doc_type	doc_id	num	date_str	description	url_metadata	lang	newspaper_id	time_ut
lk_news	2025-11-13-tamilmirrorlk-030517f7	tamilmirrorlk-030517f7	2025-11-13	வெங்காய மலைகளை அணிந்து வந்த உறுப்பினர்	https://www.tamilmirror.lk/செய்திகள்/வெங்காய-மலைகளை-அணிந்து-வந்த-உறுப்பினர்/175-367884	ta	tamilmirrorlk	1763021095.0
lk_news	2025-11-13-virakesarilk-e8d2f938	virakesarilk-e8d2f938	2025-11-13	MSBA லீக் சுற்றுப்போட்டியில் சாம்பியன் பட்டம் வென்றது ஸ்ரீலங்கன் ஏர்லைன்ஸ் கூடைப்பந்தாட்ட அணி!	https://www.virakesari.lk/article/230237	ta	virakesarilk	1763021040.0
lk_news	2025-11-13-virakesarilk-2d00660a	virakesarilk-2d00660a	2025-11-13	2025 உலக நுண்ணுயிர் எதிர்ப்பு விழிப்புணர்வு வார தேசிய நிகழ்வு நாளை ஆரம்பம்	https://www.virakesari.lk/article/230236	ta	virakesarilk	1763020740.0
lk_news	2025-11-13-lankadeepalk-4840b666	lankadeepalk-4840b666	2025-11-13	මීගමු කලපුව දූෂණය වෙලා	https://www.lankadeepa.lk/news/මගම-කලපව-දෂණය-වල/101-683088	si	lankadeepalk	1763020615.0
lk_news	2025-11-13-lankadeepalk-5f06bb63	lankadeepalk-5f06bb63	2025-11-13	අපි මෙහෙම ඉන්න ඕන රටක් නෙමෙයි	https://www.lankadeepa.lk/news/අප-මහම-ඉනන-ඕන-රටක-නමය/101-683087	si	lankadeepalk	1763020181.0
lk_news	2025-11-13-virakesarilk-e8e178c1	virakesarilk-e8e178c1	2025-11-13	கானாவில் இராணுவத்துக்கு ஆட்சேர்ப்பு - சன நெரிசல் சிக்கி 6 பேர் பலி ; 22 பேர் படுகாயம்	https://www.virakesari.lk/article/230234	ta	virakesarilk	1763019840.0
lk_news	2025-11-13-virakesarilk-2f4b82cd	virakesarilk-2f4b82cd	2025-11-13	பஸ்ஸுடன் மோதி மோட்டார் சைக்கிள் விபத்து ; இளைஞன் பலி	https://www.virakesari.lk/article/230235	ta	virakesarilk	1763019660.0
lk_news	2025-11-13-virakesarilk-3217cb11	virakesarilk-3217cb11	2025-11-13	எமது பிரதேசத்துக்கான அபிவிருத்திகளையே ஜனாதிபதியிடம் கேட்டிருக்கிறோம் - பஸ்மின் ஷரீப்	https://www.virakesari.lk/article/230223	ta	virakesarilk	1763018760.0
lk_news	2025-11-13-virakesarilk-00df0d5e	virakesarilk-00df0d5e	2025-11-13	சமந்த வித்யாரத்ன ஊடங்களுக்கு குறிப்பிட்ட  கருத்துக்களால் எனது பாதுகாப்புக்கு அச்சுறுத்தல் - எஸ்.எம்.மரிக்கார்	https://www.virakesari.lk/article/230233	ta	virakesarilk	1763018760.0
lk_news	2025-11-13-virakesarilk-6aeb671b	virakesarilk-6aeb671b	2025-11-13	நல்லூர் பிரதேச சபையினால் பாதீனிச் செடி அகற்றும் செயற்றிட்டம் முன்னெடுப்பு	https://www.virakesari.lk/article/230217	ta	virakesarilk	1763018700.0
lk_news	2025-11-13-lankadeepalk-7199cb7b	lankadeepalk-7199cb7b	2025-11-13	හල්ඔළුව අත්අඩංගුවට ගන්න නියෝග	https://www.lankadeepa.lk/news/හලඔළව-අතඅඩගවට-ගනන-නයග/101-683086	si	lankadeepalk	1763018433.0
lk_news	2025-11-13-virakesarilk-5915d886	virakesarilk-5915d886	2025-11-13	தேசிய லொத்தர் சபையின் முன்னாள் பணிப்பாளர் துசித ஹல்லொலுவவுக்கு பிடியாணை	https://www.virakesari.lk/article/230232	ta	virakesarilk	1763018340.0
lk_news	2025-11-13-virakesarilk-e520463d	virakesarilk-e520463d	2025-11-13	வீதி விளக்குகளுக்கான மின்சார கட்டணத்தை  செலுத்த தவறிய உள்ளூராட்சி நிறுவனங்கள் - வலுசக்தி அமைச்சர்	https://www.virakesari.lk/article/230220	ta	virakesarilk	1763018220.0
lk_news	2025-11-13-virakesarilk-37da5bbd	virakesarilk-37da5bbd	2025-11-13	நாட்டின் வெவ்வேறு பகுதிகளில் இடம்பெற்ற விபத்துக்களில் இருவர் உயிரிழப்பு	https://www.virakesari.lk/article/230219	ta	virakesarilk	1763018160.0
lk_news	2025-11-13-tamilmirrorlk-48dd63b8	tamilmirrorlk-48dd63b8	2025-11-13	செங்​கோட்​டை​யில் ஜனவரி 26 அன்றே தாக்​குதல் நடத்த திட்டம்	https://www.tamilmirror.lk/செய்திகள்/செங்-கோட்-டை-யில்-ஜனவரி-26-அன்றே-தாக்-குதல்-நடத்த-திட்டம்/175-367883	ta	tamilmirrorlk	1763018120.0
lk_news	2025-11-13-adalk-8559e5e0	adalk-8559e5e0	2025-11-13	තුසිත හල්ලොලුවට අත්අඩංගුවට ගෙන අධිකරණයට ඉදිරිපත් කරන්නැයි නියෝග	https://www.ada.lk/breaking_news/තුසිත-හල්ලොලුවට-අත්අඩංගුවට-ගෙන-අධිකරණයට-ඉදිරිපත්-කරන්නැයි-නියෝග/11-419667	si	adalk	1763018037.0
lk_news	2025-11-13-virakesarilk-40eccfbd	virakesarilk-40eccfbd	2025-11-13	விதை நெல் உற்பத்திக்கு காப்புறுதித் திட்டம் அறிமுகம் - கமநல காப்புறுதிச் சபை	https://www.virakesari.lk/article/230218	ta	virakesarilk	1763017920.0
lk_news	2025-11-13-virakesarilk-f393def4	virakesarilk-f393def4	2025-11-13	அரச சேவைக்காக முறையான சம்பளக் கட்டமைப்பைத் தயாரிப்பது தொடர்பான இடைக்கால அறிக்கை அமைச்சுசார் ஆலோசனைக் குழுவிடம் கையளிக்கப்படும் - சந்தன சூரியாரச்சி	https://www.virakesari.lk/article/230231	ta	virakesarilk	1763017800.0
lk_news	2025-11-13-virakesarilk-e8f61d1d	virakesarilk-e8f61d1d	2025-11-13	இலஞ்சம் பெற்ற வனஜீவராசிகள் அலுவலக அதிகாரி கைது	https://www.virakesari.lk/article/230216	ta	virakesarilk	1763017800.0
lk_news	2025-11-13-virakesarilk-06b41ae0	virakesarilk-06b41ae0	2025-11-13	யாழ். பல்கலை நிர்வாகச் செயல்களில் தலையிட்டதில்லை - ரஜீவன் எம்.பி	https://www.virakesari.lk/article/230230	ta	virakesarilk	1763017800.0
lk_news	2025-11-13-virakesarilk-1c3f26f6	virakesarilk-1c3f26f6	2025-11-13	லங்கா பிரிமியர் லீக் ஆட்ட நிர்ணய சதியில் ஈடுபட்ட தமீம் ரஹ்மானுக்கு எதிராக குற்றப்பத்திரிகை தாக்கல்	https://www.virakesari.lk/article/230215	ta	virakesarilk	1763017680.0
lk_news	2025-11-13-virakesarilk-11f17df5	virakesarilk-11f17df5	2025-11-13	இந்தியாவுக்கு குர்ஆன் பிரதிகள் அனுப்பப்படுவதாக வரும் செய்திகள் பொய்யானவை - பஸ்மின் ஷரீப்	https://www.virakesari.lk/article/230214	ta	virakesarilk	1763017620.0
lk_news	2025-11-13-virakesarilk-b6c31fa3	virakesarilk-b6c31fa3	2025-11-13	சட்ட விரோதமாக மன்னாரிலிருந்து தனுஷ்கோடி அரிச்சல் முனை பகுதிக்கு படகில் சென்றவர் கைது	https://www.virakesari.lk/article/230221	ta	virakesarilk	1763017560.0
lk_news	2025-11-13-adalk-eb887f54	adalk-eb887f54	2025-11-13	ශ්‍රී ලංකා - පාකිස්තාන එක්දින තරගාවලියේ දින වෙනස්වෙයි	https://www.ada.lk/sports/ශ්‍රී-ලංකා---පාකිස්තාන-එක්දින-තරගාවලියේ-දින-වෙනස්වෙයි/9-419666	si	adalk	1763017434.0
lk_news	2025-11-13-virakesarilk-ff6eb8bf	virakesarilk-ff6eb8bf	2025-11-13	நடிகர் பவிஷ் நடிக்கும் 'லவ் ஓ லவ்' ‌ படத்தின் டைட்டில்  லுக் வெளியீடு	https://www.virakesari.lk/article/230229	ta	virakesarilk	1763016960.0
lk_news	2025-11-13-virakesarilk-48004b99	virakesarilk-48004b99	2025-11-13	நடிகர் ரஜினி கிஷன் நடிக்கும்' ரஜினி கேங் ' படத்தின் இசை மற்றும் முன்னோட்டம் வெளியீடு	https://www.virakesari.lk/article/230227	ta	virakesarilk	1763016840.0
lk_news	2025-11-13-virakesarilk-174ed6e0	virakesarilk-174ed6e0	2025-11-13	அடுத்த தலைமுறை இணைப்பை அனைவருக்கும் கிடைக்கச் செய்யும் Dialog, Nubia Air 5Gஐ அறிமுகப்படுத்துகிறது	https://www.virakesari.lk/article/230228	ta	virakesarilk	1763016840.0
lk_news	2025-11-13-virakesarilk-84d0ee66	virakesarilk-84d0ee66	2025-11-13	இலங்கையின் எட்டாக்கனியான ஜனநாயகத்தை புதுப்பித்தல்	https://www.virakesari.lk/article/230224	ta	virakesarilk	1763016300.0
lk_news	2025-11-13-virakesarilk-548c3477	virakesarilk-548c3477	2025-11-13	உலக நற்குண தினம் – மனித இதயங்களை இணைக்கும் கருணையின் பரிமாணங்கள்	https://www.virakesari.lk/article/230211	ta	virakesarilk	1763015820.0
lk_news	2025-11-13-adalk-20781db4	adalk-20781db4	2025-11-13	කීරි සම්බා වල මිල සංශෝධනය  කරනවා	https://www.ada.lk/breaking_news/කීරි-සම්බා-වල-මිල-සංශෝධනය--කරනවා/11-419665	si	adalk	1763015288.0
lk_news	2025-11-13-lankadeepalk-0379bde5	lankadeepalk-0379bde5	2025-11-13	රාජ්‍ය ව්‍යාපාර විකුණනවා වෙනුවට ලාබ ගන්න වැඩ කරනවා	https://www.lankadeepa.lk/news/රජය-වයපර-වකණනව-වනවට-ලබ-ගනන-වඩ-කරනව/101-683082	si	lankadeepalk	1763015229.0
lk_news	2025-11-13-tamilmirrorlk-c795a318	tamilmirrorlk-c795a318	2025-11-13	சட்டவிரோதமாக தனுஷ்கோடி சென்றவர் கைது	https://www.tamilmirror.lk/செய்திகள்/சட்டவிரோதமாக-தனுஷ்கோடி-சென்றவர்-கைது/175-367881	ta	tamilmirrorlk	1763015126.0
lk_news	2025-11-13-tamilmirrorlk-7203c46e	tamilmirrorlk-7203c46e	2025-11-13	காசல் வீதி மருத்துவமனையில் ஒட்டிப் பிறந்த இரட்டையர்கள்	https://www.tamilmirror.lk/செய்திகள்/காசல்-வீதி-மருத்துவமனையில்-ஒட்டிப்-பிறந்த-இரட்டையர்கள்/175-367880	ta	tamilmirrorlk	1763014957.0
lk_news	2025-11-13-tamilmirrorlk-082f4789	tamilmirrorlk-082f4789	2025-11-13	காசலில் ஒட்டிப் பிறந்த இரட்டையர்கள்	https://www.tamilmirror.lk/செய்திகள்/காசலில்-ஒட்டிப்-பிறந்த-இரட்டையர்கள்/175-367880	ta	tamilmirrorlk	1763014957.0
lk_news	2025-11-13-lankadeepalk-a5845bd5	lankadeepalk-a5845bd5	2025-11-13	අයවැය මාරක ළිඳේ මෝටර් සයිකලේ වගේ	https://www.lankadeepa.lk/news/අයවය-මරක-ළඳ-මටර-සයකල-වග/101-683081	si	lankadeepalk	1763014639.0
lk_news	2025-11-13-tamilmirrorlk-6d8e5630	tamilmirrorlk-6d8e5630	2025-11-13	புதுடெல்லியில் கோரம்: 500 மீட்டர் தொலைவில் கூரையில் கை	https://www.tamilmirror.lk/செய்திகள்/புதுடெல்லியில்-கோரம்-500-மீட்டர்-தொலைவில்-கூரையில்-கை/175-367879	ta	tamilmirrorlk	1763014034.0
lk_news	2025-11-13-virakesarilk-eebff342	virakesarilk-eebff342	2025-11-13	இன்றைய தங்க விலை நிலைவரம்!	https://www.virakesari.lk/article/230212	ta	virakesarilk	1763013720.0
lk_news	2025-11-13-tamilmirrorlk-4e85e85e	tamilmirrorlk-4e85e85e	2025-11-13	காளையை  வம்புக்கு இழுத்த இளைஞர்: இதெல்லாம் தேவையா?	https://www.tamilmirror.lk/செய்திகள்/காளையை-வம்புக்கு-இழுத்த-இளைஞர்-இதெல்லாம்-தேவையா/175-367878	ta	tamilmirrorlk	1763013623.0
lk_news	2025-11-13-adalk-df640128	adalk-df640128	2025-11-13	ජාතික හැඳුනුම්පත් ප්‍රමාදය වහා අවසන් කරන්න ජනපති මැදිහත් වෙයි	https://www.ada.lk/breaking_news/ජාතික-හැඳුනුම්පත්-ප්‍රමාදය-වහා-අවසන්-කරන්න-ජනපති-මැදිහත්-වෙයි/11-419664	si	adalk	1763013129.0
lk_news	2025-11-13-lankadeepalk-94711dea	lankadeepalk-94711dea	2025-11-13	මත් වැරදි කරුවෝ 1099 ක් කොටු	https://www.lankadeepa.lk/news/මත-වරද-කරව-1099-ක-කට/101-683080	si	lankadeepalk	1763012406.0
lk_news	2025-11-13-adalk-fd0f0909	adalk-fd0f0909	2025-11-13	PTA අහෝසි කිරීම සඳහා වන කමිටු වාර්තාව භාරදෙයි	https://www.ada.lk/breaking_news/PTA-අහෝසි-කිරීම-සඳහා-වන-කමිටු-වාර්තාව-භාරදෙයි/11-419663	si	adalk	1763011863.0
lk_news	2025-11-13-islandlk-fdaa7e83	islandlk-fdaa7e83	2025-11-13	OnsysConnect, the Innovative Digital Data Sharing Platform, Wins NBQSA 2025 Award in Digital Government Category	http://island.lk/onsysconnect-the-innovative-digital-data-sharing-platform-wins-nbqsa-2025-award-in-digital-government-category-in-a-landmark-achievement-for-local-digital-innovation/	en	islandlk	1763009280.0
lk_news	2025-11-13-tamilmirrorlk-0ea0de73	tamilmirrorlk-0ea0de73	2025-11-13	8 வயது சிறுமி துஷ்பிரயோகம்: குற்றவாளிக்கு கடூழிய சிறை	https://www.tamilmirror.lk/செய்திகள்/8-வயது-சிறுமி-துஷ்பிரயோகம்-குற்றவாளிக்கு-கடூழிய-சிறை/175-367876	ta	tamilmirrorlk	1763009140.0
lk_news	2025-11-13-tamilmirrorlk-ba7238c6	tamilmirrorlk-ba7238c6	2025-11-13	மன்னாரில் போதைப்பொருள் குற்றவாளிக்கு ஆயுள் தண்டனை	https://www.tamilmirror.lk/செய்திகள்/மன்னாரில்-போதைப்பொருள்-குற்றவாளிக்கு-ஆயுள்-தண்டனை/175-367875	ta	tamilmirrorlk	1763008870.0
lk_news	2025-11-13-lankadeepalk-863c6d69	lankadeepalk-863c6d69	2025-11-13	ආණ්ඩු විරෝධී රැලියේ අරමුණ කියයි	https://www.lankadeepa.lk/latest_news/ආණඩ-වරධ-රලය-අරමණ-කයය/1-683076	si	lankadeepalk	1763008735.0
lk_news	2025-11-13-lankadeepalk-b247228c	lankadeepalk-b247228c	2025-11-13	රජමහ වෙහෙරක  තිබූ මැණික්  සොරු අරන්	https://www.lankadeepa.lk/latest_news/රජමහ-වහරක-තබ-මණක-සර-අරන/1-683075	si	lankadeepalk	1763008624.0
lk_news	2025-11-13-adalk-76dccd3b	adalk-76dccd3b	2025-11-13	ගාල්ලේ පුරන් කුඹුරු අක්කර 700ක් අස්වද්දයි	https://www.ada.lk/breaking_news/ගාල්ලේ-පුරන්-කුඹුරු-අක්කර-700ක්-අස්වද්දයි/11-419662	si	adalk	1763006945.0
lk_news	2025-11-13-adalk-d1a816f5	adalk-d1a816f5	2025-11-13	වතු වල ගොවීන් බීජ අර්තාපල් නිෂ්පාදනයට	https://www.ada.lk/breaking_news/වතු-වල-ගොවීන්-බීජ-අර්තාපල්-නිෂ්පාදනයට/11-419661	si	adalk	1763006472.0
lk_news	2025-11-13-virakesarilk-1b3d07e9	virakesarilk-1b3d07e9	2025-11-13	8 வயது சிறுமி துஷ்பிரயோக குற்றவாளிக்கு கடூழிய சிறைத்தண்டனை	https://www.virakesari.lk/article/230207	ta	virakesarilk	1763005080.0
lk_news	2025-11-13-virakesarilk-7c135647	virakesarilk-7c135647	2025-11-13	போதைப்பொருள் குற்றவாளிக்கு ஆயுள் தண்டனை விதிப்பு	https://www.virakesari.lk/article/230206	ta	virakesarilk	1763005020.0
lk_news	2025-11-13-tamilmirrorlk-c4175906	tamilmirrorlk-c4175906	2025-11-13	’திறமையாளர்களை அமெரிக்கா ஈர்ப்பது முக்கியம்’	https://www.tamilmirror.lk/உலக-செய்திகள்/திறமையாளர்களை-அமெரிக்கா-ஈர்ப்பது-முக்கியம்/50-367874	ta	tamilmirrorlk	1763004770.0
lk_news	2025-11-13-tamilmirrorlk-d5ff777e	tamilmirrorlk-d5ff777e	2025-11-13	ஆப்கனிஸ்தானில் பசியால் வாடும் குடும்பங்கள்	https://www.tamilmirror.lk/உலக-செய்திகள்/ஆப்கனிஸ்தானில்-பசியால்-வாடும்-குடும்பங்கள்/50-367873	ta	tamilmirrorlk	1763004448.0
lk_news	2025-11-13-tamilmirrorlk-4e685fb4	tamilmirrorlk-4e685fb4	2025-11-13	ஆப்கானிஸ்தானில் பசியால் வாடும் குடும்பங்கள்	https://www.tamilmirror.lk/உலக-செய்திகள்/ஆப்கானிஸ்தானில்-பசியால்-வாடும்-குடும்பங்கள்/50-367873	ta	tamilmirrorlk	1763004448.0
lk_news	2025-11-13-virakesarilk-68bdc1ec	virakesarilk-68bdc1ec	2025-11-13	கப்பலில் ஐஸ் போதைப்பொருளுடன் 07 சந்தேகநபர்கள் கைது	https://www.virakesari.lk/article/230205	ta	virakesarilk	1763004300.0
lk_news	2025-11-13-adalk-2f9e3637	adalk-2f9e3637	2025-11-13	යුරෝපයේ රැකියා හා අධ්‍යාපන අවස්ථා කියමින් මුදල් ගැරිමේ ජාවාරමක්	https://www.ada.lk/breaking_news/යුරෝපයේ-රැකියා-හා-අධ්‍යාපන-අවස්ථා-කියමින්-මුදල්-ගැරිමේ-ජාවාරමක්/11-419660	si	adalk	1763003714.0
lk_news	2025-11-13-dailyftlk-00dda00a	dailyftlk-00dda00a	2025-11-13	Sri Lanka participates in 8th China International Import Expo in Shanghai	https://www.ft.lk/business/Sri-Lanka-participates-in-8th-China-International-Import-Expo-in-Shanghai/34-784295	en	dailyftlk	1763003584.0
lk_news	2025-11-13-virakesarilk-e585eccf	virakesarilk-e585eccf	2025-11-13	இலங்கை - இந்திய கடற்படைகள், கடலோர காவற்படைகள்: 35வது சர்வதேச கடல்சார் எல்லைக் கோடு சந்திப்பு (IMBL) நிறைவடைந்தது	https://www.virakesari.lk/article/230204	ta	virakesarilk	1763003580.0
lk_news	2025-11-13-dailyftlk-3123590d	dailyftlk-3123590d	2025-11-13	NCCSL hosts post-Budget seminar, highlights development focus and fiscal discipline	https://www.ft.lk/business/NCCSL-hosts-post-Budget-seminar-highlights-development-focus-and-fiscal-discipline/34-784294	en	dailyftlk	1763003508.0
lk_news	2025-11-13-dailyftlk-9dd01374	dailyftlk-9dd01374	2025-11-13	National Supply Chain Day 2025 celebrations highlight excellence and innovation	https://www.ft.lk/business/National-Supply-Chain-Day-2025-celebrations-highlight-excellence-and-innovation/34-784293	en	dailyftlk	1763003420.0
lk_news	2025-11-13-dailyftlk-0d721ae8	dailyftlk-0d721ae8	2025-11-13	National Supply Chain Excellence Award Winners 2025	https://www.ft.lk/business/National-Supply-Chain-Excellence-Award-Winners-2025/34-784292	en	dailyftlk	1763003306.0
lk_news	2025-11-13-lankadeepalk-e4bb3c3c	lankadeepalk-e4bb3c3c	2025-11-13	උණ්ඩ-ගිනි අවි සමඟ විශ්‍රාමික ඉඩම් රෙජිස්ට්‍රාර් අත්අඩංගුවට	https://www.lankadeepa.lk/latest_news/උණඩ-ගන-අව-සමඟ-වශරමක-ඉඩම-රජසටරර-අතඅඩගවට/1-683072	si	lankadeepalk	1763003267.0
lk_news	2025-11-13-lankadeepalk-eb2958b1	lankadeepalk-eb2958b1	2025-11-13	පළාත් කිහිපයකට වැස්ස වැඩිවෙයි	https://www.lankadeepa.lk/latest_news/පළත-කහපයකට-වසස-වඩවය/1-683071	si	lankadeepalk	1763002790.0
lk_news	2025-11-13-tamilmirrorlk-c295e931	tamilmirrorlk-c295e931	2025-11-13	ரணிலை சந்தித்த பின் நாமல் வெளியிட்ட அதிரடி அறிவிப்பு	https://www.tamilmirror.lk/செய்திகள்/ரணிலை-சந்தித்த-பின்-நாமல்-வெளியிட்ட-அதிரடி-அறிவிப்பு/175-367872	ta	tamilmirrorlk	1763002603.0
lk_news	2025-11-13-tamilmirrorlk-625eae59	tamilmirrorlk-625eae59	2025-11-13	வேறு இடத்திற்கு மாற்றப்படும் காலி சிறைச்சாலை	https://www.tamilmirror.lk/செய்திகள்/வேறு-இடத்திற்கு-மாற்றப்படும்-காலி-சிறைச்சாலை/175-367871	ta	tamilmirrorlk	1763001991.0
lk_news	2025-11-13-tamilmirrorlk-6ac279c9	tamilmirrorlk-6ac279c9	2025-11-13	மழையுடனான வானிலை அதிகரிக்கும்	https://www.tamilmirror.lk/செய்திகள்/மழையுடனான-வானிலை-அதிகரிக்கும்/175-367870	ta	tamilmirrorlk	1762999956.0
lk_news	2025-11-13-adalk-2044656d	adalk-2044656d	2025-11-13	එක්දින තරගාවලියේ තරග කාලසටහනේ වෙනසක්	https://www.ada.lk/breaking_news/එක්දින-තරගාවලියේ-තරග-කාලසටහනේ-වෙනසක්/11-419659	si	adalk	1762998477.0
lk_news	2025-11-13-virakesarilk-3a015e4a	virakesarilk-3a015e4a	2025-11-13	இன்றைய வானிலை	https://www.virakesari.lk/article/230203	ta	virakesarilk	1762996980.0
lk_news	2025-11-13-adalk-120c7bc5	adalk-120c7bc5	2025-11-13	ක්‍රීඩකයන්ගේ ආරක්ෂාව තහවුරු බවට ක්‍රිකට් ආයතනය සහතික වෙයි	https://www.ada.lk/sports/ක්‍රීඩකයන්ගේ-ආරක්ෂාව-තහවුරු-බවට-ක්‍රිකට්-ආයතනය-සහතික-වෙයි/9-419658	si	adalk	1762996597.0
lk_news	2025-11-13-dailyftlk-f29bba87	dailyftlk-f29bba87	2025-11-13	Business leaders share  lessons in resilience at I AM COYLE Leadership Forum 2025	https://www.ft.lk/business/Business-leaders-share-lessons-in-resilience-at-I-AM-COYLE-Leadership-Forum-2025/34-784264	en	dailyftlk	1762996515.0
lk_news	2025-11-13-dailyftlk-02466864	dailyftlk-02466864	2025-11-13	CCI’s 21st AGM today	https://www.ft.lk/business/CCI-s-21st-AGM-today/34-784263	en	dailyftlk	1762996324.0
lk_news	2025-11-13-dailyftlk-2b7344f5	dailyftlk-2b7344f5	2025-11-13	PickMe ‘Nena Pahana’ brings human connection  to digital platform economy	https://www.ft.lk/business/PickMe-Nena-Pahana-brings-human-connection-to-digital-platform-economy/34-784262	en	dailyftlk	1762996276.0
lk_news	2025-11-13-dailyftlk-f2617357	dailyftlk-f2617357	2025-11-13	Sri Lankan business leaders explore opportunities in Cambodia	https://www.ft.lk/business/Sri-Lankan-business-leaders-explore-opportunities-in-Cambodia/34-784261	en	dailyftlk	1762996220.0
lk_news	2025-11-13-dailyftlk-55d83e11	dailyftlk-55d83e11	2025-11-13	SLISM to host CXM Conference 2026	https://www.ft.lk/business/SLISM-to-host-CXM-Conference-2026/34-784260	en	dailyftlk	1762996148.0
