doc_type	doc_id	num	date_str	description	url_metadata	lang	newspaper_id	time_ut
lk_news	2025-10-29-tamilmirrorlk-42da8598	tamilmirrorlk-42da8598	2025-10-29	ரணிலுக்கு எதிரான வழக்கு இன்று மீண்டும் விசாரணைக்கு	https://www.tamilmirror.lk/செய்திகள்/ரணிலுக்கு-எதிரான-வழக்கு-இன்று-மீண்டும்-விசாரணைக்கு/175-367019	ta	tamilmirrorlk	1761706436.0
lk_news	2025-10-29-adalk-605cee9f	adalk-605cee9f	2025-10-29	ජපාන යුද නැවක් කොළඹ වරායට	https://www.ada.lk/breaking_news/ජපාන-යුද-නැවක්-කොළඹ-වරායට/11-419377	si	adalk	1761706149.0
lk_news	2025-10-29-colombotelegraphcom-2099ff64	colombotelegraphcom-2099ff64	2025-10-29	Drawing The Line: Faith, Modernity & The Challenge Of Muslim Unity	https://www.colombotelegraph.com/index.php/drawing-the-line-faith-modernity-the-challenge-of-muslim-unity/	en	colombotelegraphcom	1761705711.0
lk_news	2025-10-29-tamilmirrorlk-21ef1d39	tamilmirrorlk-21ef1d39	2025-10-29	’மோந்தா’ சூறாவளியின் தற்போதைய நிலை	https://www.tamilmirror.lk/செய்திகள்/மோந்தா-சூறாவளியின்-தற்போதைய-நிலை/175-367018	ta	tamilmirrorlk	1761705360.0
lk_news	2025-10-29-colombotelegraphcom-8a441007	colombotelegraphcom-8a441007	2025-10-29	Sinhalese Nationalism, Monastic Power & The Myth Of Sacred Land	https://www.colombotelegraph.com/index.php/sinhalese-nationalism-monastic-power-the-myth-of-sacred-land/	en	colombotelegraphcom	1761704915.0
lk_news	2025-10-29-tamilmirrorlk-546d0228	tamilmirrorlk-546d0228	2025-10-29	ஐஸ் போதைப் பொருளுடன் இளைஞன் கைது	https://www.tamilmirror.lk/செய்திகள்/ஐஸ்-போதைப்-பொருளுடன்-இளைஞன்-கைது/175-367017	ta	tamilmirrorlk	1761704810.0
lk_news	2025-10-29-adalk-fdd7455b	adalk-fdd7455b	2025-10-29	දුම්රියේ එන්ජින් හා බලවේග කට්ටල 103ක් ධාවනයෙන් ඉවත් කරලා	https://www.ada.lk/breaking_news/දුම්රියේ-එන්ජින්-හා-බලවේග-කට්ටල-103ක්-ධාවනයෙන්-ඉවත්-කරලා/11-419376	si	adalk	1761703867.0
lk_news	2025-10-29-tamilmirrorlk-6a8f957d	tamilmirrorlk-6a8f957d	2025-10-29	சட்டப்புத்தகம் வழங்கிய பெண் வழக்கறிஞர் கைது	https://www.tamilmirror.lk/செய்திகள்/சட்டப்புத்தகம்-வழங்கிய-பெண்-வழக்கறிஞர்-கைது/175-367016	ta	tamilmirrorlk	1761703609.0
lk_news	2025-10-29-bbccomsinhala-1debc331	bbccomsinhala-1debc331	2025-10-29	මහාධිකරණවලට ලබා දුන් රජයේ නිල නිවාසවල මීට පෙර සිටි ඇමැතිවරුන් කවුද?	https://www.bbc.com/sinhala/articles/cn0g2ynr418o	si	bbccomsinhala	1761702836.0
lk_news	2025-10-29-lankadeepalk-7084e55a	lankadeepalk-7084e55a	2025-10-29	සෙව්වන්දිට නීති පොත දුන් නීතිඥවරියත් කොටුවෙයි	https://www.lankadeepa.lk/latest_news/සවවනදට-නත-පත-දන-නතඥවරයත-කටවය/1-682259	si	lankadeepalk	1761701208.0
lk_news	2025-10-29-lankadeepalk-01ebd381	lankadeepalk-01ebd381	2025-10-29	පළාත් කීපයකට පොඩි වැස්සක්	https://www.lankadeepa.lk/latest_news/පළත-කපයකට-පඩ-වසසක/1-682258	si	lankadeepalk	1761700852.0
lk_news	2025-10-29-virakesarilk-3a015e4a	virakesarilk-3a015e4a	2025-10-29	இன்றைய வானிலை	https://www.virakesari.lk/article/228942	ta	virakesarilk	1761700560.0
lk_news	2025-10-29-virakesarilk-1f47a6e0	virakesarilk-1f47a6e0	2025-10-29	கென்யாவில் வெளிநாட்டு சுற்றுலாப் பயணிகளை ஏற்றிச் சென்ற சிறிய விமானம் விபத்து ; 11 பேர் பலி	https://www.virakesari.lk/article/228941	ta	virakesarilk	1761693720.0
lk_news	2025-10-29-bbccomsinhala-04638f68	bbccomsinhala-04638f68	2025-10-29	'මම රැකියා 20ක් විතර කළා. ඒ හැම තැනකදි ම මම අපහාස වින්දා'	https://www.bbc.com/sinhala/articles/cpd216lv944o	si	bbccomsinhala	1761693282.0
lk_news	2025-10-29-dailyftlk-3156e57b	dailyftlk-3156e57b	2025-10-29	WCIC’s 40th anniversary celebrations continue with “Empowering Future Female Entrepreneurs” workshop	https://www.ft.lk/news/WCIC-s-40th-anniversary-celebrations-continue-with-Empowering-Future-Female-Entrepreneurs-workshop/56-783620	en	dailyftlk	1761693091.0
lk_news	2025-10-29-dailyftlk-b58e380e	dailyftlk-b58e380e	2025-10-29	GREE AirTech Sri Lanka wins prestigious ‘Most Promising Award’ at GREE Global Conference	https://www.ft.lk/news/GREE-AirTech-Sri-Lanka-wins-prestigious-Most-Promising-Award-at-GREE-Global-Conference/56-783619	en	dailyftlk	1761692952.0
lk_news	2025-10-29-dailyftlk-dd65ea2a	dailyftlk-dd65ea2a	2025-10-29	Singapore’s Trafigura gets 7-month diesel contract	https://www.ft.lk/news/Singapore-s-Trafigura-gets-7-month-diesel-contract/56-783618	en	dailyftlk	1761692770.0
lk_news	2025-10-29-dailyftlk-f887da19	dailyftlk-f887da19	2025-10-29	Brandix highlights ESG Stewardship in latest ESG Report	https://www.ft.lk/news/Brandix-highlights-ESG-Stewardship-in-latest-ESG-Report/56-783617	en	dailyftlk	1761692745.0
lk_news	2025-10-29-dailyftlk-ece583ab	dailyftlk-ece583ab	2025-10-29	Govt. begins mapping smallholder rubber lands to meet EUDR rules	https://www.ft.lk/news/Govt-begins-mapping-smallholder-rubber-lands-to-meet-EUDR-rules/56-783616	en	dailyftlk	1761692723.0
lk_news	2025-10-29-dailyftlk-5c1e814d	dailyftlk-5c1e814d	2025-10-29	Sri Lanka highlights trade, investment and tourism opportunities in Brussels	https://www.ft.lk/news/Sri-Lanka-highlights-trade-investment-and-tourism-opportunities-in-Brussels/56-783615	en	dailyftlk	1761692700.0
lk_news	2025-10-29-dailyftlk-c82ccde8	dailyftlk-c82ccde8	2025-10-29	Govt. ended culture of political interference in foreign employment: Minister Herath	https://www.ft.lk/news/Govt-ended-culture-of-political-interference-in-foreign-employment-Minister-Herath/56-783614	en	dailyftlk	1761692356.0
lk_news	2025-10-29-dailyftlk-c521efd0	dailyftlk-c521efd0	2025-10-29	Ragama Rehabilitation Hospital, Science and Technology  Ministry to collaborate on advanced medical innovation	https://www.ft.lk/news/Ragama-Rehabilitation-Hospital-Science-and-Technology-Ministry-to-collaborate-on-advanced-medical-innovation/56-783613	en	dailyftlk	1761692218.0
lk_news	2025-10-29-dailyftlk-a0cf3224	dailyftlk-a0cf3224	2025-10-29	Canadian arrested at BIA with Rs. 182 m worth of hashish	https://www.ft.lk/news/Canadian-arrested-at-BIA-with-Rs-182-m-worth-of-hashish/56-783612	en	dailyftlk	1761692134.0
lk_news	2025-10-29-dailyftlk-fcc903d3	dailyftlk-fcc903d3	2025-10-29	Police launch probe into officers over video of Weligama PS Chairman murder suspect’s arrest	https://www.ft.lk/news/Police-launch-probe-into-officers-over-video-of-Weligama-PS-Chairman-murder-suspect-s-arrest/56-783611	en	dailyftlk	1761692047.0
lk_news	2025-10-29-dailyftlk-6f7c144f	dailyftlk-6f7c144f	2025-10-29	Cabinet clears Bill to regulate container depot operators and amend licensing laws	https://www.ft.lk/news/Cabinet-clears-Bill-to-regulate-container-depot-operators-and-amend-licensing-laws/56-783610	en	dailyftlk	1761692025.0
lk_news	2025-10-29-dailyftlk-c980e705	dailyftlk-c980e705	2025-10-29	Four new High Courts in Colombo under Anti-Corruption National Action Plan	https://www.ft.lk/news/Four-new-High-Courts-in-Colombo-under-Anti-Corruption-National-Action-Plan/56-783609	en	dailyftlk	1761691993.0
lk_news	2025-10-29-virakesarilk-8827de10	virakesarilk-8827de10	2025-10-29	ஜகத் விதானவுக்குள்ள உயிர் அச்சுறுத்தல் தொடர்பில் தொடர்ந்தும் மதிப்பாய்வுகள் முன்னெடுக்கப்படுகின்றன - பொலிஸ் பேச்சாளர் விளக்கம்	https://www.virakesari.lk/article/228940	ta	virakesarilk	1761691140.0
lk_news	2025-10-29-virakesarilk-1ba6d711	virakesarilk-1ba6d711	2025-10-29	இன்று மீண்டும் விசாரணைக்கு வரும் ரணிலின் வழக்கு	https://www.virakesari.lk/article/228939	ta	virakesarilk	1761690720.0
lk_news	2025-10-29-dailyftlk-9f66a567	dailyftlk-9f66a567	2025-10-29	Michael Kors commits $ 2.7 m to feed Sri Lankan children, support local farmers through WFP	https://www.ft.lk/news/Michael-Kors-commits-2-7-m-to-feed-Sri-Lankan-children-support-local-farmers-through-WFP/56-783602	en	dailyftlk	1761690676.0
