doc_type	doc_id	num	date_str	description	url_metadata	lang	newspaper_id	time_ut
lk_news	2025-12-12-virakesarilk-1ff49a2f	virakesarilk-1ff49a2f	2025-12-12	குச்சவெளியில் பெண்ணின் சடலம் மீட்பு!	https://www.virakesari.lk/article/233197	ta	virakesarilk	1765538700.0
lk_news	2025-12-12-lankadeepalk-743519a2	lankadeepalk-743519a2	2025-12-12	ලංකාවට ආධාර කන්දක් ලැබුණු හේතුව ටිල්වින් පහදයි	https://www.lankadeepa.lk/news/ලකවට-ආධර-කනදක-ලබණ-හතව-ටලවන-පහදය/101-685182	si	lankadeepalk	1765538463.0
lk_news	2025-12-12-virakesarilk-345438ce	virakesarilk-345438ce	2025-12-12	மன்னாரிற்கு விஜயம் செய்யும் ஜனாதிபதி  வடக்கு மீனவர்கள் முகம் கொடுக்கும் பிரச்சினைக்கும் துரித நடவடிக்கைகளை மேற்கொள்ள வேண்டும் - என்.எம்.ஆலாம்  கோரிக்கை	https://www.virakesari.lk/article/233193	ta	virakesarilk	1765538460.0
lk_news	2025-12-12-virakesarilk-68d38d8a	virakesarilk-68d38d8a	2025-12-12	பிரதி சபாநாயகர் ரிஸ்வி சாலியை சந்தித்தார் பாகிஸ்தானின் கடல்சார் அலுவல்களுக்கான பெடரல் அமைச்சர்	https://www.virakesari.lk/article/233192	ta	virakesarilk	1765538220.0
lk_news	2025-12-12-adalk-03129a1b	adalk-03129a1b	2025-12-12	කෑගල්ල ම. න. ස. අයවැය සම්මතයි	https://www.ada.lk/breaking_news/කෑගල්ල-ම--න--ස--අයවැය-සම්මතයි/11-420207	si	adalk	1765538207.0
lk_news	2025-12-12-virakesarilk-0dd46220	virakesarilk-0dd46220	2025-12-12	ஜப்பான் பேரிடர் நிவாரண மருத்துவக் குழுவின் சிலாபம் கள வைத்தியசாலையை பார்வையிட்டார் அமைச்சர் நளிந்த ஜயதிஸ்ஸ!	https://www.virakesari.lk/article/233195	ta	virakesarilk	1765538100.0
lk_news	2025-12-12-adalk-bd52992b	adalk-bd52992b	2025-12-12	අශෝක රන්වල අත්අඩංගුවට - රන්වල සාමාන්‍ය පුරවැසියෙකු සේ සලකා නීතිය ක්‍රියාත්මක කරන්න	https://www.ada.lk/breaking_news/අශෝක-රන්වල-අත්අඩංගුවට---රන්වල-සාමාන්‍ය-පුරවැසියෙකු-සේ-සලකා-නීතිය-ක්‍රියාත්මක-කරන්න/11-420206	si	adalk	1765537991.0
lk_news	2025-12-12-lankadeepalk-cd71ee44	lankadeepalk-cd71ee44	2025-12-12	’’අභියෝග වලට ඔරොත්තු දෙන ලාංකික ජාතියක් ගොඩ නගනවා’’	https://www.lankadeepa.lk/latest_news/අභයග-වලට-ඔරතත-දන-ලකක-ජතයක-ගඩ-නගනව/1-685181	si	lankadeepalk	1765537719.0
lk_news	2025-12-12-tamilmirrorlk-6213764d	tamilmirrorlk-6213764d	2025-12-12	காணாமல் போன 193 பேருக்கு இறப்புப் பதிவுச் சான்றிதழ்	https://www.tamilmirror.lk/செய்திகள்/காணாமல்-போன-193-பேருக்கு-இறப்புப்-பதிவுச்-சான்றிதழ்/175-369455	ta	tamilmirrorlk	1765536885.0
lk_news	2025-12-12-lankadeepalk-acc390b6	lankadeepalk-acc390b6	2025-12-12	පුත්තලමේ ඉඩමකින් ගිනිඅවියක් හමුවෙයි	https://www.lankadeepa.lk/latest_news/පතතලම-ඉඩමකන-ගනඅවයක-හමවය/1-685180	si	lankadeepalk	1765536775.0
lk_news	2025-12-12-tamilmirrorlk-a1ea6e19	tamilmirrorlk-a1ea6e19	2025-12-12	25,000 ரூபாய் நிவாரணம் கிடைக்கவில்லை : மாணவன் முறைப்பாடு	https://www.tamilmirror.lk/செய்திகள்/25-000-ரூபாய்-நிவாரணம்-கிடைக்கவில்லை-மாணவன்-முறைப்பாடு/175-369454	ta	tamilmirrorlk	1765535472.0
lk_news	2025-12-12-virakesarilk-798e06a9	virakesarilk-798e06a9	2025-12-12	யாழ். மாவட்டசெயலாளரை சந்தித்தார்  துரைராசா ரவிகரன்	https://www.virakesari.lk/article/233184	ta	virakesarilk	1765535340.0
lk_news	2025-12-12-virakesarilk-f4028256	virakesarilk-f4028256	2025-12-12	சாரதியிடம் இலஞ்சம் பெற்ற இரு பொலிஸ் உத்தியோகத்தர்கள் கைது	https://www.virakesari.lk/article/233191	ta	virakesarilk	1765534980.0
lk_news	2025-12-12-virakesarilk-c3674fb8	virakesarilk-c3674fb8	2025-12-12	இந்திய மீனவர்களின் அத்துமீறிய மீன்பிடிக்கு எதிராக யாழ். மாவட்ட செயலகத்தை முற்றுகையிட்டு போராட்டம்	https://www.virakesari.lk/article/233179	ta	virakesarilk	1765534980.0
lk_news	2025-12-12-virakesarilk-18837716	virakesarilk-18837716	2025-12-12	வடகீழ் பருவப் பெயர்ச்சி காலநிலை : துறை சார்ந்தோருடன் கலந்துரையாடி முன்னாயத்த நடவடிக்கைகள் முன்னெடுக்கப்பட்டுள்ளன - அனர்த்த முகாமைத்துவ மத்திய நிலைய பணிப்பாளர் நாயகம்	https://www.virakesari.lk/article/233189	ta	virakesarilk	1765534560.0
lk_news	2025-12-12-virakesarilk-c2c5dcd5	virakesarilk-c2c5dcd5	2025-12-12	பொதுத் தகவல் தொழில்நுட்பப் பரீட்சை ஜனவரியில் இடம்பெறும் - பரீட்சை திணைக்களம் அறிவிப்பு	https://www.virakesari.lk/article/233188	ta	virakesarilk	1765534440.0
lk_news	2025-12-12-adalk-4a6d942d	adalk-4a6d942d	2025-12-12	කුකුළු ලොරිය ගවයෙකුගේ ගැටී කුකුළන් 650ක්  හා ගවයා මිය යයි	https://www.ada.lk/breaking_news/කුකුළු-ලොරිය-ගවයෙකුගේ-ගැටී-කුකුළන්-650ක්--හා-ගවයා-මිය-යයි/11-420205	si	adalk	1765534346.0
lk_news	2025-12-12-virakesarilk-23fe902e	virakesarilk-23fe902e	2025-12-12	75வது கடற்படை ஆண்டு நிறைவை முன்னிட்டு இரத்த தான திட்டம் மற்றும் மருத்துவ முகாம்	https://www.virakesari.lk/article/233185	ta	virakesarilk	1765534260.0
lk_news	2025-12-12-adalk-9b9f8120	adalk-9b9f8120	2025-12-12	යටියන්තොට ප්‍රාස අයවැය දෙවන වරටත් පරදියි	https://www.ada.lk/breaking_news/යටියන්තොට-ප්‍රාස-අයවැය-දෙවන-වරටත්-පරදියි/11-420204	si	adalk	1765533867.0
lk_news	2025-12-12-lankadeepalk-6367a283	lankadeepalk-6367a283	2025-12-12	පිරිමි අතර වැඩි මුඛ  පිළිකා  ගැන සම්පූර්ණයෙන්	https://www.lankadeepa.lk/videos/පිරිමි-අතර-වැඩි-මුඛ--පිළිකා--ගැන-සම්පූර්ණයෙන්/12-685179	si	lankadeepalk	1765533007.0
lk_news	2025-12-12-virakesarilk-6bd013a2	virakesarilk-6bd013a2	2025-12-12	அட்டன் - நோர்டன்பிரிட்ஜ் பிரதான வீதியில் புதிய இரும்பு பாலம் அமைத்து போக்குவரத்துக்கு அனுமதி	https://www.virakesari.lk/article/233183	ta	virakesarilk	1765532760.0
lk_news	2025-12-12-virakesarilk-b36518b8	virakesarilk-b36518b8	2025-12-12	ரவி கருணாநாயக்க, அர்ஜுன் அலோசியஸ் வழக்கு : ஜனவரி 16ஆம் திகதி விசாரணைக்கு உத்தரவு	https://www.virakesari.lk/article/233180	ta	virakesarilk	1765532700.0
lk_news	2025-12-12-tamilmirrorlk-21ea6c90	tamilmirrorlk-21ea6c90	2025-12-12	முன்னாள் சபாநாயகர் கைது	https://www.tamilmirror.lk/செய்திகள்/முன்னாள்-சபாநாயகர்-கைது/175-369453	ta	tamilmirrorlk	1765532588.0
lk_news	2025-12-12-virakesarilk-cf6bd662	virakesarilk-cf6bd662	2025-12-12	19இன் கீழ் உலகக் கிண்ணம்: இலங்கையை எதிர்த்தாடவுள்ள இலங்கை வம்சாவளி ஆஸி.	https://www.virakesari.lk/article/233182	ta	virakesarilk	1765532520.0
lk_news	2025-12-12-lankadeepalk-7b658452	lankadeepalk-7b658452	2025-12-12	නාය මරකපොලු 2377ක්: විමර්ශන අරඹයි	https://www.lankadeepa.lk/latest_news/නය-මරකපල-2377ක-වමරශන-අරඹය/1-685176	si	lankadeepalk	1765531986.0
lk_news	2025-12-12-virakesarilk-03b45ce5	virakesarilk-03b45ce5	2025-12-12	முன்னாள் சபாநாயகர் அசோக ரன்வல கைது!	https://www.virakesari.lk/article/233178	ta	virakesarilk	1765528560.0
lk_news	2025-12-12-virakesarilk-b2a91483	virakesarilk-b2a91483	2025-12-12	பேரிடரின் பின்னர் மனதை அமைதியாகவும் ஆரோக்கியமாகவும் வைத்திருக்க இலங்கை உளநல வைத்தியர்கள் சங்கத்தின் ஆலோசனை	https://www.virakesari.lk/article/233174	ta	virakesarilk	1765528500.0
lk_news	2025-12-12-lankadeepalk-00ee6cdc	lankadeepalk-00ee6cdc	2025-12-12	ලංකාව අවස්ථා අල්ලා ගැනීමට අසමත්ද?	https://www.lankadeepa.lk/features/ලකව-අවසථ-අලල-ගනමට-අසමතද/2-685175	si	lankadeepalk	1765528293.0
lk_news	2025-12-12-lankadeepalk-b9e4e25e	lankadeepalk-b9e4e25e	2025-12-12	පා.මන්ත්‍රී හා හිටපු කතානායක රන්වල අත්අඩංගුවට	https://www.lankadeepa.lk/latest_news/ප-මනතර-හ-හටප-කතනයක-රනවල-අතඅඩගවට/1-685174	si	lankadeepalk	1765528168.0
lk_news	2025-12-12-virakesarilk-450cdd5b	virakesarilk-450cdd5b	2025-12-12	4 மாவட்டங்களுக்கு பலத்த மின்னல் தாக்கம் குறித்து எச்சரிக்கை!	https://www.virakesari.lk/article/233176	ta	virakesarilk	1765527900.0
lk_news	2025-12-12-lankadeepalk-48fd30c8	lankadeepalk-48fd30c8	2025-12-12	පෙර පාසල් ගුරුවරිය අනතුරින් මරුට	https://www.lankadeepa.lk/news/පර-පසල-ගරවරය-අනතරන-මරට/101-685173	si	lankadeepalk	1765526785.0
lk_news	2025-12-12-virakesarilk-70a78c1e	virakesarilk-70a78c1e	2025-12-12	ரயில்வே திணைக்கள அதிபர்களாக பெண்களையும் உள்ளீர்க்க முடியும் : அமைச்சரவை தீர்மானத்தை நீதிமன்றில் தெரிவித்தது அரசாங்கம் !	https://www.virakesari.lk/article/233165	ta	virakesarilk	1765526700.0
lk_news	2025-12-12-lankadeepalk-0c8fed46	lankadeepalk-0c8fed46	2025-12-12	රේල් පිලී කොටස් සමඟ අයෙක් අල්ලයි	https://www.lankadeepa.lk/news/රල-පල-කටස-සමඟ-අයක-අලලය/101-685151	si	lankadeepalk	1765525584.0
lk_news	2025-12-12-virakesarilk-b9f69e63	virakesarilk-b9f69e63	2025-12-12	அனர்த்தத்தால் பாதிக்கப்பட்ட ஆரம்பகால குழந்தைப் பருவ மேம்பாட்டு மையங்களை புனரமைக்க திட்டம்	https://www.virakesari.lk/article/233175	ta	virakesarilk	1765525260.0
lk_news	2025-12-12-adalk-fee01057	adalk-fee01057	2025-12-12	තියුණු ආයුධයකින් පහර දි බිරිදි ඝාතනය කල සැමියාට මරණ දඩුවම	https://www.ada.lk/breaking_news/තියුණු-ආයුධයකින්-පහර-දි-බිරිදි-ඝාතනය-කල-සැමියාට-මරණ-දඩුවම/11-420203	si	adalk	1765525015.0
lk_news	2025-12-12-adalk-f01ba245	adalk-f01ba245	2025-12-12	ඉදිරි වසර තුළ කිසිම සහල් හිඟයක් නැ	https://www.ada.lk/breaking_news/ඉදිරි-වසර-තුළ-කිසිම-සහල්-හිඟයක්-නැ/11-420202	si	adalk	1765524662.0
lk_news	2025-12-12-lankadeepalk-e5ece407	lankadeepalk-e5ece407	2025-12-12	දඹුල්ලේ එළවලු මිල ඉහළට	https://www.lankadeepa.lk/news/දඹලල-එළවල-මල-ඉහළට/101-685149	si	lankadeepalk	1765523679.0
lk_news	2025-12-12-virakesarilk-1c19a16c	virakesarilk-1c19a16c	2025-12-12	75வது கடற்படை தினத்தை முன்னிட்டு கடற்படைக்கு ஆசிர்வாதம் பெறுவதற்காக அநுராதபுரத்தில் உள்ள சந்தஹிரு சேவையில் நடைபெற்ற ஒளி விழா	https://www.virakesari.lk/article/233173	ta	virakesarilk	1765523580.0
lk_news	2025-12-12-virakesarilk-6e8feb10	virakesarilk-6e8feb10	2025-12-12	இன்றைய நாணய மாற்று விகிதம்	https://www.virakesari.lk/article/233171	ta	virakesarilk	1765523460.0
lk_news	2025-12-12-virakesarilk-a7f26aea	virakesarilk-a7f26aea	2025-12-12	கர்ப்பிணித் தாய்மார்களுக்கு ஊட்டச்சத்து கொடுப்பனவு வழங்க தீர்மானம் - மகளிர் மற்றும் சிறுவர் விவகார அமைச்சு	https://www.virakesari.lk/article/233170	ta	virakesarilk	1765523340.0
lk_news	2025-12-12-lankadeepalk-8e34cdb9	lankadeepalk-8e34cdb9	2025-12-12	සිදුවන්නට ගිය අනතුර නූලෙන් වැළකෙයි	https://www.lankadeepa.lk/news/සදවනනට-ගය-අනතර-නලන-වළකය/101-685148	si	lankadeepalk	1765522771.0
lk_news	2025-12-12-lankadeepalk-80d4b383	lankadeepalk-80d4b383	2025-12-12	රට රැකියා පෙන්වා කෝටි 5ක් වංචා කළ අයෙක් අල්ලයි	https://www.lankadeepa.lk/news/රට-රකය-පනව-කට-5ක-වච-කළ-අයක-අලලය/101-685147	si	lankadeepalk	1765521790.0
lk_news	2025-12-12-virakesarilk-88aa300e	virakesarilk-88aa300e	2025-12-12	மன்னாரில் 10 இலட்சம் ரூபாவுக்கும் அதிக பெறுமதியான போதைப்பொருளுடன் இருவர் கைது	https://www.virakesari.lk/article/233168	ta	virakesarilk	1765521720.0
lk_news	2025-12-12-virakesarilk-fa7dc86b	virakesarilk-fa7dc86b	2025-12-12	சீரற்ற வானிலை ; உயிரிழந்தோர் எண்ணிக்கை 639 ஆக அதிகரிப்பு	https://www.virakesari.lk/article/233162	ta	virakesarilk	1765521360.0
lk_news	2025-12-12-virakesarilk-69b7c573	virakesarilk-69b7c573	2025-12-12	நாட்டில் மண்சரிவு அபாயம் உள்ள 2,377 இடங்களில் ஆய்வுகள் ஆரம்பம்	https://www.virakesari.lk/article/233169	ta	virakesarilk	1765520940.0
lk_news	2025-12-12-lankadeepalk-20335bf7	lankadeepalk-20335bf7	2025-12-12	ගැඹුරු මුහුදේ මසුන් අල්ලන්න ගිහින් ගල් පරයක සිරවෙයි	https://www.lankadeepa.lk/news/ගඹර-මහද-මසන-අලලනන-ගහන-ගල-පරයක-සරවය/101-685145	si	lankadeepalk	1765520763.0
lk_news	2025-12-12-virakesarilk-03973a5a	virakesarilk-03973a5a	2025-12-12	'முழு நாடுமே ஒன்றாக' போதைப்பொருள் ஒழிப்பு நடவடிக்கை: 860 பேர் கைது	https://www.virakesari.lk/article/233167	ta	virakesarilk	1765520340.0
lk_news	2025-12-12-lankadeepalk-acdc8522	lankadeepalk-acdc8522	2025-12-12	දිට්වාගේ ආර්ථික සුනාමිය	https://www.lankadeepa.lk/friday/දටවග-ආරථක-සනමය/122-685144	si	lankadeepalk	1765520089.0
lk_news	2025-12-12-lankadeepalk-69e59580	lankadeepalk-69e59580	2025-12-12	‘දිට්වා‘ ගෙන් ළමයන් අනාථවීම	https://www.lankadeepa.lk/features/දටව-ගන-ළමයන-අනථවම/2-685143	si	lankadeepalk	1765519947.0
lk_news	2025-12-12-virakesarilk-7607c6c0	virakesarilk-7607c6c0	2025-12-12	ஐக்கிய அரபு இராச்சியத்தின் தூதரகம் ஏற்பாடு செய்த ‘வோட்டர் எவோர்ட்ஸ்’ விருது வழங்கும் விழா	https://www.virakesari.lk/article/233166	ta	virakesarilk	1765519860.0
lk_news	2025-12-12-tamilmirrorlk-828ea360	tamilmirrorlk-828ea360	2025-12-12	நுவரெலியாவுக்கு இரவில் செல்ல வேண்டாம்	https://www.tamilmirror.lk/செய்திகள்/நுவரெலியாவுக்கு-இரவில்-செல்ல-வேண்டாம்/175-369452	ta	tamilmirrorlk	1765519625.0
lk_news	2025-12-12-virakesarilk-34170730	virakesarilk-34170730	2025-12-12	நுவரெலியாவுக்குச் செல்லும் வீதிகளில் இரவு நேர வாகன பயணத்தை தவிர்க்குமாறு அறிவுறுத்தல் !	https://www.virakesari.lk/article/233163	ta	virakesarilk	1765519260.0
lk_news	2025-12-12-virakesarilk-ff234224	virakesarilk-ff234224	2025-12-12	கல்வி மற்றும் அபிவிருத்தி ஒத்துழைப்பு குறித்து அவுஸ்திரேலியாவின் சர்வதேச கல்விக்கான உதவி அமைச்சருடன் பிரதமர் கலந்துரையாடல்	https://www.virakesari.lk/article/233160	ta	virakesarilk	1765518900.0
lk_news	2025-12-12-tamilmirrorlk-e13a49c1	tamilmirrorlk-e13a49c1	2025-12-12	3 காதலிகளுக்காக திருடிய 18 வயது இளைஞன்	https://www.tamilmirror.lk/செய்திகள்/3-காதலிகளுக்காக-திருடிய-18-வயது-இளைஞன்/175-369451	ta	tamilmirrorlk	1765518486.0
lk_news	2025-12-12-virakesarilk-c832ecdf	virakesarilk-c832ecdf	2025-12-12	நுவரெலியாவில் கொலைக் குற்றவாளிக்கு மரணதண்டனை	https://www.virakesari.lk/article/233158	ta	virakesarilk	1765517700.0
lk_news	2025-12-12-virakesarilk-1c910d9f	virakesarilk-1c910d9f	2025-12-12	முன்னாள் சபாநாயகர் அசோக ரன்வல விபத்துக்குள்ளாகி வைத்தியசாலையில் அனுமதி	https://www.virakesari.lk/article/233159	ta	virakesarilk	1765517400.0
lk_news	2025-12-12-virakesarilk-2727ee49	virakesarilk-2727ee49	2025-12-12	“டித்வா” புயலில் பாதிக்கப்பட்ட சிறு விவசாயிகள், மீனவர்களுக்கு அவசர உதவி அவசியம் – ஐ.நா. உணவு மற்றும் விவசாய நிறுவனம்	https://www.virakesari.lk/article/233161	ta	virakesarilk	1765517280.0
lk_news	2025-12-12-tamilmirrorlk-0c38c9a4	tamilmirrorlk-0c38c9a4	2025-12-12	வடக்கு மாகாணத்திற்கு பலத்த மழை	https://www.tamilmirror.lk/செய்திகள்/வடக்கு-மாகாணத்திற்கு-பலத்த-மழை/175-369450	ta	tamilmirrorlk	1765516863.0
lk_news	2025-12-12-adalk-ad67b371	adalk-ad67b371	2025-12-12	සමස්ත සම්මාන 15ක් සමග 27 වැනි ජනාධිපති අපනයන සම්මාන දිනූවෝ	https://www.ada.lk/business/සමස්ත-සම්මාන-15ක්-සමග-27-වැනි-ජනාධිපති-අපනයන-සම්මාන-දිනූවෝ/7-420199	si	adalk	1765516698.0
lk_news	2025-12-12-bbccomsinhala-8c519f4b	bbccomsinhala-8c519f4b	2025-12-12	මානව හිමිකම් කොමිසම සිය මානව හිමිකම් කඩකළ බවට එහි නිලධාරිනියක් අඛණ්ඩ සත්‍යග්‍රහයක නිරත වූයේ ඇයි?	https://www.bbc.com/sinhala/articles/cpvdd0zjdxko	si	bbccomsinhala	1765516523.0
lk_news	2025-12-12-lankadeepalk-04215495	lankadeepalk-04215495	2025-12-12	රැකියා අහිමි අහිමිවූ පෙහෙකම්හල් සේවක දීමනාව වැඩි කරයි	https://www.lankadeepa.lk/news/රකය-අහම-අහමව-පහකමහල-සවක-දමනව-වඩ-කරය/101-685142	si	lankadeepalk	1765516088.0
lk_news	2025-12-12-virakesarilk-a14cb1a9	virakesarilk-a14cb1a9	2025-12-12	வர்த்தக விநியோகம், சுங்கச் செயல்முறை, முதலீட்டு அங்கீகாரம் ஆகியவற்றை வினைத்திறனாக்கவும், ஏற்றுமதி வசதிகளை மேம்படுத்தவும் அரசாங்கம் நடவடிக்கை எடுக்கும் - பிரதமர் தெரிவிப்பு	https://www.virakesari.lk/article/233157	ta	virakesarilk	1765516080.0
lk_news	2025-12-12-lankadeepalk-3e57680a	lankadeepalk-3e57680a	2025-12-12	හෙරොයින් සමඟ දෙන්නෙක් මාට්ටු	https://www.lankadeepa.lk/news/හරයන-සමඟ-දනනක-මටට/101-685141	si	lankadeepalk	1765515617.0
lk_news	2025-12-12-virakesarilk-c4576a11	virakesarilk-c4576a11	2025-12-12	தினக்குரல் உதவி ஆசிரியரின் சசோதரர் காலமானார்	https://www.virakesari.lk/article/233154	ta	virakesarilk	1765515420.0
lk_news	2025-12-12-lankadeepalk-02cd7857	lankadeepalk-02cd7857	2025-12-12	මඩොල්සිම පාර අද උදේ යළි විවෘත කරයි	https://www.lankadeepa.lk/news/මඩලසම-පර-අද-උද-යළ-වවත-කරය/101-685140	si	lankadeepalk	1765515121.0
lk_news	2025-12-12-virakesarilk-134205ee	virakesarilk-134205ee	2025-12-12	யுனிசெஃப் நிறுவனப் பிரதிநிதிகளுக்கும் பிரதமருக்குமிடையில் சந்திப்பு	https://www.virakesari.lk/article/233152	ta	virakesarilk	1765515060.0
lk_news	2025-12-12-virakesarilk-e4c0dbca	virakesarilk-e4c0dbca	2025-12-12	காதலிகளுக்கு பரிசு வழங்க திருட்டில் ஈடுபட்ட இளைஞன் கைது!	https://www.virakesari.lk/article/233156	ta	virakesarilk	1765515000.0
lk_news	2025-12-12-virakesarilk-20232667	virakesarilk-20232667	2025-12-12	மூடப்பட்டிருந்த தேயிலை தொழிற்சாலையை மீண்டும் திறப்பதற்கான நடவடிக்கையை ஜீவன் தொண்டமான் முன்னெடுப்பு	https://www.virakesari.lk/article/233146	ta	virakesarilk	1765514820.0
lk_news	2025-12-12-lankadeepalk-06a6b755	lankadeepalk-06a6b755	2025-12-12	යුනිසෙෆ්- අගමැතිනිනී හමු වෙයි	https://www.lankadeepa.lk/news/යනසෆ-අගමතනන-හම-වය/101-685139	si	lankadeepalk	1765514484.0
lk_news	2025-12-12-virakesarilk-322b4085	virakesarilk-322b4085	2025-12-12	சீரற்ற வானிலை: 4.95 இலட்சம் குடும்பங்களைச் சேர்ந்த 17 இலட்சம் பேர் பாதிப்பு - அனர்த்த முகாமைத்துவ மத்திய நிலையம்	https://www.virakesari.lk/article/233153	ta	virakesarilk	1765514400.0
