doc_type	doc_id	num	date_str	description	url_metadata	lang	newspaper_id	time_ut
lk_news	2025-10-22-virakesarilk-4b345b84	virakesarilk-4b345b84	2025-10-22	தர்மலிங்கம் சுரேஸ் பயங்கரவாத தடுப்புப் பிரிவில் முன்னிலை - ஐந்து மணிநேர விசாரணையின் பிறகு விடுவிப்பு	https://www.virakesari.lk/article/228393	ta	virakesarilk	1761131100.0
lk_news	2025-10-22-tamilmirrorlk-5c96279f	tamilmirrorlk-5c96279f	2025-10-22	729,393 மாணவர்களுக்கு  பாதணி	https://www.tamilmirror.lk/செய்திகள்/729-393-மாணவர்களுக்கு-பாதணி/175-366674	ta	tamilmirrorlk	1761130851.0
lk_news	2025-10-22-virakesarilk-214ba4e3	virakesarilk-214ba4e3	2025-10-22	“கெஹெல்பத்தர பத்மே”வின் ஐஸ் இரசாயனங்கள் ; பியல் மனம்பேரிக்கு விளக்கமறியல் நீடிப்பு!	https://www.virakesari.lk/article/228392	ta	virakesarilk	1761130500.0
lk_news	2025-10-22-tamilmirrorlk-804b4bb9	tamilmirrorlk-804b4bb9	2025-10-22	’இலங்கையர் தினம்’	https://www.tamilmirror.lk/செய்திகள்/இலங்கையர்-தினம்/175-366673	ta	tamilmirrorlk	1761130345.0
lk_news	2025-10-22-virakesarilk-e73d61f8	virakesarilk-e73d61f8	2025-10-22	வெலிகம பிரதேச சபை தவிசாளர் கொலை : பக்க சார்பற்ற விசாரணைகள் முன்னெடுக்கப்படும் - அரசாங்கம்	https://www.virakesari.lk/article/228390	ta	virakesarilk	1761130200.0
lk_news	2025-10-22-lankadeepalk-2331c2d8	lankadeepalk-2331c2d8	2025-10-22	තැපැල් දුම්රිය දෙකක් සමග දුම්රිය 5 ක් අවලංගුයි	https://www.lankadeepa.lk/latest_news/තපල-දමරය-දකක-සමග-දමරය-5-ක-අවලගය/1-681857	si	lankadeepalk	1761129801.0
lk_news	2025-10-22-adalk-a6b91eb9	adalk-a6b91eb9	2025-10-22	උඩරට මාර්ගයේ දුම්රිය ගමන්වාර 5ක් අවලංගුයි	https://www.ada.lk/breaking_news/උඩරට-මාර්ගයේ-දුම්රිය-ගමන්වාර-5ක්-අවලංගුයි/11-419265	si	adalk	1761129375.0
lk_news	2025-10-22-virakesarilk-830b8a0d	virakesarilk-830b8a0d	2025-10-22	“கெஹெல்பத்தர பத்மே” உடனான தொடர்பு குறித்து பியூமி ஹன்சமாலியிடம் சி.ஐ.டி விசாரணை!	https://www.virakesari.lk/article/228391	ta	virakesarilk	1761129120.0
lk_news	2025-10-22-virakesarilk-2ff78a59	virakesarilk-2ff78a59	2025-10-22	தவிசாளர்கள் - செயலாளர்கள் முரண்பாடு பெரும் தலையிடி ; அனைவரும் ஒன்றிணைந்தால் மட்டுமே மாற்றத்தை ஏற்படுத்த முடியும் - வடக்கு ஆளுநர்	https://www.virakesari.lk/article/228385	ta	virakesarilk	1761128580.0
lk_news	2025-10-22-lankadeepalk-9c6c2784	lankadeepalk-9c6c2784	2025-10-22	කොළඹ මහ නගර සභාව කෝටි 367ක් වැටුප් ගෙවලා	https://www.lankadeepa.lk/latest_news/කළඹ-මහ-නගර-සභව-කට-367ක-වටප-ගවල/1-681856	si	lankadeepalk	1761128217.0
lk_news	2025-10-22-lankadeepalk-56f55e82	lankadeepalk-56f55e82	2025-10-22	නාගදීප - ඩෙල්ෆ් යන ජැටිය අලුත් කරයි	https://www.lankadeepa.lk/latest_news/නගදප-ඩලෆ-යන-ජටය-අලත-කරය/1-681855	si	lankadeepalk	1761127811.0
lk_news	2025-10-22-virakesarilk-b9d76106	virakesarilk-b9d76106	2025-10-22	கொழும்பு செல்ல ஹட்டனில் நீண்ட வரிசையில் காத்திருக்கும் பயணிகள்!	https://www.virakesari.lk/article/228378	ta	virakesarilk	1761126960.0
lk_news	2025-10-22-adalk-eb4cde23	adalk-eb4cde23	2025-10-22	පද්මේ මට ඩුබායිවලදී හමුවුණා, මුදල් ගණුදෙනු කර නෑ	https://www.ada.lk/breaking_news/පද්මේ-මට-ඩුබායිවලදී-හමුවුණා--මුදල්-ගණුදෙනු-කර-නෑ/11-419263	si	adalk	1761126954.0
lk_news	2025-10-22-virakesarilk-c1664373	virakesarilk-c1664373	2025-10-22	இஷாரா செவ்வந்தி வழங்கிய தகவலுக்கமைய  பிரதான ஆல்கடத்தல்காரர் கைது!	https://www.virakesari.lk/article/228387	ta	virakesarilk	1761126780.0
lk_news	2025-10-22-virakesarilk-321a77f2	virakesarilk-321a77f2	2025-10-22	மட்டக்களப்பு - ஏறாவூரில் 1000க்கும் மேற்பட்ட போதை லேகியங்கள் கைப்பற்றப்பட்டன	https://www.virakesari.lk/article/228383	ta	virakesarilk	1761126780.0
lk_news	2025-10-22-lankadeepalk-c219754a	lankadeepalk-c219754a	2025-10-22	’ශ්‍රී ලාංකික දිනය’ තියන තැන්-දින තීරණය කරයි	https://www.lankadeepa.lk/latest_news/ශර-ලකක-දනය-තයන-තන-දන-තරණය-කරය/1-681854	si	lankadeepalk	1761126626.0
lk_news	2025-10-22-adalk-fb6f74b5	adalk-fb6f74b5	2025-10-22	රටේ ජාතික ආරක්ෂාව සම්බන්ධ විශාල ප්‍රශ්නයක් -  වගකීම රජය භාරගත යුතුයි	https://www.ada.lk/breaking_news/රටේ-ජාතික-ආරක්ෂාව-සම්බන්ධ-විශාල-ප්‍රශ්නයක්----වගකීම-රජය-භාරගත-යුතුයි/11-419262	si	adalk	1761126563.0
lk_news	2025-10-22-lankadeepalk-2523361d	lankadeepalk-2523361d	2025-10-22	කෙහෙල්බද්දර පත්මේගේ දේපළ තහනම්	https://www.lankadeepa.lk/news/කහලබදදර-පතමග-දපළ-තහනම/101-681853	si	lankadeepalk	1761126198.0
lk_news	2025-10-22-lankadeepalk-5ef940d0	lankadeepalk-5ef940d0	2025-10-22	මනූෂගෙන් ඔහුගේ බිරිදගෙන් සී.අයි.ඩියට ප්‍රකාශයක්	https://www.lankadeepa.lk/news/මනෂගන-ඔහග-බරදගන-ස-අය-ඩයට-පරකශයක/101-681852	si	lankadeepalk	1761125858.0
lk_news	2025-10-22-adalk-55d8a428	adalk-55d8a428	2025-10-22	වාහන බදු සංශෝධනයක් ගැන මේ වෙලාවේ කියන්න බෑ	https://www.ada.lk/breaking_news/වාහන-බදු-සංශෝධනයක්-ගැන-මේ-වෙලාවේ-කියන්න-බෑ/11-419261	si	adalk	1761125493.0
lk_news	2025-10-22-virakesarilk-e2bec159	virakesarilk-e2bec159	2025-10-22	தோல்வி அடையாமல் இருக்கும் பலசாலிகளான அவுஸ்திரேலியா - இங்கிலாந்து மோதும் போட்டி இன்று	https://www.virakesari.lk/article/228384	ta	virakesarilk	1761125400.0
lk_news	2025-10-22-virakesarilk-8e8afff8	virakesarilk-8e8afff8	2025-10-22	“மிதிகம லசா”வுக்கும் “ஹரக் கட்டா”வுக்கும் இடையில் தொடர்பு?	https://www.virakesari.lk/article/228382	ta	virakesarilk	1761124920.0
lk_news	2025-10-22-lankadeepalk-9a577376	lankadeepalk-9a577376	2025-10-22	පොඩි දරුවන් රකින්න උපාය මාර්ගික සැලැස්මක්	https://www.lankadeepa.lk/news/පඩ-දරවන-රකනන-උපය-මරගක-සලසමක/101-681851	si	lankadeepalk	1761124403.0
lk_news	2025-10-22-virakesarilk-18a8dac5	virakesarilk-18a8dac5	2025-10-22	வெள்ளை மாளிகையில் டிரம்ப் தீபாவளி கொண்டாட்டம் : மோடியுடன் வர்த்தகம், பாகிஸ்தான் குறித்துப் பேச்சு!	https://www.virakesari.lk/article/228381	ta	virakesarilk	1761124380.0
lk_news	2025-10-22-lankadeepalk-f3c33a15	lankadeepalk-f3c33a15	2025-10-22	රාජ්‍ය සමාගම්වල තීරණ ගැනීමේ ප්‍රමාදයක්: කර්මාන්ත ඇමැති පිළිගනියි	https://www.lankadeepa.lk/news/රජය-සමගමවල-තරණ-ගනම-පරමදයක-කරමනත-ඇමත-පළගනය/101-681850	si	lankadeepalk	1761124269.0
lk_news	2025-10-22-virakesarilk-d10a9060	virakesarilk-d10a9060	2025-10-22	ட்ரம்ப் - புதின் சந்திப்பு இடைநிறுத்தம்! - வெள்ளை மாளிகை	https://www.virakesari.lk/article/228379	ta	virakesarilk	1761124200.0
lk_news	2025-10-22-adalk-039c42ad	adalk-039c42ad	2025-10-22	මරණ දඩුවම ගැන මෙතෙක් තීරණයක් ගෙන නෑ	https://www.ada.lk/breaking_news/මරණ-දඩුවම-ගැන-මෙතෙක්-තීරණයක්-ගෙන-නෑ/11-419260	si	adalk	1761123747.0
