doc_type	doc_id	num	date_str	description	url_metadata	lang	newspaper_id	time_ut
lk_news	2025-12-06-lankadeepalk-bf6b51ff	lankadeepalk-bf6b51ff	2025-12-06	ජනපති පාර්ලිමේන්තුව අමතා කළ සම්පූර්ණ කතාව	https://www.lankadeepa.lk/latest_news/ජනපත-පරලමනතව-අමත-කළ-සමපරණ-කතව/1-684757	si	lankadeepalk	1764990425.0
lk_news	2025-12-06-tamilmirrorlk-1263f390	tamilmirrorlk-1263f390	2025-12-06	பம்பலப்பிட்டியில் விபத்து : 5 பேர் காயம்	https://www.tamilmirror.lk/செய்திகள்/பம்பலப்பிட்டியில்-விபத்து-5-பேர்-காயம்/175-369127	ta	tamilmirrorlk	1764990323.0
lk_news	2025-12-06-lankadeepalk-ef61228b	lankadeepalk-ef61228b	2025-12-06	පහක් මැරූ එකෙක් මාට්ටු	https://www.lankadeepa.lk/latest_news/පහක-මර-එකක-මටට/1-684756	si	lankadeepalk	1764990081.0
lk_news	2025-12-06-lankadeepalk-bae25ca2	lankadeepalk-bae25ca2	2025-12-06	කෝටි 100 කුඩු කල්පිටියන් අල්ලයි	https://www.lankadeepa.lk/latest_news/කට-100-කඩ-කලපටයන-අලලය/1-684755	si	lankadeepalk	1764989729.0
lk_news	2025-12-06-adalk-e34cde94	adalk-e34cde94	2025-12-06	මත්ද්‍රව්‍ය රැගත් බෝට්ටුවක් නාවික හමුදා භාරයට	https://www.ada.lk/breaking_news/මත්ද්‍රව්‍ය-රැගත්-බෝට්ටුවක්-නාවික-හමුදා-භාරයට/11-420081	si	adalk	1764988452.0
lk_news	2025-12-06-virakesarilk-7f043064	virakesarilk-7f043064	2025-12-06	வடகீழ் பருவப் பெயர்ச்சிக்கான காலநிலை ஆரம்பிக்கின்றது	https://www.virakesari.lk/article/232576	ta	virakesarilk	1764981720.0
lk_news	2025-12-06-tamilmirrorlk-30c4d459	tamilmirrorlk-30c4d459	2025-12-06	மாலைதீவினால் 25,000 டின்மீன் பெட்டிகள் நன்கொடை	https://www.tamilmirror.lk/செய்திகள்/மாலைதீவினால்-25-000-டின்மீன்-பெட்டிகள்-நன்கொடை/175-369126	ta	tamilmirrorlk	1764975774.0
lk_news	2025-12-06-tamilmirrorlk-80debff5	tamilmirrorlk-80debff5	2025-12-06	’சுதந்திரமான கொள்கையை இந்தியா பின்பற்றுகிறது’	https://www.tamilmirror.lk/உலக-செய்திகள்/சுதந்திரமான-கொள்கையை-இந்தியா-பின்பற்றுகிறது/50-369125	ta	tamilmirrorlk	1764975242.0
lk_news	2025-12-06-dailyftlk-b70390ca	dailyftlk-b70390ca	2025-12-06	President calls for permanent housing solutions in high-risk disaster-prone areas	https://www.ft.lk/news/President-calls-for-permanent-housing-solutions-in-high-risk-disaster-prone-areas/56-785319	en	dailyftlk	1764966444.0
lk_news	2025-12-06-dailyftlk-600f6bd9	dailyftlk-600f6bd9	2025-12-06	Putin expresses condolences to SL	https://www.ft.lk/news/Putin-expresses-condolences-to-SL/56-785318	en	dailyftlk	1764966332.0
lk_news	2025-12-06-dailyftlk-b1b00413	dailyftlk-b1b00413	2025-12-06	Naina Thambi sworn in as Member of Parliament	https://www.ft.lk/news/Naina-Thambi-sworn-in-as-Member-of-Parliament/56-785317	en	dailyftlk	1764966297.0
lk_news	2025-12-06-dailyftlk-9d31cf63	dailyftlk-9d31cf63	2025-12-06	PM thanks diplomatic community for swift response, flags ongoing post-flood challenges	https://www.ft.lk/news/PM-thanks-diplomatic-community-for-swift-response-flags-ongoing-post-flood-challenges/56-785316	en	dailyftlk	1764966129.0
lk_news	2025-12-06-dailyftlk-81f640ce	dailyftlk-81f640ce	2025-12-06	Cross-party Opposition MPs visit cyclone-hit Kandy district	https://www.ft.lk/news/Cross-party-Opposition-MPs-visit-cyclone-hit-Kandy-district/56-785315	en	dailyftlk	1764966087.0
lk_news	2025-12-06-dailyftlk-30770d12	dailyftlk-30770d12	2025-12-06	High powered delegation of Indian IT CEOs in town	https://www.ft.lk/business/High-powered-delegation-of-Indian-IT-CEOs-in-town/34-785313	en	dailyftlk	1764964172.0
lk_news	2025-12-06-dailyftlk-7c56191a	dailyftlk-7c56191a	2025-12-06	People’s Bank partners Western Provincial Council to offer concessional MSME loans	https://www.ft.lk/business/People-s-Bank-partners-Western-Provincial-Council-to-offer-concessional-MSME-loans/34-785311	en	dailyftlk	1764963698.0
lk_news	2025-12-06-dailyftlk-d1e3bc71	dailyftlk-d1e3bc71	2025-12-06	Maldivian business magnate donates $200,000 to Sri Lanka	https://www.ft.lk/business/Maldivian-business-magnate-donates-200-000-to-Sri-Lanka/34-785310	en	dailyftlk	1764963631.0
lk_news	2025-12-06-dailyftlk-a81299e2	dailyftlk-a81299e2	2025-12-06	Apparel sector activates industry-wide relief, recovery effort	https://www.ft.lk/business/Apparel-sector-activates-industry-wide-relief-recovery-effort/34-785309	en	dailyftlk	1764963554.0
lk_news	2025-12-06-dailyftlk-891e8a0b	dailyftlk-891e8a0b	2025-12-06	SLT‑Mobitel calls for public support to keep Sri Lanka connected	https://www.ft.lk/business/SLTMobitel-calls-for-public-support-to-keep-Sri-Lanka-connected/34-785308	en	dailyftlk	1764963529.0
lk_news	2025-12-06-dailyftlk-49923cd4	dailyftlk-49923cd4	2025-12-06	JXG’s Holistic Leadership Summit 2025 champions blueprint for corporate steadiness and human-centred growth	https://www.ft.lk/business/JXG-s-Holistic-Leadership-Summit-2025-champions-blueprint-for-corporate-steadiness-and-human-centred-growth/34-785307	en	dailyftlk	1764963503.0
lk_news	2025-12-06-dailyftlk-cc8ca3d2	dailyftlk-cc8ca3d2	2025-12-06	UK increases SL relief funding to £ 1 m	https://www.ft.lk/news/UK-increases-SL-relief-funding-to-1-m/56-785305	en	dailyftlk	1764963225.0
lk_news	2025-12-06-dailyftlk-5369dc49	dailyftlk-5369dc49	2025-12-06	Maldives donates 14 containers of tuna	https://www.ft.lk/news/Maldives-donates-14-containers-of-tuna/56-785304	en	dailyftlk	1764963092.0
lk_news	2025-12-06-dailyftlk-d3c1975d	dailyftlk-d3c1975d	2025-12-06	India rushes critical infrastructure, medical support, and drinking water	https://www.ft.lk/news/India-rushes-critical-infrastructure-medical-support-and-drinking-water/56-785303	en	dailyftlk	1764963019.0
lk_news	2025-12-06-dailyftlk-91faa2c2	dailyftlk-91faa2c2	2025-12-06	South Korea provides emergency relief to Sri Lanka following Cyclone Ditwah	https://www.ft.lk/news/South-Korea-provides-emergency-relief-to-Sri-Lanka-following-Cyclone-Ditwah/56-785301	en	dailyftlk	1764962854.0
lk_news	2025-12-06-dailyftlk-7eecb55b	dailyftlk-7eecb55b	2025-12-06	UAE extends urgent humanitarian aid to flood-stricken Sri Lanka	https://www.ft.lk/news/UAE-extends-urgent-humanitarian-aid-to-flood-stricken-Sri-Lanka/56-785299	en	dailyftlk	1764962321.0
lk_news	2025-12-06-dailyftlk-315369f3	dailyftlk-315369f3	2025-12-06	An unhappy commentary	https://www.ft.lk/columns/An-unhappy-commentary/4-785298	en	dailyftlk	1764962291.0
lk_news	2025-12-06-dailyftlk-ca8cebbe	dailyftlk-ca8cebbe	2025-12-06	Gangaramaya Temple donates Rs. 30 m to ‘Rebuilding Sri Lanka’ Fund	https://www.ft.lk/news/Gangaramaya-Temple-donates-Rs-30-m-to-Rebuilding-Sri-Lanka-Fund/56-785297	en	dailyftlk	1764962256.0
lk_news	2025-12-06-dailyftlk-2cc1b70f	dailyftlk-2cc1b70f	2025-12-06	Beyond the rain: Systemic lessons  from the Ditwah catastrophe	https://www.ft.lk/columns/Beyond-the-rain-Systemic-lessons-from-the-Ditwah-catastrophe/4-785295	en	dailyftlk	1764961524.0
lk_news	2025-12-06-dailyftlk-44841711	dailyftlk-44841711	2025-12-06	Experience on rebuilding funds: Selective amnesia?	https://www.ft.lk/columns/Experience-on-rebuilding-funds-Selective-amnesia/4-785294	en	dailyftlk	1764961005.0
lk_news	2025-12-05-virakesarilk-a023e157	virakesarilk-a023e157	2025-12-05	பேரனர்த்தத்தின் அழிவிலிருந்து நாட்டைக் கட்டியெழுப்ப ஒற்றுமையுடன் கைகோருங்கள் - உலகளாவிய புலம்பெயர் தமிழர் அமைப்புக்களுக்கு அனைத்துலகத் தமிழர் பேரவை அழைப்பு	https://www.virakesari.lk/article/232571	ta	virakesarilk	1764957600.0
lk_news	2025-12-05-virakesarilk-bf9d2b2d	virakesarilk-bf9d2b2d	2025-12-05	அனர்த்தத்தை எதிர்கொண்டு புதிய பாதையில் ஒன்றாகப் பயணித்து நாட்டைக் கட்டியெழுப்புவோம் : ஜனாதிபதியின் முழுமையான உரை	https://www.virakesari.lk/article/232575	ta	virakesarilk	1764957420.0
lk_news	2025-12-05-lankadeepalk-9dde8334	lankadeepalk-9dde8334	2025-12-05	විසර්ජන පනතට කතානායක සහතිකය	https://www.lankadeepa.lk/latest_news/වසරජන-පනතට-කතනයක-සහතකය/1-684754	si	lankadeepalk	1764951018.0
lk_news	2025-12-05-islandlk-70bb6090	islandlk-70bb6090	2025-12-05	Colombo bourse wakes up late, ends day on a busier note	http://island.lk/colombo-bourse-wakes-up-late-ends-day-on-a-busier-note/	en	islandlk	1764948960.0
lk_news	2025-12-05-islandlk-c6442c2a	islandlk-c6442c2a	2025-12-05	Sri Lanka claims regional spotlight as DC Group wins Gold for Digital Innovation Agency of the Year – South Asia and Rest of South Asia	http://island.lk/sri-lanka-claims-regional-spotlight-as-dc-group-wins-gold-for-digital-innovation-agency-of-the-year-south-asia-and-rest-of-south-asia/	en	islandlk	1764948900.0
lk_news	2025-12-05-islandlk-288eb0f0	islandlk-288eb0f0	2025-12-05	TikTok launches guide to combat misinformation during floods in Sri Lanka	http://island.lk/tiktok-launches-guide-to-combat-misinformation-during-floods-in-sri-lanka/	en	islandlk	1764948900.0
lk_news	2025-12-05-virakesarilk-88c2bd53	virakesarilk-88c2bd53	2025-12-05	விவசாயம், பெருந்தோட்டத்துறையை மேம்படுத்த சர்வதேச நாடுகளின் ஒத்துழைப்பைப் பெறுவது தொடர்பில் கவனம் செலுத்தவும் - ஹெக்டர் அப்புஹாமி	https://www.virakesari.lk/article/232573	ta	virakesarilk	1764947340.0
lk_news	2025-12-05-islandlk-909c549e	islandlk-909c549e	2025-12-05	Round Table Sri Lanka delivers rapid, high-impact relief following Cyclone Ditwah	http://island.lk/round-table-sri-lanka-delivers-rapid-high-impact-relief-following-cyclone-ditwah/	en	islandlk	1764947160.0
lk_news	2025-12-05-islandlk-8dcb8299	islandlk-8dcb8299	2025-12-05	HUTCH joins nation’s rebuild effort with Rs.60 million contribution to ‘Rebuild Sri Lanka’ Fund	http://island.lk/hutch-joins-nations-rebuild-effort-with-rs-60-million-contribution-to-rebuild-sri-lanka-fund/	en	islandlk	1764947100.0
lk_news	2025-12-05-islandlk-5500d132	islandlk-5500d132	2025-12-05	Sri Lanka Insurance Corporation General Limited partners ‘Kedella Art of Living 2025’	http://island.lk/sri-lanka-insurance-corporation-general-limited-partners-kedella-art-of-living-2025/	en	islandlk	1764947100.0
lk_news	2025-12-05-lankadeepalk-efc2b7f0	lankadeepalk-efc2b7f0	2025-12-05	මල්වතු ඔයට වැටුණු අයියගේ සිරු හමුවේ:නංගී තවමත් අතුරුදන්	https://www.lankadeepa.lk/news/මලවත-ඔයට-වටණ-අයයග-සර-හමවනග-තවමත-අතරදන/101-684753	si	lankadeepalk	1764946753.0
lk_news	2025-12-05-adalk-956ce7bb	adalk-956ce7bb	2025-12-05	අයවැය සම්මතයි	https://www.ada.lk/breaking_news/අයවැය-සම්මතයි/11-420080	si	adalk	1764946310.0
lk_news	2025-12-05-lankadeepalk-fc11191e	lankadeepalk-fc11191e	2025-12-05	හෙරණ නගර සභා අයවැයි ජාජබ පරාදයි	https://www.lankadeepa.lk/news/හරණ-නගර-සභ-අයවය-ජජබ-පරදය/101-684752	si	lankadeepalk	1764946286.0
lk_news	2025-12-05-tamilmirrorlk-ce9a5174	tamilmirrorlk-ce9a5174	2025-12-05	நெடுஞ்சாலையில் அனர்த்தம்: பெண் பலி	https://www.tamilmirror.lk/மலையகம்/நெடுஞ்சாலையில்-அனர்த்தம்-பெண்-பலி/76-369112	ta	tamilmirrorlk	1764946073.0
lk_news	2025-12-05-virakesarilk-4c7d7aa6	virakesarilk-4c7d7aa6	2025-12-05	ஆடம்பரங்களை தவிர்த்து கிறிஸ்து பிறப்பு விழாவை கொண்டாடுங்கள் ; யாழ். மறை மாவட்ட குரு முதல்வர்	https://www.virakesari.lk/article/232548	ta	virakesarilk	1764945660.0
lk_news	2025-12-05-virakesarilk-d0cc4817	virakesarilk-d0cc4817	2025-12-05	நாடு முழுவதும்  504 அனர்த்த நிவாரண வைத்திய குழுக்கள் நிவாரணப் பணியில் !	https://www.virakesari.lk/article/232551	ta	virakesarilk	1764945540.0
lk_news	2025-12-05-lankadeepalk-34b82058	lankadeepalk-34b82058	2025-12-05	වැලිමඩ - නුවරඑළිය පාර යළි අරී	https://www.lankadeepa.lk/news/වලමඩ-නවරඑළය-පර-යළ-අර/101-684751	si	lankadeepalk	1764945431.0
lk_news	2025-12-05-virakesarilk-60f54c9f	virakesarilk-60f54c9f	2025-12-05	பிரதியமைச்சர் சுனில் வட்டகலவின் கருத்துக்கு சர்வதேச ஊடகவியலாளர்கள் பேரவை கண்டனம்	https://www.virakesari.lk/article/232552	ta	virakesarilk	1764945420.0
lk_news	2025-12-05-virakesarilk-afc8922d	virakesarilk-afc8922d	2025-12-05	அரசாங்கம்  தவறுகளை திருத்திக்கொள்ள வேண்டும் - அஜித் பி பெரேரா	https://www.virakesari.lk/article/232553	ta	virakesarilk	1764945360.0
lk_news	2025-12-05-tamilmirrorlk-93703c35	tamilmirrorlk-93703c35	2025-12-05	தகவல் தெரிந்தவர்ஙள் அறிவிக்கவும்	https://www.tamilmirror.lk/செய்திகள்/தகவல்-தெரிந்தவர்ஙள்-அறிவிக்கவும்/175-369111	ta	tamilmirrorlk	1764945249.0
lk_news	2025-12-05-virakesarilk-cd1fb4d8	virakesarilk-cd1fb4d8	2025-12-05	2026 நிதியாண்டுக்கான வரவு - செலவுத் திட்டம் பாராளுமன்றத்தில் நிறைவேறியது!	https://www.virakesari.lk/article/232568	ta	virakesarilk	1764945180.0
lk_news	2025-12-05-lankadeepalk-8bc2a5ff	lankadeepalk-8bc2a5ff	2025-12-05	අධිවේගීයේ අනතුරකින් කතක් මරුට	https://www.lankadeepa.lk/news/අධවගය-අනතරකන-කතක-මරට/101-684750	si	lankadeepalk	1764944959.0
lk_news	2025-12-05-virakesarilk-82e6135b	virakesarilk-82e6135b	2025-12-05	நீர்த்தேக்கத்திலிருந்து நீரை முறையாக விடுவிக்க நீர்ப்பாசன அமைச்சர் நடவடிக்கை எடுத்திருந்தால் மக்களின் உயிரிழப்பை தடுத்திருக்கலாம் - சாமர சம்பத்	https://www.virakesari.lk/article/232569	ta	virakesarilk	1764944700.0
lk_news	2025-12-05-tamilmirrorlk-14820c41	tamilmirrorlk-14820c41	2025-12-05	“வீட்டுக்குள் ஜெனரேட்டர்களை வைக்க வேண்டாம்”	https://www.tamilmirror.lk/செய்திகள்/வீட்டுக்குள்-ஜெனரேட்டர்களை-வைக்க-வேண்டாம்/175-369110	ta	tamilmirrorlk	1764944379.0
lk_news	2025-12-05-virakesarilk-17d57e69	virakesarilk-17d57e69	2025-12-05	இலங்கையில் நிலநடுக்கம் ஏற்படுமா ? எச்சரிக்கை தொடர்பான விபரம் இதோ !	https://www.virakesari.lk/article/232567	ta	virakesarilk	1764944220.0
lk_news	2025-12-05-lankadeepalk-87dd76b1	lankadeepalk-87dd76b1	2025-12-05	අයවැය තුනෙන් දෙකෙන් සම්මතයි	https://www.lankadeepa.lk/news/අයවය-තනන-දකන-සමමතය/101-684749	si	lankadeepalk	1764944083.0
lk_news	2025-12-05-lankadeepalk-3d631031	lankadeepalk-3d631031	2025-12-05	2026 අයවැය තුනෙන් දෙකෙන් සම්මතයි	https://www.lankadeepa.lk/latest_news/2026-අයවය-තනන-දකන-සමමතය/1-684749	si	lankadeepalk	1764944083.0
lk_news	2025-12-05-lankadeepalk-3dd02dbd	lankadeepalk-3dd02dbd	2025-12-05	සේසතම නැති වූ අයට ජීවනෝපායක් ලැබෙන තෙක් පනස්දාහක්	https://www.lankadeepa.lk/news/සසතම-නත-ව-අයට-ජවනපයක-ලබන-තක-පනසදහක/101-684748	si	lankadeepalk	1764943990.0
lk_news	2025-12-05-virakesarilk-63ac43a7	virakesarilk-63ac43a7	2025-12-05	பேராதனை பல்கலைக்கழகம் மாணவர்களுக்கு விடுத்த முக்கிய அறிவிப்பு!	https://www.virakesari.lk/article/232564	ta	virakesarilk	1764943980.0
lk_news	2025-12-05-tamilmirrorlk-a98def17	tamilmirrorlk-a98def17	2025-12-05	வரவு செலவுத் திட்டம் நிறைவேற்றம்	https://www.tamilmirror.lk/செய்திகள்/வரவு-செலவுத்-திட்டம்-நிறைவேற்றம்/175-369109	ta	tamilmirrorlk	1764943948.0
lk_news	2025-12-05-virakesarilk-82e4a497	virakesarilk-82e4a497	2025-12-05	வெள்ள பேரிடருக்குள்ளானோருக்கு ஜனாதிபதியின் விசேட அறிவிப்பு!	https://www.virakesari.lk/article/232566	ta	virakesarilk	1764942900.0
lk_news	2025-12-05-lankadeepalk-371040e9	lankadeepalk-371040e9	2025-12-05	නිවස - ඉඩම දෙකම අහිමි වුනා නම් රජයෙන් රුපියල් කෝටියක්	https://www.lankadeepa.lk/latest_news/නවස-ඉඩම-දකම-අහම-වන-නම-රජයන-රපයල-කටයක/1-684747	si	lankadeepalk	1764942106.0
lk_news	2025-12-05-lankadeepalk-ebfd26c6	lankadeepalk-ebfd26c6	2025-12-05	මහවැලි අධිකාරයේ හිටපුු අධ්‍යක්ෂගේ අපේක්ෂිත ඇපැල විසි වෙයි	https://www.lankadeepa.lk/latest_news/මහවල-අධකරය-හටප-අධයකෂග-අපකෂත-ඇපල-වස-වය/1-684746	si	lankadeepalk	1764941997.0
lk_news	2025-12-05-virakesarilk-1660194b	virakesarilk-1660194b	2025-12-05	அனர்த்தங்களில் சிக்கி உயிரிழந்தோரின் எண்ணிக்கை 607ஆக உயர்வு ; 214 மாயம்!	https://www.virakesari.lk/article/232565	ta	virakesarilk	1764941520.0
lk_news	2025-12-05-tamilmirrorlk-ec414205	tamilmirrorlk-ec414205	2025-12-05	உயிரிழந்தவர்களின் எண்ணிக்கை 607ஆக அதிகரித்தது	https://www.tamilmirror.lk/செய்திகள்/உயிரிழந்தவர்களின்-எண்ணிக்கை-607ஆக-அதிகரித்தது/175-369108	ta	tamilmirrorlk	1764941450.0
lk_news	2025-12-05-tamilmirrorlk-437d30cc	tamilmirrorlk-437d30cc	2025-12-05	வெளியேறுகை எச்சரிக்கை	https://www.tamilmirror.lk/செய்திகள்/வெளியேறுகை-எச்சரிக்கை/175-369107	ta	tamilmirrorlk	1764941085.0
lk_news	2025-12-05-tamilmirrorlk-a8191397	tamilmirrorlk-a8191397	2025-12-05	குரோதஙகளுக்கு மத்தியில் நல்லவர்களும் உள்ளனர்	https://www.tamilmirror.lk/செய்திகள்/குரோதஙகளுக்கு-மத்தியில்-நல்லவர்களும்-உள்ளனர்/175-369106	ta	tamilmirrorlk	1764940707.0
lk_news	2025-12-05-virakesarilk-135f7268	virakesarilk-135f7268	2025-12-05	நிர்வாகம் பொறுப்பல்ல - திரைப்பட விமர்சனம்	https://www.virakesari.lk/article/232561	ta	virakesarilk	1764940320.0
lk_news	2025-12-05-tamilmirrorlk-dbc30f95	tamilmirrorlk-dbc30f95	2025-12-05	ஈரமான நாணயத்தாள் தொடர்பிலான அறிவிப்பு	https://www.tamilmirror.lk/செய்திகள்/ஈரமான-நாணயத்தாள்-தொடர்பிலான-அறிவிப்பு/175-369105	ta	tamilmirrorlk	1764940135.0
lk_news	2025-12-05-virakesarilk-aa50481a	virakesarilk-aa50481a	2025-12-05	சா வீ  - திரைப்பட விமர்சனம்	https://www.virakesari.lk/article/232560	ta	virakesarilk	1764940080.0
lk_news	2025-12-05-tamilmirrorlk-070931e0	tamilmirrorlk-070931e0	2025-12-05	ஜனாதிபதியின் விசேட நிவாரண அறிவிப்பு	https://www.tamilmirror.lk/செய்திகள்/ஜனாதிபதியின்-விசேட-நிவாரண-அறிவிப்பு/175-369104	ta	tamilmirrorlk	1764939837.0
lk_news	2025-12-05-virakesarilk-33119c11	virakesarilk-33119c11	2025-12-05	சாரா - திரைப்பட விமர்சனம்	https://www.virakesari.lk/article/232559	ta	virakesarilk	1764939660.0
lk_news	2025-12-05-virakesarilk-a3072980	virakesarilk-a3072980	2025-12-05	அங்கம்மாள் - திரைப்பட விமர்சனம்	https://www.virakesari.lk/article/232558	ta	virakesarilk	1764939420.0
lk_news	2025-12-05-tamilmirrorlk-42214c76	tamilmirrorlk-42214c76	2025-12-05	மாலத்தீவு டின் டுனா அன்பளிப்பு	https://www.tamilmirror.lk/உலக-செய்திகள்/மாலத்தீவு-டின்-டுனா-அன்பளிப்பு/50-369103	ta	tamilmirrorlk	1764939206.0
lk_news	2025-12-05-tamilmirrorlk-a48bbba2	tamilmirrorlk-a48bbba2	2025-12-05	அனர்த்த எச்சரிக்கையில் தமிழ் மொழி புறக்கணிப்பு	https://www.tamilmirror.lk/செய்திகள்/அனர்த்த-எச்சரிக்கையில்-தமிழ்-மொழி-புறக்கணிப்பு/175-369102	ta	tamilmirrorlk	1764938445.0
lk_news	2025-12-05-lankadeepalk-0802838f	lankadeepalk-0802838f	2025-12-05	වාරිමාර්ග ඇමතිට ජම්පර අඳින්න වෙනවා	https://www.lankadeepa.lk/news/වරමරග-ඇමතට-ජමපර-අඳනන-වනව/101-684745	si	lankadeepalk	1764938222.0
lk_news	2025-12-05-lankadeepalk-3ba213b3	lankadeepalk-3ba213b3	2025-12-05	නුවරඑළිය මන්ත්‍රිනිය පාර්ලිමේන්තුවේ  හඬා වැටෙයි	https://www.lankadeepa.lk/news/නවරඑළය-මනතරනය-පරලමනතව-හඬ-වටය/101-684744	si	lankadeepalk	1764937632.0
lk_news	2025-12-05-lankadeepalk-58fd21f6	lankadeepalk-58fd21f6	2025-12-05	ජනපති මැතිසබයට එයි	https://www.lankadeepa.lk/news/ජනපත-මතසබයට-එය/101-684743	si	lankadeepalk	1764937416.0
lk_news	2025-12-05-virakesarilk-1edadffa	virakesarilk-1edadffa	2025-12-05	உலகின் மிகச்சிறிய எருமை	https://www.virakesari.lk/article/232539	ta	virakesarilk	1764936300.0
lk_news	2025-12-05-virakesarilk-a6dd1846	virakesarilk-a6dd1846	2025-12-05	யாழ். சாவகச்சேரி வைத்தியசாலை பிரச்சினையை வைத்து அரசியல் செய்து பாராளுமன்றம் வந்தவர் இன்றுவரை அந்த மக்களுக்கு எந்த உதவியும் செய்ய செல்லவில்லை - இளங்குமரன்	https://www.virakesari.lk/article/232544	ta	virakesarilk	1764935880.0
lk_news	2025-12-05-virakesarilk-700dc981	virakesarilk-700dc981	2025-12-05	நாட்டில் ஏற்பட்ட அனர்த்தங்களில் முழுநாடும் அதிர்ச்சியடைந்துள்ளது ; இந்த மோசமான நிலைமையில் பலர் உயிரிழந்துள்ளதுடன் பல குடும்பங்கள் நிர்க்கதியாகியுள்ளன - வே.இராதாகிருஷ்ணன்	https://www.virakesari.lk/article/232542	ta	virakesarilk	1764935160.0
