doc_type	doc_id	num	date_str	description	url_metadata	lang	newspaper_id	time_ut
lk_news	2025-12-10-lankadeepalk-4f6ba934	lankadeepalk-4f6ba934	2025-12-10	රුසියානු ආධාර තොගයක් කටුනායකට	https://www.lankadeepa.lk/latest_news/රසයන-ආධර-තගයක-කටනයකට/1-685031	si	lankadeepalk	1765361020.0
lk_news	2025-12-10-lankadeepalk-67a9f5f6	lankadeepalk-67a9f5f6	2025-12-10	කොත්මලේ හරහා ගමන් කිරීම සහැල්ලු වාහන පමණයි	https://www.lankadeepa.lk/news/කතමල-හරහ-ගමන-කරම-සහලල-වහන-පමණය/101-685030	si	lankadeepalk	1765359688.0
lk_news	2025-12-10-lankadeepalk-3ba34b07	lankadeepalk-3ba34b07	2025-12-10	කොත්මලේ හරහා ගමන් කිරීම සැහැල්ලු වාහන පමණයි	https://www.lankadeepa.lk/latest_news/කතමල-හරහ-ගමන-කරම-සහලල-වහන-පමණය/1-685030	si	lankadeepalk	1765359688.0
lk_news	2025-12-10-tamilmirrorlk-776ff510	tamilmirrorlk-776ff510	2025-12-10	காதலனின் மனைவியிடமிருந்து தப்பிக்க பெண் செய்த விபரீதம் (வீடியோ)	https://www.tamilmirror.lk/செய்திகள்/காதலனின்-மனைவியிடமிருந்து-தப்பிக்க-பெண்-செய்த-விபரீதம்-வீடியோ/175-369376	ta	tamilmirrorlk	1765359521.0
lk_news	2025-12-10-tamilmirrorlk-d311cb92	tamilmirrorlk-d311cb92	2025-12-10	Google Mapபில் இலங்கையின் சாலை வலையமைப்பு புதுப்பிப்பு	https://www.tamilmirror.lk/செய்திகள்/Google-Mapபில்-இலங்கையின்-சாலை-வலையமைப்பு-புதுப்பிப்பு/175-369375	ta	tamilmirrorlk	1765359072.0
lk_news	2025-12-10-lankadeepalk-6bc51d07	lankadeepalk-6bc51d07	2025-12-10	ශක්තිමත් රටවල් මානව හිමිකම් රකිනවාද ප්‍රශ්නයක්	https://www.lankadeepa.lk/latest_news/ශකතමත-රටවල-මනව-හමකම-රකනවද-පරශනයක/1-685028	si	lankadeepalk	1765358125.0
lk_news	2025-12-10-virakesarilk-6cfb00fe	virakesarilk-6cfb00fe	2025-12-10	வெள்ளத்தினால் பாதிக்கப்பட்ட பொதுக்கட்டடங்களை புனரமைக்கவும் கொடுப்பனவுகள் வழங்கப்படவேண்டும் - இம்ரான் எம்.பி	https://www.virakesari.lk/article/232965	ta	virakesarilk	1765357740.0
lk_news	2025-12-10-virakesarilk-70357b65	virakesarilk-70357b65	2025-12-10	சட்டவிரோத மணல் அகழ்வுக்கு எதிராக செயற்பட்டவர் மணலுடன் சென்ற கனரக வாகனம் மோதி பலி	https://www.virakesari.lk/article/232972	ta	virakesarilk	1765357560.0
lk_news	2025-12-10-adalk-9a5df71f	adalk-9a5df71f	2025-12-10	හිටපු මහබැංකු අධිපති කබ්රාල් ශ්‍රීක බැඳුම්කර නඩුවෙන් නිදහස්	https://www.ada.lk/breaking_news/හිටපු-මහබැංකු-අධිපති-කබ්රාල්-ශ්‍රීක-බැඳුම්කර-නඩුවෙන්-නිදහස්/11-420160	si	adalk	1765357171.0
lk_news	2025-12-10-tamilmirrorlk-8b413c95	tamilmirrorlk-8b413c95	2025-12-10	இடியுடன் கூடிய மழை எச்சரிக்கை	https://www.tamilmirror.lk/செய்திகள்/இடியுடன்-கூடிய-மழை-எச்சரிக்கை/175-369374	ta	tamilmirrorlk	1765356593.0
lk_news	2025-12-10-tamilmirrorlk-fcbd9df6	tamilmirrorlk-fcbd9df6	2025-12-10	வீடுகள் சுத்தம் செய்யும் பணியில் இணைந்த வெளிநாட்டவர்	https://www.tamilmirror.lk/மலையகம்/வீடுகள்-சுத்தம்-செய்யும்-பணியில்-இணைந்த-வெளிநாட்டவர்/76-369373	ta	tamilmirrorlk	1765356206.0
lk_news	2025-12-10-tamilmirrorlk-1dc3cbba	tamilmirrorlk-1dc3cbba	2025-12-10	மஞ்சள் அனகொண்டா குட்டிக்கு மறுப்பு	https://www.tamilmirror.lk/செய்திகள்/மஞ்சள்-அனகொண்டா-குட்டிக்கு-மறுப்பு/175-369372	ta	tamilmirrorlk	1765356194.0
lk_news	2025-12-10-virakesarilk-25ebc088	virakesarilk-25ebc088	2025-12-10	இலங்கை தீவின் முந்தைய அழகு இரட்டிப்பாகும் காலம் வெகு தொலைவில் இல்லை! - அனர்த்த நிலையிலும் டிசம்பர் முதல் 8 நாட்களில் 50,222 வெளிநாட்டு சுற்றுலாப் பயணிகள் நாட்டுக்கு வருகை	https://www.virakesari.lk/article/232870	ta	virakesarilk	1765356000.0
lk_news	2025-12-10-lankadeepalk-2232a22c	lankadeepalk-2232a22c	2025-12-10	ට්‍රම්ප් තායි - කාම්බෝජ ගැටුම්වලට යළි මැදිහත් වේ	https://www.lankadeepa.lk/latest_news/ටරමප-තය-කමබජ-ගටමවලට-යළ-මදහත-ව/1-685027	si	lankadeepalk	1765355924.0
lk_news	2025-12-10-virakesarilk-b9570bbc	virakesarilk-b9570bbc	2025-12-10	மாதம்பை தமிழ் பாடசாலையில் தற்காலிகமாக தங்கியிருக்கும் தோட்ட மக்களை பாதுகாப்பான இடங்களுக்கு மாற்றவேண்டும் - சுந்தரலிங்கம் பிரதீப்	https://www.virakesari.lk/article/232969	ta	virakesarilk	1765355520.0
lk_news	2025-12-10-virakesarilk-94b7b634	virakesarilk-94b7b634	2025-12-10	சீனாவில் இலஞ்ச மோசடியில் ஈடுபட்டவருக்கு மரண தண்டனை நிறைவேற்றப்பட்டது!	https://www.virakesari.lk/article/232971	ta	virakesarilk	1765355460.0
lk_news	2025-12-10-lankadeepalk-ad37d31b	lankadeepalk-ad37d31b	2025-12-10	යුක්රේන ජනපති පාප්තුමන් හමුවෙයි	https://www.lankadeepa.lk/latest_news/යකරන-ජනපත-පපතමන-හමවය/1-685026	si	lankadeepalk	1765355447.0
lk_news	2025-12-10-lankadeepalk-ba29715e	lankadeepalk-ba29715e	2025-12-10	තද වැසි අකුණු  කලාප ගැන කාලගුණයෙන්  නිවේදනයක්	https://www.lankadeepa.lk/latest_news/තද-වස-අකණ-කලප-ගන-කලගණයන-නවදනයක/1-685025	si	lankadeepalk	1765355382.0
lk_news	2025-12-10-tamilmirrorlk-ba7bf129	tamilmirrorlk-ba7bf129	2025-12-10	பர்தாவுடன் சுற்றித்திரிந்த மாணவன் கைது	https://www.tamilmirror.lk/மலையகம்/பர்தாவுடன்-சுற்றித்திரிந்த-மாணவன்-கைது/76-369369	ta	tamilmirrorlk	1765354455.0
lk_news	2025-12-10-lankadeepalk-d5b6faa7	lankadeepalk-d5b6faa7	2025-12-10	නුවරඑළිය රෝහලේ හානි බලන්න ලේකම් යයි	https://www.lankadeepa.lk/news/නවරඑළය-රහල-හන-බලනන-ලකම-යය/101-685021	si	lankadeepalk	1765354324.0
lk_news	2025-12-10-lankadeepalk-a7ff5f6c	lankadeepalk-a7ff5f6c	2025-12-10	ඇල්පිටිය ප්‍රා.ස. අය වැය සම්මතයි	https://www.lankadeepa.lk/news/ඇලපටය-පර-ස-අය-වය-සමමතය/101-685020	si	lankadeepalk	1765353877.0
lk_news	2025-12-10-tamilmirrorlk-570c4ddd	tamilmirrorlk-570c4ddd	2025-12-10	பதுளையில் 1,168 குழந்தைகள் பாதுகாப்பு மையங்களில்	https://www.tamilmirror.lk/மலையகம்/பதுளையில்-1-168-குழந்தைகள்-பாதுகாப்பு-மையங்களில்/76-369368	ta	tamilmirrorlk	1765353623.0
lk_news	2025-12-10-virakesarilk-08f9b619	virakesarilk-08f9b619	2025-12-10	இலங்கையின் வீதி வலையமைப்பை புதுப்பித்துள்ள கூகுள் மெப்	https://www.virakesari.lk/article/232970	ta	virakesarilk	1765353600.0
lk_news	2025-12-10-lankadeepalk-4e8bee46	lankadeepalk-4e8bee46	2025-12-10	මරණ පරීක්ෂකවරුන්ගෙන් පින් අතේ වැඩක්	https://www.lankadeepa.lk/news/මරණ-පරකෂකවරනගන-පන-අත-වඩක/101-685019	si	lankadeepalk	1765351523.0
lk_news	2025-12-10-lankadeepalk-abd0e59e	lankadeepalk-abd0e59e	2025-12-10	දිට්වාගෙන් මතුවන අර්බුද	https://www.lankadeepa.lk/features/දටවගන-මතවන-අරබද/2-685018	si	lankadeepalk	1765351089.0
lk_news	2025-12-10-adalk-d867ed9e	adalk-d867ed9e	2025-12-10	අධ්‍යාපන අමාත්‍යාංශයෙන් විශේෂ නිවේදනයක්	https://www.ada.lk/breaking_news/අධ්‍යාපන-අමාත්‍යාංශයෙන්-විශේෂ-නිවේදනයක්/11-420159	si	adalk	1765350700.0
lk_news	2025-12-10-virakesarilk-46c95d30	virakesarilk-46c95d30	2025-12-10	சூழல்நேயம்மிக்க போக்குவரத்திற்கு உதவும் முகமாக TAILG இலெக்ட்ரிக் மோட்டார் சைக்கிள்களை சிங்கர் அறிமுகப்படுத்தியுள்ளது	https://www.virakesari.lk/article/232968	ta	virakesarilk	1765350600.0
lk_news	2025-12-10-virakesarilk-12d73868	virakesarilk-12d73868	2025-12-10	இலங்கை காப்பீட்டு நிறுவனம்  இலங்கை பார் எசோசியேஷனுடன் ஓய்வூதியத்திட்டங்களை வழங்க உள்ளனர்	https://www.virakesari.lk/article/232967	ta	virakesarilk	1765350480.0
lk_news	2025-12-10-virakesarilk-0f525621	virakesarilk-0f525621	2025-12-10	அவுஸ்திரேலிய துணை அமைச்சர் ஜூலியன் ஹில் இலங்கைக்கு விஜயம்!	https://www.virakesari.lk/article/232966	ta	virakesarilk	1765350420.0
lk_news	2025-12-10-lankadeepalk-6ed087d6	lankadeepalk-6ed087d6	2025-12-10	පහට අඩු දූදරුවන් 1,168 ක් බදුල්ලේ සුරක්ෂිත මධ්‍යස්ථානවල	https://www.lankadeepa.lk/latest_news/පහට-අඩ-දදරවන-1-168-ක-බදලල-සරකෂත-මධයසථනවල/1-685017	si	lankadeepalk	1765350163.0
lk_news	2025-12-10-lankadeepalk-9f3162ae	lankadeepalk-9f3162ae	2025-12-10	කොළඹ යළි අනවසර ඉදිකිරීම් බෑ	https://www.lankadeepa.lk/latest_news/කළඹ-යළ-අනවසර-ඉදකරම-බ/1-685016	si	lankadeepalk	1765350154.0
lk_news	2025-12-10-tamilmirrorlk-c91bb6fb	tamilmirrorlk-c91bb6fb	2025-12-10	கொழும்புக்கு அதிரடி அறிவிப்பு	https://www.tamilmirror.lk/செய்திகள்/கொழும்புக்கு-அதிரடி-அறிவிப்பு/175-369367	ta	tamilmirrorlk	1765349160.0
lk_news	2025-12-10-virakesarilk-a3a393b9	virakesarilk-a3a393b9	2025-12-10	மாறுகின்ற உலக ஒழுங்கில் இந்திய – ரஷ்ய உறவின் மீள் உறுதிப்பாடு	https://www.virakesari.lk/article/232963	ta	virakesarilk	1765348920.0
lk_news	2025-12-10-lankadeepalk-9f07101d	lankadeepalk-9f07101d	2025-12-10	කොළොන්න සභාව උණුසුම් වෙයි	https://www.lankadeepa.lk/latest_news/කළනන-සභව-උණසම-වය/1-685014	si	lankadeepalk	1765348661.0
lk_news	2025-12-10-virakesarilk-97c1d076	virakesarilk-97c1d076	2025-12-10	அனர்த்தத்தின் மத்தியிலும் சுற்றுலாப் பயணிகளின் எண்ணிக்கை அதிகரிப்பு!	https://www.virakesari.lk/article/232962	ta	virakesarilk	1765348620.0
lk_news	2025-12-10-tamilmirrorlk-eb109c3d	tamilmirrorlk-eb109c3d	2025-12-10	சட்டவிரோத மணல் அகழ்வுக்கு எதிரானவர்: மணல் ரிப்பர் மோதி  பலி	https://www.tamilmirror.lk/செய்திகள்/சட்டவிரோத-மணல்-அகழ்வுக்கு-எதிரானவர்-மணல்-ரிப்பர்-மோதி-பலி/175-369366	ta	tamilmirrorlk	1765348601.0
lk_news	2025-12-10-tamilmirrorlk-23a76d16	tamilmirrorlk-23a76d16	2025-12-10	மணல் அகழ்வுக்கு எதிராக செயற்பட்டவர்: மணல் ரிப்பர் மோதியதில் பலி	https://www.tamilmirror.lk/செய்திகள்/மணல்-அகழ்வுக்கு-எதிராக-செயற்பட்டவர்-மணல்-ரிப்பர்-மோதியதில்-பலி/175-369366	ta	tamilmirrorlk	1765348601.0
lk_news	2025-12-10-lankadeepalk-2cb6afa3	lankadeepalk-2cb6afa3	2025-12-10	කෝටි පන්දාහේ  පරිපූරකයට මුදල් සභාවේ අනුමැතිය	https://www.lankadeepa.lk/latest_news/කට-පනදහ-පරපරකයට-මදල-සභව-අනමතය/1-685013	si	lankadeepalk	1765348590.0
lk_news	2025-12-10-tamilmirrorlk-c9de9276	tamilmirrorlk-c9de9276	2025-12-10	கல்வியமைச்சின் மற்றுமோர்  அறிவிப்பு	https://www.tamilmirror.lk/செய்திகள்/கல்வியமைச்சின்-மற்றுமோர்-அறிவிப்பு/175-369365	ta	tamilmirrorlk	1765348144.0
lk_news	2025-12-10-virakesarilk-4a728c81	virakesarilk-4a728c81	2025-12-10	யாழில். 25 ஆயிரம் ரூபாய் நிதி உதவி தொகை பெறுவோரின் பெயர் பட்டியல் இன்று முதல் காட்சிப்படுத்தப்படும்!	https://www.virakesari.lk/article/232958	ta	virakesarilk	1765348140.0
lk_news	2025-12-10-virakesarilk-54d54f28	virakesarilk-54d54f28	2025-12-10	நெடுந்தீவு இறங்குதுறையில் படகுகள் கட்டியிருந்த கயிற்றில் தடுக்கி கடலில் விழுந்தவர் உயிரிழப்பு!	https://www.virakesari.lk/article/232960	ta	virakesarilk	1765348080.0
lk_news	2025-12-10-virakesarilk-43066d13	virakesarilk-43066d13	2025-12-10	பட்டாசு தொழிற்சாலையில் வெடிப்பு சம்பவம் ; இளைஞன் பலி!	https://www.virakesari.lk/article/232961	ta	virakesarilk	1765348020.0
lk_news	2025-12-10-lankadeepalk-512d3ab2	lankadeepalk-512d3ab2	2025-12-10	රස පරීක්ෂක නිලධාරීන් 50ක් කොන්ත්‍රාත් පදනමට	https://www.lankadeepa.lk/latest_news/රස-පරකෂක-නලධරන-50ක-කනතරත-පදනමට/1-685011	si	lankadeepalk	1765347833.0
lk_news	2025-12-10-lankadeepalk-4fd02eeb	lankadeepalk-4fd02eeb	2025-12-10	රට නගන අරමුදල⁣ට කෝටි 189ක් ලැබිලා	https://www.lankadeepa.lk/latest_news/රට-නගන-අරමදලට-කට-189ක-ලබල/1-685009	si	lankadeepalk	1765347468.0
lk_news	2025-12-10-virakesarilk-60b38aab	virakesarilk-60b38aab	2025-12-10	ரிதிமாலியத்த பிரதேச செயலகப் பிரிவுக்கு உட்பட்ட பகுதிகளில் மண்சரிவு அபாயம்!	https://www.virakesari.lk/article/232959	ta	virakesarilk	1765347360.0
lk_news	2025-12-10-tamilmirrorlk-e86a86e7	tamilmirrorlk-e86a86e7	2025-12-10	தொடர் பணியில்  முப்படையினரும் அரச நிறுவனங்களும்	https://www.tamilmirror.lk/செய்திகள்/தொடர்-பணியில்-முப்படையினரும்-அரச-நிறுவனங்களும்/175-369362	ta	tamilmirrorlk	1765347351.0
lk_news	2025-12-10-lankadeepalk-5507c43a	lankadeepalk-5507c43a	2025-12-10	බුර්කාවක් ඇඟලා නගරයේ සැරි සැරූ සිසුවා අත්අඩංගුවට	https://www.lankadeepa.lk/news/බරකවක-ඇඟල-නගරය-සර-සර-සසව-අතඅඩගවට/101-685007	si	lankadeepalk	1765347193.0
lk_news	2025-12-10-virakesarilk-d0ec4abc	virakesarilk-d0ec4abc	2025-12-10	அரசியல்வாதிகள் பின்பற்றுவதற்கு உதாரணத்தை வகுக்கும் மக்கள்	https://www.virakesari.lk/article/232957	ta	virakesarilk	1765347180.0
lk_news	2025-12-10-virakesarilk-3b6f30f6	virakesarilk-3b6f30f6	2025-12-10	யாழ். குறிகாட்டுவான் வீதி துரிதகதியில் புனரமைப்பு	https://www.virakesari.lk/article/232955	ta	virakesarilk	1765347120.0
lk_news	2025-12-10-lankadeepalk-74bac6fa	lankadeepalk-74bac6fa	2025-12-10	සූමෝ ශූරයෝ මව්බිමට එති	https://www.lankadeepa.lk/news/සම-ශරය-මවබමට-එත/101-685004	si	lankadeepalk	1765347092.0
lk_news	2025-12-10-virakesarilk-60233214	virakesarilk-60233214	2025-12-10	ஹட்டன் - நோர்டன் பிரதான வீதியின் பாலத்தை புனரமைக்கும் இராணுவம்!	https://www.virakesari.lk/article/232956	ta	virakesarilk	1765346820.0
lk_news	2025-12-10-tamilmirrorlk-23c6e2e9	tamilmirrorlk-23c6e2e9	2025-12-10	பெண்களுக்கு எதிரான வன்முறையை ஒழிக்க ஜோன் கீல்ஸ்  அறக்கட்டளை பங்களிப்பு	https://www.tamilmirror.lk/செய்திகள்/பெண்களுக்கு-எதிரான-வன்முறையை-ஒழிக்க-ஜோன்-கீல்ஸ்-அறக்கட்டளை-பங்களிப்பு/175-369361	ta	tamilmirrorlk	1765346712.0
lk_news	2025-12-10-tamilmirrorlk-8dd5a72b	tamilmirrorlk-8dd5a72b	2025-12-10	தந்தை எச்சரித்ததால் உயிரை மாய்த்த சிறுமி	https://www.tamilmirror.lk/மலையகம்/தந்தை-எச்சரித்ததால்-உயிரை-மாய்த்த-சிறுமி/76-369360	ta	tamilmirrorlk	1765346576.0
lk_news	2025-12-10-tamilmirrorlk-a4555fa5	tamilmirrorlk-a4555fa5	2025-12-10	“அணையின் மீது கனரக வாகனங்கள் செல்ல தடை”	https://www.tamilmirror.lk/மலையகம்/அணையின்-மீது-கனரக-வாகனங்கள்-செல்ல-தடை/76-369359	ta	tamilmirrorlk	1765346503.0
lk_news	2025-12-10-virakesarilk-4c17fcc0	virakesarilk-4c17fcc0	2025-12-10	அனர்த்தத்தால் பாதிக்கப்பட்ட வீடுகளுக்குள் நுழைந்து பெறுமதியான பொருட்களை திருடிய 12 பேர் கைது!	https://www.virakesari.lk/article/232954	ta	virakesarilk	1765346460.0
lk_news	2025-12-10-virakesarilk-b52de3de	virakesarilk-b52de3de	2025-12-10	யாழ். பல்கலையில் போதனைசாராப் பணியாளர் வெற்றிடங்களை நிரப்புமாறு கோரி தொழிற்சங்க சம்மேளனம் வேலைநிறுத்த போராட்டத்தில் ஈடுபடப்போவதாக எச்சரிக்கை	https://www.virakesari.lk/article/232951	ta	virakesarilk	1765346160.0
lk_news	2025-12-10-virakesarilk-9665124a	virakesarilk-9665124a	2025-12-10	வெளிநாட்டு மனிதாபிமான நிவாரண உதவிகளை ஒருங்கிணைக்க உயர்மட்ட தேசியக் குழு நியமனம்	https://www.virakesari.lk/article/232953	ta	virakesarilk	1765346100.0
lk_news	2025-12-10-lankadeepalk-86c02b59	lankadeepalk-86c02b59	2025-12-10	කොස්ගම වෙඩිතැබීමේ වෙඩික්කරු  ඇතුළු තුනක්  මාට්ටු	https://www.lankadeepa.lk/news/කසගම-වඩතබම-වඩකකර-ඇතළ-තනක-මටට/101-684997	si	lankadeepalk	1765346079.0
lk_news	2025-12-10-virakesarilk-a59076f3	virakesarilk-a59076f3	2025-12-10	டித்வா சூறாவளியால் சேதமடைந்த வர்த்தகங்கள் மற்றும் சொத்துக்களுக்கு இழப்பீடு வழங்க காப்புறுதி நிறுவனங்கள் தயார்!	https://www.virakesari.lk/article/232952	ta	virakesarilk	1765345980.0
lk_news	2025-12-10-adalk-18f2bb09	adalk-18f2bb09	2025-12-10	බෝගහපතන කන්දේ නාය යෑමක්	https://www.ada.lk/breaking_news/බෝගහපතන-කන්දේ-නාය-යෑමක්/11-420157	si	adalk	1765345702.0
lk_news	2025-12-10-tamilmirrorlk-a6d0e9f9	tamilmirrorlk-a6d0e9f9	2025-12-10	Re building Sri lanka  திட்டத்திற்கு  ரூ.1893 மில்லியன்  நிதி உதவி	https://www.tamilmirror.lk/செய்திகள்/Re-building-Sri-lanka-திட்டத்திற்கு-ரூ-1893-மில்லியன்-நிதி-உதவி/175-369358	ta	tamilmirrorlk	1765345633.0
lk_news	2025-12-10-lankadeepalk-3bc889be	lankadeepalk-3bc889be	2025-12-10	කොල්මලේ ජලාශ වේල්ල මතින් බර වාහන ධාවනය තහනම් කරයි	https://www.lankadeepa.lk/news/කලමල-ජලශ-වලල-මතන-බර-වහන-ධවනය-තහනම-කරය/101-684988	si	lankadeepalk	1765345342.0
lk_news	2025-12-10-lankadeepalk-3c852b5b	lankadeepalk-3c852b5b	2025-12-10	ඉන්දුනීසියාවේ තට්ටු හතක ගොඩනැගිල්ල ගින්නක්	https://www.lankadeepa.lk/news/ඉනදනසයව-තටට-හතක-ගඩනගලල-ගනනක/101-684987	si	lankadeepalk	1765345305.0
lk_news	2025-12-10-adalk-d678d991	adalk-d678d991	2025-12-10	හේමාස් හෝල්ඩින්ග්ස් සභාපති නියෝජ්‍ය සභාපති පුටුවට යයි	https://www.ada.lk/business/හේමාස්-හෝල්ඩින්ග්ස්-සභාපති-නියෝජ්‍ය-සභාපති-පුටුවට-යයි/7-420156	si	adalk	1765344911.0
lk_news	2025-12-10-lankadeepalk-168f7519	lankadeepalk-168f7519	2025-12-10	රට නගන අරමුදලට රට වටින් ආධාර	https://www.lankadeepa.lk/news/රට-නගන-අරමදලට-රට-වටන-ආධර/101-684986	si	lankadeepalk	1765344868.0
lk_news	2025-12-10-virakesarilk-694e2702	virakesarilk-694e2702	2025-12-10	பதுளை - போகஹபத்தன பகுதியில் மண்சரிவு!	https://www.virakesari.lk/article/232950	ta	virakesarilk	1765344480.0
lk_news	2025-12-10-tamilmirrorlk-1119f6e3	tamilmirrorlk-1119f6e3	2025-12-10	உலகின் மிக அழகான பெண்களின் பட்டியல்	https://www.tamilmirror.lk/விநோத-உலகம்/உலகின்-மிக-அழகான-பெண்களின்-பட்டியல்/53-369356	ta	tamilmirrorlk	1765343987.0
lk_news	2025-12-10-virakesarilk-5e73c51d	virakesarilk-5e73c51d	2025-12-10	ஹிக்கடுவையில் ரயிலுடன் மோதி கார் விபத்து!	https://www.virakesari.lk/article/232949	ta	virakesarilk	1765343760.0
lk_news	2025-12-10-virakesarilk-5576e358	virakesarilk-5576e358	2025-12-10	சுற்றுலாப் பயணிகள் அதிகம் வருகை தரும் தெமோதரையில் மண்சரிவு அபாயம்!	https://www.virakesari.lk/article/232948	ta	virakesarilk	1765343460.0
lk_news	2025-12-10-virakesarilk-4a6286a5	virakesarilk-4a6286a5	2025-12-10	மீட்சிக்குக் கைகொடுக்கும் சர்வதேசம் ; தோழனாகத் தலைமை தாங்கும் இந்தியா	https://www.virakesari.lk/article/232947	ta	virakesarilk	1765343280.0
