doc_type	doc_id	num	date_str	description	url_metadata	lang	newspaper_id	time_ut
lk_news	2025-10-31-lankadeepalk-e1a88f27	lankadeepalk-e1a88f27	2025-10-31	වාණිජ නීතිගත සංස්ථාවේ හිටපු සභාපතිට ඇප	https://www.lankadeepa.lk/news/වණජ-නතගත-සසථව-හටප-සභපතට-ඇප/101-682467	si	lankadeepalk	1761921705.0
lk_news	2025-10-31-virakesarilk-0815f907	virakesarilk-0815f907	2025-10-31	இரண்டாவது சர்வதேச ரி20  கிரிக்கெட் போட்டியில் இந்தியாவை 4 விக்கெட்களால் அவுஸ்திரேலியா வென்றது	https://www.virakesari.lk/article/229194	ta	virakesarilk	1761919560.0
lk_news	2025-10-31-tamilmirrorlk-564b0ba1	tamilmirrorlk-564b0ba1	2025-10-31	பஸ் விபத்தில் நால்வர் மரணம்	https://www.tamilmirror.lk/செய்திகள்/பஸ்-விபத்தில்-நால்வர்-மரணம்/175-367140	ta	tamilmirrorlk	1761918645.0
lk_news	2025-10-31-lankadeepalk-c12e9519	lankadeepalk-c12e9519	2025-10-31	නියෝජ්‍ය කතානායකත් මැතිසබේ තෙල් එපා කියයි	https://www.lankadeepa.lk/news/නයජය-කතනයකත-මතසබ-තල-එප-කයය/101-682466	si	lankadeepalk	1761917347.0
lk_news	2025-10-31-lankadeepalk-176d8e69	lankadeepalk-176d8e69	2025-10-31	සල්ලි අරන් වගා නොකරන ගොවීන්ගේ සහනාධාර කපයි	https://www.lankadeepa.lk/news/සලල-අරන-වග-නකරන-ගවනග-සහනධර-කපය/101-682465	si	lankadeepalk	1761917130.0
lk_news	2025-10-31-virakesarilk-228bb59f	virakesarilk-228bb59f	2025-10-31	மெஸன்ஜர் - திரைப்பட விமர்சனம்	https://www.virakesari.lk/article/229192	ta	virakesarilk	1761916260.0
lk_news	2025-10-31-virakesarilk-f0591463	virakesarilk-f0591463	2025-10-31	தடை அதை உடை - திரைப்பட விமர்சனம்	https://www.virakesari.lk/article/229191	ta	virakesarilk	1761916080.0
lk_news	2025-10-31-virakesarilk-d752868a	virakesarilk-d752868a	2025-10-31	கார்த்திகையில் மரநடுகை தேசத்தை மாத்திரமல்ல, தமிழ்த் தேசியத்தின் ஆன்மாவையும் குளிரச்செய்யும் - ஐங்கரநேசன்	https://www.virakesari.lk/article/229190	ta	virakesarilk	1761915900.0
lk_news	2025-10-31-virakesarilk-6237cb2d	virakesarilk-6237cb2d	2025-10-31	ஆர்யன் - திரைப்பட விமர்சனம்	https://www.virakesari.lk/article/229189	ta	virakesarilk	1761915840.0
lk_news	2025-10-31-virakesarilk-feb7a1ed	virakesarilk-feb7a1ed	2025-10-31	டிசம்பர் 6இல் குளோபல் வர்த்தக மாநாடு ஆரம்பம் - அவுஸ்திரேலியாவில் இந்திய நிறுவனங்களுக்கு மானியம்	https://www.virakesari.lk/article/229187	ta	virakesarilk	1761915420.0
lk_news	2025-10-31-virakesarilk-85b7f632	virakesarilk-85b7f632	2025-10-31	ஆண்பாவம் பொல்லாதது - திரைப்பட விமர்சனம்	https://www.virakesari.lk/article/229188	ta	virakesarilk	1761915420.0
lk_news	2025-10-31-virakesarilk-ac6e5dd6	virakesarilk-ac6e5dd6	2025-10-31	அரசாங்கத்தின் பலவீனமான கொள்கைகளே திட்டமிட்ட குற்றச் செயல்களில் ஈடுபடுவோர் சமூகத்தை ஆக்கிரமிக்க காரணம் - எதிர்க்கட்சித் தலைவர் சஜித் பிரேமதாச	https://www.virakesari.lk/article/229185	ta	virakesarilk	1761914340.0
lk_news	2025-10-31-lankadeepalk-35900755	lankadeepalk-35900755	2025-10-31	යාපන පුස්තකාල වහලයෙන් තවත් අවි ආයුධ	https://www.lankadeepa.lk/latest_news/යපන-පසතකල-වහලයන-තවත-අව-ආයධ/1-682464	si	lankadeepalk	1761913750.0
lk_news	2025-10-31-virakesarilk-5c4791ef	virakesarilk-5c4791ef	2025-10-31	ராணி சிரிகிட் கிடியாகராவுக்கு அஞ்சலி  செலுத்தினார் ரணில் விக்கிரமசிங்க	https://www.virakesari.lk/article/229182	ta	virakesarilk	1761913740.0
lk_news	2025-10-31-virakesarilk-5d90059d	virakesarilk-5d90059d	2025-10-31	மீனவப் பிரச்சினைகளுக்கான தீர்வினை முன்னோக்கிய மீனவ மாநாடு - ரவிகரன் பங்கேற்பு	https://www.virakesari.lk/article/229183	ta	virakesarilk	1761913320.0
lk_news	2025-10-31-lankadeepalk-3861aa7c	lankadeepalk-3861aa7c	2025-10-31	මන්ත්‍රී අර්චුනාගේ සූම් කතාවට සභාවේ සිනා	https://www.lankadeepa.lk/news/මනතර-අරචනග-සම-කතවට-සභව-සන/101-682463	si	lankadeepalk	1761912496.0
lk_news	2025-10-31-virakesarilk-d2a295c0	virakesarilk-d2a295c0	2025-10-31	வெளிநாட்டு முதலீடுகளுக்கான ஜனாதிபதியின் விசேட பிரதிநிதியாக மேல் மாகாண ஆளுநர் ஹனீப் யூசுப் நியமனம்	https://www.virakesari.lk/article/229181	ta	virakesarilk	1761912240.0
lk_news	2025-10-31-lankadeepalk-635e6c73	lankadeepalk-635e6c73	2025-10-31	හෙද පුරප්පාඩු ඉක්මනින් පුරවනවා	https://www.lankadeepa.lk/news/හද-පරපපඩ-ඉකමනන-පරවනව/101-682462	si	lankadeepalk	1761911477.0
lk_news	2025-10-31-virakesarilk-787bb0dc	virakesarilk-787bb0dc	2025-10-31	பாராளுமன்ற ஒத்துழைப்பை வலுப்படுத்தும் வகையில் பாராளுமன்றத் தூதுக் குழு ஐக்கிய இராச்சியத்திற்கு உத்தியோகபூர்வ விஜயம்	https://www.virakesari.lk/article/229178	ta	virakesarilk	1761911340.0
lk_news	2025-10-31-virakesarilk-d614f9aa	virakesarilk-d614f9aa	2025-10-31	அரசு ஒசுசலவின் 67 வது கிளை மட்டக்களப்பில் திறந்து வைப்பு!	https://www.virakesari.lk/article/229175	ta	virakesarilk	1761910980.0
lk_news	2025-10-31-virakesarilk-da86c927	virakesarilk-da86c927	2025-10-31	எதிர்க்கட்சி எம்.பிக்களின் பாதுகாப்பு தொடர்பில் சபாநாயகரின் தலைமையில் கலந்துரையாடல்	https://www.virakesari.lk/article/229176	ta	virakesarilk	1761910560.0
lk_news	2025-10-31-lankadeepalk-25e59340	lankadeepalk-25e59340	2025-10-31	විදෙස් ආයෝජනවලට ජනපති විශේෂ නියෝජිතයෙක් පත් වෙයි	https://www.lankadeepa.lk/latest_news/වදස-ආයජනවලට-ජනපත-වශෂ-නයජතයක-පත-වය/1-682461	si	lankadeepalk	1761910530.0
lk_news	2025-10-31-virakesarilk-9194c6ab	virakesarilk-9194c6ab	2025-10-31	துல்கர் சல்மான் நடிக்கும் 'காந்தா' படத்தின் அப்டேட்ஸ்	https://www.virakesari.lk/article/229177	ta	virakesarilk	1761910320.0
lk_news	2025-10-31-virakesarilk-433c5b30	virakesarilk-433c5b30	2025-10-31	இந்திய நிதியுதவியில் பொலன்னறுவை நிர்மாணிக்கப்பட்ட பல்லின மும்மொழிக் கல்விப் பாடசாலை திறப்பு	https://www.virakesari.lk/article/229173	ta	virakesarilk	1761910080.0
lk_news	2025-10-31-lankadeepalk-0cf28d84	lankadeepalk-0cf28d84	2025-10-31	තායිලන්ත රැජනගේ අභාවයට සොව පළ කරන්න රනිල් යයි	https://www.lankadeepa.lk/latest_news/තයලනත-රජනග-අභවයට-සව-පළ-කරනන-රනල-යය/1-682460	si	lankadeepalk	1761909914.0
lk_news	2025-10-31-virakesarilk-0114ba0a	virakesarilk-0114ba0a	2025-10-31	வெளிநாட்டில் வேலை வாய்ப்பு பெற்றுத் தருவதாக கூறி பண மோசடி செய்தவருக்கு விளக்கமறியல் நீடிப்பு!	https://www.virakesari.lk/article/229174	ta	virakesarilk	1761909840.0
lk_news	2025-10-31-lankadeepalk-38dfe02e	lankadeepalk-38dfe02e	2025-10-31	එස්.එස්.පීලා පහකට ඩී.අයි.ජී පුටු	https://www.lankadeepa.lk/latest_news/එස-එස-පල-පහකට-ඩ-අය-ජ-පට/1-682459	si	lankadeepalk	1761909626.0
lk_news	2025-10-31-virakesarilk-f023ff84	virakesarilk-f023ff84	2025-10-31	ஐ.தே.க மற்றும் ஐ.ம.ச. இணைப்பு விரைவில் – அகிலவிராஜ் காரியவசம்	https://www.virakesari.lk/article/229171	ta	virakesarilk	1761909600.0
lk_news	2025-10-31-virakesarilk-7077e631	virakesarilk-7077e631	2025-10-31	யாழ். மாவட்ட காணிப் பயன்பாட்டுக் குழுக் கூட்டம்	https://www.virakesari.lk/article/229166	ta	virakesarilk	1761909540.0
lk_news	2025-10-31-virakesarilk-3564a7c8	virakesarilk-3564a7c8	2025-10-31	இலங்கையில் வரலாற்றிலேயே அதிக தாதியர்கள் ஆட்சேர்ப்பு – 4,141 பேர் பணியில் இணைப்பு!	https://www.virakesari.lk/article/229169	ta	virakesarilk	1761909540.0
lk_news	2025-10-31-virakesarilk-f2e3cfea	virakesarilk-f2e3cfea	2025-10-31	இந்தியாவின் முதல் தர Cavin’s Milkshake இலங்கையில் அறிமுகம்	https://www.virakesari.lk/article/229164	ta	virakesarilk	1761909480.0
lk_news	2025-10-31-virakesarilk-60acc3ef	virakesarilk-60acc3ef	2025-10-31	41 மில்லியன் ரூபாய்க்கும் அதிக  மதிப்புள்ள கேரள கஞ்சாவுடன் இருவர் கைது!	https://www.virakesari.lk/article/229162	ta	virakesarilk	1761909420.0
lk_news	2025-10-31-virakesarilk-02969d94	virakesarilk-02969d94	2025-10-31	டிஜிட்டல் மயமாக்கல் மற்றும் AI தொழில்நுட்பம் குறித்து வட மாகாணத்தில் உள்ள அரச அதிகாரிகளுக்கு விழிப்புணர்வு ஏற்படுத்தும் செயலமர்வு	https://www.virakesari.lk/article/229163	ta	virakesarilk	1761909420.0
lk_news	2025-10-31-virakesarilk-e63ceff9	virakesarilk-e63ceff9	2025-10-31	வடக்கு மாகாணத்தில் மீன்பிடி அபிவிருத்தி தொடர்பாக விசேட கலந்துரையாடல்	https://www.virakesari.lk/article/229161	ta	virakesarilk	1761909360.0
lk_news	2025-10-31-virakesarilk-f689eeda	virakesarilk-f689eeda	2025-10-31	அடுத்த ஆண்டு மார்ச் மாதத்தில் வெளியாகும் 'ராக்கிங் ஸ்டார்' யாஷின் 'டாக்ஸிக் : எ ஃபேரி டேல் ஃபார் குரோன்- அப்ஸ்'	https://www.virakesari.lk/article/229170	ta	virakesarilk	1761909300.0
lk_news	2025-10-31-virakesarilk-0d5b82cd	virakesarilk-0d5b82cd	2025-10-31	இலஞ்சம் வாங்கிய திருகோணமலை குச்சவெளி பிரதேச தவிசாளர் கைது	https://www.virakesari.lk/article/229168	ta	virakesarilk	1761909000.0
lk_news	2025-10-31-lankadeepalk-cb1bc89e	lankadeepalk-cb1bc89e	2025-10-31	මන්ත්‍රීලා 56ක් ජනපති අරමුදලෙනුත් කෝටි 13ක් ඇඳලා	https://www.lankadeepa.lk/latest_news/මනතරල-56ක-ජනපත-අරමදලනත-කට-13ක-ඇඳල/1-682458	si	lankadeepalk	1761908768.0
lk_news	2025-10-31-virakesarilk-3d9d04f0	virakesarilk-3d9d04f0	2025-10-31	சுற்றுலாப் பயணிகளின் எண்ணிக்கை அதிகரிப்பு!	https://www.virakesari.lk/article/229167	ta	virakesarilk	1761908760.0
lk_news	2025-10-31-lankadeepalk-f97bd31b	lankadeepalk-f97bd31b	2025-10-31	ලලිත් පතිනායක පරිපාලන තනතුරින් ඉවතට?	https://www.lankadeepa.lk/news/ලලත-පතනයක-පරපලන-තනතරන-ඉවතට/101-682457	si	lankadeepalk	1761908760.0
lk_news	2025-10-31-lankadeepalk-acc9b7e7	lankadeepalk-acc9b7e7	2025-10-31	සීතාවක ආනමඩුව පුංචි සභා අවුල ලිහීම නීතිපතිට	https://www.lankadeepa.lk/latest_news/සතවක-ආනමඩව-පච-සභ-අවල-ලහම-නතපතට/1-682456	si	lankadeepalk	1761908498.0
lk_news	2025-10-31-virakesarilk-13625a8d	virakesarilk-13625a8d	2025-10-31	நடிகை கீதா கைலாசம் நடிக்கும் 'அங்கம்மாள்'	https://www.virakesari.lk/article/229165	ta	virakesarilk	1761908400.0
lk_news	2025-10-31-lankadeepalk-66f5db00	lankadeepalk-66f5db00	2025-10-31	බැකෝ සමන්ගේ බිරිඳට ඇප	https://www.lankadeepa.lk/latest_news/බක-සමනග-බරඳට-ඇප/1-682455	si	lankadeepalk	1761908391.0
lk_news	2025-10-31-lankadeepalk-844920aa	lankadeepalk-844920aa	2025-10-31	දත්ත ආරක්ෂණ පනත් කෙටුම්පතට කථානායක සහතිකය	https://www.lankadeepa.lk/latest_news/දතත-ආරකෂණ-පනත-කටමපතට-කථනයක-සහතකය/1-682454	si	lankadeepalk	1761907776.0
lk_news	2025-10-31-virakesarilk-5690caa9	virakesarilk-5690caa9	2025-10-31	நடிகர் ராஜேஷ் துருவா நடிக்கும் 'பீற்றர்' படத்தின் டீசர் வெளியீடு	https://www.virakesari.lk/article/229159	ta	virakesarilk	1761907620.0
lk_news	2025-10-31-lankadeepalk-f1dd7bc3	lankadeepalk-f1dd7bc3	2025-10-31	උතුරේ නිලධරයන්ටත් AI උගන්වයි	https://www.lankadeepa.lk/latest_news/උතර-නලධරයනටත-AI-උගනවය/1-682453	si	lankadeepalk	1761907612.0
lk_news	2025-10-31-adalk-b56b470b	adalk-b56b470b	2025-10-31	ඇල්ලේ අනතුරට පත්වූ බස් රථයේ චැසි අංකය වෙනස් කරලා	https://www.ada.lk/breaking_news/ඇල්ලේ-අනතුරට-පත්වූ-බස්-රථයේ-චැසි-අංකය-වෙනස්-කරලා/11-419438	si	adalk	1761907597.0
lk_news	2025-10-31-virakesarilk-d38aa4c6	virakesarilk-d38aa4c6	2025-10-31	கடற்படையின் 75வது ஆண்டு நிறைவை முன்னிட்டு நடமாடும் பல் மருத்துவமனை சிகிச்சை!	https://www.virakesari.lk/article/229158	ta	virakesarilk	1761907560.0
lk_news	2025-10-31-virakesarilk-7c3fbd8e	virakesarilk-7c3fbd8e	2025-10-31	“கணேமுல்ல சஞ்சீவ” படுகொலை ; இஷாரா செவ்வந்திக்கு உதவிய சட்டத்தரணி தொடர்ந்து பொலிஸ் தடுப்பு காவலில் வைத்து விசாரணை!	https://www.virakesari.lk/article/229156	ta	virakesarilk	1761907080.0
lk_news	2025-10-31-virakesarilk-29313dbb	virakesarilk-29313dbb	2025-10-31	முதலாம் திகதி முதல் பொலித்தீன் பைகளுக்கு கட்டணம்	https://www.virakesari.lk/article/229133	ta	virakesarilk	1761907020.0
lk_news	2025-10-31-virakesarilk-bd15e162	virakesarilk-bd15e162	2025-10-31	பாடசாலை மாணவர்களை சபரிமலை புனித யாத்திரைக்கு அனுப்பும் பெற்றோர்கள், குருசாமிகளின் கவனத்துக்கு...	https://www.virakesari.lk/article/229152	ta	virakesarilk	1761906780.0
lk_news	2025-10-31-virakesarilk-6f7a63b2	virakesarilk-6f7a63b2	2025-10-31	என் உறவுக்கார சகோதரிக்கு எதிரான 90 இலட்சம் ரூபாய் மோசடி குற்றச்சாட்டு பொய்யானது – அகிலவிராஜ் காரியவசம்	https://www.virakesari.lk/article/229151	ta	virakesarilk	1761906660.0
lk_news	2025-10-31-virakesarilk-1b6ea449	virakesarilk-1b6ea449	2025-10-31	யாழ்.பல்கலையில் இருந்து துப்பாக்கியும் மீட்பு	https://www.virakesari.lk/article/229153	ta	virakesarilk	1761906600.0
lk_news	2025-10-31-virakesarilk-34ba27be	virakesarilk-34ba27be	2025-10-31	வடக்கில் பொருளாதாரத் திறனை உருவாக்கும் நோக்கில் “ வடக்கு முதலீட்டு மாநாடு 2026 ”	https://www.virakesari.lk/article/229154	ta	virakesarilk	1761906120.0
lk_news	2025-10-31-lankadeepalk-d4e77c3a	lankadeepalk-d4e77c3a	2025-10-31	රේගුව බදු කඩයිම පන්නයි: ට්‍රිලියන දෙකක ආදායමක්	https://www.lankadeepa.lk/latest_news/රගව-බද-කඩයම-පනනය-ටරලයන-දකක-ආදයමක/1-682452	si	lankadeepalk	1761905960.0
lk_news	2025-10-31-lankadeepalk-c2ef3ea7	lankadeepalk-c2ef3ea7	2025-10-31	මන්ත්‍රීලාගේ රැකවල් ඉවත් කළේ ආණ්ඩුවේ තීරණයක් උඩ	https://www.lankadeepa.lk/latest_news/මනතරලග-රකවල-ඉවත-කළ-ආණඩව-තරණයක-උඩ/1-682451	si	lankadeepalk	1761905515.0
lk_news	2025-10-31-lankadeepalk-6cd89ccd	lankadeepalk-6cd89ccd	2025-10-31	ජනාධිපති අත්සනින් දියවඩන නිලමේ පත්කරන්න ජේ.ආර්. දැගලූ හැටි	https://www.lankadeepa.lk/features/ජනධපත-අතසනන-දයවඩන-නලම-පතකරනන-ජ-ආර-දගල-හට/2-682450	si	lankadeepalk	1761905347.0
lk_news	2025-10-31-virakesarilk-dd878186	virakesarilk-dd878186	2025-10-31	இஷாரா செவ்வந்திக்கு உதவிய சட்டத்தரணிக்கும் பாதாள உலக கும்பலைச் சேர்ந்தவர்களுக்கும் இடையில் நெருங்கிய தொடர்பு?	https://www.virakesari.lk/article/229148	ta	virakesarilk	1761905160.0
lk_news	2025-10-31-lankadeepalk-465c978c	lankadeepalk-465c978c	2025-10-31	හෙට ඉඳන් පොලිතින් බෑග් නොමිලේ නෑ	https://www.lankadeepa.lk/latest_news/හට-ඉඳන-පලතන-බග-නමල-න/1-682449	si	lankadeepalk	1761905003.0
lk_news	2025-10-31-lankadeepalk-fdd98ba2	lankadeepalk-fdd98ba2	2025-10-31	ආණ්ඩුවේ වෙනස කොතැනද?	https://www.lankadeepa.lk/friday/ආණඩව-වනස-කතනද/122-682448	si	lankadeepalk	1761904849.0
lk_news	2025-10-31-lankadeepalk-1d941a5c	lankadeepalk-1d941a5c	2025-10-31	කුච්චවෙිලි ප්‍රා.සභාපති අල්ලස් දැලේ	https://www.lankadeepa.lk/latest_news/කචචවල-පර-සභපත-අලලස-දල/1-682447	si	lankadeepalk	1761904817.0
lk_news	2025-10-31-lankadeepalk-04c61811	lankadeepalk-04c61811	2025-10-31	මතට එරෙහි වෙන්න කොරියාවෙනුත් උදව්වක්	https://www.lankadeepa.lk/latest_news/මතට-එරහ-වනන-කරයවනත-උදවවක/1-682446	si	lankadeepalk	1761904702.0
lk_news	2025-10-31-virakesarilk-7525d4be	virakesarilk-7525d4be	2025-10-31	பாராளுமன்ற உறுப்பினர்கள் பாதுகாப்புக்கு விசேட நடவடிக்கை - பொலிஸ் மா அதிபர்	https://www.virakesari.lk/article/229149	ta	virakesarilk	1761904620.0
lk_news	2025-10-31-tamilmirrorlk-0775f36e	tamilmirrorlk-0775f36e	2025-10-31	கலவானையில் துப்பாக்கி சூடு ஒருவர் காயம்	https://www.tamilmirror.lk/மலையகம்/கலவானையில்-துப்பாக்கி-சூடு-ஒருவர்-காயம்/76-367138	ta	tamilmirrorlk	1761904102.0
lk_news	2025-10-31-tamilmirrorlk-43641876	tamilmirrorlk-43641876	2025-10-31	STC முன்னாள் தலைவர் கைது	https://www.tamilmirror.lk/செய்திகள்/STC-முன்னாள்-தலைவர்-கைது/175-367137	ta	tamilmirrorlk	1761903942.0
lk_news	2025-10-31-tamilmirrorlk-991594e9	tamilmirrorlk-991594e9	2025-10-31	குச்சவெளி பிரதேச சபைத்தலைவர் கைது	https://www.tamilmirror.lk/செய்திகள்/குச்சவெளி-பிரதேச-சபைத்தலைவர்-கைது/175-367136	ta	tamilmirrorlk	1761903778.0
lk_news	2025-10-31-adalk-2d57a330	adalk-2d57a330	2025-10-31	රෙගුලාසිවලට පටහැනිව මන්ත්‍රිවරු 56කට රු. කෝටි 13ක් දීලා	https://www.ada.lk/breaking_news/රෙගුලාසිවලට-පටහැනිව-මන්ත්‍රිවරු-56කට-රු--කෝටි-13ක්-දීලා/11-419437	si	adalk	1761903183.0
lk_news	2025-10-31-virakesarilk-48ab2b4d	virakesarilk-48ab2b4d	2025-10-31	“பெக்கோ சமனின்” மனைவிக்கு பிணை!	https://www.virakesari.lk/article/229145	ta	virakesarilk	1761902940.0
lk_news	2025-10-31-adalk-7812defe	adalk-7812defe	2025-10-31	කලවාන වෙඩි තැබිමකින් දෙදෙනෙකුට තුවාල	https://www.ada.lk/breaking_news/කලවාන-වෙඩි-තැබිමකින්-දෙදෙනෙකුට-තුවාල/11-419436	si	adalk	1761902708.0
lk_news	2025-10-31-virakesarilk-8579354b	virakesarilk-8579354b	2025-10-31	அநுராதபுரத்தில் ஒருவர் கைது!	https://www.virakesari.lk/article/229144	ta	virakesarilk	1761902580.0
lk_news	2025-10-31-lankadeepalk-731cc691	lankadeepalk-731cc691	2025-10-31	විදෙස් රැකියා පෙන්වා සල්ලි ගරන කල්ලි වලට වැඩ වරදී	https://www.lankadeepa.lk/news/වදස-රකය-පනව-සලල-ගරන-කලල-වලට-වඩ-වරද/101-682445	si	lankadeepalk	1761902137.0
lk_news	2025-10-31-adalk-bd30d702	adalk-bd30d702	2025-10-31	නෙවිල්ට ඇප	https://www.ada.lk/breaking_news/නෙවිල්ට-ඇප/11-419435	si	adalk	1761902000.0
lk_news	2025-10-31-lankadeepalk-7e2a48d0	lankadeepalk-7e2a48d0	2025-10-31	ශිත සෘතුවෙන් බේරෙන්න පෝලන්තයෙන් ලංකාවට	https://www.lankadeepa.lk/latest_news/ශත-සතවන-බරනන-පලනතයන-ලකවට/1-682444	si	lankadeepalk	1761901505.0
lk_news	2025-10-31-lankadeepalk-1409dc63	lankadeepalk-1409dc63	2025-10-31	කලවානේ වෙඩි තැබීමකින් දෙකකට තුවාල	https://www.lankadeepa.lk/latest_news/කලවන-වඩ-තබමකන-දකකට-තවල/1-682443	si	lankadeepalk	1761900990.0
lk_news	2025-10-31-lankadeepalk-81a8ccc1	lankadeepalk-81a8ccc1	2025-10-31	’නව නිපැයුම් ප්‍රවර්ධනය කරනවා’	https://www.lankadeepa.lk/latest_news/නව-නපයම-පරවරධනය-කරනව/1-682442	si	lankadeepalk	1761900737.0
lk_news	2025-10-31-virakesarilk-6e8feb10	virakesarilk-6e8feb10	2025-10-31	இன்றைய நாணய மாற்று விகிதம்	https://www.virakesari.lk/article/229141	ta	virakesarilk	1761900660.0
lk_news	2025-10-31-adalk-10e9c3e0	adalk-10e9c3e0	2025-10-31	වාණිජ සංස්ථාවේ හිටපු සභාපති අත්අඩංගුවට	https://www.ada.lk/breaking_news/වාණිජ-සංස්ථාවේ-හිටපු-සභාපති-අත්අඩංගුවට/11-419434	si	adalk	1761900605.0
lk_news	2025-10-31-virakesarilk-bf9db520	virakesarilk-bf9db520	2025-10-31	கலவான பகுதியில் துப்பாக்கிச் சூடு : இருவர் காயம்	https://www.virakesari.lk/article/229140	ta	virakesarilk	1761900600.0
