doc_type	doc_id	num	date_str	description	url_metadata	lang	newspaper_id	time_ut
lk_news	2025-10-20-tamilmirrorlk-ca2dc65e	tamilmirrorlk-ca2dc65e	2025-10-20	தென் மாகாண வாகன ஓட்டிகளுக்கு விசேட அறிவித்தல்	https://www.tamilmirror.lk/செய்திகள்/தென்-மாகாண-வாகன-ஓட்டிகளுக்கு-விசேட-அறிவித்தல்/175-366541	ta	tamilmirrorlk	1760940500.0
lk_news	2025-10-20-tamilmirrorlk-f1704482	tamilmirrorlk-f1704482	2025-10-20	இறால் தொட்டியில் விழுந்த இளைஞன் மரணம்	https://www.tamilmirror.lk/செய்திகள்/இறால்-தொட்டியில்-விழுந்த-இளைஞன்-மரணம்/175-366540	ta	tamilmirrorlk	1760940391.0
lk_news	2025-10-20-tamilmirrorlk-428c1d64	tamilmirrorlk-428c1d64	2025-10-20	8 பிரதேசங்களுக்கு வௌ்ளப்பெருக்கு எச்சரிக்கை	https://www.tamilmirror.lk/செய்திகள்/8-பிரதேசங்களுக்கு-வௌ்ளப்பெருக்கு-எச்சரிக்கை/175-366539	ta	tamilmirrorlk	1760940216.0
lk_news	2025-10-20-tamilmirrorlk-38a263e2	tamilmirrorlk-38a263e2	2025-10-20	தீபாவளி பண்டிகையால்  ஜொலித்தது அயோத்தி	https://www.tamilmirror.lk/செய்திகள்/தீபாவளி-பண்டிகையால்-ஜொலித்தது-அயோத்தி/175-366538	ta	tamilmirrorlk	1760940009.0
lk_news	2025-10-20-virakesarilk-6f7bb21c	virakesarilk-6f7bb21c	2025-10-20	பொல்கொல்லை நீர்த்தேக்கத்தின் மூன்று வான்கதவுகள் திறப்பு	https://www.virakesari.lk/article/228193	ta	virakesarilk	1760939940.0
lk_news	2025-10-20-lankadeepalk-cace093f	lankadeepalk-cace093f	2025-10-20	සජබ එජාප දීගයේ වාර්තාව අනිද්දා	https://www.lankadeepa.lk/news/සජබ-එජප-දගය-වරතව-අනදද/101-681669	si	lankadeepalk	1760939551.0
lk_news	2025-10-20-lankadeepalk-04971619	lankadeepalk-04971619	2025-10-20	පෙදෙස් අටකට ගංවතුර අනතුරු ඇඟවීම්	https://www.lankadeepa.lk/news/පදස-අටකට-ගවතර-අනතර-ඇඟවම/101-681668	si	lankadeepalk	1760939391.0
lk_news	2025-10-20-virakesarilk-4ef68773	virakesarilk-4ef68773	2025-10-20	வேன் - பஸ் மோதி விபத்து ; பலர் காயம்!	https://www.virakesari.lk/article/228192	ta	virakesarilk	1760939100.0
lk_news	2025-10-20-tamilmirrorlk-63788c86	tamilmirrorlk-63788c86	2025-10-20	வெளிமாவட்டங்களிலும் ஒரு நாள் ஓட்டுநர் உரிம சேவை	https://www.tamilmirror.lk/செய்திகள்/வெளிமாவட்டங்களிலும்-ஒரு-நாள்-ஓட்டுநர்-உரிம-சேவை/175-366537	ta	tamilmirrorlk	1760938924.0
lk_news	2025-10-20-lankadeepalk-3b774280	lankadeepalk-3b774280	2025-10-20	රජයේ  ආයතනවල  හිතුමතේ පඩි වැඩි කිරීම් බඳවාගැනීම් බෑ	https://www.lankadeepa.lk/latest_news/රජය-ආයතනවල-හතමත-පඩ-වඩ-කරම-බඳවගනම-බ/1-681667	si	lankadeepalk	1760938785.0
lk_news	2025-10-20-adalk-c4e4e35f	adalk-c4e4e35f	2025-10-20	පාකිස්තානය වෙනුවෙන් 38 හැවිරිදි ක්‍රීඩකයෙකුට ටෙස්ට් වරම්	https://www.ada.lk/sports/පාකිස්තානය-වෙනුවෙන්-38-හැවිරිදි-ක්‍රීඩකයෙකුට-ටෙස්ට්-වරම්/9-419204	si	adalk	1760938733.0
lk_news	2025-10-20-virakesarilk-6da9a801	virakesarilk-6da9a801	2025-10-20	பிரான்ஸ் லூவ்ரு அருங்காட்சியகத்தில் கொள்ளை : நெப்போலியனின் மற்றும் அரச கிரீட நகைகள் மாயம் !	https://www.virakesari.lk/article/228191	ta	virakesarilk	1760938680.0
lk_news	2025-10-20-lankadeepalk-05acd14e	lankadeepalk-05acd14e	2025-10-20	ඉස්සන් ටැංකියට වැටී තරුණයා මරුට	https://www.lankadeepa.lk/latest_news/ඉසසන-ටකයට-වට-තරණය-මරට/1-681666	si	lankadeepalk	1760938617.0
lk_news	2025-10-20-virakesarilk-16da6dc5	virakesarilk-16da6dc5	2025-10-20	ஆப்கானிஸ்தான் - பாகிஸ்தான் உடனடி போர் நிறுத்தம் : கட்டார் மத்தியஸ்தத்தில் அமைதி ஒப்பந்தம்!	https://www.virakesari.lk/article/228189	ta	virakesarilk	1760938320.0
lk_news	2025-10-20-virakesarilk-49677281	virakesarilk-49677281	2025-10-20	9 மாவட்டங்களுக்கு மண்சரிவு அபாய எச்சரிக்கை!	https://www.virakesari.lk/article/228190	ta	virakesarilk	1760938200.0
lk_news	2025-10-20-adalk-b4d69eb9	adalk-b4d69eb9	2025-10-20	ගිණිකොණ වායුගෝලයත්  කැළඹෙයි, වැස්ස වැඩිවෙයි	https://www.ada.lk/breaking_news/ගිණිකොණ-වායුගෝලයත්--කැළඹෙයි--වැස්ස-වැඩිවෙයි/11-419203	si	adalk	1760937437.0
lk_news	2025-10-20-virakesarilk-b693589d	virakesarilk-b693589d	2025-10-20	படுகொலை செய்யப்பட்ட ஊடகவியலாளர் நிமலராஜனின் 25வது ஆண்டு நினைவேந்தல் யாழில்!	https://www.virakesari.lk/article/228187	ta	virakesarilk	1760936940.0
lk_news	2025-10-20-lankadeepalk-47d4d15c	lankadeepalk-47d4d15c	2025-10-20	බාල බෙහෙත් පුච්චන්නත්  කෝටි දොළහක් පුදලා	https://www.lankadeepa.lk/news/බල-බහත-පචචනනත-කට-දළහක-පදල/101-681664	si	lankadeepalk	1760936806.0
lk_news	2025-10-20-lankadeepalk-e00e7753	lankadeepalk-e00e7753	2025-10-20	දන්ත වෛද්‍ය සංගමයේ නව සභාපති පත්වේ	https://www.lankadeepa.lk/news/දනත-වදය-සගමය-නව-සභපත-පතව/101-681663	si	lankadeepalk	1760936688.0
lk_news	2025-10-20-virakesarilk-9bfffcd2	virakesarilk-9bfffcd2	2025-10-20	ஹொங்கொங்கில் சரக்கு விமானம் கடலில் விழுந்து விபத்து : 2 பேர் பலி	https://www.virakesari.lk/article/228185	ta	virakesarilk	1760935980.0
lk_news	2025-10-20-virakesarilk-ad2ccaa4	virakesarilk-ad2ccaa4	2025-10-20	இந்திய சுற்றுலாப் பயணிகள் கட்டாயம் யாழ்ப்பாணத்திற்கு வர வேண்டும் - நடிகர் தலைவாசல் விஜய்	https://www.virakesari.lk/article/228183	ta	virakesarilk	1760935560.0
lk_news	2025-10-20-lankadeepalk-23c10a8c	lankadeepalk-23c10a8c	2025-10-20	රියදුරු බලපත්‍ර එක් දින සේවාව පිටපළාත්වලටත්	https://www.lankadeepa.lk/latest_news/රයදර-බලපතර-එක-දන-සවව-පටපළතවලටත/1-681662	si	lankadeepalk	1760935470.0
lk_news	2025-10-20-lankadeepalk-1e3dd891	lankadeepalk-1e3dd891	2025-10-20	කෝටි 10ක මත්පෙති වවිනියාවේදී අල්ලයි	https://www.lankadeepa.lk/latest_news/කට-10ක-මතපත-වවනයවද-අලලය/1-681661	si	lankadeepalk	1760935271.0
lk_news	2025-10-20-virakesarilk-c8364949	virakesarilk-c8364949	2025-10-20	பிரதேச சபை உறுப்பினரின் வீட்டிற்கு தீ வைப்பு!	https://www.virakesari.lk/article/228182	ta	virakesarilk	1760934600.0
lk_news	2025-10-20-virakesarilk-5d1f082f	virakesarilk-5d1f082f	2025-10-20	“கம்பஹா பபா” வழங்கிய தகவலுக்கமைய கால்வாயிலிருந்து தோட்டாக்கள் கைப்பற்றல்!	https://www.virakesari.lk/article/228180	ta	virakesarilk	1760934000.0
lk_news	2025-10-20-lankadeepalk-7498489f	lankadeepalk-7498489f	2025-10-20	උඩරට දුම්රිය ධාවනය බදුල්ල-මහනුවරට සීමාවෙයි	https://www.lankadeepa.lk/latest_news/උඩරට-දමරය-ධවනය-බදලල-මහනවරට-සමවය/1-681660	si	lankadeepalk	1760933698.0
lk_news	2025-10-20-virakesarilk-208d527d	virakesarilk-208d527d	2025-10-20	சிறுவர்களை இலக்கு வைத்து போதைப்பொருள் வலைப்பின்னல் உருவாக்கப்படுகின்றது - வடக்கு மாகாண ஆளுநர் வேதநாயகன்	https://www.virakesari.lk/article/228179	ta	virakesarilk	1760933160.0
lk_news	2025-10-20-virakesarilk-23156c45	virakesarilk-23156c45	2025-10-20	40 ஆயிரத்தை கடந்தது டெங்கு நோயாளர்களின் எண்ணிக்கை!	https://www.virakesari.lk/article/228178	ta	virakesarilk	1760932980.0
lk_news	2025-10-20-virakesarilk-0ec8b6a7	virakesarilk-0ec8b6a7	2025-10-20	தீபாவளி திருநாளில் எல்லோர் வாழ்விலும் இன்பம் பெருகிட இறைவனின் அருள் கிடைக்கட்டும் - செந்தில் தொண்டமான் வாழ்த்து	https://www.virakesari.lk/article/228177	ta	virakesarilk	1760932920.0
lk_news	2025-10-20-virakesarilk-5c4df2f0	virakesarilk-5c4df2f0	2025-10-20	இரு வெவ்வேறு வீதி விபத்துக்களில் இருவர் பலி!	https://www.virakesari.lk/article/228176	ta	virakesarilk	1760932500.0
lk_news	2025-10-20-virakesarilk-e9aa819d	virakesarilk-e9aa819d	2025-10-20	இறால் பண்ணையில் ஒருவர் உயிரிழப்பு!	https://www.virakesari.lk/article/228174	ta	virakesarilk	1760932200.0
lk_news	2025-10-20-virakesarilk-7e0b3b15	virakesarilk-7e0b3b15	2025-10-20	பாடசாலை மாணவர்களை ஏற்றிச் சென்ற பஸ் விபத்து ; 12 பேர் காயம்!	https://www.virakesari.lk/article/228175	ta	virakesarilk	1760932080.0
lk_news	2025-10-20-tamilmirrorlk-db391825	tamilmirrorlk-db391825	2025-10-20	அடுத்த 36 மணி நேரத்திற்குள் வெள்ளப்பெருக்கு ஏற்பட வாய்ப்பு	https://www.tamilmirror.lk/செய்திகள்/அடுத்த-36-மணி-நேரத்திற்குள்-வெள்ளப்பெருக்கு-ஏற்பட-வாய்ப்பு/175-366533	ta	tamilmirrorlk	1760931522.0
lk_news	2025-10-20-tamilmirrorlk-8e775c3b	tamilmirrorlk-8e775c3b	2025-10-20	நாடு முழுவதும் மழை பெய்யும்	https://www.tamilmirror.lk/செய்திகள்/நாடு-முழுவதும்-மழை-பெய்யும்/175-366532	ta	tamilmirrorlk	1760931301.0
lk_news	2025-10-20-virakesarilk-95edcdfa	virakesarilk-95edcdfa	2025-10-20	வவுனியாவில் ஒருவர் கைது!	https://www.virakesari.lk/article/228173	ta	virakesarilk	1760931060.0
lk_news	2025-10-20-lankadeepalk-513e1875	lankadeepalk-513e1875	2025-10-20	නපුර පලවා හැර යහපත ජයග්‍රහණය කරවමු	https://www.lankadeepa.lk/news/නපර-පලව-හර-යහපත-ජයගරහණය-කරවම/101-681659	si	lankadeepalk	1760930822.0
lk_news	2025-10-20-lankadeepalk-cb6176d4	lankadeepalk-cb6176d4	2025-10-20	මේ ජනතාව අන්ධකාරයෙන් ගැලවෙන යුගයයි	https://www.lankadeepa.lk/news/ම-ජනතව-අනධකරයන-ගලවන-යගයය/101-681658	si	lankadeepalk	1760930461.0
lk_news	2025-10-20-lankadeepalk-31f67bef	lankadeepalk-31f67bef	2025-10-20	කාගෙත් ගෞරවය රකින රටක් හදනවා	https://www.lankadeepa.lk/news/කගත-ගරවය-රකන-රටක-හදනව/101-681657	si	lankadeepalk	1760930326.0
lk_news	2025-10-20-adalk-a97e0932	adalk-a97e0932	2025-10-20	කලාවැව සමස්ත ධාරිතාව ආසන්නයට, වාන් දැමීමත් ආරම්භ වෙයි	https://www.ada.lk/breaking_news/කලාවැව-සමස්ත-ධාරිතාව-ආසන්නයට--වාන්-දැමීමත්-ආරම්භ-වෙයි/11-419202	si	adalk	1760930259.0
lk_news	2025-10-20-adalk-db5756be	adalk-db5756be	2025-10-20	භාණ්ඩ ප්‍රවාහන ගුවන් යානයක් ගොඩ බෑමේදී අනතුරක	https://www.ada.lk/international/භාණ්ඩ-ප්‍රවාහන-ගුවන්-යානයක්-ගොඩ-බෑමේදී-අනතුරක/3-419201	si	adalk	1760929713.0
lk_news	2025-10-20-lankadeepalk-d1bb1b1d	lankadeepalk-d1bb1b1d	2025-10-20	පළාත් කිහිපයකට ගිගුරුම් සහිත වැසි	https://www.lankadeepa.lk/news/පළත-කහපයකට-ගගරම-සහත-වස/101-681656	si	lankadeepalk	1760929172.0
lk_news	2025-10-20-adalk-0f5a463f	adalk-0f5a463f	2025-10-20	වයඹ සරසවියේ අධ්‍යයන මණ්ඩලය 2024දී හොර පාරෙන් රු. කෝටි 138ක අතිකාල අරන්	https://www.ada.lk/breaking_news/වයඹ-සරසවියේ-අධ්‍යයන-මණ්ඩලය-2024දී-හොර-පාරෙන්-රු--කෝටි-138ක-අතිකාල-අරන්/11-419200	si	adalk	1760928585.0
lk_news	2025-10-20-tamilmirrorlk-a5a345cf	tamilmirrorlk-a5a345cf	2025-10-20	போதைப் பொருள் நீர்மூழ்கியை அழித்தது அமெரிக்கா	https://www.tamilmirror.lk/உலக-செய்திகள்/போதைப்-பொருள்-நீர்மூழ்கியை-அழித்தது-அமெரிக்கா/50-366531	ta	tamilmirrorlk	1760928018.0
lk_news	2025-10-20-adalk-87268605	adalk-87268605	2025-10-20	ඉස්සෝ ටැංකියට වැටී තරුණයෙක් මිය යයි	https://www.ada.lk/breaking_news/ඉස්සෝ-ටැංකියට-වැටී-තරුණයෙක්-මිය-යයි/11-419198	si	adalk	1760927335.0
lk_news	2025-10-20-virakesarilk-196f1623	virakesarilk-196f1623	2025-10-20	நிக்கவரெட்டிய பகுதியில் புதையல் தோண்டிய மூவர் கைது!	https://www.virakesari.lk/article/228172	ta	virakesarilk	1760927160.0
lk_news	2025-10-20-virakesarilk-d7c83cd2	virakesarilk-d7c83cd2	2025-10-20	தம்புத்தேகமவில் வீட்டினுள் நுழைந்து கொள்ளையடித்த மூவர் கைது	https://www.virakesari.lk/article/228171	ta	virakesarilk	1760927100.0
lk_news	2025-10-20-virakesarilk-821fe594	virakesarilk-821fe594	2025-10-20	குஷ் போதைப்பொருளுடன் ஒருவர் கைது	https://www.virakesari.lk/article/228170	ta	virakesarilk	1760926980.0
lk_news	2025-10-20-virakesarilk-5c1a0751	virakesarilk-5c1a0751	2025-10-20	அனைவரின் வாழ்விலும் வெற்றி, ஆரோக்கியம் மற்றும் மகிழ்ச்சி நிரம்பியதாக மலரட்டும் - ஜீவன் தொண்டமான்	https://www.virakesari.lk/article/228129	ta	virakesarilk	1760926800.0
lk_news	2025-10-20-tamilmirrorlk-e93ac08c	tamilmirrorlk-e93ac08c	2025-10-20	ஜனாதிபதியின் தீபாவளி வாழ்த்துச் செய்தி	https://www.tamilmirror.lk/செய்திகள்/ஜனாதிபதியின்-தீபாவளி-வாழ்த்துச்-செய்தி/175-366529	ta	tamilmirrorlk	1760922092.0
lk_news	2025-10-20-tamilmirrorlk-398059fd	tamilmirrorlk-398059fd	2025-10-20	’போர் நிறுத்தத்தை இஸ்ரேல் மீறியுள்ளது’	https://www.tamilmirror.lk/உலக-செய்திகள்/போர்-நிறுத்தத்தை-இஸ்ரேல்-மீறியுள்ளது/50-366528	ta	tamilmirrorlk	1760915758.0
lk_news	2025-10-20-tamilmirrorlk-0674293c	tamilmirrorlk-0674293c	2025-10-20	இஸ்ரேலின் வான் தாக்குதலில் காசாவில் 18 பேர் பலி	https://www.tamilmirror.lk/உலக-செய்திகள்/இஸ்ரேலின்-வான்-தாக்குதலில்-காசாவில்-18-பேர்-பலி/50-366527	ta	tamilmirrorlk	1760915065.0
lk_news	2025-10-20-virakesarilk-105f82a1	virakesarilk-105f82a1	2025-10-20	மஹா ஓயா பள்ளத்தாக்கில் வெள்ள அபாயம்!	https://www.virakesari.lk/article/228167	ta	virakesarilk	1760910720.0
lk_news	2025-10-20-virakesarilk-011d5e8f	virakesarilk-011d5e8f	2025-10-20	பிரான்ஸ் முன்னாள் ஜனாதிபதிக்கு விதிக்கப்பட்ட சிறைத்தண்டனை நாளை முதல் அமுலுக்கு	https://www.virakesari.lk/article/228166	ta	virakesarilk	1760910420.0
lk_news	2025-10-20-virakesarilk-73de534a	virakesarilk-73de534a	2025-10-20	ரயில் தடம்புரண்டதால் மலையகத்துக்கான பல ரயில் சேவைகள் இரத்து	https://www.virakesari.lk/article/228165	ta	virakesarilk	1760908740.0
lk_news	2025-10-20-bbccomsinhala-bc85a8b0	bbccomsinhala-bc85a8b0	2025-10-20	ඔසප්වීමකදී ඔබට දැඩි වේදනාවක් දැනීම සාමාන්‍ය තත්ත්වයක් ද? ඔබ කළ යුත්තේ කුමක් ද?	https://www.bbc.com/sinhala/articles/c6204ke44e3o	si	bbccomsinhala	1760905554.0
lk_news	2025-10-20-virakesarilk-a5782034	virakesarilk-a5782034	2025-10-20	இந்தியாவை 4 ஓட்டங்களால் வென்று உலகக் கிண்ண அரை இறுதி வாய்ப்பை உறுதிசெய்தது இங்கிலாந்து	https://www.virakesari.lk/article/228164	ta	virakesarilk	1760903400.0
lk_news	2025-10-19-lankadeepalk-56c9add7	lankadeepalk-56c9add7	2025-10-19	කොළඹ - බදුල්ල පාරට ගල් වැටීමේ අවදානමක්	https://www.lankadeepa.lk/news/කළඹ-බදලල-පරට-ගල-වටම-අවදනමක/101-681655	si	lankadeepalk	1760895734.0
lk_news	2025-10-19-lankadeepalk-c361c799	lankadeepalk-c361c799	2025-10-19	තැපැල් දුම්රිය දෙකක් අවලංගුයි	https://www.lankadeepa.lk/news/තපල-දමරය-දකක-අවලගය/101-681654	si	lankadeepalk	1760895493.0
lk_news	2025-10-19-lankadeepalk-4adfe84f	lankadeepalk-4adfe84f	2025-10-19	අවිස්සාවේල්ලේ දුම්රියක් පීලිපනී	https://www.lankadeepa.lk/latest_news/අවසසවලල-දමරයක-පලපන/1-681653	si	lankadeepalk	1760895334.0
lk_news	2025-10-19-tamilmirrorlk-03f0edfe	tamilmirrorlk-03f0edfe	2025-10-19	கான்ஸ்டபளின் மாமியாருக்கு விளக்கமறியல்	https://www.tamilmirror.lk/செய்திகள்/கான்ஸ்டபளின்-மாமியாருக்கு-விளக்கமறியல்/175-366525	ta	tamilmirrorlk	1760890987.0
lk_news	2025-10-19-dbsjeyarajcom-0528188f	dbsjeyarajcom-0528188f	2025-10-19	Elder Statewoman  Sirimavo  Bandaranaike the Grand Old Lady of Sri Lankan Politics.	https://dbsjeyaraj.com/dbsj/?p=86491	en	dbsjeyarajcom	1760885700.0
lk_news	2025-10-19-adalk-56ee8cca	adalk-56ee8cca	2025-10-19	ප්‍රා ලේ කොට්ඨාස 29කට නාය යෑමේ අනතුරු ඇඟවීම්	https://www.ada.lk/breaking_news/ප්‍රා-ලේ-කොට්ඨාස-29කට-නාය-යෑමේ-අනතුරු-ඇඟවීම්/11-419197	si	adalk	1760885185.0
lk_news	2025-10-19-tamilmirrorlk-bbb61599	tamilmirrorlk-bbb61599	2025-10-19	பதுளை-கொழும்பு இரவு அஞ்சல் ரயில்கள் ரத்து	https://www.tamilmirror.lk/செய்திகள்/பதுளை-கொழும்பு-இரவு-அஞ்சல்-ரயில்கள்-ரத்து/175-366509	ta	tamilmirrorlk	1760882834.0
lk_news	2025-10-19-lankadeepalk-69e55b90	lankadeepalk-69e55b90	2025-10-19	ගම්පොළ සමූපකාර බලය පොදු විපක්ෂයට	https://www.lankadeepa.lk/latest_news/ගමපළ-සමපකර-බලය-පද-වපකෂයට/1-681640	si	lankadeepalk	1760882393.0
lk_news	2025-10-19-lankadeepalk-0f418592	lankadeepalk-0f418592	2025-10-19	පොලිස් පොඩ්ඩාට පෙනී සිටි ‍තාරක නීතිඥ සංගම්  කමිටුවෙන් යයි	https://www.lankadeepa.lk/latest_news/පලස-පඩඩට-පන-සට-තරක-නතඥ-සගම-කමටවන-යය/1-681639	si	lankadeepalk	1760882243.0
lk_news	2025-10-19-virakesarilk-7c269658	virakesarilk-7c269658	2025-10-19	இந்தியாவுக்கு கடினமான இலக்கை நிர்ணயித்தது இங்கிலாந்து	https://www.virakesari.lk/article/228162	ta	virakesarilk	1760882040.0
lk_news	2025-10-19-lankadeepalk-5c7a3708	lankadeepalk-5c7a3708	2025-10-19	බටුවත්තේ දී බසයක් පෙරළේ	https://www.lankadeepa.lk/news/බටවතත-ද-බසයක-පරළ/101-681638	si	lankadeepalk	1760880676.0
lk_news	2025-10-19-lankadeepalk-c77a3996	lankadeepalk-c77a3996	2025-10-19	බඹරු නිසා තරුණයෝ පහක් හන්තානේ අතරමං වෙති	https://www.lankadeepa.lk/news/බඹර-නස-තරණය-පහක-හනතන-අතරම-වත/101-681637	si	lankadeepalk	1760877776.0
lk_news	2025-10-19-lankadeepalk-57987a41	lankadeepalk-57987a41	2025-10-19	වායු රයිපලයෙන් පියා පුතාට වෙඩි තියලා	https://www.lankadeepa.lk/news/වය-රයපලයන-පය-පතට-වඩ-තයල/101-681636	si	lankadeepalk	1760877079.0
lk_news	2025-10-19-islandlk-040c318b	islandlk-040c318b	2025-10-19	Vogue Jewellers opens its Melbourne Branch with a grand celebration	http://island.lk/vogue-jewellers-opens-its-melbourne-branch-with-a-grand-celebration/	en	islandlk	1760876880.0
lk_news	2025-10-19-islandlk-18239b3e	islandlk-18239b3e	2025-10-19	Fcode Labs appoints Pamaljith Harshapriya as chief operating officer	http://island.lk/fcode-labs-appoints-pamaljith-harshapriya-as-chief-operating-officer/	en	islandlk	1760876640.0
lk_news	2025-10-19-lankadeepalk-710ef717	lankadeepalk-710ef717	2025-10-19	දුම්රිය මඟ නාය යයි:සැප දුම්රියක් පීලි පනී	https://www.lankadeepa.lk/news/දමරය-මඟ-නය-යයසප-දමරයක-පල-පන/101-681635	si	lankadeepalk	1760876582.0
lk_news	2025-10-19-islandlk-87cfab3f	islandlk-87cfab3f	2025-10-19	Sri Lanka showcases its tourism potential at TTG Travel Experience 2025 in Italy	http://island.lk/sri-lanka-showcases-its-tourism-potential-at-ttg-travel-experience-2025-in-italy/	en	islandlk	1760876520.0
lk_news	2025-10-19-lankadeepalk-65968b36	lankadeepalk-65968b36	2025-10-19	ජී.රාජපක්ෂගේ ගේ බලන්න නි.ඇමති යයි	https://www.lankadeepa.lk/latest_news/ජ-රජපකෂග-ග-බලනන-න-ඇමත-යය/1-681634	si	lankadeepalk	1760876250.0
lk_news	2025-10-19-islandlk-ed83d996	islandlk-ed83d996	2025-10-19	Chinese academic delegation visits Minasro College to strengthen their academic partnership	http://island.lk/chinese-academic-delegation-visits-minasro-college-to-strengthen-their-academic-partnership/	en	islandlk	1760875980.0
lk_news	2025-10-19-islandlk-90991480	islandlk-90991480	2025-10-19	Mintpay partners with FitsAir to make outbound travel more accessible	http://island.lk/mintpay-partners-with-fitsair-to-make-outbound-travel-more-accessible/	en	islandlk	1760875980.0
lk_news	2025-10-19-islandlk-8298d266	islandlk-8298d266	2025-10-19	Doola River Edge: A destination for guests and careers	http://island.lk/doola-river-edge-a-destination-for-guests-and-careers/	en	islandlk	1760875980.0
lk_news	2025-10-19-islandlk-6c7492d5	islandlk-6c7492d5	2025-10-19	Lead Mark Engineering recognised for its professional construction solutions	http://island.lk/lead-mark-engineering-recognised-for-its-professional-construction-solutions/	en	islandlk	1760875980.0
