doc_type	doc_id	num	date_str	description	url_metadata	lang	newspaper_id	time_ut
lk_news	2025-12-04-lankadeepalk-7781d368	lankadeepalk-7781d368	2025-12-04	අවසන් ගෞවර නෑ:පෙට්ටියක්වත් නැතිව වැළලුණු මිනිස්සු	https://www.lankadeepa.lk/news/අවසන-ගවර-නපටටයකවත-නතව-වළලණ-මනසස/101-684630	si	lankadeepalk	1764815991.0
lk_news	2025-12-04-lankadeepalk-5ae50ca3	lankadeepalk-5ae50ca3	2025-12-04	ආපදාවෙන් වැඩිම මරණ මහනුවරින්	https://www.lankadeepa.lk/news/ආපදවන-වඩම-මරණ-මහනවරන/101-684629	si	lankadeepalk	1764814529.0
lk_news	2025-12-04-lankadeepalk-4aa89895	lankadeepalk-4aa89895	2025-12-04	අධිවේගයේ නොමිලේ පහසුකම් අවසන් කරයි	https://www.lankadeepa.lk/news/අධවගය-නමල-පහසකම-අවසන-කරය/101-684628	si	lankadeepalk	1764814157.0
lk_news	2025-12-04-lankadeepalk-4d3a8e91	lankadeepalk-4d3a8e91	2025-12-04	ජපන් තවත් වෛද්‍ය කණ්ඩායමක් දිවයිනට	https://www.lankadeepa.lk/news/ජපන-තවත-වදය-කණඩයමක-දවයනට/101-684627	si	lankadeepalk	1764813901.0
lk_news	2025-12-04-lankadeepalk-978f480b	lankadeepalk-978f480b	2025-12-04	රට ගොඩ නගන අරමුදලේ කළමනාකරණ කමිටුව රැස්වෙයි	https://www.lankadeepa.lk/news/රට-ගඩ-නගන-අරමදල-කළමනකරණ-කමටව-රසවය/101-684626	si	lankadeepalk	1764813365.0
lk_news	2025-12-04-dailyftlk-da9c94f8	dailyftlk-da9c94f8	2025-12-04	Probe Ditwah early warning failure, Rebuilding SL illegal: Opposition MPs	https://www.ft.lk/news/Probe-Ditwah-early-warning-failure-Rebuilding-SL-illegal-Opposition-MPs/56-785208	en	dailyftlk	1764809981.0
lk_news	2025-12-04-dailyftlk-77c69f10	dailyftlk-77c69f10	2025-12-04	Harsha says Rebuilding Sri Lanka needs Parliament sanction, oversight	https://www.ft.lk/news/Harsha-says-Rebuilding-Sri-Lanka-needs-Parliament-sanction-oversight/56-785207	en	dailyftlk	1764809791.0
lk_news	2025-12-04-dailyftlk-5b14c7c5	dailyftlk-5b14c7c5	2025-12-04	Management Committee of ‘Rebuilding Sri Lanka’ Fund convenes	https://www.ft.lk/news/Management-Committee-of-Rebuilding-Sri-Lanka-Fund-convenes/56-785206	en	dailyftlk	1764809610.0
lk_news	2025-12-04-dailyftlk-aa3fd114	dailyftlk-aa3fd114	2025-12-04	US ICE arrests Lankan with alleged history of sex crimes working as college professor	https://www.ft.lk/business/US-ICE-arrests-Lankan-with-alleged-history-of-sex-crimes-working-as-college-professor/34-785205	en	dailyftlk	1764809486.0
lk_news	2025-12-04-dailyftlk-f6be39a6	dailyftlk-f6be39a6	2025-12-04	UK delivers emergency aid to  Sri Lanka following Cyclone Ditwah	https://www.ft.lk/news/UK-delivers-emergency-aid-to-Sri-Lanka-following-Cyclone-Ditwah/56-785204	en	dailyftlk	1764809326.0
lk_news	2025-12-04-dailyftlk-b55f991c	dailyftlk-b55f991c	2025-12-04	Pakistan sends first disaster-relief flight with specialised rescue team	https://www.ft.lk/news/Pakistan-sends-first-disaster-relief-flight-with-specialised-rescue-team/56-785203	en	dailyftlk	1764809278.0
lk_news	2025-12-04-dailyftlk-a1660fe3	dailyftlk-a1660fe3	2025-12-04	Dutch Ambassador calls on Prime Minister	https://www.ft.lk/news/Dutch-Ambassador-calls-on-Prime-Minister/56-785202	en	dailyftlk	1764809168.0
lk_news	2025-12-04-dailyftlk-5b1ca41d	dailyftlk-5b1ca41d	2025-12-04	Rs. 20 m donated to Rebuilding Sri Lanka	https://www.ft.lk/news/Rs-20-m-donated-to-Rebuilding-Sri-Lanka/56-785201	en	dailyftlk	1764809108.0
lk_news	2025-12-04-dailyftlk-3d4fe184	dailyftlk-3d4fe184	2025-12-04	Central Bank was not under Finance Ministry purview in 2015: Ravi K.	https://www.ft.lk/news/Central-Bank-was-not-under-Finance-Ministry-purview-in-2015-Ravi-K/56-785200	en	dailyftlk	1764808951.0
lk_news	2025-12-04-dailyftlk-458f81b0	dailyftlk-458f81b0	2025-12-04	Women’s Chamber calls for urgent support as Cyclone Ditwah floods trigger nationwide crisis	https://www.ft.lk/business/Women-s-Chamber-calls-for-urgent-support-as-Cyclone-Ditwah-floods-trigger-nationwide-crisis/34-785199	en	dailyftlk	1764808808.0
lk_news	2025-12-04-dailyftlk-792ff110	dailyftlk-792ff110	2025-12-04	Cargills ‘Heart for the Nation’ program supports flood-affected communities	https://www.ft.lk/business/Cargills-Heart-for-the-Nation-program-supports-flood-affected-communities/34-785198	en	dailyftlk	1764808691.0
lk_news	2025-12-04-dailyftlk-06c0d11e	dailyftlk-06c0d11e	2025-12-04	CHEC Port City Colombo extends Rs. 10 m and on-ground support to recovery efforts following Cyclone	https://www.ft.lk/business/CHEC-Port-City-Colombo-extends-Rs-10-m-and-on-ground-support-to-recovery-efforts-following-Cyclone/34-785197	en	dailyftlk	1764808573.0
lk_news	2025-12-04-dailyftlk-521ac001	dailyftlk-521ac001	2025-12-04	SLT-Mobitel launches free ‘247 Helpline’ to support flood-affected communities	https://www.ft.lk/business/SLT-Mobitel-launches-free-247-Helpline-to-support-flood-affected-communities/34-785196	en	dailyftlk	1764808476.0
lk_news	2025-12-04-dailyftlk-11e4f53e	dailyftlk-11e4f53e	2025-12-04	Avon Pharmo Chem donates Rs. 2 m for flood relief	https://www.ft.lk/business/Avon-Pharmo-Chem-donates-Rs-2-m-for-flood-relief/34-785195	en	dailyftlk	1764808377.0
lk_news	2025-12-04-dailyftlk-8d30d957	dailyftlk-8d30d957	2025-12-04	Uber partners Sri Lanka Red Cross Society	https://www.ft.lk/business/Uber-partners-Sri-Lanka-Red-Cross-Society/34-785194	en	dailyftlk	1764808143.0
lk_news	2025-12-04-dailyftlk-c210ee7e	dailyftlk-c210ee7e	2025-12-04	Starlink offers free connectivity in Sri Lanka after Cyclone Ditwah	https://www.ft.lk/business/Starlink-offers-free-connectivity-in-Sri-Lanka-after-Cyclone-Ditwah/34-785193	en	dailyftlk	1764808039.0
lk_news	2025-12-04-dailyftlk-0b5375f5	dailyftlk-0b5375f5	2025-12-04	Binance contributes Rs. 61.6 m for flood relief in Sri Lanka	https://www.ft.lk/business/Binance-contributes-Rs-61-6-m-for-flood-relief-in-Sri-Lanka/34-785192	en	dailyftlk	1764807962.0
lk_news	2025-12-04-dailyftlk-4294dfaf	dailyftlk-4294dfaf	2025-12-04	US provides $ 2 m assistance to  Sri Lanka’s disaster response effort	https://www.ft.lk/news/US-provides-2-m-assistance-to-Sri-Lanka-s-disaster-response-effort/56-785191	en	dailyftlk	1764807858.0
lk_news	2025-12-04-dailyftlk-7f18506e	dailyftlk-7f18506e	2025-12-04	US Special Envoy  expresses solidarity with SL	https://www.ft.lk/news/US-Special-Envoy-expresses-solidarity-with-SL/56-785190	en	dailyftlk	1764807815.0
lk_news	2025-12-04-virakesarilk-616110cb	virakesarilk-616110cb	2025-12-04	இந்திய நிவாரணப் பொருட்களுடனான மற்றொரு விமானம் இலங்கையை வந்தடைந்தது	https://www.virakesari.lk/article/232387	ta	virakesarilk	1764807780.0
lk_news	2025-12-04-dailyftlk-23720193	dailyftlk-23720193	2025-12-04	A neighbour in need, a friend indeed	https://www.ft.lk/news/A-neighbour-in-need-a-friend-indeed/56-785189	en	dailyftlk	1764807520.0
lk_news	2025-12-04-dailyftlk-57b33b03	dailyftlk-57b33b03	2025-12-04	Bangladesh delivers essential aid to Sri Lanka	https://www.ft.lk/news/Bangladesh-delivers-essential-aid-to-Sri-Lanka/56-785188	en	dailyftlk	1764807476.0
lk_news	2025-12-04-dailyftlk-84d0ff3d	dailyftlk-84d0ff3d	2025-12-04	IOM mobilises emergency response as Cyclone Ditwah displaces 209,000 people across Sri Lanka	https://www.ft.lk/news/IOM-mobilises-emergency-response-as-Cyclone-Ditwah-displaces-209-000-people-across-Sri-Lanka/56-785187	en	dailyftlk	1764807216.0
lk_news	2025-12-04-virakesarilk-dfff6fb1	virakesarilk-dfff6fb1	2025-12-04	159 பேரும் தோற்றாலும், ஜனாதிபதி அநுர தோற்றுவிடக் கூடாது - ஹரின் பெர்னாண்டோ	https://www.virakesari.lk/article/232386	ta	virakesarilk	1764807000.0
lk_news	2025-12-04-dailyftlk-a725b93d	dailyftlk-a725b93d	2025-12-04	Cyclone Ditwah and India-Sri Lanka relations: playbook for diplomacy in the neighbourhood	https://www.ft.lk/opinion/Cyclone-Ditwah-and-India-Sri-Lanka-relations-playbook-for-diplomacy-in-the-neighbourhood/14-785186	en	dailyftlk	1764806849.0
lk_news	2025-12-04-virakesarilk-57b05c72	virakesarilk-57b05c72	2025-12-04	இத்தருணத்தில் ஒருமைப்பாடும், தொடர் உதவிகளுமே இலங்கைக்கு அவசியம் - ஐக்கிய நாடுகள் சபை சுட்டிக்காட்டு	https://www.virakesari.lk/article/232385	ta	virakesarilk	1764806760.0
lk_news	2025-12-04-virakesarilk-f71c93aa	virakesarilk-f71c93aa	2025-12-04	நிவாரணப்பொருட்களை அனர்த்த முகாமைத்துவ பிரிவிடம் கையளித்தது உலக உணவுத்திட்டம்	https://www.virakesari.lk/article/232384	ta	virakesarilk	1764806640.0
lk_news	2025-12-04-virakesarilk-19549535	virakesarilk-19549535	2025-12-04	அரசாங்கத்தை வீழ்த்த முடியாது; மக்கள் எம்முடன் உள்ளார்கள் – பிமல் ரத்நாயக்க	https://www.virakesari.lk/article/232383	ta	virakesarilk	1764806460.0
lk_news	2025-12-04-virakesarilk-b53a12f1	virakesarilk-b53a12f1	2025-12-04	பாதிக்கப்பட்ட மக்களுக்கு சாத்தியமான அனைத்து ஆதரவுகளும் வழங்கப்படும் – பாதுகாப்பு வீரர்களுக்கு பிரதமர் நன்றி	https://www.virakesari.lk/article/232382	ta	virakesarilk	1764806280.0
lk_news	2025-12-04-virakesarilk-509a4d83	virakesarilk-509a4d83	2025-12-04	அனர்த்த முன்னெச்சரிக்கை கோபுரங்கள் செயலிழப்பு: ஒவ்வொரு பிரதேசத்திலும் மத்திய அனர்த்த முகாமைத்துவ பிரிவுகள் அமைக்க வேண்டும் – ஹிஸ்புல்லாஹ்	https://www.virakesari.lk/article/232381	ta	virakesarilk	1764805980.0
lk_news	2025-12-04-virakesarilk-3dcfb185	virakesarilk-3dcfb185	2025-12-04	சமூக ஊடகங்களில் உலாவரும் போலி செய்திகள் தொடர்பில் 57 முறைப்பாடுகள் பதிவு	https://www.virakesari.lk/article/232380	ta	virakesarilk	1764805860.0
lk_news	2025-12-04-virakesarilk-2d835ffd	virakesarilk-2d835ffd	2025-12-04	சபை முதல்வரின் ‘தீய சக்திகள்’ என்ற கருத்துக்கு எம்.பி திலித் ஜயவீர கடும் எதிர்ப்பு	https://www.virakesari.lk/article/232379	ta	virakesarilk	1764805560.0
lk_news	2025-12-04-virakesarilk-f883ce63	virakesarilk-f883ce63	2025-12-04	சுகாதார அமைச்சு  வட மாகாணத்தில் அவசரகால  சுகாதார நடவடிக்கையை முன்னெடுத்துள்ளது	https://www.virakesari.lk/article/232378	ta	virakesarilk	1764804960.0
lk_news	2025-12-04-virakesarilk-8ee36c85	virakesarilk-8ee36c85	2025-12-04	வவுனியாவில் கடும் மழை மற்றும் புயல் காரணமாக 114 குளங்கள் உடைப்பு: மாவட்ட அனர்த்த முகாமைத்துவ பிரிவு	https://www.virakesari.lk/article/232377	ta	virakesarilk	1764804780.0
lk_news	2025-12-04-virakesarilk-d0885cb6	virakesarilk-d0885cb6	2025-12-04	முன்னெச்சரிக்கை அறிவிப்பு கூறப்படும்போது ஆதாரம் காட்டுங்கள் – எதிர்க்கட்சிக்கு சவால் விடுக்கும் அமைச்சர் நளிந்த ஜயதிஸ்ஸ	https://www.virakesari.lk/article/232376	ta	virakesarilk	1764804600.0
lk_news	2025-12-04-bbccomsinhala-2f04314d	bbccomsinhala-2f04314d	2025-12-04	ජලගැලීම් සහ අධික වර්ෂාව නිසා විනාශ වූ ඔබේ අත්‍යවශ්‍ය ලේඛන යළි ලබා ගන්නේ කෙසේ ද?	https://www.bbc.com/sinhala/articles/cq5q4zl7xjdo	si	bbccomsinhala	1764793088.0
lk_news	2025-12-04-dailyftlk-7a5ec13e	dailyftlk-7a5ec13e	2025-12-04	Cyclone 2025, Anura’s crisis of competence and accountability, Sajith-SJB’s straitjacket	https://www.ft.lk/columns/Cyclone-2025-Anura-s-crisis-of-competence-and-accountability-Sajith-SJB-s-straitjacket/4-785176	en	dailyftlk	1764792692.0
lk_news	2025-12-04-dailyftlk-35ac3c74	dailyftlk-35ac3c74	2025-12-04	Not fighting corruption: From rhetoric to silence in Sri Lanka	https://www.ft.lk/columns/Not-fighting-corruption-From-rhetoric-to-silence-in-Sri-Lanka/4-785175	en	dailyftlk	1764791169.0
lk_news	2025-12-04-dailyftlk-e91e778a	dailyftlk-e91e778a	2025-12-04	Prioritise marginalised communities in disaster preparedness, equitable relief and economic justice	https://www.ft.lk/opinion/Prioritise-marginalised-communities-in-disaster-preparedness-equitable-relief-and-economic-justice/14-785173	en	dailyftlk	1764790670.0
lk_news	2025-12-04-dailyftlk-84edac2e	dailyftlk-84edac2e	2025-12-04	We were too late: Lives lost to another system failure	https://www.ft.lk/columns/We-were-too-late-Lives-lost-to-another-system-failure/4-785172	en	dailyftlk	1764790145.0
lk_news	2025-12-03-islandlk-c804d1a7	islandlk-c804d1a7	2025-12-03	Commercial Bank launches ‘ComBank Shakthi’ to extend reach to customers	http://island.lk/commercial-bank-launches-combank-shakthi-to-extend-reach-to-customers/	en	islandlk	1764785220.0
lk_news	2025-12-03-islandlk-3d3ff24d	islandlk-3d3ff24d	2025-12-03	‘ICC Timber Deck Tiles: A perfect blend of natural charm, strength, and sophistication’	http://island.lk/icc-timber-deck-tiles-a-perfect-blend-of-natural-charm-strength-and-sophistication/	en	islandlk	1764785220.0
lk_news	2025-12-03-lankadeepalk-a6c3ec8c	lankadeepalk-a6c3ec8c	2025-12-03	IMF හයවැනි වාරිකයත් නිදහස් කරයි	https://www.lankadeepa.lk/news/IMF-හයවන-වරකයත-නදහස-කරය/101-684625	si	lankadeepalk	1764785206.0
lk_news	2025-12-03-islandlk-5f5b30db	islandlk-5f5b30db	2025-12-03	Chec Port City Colombo extends Rs. 10 million and critical on-ground support to national recovery efforts following Cyclone Ditwah’s devastation	http://island.lk/chec-port-city-colombo-extends-rs-10-million-and-critical-on-ground-support-to-national-recovery-efforts-following-cyclone-ditwahs-devastation/	en	islandlk	1764785160.0
lk_news	2025-12-03-islandlk-545822df	islandlk-545822df	2025-12-03	Cinnamon Hotels & Resorts prioritises guest safety, colleague support, and community recovery as affected properties resume full operations	http://island.lk/cinnamon-hotels-resorts-prioritises-guest-safety-colleague-support-and-community-recovery-as-affected-properties-resume-full-operations/	en	islandlk	1764785100.0
lk_news	2025-12-03-islandlk-fbf60b11	islandlk-fbf60b11	2025-12-03	CSE continues in panic-selling mode as investor fears persist	http://island.lk/cse-continues-in-panic-selling-mode-as-investor-fears-persist/	en	islandlk	1764785040.0
lk_news	2025-12-03-islandlk-fbddeb0d	islandlk-fbddeb0d	2025-12-03	Kaspersky advocates protecting Sri Lanka’s digital future by combatting vulnerabilities	http://island.lk/kaspersky-advocates-protecting-sri-lankas-digital-future-by-combatting-vulnerabilities/	en	islandlk	1764784980.0
lk_news	2025-12-03-lankadeepalk-d8c5d3a2	lankadeepalk-d8c5d3a2	2025-12-03	පාකිස්තාන් ආධාර රැගත් ගුවන් යානයක් පැමිණේ	https://www.lankadeepa.lk/news/පකසතන-ආධර-රගත-ගවන-යනයක-පමණ/101-684624	si	lankadeepalk	1764784817.0
lk_news	2025-12-03-virakesarilk-adb64655	virakesarilk-adb64655	2025-12-03	முழுமையான சேத மதிப்பீட்டின் பின்னர் புதிய வரவு - செலவு திட்டம் ஜனவரியில் சமர்ப்பிக்க வேண்டும் -  கூட்டு எதிர்க்கட்சிகள் அரசாங்கத்திடம் வலியுறுத்தல்	https://www.virakesari.lk/article/232374	ta	virakesarilk	1764783180.0
lk_news	2025-12-03-tamilmirrorlk-e7bf891f	tamilmirrorlk-e7bf891f	2025-12-03	வெள்ள, நிலச்சரிவால் பாதிக்கப்பட்ட பாடசாலை சிறுவருக்கு 25,000 ரூபாய்	https://www.tamilmirror.lk/செய்திகள்/வெள்ள-நிலச்சரிவால்-பாதிக்கப்பட்ட-பாடசாலை-சிறுவருக்கு-25-000-ரூபாய்/175-369036	ta	tamilmirrorlk	1764783032.0
lk_news	2025-12-03-virakesarilk-7529af22	virakesarilk-7529af22	2025-12-03	16 இலட்சத்துக்கும் மேற்பட்டோர் பாதிப்பு; 479 பேர் உயிரிழப்பு; 44, 000 வீடுகள் சேதம்  காணாமல் போயுள்ள 350 பேரைத் தேடும் பணிகள் தொடர்கின்றன	https://www.virakesari.lk/article/232373	ta	virakesarilk	1764779940.0
lk_news	2025-12-03-virakesarilk-f8d5d0b0	virakesarilk-f8d5d0b0	2025-12-03	யாழ்ப்பாணம்: 7.9% குடும்பங்கள் அனர்த்தத்தால் பாதிப்பு; வீடு சுத்தம் செய்ய ரூ.25,000 ஒதுக்கீடு	https://www.virakesari.lk/article/232372	ta	virakesarilk	1764779760.0
lk_news	2025-12-03-virakesarilk-1a3a5afe	virakesarilk-1a3a5afe	2025-12-03	‘Rebuilding Sri Lanka’ நிதியத்தின் முகாமைத்துவக் குழு கூடியது	https://www.virakesari.lk/article/232371	ta	virakesarilk	1764779580.0
lk_news	2025-12-03-adalk-936a0c4a	adalk-936a0c4a	2025-12-03	මොනරාගල සියලු සුරක්ෂිතතා කඳවුරු වසා දමයි	https://www.ada.lk/breaking_news/මොනරාගල-සියලු-සුරක්ෂිතතා-කඳවුරු-වසා-දමයි/11-420048	si	adalk	1764776593.0
lk_news	2025-12-03-tamilmirrorlk-71ff0faf	tamilmirrorlk-71ff0faf	2025-12-03	செவ்வந்திக்கு உதவிய யாழ் நபர்களுக்கு ஏற்பட்ட நிலை	https://www.tamilmirror.lk/செய்திகள்/செவ்வந்திக்கு-உதவிய-யாழ்-நபர்களுக்கு-ஏற்பட்ட-நிலை/175-369023	ta	tamilmirrorlk	1764776260.0
lk_news	2025-12-03-adalk-b2dde4e6	adalk-b2dde4e6	2025-12-03	සෝපානයකින් වැටී පුද්ගලයෙක් මරුට	https://www.ada.lk/breaking_news/සෝපානයකින්-වැටී-පුද්ගලයෙක්-මරුට/11-420047	si	adalk	1764775916.0
lk_news	2025-12-03-adalk-2861d710	adalk-2861d710	2025-12-03	අපේ ගොවීන් වගා කරන කිසිදු එළවළුවක් රටින් ගෙන්නේ නෑ	https://www.ada.lk/breaking_news/අපේ-ගොවීන්-වගා-කරන-කිසිදු-එළවළුවක්-රටින්-ගෙන්නේ-නෑ/11-420046	si	adalk	1764775679.0
lk_news	2025-12-03-colombotelegraphcom-a0888f3a	colombotelegraphcom-a0888f3a	2025-12-03	Economic Impacts Of The Ditwah Cyclone Disaster In Sri Lanka	https://www.colombotelegraph.com/index.php/economic-impacts-of-the-ditwah-cyclone-disaster-in-sri-lanka/	en	colombotelegraphcom	1764775426.0
lk_news	2025-12-03-tamilmirrorlk-c55ca831	tamilmirrorlk-c55ca831	2025-12-03	இலங்கையில் உயிரிழந்தவர்களின் எண்ணிக்கை 479ஆக உயர்வு	https://www.tamilmirror.lk/செய்திகள்/இலங்கையில்-உயிரிழந்தவர்களின்-எண்ணிக்கை-479ஆக-உயர்வு/175-369022	ta	tamilmirrorlk	1764774858.0
lk_news	2025-12-03-tamilmirrorlk-4dfde1e6	tamilmirrorlk-4dfde1e6	2025-12-03	அவிசாவளையில் துப்பாக்கிச் சூடு	https://www.tamilmirror.lk/செய்திகள்/அவிசாவளையில்-துப்பாக்கிச்-சூடு/175-369021	ta	tamilmirrorlk	1764774563.0
lk_news	2025-12-03-virakesarilk-f251d4dc	virakesarilk-f251d4dc	2025-12-03	டித்வா’ சூறாவளி பாதிப்பு – இலங்கைக்கு 2 மில்லியன் அமெரிக்க டொலர் அவசர உதவி: அமெரிக்கா அறிவிப்பு	https://www.virakesari.lk/article/232370	ta	virakesarilk	1764774420.0
lk_news	2025-12-03-virakesarilk-a36a2c96	virakesarilk-a36a2c96	2025-12-03	பாதிக்கப்பட்ட மக்களுக்கு நிவாரணம் வழங்க 20 இலட்சம் ரூபா நிதி நன்கொடை	https://www.virakesari.lk/article/232369	ta	virakesarilk	1764774300.0
lk_news	2025-12-03-virakesarilk-4ea9a4d5	virakesarilk-4ea9a4d5	2025-12-03	அமெரிக்காவிடமிருந்து இலங்கை கடற்படைக்கு மேலும் ஒரு  கப்பல்; புதிய மைல்கல் - தூதுவர் ஜுலி சங்	https://www.virakesari.lk/article/232368	ta	virakesarilk	1764773700.0
lk_news	2025-12-03-bbccomsinhala-32e4a0ea	bbccomsinhala-32e4a0ea	2025-12-03	ගම්පොළ: 'තව ටික වෙලාවයි තියෙන්නේ වතුරේ අපි ගහගෙන යන්න, අපි විසිනව දෙනා ම එකට මැරෙමු කියලා අපි කතා වුණා'	https://www.bbc.com/sinhala/articles/cj4q2eydgx0o	si	bbccomsinhala	1764771574.0
lk_news	2025-12-03-lankadeepalk-7309b01e	lankadeepalk-7309b01e	2025-12-03	කොස්ගම වෙඩිතැබීමක්	https://www.lankadeepa.lk/news/කසගම-වඩතබමක/101-684623	si	lankadeepalk	1764771109.0
lk_news	2025-12-03-virakesarilk-29b97689	virakesarilk-29b97689	2025-12-03	பேரிடர்களால் உயிரிழந்தவர்களின் எண்ணிக்கை 479 ஆக அதிகரிப்பு!	https://www.virakesari.lk/article/232367	ta	virakesarilk	1764770160.0
lk_news	2025-12-03-lankadeepalk-3cf7e8a6	lankadeepalk-3cf7e8a6	2025-12-03	ගුවන් රණවිරුවාගේ උපාධිය දේහයට පිළිගන්වයි	https://www.lankadeepa.lk/news/ගවන-රණවරවග-උපධය-දහයට-පළගනවය/101-684622	si	lankadeepalk	1764769991.0
lk_news	2025-12-03-virakesarilk-9793b06b	virakesarilk-9793b06b	2025-12-03	இந்தியாவை பலமான நிலையில் இட்ட கோஹ்லி, ருத்துராஜ் சதங்கள்	https://www.virakesari.lk/article/232366	ta	virakesarilk	1764769260.0
lk_news	2025-12-03-lankadeepalk-87592aca	lankadeepalk-87592aca	2025-12-03	සරසවි සිසුන්ට මහපොළ තවත් වාරිකයක්	https://www.lankadeepa.lk/latest_news/සරසව-සසනට-මහපළ-තවත-වරකයක/1-684621	si	lankadeepalk	1764769127.0
lk_news	2025-12-03-lankadeepalk-42b199b5	lankadeepalk-42b199b5	2025-12-03	උඳුවප් පුන් පෝය අද (4) දිනයට යෙදී තිබේ.	https://www.lankadeepa.lk/test/උඳවප-පන-පය-අද-4-දනයට-යද-තබ/222-684620	si	lankadeepalk	1764768976.0
lk_news	2025-12-03-colombotelegraphcom-a29e990f	colombotelegraphcom-a29e990f	2025-12-03	Rising From The Ruins Of Cyclone Ditwah: A Nation’s Gratitude To Its True Friends	https://www.colombotelegraph.com/index.php/rising-from-the-ruins-of-cyclone-ditwah-a-nations-gratitude-to-its-true-friends/	en	colombotelegraphcom	1764768340.0
lk_news	2025-12-03-lankadeepalk-bbee2f8e	lankadeepalk-bbee2f8e	2025-12-03	ඔන්මැක්ස් ඩී.ටී අධ්‍යක්ෂකවරුන් සිව්දෙනකුට අධිකරණ නියෝගයක්	https://www.lankadeepa.lk/latest_news/ඔනමකස-ඩ-ට-අධයකෂකවරන-සවදනකට-අධකරණ-නයගයක/1-684619	si	lankadeepalk	1764768046.0
lk_news	2025-12-03-colombotelegraphcom-aff0f395	colombotelegraphcom-aff0f395	2025-12-03	Sri Lanka: Disasters Around The Corner	https://www.colombotelegraph.com/index.php/sri-lanka-disasters-around-the-corner/	en	colombotelegraphcom	1764767830.0
lk_news	2025-12-03-lankadeepalk-0eada18e	lankadeepalk-0eada18e	2025-12-03	අධික මිලකට එළවළු අලෙවි කළ 7ක් අල්ලයි	https://www.lankadeepa.lk/latest_news/අධක-මලකට-එළවළ-අලව-කළ-7ක-අලලය/1-684618	si	lankadeepalk	1764767460.0
