doc_type	doc_id	num	date_str	description	url_metadata	lang	newspaper_id	time_ut
lk_news	2025-09-27-tamilmirrorlk-700d79fa	tamilmirrorlk-700d79fa	2025-09-27	பிரசவத்தின் போது இரட்டை சிசுக்களும் தாயும் உயிரிழப்பு	https://www.tamilmirror.lk/செய்திகள்/பிரசவத்தின்-போது-இரட்டை-சிசுக்களும்-தாயும்-உயிரிழப்பு/175-365357	ta	tamilmirrorlk	1758923641.0
lk_news	2025-09-27-virakesarilk-dc6dd409	virakesarilk-dc6dd409	2025-09-27	இராணுவத்தின் 76வது ஆண்டு நிறைவை முன்னிட்டு சிறப்பு மத நிகழ்ச்சித் தொடர் ஆரம்பம்	https://www.virakesari.lk/article/226208	ta	virakesarilk	1758918540.0
lk_news	2025-09-27-virakesarilk-6cf77698	virakesarilk-6cf77698	2025-09-27	உள்நாட்டு விமான பயணங்களின் பாதுகாப்பை உறுதிப்படுத்த  பல நடவடிக்கைகள் தேவை - சஜித் பிரேமதாச	https://www.virakesari.lk/article/226207	ta	virakesarilk	1758917640.0
lk_news	2025-09-27-virakesarilk-57f884df	virakesarilk-57f884df	2025-09-27	அக்கரப்பத்தனை பிரதேச வைத்தியசாலையில் குழப்பகரமான சூழ்நிலை	https://www.virakesari.lk/article/226206	ta	virakesarilk	1758917520.0
lk_news	2025-09-27-dailyftlk-3ca3a9b9	dailyftlk-3ca3a9b9	2025-09-27	Foreign Ministry coordinates repatriation of foreign monks killed in Na Uyana cable car tragedy	https://www.ft.lk/news/Foreign-Ministry-coordinates-repatriation-of-foreign-monks-killed-in-Na-Uyana-cable-car-tragedy/56-782261	en	dailyftlk	1758914435.0
lk_news	2025-09-27-dailyftlk-c3d2cc1d	dailyftlk-c3d2cc1d	2025-09-27	Senior Pakistan Navy delegation visits Sri Lanka for Galle Dialogue-2025	https://www.ft.lk/news/Senior-Pakistan-Navy-delegation-visits-Sri-Lanka-for-Galle-Dialogue-2025/56-782260	en	dailyftlk	1758914349.0
lk_news	2025-09-27-virakesarilk-0b0ecebb	virakesarilk-0b0ecebb	2025-09-27	ஆசிய கிண்ண கடைசி சுப்பர் 4இல் சுப்பர் ஓவரில் இந்தியா வெற்றி; மூவகை கிரிக்கெட்டிலும் சதம் குவித்த 4ஆவது இலங்கையரானார் நிஸ்ஸன்க	https://www.virakesari.lk/article/226205	ta	virakesarilk	1758914280.0
lk_news	2025-09-27-dailyftlk-87213999	dailyftlk-87213999	2025-09-27	Global Dialogue Forum conclave showcases AI’s role in powering green energy, food security and cybersecurity	https://www.ft.lk/business/Global-Dialogue-Forum-conclave-showcases-AI-s-role-in-powering-green-energy-food-security-and-cybersecurity/34-782259	en	dailyftlk	1758914246.0
lk_news	2025-09-27-dailyftlk-4524ddeb	dailyftlk-4524ddeb	2025-09-27	Sustainable champions in industry receive Ecolabel Sri Lanka recognition	https://www.ft.lk/business/Sustainable-champions-in-industry-receive-Ecolabel-Sri-Lanka-recognition/34-782258	en	dailyftlk	1758914206.0
lk_news	2025-09-27-dailyftlk-5f50f728	dailyftlk-5f50f728	2025-09-27	Sanasa Life Insurance supports Colombo International Book Fair as official insurance partner	https://www.ft.lk/business/Sanasa-Life-Insurance-supports-Colombo-International-Book-Fair-as-official-insurance-partner/34-782257	en	dailyftlk	1758914090.0
lk_news	2025-09-27-dailyftlk-5762d806	dailyftlk-5762d806	2025-09-27	Serendib Flour Mills showcases innovation and engagement at Profood Propack & AgBiz 2025	https://www.ft.lk/business/Serendib-Flour-Mills-showcases-innovation-and-engagement-at-Profood-Propack-AgBiz-2025/34-782256	en	dailyftlk	1758914020.0
lk_news	2025-09-27-dailyftlk-2c254c01	dailyftlk-2c254c01	2025-09-27	Yaden Laboratories shines at Tecnosalud 2025	https://www.ft.lk/business/Yaden-Laboratories-shines-at-Tecnosalud-2025/34-782255	en	dailyftlk	1758913954.0
lk_news	2025-09-27-virakesarilk-a62809b0	virakesarilk-a62809b0	2025-09-27	பொது எதிர்பார்ப்புக்களை கொண்ட பிரஜைகளை பிரிக்கவே முடியாது - சீனத்தூதுவர் தெரிவிப்பு	https://www.virakesari.lk/article/226204	ta	virakesarilk	1758913680.0
lk_news	2025-09-27-virakesarilk-13f8837a	virakesarilk-13f8837a	2025-09-27	கிரிக்கெட்டில் மாத்திரம் கவனம் செலுத்தி வில்லங்கம் இல்லாமல் விளையாடுவோம்  - ஹாமன்ப்ரீத், சானா தெரிவிப்பு	https://www.virakesari.lk/article/226202	ta	virakesarilk	1758913500.0
lk_news	2025-09-27-virakesarilk-45f8110a	virakesarilk-45f8110a	2025-09-27	அரை இறுதிக்கு இலங்கை செல்ல வேண்டும் என்பதே எனது குறிக்கோள் - சமரி அத்தபத்து	https://www.virakesari.lk/article/226203	ta	virakesarilk	1758913440.0
lk_news	2025-09-27-dailyftlk-76c83c46	dailyftlk-76c83c46	2025-09-27	Politics of Tamil-Muslim relations	https://www.ft.lk/columns/Politics-of-Tamil-Muslim-relations/4-782245	en	dailyftlk	1758912151.0
lk_news	2025-09-26-dailyftlk-9d5a6eaa	dailyftlk-9d5a6eaa	2025-09-26	Selective republicanism of socialist regime rules	https://www.ft.lk/columns/Selective-republicanism-of-socialist-regime-rules/4-782242	en	dailyftlk	1758911222.0
lk_news	2025-09-26-dailyftlk-61c62c32	dailyftlk-61c62c32	2025-09-26	Shutting down the internet shuts down your right to know	https://www.ft.lk/opinion/Shutting-down-the-internet-shuts-down-your-right-to-know/14-782241	en	dailyftlk	1758910821.0
lk_news	2025-09-26-dailyftlk-2828b364	dailyftlk-2828b364	2025-09-26	Sri Lanka’s tourism at crossroads: Wake-up call on World Tourism Day	https://www.ft.lk/opinion/Sri-Lanka-s-tourism-at-crossroads-Wake-up-call-on-World-Tourism-Day/14-782239	en	dailyftlk	1758910434.0
lk_news	2025-09-26-dailyftlk-304877ea	dailyftlk-304877ea	2025-09-26	City-centric approaches to climate-related human mobility	https://www.ft.lk/columns/City-centric-approaches-to-climate-related-human-mobility/4-782238	en	dailyftlk	1758910202.0
lk_news	2025-09-26-lankadeepalk-49083fe6	lankadeepalk-49083fe6	2025-09-26	‘‘ආහාර ටොන් කෝටි 130ක් වසරක අපතේ යවනවා‘‘	https://www.lankadeepa.lk/latest_news/ආහර-ටන-කට-130ක-වසරක-අපත-යවනව/1-680298	si	lankadeepalk	1758906594.0
lk_news	2025-09-26-lankadeepalk-22c65f2e	lankadeepalk-22c65f2e	2025-09-26	‘‘වේරහැර R.M.V. සේවාවලට අල්ලස් ගන්නවා‘‘	https://www.lankadeepa.lk/latest_news/වරහර-R-M-V-සවවලට-අලලස-ගනනව/1-680297	si	lankadeepalk	1758906054.0
lk_news	2025-09-26-virakesarilk-444af170	virakesarilk-444af170	2025-09-26	திஸ்ஸமஹாராமவில் துப்பாக்கிச் சூடு – ஒருவர் பலி	https://www.virakesari.lk/article/226201	ta	virakesarilk	1758904740.0
lk_news	2025-09-26-lankadeepalk-e531ac1d	lankadeepalk-e531ac1d	2025-09-26	තේ පොහොර සහනාධාරය QR ක්‍රමයට	https://www.lankadeepa.lk/news/ත-පහර-සහනධරය-QR-කරමයට/101-680296	si	lankadeepalk	1758903844.0
lk_news	2025-09-26-tamilmirrorlk-4a962fce	tamilmirrorlk-4a962fce	2025-09-26	திஸ்ஸமஹாராம பகுதியில் துப்பாக்கிச் சூடு : ஒருவர் மரணம்	https://www.tamilmirror.lk/செய்திகள்/திஸ்ஸமஹாராம-பகுதியில்-துப்பாக்கிச்-சூடு-ஒருவர்-மரணம்/175-365356	ta	tamilmirrorlk	1758902832.0
lk_news	2025-09-26-lankadeepalk-f9cbb369	lankadeepalk-f9cbb369	2025-09-26	මධ්‍යම පරිසර අධිකාරිය GOv pay හා එක් වෙයි	https://www.lankadeepa.lk/latest_news/මධයම-පරසර-අධකරය-GOv-pay-හ-එක-වය/1-680295	si	lankadeepalk	1758901359.0
lk_news	2025-09-26-lankadeepalk-ad354731	lankadeepalk-ad354731	2025-09-26	උ.පෙළ විභාග පරීක්ෂකයන් ඔන්ලයින් තෝරයි	https://www.lankadeepa.lk/news/උ-පළ-වභග-පරකෂකයන-ඔනලයන-තරය/101-680294	si	lankadeepalk	1758900397.0
lk_news	2025-09-26-adalk-4ff15e12	adalk-4ff15e12	2025-09-26	කෝප් කමිටුව ශක්තිමත් කිරීමට ස්ථාවර නියෝග සංශෝධනය කරයි	https://www.ada.lk/breaking_news/කෝප්-කමිටුව-ශක්තිමත්-කිරීමට-ස්ථාවර-නියෝග-සංශෝධනය-කරයි/11-418750	si	adalk	1758897659.0
lk_news	2025-09-26-virakesarilk-ea2a74b1	virakesarilk-ea2a74b1	2025-09-26	கடற்றொழிலாளர்களின் பிள்ளைகளின் கல்விக்கு ஜனாதிபதி நிதியத்திலிருந்து விசேட நிதி உதவி – கடற்றொழில் அமைச்சர்	https://www.virakesari.lk/article/226200	ta	virakesarilk	1758896940.0
lk_news	2025-09-26-lankadeepalk-eb9e5f4f	lankadeepalk-eb9e5f4f	2025-09-26	තිස්සමහාරාම වෙඩි තැබීමකින් අයෙක් මරුට	https://www.lankadeepa.lk/latest_news/තසසමහරම-වඩ-තබමකන-අයක-මරට/1-680293	si	lankadeepalk	1758896894.0
lk_news	2025-09-26-virakesarilk-6723e65c	virakesarilk-6723e65c	2025-09-26	காங்கேசன்துறை துறைமுக அபிவிருத்தி இறுதி தீர்மானம் ஏதும் எடுக்கப்படவில்லை - அமைச்சர் பிமல் ரத்நாயக்க	https://www.virakesari.lk/article/226196	ta	virakesarilk	1758896820.0
lk_news	2025-09-26-virakesarilk-6cc6440e	virakesarilk-6cc6440e	2025-09-26	யாழ். பழைய பூங்காவில் உள்ள சிறுவர் பூங்காவை மேம்படுத்த நடவடிக்கை - அரசாங்க அதிபர்	https://www.virakesari.lk/article/226187	ta	virakesarilk	1758896760.0
lk_news	2025-09-26-virakesarilk-2d110c0a	virakesarilk-2d110c0a	2025-09-26	மன்னார் மக்களை எதிர்த்து அடாவடியாக காற்றாலை திட்டத்தை முன்னெடுக்கவேண்டாம்  - ரவிகரன்	https://www.virakesari.lk/article/226190	ta	virakesarilk	1758896640.0
lk_news	2025-09-26-virakesarilk-1b385ed4	virakesarilk-1b385ed4	2025-09-26	இலஞ்ச ஊழல் ஆணைக்குழு அரசாங்கத்தின் அடக்குமுறையை செயற்படுத்துகிறது - நளின் பண்டார	https://www.virakesari.lk/article/226191	ta	virakesarilk	1758896580.0
lk_news	2025-09-26-virakesarilk-16301456	virakesarilk-16301456	2025-09-26	அமைதி, மேம்பாட்டின் உன்னத நோக்கத்திற்கு சீனா மகத்தான பங்களிப்புகளைச் செய்யும் - சீனத் தூதுவர்	https://www.virakesari.lk/article/226199	ta	virakesarilk	1758896400.0
lk_news	2025-09-26-lankadeepalk-7f6a8748	lankadeepalk-7f6a8748	2025-09-26	කෘතිම බුද්ධිය වෘත්තීය මාධ්‍යවේදියාට පහරක්ද?	https://www.lankadeepa.lk/test/කතම-බදධය-වතතය-මධයවදයට-පහරකද/222-680292	si	lankadeepalk	1758895070.0
lk_news	2025-09-26-virakesarilk-6bbd3eea	virakesarilk-6bbd3eea	2025-09-26	மருத்துவம், ஆயுர்வேதம், உணவு மற்றும் அழகு சாதன பரிசோதனைகளுக்கு நவீன ஆய்வுகூடம் - அமைச்சர் நளிந்த ஜயதிஸ்ஸ	https://www.virakesari.lk/article/226192	ta	virakesarilk	1758894600.0
lk_news	2025-09-26-virakesarilk-e7c7c225	virakesarilk-e7c7c225	2025-09-26	ஏறாவூர் சுற்றுலா நீதிமன்ற சிறைக்கூடத்தில் கைதி ஒருவர் உயிர்மாய்ப்பு	https://www.virakesari.lk/article/226193	ta	virakesarilk	1758894540.0
lk_news	2025-09-26-virakesarilk-d0206942	virakesarilk-d0206942	2025-09-26	ஆசிய அபிவிருத்தி வங்கியின் நிதியுதவியில் சுகாதார சேவைகளுக்கு பயன்படுத்த 7 வாகனங்கள் வழங்கி வைப்பு	https://www.virakesari.lk/article/226194	ta	virakesarilk	1758894360.0
lk_news	2025-09-26-virakesarilk-03871ed8	virakesarilk-03871ed8	2025-09-26	இலஞ்சம் பெற்ற குற்றச்சாட்டில் மூவர் கைது	https://www.virakesari.lk/article/226198	ta	virakesarilk	1758894120.0
lk_news	2025-09-26-virakesarilk-b729cc24	virakesarilk-b729cc24	2025-09-26	வேன் - சிறிய லொறி - முச்சக்கர வண்டி  மோதி விபத்து ; 12 பேர் காயம்,  பண்டாரகமயில்  சம்பவம்	https://www.virakesari.lk/article/226197	ta	virakesarilk	1758894060.0
lk_news	2025-09-26-tamilmirrorlk-b49c06e3	tamilmirrorlk-b49c06e3	2025-09-26	பகிடிவதை விவகாரம் : மாணவர்களுக்கு விளக்கமறியல்	https://www.tamilmirror.lk/செய்திகள்/பகிடிவதை-விவகாரம்-மாணவர்களுக்கு-விளக்கமறியல்/175-365341	ta	tamilmirrorlk	1758893898.0
lk_news	2025-09-26-tamilmirrorlk-8a788e25	tamilmirrorlk-8a788e25	2025-09-26	ஆடையை கழற்றி பகிடிவதை : மாணவர்களுக்கு விளக்கமறியல்	https://www.tamilmirror.lk/செய்திகள்/ஆடையை-கழற்றி-பகிடிவதை-மாணவர்களுக்கு-விளக்கமறியல்/175-365341	ta	tamilmirrorlk	1758893898.0
lk_news	2025-09-26-lankadeepalk-7f3bfbc9	lankadeepalk-7f3bfbc9	2025-09-26	නා උයන ආරණ්‍යයේ හිමිවරුන්ට වජිර අවසන් ගෞරව දක්වයි	https://www.lankadeepa.lk/latest_news/න-උයන-ආරණයය-හමවරනට-වජර-අවසන-ගරව-දකවය/1-680291	si	lankadeepalk	1758892229.0
lk_news	2025-09-26-lankadeepalk-122f2950	lankadeepalk-122f2950	2025-09-26	නා උයනනේ අනතුර ගැන කතෝලික සම්මේලනයෙන් ශෝක පණිවුඩයක්	https://www.lankadeepa.lk/latest_news/න-උයනන-අනතර-ගන-කතලක-සමමලනයන-ශක-පණවඩයක/1-680290	si	lankadeepalk	1758891620.0
lk_news	2025-09-26-lankadeepalk-b343d8c2	lankadeepalk-b343d8c2	2025-09-26	’’ආණ්ඩුවේ ප්‍රතිපත්ති’’ ක්‍රියාත්මක කිරීම ගැන සතුටුයි	https://www.lankadeepa.lk/news/ආණඩව-පරතපතත-කරයතමක-කරම-ගන-සතටය/101-680289	si	lankadeepalk	1758891323.0
lk_news	2025-09-26-virakesarilk-8f09c243	virakesarilk-8f09c243	2025-09-26	அறுகம்பேயில் உள்ள இஸ்ரேலின் சபாத் இல்லத்தினால் மக்கள் பீதியடைந்தால் சட்ட நடவடிக்கை எடுக்குமாறு நீதிமன்றம் பொலிஸாருக்கு ஆலோசனை - அமைச்சர் சுனில் செனவி	https://www.virakesari.lk/article/226189	ta	virakesarilk	1758891000.0
lk_news	2025-09-26-virakesarilk-bbd747ae	virakesarilk-bbd747ae	2025-09-26	வவுனியா வடக்கில் தமிழர்களின் பூர்வீக காணிகள், குளங்களை விழுங்கப்போகும் கிவுல் ஓயா திட்டத்தை உடன் நிறுத்துங்கள் -  ரவிகரன்	https://www.virakesari.lk/article/226188	ta	virakesarilk	1758890640.0
lk_news	2025-09-26-virakesarilk-02882d52	virakesarilk-02882d52	2025-09-26	சாதனை படைக்கும் ரஜினி கிஷன் நடிக்கும் 'ரஜினி கேங்'	https://www.virakesari.lk/article/226186	ta	virakesarilk	1758890400.0
lk_news	2025-09-26-virakesarilk-5ece12c7	virakesarilk-5ece12c7	2025-09-26	நடிகை யாஷிகா ஆனந்த் நடிக்கும் 'டாஸ்' படத்தின் படப்பிடிப்பு தொடக்கம்	https://www.virakesari.lk/article/226184	ta	virakesarilk	1758890040.0
lk_news	2025-09-26-lankadeepalk-63b3da7c	lankadeepalk-63b3da7c	2025-09-26	ලංගම ඩිපෝවල ලොක්කෝ පොඩ්ඩෝ  උදේ ඉදන් සූර් වෙලා	https://www.lankadeepa.lk/news/ලගම-ඩපවල-ලකක-පඩඩ-උද-ඉදන-සර-වල/101-680288	si	lankadeepalk	1758888961.0
lk_news	2025-09-26-virakesarilk-7ab582eb	virakesarilk-7ab582eb	2025-09-26	தமிழ் திரையுலக பிரபலங்கள் இணைந்து வெளியிட்ட 'இரவின் விழிகள்' படத்தின் இசை மற்றும் முன்னோட்டம்	https://www.virakesari.lk/article/226181	ta	virakesarilk	1758888900.0
lk_news	2025-09-26-lankadeepalk-c74faca5	lankadeepalk-c74faca5	2025-09-26	රාමඤ්ඤ නිකායේ විහාරවල කහ කොඩි ඔසවන්න	https://www.lankadeepa.lk/news/රමඤඤ-නකය-වහරවල-කහ-කඩ-ඔසවනන/101-680287	si	lankadeepalk	1758888808.0
lk_news	2025-09-26-economynextcom-9ad477d6	economynextcom-9ad477d6	2025-09-26	Sri Lanka rupee flat against dollar, bond yields steady	https://economynext.com/sri-lanka-rupee-flat-against-dollar-bond-yields-steady-241992/	en	economynextcom	1758888360.0
lk_news	2025-09-26-virakesarilk-d2dc2f65	virakesarilk-d2dc2f65	2025-09-26	சர்வதேச மாணவர் விருதினை பெற்ற இலங்கை கடற்படையினைச் சேர்ந்த LCDR கத்ரிஆரச்சிகே கத்ரிஆரச்சிக்கு அமெரிக்க தூதரகம் வாழ்த்து	https://www.virakesari.lk/article/226155	ta	virakesarilk	1758888120.0
lk_news	2025-09-26-virakesarilk-998389eb	virakesarilk-998389eb	2025-09-26	சிங்கள மொழி கற்றல் சமூக கலாசாரத்தைப்  புரிதலும் இனங்களுக்கு இடையேயான உறவுகளை வளர்க்க உதவும் –  முனீர் முளப்பர்	https://www.virakesari.lk/article/226179	ta	virakesarilk	1758887940.0
lk_news	2025-09-26-virakesarilk-81c5abca	virakesarilk-81c5abca	2025-09-26	தேசிய பொருளாதார மீட்புக்காக ஃபாம் ஒயில் செய்கையை மீண்டும் ஆரம்பிக்க அரசாங்கத்தை வலியுறுத்துகிறது இலங்கைக பெருந்தோட்ட முதலாளிமார் சம்மேளனம்	https://www.virakesari.lk/article/226174	ta	virakesarilk	1758887940.0
lk_news	2025-09-26-virakesarilk-584fbdaf	virakesarilk-584fbdaf	2025-09-26	வலிந்து காணாமலாக்கப்பட்டவர்களுக்கு நீதி கோரி இரண்டாம் நாள் உண்ணாவிரதப் போராட்டம்	https://www.virakesari.lk/article/226175	ta	virakesarilk	1758887760.0
lk_news	2025-09-26-virakesarilk-c49eec7b	virakesarilk-c49eec7b	2025-09-26	சர்ச்சைக்குரிய கொள்கலன்களை விடுவிக்க அனுமதியளித்தது யார்? என்பதை அரசாங்கம் விரைவில் வெளிப்படுத்த வேண்டும் - நாமல் ராஜபக்ஷ	https://www.virakesari.lk/article/226172	ta	virakesarilk	1758887700.0
lk_news	2025-09-26-virakesarilk-99c8084d	virakesarilk-99c8084d	2025-09-26	வேலிக்கு ஓணான் சாட்சி போல ஊழல்வாதிகளுக்கு எதிர்க்கட்சியினர்  ஆதரவாக உள்ளார்கள் - மஹிந்த ஜயசிங்க	https://www.virakesari.lk/article/226173	ta	virakesarilk	1758887700.0
lk_news	2025-09-26-virakesarilk-fd431eae	virakesarilk-fd431eae	2025-09-26	அரசாங்கத்துக்கு எதிராக செயற்படுபவர்களுக்கு மாத்திரமே அரசாங்கம் கடைப்பிடித்து வருகிறது ; முஜிபுர் ரஹ்மான்	https://www.virakesari.lk/article/226171	ta	virakesarilk	1758887640.0
lk_news	2025-09-26-virakesarilk-b9623be6	virakesarilk-b9623be6	2025-09-26	2026 நிதியாண்டுக்கான நிதி ஒதுக்கீட்டுச் சட்டமூலத்தை பாராளுமன்றத்தில் சமர்ப்பித்தார் அனில் ஜயந்த பெர்னாண்டோ	https://www.virakesari.lk/article/226170	ta	virakesarilk	1758887640.0
lk_news	2025-09-26-virakesarilk-63f089f1	virakesarilk-63f089f1	2025-09-26	323 கொள்கலன்கள் விடுவிக்கப்பட்டமைக்கு அரசாங்கமே பொறுப்புக்கூற வேண்டும் - டி.வி.சானக	https://www.virakesari.lk/article/226169	ta	virakesarilk	1758887580.0
lk_news	2025-09-26-virakesarilk-7a23a0a4	virakesarilk-7a23a0a4	2025-09-26	சொத்து மதிப்பு பிரகடனம் தொடர்பில் எதிர்க்கட்சி தலைவர் தொடர்பில் அவதூறு பரப்பப்படுகிறது - ஐக்கிய மக்கள் சக்தி	https://www.virakesari.lk/article/226166	ta	virakesarilk	1758887520.0
lk_news	2025-09-26-virakesarilk-79c968b9	virakesarilk-79c968b9	2025-09-26	புதிய வாகன இலக்கத்தகடுகள் நவம்பர் 15 ஆம் திகதி முதல் விநியோகிக்கப்படும் - பிமல் ரத்நாயக்க	https://www.virakesari.lk/article/226167	ta	virakesarilk	1758887520.0
lk_news	2025-09-26-virakesarilk-e3ff6adf	virakesarilk-e3ff6adf	2025-09-26	LGBTIQ சுற்றுலாவை ஊக்குவிக்கும் திட்டத்திற்கு ஆதரவு	https://www.virakesari.lk/article/226157	ta	virakesarilk	1758887460.0
lk_news	2025-09-26-virakesarilk-01ef9583	virakesarilk-01ef9583	2025-09-26	களுவாஞ்சிகுடியில் ஆணின் சடலம் மீட்பு!	https://www.virakesari.lk/article/226168	ta	virakesarilk	1758887100.0
lk_news	2025-09-26-virakesarilk-e8321772	virakesarilk-e8321772	2025-09-26	யாழ்ப்பாணத்திலிருந்து பயணித்த ரயிலில் மோதி ஒருவர் பலி!	https://www.virakesari.lk/article/226177	ta	virakesarilk	1758887040.0
lk_news	2025-09-26-lankadeepalk-2c70be76	lankadeepalk-2c70be76	2025-09-26	අයවැය විසර්ජන පනත් කෙටුම්පත මැතිසබයට	https://www.lankadeepa.lk/news/අයවය-වසරජන-පනත-කටමපත-මතසබයට/101-680286	si	lankadeepalk	1758886569.0
lk_news	2025-09-26-tamilmirrorlk-db4fc198	tamilmirrorlk-db4fc198	2025-09-26	இலைதழைகள் மட்டும் தான் சாப்பாடு: ஆனால் சிக்ஸ்பேக்	https://www.tamilmirror.lk/செய்திகள்/இலைதழைகள்-மட்டும்-தான்-சாப்பாடு-ஆனால்-சிக்ஸ்பேக்/175-365339	ta	tamilmirrorlk	1758886030.0
lk_news	2025-09-26-economynextcom-fc52d216	economynextcom-fc52d216	2025-09-26	Sri Lanka stocks close up, driven by capital goods	https://economynext.com/sri-lanka-stocks-close-up-driven-by-capital-goods-241975/	en	economynextcom	1758885900.0
