doc_type	doc_id	num	date_str	description	url_metadata	lang	newspaper_id	time_ut
lk_news	2025-11-25-lankadeepalk-1fda1d19	lankadeepalk-1fda1d19	2025-11-25	රෝගී කතට අතවර කළැයි කියන වෛද්‍යවරයාට ඇප	https://www.lankadeepa.lk/latest_news/රග-කතට-අතවර-කළය-කයන-වදයවරයට-ඇප/1-683872	si	lankadeepalk	1764076518.0
lk_news	2025-11-25-virakesarilk-97b311f1	virakesarilk-97b311f1	2025-11-25	உயர்தர பரீட்சை வினாத்தாளின் வினாக்கள் நுகேகொடை தனியார் கல்வி நிறுவனம் விநியோத்த வினாப் பத்திரத்தில்! - சாமர சம்பத் சுட்டிக்காட்டு	https://www.virakesari.lk/article/231437	ta	virakesarilk	1764076320.0
lk_news	2025-11-25-virakesarilk-385cf55d	virakesarilk-385cf55d	2025-11-25	பொருளியல் பரீட்சை வினாத்தாள் பரீட்சைக்கு முன்னரே கசிவு ; முறையான விசாரணைகள் தேவை - சானக மாதுகொட	https://www.virakesari.lk/article/231436	ta	virakesarilk	1764076320.0
lk_news	2025-11-25-virakesarilk-b6855b09	virakesarilk-b6855b09	2025-11-25	பொய் கூறுவதாக தன் மீது சுமத்தப்படும் குற்றச்சாட்டு தொடர்பில் சிறப்புரிமை பிரச்சினையை முன்வைத்த சஜித் - சபையில் சர்ச்சை	https://www.virakesari.lk/article/231435	ta	virakesarilk	1764076260.0
lk_news	2025-11-25-virakesarilk-4d1dab38	virakesarilk-4d1dab38	2025-11-25	ஏழ்மையான பெற்றோர்கள், மாணவர்களை சுரண்டிப் பிழைக்கும் டியூசன் மாபியா ; இதுவரை ஆளுங்கட்சி நடவடிக்கை எடுக்கவில்லை - கபீர் ஹாசிம்	https://www.virakesari.lk/article/231431	ta	virakesarilk	1764076200.0
lk_news	2025-11-25-virakesarilk-33bb76ed	virakesarilk-33bb76ed	2025-11-25	நடைமுறையிலுள்ள சட்டத்துக்கு அப்பால் மாகாண சபைத் தேர்தலை நடத்த முடியாது - அரசாங்கம்	https://www.virakesari.lk/article/231433	ta	virakesarilk	1764076200.0
lk_news	2025-11-25-tamilmirrorlk-c00eb74c	tamilmirrorlk-c00eb74c	2025-11-25	அனைத்து பாலர் பாடசாலைகளுக்கும் விடுமுறை	https://www.tamilmirror.lk/செய்திகள்/அனைத்து-பாலர்-பாடசாலைகளுக்கும்-விடுமுறை/175-368485	ta	tamilmirrorlk	1764075813.0
lk_news	2025-11-25-lankadeepalk-05119bb1	lankadeepalk-05119bb1	2025-11-25	සුද්දියන්ට රසඟ පෙන් වූ රෝද තුනේ රියැදුරා මාස හයක් හිරේ	https://www.lankadeepa.lk/latest_news/සදදයනට-රසඟ-පන-ව-රද-තන-රයදර-මස-හයක-හර/1-683871	si	lankadeepalk	1764075290.0
lk_news	2025-11-25-virakesarilk-c75bfa67	virakesarilk-c75bfa67	2025-11-25	கடினதரை டென்னிஸ்  சம்பியன்ஷிப்பில்   4 சம்பியன் பட்டங்களை சூடி அசத்திய 14 வயது பாடசாலை மாணவி அனன்யா	https://www.virakesari.lk/article/231434	ta	virakesarilk	1764074460.0
lk_news	2025-11-25-lankadeepalk-775be90f	lankadeepalk-775be90f	2025-11-25	දිසා 12කට නාය අවදානම්	https://www.lankadeepa.lk/latest_news/දස-12කට-නය-අවදනම/1-683870	si	lankadeepalk	1764074412.0
lk_news	2025-11-25-lankadeepalk-e91620d0	lankadeepalk-e91620d0	2025-11-25	ඉදිරි දිනවල වැස් වැඩි වන හැඩ	https://www.lankadeepa.lk/latest_news/ඉදර-දනවල-වස-වඩ-වන-හඩ/1-683869	si	lankadeepalk	1764074052.0
lk_news	2025-11-25-virakesarilk-488c9f11	virakesarilk-488c9f11	2025-11-25	பெண்களை அவதூறாக வர்ணித்த அமைச்சர்களை கட்சியில் இருந்து நீக்க ஜனாதிபதி அநுரகுமாரவிடம் நடவடிக்கை கோரிக்கை – சாமர சம்பத் தசநாயக்க	https://www.virakesari.lk/article/231432	ta	virakesarilk	1764074040.0
lk_news	2025-11-25-lankadeepalk-6bc7813e	lankadeepalk-6bc7813e	2025-11-25	කොත්මලේ දොරක් ඇරේ	https://www.lankadeepa.lk/latest_news/කතමල-දරක-ඇර/1-683868	si	lankadeepalk	1764073567.0
lk_news	2025-11-25-lankadeepalk-efc1e62a	lankadeepalk-efc1e62a	2025-11-25	ගැලවූ පුරා විද්‍යා පුවරු සකච්ඡාකර සවිකරන්නැයි නියෝගයක්	https://www.lankadeepa.lk/latest_news/ගලව-පර-වදය-පවර-සකචඡකර-සවකරනනය-නයගයක/1-683867	si	lankadeepalk	1764073273.0
lk_news	2025-11-25-virakesarilk-c920bd87	virakesarilk-c920bd87	2025-11-25	தொல்பொருள் அடையாளங்களை பாதுகாப்பதற்காக திணைக்களத்துக்கு ஆலோசனைக் குழுவை நியமிப்பது தொடர்பில் சம உரிமை இயக்கம் கடிதம்	https://www.virakesari.lk/article/231430	ta	virakesarilk	1764073080.0
lk_news	2025-11-25-virakesarilk-cf4febdf	virakesarilk-cf4febdf	2025-11-25	சுமார் 100 அடி பள்ளத்தில் கவிழ்ந்து லொறி விபத்து ; சாரதி படுகாயம்!	https://www.virakesari.lk/article/231429	ta	virakesarilk	1764072420.0
lk_news	2025-11-25-virakesarilk-0ae5ce83	virakesarilk-0ae5ce83	2025-11-25	யாழ். வடமராட்சியில் இளைஞன் கொலை ; இருவர் கைது	https://www.virakesari.lk/article/231428	ta	virakesarilk	1764072180.0
lk_news	2025-11-25-lankadeepalk-c53daec1	lankadeepalk-c53daec1	2025-11-25	හම්බන්තොට අයවැය සම්මතයි	https://www.lankadeepa.lk/latest_news/හමබනතට-අයවය-සමමතය/1-683866	si	lankadeepalk	1764072159.0
lk_news	2025-11-25-adalk-22e10fdc	adalk-22e10fdc	2025-11-25	අත්අඩංගුවට ගන්නා මත්ද්‍රව්‍ය ඒ ඒ අවස්ථාවලදීම විනාශ කරන්න නීති	https://www.ada.lk/breaking_news/අත්අඩංගුවට-ගන්නා-මත්ද්‍රව්‍ය-ඒ-ඒ-අවස්ථාවලදීම-විනාශ-කරන්න-නීති/11-419883	si	adalk	1764072139.0
lk_news	2025-11-25-virakesarilk-26a209ed	virakesarilk-26a209ed	2025-11-25	பகிரங்கப்படுத்தப்பட்டது இலங்கை - அமெரிக்காவுக்கு இடையிலான பாதுகாப்பு புரிந்துணர்வு ஒப்பந்தம்	https://www.virakesari.lk/article/231423	ta	virakesarilk	1764072000.0
lk_news	2025-11-25-lankadeepalk-728d2889	lankadeepalk-728d2889	2025-11-25	පාසල් මුරකරුගේ ස්ථානෝචිත ප්‍රඥාවෙන් වැලකුණු දුම්රිය අනතුර	https://www.lankadeepa.lk/latest_news/පසල-මරකරග-සථනචත-පරඥවන-වලකණ-දමරය-අනතර/1-683865	si	lankadeepalk	1764071893.0
lk_news	2025-11-25-virakesarilk-a90531d4	virakesarilk-a90531d4	2025-11-25	கல்விக்கு 1.3 சதவீதமே ஒதுக்கப்பட்டுள்ளது ; இந்த தொகை போதுமானது அல்ல -  கஜேந்திரகுமார் பொன்னம்பலம்	https://www.virakesari.lk/article/231426	ta	virakesarilk	1764071640.0
lk_news	2025-11-25-virakesarilk-62b4583b	virakesarilk-62b4583b	2025-11-25	இயலாமை உடைய நபர்கள் தொடர்பில் அனுதாபப்படத் தேவையில்லை, அவர்கள் சுயமாகச் செயற்படுவதற்குத் தேவையான சூழலை ஏற்படுத்திக் கொடுப்பதே அவசியமானது – தொழில் அமைச்சர் அனில் ஜயந்த பெர்னாந்து	https://www.virakesari.lk/article/231424	ta	virakesarilk	1764071580.0
lk_news	2025-11-25-virakesarilk-4e958919	virakesarilk-4e958919	2025-11-25	அலைமருவி சமிக்ஞை தொலைக்காட்சி ஒளிபரப்பு முறைமைக்கான அனுமதிப்பத்திரம் வழங்கும் செயன்முறையை இடைநிறுத்த தீர்மானம்	https://www.virakesari.lk/article/231425	ta	virakesarilk	1764071580.0
lk_news	2025-11-25-tamilmirrorlk-c2161034	tamilmirrorlk-c2161034	2025-11-25	வினாத்தாள் கசிந்ததா? CIDயில் புகார்	https://www.tamilmirror.lk/செய்திகள்/வினாத்தாள்-கசிந்ததா-CIDயில்-புகார்/175-368484	ta	tamilmirrorlk	1764071562.0
lk_news	2025-11-25-virakesarilk-1fa73fd6	virakesarilk-1fa73fd6	2025-11-25	சட்டவிரோத சொத்து குவிப்பு ; போதைப்பொருள் கடத்தல்காரரின் மனைவி கைது!	https://www.virakesari.lk/article/231427	ta	virakesarilk	1764071040.0
