doc_type	doc_id	num	date_str	description	url_metadata	lang	newspaper_id	time_ut
lk_news	2025-12-10-lankadeepalk-512d3ab2	lankadeepalk-512d3ab2	2025-12-10	රස පරීක්ෂක නිලධාරීන් 50ක් කොන්ත්‍රාත් පදනමට	https://www.lankadeepa.lk/latest_news/රස-පරකෂක-නලධරන-50ක-කනතරත-පදනමට/1-685011	si	lankadeepalk	1765347833.0
lk_news	2025-12-10-lankadeepalk-4fd02eeb	lankadeepalk-4fd02eeb	2025-12-10	රට නගන අරමුදල⁣ට කෝටි 189ක් ලැබිලා	https://www.lankadeepa.lk/latest_news/රට-නගන-අරමදලට-කට-189ක-ලබල/1-685009	si	lankadeepalk	1765347468.0
lk_news	2025-12-10-virakesarilk-60b38aab	virakesarilk-60b38aab	2025-12-10	ரிதிமாலியத்த பிரதேச செயலகப் பிரிவுக்கு உட்பட்ட பகுதிகளில் மண்சரிவு அபாயம்!	https://www.virakesari.lk/article/232959	ta	virakesarilk	1765347360.0
lk_news	2025-12-10-tamilmirrorlk-e86a86e7	tamilmirrorlk-e86a86e7	2025-12-10	தொடர் பணியில்  முப்படையினரும் அரச நிறுவனங்களும்	https://www.tamilmirror.lk/செய்திகள்/தொடர்-பணியில்-முப்படையினரும்-அரச-நிறுவனங்களும்/175-369362	ta	tamilmirrorlk	1765347351.0
lk_news	2025-12-10-lankadeepalk-5507c43a	lankadeepalk-5507c43a	2025-12-10	බුර්කාවක් ඇඟලා නගරයේ සැරි සැරූ සිසුවා අත්අඩංගුවට	https://www.lankadeepa.lk/news/බරකවක-ඇඟල-නගරය-සර-සර-සසව-අතඅඩගවට/101-685007	si	lankadeepalk	1765347193.0
lk_news	2025-12-10-virakesarilk-d0ec4abc	virakesarilk-d0ec4abc	2025-12-10	அரசியல்வாதிகள் பின்பற்றுவதற்கு உதாரணத்தை வகுக்கும் மக்கள்	https://www.virakesari.lk/article/232957	ta	virakesarilk	1765347180.0
lk_news	2025-12-10-virakesarilk-3b6f30f6	virakesarilk-3b6f30f6	2025-12-10	யாழ். குறிகாட்டுவான் வீதி துரிதகதியில் புனரமைப்பு	https://www.virakesari.lk/article/232955	ta	virakesarilk	1765347120.0
lk_news	2025-12-10-lankadeepalk-74bac6fa	lankadeepalk-74bac6fa	2025-12-10	සූමෝ ශූරයෝ මව්බිමට එති	https://www.lankadeepa.lk/news/සම-ශරය-මවබමට-එත/101-685004	si	lankadeepalk	1765347092.0
lk_news	2025-12-10-virakesarilk-60233214	virakesarilk-60233214	2025-12-10	ஹட்டன் - நோர்டன் பிரதான வீதியின் பாலத்தை புனரமைக்கும் இராணுவம்!	https://www.virakesari.lk/article/232956	ta	virakesarilk	1765346820.0
lk_news	2025-12-10-tamilmirrorlk-23c6e2e9	tamilmirrorlk-23c6e2e9	2025-12-10	பெண்களுக்கு எதிரான வன்முறையை ஒழிக்க ஜோன் கீல்ஸ்  அறக்கட்டளை பங்களிப்பு	https://www.tamilmirror.lk/செய்திகள்/பெண்களுக்கு-எதிரான-வன்முறையை-ஒழிக்க-ஜோன்-கீல்ஸ்-அறக்கட்டளை-பங்களிப்பு/175-369361	ta	tamilmirrorlk	1765346712.0
lk_news	2025-12-10-tamilmirrorlk-8dd5a72b	tamilmirrorlk-8dd5a72b	2025-12-10	தந்தை எச்சரித்ததால் உயிரை மாய்த்த சிறுமி	https://www.tamilmirror.lk/மலையகம்/தந்தை-எச்சரித்ததால்-உயிரை-மாய்த்த-சிறுமி/76-369360	ta	tamilmirrorlk	1765346576.0
lk_news	2025-12-10-tamilmirrorlk-a4555fa5	tamilmirrorlk-a4555fa5	2025-12-10	“அணையின் மீது கனரக வாகனங்கள் செல்ல தடை”	https://www.tamilmirror.lk/மலையகம்/அணையின்-மீது-கனரக-வாகனங்கள்-செல்ல-தடை/76-369359	ta	tamilmirrorlk	1765346503.0
lk_news	2025-12-10-virakesarilk-4c17fcc0	virakesarilk-4c17fcc0	2025-12-10	அனர்த்தத்தால் பாதிக்கப்பட்ட வீடுகளுக்குள் நுழைந்து பெறுமதியான பொருட்களை திருடிய 12 பேர் கைது!	https://www.virakesari.lk/article/232954	ta	virakesarilk	1765346460.0
lk_news	2025-12-10-virakesarilk-b52de3de	virakesarilk-b52de3de	2025-12-10	யாழ். பல்கலையில் போதனைசாராப் பணியாளர் வெற்றிடங்களை நிரப்புமாறு கோரி தொழிற்சங்க சம்மேளனம் வேலைநிறுத்த போராட்டத்தில் ஈடுபடப்போவதாக எச்சரிக்கை	https://www.virakesari.lk/article/232951	ta	virakesarilk	1765346160.0
lk_news	2025-12-10-virakesarilk-9665124a	virakesarilk-9665124a	2025-12-10	வெளிநாட்டு மனிதாபிமான நிவாரண உதவிகளை ஒருங்கிணைக்க உயர்மட்ட தேசியக் குழு நியமனம்	https://www.virakesari.lk/article/232953	ta	virakesarilk	1765346100.0
lk_news	2025-12-10-lankadeepalk-86c02b59	lankadeepalk-86c02b59	2025-12-10	කොස්ගම වෙඩිතැබීමේ වෙඩික්කරු  ඇතුළු තුනක්  මාට්ටු	https://www.lankadeepa.lk/news/කසගම-වඩතබම-වඩකකර-ඇතළ-තනක-මටට/101-684997	si	lankadeepalk	1765346079.0
lk_news	2025-12-10-virakesarilk-a59076f3	virakesarilk-a59076f3	2025-12-10	டித்வா சூறாவளியால் சேதமடைந்த வர்த்தகங்கள் மற்றும் சொத்துக்களுக்கு இழப்பீடு வழங்க காப்புறுதி நிறுவனங்கள் தயார்!	https://www.virakesari.lk/article/232952	ta	virakesarilk	1765345980.0
lk_news	2025-12-10-adalk-18f2bb09	adalk-18f2bb09	2025-12-10	බෝගහපතන කන්දේ නාය යෑමක්	https://www.ada.lk/breaking_news/බෝගහපතන-කන්දේ-නාය-යෑමක්/11-420157	si	adalk	1765345702.0
lk_news	2025-12-10-tamilmirrorlk-a6d0e9f9	tamilmirrorlk-a6d0e9f9	2025-12-10	Re building Sri lanka  திட்டத்திற்கு  ரூ.1893 மில்லியன்  நிதி உதவி	https://www.tamilmirror.lk/செய்திகள்/Re-building-Sri-lanka-திட்டத்திற்கு-ரூ-1893-மில்லியன்-நிதி-உதவி/175-369358	ta	tamilmirrorlk	1765345633.0
lk_news	2025-12-10-lankadeepalk-3bc889be	lankadeepalk-3bc889be	2025-12-10	කොල්මලේ ජලාශ වේල්ල මතින් බර වාහන ධාවනය තහනම් කරයි	https://www.lankadeepa.lk/news/කලමල-ජලශ-වලල-මතන-බර-වහන-ධවනය-තහනම-කරය/101-684988	si	lankadeepalk	1765345342.0
lk_news	2025-12-10-lankadeepalk-3c852b5b	lankadeepalk-3c852b5b	2025-12-10	ඉන්දුනීසියාවේ තට්ටු හතක ගොඩනැගිල්ල ගින්නක්	https://www.lankadeepa.lk/news/ඉනදනසයව-තටට-හතක-ගඩනගලල-ගනනක/101-684987	si	lankadeepalk	1765345305.0
lk_news	2025-12-10-adalk-d678d991	adalk-d678d991	2025-12-10	හේමාස් හෝල්ඩින්ග්ස් සභාපති නියෝජ්‍ය සභාපති පුටුවට යයි	https://www.ada.lk/business/හේමාස්-හෝල්ඩින්ග්ස්-සභාපති-නියෝජ්‍ය-සභාපති-පුටුවට-යයි/7-420156	si	adalk	1765344911.0
lk_news	2025-12-10-lankadeepalk-168f7519	lankadeepalk-168f7519	2025-12-10	රට නගන අරමුදලට රට වටින් ආධාර	https://www.lankadeepa.lk/news/රට-නගන-අරමදලට-රට-වටන-ආධර/101-684986	si	lankadeepalk	1765344868.0
lk_news	2025-12-10-virakesarilk-694e2702	virakesarilk-694e2702	2025-12-10	பதுளை - போகஹபத்தன பகுதியில் மண்சரிவு!	https://www.virakesari.lk/article/232950	ta	virakesarilk	1765344480.0
lk_news	2025-12-10-tamilmirrorlk-1119f6e3	tamilmirrorlk-1119f6e3	2025-12-10	உலகின் மிக அழகான பெண்களின் பட்டியல்	https://www.tamilmirror.lk/விநோத-உலகம்/உலகின்-மிக-அழகான-பெண்களின்-பட்டியல்/53-369356	ta	tamilmirrorlk	1765343987.0
lk_news	2025-12-10-virakesarilk-5e73c51d	virakesarilk-5e73c51d	2025-12-10	ஹிக்கடுவையில் ரயிலுடன் மோதி கார் விபத்து!	https://www.virakesari.lk/article/232949	ta	virakesarilk	1765343760.0
lk_news	2025-12-10-virakesarilk-5576e358	virakesarilk-5576e358	2025-12-10	சுற்றுலாப் பயணிகள் அதிகம் வருகை தரும் தெமோதரையில் மண்சரிவு அபாயம்!	https://www.virakesari.lk/article/232948	ta	virakesarilk	1765343460.0
lk_news	2025-12-10-virakesarilk-4a6286a5	virakesarilk-4a6286a5	2025-12-10	மீட்சிக்குக் கைகொடுக்கும் சர்வதேசம் ; தோழனாகத் தலைமை தாங்கும் இந்தியா	https://www.virakesari.lk/article/232947	ta	virakesarilk	1765343280.0
lk_news	2025-12-10-tamilmirrorlk-8b8a75bf	tamilmirrorlk-8b8a75bf	2025-12-10	கப்பலுக்கு பொருட்களை ஏற்றியவர் கடலில் விழுந்து மரணம்	https://www.tamilmirror.lk/செய்திகள்/கப்பலுக்கு-பொருட்களை-ஏற்றியவர்-கடலில்-விழுந்து-மரணம்/175-369355	ta	tamilmirrorlk	1765343278.0
