doc_type	doc_id	num	date_str	description	url_metadata	lang	newspaper_id	time_ut
lk_news	2025-12-10-lankadeepalk-b55bdac1	lankadeepalk-b55bdac1	2025-12-10	කලාවැවේ වාන් යළි අරී	https://www.lankadeepa.lk/latest_news/කලවව-වන-යළ-අර/1-685042	si	lankadeepalk	1765366248.0
lk_news	2025-12-10-lankadeepalk-60400773	lankadeepalk-60400773	2025-12-10	ග්‍රීසි නඩුවෙන් කබ්රාල් නිදහස්	https://www.lankadeepa.lk/latest_news/ගරස-නඩවන-කබරල-නදහස/1-685041	si	lankadeepalk	1765366177.0
lk_news	2025-12-10-lankadeepalk-0933b47b	lankadeepalk-0933b47b	2025-12-10	යෝෂිතට එරෙහි නඩුව කල්යයි	https://www.lankadeepa.lk/latest_news/යෂතට-එරහ-නඩව-කලයය/1-685040	si	lankadeepalk	1765365969.0
lk_news	2025-12-10-lankadeepalk-74048ce1	lankadeepalk-74048ce1	2025-12-10	වරායේදී භාණ්ඩ ඉස්සූ වාප්පු ලිපිකරු මාට්ටු	https://www.lankadeepa.lk/news/වරයද-භණඩ-ඉසස-වපප-ලපකර-මටට/101-685039	si	lankadeepalk	1765365709.0
lk_news	2025-12-10-lankadeepalk-3870f3ee	lankadeepalk-3870f3ee	2025-12-10	දෙසැම්බර් 31කට කලින් ඇළ වේලි හදයි	https://www.lankadeepa.lk/news/දසමබර-31කට-කලන-ඇළ-වල-හදය/101-685038	si	lankadeepalk	1765365420.0
lk_news	2025-12-10-lankadeepalk-967bdb92	lankadeepalk-967bdb92	2025-12-10	විපතට පත්වූවන් 85000ක් තවමත් සුරක්ෂා කඳවුරුවල	https://www.lankadeepa.lk/latest_news/වපතට-පතවවන-85000ක-තවමත-සරකෂ-කඳවරවල/1-685037	si	lankadeepalk	1765365291.0
lk_news	2025-12-10-lankadeepalk-49653c9d	lankadeepalk-49653c9d	2025-12-10	හලාවත රෝහලට වැස්සෙන් බර හානි	https://www.lankadeepa.lk/news/හලවත-රහලට-වසසන-බර-හන/101-685036	si	lankadeepalk	1765365062.0
lk_news	2025-12-10-adalk-5ef157bb	adalk-5ef157bb	2025-12-10	විපක්ෂයෙන් ආපදා තෙරතුරු මධ්‍යස්ථානයක්	https://www.ada.lk/breaking_news/විපක්ෂයෙන්-ආපදා-තෙරතුරු-මධ්‍යස්ථානයක්/11-420166	si	adalk	1765364885.0
lk_news	2025-12-10-lankadeepalk-38b7d6a9	lankadeepalk-38b7d6a9	2025-12-10	විපක්‍ෂයේ විරෝධයන් කොළඹ මහ නගර සභාව රත්වෙයි	https://www.lankadeepa.lk/news/වපකෂය-වරධයන-කළඹ-මහ-නගර-සභව-රතවය/101-685035	si	lankadeepalk	1765364715.0
lk_news	2025-12-10-lankadeepalk-bb505567	lankadeepalk-bb505567	2025-12-10	විපතට පත් ජනතාවගේ තොරතුරු විපක්ෂ කාර්යාලයෙන් රැස්කරයි	https://www.lankadeepa.lk/news/වපතට-පත-ජනතවග-තරතර-වපකෂ-කරයලයන-රසකරය/101-685034	si	lankadeepalk	1765364673.0
lk_news	2025-12-10-lankadeepalk-625e5e51	lankadeepalk-625e5e51	2025-12-10	ආපදාවට සහන දුන් හැටි නිපෝලි සමාජ ක්‍රියාකරු කියයි	https://www.lankadeepa.lk/latest_news/ආපදවට-සහන-දන-හට-නපල-සමජ-කරයකර-කයය/1-685033	si	lankadeepalk	1765364413.0
lk_news	2025-12-10-adalk-ab6aaf4b	adalk-ab6aaf4b	2025-12-10	නුවරඑලිය ගම්පොළ පාර සැහැල්ලු වාහන ධාවනය සදහා විවෘතයි	https://www.ada.lk/picture_story/නුවරඑලිය-ගම්පොළ-පාර-සැහැල්ලු-වාහන-ධාවනය-සදහා-විවෘතයි/10-420164	si	adalk	1765363686.0
lk_news	2025-12-10-tamilmirrorlk-d600b304	tamilmirrorlk-d600b304	2025-12-10	நீலாபொல விவசாய நிலங்கள்  மணலால் மூடப்பட்டுள்ளன	https://www.tamilmirror.lk/செய்திகள்/நீலாபொல-விவசாய-நிலங்கள்-மணலால்-மூடப்பட்டுள்ளன/175-369381	ta	tamilmirrorlk	1765363655.0
lk_news	2025-12-10-lankadeepalk-f48f2812	lankadeepalk-f48f2812	2025-12-10	ජල සම්පාදන ක්‍රම, 99%ක් යථා තත්වයට	https://www.lankadeepa.lk/news/ජල-සමපදන-කරම-99ක-යථ-තතවයට/101-685032	si	lankadeepalk	1765363637.0
lk_news	2025-12-10-virakesarilk-1007b824	virakesarilk-1007b824	2025-12-10	கிவுல் ஓயா திட்டம் தொடர்பில் வெளிப்படையான கலந்துரையாடலை கோரிய சத்தியலிங்கம் எம்.பி	https://www.virakesari.lk/article/232973	ta	virakesarilk	1765363320.0
lk_news	2025-12-10-tamilmirrorlk-0602a0aa	tamilmirrorlk-0602a0aa	2025-12-10	மும்பையில் ‘பேஷன் ஷோ’வில்  மெஸ்சி	https://www.tamilmirror.lk/பிரதான-விளையாட்டு/மும்பையில்-பேஷன்-ஷோ-வில்-மெஸ்சி/44-369380	ta	tamilmirrorlk	1765362773.0
lk_news	2025-12-10-adalk-0f36e7db	adalk-0f36e7db	2025-12-10	ජල බෝතල් වැඩි මිලට වික්කාට රු. ලක්ෂ 5ක දඩ	https://www.ada.lk/breaking_news/ජල-බෝතල්-වැඩි-මිලට-වික්කාට-රු--ලක්ෂ-5ක-දඩ/11-420163	si	adalk	1765362746.0
lk_news	2025-12-10-tamilmirrorlk-df8b52ff	tamilmirrorlk-df8b52ff	2025-12-10	உதவிப் பொருட்களுடன் ரஷ்ய விமானம் வந்திறங்கியது	https://www.tamilmirror.lk/செய்திகள்/உதவிப்-பொருட்களுடன்-ரஷ்ய-விமானம்-வந்திறங்கியது/175-369379	ta	tamilmirrorlk	1765362439.0
lk_news	2025-12-10-virakesarilk-efd5b2a4	virakesarilk-efd5b2a4	2025-12-10	கிரேக்க பிணைமுறி வழக்கு - மத்திய வங்கி முன்னாள் ஆளுநர் அஜித் நிவாட் கப்ரால் உட்பட 4 பேர் விடுதலை!	https://www.virakesari.lk/article/232991	ta	virakesarilk	1765362300.0
lk_news	2025-12-10-adalk-c7506f02	adalk-c7506f02	2025-12-10	රුසියා ආධාර රැගත් ගුවන් යානයක් එයි	https://www.ada.lk/picture_story/රුසියා-ආධාර-රැගත්-ගුවන්-යානයක්-එයි/10-420162	si	adalk	1765361817.0
lk_news	2025-12-10-virakesarilk-1f158194	virakesarilk-1f158194	2025-12-10	தென்னிந்திய திரைத்துறையில் இந்திய மதிப்பில் நான்காயிரம் கோடி ரூபாய் முதலீடு செய்யும் ஜியோ ஹாட்ஸ்டார் நிறுவனம் : தமிழக அரசுடன் புரிந்துணர் ஒப்பந்தம் கைசாத்து	https://www.virakesari.lk/article/232989	ta	virakesarilk	1765361640.0
lk_news	2025-12-10-virakesarilk-6e8feb10	virakesarilk-6e8feb10	2025-12-10	இன்றைய நாணய மாற்று விகிதம்	https://www.virakesari.lk/article/232978	ta	virakesarilk	1765361280.0
lk_news	2025-12-10-lankadeepalk-4f6ba934	lankadeepalk-4f6ba934	2025-12-10	රුසියානු ආධාර තොගයක් කටුනායකට	https://www.lankadeepa.lk/latest_news/රසයන-ආධර-තගයක-කටනයකට/1-685031	si	lankadeepalk	1765361020.0
lk_news	2025-12-10-virakesarilk-462edb32	virakesarilk-462edb32	2025-12-10	கனமழையால் மீண்டும் மூழ்கிய வயல் நிலங்கள்	https://www.virakesari.lk/article/232987	ta	virakesarilk	1765360860.0
lk_news	2025-12-10-virakesarilk-aae29e98	virakesarilk-aae29e98	2025-12-10	அர்ஜுன் தாஸ் உடன் இணையும் மலையாள நடிகை அன்னா பென்	https://www.virakesari.lk/article/232988	ta	virakesarilk	1765360560.0
lk_news	2025-12-10-lankadeepalk-67a9f5f6	lankadeepalk-67a9f5f6	2025-12-10	කොත්මලේ හරහා ගමන් කිරීම සහැල්ලු වාහන පමණයි	https://www.lankadeepa.lk/news/කතමල-හරහ-ගමන-කරම-සහලල-වහන-පමණය/101-685030	si	lankadeepalk	1765359688.0
lk_news	2025-12-10-lankadeepalk-3ba34b07	lankadeepalk-3ba34b07	2025-12-10	කොත්මලේ හරහා ගමන් කිරීම සැහැල්ලු වාහන පමණයි	https://www.lankadeepa.lk/latest_news/කතමල-හරහ-ගමන-කරම-සහලල-වහන-පමණය/1-685030	si	lankadeepalk	1765359688.0
lk_news	2025-12-10-virakesarilk-34ff5a1b	virakesarilk-34ff5a1b	2025-12-10	மீண்டும் இணையும் ஆதித்யா பாஸ்கர் - கௌரி கிஷன் கூட்டணி	https://www.virakesari.lk/article/232983	ta	virakesarilk	1765359600.0
lk_news	2025-12-10-tamilmirrorlk-776ff510	tamilmirrorlk-776ff510	2025-12-10	காதலனின் மனைவியிடமிருந்து தப்பிக்க பெண் செய்த விபரீதம் (வீடியோ)	https://www.tamilmirror.lk/செய்திகள்/காதலனின்-மனைவியிடமிருந்து-தப்பிக்க-பெண்-செய்த-விபரீதம்-வீடியோ/175-369376	ta	tamilmirrorlk	1765359521.0
lk_news	2025-12-10-virakesarilk-a0c6dd86	virakesarilk-a0c6dd86	2025-12-10	இயக்குநர் கே. பாக்யராஜ் வெளியிட்ட 'ஜஸ்டிஸ் ஃபார் ஜெனி' படத்தின் இசை மற்றும் முன்னோட்டம்	https://www.virakesari.lk/article/232982	ta	virakesarilk	1765359300.0
lk_news	2025-12-10-adalk-5f6b5c2b	adalk-5f6b5c2b	2025-12-10	ඔස්ට්‍රේලියාවේ සමාජ මාධ්‍ය තහනම අද සිට ක්‍රියාත්මක කරයි	https://www.ada.lk/breaking_news/ඔස්ට්‍රේලියාවේ-සමාජ-මාධ්‍ය-තහනම-අද-සිට-ක්‍රියාත්මක-කරයි/11-420161	si	adalk	1765359269.0
lk_news	2025-12-10-tamilmirrorlk-d311cb92	tamilmirrorlk-d311cb92	2025-12-10	Google Mapபில் இலங்கையின் சாலை வலையமைப்பு புதுப்பிப்பு	https://www.tamilmirror.lk/செய்திகள்/Google-Mapபில்-இலங்கையின்-சாலை-வலையமைப்பு-புதுப்பிப்பு/175-369375	ta	tamilmirrorlk	1765359072.0
lk_news	2025-12-10-virakesarilk-e14a9a50	virakesarilk-e14a9a50	2025-12-10	வவுனியாவில் வலிந்து காணாமல் ஆக்கப்பட்டோரின் உறவினர்கள் போராட்டம்	https://www.virakesari.lk/article/232975	ta	virakesarilk	1765358220.0
lk_news	2025-12-10-lankadeepalk-6bc51d07	lankadeepalk-6bc51d07	2025-12-10	ශක්තිමත් රටවල් මානව හිමිකම් රකිනවාද ප්‍රශ්නයක්	https://www.lankadeepa.lk/latest_news/ශකතමත-රටවල-මනව-හමකම-රකනවද-පරශනයක/1-685028	si	lankadeepalk	1765358125.0
lk_news	2025-12-10-virakesarilk-e884c86c	virakesarilk-e884c86c	2025-12-10	சில பகுதிகளுக்கு இடியுடன் கூடிய மழை எச்சரிக்கை	https://www.virakesari.lk/article/232976	ta	virakesarilk	1765358100.0
lk_news	2025-12-10-virakesarilk-6cfb00fe	virakesarilk-6cfb00fe	2025-12-10	வெள்ளத்தினால் பாதிக்கப்பட்ட பொதுக்கட்டடங்களை புனரமைக்கவும் கொடுப்பனவுகள் வழங்கப்படவேண்டும் - இம்ரான் எம்.பி	https://www.virakesari.lk/article/232965	ta	virakesarilk	1765357740.0
lk_news	2025-12-10-virakesarilk-70357b65	virakesarilk-70357b65	2025-12-10	சட்டவிரோத மணல் அகழ்வுக்கு எதிராக செயற்பட்டவர் மணலுடன் சென்ற கனரக வாகனம் மோதி பலி	https://www.virakesari.lk/article/232972	ta	virakesarilk	1765357560.0
lk_news	2025-12-10-adalk-9a5df71f	adalk-9a5df71f	2025-12-10	හිටපු මහබැංකු අධිපති කබ්රාල් ශ්‍රීක බැඳුම්කර නඩුවෙන් නිදහස්	https://www.ada.lk/breaking_news/හිටපු-මහබැංකු-අධිපති-කබ්රාල්-ශ්‍රීක-බැඳුම්කර-නඩුවෙන්-නිදහස්/11-420160	si	adalk	1765357171.0
lk_news	2025-12-10-tamilmirrorlk-8b413c95	tamilmirrorlk-8b413c95	2025-12-10	இடியுடன் கூடிய மழை எச்சரிக்கை	https://www.tamilmirror.lk/செய்திகள்/இடியுடன்-கூடிய-மழை-எச்சரிக்கை/175-369374	ta	tamilmirrorlk	1765356593.0
lk_news	2025-12-10-tamilmirrorlk-fcbd9df6	tamilmirrorlk-fcbd9df6	2025-12-10	வீடுகள் சுத்தம் செய்யும் பணியில் இணைந்த வெளிநாட்டவர்	https://www.tamilmirror.lk/மலையகம்/வீடுகள்-சுத்தம்-செய்யும்-பணியில்-இணைந்த-வெளிநாட்டவர்/76-369373	ta	tamilmirrorlk	1765356206.0
lk_news	2025-12-10-tamilmirrorlk-1dc3cbba	tamilmirrorlk-1dc3cbba	2025-12-10	மஞ்சள் அனகொண்டா குட்டிக்கு மறுப்பு	https://www.tamilmirror.lk/செய்திகள்/மஞ்சள்-அனகொண்டா-குட்டிக்கு-மறுப்பு/175-369372	ta	tamilmirrorlk	1765356194.0
lk_news	2025-12-10-virakesarilk-25ebc088	virakesarilk-25ebc088	2025-12-10	இலங்கை தீவின் முந்தைய அழகு இரட்டிப்பாகும் காலம் வெகு தொலைவில் இல்லை! - அனர்த்த நிலையிலும் டிசம்பர் முதல் 8 நாட்களில் 50,222 வெளிநாட்டு சுற்றுலாப் பயணிகள் நாட்டுக்கு வருகை	https://www.virakesari.lk/article/232870	ta	virakesarilk	1765356000.0
lk_news	2025-12-10-lankadeepalk-2232a22c	lankadeepalk-2232a22c	2025-12-10	ට්‍රම්ප් තායි - කාම්බෝජ ගැටුම්වලට යළි මැදිහත් වේ	https://www.lankadeepa.lk/latest_news/ටරමප-තය-කමබජ-ගටමවලට-යළ-මදහත-ව/1-685027	si	lankadeepalk	1765355924.0
lk_news	2025-12-10-virakesarilk-b9570bbc	virakesarilk-b9570bbc	2025-12-10	மாதம்பை தமிழ் பாடசாலையில் தற்காலிகமாக தங்கியிருக்கும் தோட்ட மக்களை பாதுகாப்பான இடங்களுக்கு மாற்றவேண்டும் - சுந்தரலிங்கம் பிரதீப்	https://www.virakesari.lk/article/232969	ta	virakesarilk	1765355520.0
lk_news	2025-12-10-virakesarilk-94b7b634	virakesarilk-94b7b634	2025-12-10	சீனாவில் இலஞ்ச மோசடியில் ஈடுபட்டவருக்கு மரண தண்டனை நிறைவேற்றப்பட்டது!	https://www.virakesari.lk/article/232971	ta	virakesarilk	1765355460.0
lk_news	2025-12-10-lankadeepalk-ad37d31b	lankadeepalk-ad37d31b	2025-12-10	යුක්රේන ජනපති පාප්තුමන් හමුවෙයි	https://www.lankadeepa.lk/latest_news/යකරන-ජනපත-පපතමන-හමවය/1-685026	si	lankadeepalk	1765355447.0
lk_news	2025-12-10-lankadeepalk-ba29715e	lankadeepalk-ba29715e	2025-12-10	තද වැසි අකුණු  කලාප ගැන කාලගුණයෙන්  නිවේදනයක්	https://www.lankadeepa.lk/latest_news/තද-වස-අකණ-කලප-ගන-කලගණයන-නවදනයක/1-685025	si	lankadeepalk	1765355382.0
lk_news	2025-12-10-tamilmirrorlk-ba7bf129	tamilmirrorlk-ba7bf129	2025-12-10	பர்தாவுடன் சுற்றித்திரிந்த மாணவன் கைது	https://www.tamilmirror.lk/மலையகம்/பர்தாவுடன்-சுற்றித்திரிந்த-மாணவன்-கைது/76-369369	ta	tamilmirrorlk	1765354455.0
lk_news	2025-12-10-lankadeepalk-d5b6faa7	lankadeepalk-d5b6faa7	2025-12-10	නුවරඑළිය රෝහලේ හානි බලන්න ලේකම් යයි	https://www.lankadeepa.lk/news/නවරඑළය-රහල-හන-බලනන-ලකම-යය/101-685021	si	lankadeepalk	1765354324.0
lk_news	2025-12-10-lankadeepalk-a7ff5f6c	lankadeepalk-a7ff5f6c	2025-12-10	ඇල්පිටිය ප්‍රා.ස. අය වැය සම්මතයි	https://www.lankadeepa.lk/news/ඇලපටය-පර-ස-අය-වය-සමමතය/101-685020	si	lankadeepalk	1765353877.0
lk_news	2025-12-10-tamilmirrorlk-570c4ddd	tamilmirrorlk-570c4ddd	2025-12-10	பதுளையில் 1,168 குழந்தைகள் பாதுகாப்பு மையங்களில்	https://www.tamilmirror.lk/மலையகம்/பதுளையில்-1-168-குழந்தைகள்-பாதுகாப்பு-மையங்களில்/76-369368	ta	tamilmirrorlk	1765353623.0
lk_news	2025-12-10-virakesarilk-08f9b619	virakesarilk-08f9b619	2025-12-10	இலங்கையின் வீதி வலையமைப்பை புதுப்பித்துள்ள கூகுள் மெப்	https://www.virakesari.lk/article/232970	ta	virakesarilk	1765353600.0
lk_news	2025-12-10-lankadeepalk-4e8bee46	lankadeepalk-4e8bee46	2025-12-10	මරණ පරීක්ෂකවරුන්ගෙන් පින් අතේ වැඩක්	https://www.lankadeepa.lk/news/මරණ-පරකෂකවරනගන-පන-අත-වඩක/101-685019	si	lankadeepalk	1765351523.0
lk_news	2025-12-10-lankadeepalk-abd0e59e	lankadeepalk-abd0e59e	2025-12-10	දිට්වාගෙන් මතුවන අර්බුද	https://www.lankadeepa.lk/features/දටවගන-මතවන-අරබද/2-685018	si	lankadeepalk	1765351089.0
lk_news	2025-12-10-adalk-d867ed9e	adalk-d867ed9e	2025-12-10	අධ්‍යාපන අමාත්‍යාංශයෙන් විශේෂ නිවේදනයක්	https://www.ada.lk/breaking_news/අධ්‍යාපන-අමාත්‍යාංශයෙන්-විශේෂ-නිවේදනයක්/11-420159	si	adalk	1765350700.0
lk_news	2025-12-10-virakesarilk-46c95d30	virakesarilk-46c95d30	2025-12-10	சூழல்நேயம்மிக்க போக்குவரத்திற்கு உதவும் முகமாக TAILG இலெக்ட்ரிக் மோட்டார் சைக்கிள்களை சிங்கர் அறிமுகப்படுத்தியுள்ளது	https://www.virakesari.lk/article/232968	ta	virakesarilk	1765350600.0
lk_news	2025-12-10-virakesarilk-12d73868	virakesarilk-12d73868	2025-12-10	இலங்கை காப்பீட்டு நிறுவனம்  இலங்கை பார் எசோசியேஷனுடன் ஓய்வூதியத்திட்டங்களை வழங்க உள்ளனர்	https://www.virakesari.lk/article/232967	ta	virakesarilk	1765350480.0
lk_news	2025-12-10-virakesarilk-0f525621	virakesarilk-0f525621	2025-12-10	அவுஸ்திரேலிய துணை அமைச்சர் ஜூலியன் ஹில் இலங்கைக்கு விஜயம்!	https://www.virakesari.lk/article/232966	ta	virakesarilk	1765350420.0
lk_news	2025-12-10-lankadeepalk-6ed087d6	lankadeepalk-6ed087d6	2025-12-10	පහට අඩු දූදරුවන් 1,168 ක් බදුල්ලේ සුරක්ෂිත මධ්‍යස්ථානවල	https://www.lankadeepa.lk/latest_news/පහට-අඩ-දදරවන-1-168-ක-බදලල-සරකෂත-මධයසථනවල/1-685017	si	lankadeepalk	1765350163.0
lk_news	2025-12-10-lankadeepalk-9f3162ae	lankadeepalk-9f3162ae	2025-12-10	කොළඹ යළි අනවසර ඉදිකිරීම් බෑ	https://www.lankadeepa.lk/latest_news/කළඹ-යළ-අනවසර-ඉදකරම-බ/1-685016	si	lankadeepalk	1765350154.0
lk_news	2025-12-10-tamilmirrorlk-c91bb6fb	tamilmirrorlk-c91bb6fb	2025-12-10	கொழும்புக்கு அதிரடி அறிவிப்பு	https://www.tamilmirror.lk/செய்திகள்/கொழும்புக்கு-அதிரடி-அறிவிப்பு/175-369367	ta	tamilmirrorlk	1765349160.0
lk_news	2025-12-10-virakesarilk-a3a393b9	virakesarilk-a3a393b9	2025-12-10	மாறுகின்ற உலக ஒழுங்கில் இந்திய – ரஷ்ய உறவின் மீள் உறுதிப்பாடு	https://www.virakesari.lk/article/232963	ta	virakesarilk	1765348920.0
lk_news	2025-12-10-lankadeepalk-9f07101d	lankadeepalk-9f07101d	2025-12-10	කොළොන්න සභාව උණුසුම් වෙයි	https://www.lankadeepa.lk/latest_news/කළනන-සභව-උණසම-වය/1-685014	si	lankadeepalk	1765348661.0
lk_news	2025-12-10-virakesarilk-97c1d076	virakesarilk-97c1d076	2025-12-10	அனர்த்தத்தின் மத்தியிலும் சுற்றுலாப் பயணிகளின் எண்ணிக்கை அதிகரிப்பு!	https://www.virakesari.lk/article/232962	ta	virakesarilk	1765348620.0
lk_news	2025-12-10-tamilmirrorlk-eb109c3d	tamilmirrorlk-eb109c3d	2025-12-10	சட்டவிரோத மணல் அகழ்வுக்கு எதிரானவர்: மணல் ரிப்பர் மோதி  பலி	https://www.tamilmirror.lk/செய்திகள்/சட்டவிரோத-மணல்-அகழ்வுக்கு-எதிரானவர்-மணல்-ரிப்பர்-மோதி-பலி/175-369366	ta	tamilmirrorlk	1765348601.0
lk_news	2025-12-10-tamilmirrorlk-23a76d16	tamilmirrorlk-23a76d16	2025-12-10	மணல் அகழ்வுக்கு எதிராக செயற்பட்டவர்: மணல் ரிப்பர் மோதியதில் பலி	https://www.tamilmirror.lk/செய்திகள்/மணல்-அகழ்வுக்கு-எதிராக-செயற்பட்டவர்-மணல்-ரிப்பர்-மோதியதில்-பலி/175-369366	ta	tamilmirrorlk	1765348601.0
lk_news	2025-12-10-lankadeepalk-2cb6afa3	lankadeepalk-2cb6afa3	2025-12-10	කෝටි පන්දාහේ  පරිපූරකයට මුදල් සභාවේ අනුමැතිය	https://www.lankadeepa.lk/latest_news/කට-පනදහ-පරපරකයට-මදල-සභව-අනමතය/1-685013	si	lankadeepalk	1765348590.0
lk_news	2025-12-10-tamilmirrorlk-c9de9276	tamilmirrorlk-c9de9276	2025-12-10	கல்வியமைச்சின் மற்றுமோர்  அறிவிப்பு	https://www.tamilmirror.lk/செய்திகள்/கல்வியமைச்சின்-மற்றுமோர்-அறிவிப்பு/175-369365	ta	tamilmirrorlk	1765348144.0
lk_news	2025-12-10-virakesarilk-4a728c81	virakesarilk-4a728c81	2025-12-10	யாழில். 25 ஆயிரம் ரூபாய் நிதி உதவி தொகை பெறுவோரின் பெயர் பட்டியல் இன்று முதல் காட்சிப்படுத்தப்படும்!	https://www.virakesari.lk/article/232958	ta	virakesarilk	1765348140.0
lk_news	2025-12-10-virakesarilk-54d54f28	virakesarilk-54d54f28	2025-12-10	நெடுந்தீவு இறங்குதுறையில் படகுகள் கட்டியிருந்த கயிற்றில் தடுக்கி கடலில் விழுந்தவர் உயிரிழப்பு!	https://www.virakesari.lk/article/232960	ta	virakesarilk	1765348080.0
lk_news	2025-12-10-virakesarilk-43066d13	virakesarilk-43066d13	2025-12-10	பட்டாசு தொழிற்சாலையில் வெடிப்பு சம்பவம் ; இளைஞன் பலி!	https://www.virakesari.lk/article/232961	ta	virakesarilk	1765348020.0
