doc_type	doc_id	num	date_str	description	url_metadata	lang	newspaper_id	time_ut
lk_news	2025-12-12-virakesarilk-23fe902e	virakesarilk-23fe902e	2025-12-12	75வது கடற்படை ஆண்டு நிறைவை முன்னிட்டு இரத்த தான திட்டம் மற்றும் மருத்துவ முகாம்	https://www.virakesari.lk/article/233185	ta	virakesarilk	1765534260.0
lk_news	2025-12-12-adalk-9b9f8120	adalk-9b9f8120	2025-12-12	යටියන්තොට ප්‍රාස අයවැය දෙවන වරටත් පරදියි	https://www.ada.lk/breaking_news/යටියන්තොට-ප්‍රාස-අයවැය-දෙවන-වරටත්-පරදියි/11-420204	si	adalk	1765533867.0
lk_news	2025-12-12-lankadeepalk-6367a283	lankadeepalk-6367a283	2025-12-12	පිරිමි අතර වැඩි මුඛ  පිළිකා  ගැන සම්පූර්ණයෙන්	https://www.lankadeepa.lk/videos/පිරිමි-අතර-වැඩි-මුඛ--පිළිකා--ගැන-සම්පූර්ණයෙන්/12-685179	si	lankadeepalk	1765533007.0
lk_news	2025-12-12-virakesarilk-6bd013a2	virakesarilk-6bd013a2	2025-12-12	அட்டன் - நோர்டன்பிரிட்ஜ் பிரதான வீதியில் புதிய இரும்பு பாலம் அமைத்து போக்குவரத்துக்கு அனுமதி	https://www.virakesari.lk/article/233183	ta	virakesarilk	1765532760.0
lk_news	2025-12-12-virakesarilk-bbcf230d	virakesarilk-bbcf230d	2025-12-12	களுத்துறையில் நடைபெற்ற சர்வதேச அவசர சிகிச்சை அல்ட்ரா சவுண்ட் மாநாடு	https://www.virakesari.lk/article/233181	ta	virakesarilk	1765532700.0
lk_news	2025-12-12-virakesarilk-b36518b8	virakesarilk-b36518b8	2025-12-12	ரவி கருணாநாயக்க, அர்ஜுன் அலோசியஸ் வழக்கு : ஜனவரி 16ஆம் திகதி விசாரணைக்கு உத்தரவு	https://www.virakesari.lk/article/233180	ta	virakesarilk	1765532700.0
lk_news	2025-12-12-tamilmirrorlk-21ea6c90	tamilmirrorlk-21ea6c90	2025-12-12	முன்னாள் சபாநாயகர் கைது	https://www.tamilmirror.lk/செய்திகள்/முன்னாள்-சபாநாயகர்-கைது/175-369453	ta	tamilmirrorlk	1765532588.0
lk_news	2025-12-12-virakesarilk-cf6bd662	virakesarilk-cf6bd662	2025-12-12	19இன் கீழ் உலகக் கிண்ணம்: இலங்கையை எதிர்த்தாடவுள்ள இலங்கை வம்சாவளி ஆஸி.	https://www.virakesari.lk/article/233182	ta	virakesarilk	1765532520.0
lk_news	2025-12-12-lankadeepalk-7b658452	lankadeepalk-7b658452	2025-12-12	නාය මරකපොලු 2377ක්: විමර්ශන අරඹයි	https://www.lankadeepa.lk/latest_news/නය-මරකපල-2377ක-වමරශන-අරඹය/1-685176	si	lankadeepalk	1765531986.0
lk_news	2025-12-12-virakesarilk-03b45ce5	virakesarilk-03b45ce5	2025-12-12	முன்னாள் சபாநாயகர் அசோக ரன்வல கைது!	https://www.virakesari.lk/article/233178	ta	virakesarilk	1765528560.0
lk_news	2025-12-12-virakesarilk-b2a91483	virakesarilk-b2a91483	2025-12-12	பேரிடரின் பின்னர் மனதை அமைதியாகவும் ஆரோக்கியமாகவும் வைத்திருக்க இலங்கை உளநல வைத்தியர்கள் சங்கத்தின் ஆலோசனை	https://www.virakesari.lk/article/233174	ta	virakesarilk	1765528500.0
lk_news	2025-12-12-lankadeepalk-00ee6cdc	lankadeepalk-00ee6cdc	2025-12-12	ලංකාව අවස්ථා අල්ලා ගැනීමට අසමත්ද?	https://www.lankadeepa.lk/features/ලකව-අවසථ-අලල-ගනමට-අසමතද/2-685175	si	lankadeepalk	1765528293.0
lk_news	2025-12-12-lankadeepalk-b9e4e25e	lankadeepalk-b9e4e25e	2025-12-12	පා.මන්ත්‍රී හා හිටපු කතානායක රන්වල අත්අඩංගුවට	https://www.lankadeepa.lk/latest_news/ප-මනතර-හ-හටප-කතනයක-රනවල-අතඅඩගවට/1-685174	si	lankadeepalk	1765528168.0
lk_news	2025-12-12-virakesarilk-450cdd5b	virakesarilk-450cdd5b	2025-12-12	4 மாவட்டங்களுக்கு பலத்த மின்னல் தாக்கம் குறித்து எச்சரிக்கை!	https://www.virakesari.lk/article/233176	ta	virakesarilk	1765527900.0
lk_news	2025-12-12-bbccomsinhala-4d3aef00	bbccomsinhala-4d3aef00	2025-12-12	අජිත් නිවාඩ් කබ්රාල් 'නිදොස් කොට නිදහස්' කළා ද? අධිකරණයේදී සිදුවූයේ කුමක් ද?	https://www.bbc.com/sinhala/articles/c5y22qe5l0xo	si	bbccomsinhala	1765527786.0
lk_news	2025-12-12-lankadeepalk-48fd30c8	lankadeepalk-48fd30c8	2025-12-12	පෙර පාසල් ගුරුවරිය අනතුරින් මරුට	https://www.lankadeepa.lk/news/පර-පසල-ගරවරය-අනතරන-මරට/101-685173	si	lankadeepalk	1765526785.0
lk_news	2025-12-12-virakesarilk-70a78c1e	virakesarilk-70a78c1e	2025-12-12	ரயில்வே திணைக்கள அதிபர்களாக பெண்களையும் உள்ளீர்க்க முடியும் : அமைச்சரவை தீர்மானத்தை நீதிமன்றில் தெரிவித்தது அரசாங்கம் !	https://www.virakesari.lk/article/233165	ta	virakesarilk	1765526700.0
lk_news	2025-12-12-lankadeepalk-0c8fed46	lankadeepalk-0c8fed46	2025-12-12	රේල් පිලී කොටස් සමඟ අයෙක් අල්ලයි	https://www.lankadeepa.lk/news/රල-පල-කටස-සමඟ-අයක-අලලය/101-685151	si	lankadeepalk	1765525584.0
lk_news	2025-12-12-virakesarilk-b9f69e63	virakesarilk-b9f69e63	2025-12-12	அனர்த்தத்தால் பாதிக்கப்பட்ட ஆரம்பகால குழந்தைப் பருவ மேம்பாட்டு மையங்களை புனரமைக்க திட்டம்	https://www.virakesari.lk/article/233175	ta	virakesarilk	1765525260.0
lk_news	2025-12-12-adalk-fee01057	adalk-fee01057	2025-12-12	තියුණු ආයුධයකින් පහර දි බිරිදි ඝාතනය කල සැමියාට මරණ දඩුවම	https://www.ada.lk/breaking_news/තියුණු-ආයුධයකින්-පහර-දි-බිරිදි-ඝාතනය-කල-සැමියාට-මරණ-දඩුවම/11-420203	si	adalk	1765525015.0
lk_news	2025-12-12-adalk-f01ba245	adalk-f01ba245	2025-12-12	ඉදිරි වසර තුළ කිසිම සහල් හිඟයක් නැ	https://www.ada.lk/breaking_news/ඉදිරි-වසර-තුළ-කිසිම-සහල්-හිඟයක්-නැ/11-420202	si	adalk	1765524662.0
lk_news	2025-12-12-lankadeepalk-e5ece407	lankadeepalk-e5ece407	2025-12-12	දඹුල්ලේ එළවලු මිල ඉහළට	https://www.lankadeepa.lk/news/දඹලල-එළවල-මල-ඉහළට/101-685149	si	lankadeepalk	1765523679.0
lk_news	2025-12-12-virakesarilk-1c19a16c	virakesarilk-1c19a16c	2025-12-12	75வது கடற்படை தினத்தை முன்னிட்டு கடற்படைக்கு ஆசிர்வாதம் பெறுவதற்காக அநுராதபுரத்தில் உள்ள சந்தஹிரு சேவையில் நடைபெற்ற ஒளி விழா	https://www.virakesari.lk/article/233173	ta	virakesarilk	1765523580.0
lk_news	2025-12-12-virakesarilk-6e8feb10	virakesarilk-6e8feb10	2025-12-12	இன்றைய நாணய மாற்று விகிதம்	https://www.virakesari.lk/article/233171	ta	virakesarilk	1765523460.0
lk_news	2025-12-12-virakesarilk-a7f26aea	virakesarilk-a7f26aea	2025-12-12	கர்ப்பிணித் தாய்மார்களுக்கு ஊட்டச்சத்து கொடுப்பனவு வழங்க தீர்மானம் - மகளிர் மற்றும் சிறுவர் விவகார அமைச்சு	https://www.virakesari.lk/article/233170	ta	virakesarilk	1765523340.0
lk_news	2025-12-12-lankadeepalk-8e34cdb9	lankadeepalk-8e34cdb9	2025-12-12	සිදුවන්නට ගිය අනතුර නූලෙන් වැළකෙයි	https://www.lankadeepa.lk/news/සදවනනට-ගය-අනතර-නලන-වළකය/101-685148	si	lankadeepalk	1765522771.0
lk_news	2025-12-12-lankadeepalk-80d4b383	lankadeepalk-80d4b383	2025-12-12	රට රැකියා පෙන්වා කෝටි 5ක් වංචා කළ අයෙක් අල්ලයි	https://www.lankadeepa.lk/news/රට-රකය-පනව-කට-5ක-වච-කළ-අයක-අලලය/101-685147	si	lankadeepalk	1765521790.0
lk_news	2025-12-12-virakesarilk-88aa300e	virakesarilk-88aa300e	2025-12-12	மன்னாரில் 10 இலட்சம் ரூபாவுக்கும் அதிக பெறுமதியான போதைப்பொருளுடன் இருவர் கைது	https://www.virakesari.lk/article/233168	ta	virakesarilk	1765521720.0
lk_news	2025-12-12-virakesarilk-fa7dc86b	virakesarilk-fa7dc86b	2025-12-12	சீரற்ற வானிலை ; உயிரிழந்தோர் எண்ணிக்கை 639 ஆக அதிகரிப்பு	https://www.virakesari.lk/article/233162	ta	virakesarilk	1765521360.0
lk_news	2025-12-12-virakesarilk-69b7c573	virakesarilk-69b7c573	2025-12-12	நாட்டில் மண்சரிவு அபாயம் உள்ள 2,377 இடங்களில் ஆய்வுகள் ஆரம்பம்	https://www.virakesari.lk/article/233169	ta	virakesarilk	1765520940.0
