doc_type	doc_id	num	date_str	description	url_metadata	lang	newspaper_id	time_ut
lk_news	2025-11-19-virakesarilk-777192fc	virakesarilk-777192fc	2025-11-19	வடக்கு, கிழக்கு மக்களின் பிரச்சினைகளுக்கு புதிய அரசியல் தீர்வொன்று அவசியம் - ஜனாதிபதி	https://www.virakesari.lk/article/230839	ta	virakesarilk	1763559720.0
lk_news	2025-11-19-lankadeepalk-16d15991	lankadeepalk-16d15991	2025-11-19	ලෝක පිරිමින්ගේ දිනය (International Men’s Day - IMD) අදයි	https://www.lankadeepa.lk/visheshanga/ලක-පරමනග-දනය-International-Mens-Day-IMD-අදය/26-683491	si	lankadeepalk	1763559402.0
lk_news	2025-11-19-lankadeepalk-4bc16fe2	lankadeepalk-4bc16fe2	2025-11-19	උතුරු නැගෙනහිර ගැටලු වලට නව දේශපාලන විසඳුමක්	https://www.lankadeepa.lk/news/උතර-නගනහර-ගටල-වලට-නව-දශපලන-වසඳමක/101-683490	si	lankadeepalk	1763559160.0
lk_news	2025-11-19-lankadeepalk-9c62cc44	lankadeepalk-9c62cc44	2025-11-19	රාජ්‍ය පරිපාලන වැය ශීර්ෂය සම්මතයි	https://www.lankadeepa.lk/news/රජය-පරපලන-වය-ශරෂය-සමමතය/101-683489	si	lankadeepalk	1763558923.0
lk_news	2025-11-19-lankadeepalk-438007ec	lankadeepalk-438007ec	2025-11-19	අයවැයට වෛද්‍ය නිලධාරීන්ගේ සංසදයේ විරෝධය	https://www.lankadeepa.lk/latest_news/අයවයට-වදය-නලධරනග-සසදය-වරධය/1-683488	si	lankadeepalk	1763558499.0
lk_news	2025-11-19-lankadeepalk-6182d982	lankadeepalk-6182d982	2025-11-19	සමූල ඝාතනයක් නූලෙන් වැළකෙයි	https://www.lankadeepa.lk/latest_news/සමල-ඝතනයක-නලන-වළකය/1-683487	si	lankadeepalk	1763556716.0
lk_news	2025-11-19-virakesarilk-e728f8d4	virakesarilk-e728f8d4	2025-11-19	மதுபோதையில் வாகனங்களை செலுத்திய 14 சாரதிகள் கைது!	https://www.virakesari.lk/article/230835	ta	virakesarilk	1763556000.0
lk_news	2025-11-19-virakesarilk-83c4376c	virakesarilk-83c4376c	2025-11-19	ஜனாதிபதியை சந்தித்து இலங்கை தமிழ் அரசுக் கட்சி பேசிய விடயங்கள் என்ன?	https://www.virakesari.lk/article/230830	ta	virakesarilk	1763554140.0
lk_news	2025-11-19-adalk-3b58d929	adalk-3b58d929	2025-11-19	රුසියාවෙන් යුක්රේනයට ප්‍රහාරයක් - 20ක් මරුට	https://www.ada.lk/breaking_news/රුසියාවෙන්-යුක්රේනයට-ප්‍රහාරයක්---20ක්-මරුට/11-419763	si	adalk	1763553266.0
lk_news	2025-11-19-virakesarilk-3dab5f95	virakesarilk-3dab5f95	2025-11-19	தற்போதைய அல்லது எதிர்கால அரசியல் நிகழ்ச்சி நிரல்கள் மீண்டும் ஒருபோதும் இனவாதத்தின் மீது எழுதப்படாது - ஜனாதிபதி	https://www.virakesari.lk/article/230829	ta	virakesarilk	1763552640.0
lk_news	2025-11-19-virakesarilk-80194855	virakesarilk-80194855	2025-11-19	குறைநிரப்பு மதிப்பீட்டைக் கொண்டு வருவதன் மூலம் 2020-2024 ஆம் காலப்பகுதிகளுக்குள் ஓய்வுபெற்ற அரச ஊழியர்களின் பிரச்சினையை தீர்த்து வைக்க முடியும் - சஜித் பிரேமதாச	https://www.virakesari.lk/article/230827	ta	virakesarilk	1763552100.0
lk_news	2025-11-19-lankadeepalk-8b375ee4	lankadeepalk-8b375ee4	2025-11-19	පැන්ෂන් කැපුවොත් නඩු දානවා	https://www.lankadeepa.lk/news/පනෂන-කපවත-නඩ-දනව/101-683486	si	lankadeepalk	1763551988.0
lk_news	2025-11-19-virakesarilk-713d6623	virakesarilk-713d6623	2025-11-19	முதல் முறையாக இரண்டு அரியவகை வௌவால் இனங்கள் கண்டுபிடிப்பு	https://www.virakesari.lk/article/230826	ta	virakesarilk	1763551980.0
lk_news	2025-11-19-virakesarilk-415f1551	virakesarilk-415f1551	2025-11-19	ஜப்பானில் பாரிய தீ - 170க்கு மேற்பட்ட கட்டடங்கள் எரிந்து நாசம்! - ஒருவர் பலி?	https://www.virakesari.lk/article/230828	ta	virakesarilk	1763551860.0
lk_news	2025-11-19-lankadeepalk-69e0e423	lankadeepalk-69e0e423	2025-11-19	විශ්‍රාමිකයන්ගේ විරෝධතාවයට දයාසිරිත් එයි	https://www.lankadeepa.lk/news/විශ්‍රාමිකයන්ගේ-විරෝධතාවයට-දයාසිරිත්-එයි/101-683485	si	lankadeepalk	1763551792.0
lk_news	2025-11-19-tamilmirrorlk-4e46022e	tamilmirrorlk-4e46022e	2025-11-19	திருமலை புத்தர்:  “இரு தரப்புக்கும்   தொடர்பே இல்லை”	https://www.tamilmirror.lk/செய்திகள்/திருமலை-புத்தர்-இரு-தரப்புக்கும்-தொடர்பே-இல்லை/175-368190	ta	tamilmirrorlk	1763551470.0
lk_news	2025-11-19-adalk-7bfa1525	adalk-7bfa1525	2025-11-19	බදුල්ල රාත්‍රී තැපැල් දුම්රිය අවලංගු කරයි	https://www.ada.lk/breaking_news/බදුල්ල-රාත්‍රී-තැපැල්-දුම්රිය-අවලංගු-කරයි/11-419761	si	adalk	1763551212.0
lk_news	2025-11-19-lankadeepalk-8186da2c	lankadeepalk-8186da2c	2025-11-19	උඩරට මාර්ගයේ තැපැල් දුම්රිය දෙකක් අවලංගු කරයි	https://www.lankadeepa.lk/news/උඩරට-මරගය-තපල-දමරය-දකක-අවලග-කරය/101-683484	si	lankadeepalk	1763551055.0
lk_news	2025-11-19-virakesarilk-59925c09	virakesarilk-59925c09	2025-11-19	இரு மோட்டார் சைக்கிள்கள் நேருக்கு நேர் மோதி விபத்து ; இருவர் பலி ; ஒருவர் காயம்!	https://www.virakesari.lk/article/230825	ta	virakesarilk	1763550960.0
lk_news	2025-11-19-virakesarilk-89273857	virakesarilk-89273857	2025-11-19	நானுஓயாவில் விபத்து - ஒருவர் படுகாயம்!	https://www.virakesari.lk/article/230824	ta	virakesarilk	1763550600.0
lk_news	2025-11-19-tamilmirrorlk-2d9a17f7	tamilmirrorlk-2d9a17f7	2025-11-19	‘21’க்கு  ‘20’ போட்டி: சானக்க குற்றச்சாட்டு	https://www.tamilmirror.lk/செய்திகள்/21-க்கு-20-போட்டி-சானக்க-குற்றச்சாட்டு/175-368189	ta	tamilmirrorlk	1763550585.0
lk_news	2025-11-19-lankadeepalk-db1b878c	lankadeepalk-db1b878c	2025-11-19	ලංකා- ඇමරිකා ආරක්ෂක ගිවිසුම පාර්ලිමේන්තුවට දෙන්න	https://www.lankadeepa.lk/news/ලක-ඇමරක-ආරකෂක-ගවසම-පරලමනතවට-දනන/101-683483	si	lankadeepalk	1763550166.0
lk_news	2025-11-19-lankadeepalk-c39dc63d	lankadeepalk-c39dc63d	2025-11-19	ලෝක පාර්ලිමේන්තු සංගමයෙන් ලංකාවට සහතිකයක්	https://www.lankadeepa.lk/news/ලක-පරලමනත-සගමයන-ලකවට-සහතකයක/101-683482	si	lankadeepalk	1763550006.0
lk_news	2025-11-19-virakesarilk-058b2669	virakesarilk-058b2669	2025-11-19	திருநங்கை பாலியல் தொழிலாளர்களில் 30 வீதமானோர் போதைக்கு அடிமை : ட்ரான்ஸ் சமத்துவ அறக்கட்டளை கவலை	https://www.virakesari.lk/article/230823	ta	virakesarilk	1763550000.0
lk_news	2025-11-19-lankadeepalk-cbeac45b	lankadeepalk-cbeac45b	2025-11-19	“කන්න දීප අත සපා කෑ අලියා“	https://www.lankadeepa.lk/latest_news/කනන-දප-අත-සප-ක-අලය/1-683481	si	lankadeepalk	1763549807.0
lk_news	2025-11-19-tamilmirrorlk-08aeb7cc	tamilmirrorlk-08aeb7cc	2025-11-19	மரைன் படைக்கு 250 வது பிறந்த நாள் வாழ்த்து	https://www.tamilmirror.lk/செய்திகள்/மரைன்-படைக்கு-250-வது-பிறந்த-நாள்-வாழ்த்து/175-368188	ta	tamilmirrorlk	1763549413.0
lk_news	2025-11-19-virakesarilk-49ca8186	virakesarilk-49ca8186	2025-11-19	மூலிகை தாவரங்கள் பற்றாக்குறை ; ஆயுர்வேத மருந்து உற்பத்தி பாதிப்பு	https://www.virakesari.lk/article/230822	ta	virakesarilk	1763549400.0
lk_news	2025-11-19-lankadeepalk-82ed8ed2	lankadeepalk-82ed8ed2	2025-11-19	අනූනවයෙන් බේරුණු දුම්රිය මහා අනතුර	https://www.lankadeepa.lk/news/අනනවයන-බරණ-දමරය-මහ-අනතර/101-683479	si	lankadeepalk	1763549269.0
lk_news	2025-11-19-virakesarilk-ce933a32	virakesarilk-ce933a32	2025-11-19	என்னிடம் பாலியல் சேட்டையில்  ஈடுபட்ட  இளைஞன் தொடர்பில் விரைந்து நடவடிக்கை எடுத்த இலங்கை  பொலிஸாருக்கு நன்றி - நியூசிலாந்துப் பெண்	https://www.virakesari.lk/article/230816	ta	virakesarilk	1763549040.0
lk_news	2025-11-19-virakesarilk-39bf5d92	virakesarilk-39bf5d92	2025-11-19	தேரர் போன்று காவி உடை அணிந்து குற்றச் செயல்களில் ஈடுபட்டு வந்த சந்தேக நபர் கைது!	https://www.virakesari.lk/article/230821	ta	virakesarilk	1763549040.0
lk_news	2025-11-19-lankadeepalk-89ad9ab1	lankadeepalk-89ad9ab1	2025-11-19	කම්කරු උපදේශන සභාව සක්‍රීය වෙයි	https://www.lankadeepa.lk/news/කමකර-උපදශන-සභව-සකරය-වය/101-683478	si	lankadeepalk	1763548647.0
lk_news	2025-11-19-lankadeepalk-2ed6de9b	lankadeepalk-2ed6de9b	2025-11-19	රාජ්‍ය සේවා කොමිසමේ  වැඩක් නිසා අවුලක් වෙලා	https://www.lankadeepa.lk/news/රජය-සව-කමසම-වඩක-නස-අවලක-වල/101-683477	si	lankadeepalk	1763548551.0
lk_news	2025-11-19-virakesarilk-116390db	virakesarilk-116390db	2025-11-19	திருகோணமலையில் மாவீரர் பெற்றோர் மதிப்பளிப்பு விழா	https://www.virakesari.lk/article/230819	ta	virakesarilk	1763548500.0
lk_news	2025-11-19-adalk-302f3c80	adalk-302f3c80	2025-11-19	තාජුඩීන්ගේ මරණය ඝාතනයක් - ජනපති	https://www.ada.lk/breaking_news/තාජුඩීන්ගේ-මරණය-ඝාතනයක්---ජනපති/11-419760	si	adalk	1763547851.0
lk_news	2025-11-19-virakesarilk-bdd645ee	virakesarilk-bdd645ee	2025-11-19	சபாநாயகர் அலுவலகத்துக்குள் பாம்பு	https://www.virakesari.lk/article/230818	ta	virakesarilk	1763547720.0
lk_news	2025-11-19-lankadeepalk-31661c14	lankadeepalk-31661c14	2025-11-19	ජපන් රැකියා සංචිතයක් හදයි	https://www.lankadeepa.lk/news/ජපන-රකය-සචතයක-හදය/101-683476	si	lankadeepalk	1763547191.0
lk_news	2025-11-19-virakesarilk-134b85c1	virakesarilk-134b85c1	2025-11-19	இந்திய கடற்படையின் போர் கப்பல் இலங்கையை வந்தடைந்தது!	https://www.virakesari.lk/article/230813	ta	virakesarilk	1763547000.0
lk_news	2025-11-19-lankadeepalk-8c8d53c5	lankadeepalk-8c8d53c5	2025-11-19	අගතියට පත් විශ්‍රාමිකයන් වෙනුවෙන් උපරිම හඬ නගනවා	https://www.lankadeepa.lk/news/අගතියට-පත්-විශ්‍රාමිකයන්-වෙනුවෙන්-උපරිම-හඬ-නගනවා/101-683475	si	lankadeepalk	1763546899.0
lk_news	2025-11-19-tamilmirrorlk-8f9b91dc	tamilmirrorlk-8f9b91dc	2025-11-19	‘கை’யில் கைகளை உயர்த்திய எண்மருக்கு சிக்கல்	https://www.tamilmirror.lk/செய்திகள்/கை-யில்-கைகளை-உயர்த்திய-எண்மருக்கு-சிக்கல்/175-368186	ta	tamilmirrorlk	1763546610.0
lk_news	2025-11-19-virakesarilk-9074031b	virakesarilk-9074031b	2025-11-19	திருட்டு சம்பவத்துடன் தொடர்புடைய தேவாலய பூசாரி கைது!	https://www.virakesari.lk/article/230815	ta	virakesarilk	1763546520.0
lk_news	2025-11-19-lankadeepalk-6a1100f7	lankadeepalk-6a1100f7	2025-11-19	ටිරාන්ට  එරෙහිව අල්ලස් කොමිසමට පැමිණිල්ලක්	https://www.lankadeepa.lk/latest_news/ටරනට-එරහව-අලලස-කමසමට-පමණලලක/1-683474	si	lankadeepalk	1763546469.0
lk_news	2025-11-19-lankadeepalk-96679d5d	lankadeepalk-96679d5d	2025-11-19	විශ්‍රාමිකයෝ පොල්දූවේ විරෝධතාවයේ	https://www.lankadeepa.lk/news/වශරමකය-පලදව-වරධතවය/101-683473	si	lankadeepalk	1763546105.0
lk_news	2025-11-19-virakesarilk-dd7717ba	virakesarilk-dd7717ba	2025-11-19	அரச வைத்தியசாலைகளில் சுமார் 150 மருந்து வகைகளுக்கு  தட்டுப்பாடு!	https://www.virakesari.lk/article/230814	ta	virakesarilk	1763545920.0
lk_news	2025-11-19-lankadeepalk-52a95b59	lankadeepalk-52a95b59	2025-11-19	ඔබව වට්ටන්න හදන මිනිස්සුන්ට  මේ විදිහට පිළිතුරු දෙන්න	https://www.lankadeepa.lk/videos/ඔබව-වට්ටන්න-හදන-මිනිස්සුන්ට--මේ-විදිහට-පිළිතුරු-දෙන්න/12-683472	si	lankadeepalk	1763545183.0
lk_news	2025-11-19-virakesarilk-5fce69c4	virakesarilk-5fce69c4	2025-11-19	அமெரிக்க மரைன் படைப் பிரிவின் 250ஆவது ஆண்டு விழா அமெரிக்கத் தூதரகத்தில் கொண்டாட்டம்	https://www.virakesari.lk/article/230801	ta	virakesarilk	1763544900.0
lk_news	2025-11-19-virakesarilk-a99cc940	virakesarilk-a99cc940	2025-11-19	ஜீ 5 டிஜிட்டல் தளத்தில் வெளியாகும் நடிகர் பாலஹாசனின் 'ரேகை' கிரைம் திரில்லர் இணைய தொடர்	https://www.virakesari.lk/article/230809	ta	virakesarilk	1763544120.0
lk_news	2025-11-19-virakesarilk-7576ba8d	virakesarilk-7576ba8d	2025-11-19	இராஜதந்திர மோதல் ; ஜப்பானிய கடல் உணவு இறக்குமதியை தடை செய்யும் சீனா	https://www.virakesari.lk/article/230811	ta	virakesarilk	1763543880.0
lk_news	2025-11-19-virakesarilk-f67d4d7c	virakesarilk-f67d4d7c	2025-11-19	டிசம்பரில் வெளியாகும் அனுபமா பரமேஸ்வரனின் 'லாக் டவுன்'	https://www.virakesari.lk/article/230808	ta	virakesarilk	1763543400.0
lk_news	2025-11-19-lankadeepalk-bc6eb5b6	lankadeepalk-bc6eb5b6	2025-11-19	සජබ මන්ත්‍රීලා තුනකට මැතිසබේ අලුත් පුටු	https://www.lankadeepa.lk/news/සජබ-මනතරල-තනකට-මතසබ-අලත-පට/101-683458	si	lankadeepalk	1763543373.0
lk_news	2025-11-19-virakesarilk-8cf8d22d	virakesarilk-8cf8d22d	2025-11-19	சங்ககிரி ராஜ்குமார் நடித்து இயக்கும்  'ஒன் மேன்' படத்தின் அறிமுக காணொளி வெளியீடு	https://www.virakesari.lk/article/230806	ta	virakesarilk	1763543340.0
lk_news	2025-11-19-virakesarilk-86310d7a	virakesarilk-86310d7a	2025-11-19	அறிமுக நடிகர் தக்ஷ் நடிக்கும் ' ஏ பியூட்டிஃபுல் பிரேக் அப் ' எனும் படத்தின் டீசர் வெளியீடு	https://www.virakesari.lk/article/230807	ta	virakesarilk	1763543340.0
lk_news	2025-11-19-adalk-a03b3ea2	adalk-a03b3ea2	2025-11-19	විශේෂඥ වෛද්‍යවරුන්ගේ සේවා ව්‍යවස්ථාව කෙටුම්පත් කිරීමට කමිටුවක්	https://www.ada.lk/breaking_news/විශේෂඥ-වෛද්‍යවරුන්ගේ-සේවා-ව්‍යවස්ථාව-කෙටුම්පත්-කිරීමට-කමිටුවක්/11-419759	si	adalk	1763543131.0
lk_news	2025-11-19-virakesarilk-16c2eddb	virakesarilk-16c2eddb	2025-11-19	பொருளாதார நெருக்கடிக்குப்  பின்னர் வலுவான மீட்சி 20 இலட்சமாவது சுற்றுலாப் பயணி இலங்கை வருகை	https://www.virakesari.lk/article/230804	ta	virakesarilk	1763543040.0
lk_news	2025-11-19-virakesarilk-bedc4ade	virakesarilk-bedc4ade	2025-11-19	நாமல் ராஜபக்ஷ பட்டச் சான்றிதழ் தொடர்பில் சந்தேகங்கள் ; உண்மையை வெளிப்படுத்த வேண்டும் -  நளிந்த ஜயதிஸ்ஸ வலியுறுத்தல்	https://www.virakesari.lk/article/230803	ta	virakesarilk	1763542920.0
lk_news	2025-11-19-lankadeepalk-6a30292d	lankadeepalk-6a30292d	2025-11-19	නාමල්ගේ නීති උපාධි සහතිකයට මැතිසබය ඇවිළෙයි	https://www.lankadeepa.lk/news/නමලග-නත-උපධ-සහතකයට-මතසබය-ඇවළය/101-683455	si	lankadeepalk	1763541378.0
lk_news	2025-11-19-lankadeepalk-bd3af7a4	lankadeepalk-bd3af7a4	2025-11-19	අස්වැසුමේ හිල් වහන්න මැතිසබා කමිටුවෙන්  නියෝගයක්	https://www.lankadeepa.lk/news/අසවසම-හල-වහනන-මතසබ-කමටවන-නයගයක/101-683454	si	lankadeepalk	1763541324.0
lk_news	2025-11-19-lankadeepalk-918eb3d1	lankadeepalk-918eb3d1	2025-11-19	ප්‍රජා ශක්ති කිලිනොච්චි යයි	https://www.lankadeepa.lk/news/පරජ-ශකත-කලනචච-යය/101-683452	si	lankadeepalk	1763541140.0
lk_news	2025-11-19-virakesarilk-048ceb2b	virakesarilk-048ceb2b	2025-11-19	'சமூக சக்தி'  தேசிய திட்டத்தை செயல்படுத்துவதற்காக மாவட்ட மற்றும் பிரதேச செயலக அதிகாரிகளுக்கு பயிற்சி அளிக்கும் கிளிநொச்சி நிகழ்ச்சித் திட்டம்	https://www.virakesari.lk/article/230798	ta	virakesarilk	1763541120.0
lk_news	2025-11-19-virakesarilk-84dc7ee9	virakesarilk-84dc7ee9	2025-11-19	மீன்பிடித் துறைமுக நவீனமயப்படுத்தலுக்காக ஜைக்காவுடன் புரிந்துணர்வு ஒப்பந்தம்	https://www.virakesari.lk/article/230796	ta	virakesarilk	1763541060.0
lk_news	2025-11-19-virakesarilk-eebff342	virakesarilk-eebff342	2025-11-19	இன்றைய தங்க விலை நிலைவரம்!	https://www.virakesari.lk/article/230800	ta	virakesarilk	1763540760.0
lk_news	2025-11-19-lankadeepalk-b1a9cd12	lankadeepalk-b1a9cd12	2025-11-19	ශ්‍රීලනිප ප්‍රා. සභා මන්ත්‍රීවරු 8 ක පක්‍ෂ සාමාජිකත්වය අත්හිටුවයි	https://www.lankadeepa.lk/news/ශරලනප-පර-සභ-මනතරවර-8-ක-පකෂ-සමජකතවය-අතහටවය/101-683449	si	lankadeepalk	1763540508.0
lk_news	2025-11-19-virakesarilk-b8eae832	virakesarilk-b8eae832	2025-11-19	ஜெனிவாவில் 151வது IPU மாநாடு : பாலின சமத்துவத்தில் மைல்கல் முன்னேற்றத்தை வெளிக்காட்டிய இலங்கை	https://www.virakesari.lk/article/230799	ta	virakesarilk	1763540220.0
lk_news	2025-11-19-lankadeepalk-aa99dc7b	lankadeepalk-aa99dc7b	2025-11-19	ලෙකෝ සභාපතිගේ බෙන්ස් රථය මැතිසබයටත් එයි	https://www.lankadeepa.lk/news/ලක-සභපතග-බනස-රථය-මතසබයටත-එය/101-683446	si	lankadeepalk	1763540158.0
lk_news	2025-11-19-virakesarilk-c8b37619	virakesarilk-c8b37619	2025-11-19	தெற்கு அதிவேக நெடுஞ்சாலையில் திடீரென நுழைந்த காட்டு யானையால் பரபரப்பு!	https://www.virakesari.lk/article/230797	ta	virakesarilk	1763539800.0
lk_news	2025-11-19-lankadeepalk-01ea3052	lankadeepalk-01ea3052	2025-11-19	විශේෂඥ වෛද්‍යවරුන්ගේ ප්‍රශ්නය විසඳන්න කමිටුවක්	https://www.lankadeepa.lk/latest_news/වශෂඥ-වදයවරනග-පරශනය-වසඳනන-කමටවක/1-683443	si	lankadeepalk	1763539702.0
lk_news	2025-11-19-virakesarilk-e0c9ae14	virakesarilk-e0c9ae14	2025-11-19	சர்வதேச நீரிழிவு தினத்தினை முன்னிட்டு மட்டக்களப்பில் பேரணியும் விழிப்புணர்வு நிகழ்வும்	https://www.virakesari.lk/article/230794	ta	virakesarilk	1763539680.0
lk_news	2025-11-19-tamilmirrorlk-d67323dd	tamilmirrorlk-d67323dd	2025-11-19	திருமலை விஹாரை: நீதிமன்றம் அதிரடி தீர்ப்பு	https://www.tamilmirror.lk/பிரசித்த-செய்தி/திருமலை-விஹாரை-நீதிமன்றம்-அதிரடி-தீர்ப்பு/150-368182	ta	tamilmirrorlk	1763539471.0
lk_news	2025-11-19-tamilmirrorlk-3f090be4	tamilmirrorlk-3f090be4	2025-11-19	50 எலிகளை சாப்பிட்டு 14 கிலோ எடை குறைத்த பெண்	https://www.tamilmirror.lk/விநோத-உலகம்/50-எலிகளை-சாப்பிட்டு-14-கிலோ-எடை-குறைத்த-பெண்/53-368180	ta	tamilmirrorlk	1763539084.0
lk_news	2025-11-19-virakesarilk-ab4fa77d	virakesarilk-ab4fa77d	2025-11-19	கடும் மின்னல் தாக்கம் குறித்து பொதுமக்களுக்கு எச்சரிக்கை!	https://www.virakesari.lk/article/230792	ta	virakesarilk	1763539080.0
lk_news	2025-11-19-tamilmirrorlk-be92d4cb	tamilmirrorlk-be92d4cb	2025-11-19	ஆம்புலன்ஸ் வழங்க மறுத்ததால் வேலைநிறுத்தம்	https://www.tamilmirror.lk/மலையகம்/ஆம்புலன்ஸ்-வழங்க-மறுத்ததால்-வேலைநிறுத்தம்/76-368179	ta	tamilmirrorlk	1763538600.0
lk_news	2025-11-19-virakesarilk-3002a625	virakesarilk-3002a625	2025-11-19	ஞானசார தேரரின் இனத்துவேஷ செயற்பாடுகளுக்கு அரசாங்கம் இடமளிக்கக்கூடாது - சாணக்கியன் எம்.பி	https://www.virakesari.lk/article/230790	ta	virakesarilk	1763538360.0
lk_news	2025-11-19-tamilmirrorlk-2258a157	tamilmirrorlk-2258a157	2025-11-19	நாமல்  விலகினார்: சபாநாயகர் அறிவித்தார்	https://www.tamilmirror.lk/செய்திகள்/நாமல்-விலகினார்-சபாநாயகர்-அறிவித்தார்/175-368178	ta	tamilmirrorlk	1763538141.0
