doc_type	doc_id	num	date_str	description	url_metadata	lang	newspaper_id	time_ut
lk_news	2025-10-16-virakesarilk-a7f16769	virakesarilk-a7f16769	2025-10-16	குற்றவாளிகளைக் கொண்டாடுதலும் தண்டனைகளிலிருந்து விடுபடும் போக்கும் முடிவுக்குக் கொண்டுவரப்படவேண்டும் - மனித உரிமைகள் கண்காணிப்பகம்	https://www.virakesari.lk/article/227925	ta	virakesarilk	1760620740.0
lk_news	2025-10-16-virakesarilk-2ccfc24f	virakesarilk-2ccfc24f	2025-10-16	நிலுவையில் உள்ள சாரதி அனுமதிப்பத்திரங்களை 3 மாதங்களுக்குள் அச்சிட்டு வழங்க திட்டம்	https://www.virakesari.lk/article/227924	ta	virakesarilk	1760620440.0
lk_news	2025-10-16-tamilmirrorlk-2f72da02	tamilmirrorlk-2f72da02	2025-10-16	மக்களே உஷார்;பொலிஸ் முக்கிய அறிவிப்பு	https://www.tamilmirror.lk/செய்திகள்/மக்களே-உஷார்-பொலிஸ்-முக்கிய-அறிவிப்பு/175-366413	ta	tamilmirrorlk	1760620364.0
lk_news	2025-10-16-virakesarilk-1bee4100	virakesarilk-1bee4100	2025-10-16	நிர்மாணக் கைத்தொழில் அபிவிருத்தி அதிகாரசபைக்கு எதிரான வழக்குகள் தொடர்பான நடவடிக்கைகளுக்கு  அதிகாரசபையினால் 15.01 மில்லியன் ரூபாய் செலவு - கோப் குழு	https://www.virakesari.lk/article/227923	ta	virakesarilk	1760620200.0
lk_news	2025-10-16-lankadeepalk-05ebac1a	lankadeepalk-05ebac1a	2025-10-16	අපේක්ෂා රෝහලේ රෝගී දරුවන් විකිණූ තිදෙනෙක් මාට්ටු	https://www.lankadeepa.lk/news/අපකෂ-රහල-රග-දරවන-වකණ-තදනක-මටට/101-681497	si	lankadeepalk	1760619489.0
lk_news	2025-10-16-lankadeepalk-a3ae7579	lankadeepalk-a3ae7579	2025-10-16	උසාවිය මගහැරි  සිරකරුවෙක් මාට්ටු	https://www.lankadeepa.lk/latest_news/උසවය-මගහර-සරකරවක-මටට/1-681496	si	lankadeepalk	1760618530.0
lk_news	2025-10-16-virakesarilk-ad22fec2	virakesarilk-ad22fec2	2025-10-16	பண்டாரவளை நிகழ்வு முற்றுமுழுதாக ஒரு ஏமாற்று வேலையாகும் - மனோ கணேசன்	https://www.virakesari.lk/article/227919	ta	virakesarilk	1760617980.0
lk_news	2025-10-16-lankadeepalk-7bc31504	lankadeepalk-7bc31504	2025-10-16	හරිනි-ජය ශංකර් හමුවේ	https://www.lankadeepa.lk/latest_news/හරන-ජය-ශකර-හමව/1-681495	si	lankadeepalk	1760617820.0
lk_news	2025-10-16-lankadeepalk-0d125b8f	lankadeepalk-0d125b8f	2025-10-16	කොළඹ නගරාධිපතිනියට විපක්‍ෂය ප්‍රශ්න වැලක්	https://www.lankadeepa.lk/latest_news/කළඹ-නගරධපතනයට-වපකෂය-පරශන-වලක/1-681494	si	lankadeepalk	1760617449.0
lk_news	2025-10-16-lankadeepalk-03ec69c7	lankadeepalk-03ec69c7	2025-10-16	කොළඹ නගරාධිපතිනියට විපක්‍ෂයෙන් ප්‍රශ්න වැලක්	https://www.lankadeepa.lk/news/කළඹ-නගරධපතනයට-වපකෂයන-පරශන-වලක/101-681494	si	lankadeepalk	1760617449.0
lk_news	2025-10-16-tamilmirrorlk-ddb5e133	tamilmirrorlk-ddb5e133	2025-10-16	எம்.பிக்களின் சம்பளத்தை கட்சிகள் எடுப்பதற்கு எதிராக பிரேரணை	https://www.tamilmirror.lk/செய்திகள்/எம்-பிக்களின்-சம்பளத்தை-கட்சிகள்-எடுப்பதற்கு-எதிராக-பிரேரணை/175-366412	ta	tamilmirrorlk	1760617382.0
lk_news	2025-10-16-virakesarilk-1af600b5	virakesarilk-1af600b5	2025-10-16	இஷாரா செவ்வந்தி உள்ளிட்ட குழுவை பொலிஸ் தடுப்பு காவலில் வைத்து விசாரணை செய்ய அனுமதி!	https://www.virakesari.lk/article/227918	ta	virakesarilk	1760617320.0
lk_news	2025-10-16-tamilmirrorlk-f5a79ef4	tamilmirrorlk-f5a79ef4	2025-10-16	தீபாவளியை முன்னிட்டு விசேட பஸ் சேவைகள்	https://www.tamilmirror.lk/செய்திகள்/தீபாவளியை-முன்னிட்டு-விசேட-பஸ்-சேவைகள்/175-366411	ta	tamilmirrorlk	1760616934.0
lk_news	2025-10-16-virakesarilk-ee8eb3c5	virakesarilk-ee8eb3c5	2025-10-16	திருமணமான தம்பதிகளின் கவனத்தை கவர்ந்த ரியோ ராஜின் 'ஆண்பாவம் பொல்லாதது 'பட முன்னோட்டம்	https://www.virakesari.lk/article/227912	ta	virakesarilk	1760616480.0
lk_news	2025-10-16-virakesarilk-40bad97c	virakesarilk-40bad97c	2025-10-16	இயக்குநர் மோகன் ஜி வெளியிட்ட 'தடை அதை உடை' படத்தின் கிளர்வோட்டம்	https://www.virakesari.lk/article/227910	ta	virakesarilk	1760616480.0
lk_news	2025-10-16-virakesarilk-f61dde13	virakesarilk-f61dde13	2025-10-16	பொலிஸ் அதிகாரிகள் என கூறி லொறியை சோதனையிட்டு பணத்தை திருடியவர்கள் தொடர்பில் பொலிஸார் விசாரணை!	https://www.virakesari.lk/article/227913	ta	virakesarilk	1760615700.0
lk_news	2025-10-16-virakesarilk-608c5479	virakesarilk-608c5479	2025-10-16	எச்சரிக்கை: கொழும்பு மாநகர சபை விடுத்துள்ள முக்கிய அறிவிப்பு!	https://www.virakesari.lk/article/227911	ta	virakesarilk	1760615220.0
lk_news	2025-10-16-virakesarilk-ad455847	virakesarilk-ad455847	2025-10-16	நடிகர் ஸ்ரீராம் கார்த்திக் நடிக்கும் 'மெசன்ஜர் 'படத்தின் முன்னோட்டம் வெளியீடு	https://www.virakesari.lk/article/227908	ta	virakesarilk	1760614620.0
lk_news	2025-10-16-virakesarilk-6b1fad93	virakesarilk-6b1fad93	2025-10-16	நடிகர் கௌஷிக் ராம் நடிக்கும் 'கிறிஸ்டினா கதிர்வேலன்' படத்தின் முதல் பாடல் வெளியீடு	https://www.virakesari.lk/article/227906	ta	virakesarilk	1760614560.0
lk_news	2025-10-16-virakesarilk-569cff9c	virakesarilk-569cff9c	2025-10-16	15 வயது சிறுமியை பாலியல் துஷ்பிரயோகம் செய்த 17 வயது சிறுவன் கைது	https://www.virakesari.lk/article/227907	ta	virakesarilk	1760614500.0
lk_news	2025-10-16-tamilmirrorlk-a1ea8fc5	tamilmirrorlk-a1ea8fc5	2025-10-16	இஷாரா உள்ளிட்ட நால்வருக்கும்  72 மணிநேர தடுப்புக்காவல்	https://www.tamilmirror.lk/செய்திகள்/இஷாரா-உள்ளிட்ட-நால்வருக்கும்-72-மணிநேர-தடுப்புக்காவல்/175-366409	ta	tamilmirrorlk	1760614409.0
