doc_type	doc_id	num	date_str	description	url_metadata	lang	newspaper_id	time_ut
lk_news	2025-12-02-tamilmirrorlk-2fce45dd	tamilmirrorlk-2fce45dd	2025-12-02	மதத் தலங்களை புனரமைக்க, ​மொட்டின் உதவி	https://www.tamilmirror.lk/செய்திகள்/மதத்-தலங்களை-புனரமைக்க-மொட்டின்-உதவி/175-368920	ta	tamilmirrorlk	1764652065.0
lk_news	2025-12-02-lankadeepalk-f1acb910	lankadeepalk-f1acb910	2025-12-02	පස් කන්දට යට වූ එකම පවුලේ සිව් දෙනා සොයා මෙහෙයුම්	https://www.lankadeepa.lk/latest_news/පස-කනදට-යට-ව-එකම-පවල-සව-දන-සය-මහයම/1-684461	si	lankadeepalk	1764651998.0
lk_news	2025-12-02-tamilmirrorlk-47fb8cb6	tamilmirrorlk-47fb8cb6	2025-12-02	மாணவி கர்ப்பம் ; விவாகரத்தான நிலையில், தாயார் கைது	https://www.tamilmirror.lk/அம்பாறை/மாணவி-கர்ப்பம்-விவாகரத்தான-நிலையில்-தாயார்-கைது/74-368919	ta	tamilmirrorlk	1764651104.0
lk_news	2025-12-02-tamilmirrorlk-7849cb98	tamilmirrorlk-7849cb98	2025-12-02	ஐக்கிய அரபு எமிர் இராச்சியத்திலிருந்து  உதவி	https://www.tamilmirror.lk/செய்திகள்/ஐக்கிய-அரபு-எமிர்-இராச்சியத்திலிருந்து-உதவி/175-368918	ta	tamilmirrorlk	1764649977.0
lk_news	2025-12-02-virakesarilk-f0b0b0ab	virakesarilk-f0b0b0ab	2025-12-02	தெற்கு அதிவேக வீதியின் அத்துருகிரிய நுழைவாயில் மீண்டும் திறக்கப்பட்டது!	https://www.virakesari.lk/article/232209	ta	virakesarilk	1764649860.0
lk_news	2025-12-02-lankadeepalk-e9024a78	lankadeepalk-e9024a78	2025-12-02	විපතට පත් අයට එල්.බී ෆිනෑන්ස් පිහිටක් වෙයි	https://www.lankadeepa.lk/latest_news/වපතට-පත-අයට-එල-බ-ෆනනස-පහටක-වය/1-684460	si	lankadeepalk	1764649809.0
lk_news	2025-12-02-virakesarilk-05e075e1	virakesarilk-05e075e1	2025-12-02	நிவாரணங்களுடன் வந்தது ஐக்கிய அரபு இராஜ்ஜியத்தின் விமானம்	https://www.virakesari.lk/article/232204	ta	virakesarilk	1764649680.0
lk_news	2025-12-02-virakesarilk-b55b82cf	virakesarilk-b55b82cf	2025-12-02	இரத்தினபுரியில் பாதிக்கப்பட்ட தோட்ட மக்கள் பலர் தற்காலிக முகாம்களில் தங்கவைப்பு	https://www.virakesari.lk/article/232203	ta	virakesarilk	1764649500.0
lk_news	2025-12-02-tamilmirrorlk-92feff45	tamilmirrorlk-92feff45	2025-12-02	மூன்றாம் நிலை சிவப்பு எச்சரிக்கை	https://www.tamilmirror.lk/செய்திகள்/மூன்றாம்-நிலை-சிவப்பு-எச்சரிக்கை/175-368917	ta	tamilmirrorlk	1764649461.0
lk_news	2025-12-02-virakesarilk-79f517b3	virakesarilk-79f517b3	2025-12-02	சீரற்ற வானிலையால் நுவரெலியா மாவட்டத்தில் 77 பேர் உயிரிழப்பு ; 73 பேர் மாயம்!	https://www.virakesari.lk/article/232206	ta	virakesarilk	1764649440.0
lk_news	2025-12-02-virakesarilk-2e8121d3	virakesarilk-2e8121d3	2025-12-02	அனர்த்தத்தினால் பாதிக்கப்பட்டவர்களுக்கு உதவும் நிவாரணக் குழுக்களுக்கு பொலிஸ் விடுத்துள்ள அறிவிப்பு	https://www.virakesari.lk/article/232205	ta	virakesarilk	1764649440.0
lk_news	2025-12-02-lankadeepalk-b27e2dad	lankadeepalk-b27e2dad	2025-12-02	වැනසුණු ආගමික ස්ථාන හදන්න පොහොට්ටුවේ සහය	https://www.lankadeepa.lk/latest_news/වනසණ-ආගමක-සථන-හදනන-පහටටව-සහය/1-684459	si	lankadeepalk	1764649020.0
lk_news	2025-12-02-lankadeepalk-e8e62c81	lankadeepalk-e8e62c81	2025-12-02	මහියංගණය රෝහල යථා තත්වයට	https://www.lankadeepa.lk/latest_news/මහයගණය-රහල-යථ-තතවයට/1-684457	si	lankadeepalk	1764648742.0
lk_news	2025-12-02-adalk-97e3f582	adalk-97e3f582	2025-12-02	ආපදා හදිසි මානුෂීය ආධාරයක් ලෙස චීනයෙන් ඩො.මිලියනයක්	https://www.ada.lk/business/ආපදා-හදිසි-මානුෂීය-ආධාරයක්-ලෙස-චීනයෙන්-ඩො-මිලියනයක්/7-420013	si	adalk	1764648715.0
lk_news	2025-12-02-lankadeepalk-2e0aa27c	lankadeepalk-2e0aa27c	2025-12-02	ප්‍රා.ලේ.කොට්ඨාස 70 කට රතු නිවේදන	https://www.lankadeepa.lk/latest_news/පර-ල-කටඨස-70-කට-රත-නවදන/1-684456	si	lankadeepalk	1764648436.0
lk_news	2025-12-02-tamilmirrorlk-e828ad90	tamilmirrorlk-e828ad90	2025-12-02	இலங்கையின் மூன்றில் ஒரு பகுதியை நாசமாக்கிய ’டித்வா’	https://www.tamilmirror.lk/செய்திகள்/இலங்கையின்-மூன்றில்-ஒரு-பகுதியை-நாசமாக்கிய-டித்வா/175-368916	ta	tamilmirrorlk	1764648162.0
lk_news	2025-12-02-virakesarilk-d988873d	virakesarilk-d988873d	2025-12-02	நுவரெலியாவில் வெள்ளத்தால்  நாசமான உணவு பொருட்கள் !	https://www.virakesari.lk/article/232202	ta	virakesarilk	1764648060.0
lk_news	2025-12-02-virakesarilk-1f3631da	virakesarilk-1f3631da	2025-12-02	களனி ஆற்றின் நீர்மட்டம் குறைந்து வருகிறது - நீர்ப்பாசனத்திணைக்களம்	https://www.virakesari.lk/article/232201	ta	virakesarilk	1764647940.0
lk_news	2025-12-02-virakesarilk-421797a8	virakesarilk-421797a8	2025-12-02	கோப்பாய் பொலிஸ் பிரிவில் நபரொருவர் கொலை — சந்தேக நபர்கள் கைது!	https://www.virakesari.lk/article/232200	ta	virakesarilk	1764647340.0
lk_news	2025-12-02-lankadeepalk-31794b28	lankadeepalk-31794b28	2025-12-02	මෝදි-අනුර දුරකථන සාකච්ඡාවක්	https://www.lankadeepa.lk/latest_news/මද-අනර-දරකථන-සකචඡවක/1-684454	si	lankadeepalk	1764647148.0
lk_news	2025-12-02-virakesarilk-66926fac	virakesarilk-66926fac	2025-12-02	இன்று மட்டுப்படுத்தப்பட்டு ரயில் சேவைகள் இயங்கும் - ரயில் திணைக்களம்	https://www.virakesari.lk/article/232199	ta	virakesarilk	1764646980.0
lk_news	2025-12-02-tamilmirrorlk-46a31258	tamilmirrorlk-46a31258	2025-12-02	இலங்கைக்கு ரஷ்ய ஜனாதிபதி இரங்கல்	https://www.tamilmirror.lk/செய்திகள்/இலங்கைக்கு-ரஷ்ய-ஜனாதிபதி-இரங்கல்/175-368915	ta	tamilmirrorlk	1764646409.0
lk_news	2025-12-02-virakesarilk-1c8bcce6	virakesarilk-1c8bcce6	2025-12-02	அனர்த்த முகாமையும்  அநுரவின் உறுதிப்பாடும்	https://www.virakesari.lk/article/232198	ta	virakesarilk	1764645240.0
lk_news	2025-12-02-lankadeepalk-4f00e78f	lankadeepalk-4f00e78f	2025-12-02	නාගරික මන්ත්‍රීට පහරදුන් 6ක් අල්ලයි	https://www.lankadeepa.lk/latest_news/නගරක-මනතරට-පහරදන-6ක-අලලය/1-684453	si	lankadeepalk	1764645230.0
lk_news	2025-12-02-lankadeepalk-8182d51d	lankadeepalk-8182d51d	2025-12-02	විදෙස් පරිත්‍යාග තීරු බදු නැතිව ගෙන්වන ක්‍රමයක්	https://www.lankadeepa.lk/latest_news/වදස-පරතයග-තර-බද-නතව-ගනවන-කරමයක/1-684452	si	lankadeepalk	1764644882.0
lk_news	2025-12-02-lankadeepalk-35ae4ebb	lankadeepalk-35ae4ebb	2025-12-02	එළවළු රටින් ගෙනෙයි	https://www.lankadeepa.lk/latest_news/එළවළ-රටන-ගනය/1-684450	si	lankadeepalk	1764644659.0
lk_news	2025-12-02-tamilmirrorlk-f991e6e8	tamilmirrorlk-f991e6e8	2025-12-02	சுமத்ரா தீவில் பெரும் பேரழிவு	https://www.tamilmirror.lk/உலக-செய்திகள்/சுமத்ரா-தீவில்-பெரும்-பேரழிவு/50-368914	ta	tamilmirrorlk	1764644637.0
lk_news	2025-12-02-tamilmirrorlk-69d2abba	tamilmirrorlk-69d2abba	2025-12-02	இன்றும் மழை பெய்யும்	https://www.tamilmirror.lk/செய்திகள்/இன்றும்-மழை-பெய்யும்/175-368913	ta	tamilmirrorlk	1764644205.0
lk_news	2025-12-02-tamilmirrorlk-3f15066a	tamilmirrorlk-3f15066a	2025-12-02	’இலங்கைக்கு இந்தியா துணைநிற்கும்’	https://www.tamilmirror.lk/செய்திகள்/இலங்கைக்கு-இந்தியா-துணைநிற்கும்/175-368912	ta	tamilmirrorlk	1764643246.0
lk_news	2025-12-02-adalk-71eec167	adalk-71eec167	2025-12-02	උද්දමනය වෙනස් නොවෙයි	https://www.ada.lk/breaking_news/උද්දමනය-වෙනස්-නොවෙයි/11-420010	si	adalk	1764643064.0
lk_news	2025-12-02-lankadeepalk-f84c2d9a	lankadeepalk-f84c2d9a	2025-12-02	එක්සත් අරාබි එමීර් රාජ්‍යයෙන් ආධාර තොගයක්	https://www.lankadeepa.lk/news/එකසත-අරබ-එමර-රජයයන-ආධර-තගයක/101-684446	si	lankadeepalk	1764639286.0
lk_news	2025-12-02-lankadeepalk-3a4ce94a	lankadeepalk-3a4ce94a	2025-12-02	වැඩි මිලට බඩු වික්කොත් දැඩි දඬුවම්	https://www.lankadeepa.lk/news/වඩ-මලට-බඩ-වකකත-දඩ-දඬවම/101-684445	si	lankadeepalk	1764638943.0
lk_news	2025-12-02-lankadeepalk-7b45159a	lankadeepalk-7b45159a	2025-12-02	තැනින් තැනට සුළු වැස්සක්	https://www.lankadeepa.lk/news/තනන-තනට-සළ-වසසක/101-684444	si	lankadeepalk	1764638675.0
lk_news	2025-12-02-adalk-90a03545	adalk-90a03545	2025-12-02	කැළණි ගඟ හා මල්වතු ඔය එක් ස්ථානයක බැගින් අධි ගංවතුර තත්ත්වයක	https://www.ada.lk/breaking_news/කැළණි-ගඟ-හා-මල්වතු-ඔය-එක්-ස්ථානයක-බැගින්-අධි-ගංවතුර-තත්ත්වයක/11-420009	si	adalk	1764638437.0
lk_news	2025-12-02-adalk-030bdf39	adalk-030bdf39	2025-12-02	අධික වේගයෙන් ජලය යන ඇළේ දිය නෑ පුද්ගලයෙක් අතුරුදන්	https://www.ada.lk/breaking_news/අධික-වේගයෙන්-ජලය-යන-ඇළේ-දිය-නෑ-පුද්ගලයෙක්-අතුරුදන්/11-420008	si	adalk	1764638118.0
lk_news	2025-12-02-adalk-d7918651	adalk-d7918651	2025-12-02	චින වරායේ වෙඩි තැබිමක් පුද්ගලයෙක් මරුට	https://www.ada.lk/breaking_news/චින-වරායේ-වෙඩි-තැබිමක්-පුද්ගලයෙක්-මරුට/11-420007	si	adalk	1764636525.0
lk_news	2025-12-02-virakesarilk-3a015e4a	virakesarilk-3a015e4a	2025-12-02	இன்றைய வானிலை	https://www.virakesari.lk/article/232197	ta	virakesarilk	1764636420.0
lk_news	2025-12-02-virakesarilk-8d0c62f8	virakesarilk-8d0c62f8	2025-12-02	சீன விரிகுடா காவல் பிரிவில் துப்பாக்கிச் சூடு	https://www.virakesari.lk/article/232196	ta	virakesarilk	1764629940.0
lk_news	2025-12-02-virakesarilk-6cc8390f	virakesarilk-6cc8390f	2025-12-02	வெள்ளத்தால் பாதிக்கப்பட்ட அவிசாவளை பிரதேச மக்களுக்கு மனிதாபிமான நிவாரணங்களை வழங்கிய கடற்படை	https://www.virakesari.lk/article/232195	ta	virakesarilk	1764629760.0
lk_news	2025-12-02-virakesarilk-8f2c8823	virakesarilk-8f2c8823	2025-12-02	பாதிக்கப்பட்டோருடனும் மீட்புப்பணியாளர்களுடனும் உடன்நிற்கிறோம் - தென்னாபிரிக்க ஜனாதிபதி சிறில் ரமபோசா தெரிவிப்பு	https://www.virakesari.lk/article/232194	ta	virakesarilk	1764629280.0
lk_news	2025-12-02-bbccomsinhala-83cd9760	bbccomsinhala-83cd9760	2025-12-02	මහනුවර, නුවරඑළිය ඇතුළු ප්‍රධාන නගර වෙත ගොඩබිම් මාර්ග සබඳතා යථා තත්ත්වයට	https://www.bbc.com/sinhala/articles/c17x5e7v7r9o	si	bbccomsinhala	1764629200.0
lk_news	2025-12-02-virakesarilk-cb0b0584	virakesarilk-cb0b0584	2025-12-02	அரசாங்கத்திற்கு எதிராக குற்றவியல் வழக்குத் தாக்கல் செய்வோம் - ஐக்கிய மக்கள் சக்தி	https://www.virakesari.lk/article/232193	ta	virakesarilk	1764629100.0
lk_news	2025-12-02-virakesarilk-6edcbfc7	virakesarilk-6edcbfc7	2025-12-02	வெகுவாகப் பாதிக்கப்பட்டிருக்கும் இலங்கைக்கு உடன் உதவுங்கள் - கனேடியத் தமிழர் பேரவை அந்நாட்டு அரசாங்கத்திடம் வலியுறுத்தல்	https://www.virakesari.lk/article/232192	ta	virakesarilk	1764628920.0
lk_news	2025-12-02-virakesarilk-a4b4cb96	virakesarilk-a4b4cb96	2025-12-02	வெள்ளத்தால் பாதிக்கப்பட்ட சமூகத்தினருக்கு உதவ ஸ்ரீலங்கா டெலிகொம்மிடமிருந்து இலவச உதவிச் சேவை	https://www.virakesari.lk/article/232191	ta	virakesarilk	1764628680.0
lk_news	2025-12-02-virakesarilk-00455d5f	virakesarilk-00455d5f	2025-12-02	நோய் அறிகுறிகள் இருந்தால் மருத்துவ ஆலோசனையைப் பெற்றுக்கொள்ளுமாறு அறிவித்தல்	https://www.virakesari.lk/article/232190	ta	virakesarilk	1764628260.0
lk_news	2025-12-02-virakesarilk-6a7ac4ed	virakesarilk-6a7ac4ed	2025-12-02	இலங்கையின் மீட்சிக்கும், மீளெழுச்சிக்கும் உதவத்தயார் - சர்வதேச நாணய நிதியத்தின் நிறைவேற்றுப்பணிப்பாளர் அறிவிப்பு	https://www.virakesari.lk/article/232189	ta	virakesarilk	1764628080.0
lk_news	2025-12-02-virakesarilk-d0ba0feb	virakesarilk-d0ba0feb	2025-12-02	அனர்த்தத்தினால் பாதிக்கப்பட்ட மக்களுக்கு நிவாரணம் வழங்க எல் பி ஃபைனான்ஸ் 50 இலட்சம் ரூபா நன்கொடை	https://www.virakesari.lk/article/232188	ta	virakesarilk	1764627840.0
lk_news	2025-12-02-dailyftlk-79328d9d	dailyftlk-79328d9d	2025-12-02	Ranil to convene party leaders to discuss next steps after Ditwah	https://www.ft.lk/news/Ranil-to-convene-party-leaders-to-discuss-next-steps-after-Ditwah/56-785116	en	dailyftlk	1764627535.0
lk_news	2025-12-02-dailyftlk-2c3c56ab	dailyftlk-2c3c56ab	2025-12-02	Japanese assessment team arrives; 31 experts due tomorrow	https://www.ft.lk/news/Japanese-assessment-team-arrives-31-experts-due-tomorrow/56-785115	en	dailyftlk	1764627482.0
lk_news	2025-12-02-dailyftlk-7ea80090	dailyftlk-7ea80090	2025-12-02	UK expresses support to cyclone-hit SL	https://www.ft.lk/news/UK-expresses-support-to-cyclone-hit-SL/56-785114	en	dailyftlk	1764627442.0
lk_news	2025-12-02-dailyftlk-ea7e3f8d	dailyftlk-ea7e3f8d	2025-12-02	“Maldivians with Ceylon” telethon extended as donations hit Rs. 255 m	https://www.ft.lk/news/Maldivians-with-Ceylon-telethon-extended-as-donations-hit-Rs-255-m/56-785113	en	dailyftlk	1764627421.0
lk_news	2025-12-02-dailyftlk-4002a51a	dailyftlk-4002a51a	2025-12-02	NCE affirms continuity of export sector following recent floods	https://www.ft.lk/business/NCE-affirms-continuity-of-export-sector-following-recent-floods/34-785112	en	dailyftlk	1764627191.0
lk_news	2025-12-02-dailyftlk-2d185703	dailyftlk-2d185703	2025-12-02	Ceylon Chamber affirms support for recovery efforts following Cyclone Ditwah	https://www.ft.lk/business/Ceylon-Chamber-affirms-support-for-recovery-efforts-following-Cyclone-Ditwah/34-785111	en	dailyftlk	1764627057.0
lk_news	2025-12-02-dailyftlk-b4a3d51c	dailyftlk-b4a3d51c	2025-12-02	Telecom operators, partners accelerate restoration of connectivity after Cyclone Ditwah	https://www.ft.lk/business/Telecom-operators-partners-accelerate-restoration-of-connectivity-after-Cyclone-Ditwah/34-785110	en	dailyftlk	1764627017.0
lk_news	2025-12-02-dailyftlk-19b50f51	dailyftlk-19b50f51	2025-12-02	Transparency and accountability in disaster relief: A new era after decades of misuse	https://www.ft.lk/columns/Transparency-and-accountability-in-disaster-relief-A-new-era-after-decades-of-misuse/4-785092	en	dailyftlk	1764623347.0
lk_news	2025-12-02-dailyftlk-848d8340	dailyftlk-848d8340	2025-12-02	Responding competently to natural disasters	https://www.ft.lk/columns/Responding-competently-to-natural-disasters/4-785091	en	dailyftlk	1764622855.0
lk_news	2025-12-02-dailyftlk-934820ad	dailyftlk-934820ad	2025-12-02	Colombo Dockyard delivers “Misje Sakura”  – 9th eco-friendly hybrid bulk carrier to Norway	https://www.ft.lk/business/Colombo-Dockyard-delivers-Misje-Sakura-9th-eco-friendly-hybrid-bulk-carrier-to-Norway/34-785090	en	dailyftlk	1764622414.0
lk_news	2025-12-02-dailyftlk-0bef1fc2	dailyftlk-0bef1fc2	2025-12-02	WindForce signs SPPA for  Rs. 1.18 b floating solar project	https://www.ft.lk/business/WindForce-signs-SPPA-for-Rs-1-18-b-floating-solar-project/34-785089	en	dailyftlk	1764622238.0
lk_news	2025-12-02-dailyftlk-57e1f4ac	dailyftlk-57e1f4ac	2025-12-02	Ambeon Capital to issue up to 10 m shares for ESOP	https://www.ft.lk/business/Ambeon-Capital-to-issue-up-to-10-m-shares-for-ESOP/34-785088	en	dailyftlk	1764622201.0
lk_news	2025-12-02-dailyftlk-49769829	dailyftlk-49769829	2025-12-02	Sierra Cables delivers strong 1H performance	https://www.ft.lk/business/Sierra-Cables-delivers-strong-1H-performance/34-785087	en	dailyftlk	1764622170.0
lk_news	2025-12-02-dailyftlk-5fcba2b4	dailyftlk-5fcba2b4	2025-12-02	President urged to submit report on recovery and rehabilitation during  “Cyclone Ditwah”	https://www.ft.lk/opinion/President-urged-to-submit-report-on-recovery-and-rehabilitation-during-Cyclone-Ditwah/14-785086	en	dailyftlk	1764621569.0
lk_news	2025-12-02-dailyftlk-bc2bb6f8	dailyftlk-bc2bb6f8	2025-12-02	Cyclone Ditwah: Testing NPP Govt.’s competence and public confidence	https://www.ft.lk/columns/Cyclone-Ditwah-Testing-NPP-Govt-s-competence-and-public-confidence/4-785085	en	dailyftlk	1764621273.0
lk_news	2025-12-02-dailyftlk-65a68842	dailyftlk-65a68842	2025-12-02	Let us tax for democracy	https://www.ft.lk/columns/Let-us-tax-for-democracy/4-785068	en	dailyftlk	1764616100.0
lk_news	2025-12-01-dailyftlk-bb8920ea	dailyftlk-bb8920ea	2025-12-01	After the storm: A policy blueprint to protect MSMEs from climate shocks	https://www.ft.lk/columns/After-the-storm-A-policy-blueprint-to-protect-MSMEs-from-climate-shocks/4-785066	en	dailyftlk	1764613355.0
lk_news	2025-12-01-islandlk-6cf0f36c	islandlk-6cf0f36c	2025-12-01	The folly of imported ignorance: Why Sri Lanka must reject the foreign anti-vaccine delusion	http://island.lk/the-folly-of-imported-ignorance-why-sri-lanka-must-reject-the-foreign-anti-vaccine-delusion/	en	islandlk	1764610740.0
lk_news	2025-12-01-virakesarilk-c00b6113	virakesarilk-c00b6113	2025-12-01	பேரிடரால் பாதிக்கப்பட்டுள்ள இலங்கைக்கு பிரித்தானியாவும் உதவிக்கரம்!	https://www.virakesari.lk/article/232187	ta	virakesarilk	1764608160.0
lk_news	2025-12-01-virakesarilk-56e331c7	virakesarilk-56e331c7	2025-12-01	அனர்த்த நிலைமையால் ஏற்பட்ட பெரும் சேதத்தை சமாளிப்பதில் மாகாண ஆளுநர்களுக்கு பொறுப்பு - ஜனாதிபதி	https://www.virakesari.lk/article/232186	ta	virakesarilk	1764607560.0
lk_news	2025-12-01-virakesarilk-d2df1f2c	virakesarilk-d2df1f2c	2025-12-01	அரச மற்றும் தனியார் துறை பிரதிநிதிகளைக் கொண்ட  ‘Rebuilding Sri Lanka’  நிதியத்தின் முகாமைத்துவக் குழு நியமனம்	https://www.virakesari.lk/article/232185	ta	virakesarilk	1764607140.0
lk_news	2025-12-01-virakesarilk-44376147	virakesarilk-44376147	2025-12-01	தற்போதைய நிலையிலிருந்து மீள அரசாங்கம் எடுக்கும் சிறந்த தீர்மானங்களுக்கு ஒத்துழைப்பு வழங்குவோம் - கயந்த கருணாதிலக	https://www.virakesari.lk/article/232158	ta	virakesarilk	1764605760.0
lk_news	2025-12-01-virakesarilk-404b3559	virakesarilk-404b3559	2025-12-01	எலிக்காய்ச்சல் தொற்றிலிருந்து பாதுகாப்பு பெற உடன் சிகிச்சை பெறுங்கள் ; சுகாதார அமைச்சு அறிவிப்பு	https://www.virakesari.lk/article/232164	ta	virakesarilk	1764605400.0
lk_news	2025-12-01-virakesarilk-ac908ee4	virakesarilk-ac908ee4	2025-12-01	“சாகர் பந்து” நடவடிக்கையின் கீழ் தொடர்ந்த ஆதரவு : தொலைபேசியில் ஜனாதிபதி அநுரவிடம் இந்தியப் பிரதமர் மோடி உறுதி	https://www.virakesari.lk/article/232184	ta	virakesarilk	1764605340.0
lk_news	2025-12-01-virakesarilk-74880f4b	virakesarilk-74880f4b	2025-12-01	சடுதியாக அதிகரிக்கும் மரக்கறி விலைகள் ; முட்டை, கோழி இறைச்சிக்கு தட்டுப்பாடு	https://www.virakesari.lk/article/232169	ta	virakesarilk	1764604440.0
lk_news	2025-12-01-virakesarilk-1362880a	virakesarilk-1362880a	2025-12-01	தற்போதைய இக்கட்டான நிலையை  அரசியல் இலாபத்திற்காக பயன்படுத்தக்கூடாது ; பிமல் ரத்நாயக்க	https://www.virakesari.lk/article/232159	ta	virakesarilk	1764604380.0
lk_news	2025-12-01-virakesarilk-6f2af323	virakesarilk-6f2af323	2025-12-01	அரசாங்கம் மக்களை படுகொலை செய்துள்ளது - சாணக்கியன்	https://www.virakesari.lk/article/232160	ta	virakesarilk	1764604320.0
lk_news	2025-12-01-lankadeepalk-494f97ef	lankadeepalk-494f97ef	2025-12-01	මහනුවර යට වෙන්න හේතුව කිරිඇල්ල කියයි	https://www.lankadeepa.lk/news/මහනවර-යට-වනන-හතව-කරඇලල-කයය/101-684443	si	lankadeepalk	1764602757.0
lk_news	2025-12-01-islandlk-9572da23	islandlk-9572da23	2025-12-01	Prima Group Sri Lanka supports National Flood Relief Efforts with over Rs. 300 Million in dry rations	http://island.lk/prima-group-sri-lanka-supports-national-flood-relief-efforts-with-over-rs-300-million-in-dry-rations/	en	islandlk	1764601440.0
lk_news	2025-12-01-islandlk-f9f97012	islandlk-f9f97012	2025-12-01	Heritance Kandalama awarded Silver at the 2025 ICRT Global Responsible Tourism Awards	http://island.lk/heritance-kandalama-awarded-silver-at-the-2025-icrt-global-responsible-tourism-awards/	en	islandlk	1764600600.0
lk_news	2025-12-01-islandlk-4fd2a5f8	islandlk-4fd2a5f8	2025-12-01	BCIS Library: A Gateway to Global Knowledge	http://island.lk/bcis-library-a-gateway-to-global-knowledge/	en	islandlk	1764600540.0
lk_news	2025-12-01-islandlk-3b966fa2	islandlk-3b966fa2	2025-12-01	Flood disaster taking toll on share market	http://island.lk/flood-disaster-taking-toll-on-share-market/	en	islandlk	1764600480.0
