doc_type	doc_id	num	date_str	description	url_metadata	lang	newspaper_id	time_ut
lk_news	2025-10-06-virakesarilk-5d5f85cf	virakesarilk-5d5f85cf	2025-10-06	மானிப்பாய் பிரதேச சபையின் நூலகங்களில் தேசிய வாசிப்பு மாத நிகழ்வுகள் ஆரம்பம்	https://www.virakesari.lk/article/227045	ta	virakesarilk	1759749840.0
lk_news	2025-10-06-virakesarilk-c8adc0df	virakesarilk-c8adc0df	2025-10-06	மருந்துகளின் பற்றாக்குறைக்கு தீர்வு காண்பதற்கான வழிமுறைகள் தற்போதுள்ள சட்ட நடைமுறைகளால் தடைப்பட்டுள்ளது  -  நளிந்த ஜயதிஸ்ஸ	https://www.virakesari.lk/article/227042	ta	virakesarilk	1759749600.0
lk_news	2025-10-06-virakesarilk-0032da53	virakesarilk-0032da53	2025-10-06	மோட்டார் சைக்கிள் விபத்தில் ஒருவர் பலி ; இருவர் காயம்!	https://www.virakesari.lk/article/227048	ta	virakesarilk	1759749060.0
lk_news	2025-10-06-virakesarilk-1c8a57c4	virakesarilk-1c8a57c4	2025-10-06	புவக்தண்டாவே சானா தொடர்பில் வாக்குமூலம் அளிப்பதற்கு பிறிதொரு தினத்தை வழங்குமாறு விமல் வீரவன்ச கோரிக்கை	https://www.virakesari.lk/article/227041	ta	virakesarilk	1759749000.0
lk_news	2025-10-06-lankadeepalk-908af225	lankadeepalk-908af225	2025-10-06	බ්‍රෙික් පැටලය මාරු වී තුනක් මරු තුරුලට	https://www.lankadeepa.lk/latest_news/බරක-පටලය-මර-ව-තනක-මර-තරලට/1-680801	si	lankadeepalk	1759748798.0
lk_news	2025-10-06-virakesarilk-c58eb562	virakesarilk-c58eb562	2025-10-06	பதுளை- செங்கலடி வீதியின் போக்குவரத்து வழமைக்கு திரும்பியது	https://www.virakesari.lk/article/227044	ta	virakesarilk	1759748640.0
lk_news	2025-10-06-virakesarilk-7558e64f	virakesarilk-7558e64f	2025-10-06	தாஜுதீனின் வாகனத்தைப் பின்தொடர்ந்த வாகனத்தில் இருந்தது 'கஜ்ஜா' தான் - சி.ஐ.டி.	https://www.virakesari.lk/article/227039	ta	virakesarilk	1759748340.0
lk_news	2025-10-06-virakesarilk-70f62d08	virakesarilk-70f62d08	2025-10-06	கந்தானை ஐஸ் தயாரிப்பதற்கான இரசாயனப்பொருட்கள் ; பரிசோதனை முடிவுகள் குறித்த முக்கிய அறிவிப்பு	https://www.virakesari.lk/article/227040	ta	virakesarilk	1759748160.0
lk_news	2025-10-06-tamilmirrorlk-296502c0	tamilmirrorlk-296502c0	2025-10-06	கணவனின் ஆணுறையுடன் கள்ளக்காதலனுடன் ஓடிய புதுப்பெண்	https://www.tamilmirror.lk/செய்திகள்/கணவனின்-ஆணுறையுடன்-கள்ளக்காதலனுடன்-ஓடிய-புதுப்பெண்/175-365834	ta	tamilmirrorlk	1759747514.0
lk_news	2025-10-06-tamilmirrorlk-cf959e7c	tamilmirrorlk-cf959e7c	2025-10-06	மூன்று விஞ்ஞானிகளுக்கு மருத்துவத்திற்கான நோபல் பரிசு	https://www.tamilmirror.lk/செய்திகள்/மூன்று-விஞ்ஞானிகளுக்கு-மருத்துவத்திற்கான-நோபல்-பரிசு/175-365833	ta	tamilmirrorlk	1759747424.0
lk_news	2025-10-06-tamilmirrorlk-5faf86b5	tamilmirrorlk-5faf86b5	2025-10-06	போயா நாளில் மதுபானம் விற்றவர் கைது	https://www.tamilmirror.lk/செய்திகள்/போயா-நாளில்-மதுபானம்-விற்றவர்-கைது/175-365832	ta	tamilmirrorlk	1759747273.0
lk_news	2025-10-06-tamilmirrorlk-2a36b5e1	tamilmirrorlk-2a36b5e1	2025-10-06	கம்பளை விபத்தில் மூவர் பலி	https://www.tamilmirror.lk/மலையகம்/கம்பளை-விபத்தில்-மூவர்-பலி/76-365831	ta	tamilmirrorlk	1759747260.0
lk_news	2025-10-06-virakesarilk-3180f62b	virakesarilk-3180f62b	2025-10-06	விமல் வீரவன்சவுக்கு எதிராக சாட்சி கட்டளை  சட்டத்தின் கீழ் நடவடிக்கை எடுக்கப்படும் - அரசாங்கம்	https://www.virakesari.lk/article/227035	ta	virakesarilk	1759746780.0
lk_news	2025-10-06-tamilmirrorlk-14933aab	tamilmirrorlk-14933aab	2025-10-06	தையிட்டிக்கு எதிராக கவனயீர்ப்பு போராட்டம்	https://www.tamilmirror.lk/செய்திகள்/தையிட்டிக்கு-எதிராக-கவனயீர்ப்பு-போராட்டம்/175-365830	ta	tamilmirrorlk	1759746585.0
lk_news	2025-10-06-virakesarilk-2764b3c5	virakesarilk-2764b3c5	2025-10-06	குருக்கள்மடம் பாடசாலை கட்டடத்தில் இயங்கி வருகின்ற இராணுவ முகாமை அகற்ற நடவடிக்கை – சாணக்கியன்	https://www.virakesari.lk/article/227038	ta	virakesarilk	1759746480.0
lk_news	2025-10-06-tamilmirrorlk-38f9541e	tamilmirrorlk-38f9541e	2025-10-06	முட்டை விலை: அதிரடி அறிவிப்பு	https://www.tamilmirror.lk/செய்திகள்/முட்டை-விலை-அதிரடி-அறிவிப்பு/175-365829	ta	tamilmirrorlk	1759746021.0
lk_news	2025-10-06-lankadeepalk-0e3c9d34	lankadeepalk-0e3c9d34	2025-10-06	තැපෑල තවත් රටට බරක් විය යුතු නෑ	https://www.lankadeepa.lk/latest_news/තපල-තවත-රටට-බරක-වය-යත-න/1-680799	si	lankadeepalk	1759745922.0
lk_news	2025-10-06-virakesarilk-c318ca3c	virakesarilk-c318ca3c	2025-10-06	யாழில் கைதான சட்டத்தரணிக்கு பிணை	https://www.virakesari.lk/article/227037	ta	virakesarilk	1759745760.0
lk_news	2025-10-06-tamilmirrorlk-db8b9bca	tamilmirrorlk-db8b9bca	2025-10-06	விக்கிபீடியாவுக்கு போட்டியாக வருகிறது குரோக்பீடியா	https://www.tamilmirror.lk/science-tech/விக்கிபீடியாவுக்கு-போட்டியாக-வருகிறது-குரோக்பீடியா/57-365828	ta	tamilmirrorlk	1759745618.0
lk_news	2025-10-06-tamilmirrorlk-b3aa6ead	tamilmirrorlk-b3aa6ead	2025-10-06	பிரான்ஸ் பிரதமர் திடீர் இராஜினாமா	https://www.tamilmirror.lk/உலக-செய்திகள்/பிரான்ஸ்-பிரதமர்-திடீர்-இராஜினாமா/50-365827	ta	tamilmirrorlk	1759745488.0
