doc_type	doc_id	num	date_str	description	url_metadata	lang	newspaper_id	time_ut
lk_news	2025-09-27-lankadeepalk-58684dc1	lankadeepalk-58684dc1	2025-09-27	ජනපති ජපානයට ළඟා වෙයි	https://www.lankadeepa.lk/latest_news/ජනපත-ජපනයට-ළඟ-වය/1-680330	si	lankadeepalk	1758977586.0
lk_news	2025-09-27-lankadeepalk-a7cebbb9	lankadeepalk-a7cebbb9	2025-09-27	ඇමරිකා වානිජ මණ්ඩල සභාපති ජනපති හමුවෙයි	https://www.lankadeepa.lk/latest_news/ඇමරක-වනජ-මණඩල-සභපත-ජනපත-හමවය/1-680329	si	lankadeepalk	1758977333.0
lk_news	2025-09-27-lankadeepalk-66a0976f	lankadeepalk-66a0976f	2025-09-27	ජනපති නවත් රාජ්‍ය නායකයින් තිදෙනෙක් හමුවේ	https://www.lankadeepa.lk/latest_news/ජනපත-නවත-රජය-නයකයන-තදනක-හමව/1-680328	si	lankadeepalk	1758977171.0
lk_news	2025-09-27-virakesarilk-654e5e15	virakesarilk-654e5e15	2025-09-27	பல்டி - திரைப்பட விமர்சனம்	https://www.virakesari.lk/article/226264	ta	virakesarilk	1758974880.0
lk_news	2025-09-27-virakesarilk-54bdfdd6	virakesarilk-54bdfdd6	2025-09-27	இயக்குநரான நட்சத்திர தம்பதியின் வாரிசு..!?	https://www.virakesari.lk/article/226263	ta	virakesarilk	1758974700.0
lk_news	2025-09-27-virakesarilk-553c5f08	virakesarilk-553c5f08	2025-09-27	சிலம்பரசன் நடிக்கும் 'எஸ் டி ஆர் 49 ' படத்தின் அப்டேட்	https://www.virakesari.lk/article/226262	ta	virakesarilk	1758974520.0
lk_news	2025-09-27-virakesarilk-7be86ba6	virakesarilk-7be86ba6	2025-09-27	'இசைப்புயல் 'ஏ .ஆர். ரஹ்மான் வெளியிட்ட 'வட்டக்கானல்' படத்தின் முதல் பாடல்	https://www.virakesari.lk/article/226261	ta	virakesarilk	1758974340.0
lk_news	2025-09-27-lankadeepalk-1dec40a4	lankadeepalk-1dec40a4	2025-09-27	නාරාහේන්පිට දුම්රිය පොළ අලුත් කරයි	https://www.lankadeepa.lk/latest_news/නරහනපට-දමරය-පළ-අලත-කරය/1-680327	si	lankadeepalk	1758973940.0
lk_news	2025-09-27-virakesarilk-fe4ed9e1	virakesarilk-fe4ed9e1	2025-09-27	மூன்றாவது நாளாகவும் தொடரும் சுழற்சி முறையிலான உண்ணாவிரத போராட்டம்!	https://www.virakesari.lk/article/226255	ta	virakesarilk	1758972840.0
lk_news	2025-09-27-virakesarilk-3b799823	virakesarilk-3b799823	2025-09-27	மன்னார் காற்றாலை திட்டத்திற்கு எதிர்ப்பு தெரிவித்து வவுனியாவில் ஆர்ப்பாட்டம்	https://www.virakesari.lk/article/226252	ta	virakesarilk	1758972240.0
lk_news	2025-09-27-lankadeepalk-460c6b48	lankadeepalk-460c6b48	2025-09-27	’’සුදු අලි’’ හොයන්න ආයතන 450කින් වාර්තා කැඳවයි	https://www.lankadeepa.lk/news/සද-අල-හයනන-ආයතන-450කන-වරත-කඳවය/101-680326	si	lankadeepalk	1758972036.0
lk_news	2025-09-27-virakesarilk-bfe53f99	virakesarilk-bfe53f99	2025-09-27	மன்னாரில் மக்களை கொடூரமாக தாக்கிய பொலிஸார் ; வைத்தியசாலையில் உள்ளவர்களை கைது செய்ய நடவடிக்கை	https://www.virakesari.lk/article/226250	ta	virakesarilk	1758970920.0
lk_news	2025-09-27-lankadeepalk-9ac98706	lankadeepalk-9ac98706	2025-09-27	හොඳ ව්‍යවසායකයන් බිහිකරන ’’පිරිපුන්’’ වැඩක්	https://www.lankadeepa.lk/latest_news/හඳ-වයවසයකයන-බහකරන-පරපන-වඩක/1-680323	si	lankadeepalk	1758970352.0
lk_news	2025-09-27-tamilmirrorlk-58fd2122	tamilmirrorlk-58fd2122	2025-09-27	கேபிள் கார் விபத்தில் உயிரிழந்த பிக்குகளுக்கு சஜித் இறுதி அஞ்சலி	https://www.tamilmirror.lk/செய்திகள்/கேபிள்-கார்-விபத்தில்-உயிரிழந்த-பிக்குகளுக்கு-சஜித்-இறுதி-அஞ்சலி/175-365369	ta	tamilmirrorlk	1758970227.0
lk_news	2025-09-27-virakesarilk-df9e7a24	virakesarilk-df9e7a24	2025-09-27	பாடசாலை மாணவர்களுக்கு மதுபான போத்தல்களை விற்பனை செய்தவர் கைது!	https://www.virakesari.lk/article/226247	ta	virakesarilk	1758969300.0
lk_news	2025-09-27-tamilmirrorlk-585bf913	tamilmirrorlk-585bf913	2025-09-27	பட்ஜெட்டை இந்த பேனாவுலதான் எழுதுவேன்...	https://www.tamilmirror.lk/செய்திகள்/பட்ஜெட்டை-இந்த-பேனாவுலதான்-எழுதுவேன்/175-365368	ta	tamilmirrorlk	1758969178.0
lk_news	2025-09-27-virakesarilk-04ca678b	virakesarilk-04ca678b	2025-09-27	நாரஹேன்பிட்டி புகையிரத நிலையத்தை நவீனமயப்படுத்தும் திட்டம் ஆரம்பம்	https://www.virakesari.lk/article/226244	ta	virakesarilk	1758968160.0
lk_news	2025-09-27-tamilmirrorlk-8fde24be	tamilmirrorlk-8fde24be	2025-09-27	பலரது மோட்டார் சைக்கிள்கள் பறிமுதல்	https://www.tamilmirror.lk/செய்திகள்/பலரது-மோட்டார்-சைக்கிள்கள்-பறிமுதல்/175-365367	ta	tamilmirrorlk	1758967564.0
lk_news	2025-09-27-lankadeepalk-92fae32e	lankadeepalk-92fae32e	2025-09-27	සෞඛ්‍ය අභියෝග කොහොම හරි දිනනවා	https://www.lankadeepa.lk/news/සඛය-අභයග-කහම-හර-දනනව/101-680315	si	lankadeepalk	1758966994.0
lk_news	2025-09-27-lankadeepalk-fefead82	lankadeepalk-fefead82	2025-09-27	මබ්බෲක්ට  පාර්ලිමේන්තුවේ ලොකු පුටුවක්	https://www.lankadeepa.lk/news/මබබකට-පරලමනතව-ලක-පටවක/101-680314	si	lankadeepalk	1758966104.0
lk_news	2025-09-27-virakesarilk-516eb5ff	virakesarilk-516eb5ff	2025-09-27	நிறைவேற்று ஜனாதிபதி முறைமை முக்கியமானது: சட்டக் கல்லூரி முதல்வர்	https://www.virakesari.lk/article/226242	ta	virakesarilk	1758965580.0
lk_news	2025-09-27-virakesarilk-2abca83d	virakesarilk-2abca83d	2025-09-27	“ஜீலே”வின் சகா போதைப்பொருட்களுடன் கைது!	https://www.virakesari.lk/article/226243	ta	virakesarilk	1758965280.0
lk_news	2025-09-27-virakesarilk-4be65372	virakesarilk-4be65372	2025-09-27	பருத்தித்துறையில் உணவகத்திற்கு சீல்	https://www.virakesari.lk/article/226232	ta	virakesarilk	1758965160.0
lk_news	2025-09-27-virakesarilk-06dd4699	virakesarilk-06dd4699	2025-09-27	இரண்டு பஸ்கள் நேருக்கு நேர் மோதி விபத்து!	https://www.virakesari.lk/article/226241	ta	virakesarilk	1758964380.0
lk_news	2025-09-27-virakesarilk-fa26d143	virakesarilk-fa26d143	2025-09-27	அதிக மின்சாரக் கட்டணத்திற்குக் காரணம் திறனற்ற மின் சாதனங்களின் பயன்பாடு ஆகும் - இலங்கை நிலைபெறுதகு சக்தி அதிகாரசபை	https://www.virakesari.lk/article/226240	ta	virakesarilk	1758964020.0
lk_news	2025-09-27-virakesarilk-d3b8defe	virakesarilk-d3b8defe	2025-09-27	குருணாகல் கேபிள் கார் விபத்தில் உயிரிழந்த பிக்குகளுக்கு இறுதி அஞ்சலி செலுத்தினார் எதிர்க்கட்சி தலைவர்!	https://www.virakesari.lk/article/226239	ta	virakesarilk	1758963480.0
lk_news	2025-09-27-lankadeepalk-76e8376a	lankadeepalk-76e8376a	2025-09-27	AI ගැන මහනුවරට උගන්වයි	https://www.lankadeepa.lk/latest_news/AI-ගන-මහනවරට-උගනවය/1-680312	si	lankadeepalk	1758961431.0
lk_news	2025-09-27-lankadeepalk-105a0215	lankadeepalk-105a0215	2025-09-27	නානුඔය දුම්රිය ස්ථානයේ ලෝක සංචාරක දිනය සැමරේ	https://www.lankadeepa.lk/ld_events/නනඔය-දමරය-සථනය-ලක-සචරක-දනය-සමර/244-680311	si	lankadeepalk	1758960309.0
lk_news	2025-09-27-virakesarilk-34be2f5f	virakesarilk-34be2f5f	2025-09-27	மத்திய மாகாண அரச அதிகாரிகளுக்கு டிஜிட்டல் மயமாக்கல் மற்றும் AI தொழில்நுட்பத்தின் பயன்பாடு குறித்து விழிப்புணர்வு நிகழ்ச்சி	https://www.virakesari.lk/article/226238	ta	virakesarilk	1758959880.0
lk_news	2025-09-27-tamilmirrorlk-f7805eb1	tamilmirrorlk-f7805eb1	2025-09-27	டிரம்பை சந்தித்தார் அனுர	https://www.tamilmirror.lk/செய்திகள்/டிரம்பை-சந்தித்தார்-அனுர/175-365366	ta	tamilmirrorlk	1758959408.0
lk_news	2025-09-27-virakesarilk-009bd20c	virakesarilk-009bd20c	2025-09-27	மோட்டார் சைக்கிள் - உழவு இயந்திரம் மோதி விபத்து ; இளைஞன் பலி!	https://www.virakesari.lk/article/226237	ta	virakesarilk	1758959400.0
lk_news	2025-09-27-virakesarilk-8d4fb911	virakesarilk-8d4fb911	2025-09-27	தொண்டமனாற்று பகுதியில் டெங்கு பரவக் கூடிய சூழலை பேணிய 10 பேருக்கு எதிராக தண்டப்பணம்!	https://www.virakesari.lk/article/226236	ta	virakesarilk	1758959220.0
lk_news	2025-09-27-virakesarilk-8a86c24f	virakesarilk-8a86c24f	2025-09-27	வரி செலுத்தும் அனைவருக்கும் விசேட அறிவிப்பு!	https://www.virakesari.lk/article/226233	ta	virakesarilk	1758958980.0
lk_news	2025-09-27-lankadeepalk-a00d0161	lankadeepalk-a00d0161	2025-09-27	කෝප් කෝපාවට හොරු අල්ලන බලය	https://www.lankadeepa.lk/test/කප-කපවට-හර-අලලන-බලය/222-680310	si	lankadeepalk	1758958875.0
lk_news	2025-09-27-virakesarilk-a4c96465	virakesarilk-a4c96465	2025-09-27	நாட்டின் கணினி கல்வியறிவு விகிதம் குறைவு!	https://www.virakesari.lk/article/226234	ta	virakesarilk	1758958560.0
lk_news	2025-09-27-lankadeepalk-63669553	lankadeepalk-63669553	2025-09-27	ප්‍රභූ - නිර්ප්‍රභූ මාලිමාවේ වත්කම් - බැරකම්	https://www.lankadeepa.lk/features/පරභ-නරපරභ-මලමව-වතකම-බරකම/2-680309	si	lankadeepalk	1758958203.0
lk_news	2025-09-27-virakesarilk-2c32522a	virakesarilk-2c32522a	2025-09-27	தங்காலை போதைப்பொருள் சம்பவம் ; வைத்தியசாலையில் சிகிச்சை பலனின்றி உயிரிழந்தவரின் மகனை பொலிஸ் தடுப்பு காவலில் வைத்து விசாரணை செய்ய அனுமதி!	https://www.virakesari.lk/article/226235	ta	virakesarilk	1758958080.0
lk_news	2025-09-27-tamilmirrorlk-a74ee77b	tamilmirrorlk-a74ee77b	2025-09-27	பெண் கொடூர கொலை : ஒருவர் கைது	https://www.tamilmirror.lk/செய்திகள்/பெண்-கொடூர-கொலை-ஒருவர்-கைது/175-365365	ta	tamilmirrorlk	1758956701.0
lk_news	2025-09-27-virakesarilk-0964837c	virakesarilk-0964837c	2025-09-27	அமெரிக்க ஜனாதிபதி டொனால்ட் டிரம்ப் - ஜனாதிபதி அநுரகுமார இடையில் சந்திப்பு!	https://www.virakesari.lk/article/226231	ta	virakesarilk	1758956340.0
lk_news	2025-09-27-virakesarilk-b1e3e0cd	virakesarilk-b1e3e0cd	2025-09-27	வத்தளையில் ஐஸ் போதைப்பொருளுடன் கைதுசெய்யப்பட்டவர் பல்வேறு குற்றச்செயல்களுடன் தொடர்புடையவர் என அடையாளம்!	https://www.virakesari.lk/article/226224	ta	virakesarilk	1758956280.0
lk_news	2025-09-27-tamilmirrorlk-5235f3dd	tamilmirrorlk-5235f3dd	2025-09-27	பிரான்ஸ் ஜனாதிபதியை சந்தித்தார் அநுர	https://www.tamilmirror.lk/செய்திகள்/பிரான்ஸ்-ஜனாதிபதியை-சந்தித்தார்-அநுர/175-365364	ta	tamilmirrorlk	1758955402.0
lk_news	2025-09-27-economynextcom-aa1e2b32	economynextcom-aa1e2b32	2025-09-27	Sri Lanka business delegation to visit Japan	https://economynext.com/sri-lanka-business-delegation-to-visit-japan-242005/	en	economynextcom	1758954600.0
lk_news	2025-09-27-colombotelegraphcom-fe6303eb	colombotelegraphcom-fe6303eb	2025-09-27	When Journalism Amplifies Apartheid: The Jaffna Monitor & The Israeli Narrative	https://www.colombotelegraph.com/index.php/when-journalism-amplifies-apartheid-the-jaffna-monitor-the-israeli-narrative/	en	colombotelegraphcom	1758954557.0
lk_news	2025-09-27-lankadeepalk-b10721a5	lankadeepalk-b10721a5	2025-09-27	විපක්ෂය හොඳ කෑම  ඉල්ලයි	https://www.lankadeepa.lk/news/වපකෂය-හඳ-කම-ඉලලය/101-680308	si	lankadeepalk	1758954523.0
lk_news	2025-09-27-lankadeepalk-0b8bbbc6	lankadeepalk-0b8bbbc6	2025-09-27	අනුර-ට්‍රම්ප් සුහඳ කතාබහක	https://www.lankadeepa.lk/latest_news/අනර-ටරමප-සහඳ-කතබහක/1-680307	si	lankadeepalk	1758954376.0
lk_news	2025-09-27-lankadeepalk-6198ba8f	lankadeepalk-6198ba8f	2025-09-27	සොරබොර අනතුරින් 11ක් රෝහලට	https://www.lankadeepa.lk/news/සරබර-අනතරන-11ක-රහලට/101-680306	si	lankadeepalk	1758953857.0
lk_news	2025-09-27-virakesarilk-70bd1d34	virakesarilk-70bd1d34	2025-09-27	மேலதிக வகுப்புகளுக்கு செல்லும் மாணவர்களை இலக்கு வைத்து போதைப்பொருள் விற்பனை ; இளைஞன் கைது!	https://www.virakesari.lk/article/226227	ta	virakesarilk	1758953460.0
lk_news	2025-09-27-lankadeepalk-bf7e374b	lankadeepalk-bf7e374b	2025-09-27	මෝටර් රථ අනතුරින් තුවාල ලැබූ වෛද්‍යවරයෙක් රෝහලට	https://www.lankadeepa.lk/latest_news/මටර-රථ-අනතරන-තවල-ලබ-වදයවරයක-රහලට/1-680305	si	lankadeepalk	1758953149.0
lk_news	2025-09-27-lankadeepalk-14ee5a98	lankadeepalk-14ee5a98	2025-09-27	ප්‍රංශය ඇමරිකාවේ පැවැත් වූ උත්සවයකට ජනපතිත් යයි	https://www.lankadeepa.lk/latest_news/පරශය-ඇමරකව-පවත-ව-උතසවයකට-ජනපතත-යය/1-680304	si	lankadeepalk	1758953029.0
lk_news	2025-09-27-virakesarilk-49677281	virakesarilk-49677281	2025-09-27	9 மாவட்டங்களுக்கு மண்சரிவு அபாய எச்சரிக்கை!	https://www.virakesari.lk/article/226226	ta	virakesarilk	1758952560.0
lk_news	2025-09-27-virakesarilk-a444f972	virakesarilk-a444f972	2025-09-27	சம்மாந்துறை பொலிஸாரின் அதிரடி நடவடிக்கை ; பலர் கைது, 20 மோட்டார் சைக்கிள்கள் கைப்பற்றல்	https://www.virakesari.lk/article/226216	ta	virakesarilk	1758952260.0
lk_news	2025-09-27-colombotelegraphcom-28ee8c47	colombotelegraphcom-28ee8c47	2025-09-27	History Will Not Forgive Us	https://www.colombotelegraph.com/index.php/history-will-not-forgive-us/	en	colombotelegraphcom	1758952135.0
lk_news	2025-09-27-virakesarilk-5c9e35ec	virakesarilk-5c9e35ec	2025-09-27	முச்சக்கரவண்டி மரத்தில் மோதி விபத்து : பெண் பலி ; இருவர் காயம்!	https://www.virakesari.lk/article/226214	ta	virakesarilk	1758951540.0
lk_news	2025-09-27-virakesarilk-a7d73fa4	virakesarilk-a7d73fa4	2025-09-27	மொனராகலை - மாத்தறை பிரதான வீதியில் விபத்து ; ஒருவர் பலி!	https://www.virakesari.lk/article/226215	ta	virakesarilk	1758950700.0
lk_news	2025-09-27-virakesarilk-8e4b9958	virakesarilk-8e4b9958	2025-09-27	ஐக்கிய நாடுகள் சபையின் பிரகடன உடன்படிக்கையில் (BBNJ) 60 ஆவது உறுப்பு நாடு இணைந்ததை முன்னிட்டு இடம்பெற்ற நிகழ்வில் ஜனாதிபதி பங்கேற்பு	https://www.virakesari.lk/article/226223	ta	virakesarilk	1758950160.0
lk_news	2025-09-27-virakesarilk-2d5328ed	virakesarilk-2d5328ed	2025-09-27	இந்திய மருந்துகள் இறக்குமதிக்கு 100% வரி : டொனால்ட் ட்ரம்ப்	https://www.virakesari.lk/article/226221	ta	virakesarilk	1758949560.0
lk_news	2025-09-27-virakesarilk-5995dddf	virakesarilk-5995dddf	2025-09-27	கொலம்பிய ஜனாதிபதி குஸ்டாவோ பெட்ரோவின் விசாவை அமெரிக்கா இரத்து செய்ய உள்ளது	https://www.virakesari.lk/article/226217	ta	virakesarilk	1758948780.0
lk_news	2025-09-27-virakesarilk-5ded65f3	virakesarilk-5ded65f3	2025-09-27	மோட்டார் சைக்கிள் விபத்தில் ஒருவர் உயிரிழப்பு!	https://www.virakesari.lk/article/226213	ta	virakesarilk	1758948720.0
lk_news	2025-09-27-tamilmirrorlk-e3978b65	tamilmirrorlk-e3978b65	2025-09-27	மரத்தில் மோதி விபத்துக்குள்ளான வேன்	https://www.tamilmirror.lk/செய்திகள்/மரத்தில்-மோதி-விபத்துக்குள்ளான-வேன்/175-365363	ta	tamilmirrorlk	1758948705.0
lk_news	2025-09-27-virakesarilk-67400898	virakesarilk-67400898	2025-09-27	அங்கொடையில் பெண் கொடூரமாக கொலை: எதிர் வீட்டில் வசிப்பவர் கைது!	https://www.virakesari.lk/article/226212	ta	virakesarilk	1758948360.0
lk_news	2025-09-27-virakesarilk-4e621bc5	virakesarilk-4e621bc5	2025-09-27	யாத்திரைக்கு சென்ற வேன் மரத்தில் மோதி விபத்து ; 11 பேர் காயம்	https://www.virakesari.lk/article/226220	ta	virakesarilk	1758948300.0
lk_news	2025-09-27-virakesarilk-c3cc6396	virakesarilk-c3cc6396	2025-09-27	காசா முழுவதும் இஸ்ரேலிய தாக்குதல்: ஒரே நாளில் 60 பாலஸ்தீனியர்கள் பலி	https://www.virakesari.lk/article/226219	ta	virakesarilk	1758947760.0
lk_news	2025-09-27-lankadeepalk-88e77ef1	lankadeepalk-88e77ef1	2025-09-27	රජයේ ලොක්කෙක් ජපාන ආයෝජකයන් හරවා යවලා	https://www.lankadeepa.lk/latest_news/රජය-ලකකක-ජපන-ආයජකයන-හරව-යවල/1-680303	si	lankadeepalk	1758947714.0
lk_news	2025-09-27-virakesarilk-6d4e0bf0	virakesarilk-6d4e0bf0	2025-09-27	சம்மாந்துறையில் காட்டு யானைகளின் தொல்லை அதிகரிப்பு ; உடனடியாக நடவடிக்கை எடுக்குமாறு பிரதேசமக்கள் கோரிக்கை	https://www.virakesari.lk/article/226218	ta	virakesarilk	1758947640.0
lk_news	2025-09-27-lankadeepalk-e363a08a	lankadeepalk-e363a08a	2025-09-27	නඩුවලට බියවෙලා: විපක්ෂයේ මන්ත්‍රීලා විස්සක් ගොළු වෙලා	https://www.lankadeepa.lk/news/නඩවලට-බයවල-වපකෂය-මනතරල-වසසක-ගළ-වල/101-680302	si	lankadeepalk	1758947211.0
lk_news	2025-09-27-virakesarilk-f9987d6f	virakesarilk-f9987d6f	2025-09-27	பேலியகொடை மீன் சந்தைக்கு அருகில் துப்பாக்கிகள், வெடிமருந்துகள் கைப்பற்றல்!	https://www.virakesari.lk/article/226211	ta	virakesarilk	1758947160.0
lk_news	2025-09-27-lankadeepalk-92012ee5	lankadeepalk-92012ee5	2025-09-27	තැපෑලේ කෝටි සීයක ඕටී හොරෙන් අරන්	https://www.lankadeepa.lk/news/තපල-කට-සයක-ඕට-හරන-අරන/101-680301	si	lankadeepalk	1758946636.0
lk_news	2025-09-27-tamilmirrorlk-24b4a85a	tamilmirrorlk-24b4a85a	2025-09-27	அனைத்து வரி செலுத்துவோருக்கும் முக்கிய அறிவிப்பு	https://www.tamilmirror.lk/செய்திகள்/அனைத்து-வரி-செலுத்துவோருக்கும்-முக்கிய-அறிவிப்பு/175-365362	ta	tamilmirrorlk	1758939436.0
lk_news	2025-09-27-tamilmirrorlk-c60aa341	tamilmirrorlk-c60aa341	2025-09-27	கடலில் விழுந்த இளைஞர் உயிரிழப்பு	https://www.tamilmirror.lk/செய்திகள்/கடலில்-விழுந்த-இளைஞர்-உயிரிழப்பு/175-365361	ta	tamilmirrorlk	1758936783.0
lk_news	2025-09-27-economynextcom-9f35440b	economynextcom-9f35440b	2025-09-27	EU gives Sri Lanka 8mn for biodiversity conservation and solid waste management	https://economynext.com/eu-gives-sri-lanka-8mn-for-biodiversity-conservation-and-solid-waste-management-242013/	en	economynextcom	1758936600.0
lk_news	2025-09-27-tamilmirrorlk-efb27554	tamilmirrorlk-efb27554	2025-09-27	மன்னார் போராட்டத்தில் நள்ளிரவில் பதற்றம்: பலர் காயம்	https://www.tamilmirror.lk/செய்திகள்/மன்னார்-போராட்டத்தில்-நள்ளிரவில்-பதற்றம்-பலர்-காயம்/175-365360	ta	tamilmirrorlk	1758935914.0
lk_news	2025-09-27-virakesarilk-3a015e4a	virakesarilk-3a015e4a	2025-09-27	இன்றைய வானிலை	https://www.virakesari.lk/article/226210	ta	virakesarilk	1758934500.0
lk_news	2025-09-27-virakesarilk-90aa5e81	virakesarilk-90aa5e81	2025-09-27	பொலிஸ் பாதுகாப்புடன் காற்றாலை மின் கோபுரம் அமைப்பதற்கான பொருட்கள் மன்னாரை நோக்கி : மக்கள்,  அருட்தந்தையர்கள் மீது பொலிஸார் தாக்குதல் !	https://www.virakesari.lk/article/226209	ta	virakesarilk	1758933480.0
lk_news	2025-09-27-bbccomsinhala-35005338	bbccomsinhala-35005338	2025-09-27	ආසිරි රෝහලේ අධ්‍යක්ෂවරු අධිකරණයට ඉදිරිපත් වීමෙන් පසුව ඇප මත මුදා හැරීමට නියෝග	https://www.bbc.com/sinhala/articles/c4g73vgyq91o	si	bbccomsinhala	1758925320.0
lk_news	2025-09-27-tamilmirrorlk-51948165	tamilmirrorlk-51948165	2025-09-27	ஐ.நாவில் நெதன்யாகுவுக்கு எதிர்ப்பு	https://www.tamilmirror.lk/செய்திகள்/ஐ-நாவில்-நெதன்யாகுவுக்கு-எதிர்ப்பு/175-365359	ta	tamilmirrorlk	1758925152.0
lk_news	2025-09-27-tamilmirrorlk-1dd06ab6	tamilmirrorlk-1dd06ab6	2025-09-27	’பாலஸ்தீனத்துக்கு தனி நாடு அங்கீகாரம் கூடாது’	https://www.tamilmirror.lk/உலக-செய்திகள்/பாலஸ்தீனத்துக்கு-தனி-நாடு-அங்கீகாரம்-கூடாது/50-365358	ta	tamilmirrorlk	1758924233.0
