doc_type	doc_id	num	date_str	description	url_metadata	lang	newspaper_id	time_ut
lk_news	2025-10-27-lankadeepalk-96f3c4ed	lankadeepalk-96f3c4ed	2025-10-27	මහ බැංකුවෙන් මුදල් මිටිය  අතුරුදන්වීම: පරීක්ෂණ වාර්තාව සීඅයිඩියට	https://www.lankadeepa.lk/news/මහ-බකවන-මදල-මටය-අතරදනවම-පරකෂණ-වරතව-සඅයඩයට/101-682152	si	lankadeepalk	1761556253.0
lk_news	2025-10-27-tamilmirrorlk-d0b5c547	tamilmirrorlk-d0b5c547	2025-10-27	பெண் வழக்கறிஞர் கொலை: சாரதிக்கு பிணை	https://www.tamilmirror.lk/செய்திகள்/பெண்-வழக்கறிஞர்-கொலை-சாரதிக்கு-பிணை/175-366918	ta	tamilmirrorlk	1761555887.0
lk_news	2025-10-27-adalk-4b6edd44	adalk-4b6edd44	2025-10-27	පහුගිය අවුරුදු 10ට කුඩු ඇල්ලුවට වඩා අපි පසුගිය මාස 10ට ඇල්ලුවා	https://www.ada.lk/breaking_news/පහුගිය-අවුරුදු-10ට-කුඩු-ඇල්ලුවට-වඩා-අපි-පසුගිය-මාස-10ට-ඇල්ලුවා/11-419345	si	adalk	1761555254.0
lk_news	2025-10-27-virakesarilk-4af75a1e	virakesarilk-4af75a1e	2025-10-27	மட்டக்களப்பு குருக்கள்மடம் புதைகுழி வழக்கு ஒத்திவைப்பு	https://www.virakesari.lk/article/228785	ta	virakesarilk	1761555240.0
lk_news	2025-10-27-tamilmirrorlk-5b0784df	tamilmirrorlk-5b0784df	2025-10-27	வலையில் சிக்கிய  சிறுத்தை மீட்பு	https://www.tamilmirror.lk/மலையகம்/வலையில்-சிக்கிய-சிறுத்தை-மீட்பு/76-366916	ta	tamilmirrorlk	1761555167.0
lk_news	2025-10-27-lankadeepalk-6c0886ed	lankadeepalk-6c0886ed	2025-10-27	පොන්නි සම්බා ටොන් 4,331 ක් ආනයන කරයි	https://www.lankadeepa.lk/news/පනන-සමබ-ටන-4-331-ක-ආනයන-කරය/101-682150	si	lankadeepalk	1761555159.0
lk_news	2025-10-27-virakesarilk-2cec70b9	virakesarilk-2cec70b9	2025-10-27	இவ்வாண்டின் இதுவரையான காலப்பகுதிக்குள் 2,097 ஆயுதங்கள் கைப்பற்றல்!	https://www.virakesari.lk/article/228766	ta	virakesarilk	1761555060.0
lk_news	2025-10-27-lankadeepalk-23189750	lankadeepalk-23189750	2025-10-27	විදේශ සේවා නියුක්ති කාර්යංශයේ උපන්දිනේට සමරු කවරයක්	https://www.lankadeepa.lk/news/වදශ-සව-නයකත-කරයශය-උපනදනට-සමර-කවරයක/101-682149	si	lankadeepalk	1761555041.0
lk_news	2025-10-27-virakesarilk-c64bb248	virakesarilk-c64bb248	2025-10-27	தாய்லாந்து - கம்போடியா இடையே அமைதி ஒப்பந்தம் கைச்சாத்து: மத்தியஸ்தம் செய்த ட்ரம்ப்	https://www.virakesari.lk/article/228783	ta	virakesarilk	1761554580.0
lk_news	2025-10-27-virakesarilk-e680e9bb	virakesarilk-e680e9bb	2025-10-27	இவ்வாண்டின் இதுவரையான காலப்பகுதிக்குள் பெருந்தொகை போதைப்பொருட்கள் கைப்பற்றல்!	https://www.virakesari.lk/article/228775	ta	virakesarilk	1761554520.0
lk_news	2025-10-27-tamilmirrorlk-ef94c21b	tamilmirrorlk-ef94c21b	2025-10-27	அஸ்வெசும தரவு: உலக வங்கி பிரதிநிதிகள் அதிரடி	https://www.tamilmirror.lk/செய்திகள்/அஸ்வெசும-தரவு-உலக-வங்கி-பிரதிநிதிகள்-அதிரடி/175-366914	ta	tamilmirrorlk	1761554488.0
lk_news	2025-10-27-lankadeepalk-5c062fa3	lankadeepalk-5c062fa3	2025-10-27	කොළඹ-ගම්පහ මතෙන් කප් ගසයි	https://www.lankadeepa.lk/news/කළඹ-ගමපහ-මතන-කප-ගසය/101-682148	si	lankadeepalk	1761553988.0
lk_news	2025-10-27-virakesarilk-72b4dbde	virakesarilk-72b4dbde	2025-10-27	ஶ்ரீலங்கன் ஏர்லைன்ஸ் விமான பணிப்பெண்களை தாக்கிய வெளிநாட்டுப் பிரஜை கைது!	https://www.virakesari.lk/article/228784	ta	virakesarilk	1761553800.0
lk_news	2025-10-27-lankadeepalk-5f478a74	lankadeepalk-5f478a74	2025-10-27	මන්ත්‍රීලාට රැකවරණ ඉල්ලා  සජබ ජිනීවා යයි	https://www.lankadeepa.lk/news/මනතරලට-රකවරණ-ඉලල-සජබ-ජනව-යය/101-682146	si	lankadeepalk	1761552276.0
lk_news	2025-10-27-tamilmirrorlk-35c63cdf	tamilmirrorlk-35c63cdf	2025-10-27	குவைத் -  இலங்கை , விமான சேவை மீண்டும் ஆரம்பம்	https://www.tamilmirror.lk/செய்திகள்/குவைத்-இலங்கை-விமான-சேவை-மீண்டும்-ஆரம்பம்/175-366912	ta	tamilmirrorlk	1761552038.0
lk_news	2025-10-27-lankadeepalk-15c7ee84	lankadeepalk-15c7ee84	2025-10-27	හෙද  සංගමයෙන් සෞඛ්‍ය ඇමතිට රතු එළියක්	https://www.lankadeepa.lk/news/හද-සගමයන-සඛය-ඇමතට-රත-එළයක/101-682145	si	lankadeepalk	1761551876.0
lk_news	2025-10-27-virakesarilk-ad86bd55	virakesarilk-ad86bd55	2025-10-27	ஆப்கானிஸ்தான் தாக்குதலில் 5 பாகிஸ்தானிய இராணுவ வீரர்கள் உயிரிழப்பு	https://www.virakesari.lk/article/228782	ta	virakesarilk	1761551760.0
lk_news	2025-10-27-virakesarilk-c6d21f92	virakesarilk-c6d21f92	2025-10-27	30 பில்லியன் அமெரிக்க டொலர்களில்   தெற்காசிய நாடுகளுக்கான இந்திய திட்டங்கள்	https://www.virakesari.lk/article/228781	ta	virakesarilk	1761551700.0
lk_news	2025-10-27-adalk-33acdde5	adalk-33acdde5	2025-10-27	සංචාරක පැමිණිම 1 845 164	https://www.ada.lk/breaking_news/සංචාරක-පැමිණිම-1-845-164/11-419344	si	adalk	1761551637.0
lk_news	2025-10-27-tamilmirrorlk-c823e289	tamilmirrorlk-c823e289	2025-10-27	வெல்லவாய வீதியில் பொலிஸ் சார்ஜன்ட் பலி	https://www.tamilmirror.lk/செய்திகள்/வெல்லவாய-வீதியில்-பொலிஸ்-சார்ஜன்ட்-பலி/175-366910	ta	tamilmirrorlk	1761551269.0
lk_news	2025-10-27-lankadeepalk-6326be52	lankadeepalk-6326be52	2025-10-27	ඇමතිලා හතළිස් අටකට  මැතිසබේ තෙල් එපාවෙලා	https://www.lankadeepa.lk/news/ඇමතල-හතළස-අටකට-මතසබ-තල-එපවල/101-682144	si	lankadeepalk	1761550890.0
lk_news	2025-10-27-adalk-6721679b	adalk-6721679b	2025-10-27	ආරක්ෂක කැමරා පද්ධති සකසන්නන්ගේ ලෝක ශූරතා තරගාවලියේදි ලංකාවට රන් පදක්කමක්	https://www.ada.lk/technology/ආරක්ෂක-කැමරා-පද්ධති-සකසන්නන්ගේ-ලෝක-ශූරතා-තරගාවලියේදි-ලංකාවට-රන්-පදක්කමක්/5-419343	si	adalk	1761550781.0
lk_news	2025-10-27-virakesarilk-2ed68eb8	virakesarilk-2ed68eb8	2025-10-27	குமாரப்பா புலேந்திரன் உள்ளிட்டவர்களின் நினைவுத் தூபியை அமைப்பதற்கு நடவடிக்கை - சாவகச்சேரி நகர சபையின் உப தவிசாளர்	https://www.virakesari.lk/article/228778	ta	virakesarilk	1761550500.0
lk_news	2025-10-27-lankadeepalk-88513620	lankadeepalk-88513620	2025-10-27	’’රනිල් රට වෙනුවෙන් පාවිච්චි කළ යුතුයි’’	https://www.lankadeepa.lk/news/රනල-රට-වනවන-පවචච-කළ-යතය/101-682143	si	lankadeepalk	1761550304.0
lk_news	2025-10-27-virakesarilk-f3c865d5	virakesarilk-f3c865d5	2025-10-27	இஷாரா செவ்வந்திக்கு உதவிய “ஆனந்தனின்” வீட்டிலிருந்து ஆயுதங்கள் கைப்பற்றல்!	https://www.virakesari.lk/article/228779	ta	virakesarilk	1761549840.0
lk_news	2025-10-27-virakesarilk-9fe1d324	virakesarilk-9fe1d324	2025-10-27	நாட்டுக்கும், மக்களுக்குமான நலன் சார்ந்த கொள்கைகளுடன் அரசாங்கம் இயங்கவில்லை ; சிங்கள பேரினவாதத்துக்கு அஞ்சியே செயற்படுகிறது என்கிறார் அரசியல் செயற்பாட்டாளர் ராஜ்குமார் ரஜீவ்காந்த்	https://www.virakesari.lk/article/228777	ta	virakesarilk	1761549840.0
lk_news	2025-10-27-virakesarilk-cd3e7ed6	virakesarilk-cd3e7ed6	2025-10-27	இலங்கை விமானப்படையின் 17 ஆவது ஸ்கொஷ் சாம்பியன்ஷிப்பின் வெற்றிக் கிண்ணங்களை கைப்பற்றிய ரவிந்து லக்ஷிரி மற்றும் சானித்மா சினெலி!	https://www.virakesari.lk/article/228776	ta	virakesarilk	1761549540.0
lk_news	2025-10-27-virakesarilk-6e8feb10	virakesarilk-6e8feb10	2025-10-27	இன்றைய நாணய மாற்று விகிதம்	https://www.virakesari.lk/article/228773	ta	virakesarilk	1761549420.0
lk_news	2025-10-27-virakesarilk-4b742149	virakesarilk-4b742149	2025-10-27	ஏழு மாகாணங்களில் பலத்த காற்று வீசக்கூடும்	https://www.virakesari.lk/article/228772	ta	virakesarilk	1761549360.0
lk_news	2025-10-27-adalk-2142b40c	adalk-2142b40c	2025-10-27	ලංකාවට පළමුවරට ආ ඉන්දීය ජාතිකයා තුන්කෝටියක හොරොයින් සමග අල්ලයි	https://www.ada.lk/breaking_news/ලංකාවට-පළමුවරට-ආ-ඉන්දීය-ජාතිකයා-තුන්කෝටියක-හොරොයින්-සමග-අල්ලයි/11-419341	si	adalk	1761548558.0
