doc_type	doc_id	num	date_str	description	url_metadata	lang	newspaper_id	time_ut
lk_news	2025-10-17-virakesarilk-badb4f18	virakesarilk-badb4f18	2025-10-17	இலஞ்சம் பெற்ற கமநல சேவைகள் நிலையத்தின் அதிகாரி கைது	https://www.virakesari.lk/article/227952	ta	virakesarilk	1760677440.0
lk_news	2025-10-17-lankadeepalk-ea9a0378	lankadeepalk-ea9a0378	2025-10-17	ආණ්ඩුවේ මඩ බලකාය ජොබ් එක හරියට කරන්නේ නෑ	https://www.lankadeepa.lk/latest_news/ආණඩව-මඩ-බලකය-ජබ-එක-හරයට-කරනන-න/1-681519	si	lankadeepalk	1760677308.0
lk_news	2025-10-17-virakesarilk-7673883a	virakesarilk-7673883a	2025-10-17	யாழில் பேருந்து மோதி குடும்பஸ்தர் பலி	https://www.virakesari.lk/article/227953	ta	virakesarilk	1760677260.0
lk_news	2025-10-17-virakesarilk-b8391512	virakesarilk-b8391512	2025-10-17	நானாட்டானில் 30 ஆயிரம் கால்நடைகள் உள்ள போதும் மேய்ச்சல் தரவையின்மையால் கால்நடை வளர்ப்பாளர்கள் அவதி !	https://www.virakesari.lk/article/227949	ta	virakesarilk	1760677200.0
lk_news	2025-10-17-virakesarilk-b0716acf	virakesarilk-b0716acf	2025-10-17	யாழில் தகரங்கள் மேலே விழுந்ததால் மயக்கமுற்ற நபர் உயிரிழப்பு	https://www.virakesari.lk/article/227951	ta	virakesarilk	1760677200.0
lk_news	2025-10-17-virakesarilk-5d44c878	virakesarilk-5d44c878	2025-10-17	பாடசாலை வேனுடன் மோதி மோட்டார் சைக்கிள் விபத்து ; ஒருவர் பலி!	https://www.virakesari.lk/article/227954	ta	virakesarilk	1760677020.0
lk_news	2025-10-17-virakesarilk-7dd11d9b	virakesarilk-7dd11d9b	2025-10-17	மன்னார் பேசாலை வைத்தியசாலையில் குறைபாடுகள் தொடர்பில் ஆராய்வு	https://www.virakesari.lk/article/227948	ta	virakesarilk	1760676540.0
lk_news	2025-10-17-virakesarilk-68f53837	virakesarilk-68f53837	2025-10-17	விபத்துக்குள்ளாகி யாழ். வைத்தியசாலையில் சிகிச்சை பெற்று வந்த முதியவர் உயிரிழப்பு	https://www.virakesari.lk/article/227950	ta	virakesarilk	1760676240.0
lk_news	2025-10-17-adalk-1abd842f	adalk-1abd842f	2025-10-17	අනාගත නායකයන් වෙනුවෙන් HCB, ජපුර හා අවබෝධතාවක	https://www.ada.lk/business/අනාගත-නායකයන්-වෙනුවෙන්-HCB--ජපුර-හා-අවබෝධතාවක/7-419157	si	adalk	1760674701.0
lk_news	2025-10-17-lankadeepalk-5c8fab3a	lankadeepalk-5c8fab3a	2025-10-17	බොරු වැඩකට කෝටි එකහමාරක් පුදලා: කර්මාන්ත අධිකාරියට චෝදනාවක්	https://www.lankadeepa.lk/latest_news/බර-වඩකට-කට-එකහමරක-පදල-කරමනත-අධකරයට-චදනවක/1-681514	si	lankadeepalk	1760674053.0
lk_news	2025-10-17-virakesarilk-e01866a4	virakesarilk-e01866a4	2025-10-17	"இந்தியப் பாதுகாப்பு: ""எங்கள் மண் பயன்படுத்தப்படாது"" - டெல்லி இந்து கல்லூரியில் பிரதமர் ஹரிணி"	https://www.virakesari.lk/article/227947	ta	virakesarilk	1760673480.0
lk_news	2025-10-17-virakesarilk-1f2c6483	virakesarilk-1f2c6483	2025-10-17	தென் கடலில் போதைப்பொருளுடன் படகு கைப்பற்றல்	https://www.virakesari.lk/article/227945	ta	virakesarilk	1760672940.0
lk_news	2025-10-17-lankadeepalk-61cdfad5	lankadeepalk-61cdfad5	2025-10-17	කෘෂි නිලධාරියා අල්ලස් දැලේ	https://www.lankadeepa.lk/news/කෂ-නලධරය-අලලස-දල/101-681513	si	lankadeepalk	1760671757.0
lk_news	2025-10-17-virakesarilk-7d4519cc	virakesarilk-7d4519cc	2025-10-17	ஜெலன்ஸ்கியை இன்று சந்திக்கிறார் ட்ரம்ப்	https://www.virakesari.lk/article/227946	ta	virakesarilk	1760671680.0
lk_news	2025-10-17-lankadeepalk-a2a9e6c6	lankadeepalk-a2a9e6c6	2025-10-17	ද්විත්ව ඝාතනයකට සැක අයෙක් අල්ලයි	https://www.lankadeepa.lk/news/දවතව-ඝතනයකට-සක-අයක-අලලය/101-681512	si	lankadeepalk	1760670502.0
lk_news	2025-10-17-lankadeepalk-92521c13	lankadeepalk-92521c13	2025-10-17	වෙඩි තැබීමකට අනුබල දුන් අයෙක් මාට්ටු	https://www.lankadeepa.lk/latest_news/වඩ-තබමකට-අනබල-දන-අයක-මටට/1-681511	si	lankadeepalk	1760670323.0
lk_news	2025-10-17-adalk-970132bb	adalk-970132bb	2025-10-17	අදත් සවස බොහෝ ප්‍ර දේශවලට වැසි	https://www.ada.lk/breaking_news/අදත්-සවස-බොහෝ-ප්‍ර-දේශවලට-වැසි/11-419155	si	adalk	1760669197.0
lk_news	2025-10-17-tamilmirrorlk-031befd2	tamilmirrorlk-031befd2	2025-10-17	ரயிலில் இருந்து தவறி வீழ்ந்து பெண் உயிரிழப்பு	https://www.tamilmirror.lk/செய்திகள்/ரயிலில்-இருந்து-தவறி-வீழ்ந்து-பெண்-உயிரிழப்பு/175-366429	ta	tamilmirrorlk	1760668753.0
lk_news	2025-10-17-adalk-3180a566	adalk-3180a566	2025-10-17	ගෘහස්ත ක්‍රිකට් ප්‍රධාන පුහුණුකරු පර්ත් පුහුණුකරු ධුරයකට යයි	https://www.ada.lk/sports/ගෘහස්ත-ක්‍රිකට්-ප්‍රධාන-පුහුණුකරු-පර්ත්-පුහුණුකරු-ධුරයකට-යයි/9-419154	si	adalk	1760668119.0
lk_news	2025-10-17-adalk-512f0bfb	adalk-512f0bfb	2025-10-17	රිය අනතුරු 7කින් 8ක් මරුට	https://www.ada.lk/breaking_news/රිය-අනතුරු-7කින්-8ක්-මරුට/11-419152	si	adalk	1760667433.0
lk_news	2025-10-17-tamilmirrorlk-d60070f2	tamilmirrorlk-d60070f2	2025-10-17	இன்று இடியுடன் கூடிய மழை	https://www.tamilmirror.lk/செய்திகள்/இன்று-இடியுடன்-கூடிய-மழை/175-366428	ta	tamilmirrorlk	1760667429.0
lk_news	2025-10-17-lankadeepalk-1fa57dbf	lankadeepalk-1fa57dbf	2025-10-17	සොයිසා රෝහලට මාතෘ අධි සත්කාර ඒකකයක්	https://www.lankadeepa.lk/latest_news/සයස-රහලට-මත-අධ-සතකර-ඒකකයක/1-681510	si	lankadeepalk	1760666255.0
lk_news	2025-10-17-lankadeepalk-5b66e35d	lankadeepalk-5b66e35d	2025-10-17	දිවයිනේ ප්‍රදේශ රැසකට සවස වැස්ස	https://www.lankadeepa.lk/news/දවයන-පරදශ-රසකට-සවස-වසස/101-681509	si	lankadeepalk	1760665456.0
lk_news	2025-10-17-adalk-7e1926a0	adalk-7e1926a0	2025-10-17	ද සොයිසා කාන්තා රෝහලේ  මාතෘ අධි  සත්කාර ඒකකය විවෘතයි	https://www.ada.lk/breaking_news/ද-සොයිසා-කාන්තා-රෝහලේ--මාතෘ-අධි--සත්කාර-ඒකකය-විවෘතයි/11-419151	si	adalk	1760663983.0
lk_news	2025-10-17-dailyftlk-8aa902bf	dailyftlk-8aa902bf	2025-10-17	C.C.A. Brito-Mutunayagam: First principal of Ceylon Law College, scholar and gentleman par excellence	https://www.ft.lk/opinion/C-C-A-Brito-Mutunayagam-First-principal-of-Ceylon-Law-College-scholar-and-gentleman-par-excellence/14-783113	en	dailyftlk	1760662552.0
lk_news	2025-10-17-dailyftlk-5405454c	dailyftlk-5405454c	2025-10-17	A breath of Kandy on the road	https://www.ft.lk/columns/A-breath-of-Kandy-on-the-road/4-783112	en	dailyftlk	1760662414.0
lk_news	2025-10-17-dailyftlk-bfe2e8d7	dailyftlk-bfe2e8d7	2025-10-17	Sirimavo Bandaranaike, the grand old lady of Sri Lankan politics	https://www.ft.lk/columns/Sirimavo-Bandaranaike-the-grand-old-lady-of-Sri-Lankan-politics/4-783111	en	dailyftlk	1760662089.0
lk_news	2025-10-17-dailyftlk-debbdb5e	dailyftlk-debbdb5e	2025-10-17	To improve education, fix the tax system	https://www.ft.lk/columns/To-improve-education-fix-the-tax-system/4-783110	en	dailyftlk	1760661630.0
lk_news	2025-10-17-virakesarilk-3a015e4a	virakesarilk-3a015e4a	2025-10-17	இன்றைய வானிலை	https://www.virakesari.lk/article/227944	ta	virakesarilk	1760661540.0
lk_news	2025-10-17-dailyftlk-51fa4a69	dailyftlk-51fa4a69	2025-10-17	Another health ‘bill’ for the consumer to foot?	https://www.ft.lk/columns/Another-health-bill-for-the-consumer-to-foot/4-783109	en	dailyftlk	1760661478.0
lk_news	2025-10-17-dailyftlk-9cb81f49	dailyftlk-9cb81f49	2025-10-17	Central Expressway resumption a milestone of Sri Lanka-China friendship under BRI	https://www.ft.lk/columns/Central-Expressway-resumption-a-milestone-of-Sri-Lanka-China-friendship-under-BRI/4-783108	en	dailyftlk	1760661262.0
lk_news	2025-10-17-dailyftlk-18e617ae	dailyftlk-18e617ae	2025-10-17	Cities ready for the future	https://www.ft.lk/columns/Cities-ready-for-the-future/4-783107	en	dailyftlk	1760661059.0
lk_news	2025-10-17-dailyftlk-313a1fda	dailyftlk-313a1fda	2025-10-17	Lanka Ashok Leyland reports strong first half results with Rs. 7.75 b revenue	https://www.ft.lk/business/Lanka-Ashok-Leyland-reports-strong-first-half-results-with-Rs-7-75-b-revenue/34-783105	en	dailyftlk	1760660818.0
lk_news	2025-10-17-dailyftlk-fe6c8504	dailyftlk-fe6c8504	2025-10-17	Dumindra Ratnayaka appointed Chairman of Avinya Foundation	https://www.ft.lk/business/Dumindra-Ratnayaka-appointed-Chairman-of-Avinya-Foundation/34-783104	en	dailyftlk	1760660748.0
lk_news	2025-10-17-dailyftlk-4f4e3cca	dailyftlk-4f4e3cca	2025-10-17	Mithila Wegapitiya joins LAUGFS Gas, LAUGFS Power Boards	https://www.ft.lk/business/Mithila-Wegapitiya-joins-LAUGFS-Gas-LAUGFS-Power-Boards/34-783103	en	dailyftlk	1760660673.0
lk_news	2025-10-17-dailyftlk-a94a1b57	dailyftlk-a94a1b57	2025-10-17	Great Place To Work holds CXO Forum	https://www.ft.lk/business/Great-Place-To-Work-holds-CXO-Forum/34-783102	en	dailyftlk	1760660599.0
lk_news	2025-10-17-dailyftlk-aed5f41b	dailyftlk-aed5f41b	2025-10-17	Havelock City Mall celebrates two years	https://www.ft.lk/business/Havelock-City-Mall-celebrates-two-years/34-783101	en	dailyftlk	1760660506.0
lk_news	2025-10-17-dailyftlk-b6664993	dailyftlk-b6664993	2025-10-17	Govt. to boost sports tourism	https://www.ft.lk/news/Govt-to-boost-sports-tourism/56-783100	en	dailyftlk	1760660429.0
lk_news	2025-10-17-dailyftlk-573cc636	dailyftlk-573cc636	2025-10-17	Colombo Port seen handling record 8.2 m containers in 2025	https://www.ft.lk/news/Colombo-Port-seen-handling-record-8-2-m-containers-in-2025/56-783099	en	dailyftlk	1760660374.0
lk_news	2025-10-17-dailyftlk-78c10f51	dailyftlk-78c10f51	2025-10-17	Job scam in England and Malta: Lawyer arrested for defrauding Rs. 9.41 m	https://www.ft.lk/news/Job-scam-in-England-and-Malta-Lawyer-arrested-for-defrauding-Rs-9-41-m/56-783098	en	dailyftlk	1760660328.0
lk_news	2025-10-17-dailyftlk-5e153068	dailyftlk-5e153068	2025-10-17	COPE rebukes CIDA for Rs. 15 m legal costs, staff harassment claims	https://www.ft.lk/news/COPE-rebukes-CIDA-for-Rs-15-m-legal-costs-staff-harassment-claims/56-783097	en	dailyftlk	1760660304.0
lk_news	2025-10-17-dailyftlk-9cd67482	dailyftlk-9cd67482	2025-10-17	Police caution public over predatory online and mobile loan schemes	https://www.ft.lk/news/Police-caution-public-over-predatory-online-and-mobile-loan-schemes/56-783096	en	dailyftlk	1760660250.0
lk_news	2025-10-17-dailyftlk-6613a469	dailyftlk-6613a469	2025-10-17	Customs says can release vehicles held over LC issues under conditions	https://www.ft.lk/news/Customs-says-can-release-vehicles-held-over-LC-issues-under-conditions/56-783095	en	dailyftlk	1760660205.0
lk_news	2025-10-17-dailyftlk-d0ed6d51	dailyftlk-d0ed6d51	2025-10-17	Harini, Jaishankar discuss education, capacity building cooperation between SL, India	https://www.ft.lk/news/Harini-Jaishankar-discuss-education-capacity-building-cooperation-between-SL-India/56-783094	en	dailyftlk	1760660146.0
lk_news	2025-10-17-dailyftlk-4ca977b5	dailyftlk-4ca977b5	2025-10-17	Over 300,000 driver’s licences  to be issued within three months	https://www.ft.lk/news/Over-300-000-driver-s-licences-to-be-issued-within-three-months/56-783093	en	dailyftlk	1760660125.0
lk_news	2025-10-17-dailyftlk-169f6651	dailyftlk-169f6651	2025-10-17	Parliament to take up Personal Data Protection (Amendment) Bill next week	https://www.ft.lk/news/Parliament-to-take-up-Personal-Data-Protection-Amendment-Bill-next-week/56-783092	en	dailyftlk	1760660108.0
lk_news	2025-10-17-dailyftlk-5294cd51	dailyftlk-5294cd51	2025-10-17	Customs records highest single-day revenue of Rs. 25 b	https://www.ft.lk/news/Customs-records-highest-single-day-revenue-of-Rs-25-b/56-783091	en	dailyftlk	1760660080.0
lk_news	2025-10-17-virakesarilk-68fc7470	virakesarilk-68fc7470	2025-10-17	தனியார் காணிகளை கடற்படையினருக்கு வழங்க முடியாது - வலி. வடக்கு பிரதேச சபையில் தீர்மானம்	https://www.virakesari.lk/article/227943	ta	virakesarilk	1760656620.0
lk_news	2025-10-17-virakesarilk-116453ff	virakesarilk-116453ff	2025-10-17	எரிபொருள் தீர்ந்தமையால் அனலைதீவில் கரையொதுங்கிய இந்திய மீனவர்கள்	https://www.virakesari.lk/article/227942	ta	virakesarilk	1760656440.0
lk_news	2025-10-17-virakesarilk-fc722e56	virakesarilk-fc722e56	2025-10-17	'லொக்கு பெட்டியின் நெருங்கிய ஆதரவாளரான பூசகர் கைது	https://www.virakesari.lk/article/227941	ta	virakesarilk	1760655840.0
lk_news	2025-10-17-virakesarilk-0a830648	virakesarilk-0a830648	2025-10-17	த சொய்சா மகப்பேற்று மருத்துவமனையில் தாபிக்கப்பட்டுள்ள அதிதீவிர சிகிச்சை பிரிவு சுகாதார அமைச்சரால் திறந்து வைக்கப்பட்டது	https://www.virakesari.lk/article/227940	ta	virakesarilk	1760655600.0
lk_news	2025-10-17-virakesarilk-e5224cb9	virakesarilk-e5224cb9	2025-10-17	சிறுவர்களுக்கு எதிரான உடலியல் ரீதியான தண்டனைகளை முடிவுக்குக்கொண்டுவரல்: மறுசீரமைப்பின் நோக்கத்தையும் முக்கியத்துவத்தையும் மக்கள் புரிந்துகொள்ளவேண்டும் - இலங்கை மனித உரிமைகள் ஆணைக்குழு வலியுறுத்தல்	https://www.virakesari.lk/article/227939	ta	virakesarilk	1760655420.0
lk_news	2025-10-17-virakesarilk-96b5886a	virakesarilk-96b5886a	2025-10-17	நாணய நிதியத்தின் நிர்ப்பந்தத்துக்கு மக்கள் ஆணை வழங்கவில்லை - சஜித் பிரேமதாச	https://www.virakesari.lk/article/227938	ta	virakesarilk	1760655240.0
lk_news	2025-10-17-virakesarilk-741358d5	virakesarilk-741358d5	2025-10-17	யாழில் சட்டவிரோதமான முறையில் ஆமை இறைச்சியை வைத்திருந்தவர் கைது!	https://www.virakesari.lk/article/227937	ta	virakesarilk	1760654520.0
lk_news	2025-10-17-virakesarilk-bdc8fedc	virakesarilk-bdc8fedc	2025-10-17	சம்மாந்துறை பொலிஸ் நிலைய பொறுப்பதிகாரியின் அதிரடி நடவடிக்கை ; போக்குவரத்து சட்டங்களை மீறிய 17 மோட்டார் சைக்கிள்கள் மீட்பு!	https://www.virakesari.lk/article/227936	ta	virakesarilk	1760653620.0
lk_news	2025-10-17-virakesarilk-39492699	virakesarilk-39492699	2025-10-17	கொழும்பு துறைமுக மனித புதைகுழியின் அகழ்வு நிறைவு, நூற்றுக்கும் மேற்பட்ட மனித எலும்புகள் மீட்பு	https://www.virakesari.lk/article/227935	ta	virakesarilk	1760653320.0
lk_news	2025-10-17-virakesarilk-2a5000c5	virakesarilk-2a5000c5	2025-10-17	பெருந்தோட்டத் தொழிலாளர்களின் சம்பள விவகாரம் ; 25ஆம் திகதிக்குள் இறுதி தீர்வு  - கிட்ணன் செல்வராஜா	https://www.virakesari.lk/article/227934	ta	virakesarilk	1760653020.0
lk_news	2025-10-17-tamilmirrorlk-8697cacd	tamilmirrorlk-8697cacd	2025-10-17	புடினை மீண்டும் சந்திக்கிறார் ட்ரம்ப்	https://www.tamilmirror.lk/உலக-செய்திகள்/புடினை-மீண்டும்-சந்திக்கிறார்-ட்ரம்ப்/50-366427	ta	tamilmirrorlk	1760652294.0
lk_news	2025-10-17-virakesarilk-91f142e8	virakesarilk-91f142e8	2025-10-17	அதிபர் டிரம்ப் மற்றும் புடின் சந்திப்பு 'மிகவும் பயனுள்ளதாக' முடிந்தது	https://www.virakesari.lk/article/227933	ta	virakesarilk	1760651880.0
lk_news	2025-10-17-bbccomsinhala-25aeb3d3	bbccomsinhala-25aeb3d3	2025-10-17	AI මගින් සිසුවියන් තිදෙනෙකුගේ නිරුවත් ඡායාරූප සැකසූ පාසල් සිසුවෙකු සහ අනුබල දුන් විදුහල්පතිවරයෙකු ගැන අධිකරණය ගත් පියවර	https://www.bbc.com/sinhala/articles/c0mxzwjjljpo	si	bbccomsinhala	1760651666.0
lk_news	2025-10-17-tamilmirrorlk-6899a185	tamilmirrorlk-6899a185	2025-10-17	இரும்பகத்தில் தகரம் வெட்டியதில் ஒருவர் உயிரிழப்பு	https://www.tamilmirror.lk/செய்திகள்/இரும்பகத்தில்-தகரம்-வெட்டியதில்-ஒருவர்-உயிரிழப்பு/175-366426	ta	tamilmirrorlk	1760651445.0
lk_news	2025-10-17-virakesarilk-5f7e06f5	virakesarilk-5f7e06f5	2025-10-17	ஹீலி சதத்தின் உதவியுடன் பங்களாதேஷை வீழ்த்தி முதல் அணியாக அரை இறுதிக்குள் நுழைந்தது அவுஸ்திரேலியா	https://www.virakesari.lk/article/227932	ta	virakesarilk	1760650920.0
lk_news	2025-10-17-bbccomsinhala-e7300736	bbccomsinhala-e7300736	2025-10-17	ශ්‍රී ලංකාවේ දුර්වල බදු ප්‍රතිපත්තිය දරුවන්ට අධ්‍යාපනය ලැබීමට ඇති අයිතියට බලපෑ බව හියුමන් රයිට්ස් වොච් වාර්තාවකින් අනාවරණය කරයි	https://www.bbc.com/sinhala/articles/c8r0ll73gllo	si	bbccomsinhala	1760644623.0
lk_news	2025-10-16-virakesarilk-6d4008b7	virakesarilk-6d4008b7	2025-10-16	சாவகச்சேரியில் புகையிரத விபத்தில் பெண் உயிரிழப்பு	https://www.virakesari.lk/article/227931	ta	virakesarilk	1760634420.0
lk_news	2025-10-16-virakesarilk-394e3bc1	virakesarilk-394e3bc1	2025-10-16	யாழ்ப்பாணம், வேலணித்துறை பகுதியில் சட்டவிரோதமாக கடலட்டைகளை கொண்டு சென்ற இரண்டு நபர்கள் கைது	https://www.virakesari.lk/article/227930	ta	virakesarilk	1760634120.0
lk_news	2025-10-16-islandlk-2187f381	islandlk-2187f381	2025-10-16	Lively share trading led by Hemas Holdings helps revive CSE; turnover crosses Rs 8 billion	http://island.lk/lively-share-trading-led-by-hemas-holdings-helps-revive-cse-turnover-crosses-rs-8-billion/	en	islandlk	1760629260.0
lk_news	2025-10-16-islandlk-1f1b3438	islandlk-1f1b3438	2025-10-16	CPC chief answers United Petroleum: ‘We’ve honoured every condition under exit agreement’	http://island.lk/cpc-chief-answers-united-petroleum-weve-honoured-every-condition-under-exit-agreement/	en	islandlk	1760629260.0
lk_news	2025-10-16-lankadeepalk-569fdfe5	lankadeepalk-569fdfe5	2025-10-16	පැරා ඔලිම්පික් පදක්කම් ලාබී සෙබළා දුම්රියේ ගැටිලා	https://www.lankadeepa.lk/news/පර-ඔලමපක-පදකකම-ලබ-සබළ-දමරය-ගටල/101-681502	si	lankadeepalk	1760627066.0
lk_news	2025-10-16-adalk-06a2c06e	adalk-06a2c06e	2025-10-16	ලංකා ක්ලවුඩ් පද්ධතියට ඇතිවූ බලපෑම තවදුරටත්	https://www.ada.lk/technology/ලංකා-ක්ලවුඩ්-පද්ධතියට-ඇතිවූ-බලපෑම-තවදුරටත්/5-419150	si	adalk	1760626465.0
lk_news	2025-10-16-lankadeepalk-b5920d74	lankadeepalk-b5920d74	2025-10-16	රේගුවේ ඇති වාහන කොන්දේසිවලට යටත්ව මුදා හරියි	https://www.lankadeepa.lk/news/රගව-ඇත-වහන-කනදසවලට-යටතව-මද-හරය/101-681501	si	lankadeepalk	1760625652.0
lk_news	2025-10-16-virakesarilk-2b8f1de3	virakesarilk-2b8f1de3	2025-10-16	2026 ஆடவர் ரி20 உலகக் கிண்ணத்தில் விளையாட நேபாளம், ஓமான் தகுதி	https://www.virakesari.lk/article/227929	ta	virakesarilk	1760625600.0
lk_news	2025-10-16-lankadeepalk-dea8a9e0	lankadeepalk-dea8a9e0	2025-10-16	ශ්‍රී ලංකා රේගුව කප් එක ගහයි	https://www.lankadeepa.lk/news/ශර-ලක-රගව-කප-එක-ගහය/101-681500	si	lankadeepalk	1760625389.0
lk_news	2025-10-16-islandlk-c5bdd898	islandlk-c5bdd898	2025-10-16	AIA Insurance pays tribute to Sarath Wikramanayake as he retires from Board	http://island.lk/aia-insurance-pays-tribute-to-sarath-wikramanayake-as-he-retires-from-board/	en	islandlk	1760624460.0
lk_news	2025-10-16-lankadeepalk-572ea03a	lankadeepalk-572ea03a	2025-10-16	සල්ලි අරන් නඩුවට නොආ ලෝයර්ගේ කබාය ගලවයි	https://www.lankadeepa.lk/news/සලල-අරන-නඩවට-නආ-ලයරග-කබය-ගලවය/101-681499	si	lankadeepalk	1760624419.0
lk_news	2025-10-16-lankadeepalk-429e2b09	lankadeepalk-429e2b09	2025-10-16	කළු සල්ලි සුදු කළැයි කපුවා කෝටි 33ක් සමග මාට්ටු	https://www.lankadeepa.lk/news/කළ-සලල-සද-කළය-කපව-කට-33ක-සමග-මටට/101-681498	si	lankadeepalk	1760623376.0
lk_news	2025-10-16-virakesarilk-f6b6ede4	virakesarilk-f6b6ede4	2025-10-16	கடன்மறுசீரமைப்பை அடுத்து இலங்கையின்  பொருளாதார செயலாக்கத்தில் முன்னேற்றம் - சர்வதேச நாணய நிதியம் பாராட்டு	https://www.virakesari.lk/article/227916	ta	virakesarilk	1760621580.0
lk_news	2025-10-16-virakesarilk-96d9d29f	virakesarilk-96d9d29f	2025-10-16	புகையிரத நிலைய  அதிபர் சங்கத்துக்கு  புதிய தலைவர், செயலாளர் நியமனம்	https://www.virakesari.lk/article/227917	ta	virakesarilk	1760621520.0
lk_news	2025-10-16-virakesarilk-006d2458	virakesarilk-006d2458	2025-10-16	பாராளுமன்ற உறுப்பினர்களின் சம்பளம் உள்ளிட்ட கொடுப்பனவுகளை கட்சி நிதியில் வரவு வைப்பதைத் தடை செய்யக் கோரும் தயாசிறி	https://www.virakesari.lk/article/227927	ta	virakesarilk	1760621460.0
lk_news	2025-10-16-virakesarilk-cac4b139	virakesarilk-cac4b139	2025-10-16	எதிர்பார்க்கப்பட்ட வரி வருவாயில் 102 வீதத்தை அடைய முடிந்தது - உள்நாட்டு இறைவரித் திணைக்களத்தின் அதிகாரிகள் தெரிவிப்பு	https://www.virakesari.lk/article/227926	ta	virakesarilk	1760620800.0
