doc_type	doc_id	num	date_str	description	url_metadata	lang	newspaper_id	time_ut
lk_news	2025-10-27-tamilmirrorlk-61b5ff8b	tamilmirrorlk-61b5ff8b	2025-10-27	LGBTQ சுற்றுலா திட்டத்திற்கு எதிராக மனுத் தாக்கல்	https://www.tamilmirror.lk/செய்திகள்/LGBTQ-சுற்றுலா-திட்டத்திற்கு-எதிராக-மனுத்-தாக்கல்/175-366939	ta	tamilmirrorlk	1761574103.0
lk_news	2025-10-27-virakesarilk-87acbff0	virakesarilk-87acbff0	2025-10-27	யாழ். தமிழ்ச் சங்கமும் அரசகரும மொழிகள் திணைக்களமும் இணைந்து நடத்திய புலமைத்துவக் கலந்துரையாடல்!	https://www.virakesari.lk/article/228835	ta	virakesarilk	1761572700.0
lk_news	2025-10-27-virakesarilk-62ff266f	virakesarilk-62ff266f	2025-10-27	மலேசிய மகளிர் கிரிக்கெட் அணியினர் இலங்கை வருகின்றனர்	https://www.virakesari.lk/article/228836	ta	virakesarilk	1761572640.0
lk_news	2025-10-27-lankadeepalk-865407b7	lankadeepalk-865407b7	2025-10-27	ජගත්ට දුන් ආරක්ෂාව ගැන පොලිස්පති කී දේකට සජබ විරෝධය	https://www.lankadeepa.lk/news/ජගතට-දන-ආරකෂව-ගන-පලසපත-ක-දකට-සජබ-වරධය/101-682174	si	lankadeepalk	1761572233.0
lk_news	2025-10-27-virakesarilk-9eb45541	virakesarilk-9eb45541	2025-10-27	வடக்கு மாகாண உள்ளூராட்சி அமைச்சின் செயலாளரைச் சந்தித்தார் துரைராசா ரவிகரன்	https://www.virakesari.lk/article/228834	ta	virakesarilk	1761571680.0
lk_news	2025-10-27-virakesarilk-3cc2d1da	virakesarilk-3cc2d1da	2025-10-27	அருவக்காடு திண்மக் கழிவு முகாமைத்துவத் திட்டத்தை கண்காணித்தார் பிரதமர்	https://www.virakesari.lk/article/228832	ta	virakesarilk	1761571500.0
lk_news	2025-10-27-lankadeepalk-8aaf262b	lankadeepalk-8aaf262b	2025-10-27	ලොකු ලූනු මිලට ගන්න වට මනී	https://www.lankadeepa.lk/news/ලක-ලන-මලට-ගනන-වට-මන/101-682173	si	lankadeepalk	1761571279.0
lk_news	2025-10-27-lankadeepalk-28bd51a3	lankadeepalk-28bd51a3	2025-10-27	වැලිගම සභාපති ඝාතනයට සැකපිට ගත් තිදෙනා රඳවා ගන්න අවසර	https://www.lankadeepa.lk/news/වලගම-සභපත-ඝතනයට-සකපට-ගත-තදන-රඳව-ගනන-අවසර/101-682172	si	lankadeepalk	1761570723.0
lk_news	2025-10-27-lankadeepalk-45b06dc8	lankadeepalk-45b06dc8	2025-10-27	තේ වතු හිමි ව්‍යාපාරික යුවළක් කඩුවලින් කපලා	https://www.lankadeepa.lk/news/ත-වත-හම-වයපරක-යවළක-කඩවලන-කපල/101-682171	si	lankadeepalk	1761569812.0
lk_news	2025-10-27-virakesarilk-3831005c	virakesarilk-3831005c	2025-10-27	கிழக்கு கடலில் நோய்வாய்ப்பட்ட MV IYO கப்பலின் பணியாளரை சிகிச்சைக்காக தரையிறக்க கடற்படையினர் உதவி!	https://www.virakesari.lk/article/228828	ta	virakesarilk	1761569100.0
lk_news	2025-10-27-virakesarilk-dde39c22	virakesarilk-dde39c22	2025-10-27	உயிர்த்த ஞாயிறு தாக்குதல் ; மைத்திரிபால சிறிசேனவின் மனு தொடர்பில் நீதிமன்றம் பிறப்பித்த உத்தரவு!	https://www.virakesari.lk/article/228823	ta	virakesarilk	1761569040.0
lk_news	2025-10-27-tamilmirrorlk-45ef6972	tamilmirrorlk-45ef6972	2025-10-27	சூரசம்ஹாரம்...	https://www.tamilmirror.lk/பிரதான-செய்திகள்/சூரசம்ஹாரம்/46-366937	ta	tamilmirrorlk	1761569003.0
lk_news	2025-10-27-lankadeepalk-be672b10	lankadeepalk-be672b10	2025-10-27	පිටරට ඉන්න ලාංකිකයින්ටත්  ඡන්ද අයිතිය	https://www.lankadeepa.lk/news/පටරට-ඉනන-ලකකයනටත-ඡනද-අයතය/101-682170	si	lankadeepalk	1761568519.0
lk_news	2025-10-27-virakesarilk-140c8d37	virakesarilk-140c8d37	2025-10-27	ஐசிசி மகளிர் உலகக் கிண்ண அரை இறுதிகள்: மத்தியஸ்தர்கள் குழாத்தில் இலங்கையின் நிமாலி, மிஷெல்	https://www.virakesari.lk/article/228833	ta	virakesarilk	1761568380.0
lk_news	2025-10-27-virakesarilk-31980166	virakesarilk-31980166	2025-10-27	“மிதிகம லசா” படுகொலை ; பிரதான துப்பாக்கிதாரி நீதிமன்ற வைத்தியரிடம் முன்னிலைப்படுத்தப்பட்டார்!	https://www.virakesari.lk/article/228831	ta	virakesarilk	1761567420.0
lk_news	2025-10-27-adalk-c03758cd	adalk-c03758cd	2025-10-27	මන්දකට හසු වී සිටි කදුකර කොටියා නිර්වින්දනය කර මුදා ගනිියි	https://www.ada.lk/breaking_news/මන්දකට-හසු-වී-සිටි-කදුකර-කොටියා-නිර්වින්දනය-කර-මුදා-ගනිියි/11-419348	si	adalk	1761567384.0
lk_news	2025-10-27-virakesarilk-0f64c98b	virakesarilk-0f64c98b	2025-10-27	யாழ்ப்பாணத்தில் 11 பேருக்கு மட்டுமல்ல மேலும் பலருக்கு எதிராக வழக்கு தாக்கல் - பொலிஸ்	https://www.virakesari.lk/article/228830	ta	virakesarilk	1761567240.0
lk_news	2025-10-27-lankadeepalk-e2a001fc	lankadeepalk-e2a001fc	2025-10-27	හරිනි - අරුවක්කාලු බලන්න යයි	https://www.lankadeepa.lk/news/හරන-අරවකකල-බලනන-යය/101-682169	si	lankadeepalk	1761567140.0
lk_news	2025-10-27-adalk-39c2a2fa	adalk-39c2a2fa	2025-10-27	විදෙස් ගත ශ්‍රී ලාංකිකයින්ට ඡන්ද අයිතිය	https://www.ada.lk/breaking_news/විදෙස්-ගත-ශ්‍රී-ලාංකිකයින්ට-ඡන්ද-අයිතිය/11-419347	si	adalk	1761566732.0
lk_news	2025-10-27-lankadeepalk-4006e35f	lankadeepalk-4006e35f	2025-10-27	රටවල් දෙකක ගුවන් සේවා හෙට සිට මත්තලට	https://www.lankadeepa.lk/news/රටවල-දකක-ගවන-සව-හට-සට-මතතලට/101-682168	si	lankadeepalk	1761565918.0
lk_news	2025-10-27-lankadeepalk-1f237123	lankadeepalk-1f237123	2025-10-27	’’සිපෙට්කෝ ලිහිසි තෙල්” ධීවරයන්ට ළගටම	https://www.lankadeepa.lk/news/සපටක-ලහස-තල-ධවරයනට-ළගටම/101-682167	si	lankadeepalk	1761565535.0
lk_news	2025-10-27-tamilmirrorlk-ecb91542	tamilmirrorlk-ecb91542	2025-10-27	வெளிநாடுகளில் வசிக்கும் இலங்கையர்களுக்கு விசேட செய்தி	https://www.tamilmirror.lk/செய்திகள்/வெளிநாடுகளில்-வசிக்கும்-இலங்கையர்களுக்கு-விசேட-செய்தி/175-366932	ta	tamilmirrorlk	1761565347.0
lk_news	2025-10-27-tamilmirrorlk-47e9a061	tamilmirrorlk-47e9a061	2025-10-27	எதிர்க்கட்சிக் கூட்டணியில் டெலிபோனைக் காணவில்லை	https://www.tamilmirror.lk/செய்திகள்/எதிர்க்கட்சிக்-கூட்டணியில்-டெலிபோனைக்-காணவில்லை/175-366931	ta	tamilmirrorlk	1761564813.0
lk_news	2025-10-27-lankadeepalk-4651ae38	lankadeepalk-4651ae38	2025-10-27	සංජය මහවත්තට වාරණයක්	https://www.lankadeepa.lk/latest_news/සජය-මහවතතට-වරණයක/1-682166	si	lankadeepalk	1761564528.0
lk_news	2025-10-27-virakesarilk-abb902f2	virakesarilk-abb902f2	2025-10-27	உலகில் மிக விரும்பப்படும் சுற்றுலாத் தலங்களில் இணைந்துள்ள யாழ்ப்பாணம்	https://www.virakesari.lk/article/228805	ta	virakesarilk	1761564480.0
lk_news	2025-10-27-virakesarilk-2ea4b991	virakesarilk-2ea4b991	2025-10-27	ஹிட்லருக்கு எதிரான கூட்டணி போன்றது எம்முடையது…! ; யானை– கை –மொட்டு கட்சிகளின் பிரகடனம்	https://www.virakesari.lk/article/228819	ta	virakesarilk	1761564300.0
lk_news	2025-10-27-virakesarilk-8e6772b8	virakesarilk-8e6772b8	2025-10-27	எச்.பி. பியசிறி அரச ஆயுர்வேத வைத்தியசாலையின் புதிய மூன்று மாடி சிகிச்சைப் பிரிவுக் கட்டடத் தொகுதி திறந்து வைப்பு!	https://www.virakesari.lk/article/228818	ta	virakesarilk	1761564120.0
lk_news	2025-10-27-tamilmirrorlk-b8b7fa64	tamilmirrorlk-b8b7fa64	2025-10-27	குறிஞ்சாக்கேணிக்கான பாதுகாப்பான படகு பாதை பயணம்  ஆரம்பம்	https://www.tamilmirror.lk/செய்திகள்/குறிஞ்சாக்கேணிக்கான-பாதுகாப்பான-படகு-பாதை-பயணம்-ஆரம்பம்/175-366930	ta	tamilmirrorlk	1761563841.0
lk_news	2025-10-27-virakesarilk-d2e913e7	virakesarilk-d2e913e7	2025-10-27	சிறைச்சாலையில் விசேட சோதனை ; கையடக்கத் தொலைபேசிகள் கைப்பற்றல்!	https://www.virakesari.lk/article/228812	ta	virakesarilk	1761563220.0
lk_news	2025-10-27-virakesarilk-0dd3820b	virakesarilk-0dd3820b	2025-10-27	போதைப்பொருள் விற்பனையில் ஈடுபட்ட ஓய்வு பெற்ற ஆசிரியையும் மருமகனும் கைது!	https://www.virakesari.lk/article/228815	ta	virakesarilk	1761563100.0
lk_news	2025-10-27-virakesarilk-a09c668e	virakesarilk-a09c668e	2025-10-27	இலஞ்ச ஊழல் முறைப்பாட்டுக்காக வாழும் அச்சுறுத்தல்; கிளிநொச்சி மாவட்டத்தில் ஊழல் எதிர்ப்பு ஆர்வலர் மீது தாக்குதல்	https://www.virakesari.lk/article/228814	ta	virakesarilk	1761563040.0
lk_news	2025-10-27-lankadeepalk-8b4677b8	lankadeepalk-8b4677b8	2025-10-27	ක්‍රිකට් තරඟ පාවාදීමට අනුබල දුන් තිදෙනකුගෙන් ප්‍රකාශ ගන්න නියෝගයක්	https://www.lankadeepa.lk/test/කරකට-තරඟ-පවදමට-අනබල-දන-තදනකගන-පරකශ-ගනන-නයගයක/222-682165	si	lankadeepalk	1761563009.0
lk_news	2025-10-27-virakesarilk-6067a474	virakesarilk-6067a474	2025-10-27	GovPay விண்ணப்பத்தின் மூலம் போக்குவரத்து அபராதம் செலுத்தும் திட்டத்தை செயல்படுத்துவது தொடர்பான கலந்துரையாடல்	https://www.virakesari.lk/article/228811	ta	virakesarilk	1761562560.0
lk_news	2025-10-27-virakesarilk-252c1ad9	virakesarilk-252c1ad9	2025-10-27	அஸ்வெசும திட்டத்துக்கு தகுதியானவர்கள் தேர்வுக்கு புதுப்பிக்கப்பட்ட தரவுக் கட்டமைப்பு அவசியம் ; உலக வங்கி	https://www.virakesari.lk/article/228809	ta	virakesarilk	1761562260.0
lk_news	2025-10-27-tamilmirrorlk-b1a1b980	tamilmirrorlk-b1a1b980	2025-10-27	பிறந்தநாள் ஐசிங் கேக்கில் இறந்த பல்லி	https://www.tamilmirror.lk/மலையகம்/பிறந்தநாள்-ஐசிங்-கேக்கில்-இறந்த-பல்லி/76-366927	ta	tamilmirrorlk	1761562042.0
lk_news	2025-10-27-virakesarilk-e2d6b1ed	virakesarilk-e2d6b1ed	2025-10-27	வரலாற்றுச் சிறப்புமிக்க நுவரெலியா தபால் நிலைய புனரமைப்புச் சிறப்பு கலந்துரையாடல்	https://www.virakesari.lk/article/228807	ta	virakesarilk	1761562020.0
lk_news	2025-10-27-virakesarilk-777dc5a0	virakesarilk-777dc5a0	2025-10-27	கிண்ணியா - குறிஞ்சாக்கேணி இடையிலான படகுப் பாதை சேவை ஆரம்பம்	https://www.virakesari.lk/article/228810	ta	virakesarilk	1761561960.0
lk_news	2025-10-27-lankadeepalk-408afa86	lankadeepalk-408afa86	2025-10-27	බැංකුවලට ෆිනෑන්ස් සමාගම්වලට කෝටි 2000ක ණය පොල්ලක්	https://www.lankadeepa.lk/news/බකවලට-ෆනනස-සමගමවලට-කට-2000ක-ණය-පලලක/101-682164	si	lankadeepalk	1761561803.0
lk_news	2025-10-27-virakesarilk-9b39779a	virakesarilk-9b39779a	2025-10-27	அரசாங்கத்தின் பிரச்சார திட்டத்திற்கு ஏற்ப பொலிஸ்மா அதிபர் வெளியிடும் அறிக்கைகள் சுதந்திரமான பொலிஸின் இருப்பையே கேள்விக்குள்ளாக்குகிறது - ஐக்கிய மக்கள் சக்தி	https://www.virakesari.lk/article/228806	ta	virakesarilk	1761561600.0
lk_news	2025-10-27-virakesarilk-b920a590	virakesarilk-b920a590	2025-10-27	போதைப்பொருள் பாவனை, மதுபாவனை ஆகிய இரண்டுமே அதிகமாக நுகரும் இடமாக யாழ்ப்பாணம்   -   மாவட்ட அரசாங்க அதிபர் பிரதிபன்	https://www.virakesari.lk/article/228804	ta	virakesarilk	1761561540.0
lk_news	2025-10-27-virakesarilk-bcfdcbe0	virakesarilk-bcfdcbe0	2025-10-27	சிறைச்சாலையிலிருந்து கைதிகள் இருவர் தப்பியோட்டம்!	https://www.virakesari.lk/article/228808	ta	virakesarilk	1761561120.0
lk_news	2025-10-27-lankadeepalk-c1fa11b7	lankadeepalk-c1fa11b7	2025-10-27	හදිසි මෙහෙයුමෙන් බුස්සෙන් දුරකතන 14ක් හමුවේ	https://www.lankadeepa.lk/news/හදස-මහයමන-බසසන-දරකතන-14ක-හමව/101-682162	si	lankadeepalk	1761560771.0
lk_news	2025-10-27-tamilmirrorlk-90f8148b	tamilmirrorlk-90f8148b	2025-10-27	2026 இல் சிறந்த 25 நகரங்களில்  யாழ்ப்பாணம்	https://www.tamilmirror.lk/செய்திகள்/2026-இல்-சிறந்த-25-நகரங்களில்-யாழ்ப்பாணம்/175-366925	ta	tamilmirrorlk	1761560557.0
lk_news	2025-10-27-tamilmirrorlk-425572f9	tamilmirrorlk-425572f9	2025-10-27	2026 இல் சிறந்த 25 நகரங்களில்  யாழ்ப்பாணம் இடம்பிடிப்பு	https://www.tamilmirror.lk/செய்திகள்/2026-இல்-சிறந்த-25-நகரங்களில்-யாழ்ப்பாணம்-இடம்பிடிப்பு/175-366925	ta	tamilmirrorlk	1761560557.0
lk_news	2025-10-27-tamilmirrorlk-b89af484	tamilmirrorlk-b89af484	2025-10-27	மாமனாரின் துப்பாக்கிச் சூட்டில் கான்ஸ்டபிள் பலி	https://www.tamilmirror.lk/செய்திகள்/மாமனாரின்-துப்பாக்கிச்-சூட்டில்-கான்ஸ்டபிள்-பலி/175-366924	ta	tamilmirrorlk	1761560370.0
lk_news	2025-10-27-virakesarilk-60c90e1f	virakesarilk-60c90e1f	2025-10-27	மாதவன் நடிக்கும் 'ஜி.டி.என்' ( ஜி.டி.நாயுடு) படத்தின் ஃபர்ஸ்ட் லுக் வெளியீடு	https://www.virakesari.lk/article/228803	ta	virakesarilk	1761560040.0
lk_news	2025-10-27-virakesarilk-e8ba7f62	virakesarilk-e8ba7f62	2025-10-27	ரசிகர்களுக்கும், ஊடகங்களுக்கும் நன்றி தெரிவித்த 'பைசன் காளமாடன்' படக் குழு	https://www.virakesari.lk/article/228802	ta	virakesarilk	1761559800.0
lk_news	2025-10-27-lankadeepalk-6e79ab21	lankadeepalk-6e79ab21	2025-10-27	වසර දෙකකට පසු කුවේට් එයාර්වේස් ලංකා ගුවනට	https://www.lankadeepa.lk/latest_news/වසර-දකකට-පස-කවට-එයරවස-ලක-ගවනට/1-682160	si	lankadeepalk	1761559599.0
lk_news	2025-10-27-virakesarilk-fd400cb8	virakesarilk-fd400cb8	2025-10-27	விறுவிறுப்பான படப்பிடிப்பில் விஜய் அண்டனியின் 'நூறு சாமி'	https://www.virakesari.lk/article/228801	ta	virakesarilk	1761559440.0
lk_news	2025-10-27-virakesarilk-f94e84e1	virakesarilk-f94e84e1	2025-10-27	எல்ல - பசறை வீதியில் மரமொன்று முறிந்து விழுந்தது!	https://www.virakesari.lk/article/228800	ta	virakesarilk	1761559320.0
lk_news	2025-10-27-virakesarilk-0623cc69	virakesarilk-0623cc69	2025-10-27	ஹாரிஸ் ஜெயராஜ் இசையில் உருவாகும் 'காதல் ரீசெட் ரிப்பீட்'	https://www.virakesari.lk/article/228799	ta	virakesarilk	1761559200.0
lk_news	2025-10-27-adalk-c41413b7	adalk-c41413b7	2025-10-27	තුන් හැවැරිදි පිරිමි දරුවා ඝාතනය කර මව දිවි නසාගෙන	https://www.ada.lk/breaking_news/තුන්-හැවැරිදි-පිරිමි-දරුවා-ඝාතනය-කර-මව-දිවි-නසාගෙන/11-419346	si	adalk	1761559055.0
lk_news	2025-10-27-virakesarilk-f143b83d	virakesarilk-f143b83d	2025-10-27	புல்மோட்டை ஊழியர்கள் 83 பேருக்கு 15 மாதங்களாக ஊதியம் இல்லை ; 14 ஆவது நாளாக தொடர் சத்தியாக் கிரக போராட்டம்	https://www.virakesari.lk/article/228790	ta	virakesarilk	1761558960.0
lk_news	2025-10-27-tamilmirrorlk-e56c8daa	tamilmirrorlk-e56c8daa	2025-10-27	உள்ளாடையை இழுத்து பலாத்கார முயற்சி; இளம்பெண் அதிர்ச்சி	https://www.tamilmirror.lk/உலக-செய்திகள்/ரயிலில்-உள்ளாடையை-இழுத்து-பலாத்கார-முயற்சி-இளம்பெண்-அதிர்ச்சி/50-366923	ta	tamilmirrorlk	1761558855.0
lk_news	2025-10-27-tamilmirrorlk-e86e91c3	tamilmirrorlk-e86e91c3	2025-10-27	பல்லேகல சிறையில் இருந்து இருவர் தப்பியோட்டம்	https://www.tamilmirror.lk/மலையகம்/பல்லேகல-சிறையில்-இருந்து-இருவர்-தப்பியோட்டம்/76-366922	ta	tamilmirrorlk	1761558821.0
lk_news	2025-10-27-virakesarilk-52b81fbe	virakesarilk-52b81fbe	2025-10-27	பெண்ணின் சடலத்தை அடையாளம் காண பொதுமக்களிடம்  உதவி கோரல்!	https://www.virakesari.lk/article/228796	ta	virakesarilk	1761558720.0
lk_news	2025-10-27-lankadeepalk-1fcd106d	lankadeepalk-1fcd106d	2025-10-27	ශ්‍රීලනිප කොළඹ සභාපති ධූරයට ෆයිසර් මුස්තාපා	https://www.lankadeepa.lk/latest_news/ශරලනප-කළඹ-සභපත-ධරයට-ෆයසර-මසතප/1-682159	si	lankadeepalk	1761558353.0
lk_news	2025-10-27-virakesarilk-15548194	virakesarilk-15548194	2025-10-27	ஐக்கிய இராச்சியத்தில் இலங்கை சமூகத்தினரைச் சந்தித்த இலங்கை அமைச்சர்கள் மூவர்	https://www.virakesari.lk/article/228792	ta	virakesarilk	1761558120.0
lk_news	2025-10-27-lankadeepalk-c95bf043	lankadeepalk-c95bf043	2025-10-27	දකුණු ආසියානු ජ්‍යෙෂ්ඨ මලල ක්‍රීඩා ශූරතාවලියේ අනුශූරතාව දිනයි	https://www.lankadeepa.lk/latest_news/දකණ-ආසයන-ජයෂඨ-මලල-කරඩ-ශරතවලය-අනශරතව-දනය/1-682158	si	lankadeepalk	1761558066.0
lk_news	2025-10-27-virakesarilk-a5123b1c	virakesarilk-a5123b1c	2025-10-27	கொழும்பில் பாகிஸ்தான் உயர் ஸ்தானிகராலயத்தில் ‘காஷ்மீர் கறுப்பு தின’ கருத்தரங்கு,  புகைப்படக் கண்காட்சி	https://www.virakesari.lk/article/228789	ta	virakesarilk	1761558060.0
lk_news	2025-10-27-virakesarilk-0dd8fcdc	virakesarilk-0dd8fcdc	2025-10-27	மொன்தா புயல் வலுவடைவதால் இந்தியாவில் பல்லாயிரக்கணக்கான மக்கள் நிவாரண முகாம்களில் தங்க வைப்பு	https://www.virakesari.lk/article/228788	ta	virakesarilk	1761557880.0
lk_news	2025-10-27-virakesarilk-b2313fa4	virakesarilk-b2313fa4	2025-10-27	வெளிநாட்டிலுள்ள இலங்கையர்களுக்கு விரைவில் வாக்குரிமை: அமைச்சர் விஜித ஹேரத் அறிவிப்பு	https://www.virakesari.lk/article/228786	ta	virakesarilk	1761557760.0
lk_news	2025-10-27-lankadeepalk-01138db8	lankadeepalk-01138db8	2025-10-27	මාලිමා ආණ්ඩුවට එරෙහිව විපක්ෂයෙන් ජන රැළියක්	https://www.lankadeepa.lk/news/මලම-ආණඩවට-එරහව-වපකෂයන-ජන-රළයක/101-682157	si	lankadeepalk	1761557606.0
lk_news	2025-10-27-virakesarilk-b51fc6a7	virakesarilk-b51fc6a7	2025-10-27	சிறுமி மீது பாலியல் துஷ்பிரயோகம் ; தாயின் இரண்டாவது கணவன் கைது!	https://www.virakesari.lk/article/228791	ta	virakesarilk	1761557580.0
lk_news	2025-10-27-lankadeepalk-de6e5142	lankadeepalk-de6e5142	2025-10-27	පල්ලෙ කැලෙන් රැඳවියෝ දෙන්නෙක් පැන යති	https://www.lankadeepa.lk/latest_news/පලල-කලන-රඳවය-දනනක-පන-යත/1-682156	si	lankadeepalk	1761557456.0
lk_news	2025-10-27-lankadeepalk-61f850e6	lankadeepalk-61f850e6	2025-10-27	මාමාගේ වෙඩි පහරින් පො.කො බෑනා මරුට	https://www.lankadeepa.lk/latest_news/මමග-වඩ-පහරන-ප-ක-බන-මරට/1-682155	si	lankadeepalk	1761556832.0
lk_news	2025-10-27-tamilmirrorlk-238fa2a1	tamilmirrorlk-238fa2a1	2025-10-27	கரையை நோக்கி படையெடுக்கும் நண்டுகள்: மக்கள் அச்சம்	https://www.tamilmirror.lk/செய்திகள்/கரையை-நோக்கி-படையெடுக்கும்-நண்டுகள்-மக்கள்-அச்சம்/175-366920	ta	tamilmirrorlk	1761556820.0
lk_news	2025-10-27-lankadeepalk-7669a6a6	lankadeepalk-7669a6a6	2025-10-27	අස්වැසුමට හරි දත්ත ඕනෑ	https://www.lankadeepa.lk/latest_news/අසවසමට-හර-දතත-ඕන/1-682154	si	lankadeepalk	1761556565.0
lk_news	2025-10-27-virakesarilk-fbc278e1	virakesarilk-fbc278e1	2025-10-27	மோட்டார் சைக்கிள் ஓட்ட பந்தயம் நடத்திய 8 பேர் கைது!	https://www.virakesari.lk/article/228787	ta	virakesarilk	1761556380.0
lk_news	2025-10-27-lankadeepalk-ac018f88	lankadeepalk-ac018f88	2025-10-27	පරිසර ඇමති හොංකොං සමුළුවට	https://www.lankadeepa.lk/latest_news/පරසර-ඇමත-හක-සමළවට/1-682153	si	lankadeepalk	1761556374.0
