doc_type	doc_id	num	date_str	description	url_metadata	lang	newspaper_id	time_ut
lk_news	2025-11-13-virakesarilk-6aeb671b	virakesarilk-6aeb671b	2025-11-13	நல்லூர் பிரதேச சபையினால் பாதீனிச் செடி அகற்றும் செயற்றிட்டம் முன்னெடுப்பு	https://www.virakesari.lk/article/230217	ta	virakesarilk	1763018700.0
lk_news	2025-11-13-lankadeepalk-7199cb7b	lankadeepalk-7199cb7b	2025-11-13	හල්ඔළුව අත්අඩංගුවට ගන්න නියෝග	https://www.lankadeepa.lk/news/හලඔළව-අතඅඩගවට-ගනන-නයග/101-683086	si	lankadeepalk	1763018433.0
lk_news	2025-11-13-virakesarilk-5915d886	virakesarilk-5915d886	2025-11-13	தேசிய லொத்தர் சபையின் முன்னாள் பணிப்பாளர் துசித ஹல்லொலுவவுக்கு பிடியாணை	https://www.virakesari.lk/article/230232	ta	virakesarilk	1763018340.0
lk_news	2025-11-13-virakesarilk-e520463d	virakesarilk-e520463d	2025-11-13	வீதி விளக்குகளுக்கான மின்சார கட்டணத்தை  செலுத்த தவறிய உள்ளூராட்சி நிறுவனங்கள் - வலுசக்தி அமைச்சர்	https://www.virakesari.lk/article/230220	ta	virakesarilk	1763018220.0
lk_news	2025-11-13-virakesarilk-37da5bbd	virakesarilk-37da5bbd	2025-11-13	நாட்டின் வெவ்வேறு பகுதிகளில் இடம்பெற்ற விபத்துக்களில் இருவர் உயிரிழப்பு	https://www.virakesari.lk/article/230219	ta	virakesarilk	1763018160.0
lk_news	2025-11-13-tamilmirrorlk-48dd63b8	tamilmirrorlk-48dd63b8	2025-11-13	செங்​கோட்​டை​யில் ஜனவரி 26 அன்றே தாக்​குதல் நடத்த திட்டம்	https://www.tamilmirror.lk/செய்திகள்/செங்-கோட்-டை-யில்-ஜனவரி-26-அன்றே-தாக்-குதல்-நடத்த-திட்டம்/175-367883	ta	tamilmirrorlk	1763018120.0
lk_news	2025-11-13-adalk-8559e5e0	adalk-8559e5e0	2025-11-13	තුසිත හල්ලොලුවට අත්අඩංගුවට ගෙන අධිකරණයට ඉදිරිපත් කරන්නැයි නියෝග	https://www.ada.lk/breaking_news/තුසිත-හල්ලොලුවට-අත්අඩංගුවට-ගෙන-අධිකරණයට-ඉදිරිපත්-කරන්නැයි-නියෝග/11-419667	si	adalk	1763018037.0
lk_news	2025-11-13-virakesarilk-40eccfbd	virakesarilk-40eccfbd	2025-11-13	விதை நெல் உற்பத்திக்கு காப்புறுதித் திட்டம் அறிமுகம் - கமநல காப்புறுதிச் சபை	https://www.virakesari.lk/article/230218	ta	virakesarilk	1763017920.0
lk_news	2025-11-13-virakesarilk-f393def4	virakesarilk-f393def4	2025-11-13	அரச சேவைக்காக முறையான சம்பளக் கட்டமைப்பைத் தயாரிப்பது தொடர்பான இடைக்கால அறிக்கை அமைச்சுசார் ஆலோசனைக் குழுவிடம் கையளிக்கப்படும் - சந்தன சூரியாரச்சி	https://www.virakesari.lk/article/230231	ta	virakesarilk	1763017800.0
lk_news	2025-11-13-virakesarilk-e8f61d1d	virakesarilk-e8f61d1d	2025-11-13	இலஞ்சம் பெற்ற வனஜீவராசிகள் அலுவலக அதிகாரி கைது	https://www.virakesari.lk/article/230216	ta	virakesarilk	1763017800.0
lk_news	2025-11-13-virakesarilk-06b41ae0	virakesarilk-06b41ae0	2025-11-13	யாழ். பல்கலை நிர்வாகச் செயல்களில் தலையிட்டதில்லை - ரஜீவன் எம்.பி	https://www.virakesari.lk/article/230230	ta	virakesarilk	1763017800.0
lk_news	2025-11-13-virakesarilk-1c3f26f6	virakesarilk-1c3f26f6	2025-11-13	லங்கா பிரிமியர் லீக் ஆட்ட நிர்ணய சதியில் ஈடுபட்ட தமீம் ரஹ்மானுக்கு எதிராக குற்றப்பத்திரிகை தாக்கல்	https://www.virakesari.lk/article/230215	ta	virakesarilk	1763017680.0
lk_news	2025-11-13-virakesarilk-11f17df5	virakesarilk-11f17df5	2025-11-13	இந்தியாவுக்கு குர்ஆன் பிரதிகள் அனுப்பப்படுவதாக வரும் செய்திகள் பொய்யானவை - பஸ்மின் ஷரீப்	https://www.virakesari.lk/article/230214	ta	virakesarilk	1763017620.0
lk_news	2025-11-13-virakesarilk-b6c31fa3	virakesarilk-b6c31fa3	2025-11-13	சட்ட விரோதமாக மன்னாரிலிருந்து தனுஷ்கோடி அரிச்சல் முனை பகுதிக்கு படகில் சென்றவர் கைது	https://www.virakesari.lk/article/230221	ta	virakesarilk	1763017560.0
lk_news	2025-11-13-adalk-eb887f54	adalk-eb887f54	2025-11-13	ශ්‍රී ලංකා - පාකිස්තාන එක්දින තරගාවලියේ දින වෙනස්වෙයි	https://www.ada.lk/sports/ශ්‍රී-ලංකා---පාකිස්තාන-එක්දින-තරගාවලියේ-දින-වෙනස්වෙයි/9-419666	si	adalk	1763017434.0
lk_news	2025-11-13-virakesarilk-ff6eb8bf	virakesarilk-ff6eb8bf	2025-11-13	நடிகர் பவிஷ் நடிக்கும் 'லவ் ஓ லவ்' ‌ படத்தின் டைட்டில்  லுக் வெளியீடு	https://www.virakesari.lk/article/230229	ta	virakesarilk	1763016960.0
lk_news	2025-11-13-virakesarilk-48004b99	virakesarilk-48004b99	2025-11-13	நடிகர் ரஜினி கிஷன் நடிக்கும்' ரஜினி கேங் ' படத்தின் இசை மற்றும் முன்னோட்டம் வெளியீடு	https://www.virakesari.lk/article/230227	ta	virakesarilk	1763016840.0
lk_news	2025-11-13-virakesarilk-174ed6e0	virakesarilk-174ed6e0	2025-11-13	அடுத்த தலைமுறை இணைப்பை அனைவருக்கும் கிடைக்கச் செய்யும் Dialog, Nubia Air 5Gஐ அறிமுகப்படுத்துகிறது	https://www.virakesari.lk/article/230228	ta	virakesarilk	1763016840.0
lk_news	2025-11-13-virakesarilk-84d0ee66	virakesarilk-84d0ee66	2025-11-13	இலங்கையின் எட்டாக்கனியான ஜனநாயகத்தை புதுப்பித்தல்	https://www.virakesari.lk/article/230224	ta	virakesarilk	1763016300.0
lk_news	2025-11-13-virakesarilk-548c3477	virakesarilk-548c3477	2025-11-13	உலக நற்குண தினம் – மனித இதயங்களை இணைக்கும் கருணையின் பரிமாணங்கள்	https://www.virakesari.lk/article/230211	ta	virakesarilk	1763015820.0
lk_news	2025-11-13-adalk-20781db4	adalk-20781db4	2025-11-13	කීරි සම්බා වල මිල සංශෝධනය  කරනවා	https://www.ada.lk/breaking_news/කීරි-සම්බා-වල-මිල-සංශෝධනය--කරනවා/11-419665	si	adalk	1763015288.0
lk_news	2025-11-13-lankadeepalk-0379bde5	lankadeepalk-0379bde5	2025-11-13	රාජ්‍ය ව්‍යාපාර විකුණනවා වෙනුවට ලාබ ගන්න වැඩ කරනවා	https://www.lankadeepa.lk/news/රජය-වයපර-වකණනව-වනවට-ලබ-ගනන-වඩ-කරනව/101-683082	si	lankadeepalk	1763015229.0
lk_news	2025-11-13-tamilmirrorlk-c795a318	tamilmirrorlk-c795a318	2025-11-13	சட்டவிரோதமாக தனுஷ்கோடி சென்றவர் கைது	https://www.tamilmirror.lk/செய்திகள்/சட்டவிரோதமாக-தனுஷ்கோடி-சென்றவர்-கைது/175-367881	ta	tamilmirrorlk	1763015126.0
lk_news	2025-11-13-tamilmirrorlk-7203c46e	tamilmirrorlk-7203c46e	2025-11-13	காசல் வீதி மருத்துவமனையில் ஒட்டிப் பிறந்த இரட்டையர்கள்	https://www.tamilmirror.lk/செய்திகள்/காசல்-வீதி-மருத்துவமனையில்-ஒட்டிப்-பிறந்த-இரட்டையர்கள்/175-367880	ta	tamilmirrorlk	1763014957.0
lk_news	2025-11-13-tamilmirrorlk-082f4789	tamilmirrorlk-082f4789	2025-11-13	காசலில் ஒட்டிப் பிறந்த இரட்டையர்கள்	https://www.tamilmirror.lk/செய்திகள்/காசலில்-ஒட்டிப்-பிறந்த-இரட்டையர்கள்/175-367880	ta	tamilmirrorlk	1763014957.0
lk_news	2025-11-13-lankadeepalk-a5845bd5	lankadeepalk-a5845bd5	2025-11-13	අයවැය මාරක ළිඳේ මෝටර් සයිකලේ වගේ	https://www.lankadeepa.lk/news/අයවය-මරක-ළඳ-මටර-සයකල-වග/101-683081	si	lankadeepalk	1763014639.0
lk_news	2025-11-13-tamilmirrorlk-6d8e5630	tamilmirrorlk-6d8e5630	2025-11-13	புதுடெல்லியில் கோரம்: 500 மீட்டர் தொலைவில் கூரையில் கை	https://www.tamilmirror.lk/செய்திகள்/புதுடெல்லியில்-கோரம்-500-மீட்டர்-தொலைவில்-கூரையில்-கை/175-367879	ta	tamilmirrorlk	1763014034.0
