doc_type	doc_id	num	date_str	description	url_metadata	lang	newspaper_id	time_ut
lk_news	2025-12-13-virakesarilk-d410587e	virakesarilk-d410587e	2025-12-13	யாழில். ஒரு இளைஞனின் மரணம் இரண்டு உயிர்களை காப்பாற்றியது	https://www.virakesari.lk/article/233228	ta	virakesarilk	1765572720.0
lk_news	2025-12-13-virakesarilk-dbf49036	virakesarilk-dbf49036	2025-12-13	புலிகளின் காலத்தில் இந்திய மீனவர்களின் அத்துமீறல் இருக்கவில்லை; இந்திய இழுவைப்படகுகளின் அத்துமீறலுக்கு முற்றுப்புள்ளி வைக்கப்படவேண்டும் - ரவிகரன் எம்.பி	https://www.virakesari.lk/article/233227	ta	virakesarilk	1765572300.0
lk_news	2025-12-13-virakesarilk-c1dd74e1	virakesarilk-c1dd74e1	2025-12-13	ஸ்ரீ லங்கா சுதந்திரக் கட்சியின் சிரேஷ்ட உப தலைவராக விஜேயதாச ராஜபக்ஷ நியமனம்	https://www.virakesari.lk/article/233226	ta	virakesarilk	1765570020.0
lk_news	2025-12-13-virakesarilk-d8463806	virakesarilk-d8463806	2025-12-13	நத்தார் காலத்தில் விசேட பாதுகாப்பு	https://www.virakesari.lk/article/233225	ta	virakesarilk	1765569660.0
lk_news	2025-12-13-dailyftlk-90cf927d	dailyftlk-90cf927d	2025-12-13	Norway supports flood-affected communities in Sri Lanka	https://www.ft.lk/news/Norway-supports-flood-affected-communities-in-Sri-Lanka/56-785614	en	dailyftlk	1765566683.0
lk_news	2025-12-13-dailyftlk-5b4b51d8	dailyftlk-5b4b51d8	2025-12-13	Canada pledges support for Sri Lanka’s post-disaster rebuilding efforts	https://www.ft.lk/news/Canada-pledges-support-for-Sri-Lanka-s-post-disaster-rebuilding-efforts/56-785613	en	dailyftlk	1765566646.0
lk_news	2025-12-13-dailyftlk-91200e45	dailyftlk-91200e45	2025-12-13	Naturub Group of Companies donates Rs. 100 m to ‘Rebuilding Sri Lanka’ Fund	https://www.ft.lk/business/Naturub-Group-of-Companies-donates-Rs-100-m-to-Rebuilding-Sri-Lanka-Fund/34-785612	en	dailyftlk	1765566555.0
lk_news	2025-12-13-dailyftlk-fc0cf944	dailyftlk-fc0cf944	2025-12-13	Anunine Holdings donates Rs. 25 m to ‘Rebuilding Sri Lanka’ Fund	https://www.ft.lk/business/Anunine-Holdings-donates-Rs-25-m-to-Rebuilding-Sri-Lanka-Fund/34-785611	en	dailyftlk	1765566518.0
lk_news	2025-12-13-dailyftlk-b41694b7	dailyftlk-b41694b7	2025-12-13	Lanka IOC donates Rs. 50 m to “Rebuilding Sri Lanka” Fund	https://www.ft.lk/business/Lanka-IOC-donates-Rs-50-m-to-Rebuilding-Sri-Lanka-Fund/34-785610	en	dailyftlk	1765566479.0
lk_news	2025-12-13-dailyftlk-734d9a91	dailyftlk-734d9a91	2025-12-13	Macksons Holdings donates  Rs. 15 m to ‘Rebuilding Sri Lanka’	https://www.ft.lk/business/Macksons-Holdings-donates-Rs-15-m-to-Rebuilding-Sri-Lanka/34-785609	en	dailyftlk	1765566431.0
lk_news	2025-12-13-dailyftlk-90d8c832	dailyftlk-90d8c832	2025-12-13	Musings from Houston: Embrace challenges and be ready to take off	https://www.ft.lk/columns/Musings-from-Houston-Embrace-challenges-and-be-ready-to-take-off/4-785607	en	dailyftlk	1765566079.0
lk_news	2025-12-13-dailyftlk-3a510f6f	dailyftlk-3a510f6f	2025-12-13	Brands driving urban revitalisation through creativity, arts and culture	https://www.ft.lk/columns/Brands-driving-urban-revitalisation-through-creativity-arts-and-culture/4-785591	en	dailyftlk	1765565067.0
lk_news	2025-12-13-dailyftlk-30adaea0	dailyftlk-30adaea0	2025-12-13	US tariffs vs. Chinese supremacy: Can US soybean “Make America Great Again?”	https://www.ft.lk/columns/US-tariffs-vs-Chinese-supremacy-Can-US-soybean-Make-America-Great-Again/4-785590	en	dailyftlk	1765564962.0
lk_news	2025-12-13-dailyftlk-fe6ec394	dailyftlk-fe6ec394	2025-12-13	News and irony intersect  in a cyclone’s aftermath	https://www.ft.lk/columns/News-and-irony-intersect-in-a-cyclone-s-aftermath/4-785589	en	dailyftlk	1765564718.0
lk_news	2025-12-12-lankadeepalk-a928ee0a	lankadeepalk-a928ee0a	2025-12-12	හිටපු කතානායක රන්වලට ඇප	https://www.lankadeepa.lk/latest_news/හටප-කතනයක-රනවලට-ඇප/1-685191	si	lankadeepalk	1765560387.0
lk_news	2025-12-12-virakesarilk-9c89bdce	virakesarilk-9c89bdce	2025-12-12	டிசம்பர், ஜனவரி மாதங்களில் மீண்டும் புயல் உருவாகும் வாய்ப்பு அதிகம் - காலநிலை நிபுணர்கள் எச்சரிக்கை	https://www.virakesari.lk/article/233224	ta	virakesarilk	1765556280.0
lk_news	2025-12-12-virakesarilk-e984c490	virakesarilk-e984c490	2025-12-12	டித்வா புயலால் பாதிக்கப்பட்ட பெண்கள், சிறுமியர்களின் பாதுகாப்புக்கு நிதியுதவி வழங்குமாறு ஐ. நா. சனத்தொகை நிதியம் அவசர வேண்டுகோள் !	https://www.virakesari.lk/article/233223	ta	virakesarilk	1765554840.0
lk_news	2025-12-12-virakesarilk-fe6b2825	virakesarilk-fe6b2825	2025-12-12	இலங்கையுடன் நண்பனாக இருப்பதில் பெருமை — அமெரிக்க தூதர்	https://www.virakesari.lk/article/233222	ta	virakesarilk	1765554660.0
lk_news	2025-12-12-lankadeepalk-bf9339fe	lankadeepalk-bf9339fe	2025-12-12	කොන්ද හයිය කරන බේතක් ගේන ලංසුව දෙයි	https://www.lankadeepa.lk/news/කනද-හයය-කරන-බතක-ගන-ලසව-දය/101-685190	si	lankadeepalk	1765553565.0
lk_news	2025-12-12-adalk-763a27ae	adalk-763a27ae	2025-12-12	වරෙන්තු 88 කට අවශ්‍යකර සිටි සැකකරුවෙකු අත්අඩංගුවට	https://www.ada.lk/breaking_news/වරෙන්තු-88-කට-අවශ්‍යකර-සිටි-සැකකරුවෙකු-අත්අඩංගුවට/11-420213	si	adalk	1765553359.0
lk_news	2025-12-12-lankadeepalk-d213f709	lankadeepalk-d213f709	2025-12-12	ආපදාවට මුහුණ දෙන්න සියලු පාර්ශව සූදානම්	https://www.lankadeepa.lk/latest_news/ආපදවට-මහණ-දනන-සයල-පරශව-සදනම/1-685189	si	lankadeepalk	1765552151.0
lk_news	2025-12-12-virakesarilk-ddd135ba	virakesarilk-ddd135ba	2025-12-12	சகல மதுபான அனுமதிப்பத்திரங்களுக்கான கட்டணம் அதிகரிப்பு மதுபானங்களின் விலை அதிகரிக்கும் சாத்தியம்	https://www.virakesari.lk/article/233221	ta	virakesarilk	1765551540.0
lk_news	2025-12-12-virakesarilk-9a0c02f0	virakesarilk-9a0c02f0	2025-12-12	நாட்டின் மொத்த நிலப்பரப்பில் 30 சதவீத்தைக் கொண்டுள்ள 14 மாவட்டங்கள் மண்சரிவு அபாயம் மிக்கவையாக இனங்காணப்பட்டுள்ளன - தேசிய கட்டட ஆராய்ச்சி நிறுவனம்	https://www.virakesari.lk/article/233220	ta	virakesarilk	1765551360.0
lk_news	2025-12-12-virakesarilk-0105d57e	virakesarilk-0105d57e	2025-12-12	இலங்கை மனித உரிமைகள் ஆணைக்குழுவின் தலையீட்டால்  பாதிக்கப்பட்ட 18 வீடுகளுக்கு சீபாரிசு	https://www.virakesari.lk/article/233219	ta	virakesarilk	1765551000.0
lk_news	2025-12-12-lankadeepalk-063ebd83	lankadeepalk-063ebd83	2025-12-12	විජයදාසට ශ්‍රීලනිප තනතුරු 4ක්	https://www.lankadeepa.lk/latest_news/වජයදසට-ශරලනප-තනතර-4ක/1-685188	si	lankadeepalk	1765550750.0
lk_news	2025-12-12-lankadeepalk-1c706896	lankadeepalk-1c706896	2025-12-12	සරසවි ඉඩමක් සංචාරක වැඩකට	https://www.lankadeepa.lk/news/සරසව-ඉඩමක-සචරක-වඩකට/101-685187	si	lankadeepalk	1765550213.0
lk_news	2025-12-12-virakesarilk-cf5fdac8	virakesarilk-cf5fdac8	2025-12-12	நிவாரணப் பொருட்களுடன் திருகோணமலையில் தரையிறங்கிய அமெரிக்க விமானம் !	https://www.virakesari.lk/article/233218	ta	virakesarilk	1765550160.0
lk_news	2025-12-12-adalk-21cf0a8f	adalk-21cf0a8f	2025-12-12	ඉදිරියට එන ජලය රඳවා ගන්න ඉඩක් තියෙනවා	https://www.ada.lk/breaking_news/ඉදිරියට-එන-ජලය-රඳවා-ගන්න-ඉඩක්-තියෙනවා/11-420212	si	adalk	1765549082.0
lk_news	2025-12-12-virakesarilk-a54f1621	virakesarilk-a54f1621	2025-12-12	வெளிநாடுகளுடனான சீன மக்கள் நட்புறவுச்சங்கம் இலங்கைக்கு 580,000 ஆர்.எம்.பி நிதியுதவி	https://www.virakesari.lk/article/233217	ta	virakesarilk	1765548660.0
lk_news	2025-12-12-virakesarilk-8c5c8691	virakesarilk-8c5c8691	2025-12-12	நோர்வே 2 மில்லியன் டொலர்கள் நிதியுதவி சர்வதேச அபிவிருத்தி அமைச்சர் தெரிவிப்பு	https://www.virakesari.lk/article/233216	ta	virakesarilk	1765548060.0
lk_news	2025-12-12-tamilmirrorlk-5cb8cbc6	tamilmirrorlk-5cb8cbc6	2025-12-12	அசோக ரன்வல பிணையில் விடுவிப்பு	https://www.tamilmirror.lk/செய்திகள்/அசோக-ரன்வல-பிணையில்-விடுவிப்பு/175-369456	ta	tamilmirrorlk	1765547439.0
lk_news	2025-12-12-lankadeepalk-1e3f4a70	lankadeepalk-1e3f4a70	2025-12-12	එක්ලක්ෂ හැත්තපන්දාහකට බොන්න වතුර දෙන වැඩක් අරඹයි	https://www.lankadeepa.lk/latest_news/එකලකෂ-හතතපනදහකට-බනන-වතර-දන-වඩක-අරඹය/1-685186	si	lankadeepalk	1765546202.0
lk_news	2025-12-12-lankadeepalk-890cd4bb	lankadeepalk-890cd4bb	2025-12-12	මාලදිවයින එක්ක ක්‍රීඩා සහයෝගීතා ගිවිසුමක්	https://www.lankadeepa.lk/latest_news/මලදවයන-එකක-කරඩ-සහයගත-ගවසමක/1-685185	si	lankadeepalk	1765545962.0
lk_news	2025-12-12-virakesarilk-f5d2935a	virakesarilk-f5d2935a	2025-12-12	‘Rebuilding Sri Lanka’ நிதியத்திற்கு Colombo West International Terminal (Private) Limited நிதி நன்கொடை	https://www.virakesari.lk/article/233202	ta	virakesarilk	1765543620.0
lk_news	2025-12-12-virakesarilk-f3b6ccaf	virakesarilk-f3b6ccaf	2025-12-12	மண்முனைப் பற்று பிரதேச சபையின் 2026 ஆண்டுக்கான வரவு - செலவுத் திட்டம் நிறைவேற்றம்	https://www.virakesari.lk/article/233201	ta	virakesarilk	1765543620.0
lk_news	2025-12-12-virakesarilk-650b215f	virakesarilk-650b215f	2025-12-12	நடிகர் தனுஷ் வெளியிட்ட விக்ரம் பிரபு நடிக்கும் 'சிறை' படத்தின் முன்னோட்டம்	https://www.virakesari.lk/article/233212	ta	virakesarilk	1765543440.0
lk_news	2025-12-12-virakesarilk-afbb6a43	virakesarilk-afbb6a43	2025-12-12	நடிகர் ஆர்யா நடிக்கும்'ஆர்யா 40' படத் தொடக்க விழா	https://www.virakesari.lk/article/233211	ta	virakesarilk	1765543320.0
lk_news	2025-12-12-virakesarilk-d8727414	virakesarilk-d8727414	2025-12-12	பின்னணி குரல் பதிவு பணியில் பரபரப்பாக இயங்கி வரும் ரவி மோகனின் 'கராத்தே பாபு' படக் குழு	https://www.virakesari.lk/article/233210	ta	virakesarilk	1765543200.0
lk_news	2025-12-12-virakesarilk-83c3def4	virakesarilk-83c3def4	2025-12-12	சமூக அவலங்களை தோலுரித்துக் காட்டும் 'ராசாதி ராசா..' எனும் 'மை லார்ட்' பட பாடல்	https://www.virakesari.lk/article/233209	ta	virakesarilk	1765543140.0
lk_news	2025-12-12-lankadeepalk-da2fb368	lankadeepalk-da2fb368	2025-12-12	මත්පැන් බලපත්‍ර ගාස්තු ඉහළට	https://www.lankadeepa.lk/news/මතපන-බලපතර-ගසත-ඉහළට/101-685184	si	lankadeepalk	1765542315.0
lk_news	2025-12-12-adalk-7e4ac894	adalk-7e4ac894	2025-12-12	ලංකාවේ සමස්ත භූමියෙන් සියයට 30ක් නාය යෑමේ අවධානමක	https://www.ada.lk/breaking_news/ලංකාවේ-සමස්ත-භූමියෙන්-සියයට-30ක්-නාය-යෑමේ-අවධානමක/11-420211	si	adalk	1765542315.0
lk_news	2025-12-12-lankadeepalk-e70baf8f	lankadeepalk-e70baf8f	2025-12-12	බෙලිඅත්ත ප්‍රාදේශීය සභාවේ හිටපු සභාපති රිමාන්ඩ්	https://www.lankadeepa.lk/news/බලඅතත-පරදශය-සභව-හටප-සභපත-රමනඩ/101-685183	si	lankadeepalk	1765541662.0
lk_news	2025-12-12-lankadeepalk-d418b023	lankadeepalk-d418b023	2025-12-12	බෙලිඅත්ත හිටපු සභාපති මාස 12ට කෝටි හතරක් වියදම් කරලා	https://www.lankadeepa.lk/news/බලඅතත-හටප-සභපත-මස-12ට-කට-හතරක-වයදම-කරල/101-685183	si	lankadeepalk	1765541662.0
lk_news	2025-12-12-virakesarilk-704716ff	virakesarilk-704716ff	2025-12-12	மன்னார் மாவட்டத்தில் பாதிக்கப்பட்ட கால்நடைகளுக்கான விசேட நடமாடும் கால்நடை வைத்திய நடவடிக்கை	https://www.virakesari.lk/article/233200	ta	virakesarilk	1765540980.0
lk_news	2025-12-12-adalk-6a3da828	adalk-6a3da828	2025-12-12	දිත්වා නිසා විදුලි පාරිභෝගිකයන් මිලියන 7න් 4කට බලපෑම් වුණා	https://www.ada.lk/breaking_news/දිත්වා-නිසා-විදුලි-පාරිභෝගිකයන්-මිලියන-7න්-4කට-බලපෑම්-වුණා/11-420210	si	adalk	1765540331.0
lk_news	2025-12-12-virakesarilk-fb8e03d7	virakesarilk-fb8e03d7	2025-12-12	மியன்மாரில் வைத்தியசாலை மீது தாக்குதல் ; 34 பேர் உயிரிழப்பு!	https://www.virakesari.lk/article/233199	ta	virakesarilk	1765539960.0
lk_news	2025-12-12-virakesarilk-4e1abb6f	virakesarilk-4e1abb6f	2025-12-12	மலையகத்துக்குள்ளேயே அவர்களின் வாழ்வியலை உறுதிபடுத்த வடக்கு கிழக்கு மலையகமாக ஒன்றுபடுவோம் - அருட்தந்தை சத்திவேல்	https://www.virakesari.lk/article/233198	ta	virakesarilk	1765539900.0
lk_news	2025-12-12-adalk-fe3c1508	adalk-fe3c1508	2025-12-12	කළාවැවේ ධාරිතාව අක්කර අඩි 85364ක් දක්වා ඉහළට	https://www.ada.lk/breaking_news/කළාවැවේ-ධාරිතාව-අක්කර-අඩි-85364ක්-දක්වා-ඉහළට/11-420209	si	adalk	1765538906.0
lk_news	2025-12-12-virakesarilk-1ff49a2f	virakesarilk-1ff49a2f	2025-12-12	குச்சவெளியில் பெண்ணின் சடலம் மீட்பு!	https://www.virakesari.lk/article/233197	ta	virakesarilk	1765538700.0
lk_news	2025-12-12-virakesarilk-e19c6762	virakesarilk-e19c6762	2025-12-12	அமுல்படுத்தப்பட்டுள்ள அவசர கால சட்டத்தில் தேவையற்ற விதிமுறைகளை உள்ளடக்கியதேன்? - ஜனாதிபதி சட்டத்தரணி சாலிய பீரிஸ் கேள்வி	https://www.virakesari.lk/article/233196	ta	virakesarilk	1765538580.0
lk_news	2025-12-12-virakesarilk-261dbf94	virakesarilk-261dbf94	2025-12-12	விடுக்கப்படும் எச்சரிக்கைகளுக்கமைய செயற்பட்டால் உயிரிழப்புக்களை தவிர்க்கலாம் - அனர்த்த முகாமைத்துவ மத்திய நிலைய பணிப்பாளர் பிரதீப் கொடிப்பிலி	https://www.virakesari.lk/article/233194	ta	virakesarilk	1765538520.0
lk_news	2025-12-12-lankadeepalk-743519a2	lankadeepalk-743519a2	2025-12-12	ලංකාවට ආධාර කන්දක් ලැබුණු හේතුව ටිල්වින් පහදයි	https://www.lankadeepa.lk/news/ලකවට-ආධර-කනදක-ලබණ-හතව-ටලවන-පහදය/101-685182	si	lankadeepalk	1765538463.0
lk_news	2025-12-12-virakesarilk-345438ce	virakesarilk-345438ce	2025-12-12	மன்னாரிற்கு விஜயம் செய்யும் ஜனாதிபதி  வடக்கு மீனவர்கள் முகம் கொடுக்கும் பிரச்சினைக்கும் துரித நடவடிக்கைகளை மேற்கொள்ள வேண்டும் - என்.எம்.ஆலாம்  கோரிக்கை	https://www.virakesari.lk/article/233193	ta	virakesarilk	1765538460.0
lk_news	2025-12-12-virakesarilk-68d38d8a	virakesarilk-68d38d8a	2025-12-12	பிரதி சபாநாயகர் ரிஸ்வி சாலியை சந்தித்தார் பாகிஸ்தானின் கடல்சார் அலுவல்களுக்கான பெடரல் அமைச்சர்	https://www.virakesari.lk/article/233192	ta	virakesarilk	1765538220.0
lk_news	2025-12-12-adalk-03129a1b	adalk-03129a1b	2025-12-12	කෑගල්ල ම. න. ස. අයවැය සම්මතයි	https://www.ada.lk/breaking_news/කෑගල්ල-ම--න--ස--අයවැය-සම්මතයි/11-420207	si	adalk	1765538207.0
lk_news	2025-12-12-virakesarilk-0dd46220	virakesarilk-0dd46220	2025-12-12	ஜப்பான் பேரிடர் நிவாரண மருத்துவக் குழுவின் சிலாபம் கள வைத்தியசாலையை பார்வையிட்டார் அமைச்சர் நளிந்த ஜயதிஸ்ஸ!	https://www.virakesari.lk/article/233195	ta	virakesarilk	1765538100.0
lk_news	2025-12-12-adalk-bd52992b	adalk-bd52992b	2025-12-12	අශෝක රන්වල අත්අඩංගුවට - රන්වල සාමාන්‍ය පුරවැසියෙකු සේ සලකා නීතිය ක්‍රියාත්මක කරන්න	https://www.ada.lk/breaking_news/අශෝක-රන්වල-අත්අඩංගුවට---රන්වල-සාමාන්‍ය-පුරවැසියෙකු-සේ-සලකා-නීතිය-ක්‍රියාත්මක-කරන්න/11-420206	si	adalk	1765537991.0
lk_news	2025-12-12-lankadeepalk-cd71ee44	lankadeepalk-cd71ee44	2025-12-12	’’අභියෝග වලට ඔරොත්තු දෙන ලාංකික ජාතියක් ගොඩ නගනවා’’	https://www.lankadeepa.lk/latest_news/අභයග-වලට-ඔරතත-දන-ලකක-ජතයක-ගඩ-නගනව/1-685181	si	lankadeepalk	1765537719.0
lk_news	2025-12-12-tamilmirrorlk-6213764d	tamilmirrorlk-6213764d	2025-12-12	காணாமல் போன 193 பேருக்கு இறப்புப் பதிவுச் சான்றிதழ்	https://www.tamilmirror.lk/செய்திகள்/காணாமல்-போன-193-பேருக்கு-இறப்புப்-பதிவுச்-சான்றிதழ்/175-369455	ta	tamilmirrorlk	1765536885.0
lk_news	2025-12-12-lankadeepalk-acc390b6	lankadeepalk-acc390b6	2025-12-12	පුත්තලමේ ඉඩමකින් ගිනිඅවියක් හමුවෙයි	https://www.lankadeepa.lk/latest_news/පතතලම-ඉඩමකන-ගනඅවයක-හමවය/1-685180	si	lankadeepalk	1765536775.0
lk_news	2025-12-12-tamilmirrorlk-a1ea6e19	tamilmirrorlk-a1ea6e19	2025-12-12	25,000 ரூபாய் நிவாரணம் கிடைக்கவில்லை : மாணவன் முறைப்பாடு	https://www.tamilmirror.lk/செய்திகள்/25-000-ரூபாய்-நிவாரணம்-கிடைக்கவில்லை-மாணவன்-முறைப்பாடு/175-369454	ta	tamilmirrorlk	1765535472.0
lk_news	2025-12-12-virakesarilk-798e06a9	virakesarilk-798e06a9	2025-12-12	யாழ். மாவட்டசெயலாளரை சந்தித்தார்  துரைராசா ரவிகரன்	https://www.virakesari.lk/article/233184	ta	virakesarilk	1765535340.0
lk_news	2025-12-12-virakesarilk-f4028256	virakesarilk-f4028256	2025-12-12	சாரதியிடம் இலஞ்சம் பெற்ற இரு பொலிஸ் உத்தியோகத்தர்கள் கைது	https://www.virakesari.lk/article/233191	ta	virakesarilk	1765534980.0
lk_news	2025-12-12-virakesarilk-c3674fb8	virakesarilk-c3674fb8	2025-12-12	இந்திய மீனவர்களின் அத்துமீறிய மீன்பிடிக்கு எதிராக யாழ். மாவட்ட செயலகத்தை முற்றுகையிட்டு போராட்டம்	https://www.virakesari.lk/article/233179	ta	virakesarilk	1765534980.0
lk_news	2025-12-12-virakesarilk-d6ad32aa	virakesarilk-d6ad32aa	2025-12-12	பல்கலைக்கழகங்கள் சட்டத்தில் ஜனநாயகமற்ற  மாற்றங்களை ஏற்படுத்த முயலும் அரசாங்கம்  - எதிர்க்கட்சி தலைவர் குற்றச்சாட்டு	https://www.virakesari.lk/article/233187	ta	virakesarilk	1765534740.0
lk_news	2025-12-12-virakesarilk-7badc166	virakesarilk-7badc166	2025-12-12	நீர் நிலைகளின் நீரை  முறையாக முகாமைத்துவம் செய்திருந்தால் அனர்த்தத்தின் பாதிப்பை குறைத்துக்கொள்ள முடியுமாகி இருந்திருக்கும் - வஜிர அபேவர்த்தன	https://www.virakesari.lk/article/233190	ta	virakesarilk	1765534740.0
lk_news	2025-12-12-virakesarilk-962fb75c	virakesarilk-962fb75c	2025-12-12	அனர்த்தத்தால் பொதுமக்கள் நெருக்கடிக்குள்ளாகியுள்ளதை காட்டிலும் எதிர்க்கட்சியினர் நெருக்கடிக்குள்ளாகியுள்ளார்கள் - பிமல் ரத்நாயக்க	https://www.virakesari.lk/article/233186	ta	virakesarilk	1765534680.0
lk_news	2025-12-12-virakesarilk-18837716	virakesarilk-18837716	2025-12-12	வடகீழ் பருவப் பெயர்ச்சி காலநிலை : துறை சார்ந்தோருடன் கலந்துரையாடி முன்னாயத்த நடவடிக்கைகள் முன்னெடுக்கப்பட்டுள்ளன - அனர்த்த முகாமைத்துவ மத்திய நிலைய பணிப்பாளர் நாயகம்	https://www.virakesari.lk/article/233189	ta	virakesarilk	1765534560.0
lk_news	2025-12-12-virakesarilk-c2c5dcd5	virakesarilk-c2c5dcd5	2025-12-12	பொதுத் தகவல் தொழில்நுட்பப் பரீட்சை ஜனவரியில் இடம்பெறும் - பரீட்சை திணைக்களம் அறிவிப்பு	https://www.virakesari.lk/article/233188	ta	virakesarilk	1765534440.0
lk_news	2025-12-12-adalk-4a6d942d	adalk-4a6d942d	2025-12-12	කුකුළු ලොරිය ගවයෙකුගේ ගැටී කුකුළන් 650ක්  හා ගවයා මිය යයි	https://www.ada.lk/breaking_news/කුකුළු-ලොරිය-ගවයෙකුගේ-ගැටී-කුකුළන්-650ක්--හා-ගවයා-මිය-යයි/11-420205	si	adalk	1765534346.0
