doc_type	doc_id	num	date_str	description	url_metadata	lang	newspaper_id	time_ut
lk_news	2025-10-29-lankadeepalk-01980043	lankadeepalk-01980043	2025-10-29	ඩඩ්ලි, ආණ්ඩුවේ හොඳ නරක දෙකම දකී	https://www.lankadeepa.lk/news/ඩඩල-ආණඩව-හඳ-නරක-දකම-දක/101-682326	si	lankadeepalk	1761737449.0
lk_news	2025-10-29-virakesarilk-c0cae45f	virakesarilk-c0cae45f	2025-10-29	சிறை செல்வதற்கு நானும் தயாராகவுள்ளேன் ; உதய கம்மன்பில	https://www.virakesari.lk/article/228987	ta	virakesarilk	1761737220.0
lk_news	2025-10-29-virakesarilk-cc018360	virakesarilk-cc018360	2025-10-29	அரச - தனியார் பேருந்து சேவையின் எதிர்காலம் குறித்து யாழ்ப்பாண பாராளுமன்ற உறுப்பினர்கள்கூட்டாக கள ஆய்வு!	https://www.virakesari.lk/article/228986	ta	virakesarilk	1761737160.0
lk_news	2025-10-29-lankadeepalk-4b9f067f	lankadeepalk-4b9f067f	2025-10-29	බෝවතැන්න ජලාශය ගොඩවීමේ අවදානමක?	https://www.lankadeepa.lk/news/බවතනන-ජලශය-ගඩවම-අවදනමක/101-682325	si	lankadeepalk	1761736989.0
lk_news	2025-10-29-virakesarilk-f8307287	virakesarilk-f8307287	2025-10-29	போதைப்பொருள் எதிர்ப்பு தேசிய நடவடிக்கை – ஜனாதிபதி தலைமையில் நாளை ஆரம்பம்	https://www.virakesari.lk/article/228985	ta	virakesarilk	1761736740.0
lk_news	2025-10-29-lankadeepalk-e21285cf	lankadeepalk-e21285cf	2025-10-29	නුගේගොඩ රැලියට සජබෙ කවුරු හරි යනවා	https://www.lankadeepa.lk/news/නගගඩ-රලයට-සජබ-කවර-හර-යනව/101-682324	si	lankadeepalk	1761736661.0
lk_news	2025-10-29-lankadeepalk-fa4a8009	lankadeepalk-fa4a8009	2025-10-29	පාසල් කාලය සවස 2තෙක් දීර්ඝ කරන චක්‍රලේඛය අද හෙටම	https://www.lankadeepa.lk/latest_news/පසල-කලය-සවස-2තක-දරඝ-කරන-චකරලඛය-අද-හටම/1-682323	si	lankadeepalk	1761736092.0
lk_news	2025-10-29-virakesarilk-1a4c84ce	virakesarilk-1a4c84ce	2025-10-29	தந்தையும் மகளும் பயணித்த மோட்டார் சைக்கிள் மீது காட்டு யானை தாக்குதல்!	https://www.virakesari.lk/article/228992	ta	virakesarilk	1761735960.0
lk_news	2025-10-29-lankadeepalk-16220919	lankadeepalk-16220919	2025-10-29	රනිල්ගේ නඩුවට දින දෙයි	https://www.lankadeepa.lk/latest_news/රනලග-නඩවට-දන-දය/1-682322	si	lankadeepalk	1761735788.0
lk_news	2025-10-29-tamilmirrorlk-1fb8aca3	tamilmirrorlk-1fb8aca3	2025-10-29	JMSDF AKEBONO’’ கப்பலுக்கான விஜயத்தின் போது இருதரப்பு ஒத்துழைப்பு	https://www.tamilmirror.lk/செய்திகள்/JMSDF-AKEBONO-கப்பலுக்கான-விஜயத்தின்-போது-இருதரப்பு-ஒத்துழைப்பு/175-367059	ta	tamilmirrorlk	1761735670.0
lk_news	2025-10-29-lankadeepalk-f5647f53	lankadeepalk-f5647f53	2025-10-29	මැතිසබේ කෘෂි කමිටුවට චීනයෙන් පාඩමක්	https://www.lankadeepa.lk/latest_news/මතසබ-කෂ-කමටවට-චනයන-පඩමක/1-682320	si	lankadeepalk	1761734934.0
lk_news	2025-10-29-virakesarilk-56198adc	virakesarilk-56198adc	2025-10-29	விற்பனை நிலையத்துக்குள் அத்துமீறி நுழைந்து பணம் கொள்ளை!	https://www.virakesari.lk/article/228984	ta	virakesarilk	1761734700.0
lk_news	2025-10-29-virakesarilk-60589d54	virakesarilk-60589d54	2025-10-29	நீதிமன்ற வளாகத்தில் துப்பாக்கி ; பொலிஸார் விசாரணை!	https://www.virakesari.lk/article/228990	ta	virakesarilk	1761734640.0
lk_news	2025-10-29-virakesarilk-4f7ddcd4	virakesarilk-4f7ddcd4	2025-10-29	ரணிலுக்கு எதிரான வழக்கு மீதான விசாரணை ஒத்திவைப்பு!	https://www.virakesari.lk/article/228989	ta	virakesarilk	1761734280.0
lk_news	2025-10-29-adalk-613ba5c0	adalk-613ba5c0	2025-10-29	යුධ සමයේදී ත්‍රිවිධ හමුදාව භාවිත කරන ඉඩම් නිදහස් කිරීම පිළිබඳ විශේෂ සාකච්ඡාවක්	https://www.ada.lk/breaking_news/යුධ-සමයේදී-ත්‍රිවිධ-හමුදාව-භාවිත-කරන-ඉඩම්-නිදහස්-කිරීම-පිළිබඳ-විශේෂ-සාකච්ඡාවක්/11-419395	si	adalk	1761734123.0
lk_news	2025-10-29-lankadeepalk-dff3e0a7	lankadeepalk-dff3e0a7	2025-10-29	ගොවියා රකින්න ආ ආණ්ඩුව දැන් ලොකු ලූනු මනිනවා	https://www.lankadeepa.lk/latest_news/ගවය-රකනන-ආ-ආණඩව-දන-ලක-ලන-මනනව/1-682318	si	lankadeepalk	1761733981.0
lk_news	2025-10-29-tamilmirrorlk-8452e1cb	tamilmirrorlk-8452e1cb	2025-10-29	தேசிய மக்கள் சக்தி எம்.பிக்கு  பிடியாணை	https://www.tamilmirror.lk/செய்திகள்/தேசிய-மக்கள்-சக்தி-எம்-பிக்கு-பிடியாணை/175-367058	ta	tamilmirrorlk	1761733908.0
lk_news	2025-10-29-adalk-fe18c81b	adalk-fe18c81b	2025-10-29	ජනමාධයේ කියුම් කෙරුම් ජනපති මැන බලයි	https://www.ada.lk/breaking_news/ජනමාධයේ-කියුම්-කෙරුම්-ජනපති-මැන-බලයි/11-419394	si	adalk	1761733150.0
lk_news	2025-10-29-tamilmirrorlk-749af230	tamilmirrorlk-749af230	2025-10-29	ரணிலுக்கு எதிரான வழக்கு ஒத்திவைப்பு	https://www.tamilmirror.lk/செய்திகள்/ரணிலுக்கு-எதிரான-வழக்கு-ஒத்திவைப்பு/175-367057	ta	tamilmirrorlk	1761732874.0
lk_news	2025-10-29-tamilmirrorlk-2718697a	tamilmirrorlk-2718697a	2025-10-29	’’நாளையிலிருந்து முழு நாடுமே ஒன்றாக’’	https://www.tamilmirror.lk/செய்திகள்/நாளையிலிருந்து-முழு-நாடுமே-ஒன்றாக/175-367056	ta	tamilmirrorlk	1761732817.0
lk_news	2025-10-29-lankadeepalk-468cdbe1	lankadeepalk-468cdbe1	2025-10-29	සැකකරුවෙක් අත්විලංගු සමග රෝහලින් පැන යයි	https://www.lankadeepa.lk/latest_news/සකකරවක-අතවලග-සමග-රහලන-පන-යය/1-682317	si	lankadeepalk	1761732803.0
lk_news	2025-10-29-adalk-21bb2c50	adalk-21bb2c50	2025-10-29	විපක්ෂයේ රැළිය සාර්ථක වේවා	https://www.ada.lk/breaking_news/විපක්ෂයේ-රැළිය-සාර්ථක-වේවා/11-419393	si	adalk	1761732632.0
lk_news	2025-10-29-lankadeepalk-45e9260d	lankadeepalk-45e9260d	2025-10-29	විෂ මත මඩින්න හෙට ’’රටම එකට’’ එක්වෙයි	https://www.lankadeepa.lk/news/වෂ-මත-මඩනන-හට-රටම-එකට-එකවය/101-682316	si	lankadeepalk	1761732430.0
lk_news	2025-10-29-virakesarilk-5b622225	virakesarilk-5b622225	2025-10-29	கடந்தகால சிக்கல்களை ஆராயாமல் விடுவது நெருக்கடியை கொண்டுவரும் ; பயங்கரவாத தடைச்சட்டம் சர்வதேசத் தரநிலைகளைப் பூர்த்தி செய்யவில்லை என்கிறார் ஜேர்மன் தூதுவர் பீலிக்ஸ் நியுமான்	https://www.virakesari.lk/article/228983	ta	virakesarilk	1761732180.0
lk_news	2025-10-29-virakesarilk-fe0939bf	virakesarilk-fe0939bf	2025-10-29	இலங்கையில் முதலீடு செய்வதில் பல தடைகள் நிலத்தை பெறுவது பெரும்பாடு என்கிறார் ஜேர்மன் தூதுவர் பீலிக்ஸ் நியுமான்	https://www.virakesari.lk/article/228982	ta	virakesarilk	1761731880.0
lk_news	2025-10-29-tamilmirrorlk-cab1dfee	tamilmirrorlk-cab1dfee	2025-10-29	ரணிலின் மனைவியும் நீதிமன்றுக்கு வந்தார்	https://www.tamilmirror.lk/செய்திகள்/ரணிலின்-மனைவியும்-நீதிமன்றுக்கு-வந்தார்/175-367053	ta	tamilmirrorlk	1761731636.0
lk_news	2025-10-29-virakesarilk-b34013fe	virakesarilk-b34013fe	2025-10-29	ஐஸ் போதைப்பொருள் விற்பனையில் ஈடுபட்ட தம்பதி கைது!	https://www.virakesari.lk/article/228979	ta	virakesarilk	1761731340.0
lk_news	2025-10-29-tamilmirrorlk-97b2e065	tamilmirrorlk-97b2e065	2025-10-29	செட்டிகுளத்தில் குண்டுகள் ; கட்டுநாயகவில் மூவர் கைது	https://www.tamilmirror.lk/செய்திகள்/செட்டிகுளத்தில்-குண்டுகள்-கட்டுநாயகவில்-மூவர்-கைது/175-367052	ta	tamilmirrorlk	1761731294.0
lk_news	2025-10-29-virakesarilk-7145d1f0	virakesarilk-7145d1f0	2025-10-29	மன்னாரில் உணவகம், வெதுப்பகம், வர்த்தக நிலையத்திற்கு சீல்	https://www.virakesari.lk/article/228978	ta	virakesarilk	1761731220.0
lk_news	2025-10-29-virakesarilk-5d9afbc9	virakesarilk-5d9afbc9	2025-10-29	சட்டவிரோத கடத்தல் மற்றும் குற்றச் செயல்களில் பாக்கிஸ்தானின் போக்கும் அமெரிக்கத் தீர்ப்பின் பின்னணியும்	https://www.virakesari.lk/article/228976	ta	virakesarilk	1761731220.0
lk_news	2025-10-29-adalk-2a3230e2	adalk-2a3230e2	2025-10-29	රනිල්ට එරෙහි නඩුව ජනවාරි 28ට කල් යයි	https://www.ada.lk/breaking_news/රනිල්ට-එරෙහි-නඩුව-ජනවාරි-28ට-කල්-යයි/11-419392	si	adalk	1761730986.0
lk_news	2025-10-29-tamilmirrorlk-ef01c29d	tamilmirrorlk-ef01c29d	2025-10-29	ரூ.150 மில்லியன் மோசடி: பெண்ணுக்கு வலை	https://www.tamilmirror.lk/செய்திகள்/ரூ-150-மில்லியன்-மோசடி-பெண்ணுக்கு-வலை/175-367050	ta	tamilmirrorlk	1761730261.0
lk_news	2025-10-29-adalk-99c840e7	adalk-99c840e7	2025-10-29	සෙට්ටිකුලම බෝම්බ විමර්ශනයේ සැකකරුවන් ටී.අයි.ඩී. භාරයට	https://www.ada.lk/breaking_news/සෙට්ටිකුලම-බෝම්බ-විමර්ශනයේ-සැකකරුවන්-ටී-අයි-ඩී--භාරයට/11-419391	si	adalk	1761730058.0
lk_news	2025-10-29-tamilmirrorlk-7eb73917	tamilmirrorlk-7eb73917	2025-10-29	மன்னாரில் மூன்று  சீல்	https://www.tamilmirror.lk/செய்திகள்/மன்னாரில்-மூன்று-சீல்/175-367049	ta	tamilmirrorlk	1761729876.0
lk_news	2025-10-29-virakesarilk-52eb5814	virakesarilk-52eb5814	2025-10-29	சந்தேக நபரை கைதுசெய்ய பொதுமக்களிடம் உதவி கோரல்!	https://www.virakesari.lk/article/228975	ta	virakesarilk	1761729600.0
lk_news	2025-10-29-adalk-d880b038	adalk-d880b038	2025-10-29	සැකකරියක් අල්ලන්න පොලීසිය මහජන සහාය ඉල්ලයි	https://www.ada.lk/breaking_news/සැකකරියක්-අල්ලන්න-පොලීසිය-මහජන-සහාය-ඉල්ලයි/11-419390	si	adalk	1761729238.0
lk_news	2025-10-29-tamilmirrorlk-a9f5a2dc	tamilmirrorlk-a9f5a2dc	2025-10-29	பெண்களின் நிர்வாண படங்கள் வைத்திருந்ததால் காதலனை  கொன்ற காதலி	https://www.tamilmirror.lk/செய்திகள்/பெண்களின்-நிர்வாண-படங்கள்-வைத்திருந்ததால்-காதலனை-கொன்ற-காதலி/175-367048	ta	tamilmirrorlk	1761729125.0
lk_news	2025-10-29-tamilmirrorlk-9dcb5af7	tamilmirrorlk-9dcb5af7	2025-10-29	பெண்களின் நிர்வாணம்: காதலனை  கொன்ற காதலி	https://www.tamilmirror.lk/செய்திகள்/பெண்களின்-நிர்வாணம்-காதலனை-கொன்ற-காதலி/175-367048	ta	tamilmirrorlk	1761729125.0
lk_news	2025-10-29-lankadeepalk-72e2f69a	lankadeepalk-72e2f69a	2025-10-29	වයඹ පළාත් සභාව කෝපා කමිටුවට	https://www.lankadeepa.lk/news/වයඹ-පළත-සභව-කප-කමටවට/101-682310	si	lankadeepalk	1761728937.0
lk_news	2025-10-29-virakesarilk-640ef492	virakesarilk-640ef492	2025-10-29	பெருந்தோட்டத் தொழிலாளர்களின் சம்பள விவகாரம் : சட்ட ரீதியாக அரசாங்கத்தால் பணிப்புரை விடுக்க முடியாது ; ஆனால் வாக்குறுதியை நிறைவேற்றுவோம் : அமைச்சர் சமந்த வித்தியாரத்ன	https://www.virakesari.lk/article/228974	ta	virakesarilk	1761728580.0
lk_news	2025-10-29-tamilmirrorlk-f76f4e57	tamilmirrorlk-f76f4e57	2025-10-29	‘அஸ்வெசும’ தொடர்பில் அதிரடியான அறிவிப்பு	https://www.tamilmirror.lk/செய்திகள்/அஸ்வெசும-தொடர்பில்-அதிரடியான-அறிவிப்பு/175-367046	ta	tamilmirrorlk	1761728552.0
lk_news	2025-10-29-virakesarilk-b3cd0ac2	virakesarilk-b3cd0ac2	2025-10-29	நவம்பர் 21 பேரணிக்கு முன் எதிர்க்கட்சிகள் தமது தலைமைத்துவத்தையும் இலக்கையும் தெளிவுபடுத்த வேண்டும் – திலும் அமுனுகம	https://www.virakesari.lk/article/228972	ta	virakesarilk	1761727920.0
lk_news	2025-10-29-virakesarilk-a8d45381	virakesarilk-a8d45381	2025-10-29	போர் விமானத்தில் பறந்தார் இந்திய ஜனாதிபதி திரௌபதி முர்மு	https://www.virakesari.lk/article/228971	ta	virakesarilk	1761727620.0
lk_news	2025-10-29-adalk-59089376	adalk-59089376	2025-10-29	ට්‍රම්ප්ගේ සටන් විරාම ගිවිසුම ඊශ්‍රායෙලය හා හමාස් කඩයි	https://www.ada.lk/international/ට්‍රම්ප්ගේ-සටන්-විරාම-ගිවිසුම-ඊශ්‍රායෙලය-හා-හමාස්-කඩයි/3-419389	si	adalk	1761727591.0
lk_news	2025-10-29-adalk-3873da5f	adalk-3873da5f	2025-10-29	2026දී ලංකාවේ ආර්ථික වර්ධනය 3.1යි	https://www.ada.lk/breaking_news/2026දී-ලංකාවේ-ආර්ථික-වර්ධනය-3-1යි/11-419388	si	adalk	1761726705.0
lk_news	2025-10-29-lankadeepalk-46079374	lankadeepalk-46079374	2025-10-29	අක්ෂි තාක්ෂණවේදීහු 57ක් ඩිප්ලෝමා උපාධි ලබති	https://www.lankadeepa.lk/news/අකෂ-තකෂණවදහ-57ක-ඩපලම-උපධ-ලබත/101-682307	si	lankadeepalk	1761726416.0
lk_news	2025-10-29-lankadeepalk-670ed252	lankadeepalk-670ed252	2025-10-29	වේයන්ගොඩට බහුවිධ භාණ්ඩ ප්‍රවාහන මධ්‍යස්ථානයක්	https://www.lankadeepa.lk/news/වයනගඩට-බහවධ-භණඩ-පරවහන-මධයසථනයක/101-682305	si	lankadeepalk	1761725694.0
lk_news	2025-10-29-lankadeepalk-d33b92e3	lankadeepalk-d33b92e3	2025-10-29	මැතිසබේ වෙනස් කරන රපෝර්තුවට කන්තෝරු නවයේම විරෝධය	https://www.lankadeepa.lk/news/මතසබ-වනස-කරන-රපරතවට-කනතර-නවයම-වරධය/101-682304	si	lankadeepalk	1761725543.0
lk_news	2025-10-29-tamilmirrorlk-a4254815	tamilmirrorlk-a4254815	2025-10-29	தென்கிழக்கு விஞ்ஞான பீட விடுதியில்  தீ	https://www.tamilmirror.lk/செய்திகள்/தென்கிழக்கு-விஞ்ஞான-பீட-விடுதியில்-தீ/175-367044	ta	tamilmirrorlk	1761725396.0
lk_news	2025-10-29-lankadeepalk-b5107c0e	lankadeepalk-b5107c0e	2025-10-29	රනිල් අධිකරණයට එයි	https://www.lankadeepa.lk/news/රනල-අධකරණයට-එය/101-682303	si	lankadeepalk	1761724772.0
lk_news	2025-10-29-tamilmirrorlk-954e205e	tamilmirrorlk-954e205e	2025-10-29	நீதிமன்றில் ரணில் ஆஜர்	https://www.tamilmirror.lk/செய்திகள்/நீதிமன்றில்-ரணில்-ஆஜர்/175-367041	ta	tamilmirrorlk	1761724740.0
lk_news	2025-10-29-adalk-b3bff503	adalk-b3bff503	2025-10-29	ජේම්ස් ඇන්ඩර්සන්ට නයිට් පදවියක්	https://www.ada.lk/sports/ජේම්ස්-ඇන්ඩර්සන්ට-නයිට්-පදවියක්/9-419387	si	adalk	1761724716.0
lk_news	2025-10-29-virakesarilk-8a8ac780	virakesarilk-8a8ac780	2025-10-29	நீதிமன்றில் ஆஜரானார் ரணில் விக்ரமசிங்க!	https://www.virakesari.lk/article/228970	ta	virakesarilk	1761724380.0
lk_news	2025-10-29-lankadeepalk-83ef3de6	lankadeepalk-83ef3de6	2025-10-29	හෝමාගම ප්‍රා.සභාපතිටත් මරණ තර්ජන	https://www.lankadeepa.lk/latest_news/හමගම-පර-සභපතටත-මරණ-තරජන/1-682302	si	lankadeepalk	1761724029.0
lk_news	2025-10-29-virakesarilk-a51b6df1	virakesarilk-a51b6df1	2025-10-29	முகத்தை முழுமையாக மறைக்கும் வகையில் ஆடையணிவது பிரச்சினைகளை ஏற்படுத்தும் - அரசாங்கம் இந்த விடயத்தில் அடிபணிய கூடாது என்கிறார் ஞானசார தேரர்	https://www.virakesari.lk/article/228965	ta	virakesarilk	1761724020.0
lk_news	2025-10-29-virakesarilk-6e9a555b	virakesarilk-6e9a555b	2025-10-29	சடலத்தை அடையாளம் காண  பொதுமக்களிடம் உதவி கோரல்!	https://www.virakesari.lk/article/228968	ta	virakesarilk	1761723960.0
lk_news	2025-10-29-virakesarilk-c257029f	virakesarilk-c257029f	2025-10-29	இலங்கை - ரஷ்ய இராணுவ பயிற்சியின் போது வெடி விபத்து : 3 இராணுவ வீரர்கள் காயம் !	https://www.virakesari.lk/article/228967	ta	virakesarilk	1761723780.0
lk_news	2025-10-29-dailyftlk-414f2626	dailyftlk-414f2626	2025-10-29	Vijitha says audit report on e-Visa key to ongoing court case	https://www.ft.lk/news/Vijitha-says-audit-report-on-e-Visa-key-to-ongoing-court-case/56-783631	en	dailyftlk	1761723508.0
lk_news	2025-10-29-virakesarilk-48d9a9df	virakesarilk-48d9a9df	2025-10-29	நாடளாவிய ரீதியில் விசேட சுற்றிவளைப்பு!	https://www.virakesari.lk/article/228966	ta	virakesarilk	1761723480.0
lk_news	2025-10-29-virakesarilk-b4a3c2d8	virakesarilk-b4a3c2d8	2025-10-29	பத்தாயிரம் கிலோவுக்கு அதிகமான பூசணியை சந்தைப்படுத்த முடியாது அவதிப்படும் விவசாயி	https://www.virakesari.lk/article/228964	ta	virakesarilk	1761723240.0
lk_news	2025-10-29-virakesarilk-c50622eb	virakesarilk-c50622eb	2025-10-29	2025 ஆம் ஆண்டின் மூன்றாவது காலாண்டில் ஆண்டுக்கு ஆண்டு 32% அதிகரிப்புடன் வளர்ச்சிப் பதிவுசெய்துள்ளது ஸ்ரீலங்கா இன்சூரன்ஸ் லைஃப்	https://www.virakesari.lk/article/228961	ta	virakesarilk	1761723060.0
lk_news	2025-10-29-virakesarilk-b0c9e84c	virakesarilk-b0c9e84c	2025-10-29	நுவரெலியாவில் ஆணின் சடலம் மீட்பு!	https://www.virakesari.lk/article/228963	ta	virakesarilk	1761723060.0
lk_news	2025-10-29-virakesarilk-67f72d97	virakesarilk-67f72d97	2025-10-29	மக்கள் வங்கியும் Japan Remit Finance நிறுவனமும் 5 ஆண்டு கால கூட்டாண்மையை வலுப்படுத்தியுள்ளன	https://www.virakesari.lk/article/228958	ta	virakesarilk	1761723000.0
lk_news	2025-10-29-virakesarilk-40891049	virakesarilk-40891049	2025-10-29	முற்றுப்பெறாத நீர்ப்பாசனத் திட்டமும் காட்டுயானை அட்டகாசமும் – தட்டையமலை நிலைமையை பார்வையிட்டார் துரைராசா ரவிகரன்	https://www.virakesari.lk/article/228959	ta	virakesarilk	1761723000.0
lk_news	2025-10-29-virakesarilk-633b32a2	virakesarilk-633b32a2	2025-10-29	பிரேசிலில் போதைப்பொருள் கடத்தல் கும்பலை பிடிக்க சுற்றிவளைப்பு : பொலிஸார் உட்பட 64 பேர் உயிரிழப்பு	https://www.virakesari.lk/article/228960	ta	virakesarilk	1761722820.0
lk_news	2025-10-29-bbccomsinhala-82bd1b5c	bbccomsinhala-82bd1b5c	2025-10-29	හෙද නිල ඇඳුම වෙනස් විය යුතු ද? හෙදියන්ට අවශ්‍ය වෙනස කුමක් ද?	https://www.bbc.com/sinhala/articles/crklzpkgd22o	si	bbccomsinhala	1761722798.0
lk_news	2025-10-29-adalk-084fd4f0	adalk-084fd4f0	2025-10-29	වැව් රක්ෂිතයේ තිබෙන ඉඩමෙන් ඉවත්වීමට සූදානම් බව මාලිමා මන්ත්‍රී කියයි	https://www.ada.lk/breaking_news/වැව්-රක්ෂිතයේ-තිබෙන-ඉඩමෙන්-ඉවත්වීමට-සූදානම්-බව-මාලිමා-මන්ත්‍රී-කියයි/11-419386	si	adalk	1761722732.0
lk_news	2025-10-29-lankadeepalk-8bf620fd	lankadeepalk-8bf620fd	2025-10-29	ලොකු උපාධි ගන්න ගිය දොස්තරලා 68ක් කට්ටි පැනලා	https://www.lankadeepa.lk/news/ලක-උපධ-ගනන-ගය-දසතරල-68ක-කටට-පනල/101-682301	si	lankadeepalk	1761722697.0
lk_news	2025-10-29-virakesarilk-6c8a0ffd	virakesarilk-6c8a0ffd	2025-10-29	நாடு கடத்தப்பட்ட இலங்கையர்கள் மூவர் கட்டுநாயக்கவில் கைது!	https://www.virakesari.lk/article/228962	ta	virakesarilk	1761722580.0
lk_news	2025-10-29-adalk-0b4695cd	adalk-0b4695cd	2025-10-29	ලංකාවේ තේ, කෝපි සහ දුම්කොළ වගාව සංවර්ධනයට චීන දූත පිරිසක් සමඟ සාකච්ඡා	https://www.ada.lk/breaking_news/ලංකාවේ-තේ--කෝපි-සහ-දුම්කොළ-වගාව-සංවර්ධනයට-චීන-දූත-පිරිසක්-සමඟ-සාකච්ඡා/11-419385	si	adalk	1761722089.0
lk_news	2025-10-29-adalk-7d938886	adalk-7d938886	2025-10-29	වයඹ පළාත් සභාව කෝපා කමිටුවට කැඳවයි	https://www.ada.lk/breaking_news/වයඹ-පළාත්-සභාව-කෝපා-කමිටුවට-කැඳවයි/11-419384	si	adalk	1761721466.0
