doc_type	doc_id	num	date_str	description	url_metadata	lang	newspaper_id	time_ut
lk_news	2025-11-20-virakesarilk-ae44dda9	virakesarilk-ae44dda9	2025-11-20	நோர்வோயில் இருந்து யாழ். வந்தவருக்கு எமனான கிணறு!	https://www.virakesari.lk/article/230959	ta	virakesarilk	1763657160.0
lk_news	2025-11-20-virakesarilk-98c2313d	virakesarilk-98c2313d	2025-11-20	எரிபொருள்–மின்சார மாபியாவின் அடிமையாக அரசு மாறியுள்ளது – சஜித் பிரேமதாச குற்றச்சாட்டு	https://www.virakesari.lk/article/230958	ta	virakesarilk	1763656440.0
lk_news	2025-11-20-adalk-cbb2698a	adalk-cbb2698a	2025-11-20	සතියක් තුළ ඊශ්‍රායේලයේදි දෙවැනි ශ්‍රී ලාංකික මරණයත් වාර්තා වෙයි	https://www.ada.lk/breaking_news/සතියක්-තුළ-ඊශ්‍රායේලයේදි-දෙවැනි-ශ්‍රී-ලාංකික-මරණයත්-වාර්තා-වෙයි/11-419789	si	adalk	1763653841.0
lk_news	2025-11-20-virakesarilk-568a53db	virakesarilk-568a53db	2025-11-20	மூன்று வருடங்களுக்கு பின்னர் புதுப்பொழிவுடன் புத்துயிர் பெறுகிறது பிரதான கழகங்கள் கால்பந்தாட்டம்; சம்பியன்ஸ் லீக் நாளை ஆரம்பம்	https://www.virakesari.lk/article/230957	ta	virakesarilk	1763652900.0
lk_news	2025-11-20-adalk-0f8fcfef	adalk-0f8fcfef	2025-11-20	ඩුබායි සිට බ්‍රිස්බේන් යන්න ගිය ගුවන් යානය හදිසියේ කටුනායකට ගොඩබායි	https://www.ada.lk/breaking_news/ඩුබායි-සිට-බ්‍රිස්බේන්-යන්න-ගිය-ගුවන්-යානය-හදිසියේ-කටුනායකට-ගොඩබායි/11-419788	si	adalk	1763651652.0
lk_news	2025-11-20-lankadeepalk-82de4011	lankadeepalk-82de4011	2025-11-20	කවුඩුල්ලේ සංචාරක වංචාවට දෙකක් ගෙදර යවයි	https://www.lankadeepa.lk/news/කවඩලල-සචරක-වචවට-දකක-ගදර-යවය/101-683554	si	lankadeepalk	1763648289.0
lk_news	2025-11-20-lankadeepalk-1676c81e	lankadeepalk-1676c81e	2025-11-20	රේගුවේ ඉලක්කය සපුරයි	https://www.lankadeepa.lk/news/රගව-ඉලකකය-සපරය/101-683553	si	lankadeepalk	1763647836.0
lk_news	2025-11-20-virakesarilk-c0c2b384	virakesarilk-c0c2b384	2025-11-20	புத்தர் சிலை விவகாரம் முடிந்துவிட்டதாக ஜனாதிபதி சொல்கிறார் ; சிலை அங்கேயே இருக்கிறது ; இது முடிந்த சம்பவமா? - சாணக்கியன்	https://www.virakesari.lk/article/230956	ta	virakesarilk	1763647620.0
lk_news	2025-11-20-virakesarilk-a56f8580	virakesarilk-a56f8580	2025-11-20	கண்ணுக்குத் தெரியாமலும் மதிப்பிடப்படாமலும் : இலங்கையின் சிறு மற்றும் நடுத்தர தொழில்கள் தொடர்ந்து போராடி வருகின்றன	https://www.virakesari.lk/article/230955	ta	virakesarilk	1763646720.0
lk_news	2025-11-20-virakesarilk-fe851743	virakesarilk-fe851743	2025-11-20	தமிழரின் “ஒருத்தனுக்கு ஒருத்தி” கலாசாரத்தை கடைப்பிடிக்காமல், யாரை திருமணம் முடித்துள்ளேன் என்றும் கூற முடியாதவர்கள் தமிழரின் கலாசாரத்தை உயர்த்தப்போவதாக கூறுகிறார்கள் - இளங்குமரன்	https://www.virakesari.lk/article/230950	ta	virakesarilk	1763645880.0
lk_news	2025-11-20-virakesarilk-2f8e75e2	virakesarilk-2f8e75e2	2025-11-20	இலங்கையில் மத சுதந்திரத்தை உறுதிப்படுத்துவதற்கு ஒத்துழைப்பு - பிரிட்டன் பாராளுமன்ற செயலாளர்	https://www.virakesari.lk/article/230954	ta	virakesarilk	1763645880.0
lk_news	2025-11-20-virakesarilk-cfca3978	virakesarilk-cfca3978	2025-11-20	மின்சார சபைக்கு 13 பில்லியன் ரூபா நஷ்டம் என்பதில் எந்த உண்மையும் இல்லை ; மாறாக 21000 மில். ரூபா இலாபமே! - எஸ்.எம்.மரிக்கார்	https://www.virakesari.lk/article/230947	ta	virakesarilk	1763645820.0
lk_news	2025-11-20-virakesarilk-01129cbc	virakesarilk-01129cbc	2025-11-20	தமிழர்களுக்கான நீதியையும் பொறுப்புக்கூறலையும் வென்றெடுக்க உழைப்போம் - தமிழர்களுக்கான பிரிட்டன் அனைத்துக் கட்சி பாராளுமன்றக் குழு உறுதி	https://www.virakesari.lk/article/230945	ta	virakesarilk	1763645700.0
lk_news	2025-11-20-lankadeepalk-d91fad8a	lankadeepalk-d91fad8a	2025-11-20	බලශක්ති වැය ශීර්ෂය සම්මතයි	https://www.lankadeepa.lk/news/බලශකත-වය-ශරෂය-සමමතය/101-683551	si	lankadeepalk	1763645190.0
lk_news	2025-11-20-virakesarilk-9f55b90e	virakesarilk-9f55b90e	2025-11-20	யார் ஆட்சிக்கு வந்தாலும் பௌத்த சிங்களமயமாக்கல் தொடரும்! - யாழ். பல்கலைக்கழக மாணவர் ஒன்றியம்	https://www.virakesari.lk/article/230953	ta	virakesarilk	1763645040.0
lk_news	2025-11-20-lankadeepalk-f88f4428	lankadeepalk-f88f4428	2025-11-20	‘‘විස මතට හිත ගිය දේශපාලන පෙරමුණ පරාජය කරනවා‘‘	https://www.lankadeepa.lk/news/වස-මතට-හත-ගය-දශපලන-පරමණ-පරජය-කරනව/101-683550	si	lankadeepalk	1763644852.0
lk_news	2025-11-20-virakesarilk-a77de578	virakesarilk-a77de578	2025-11-20	செவிப்புலனற்றோருக்கான விசேட சாரதி அனுமதிப் பத்திரம் வழங்கிவைப்பு	https://www.virakesari.lk/article/230951	ta	virakesarilk	1763644500.0
lk_news	2025-11-20-virakesarilk-98d14cf2	virakesarilk-98d14cf2	2025-11-20	பிரிமா 15 வயதின் கீழ் கிரிக்கெட்: கொழும்பு வடக்கு அணியை அதிரவைத்தது காலி அணி	https://www.virakesari.lk/article/230949	ta	virakesarilk	1763643600.0
lk_news	2025-11-20-virakesarilk-a1b5497e	virakesarilk-a1b5497e	2025-11-20	இதுவரை பதிவு செய்யப்படாத முதியோர் இல்லங்கள் 3 மாதகாலத்துக்குள் பதிவு செய்யப்பட வேண்டும் - யாழ். மாவட்ட அரசாங்க அதிபர்	https://www.virakesari.lk/article/230948	ta	virakesarilk	1763643360.0
lk_news	2025-11-20-lankadeepalk-dda018bc	lankadeepalk-dda018bc	2025-11-20	ගල්වලට සිවූ දුම්රිය එන්ජම උස්සයි	https://www.lankadeepa.lk/news/ගලවලට-සවදමරය-එනජම-උසසය/101-683549	si	lankadeepalk	1763641712.0
lk_news	2025-11-20-lankadeepalk-2ba1e6f4	lankadeepalk-2ba1e6f4	2025-11-20	ගල්වලට සිරවූ දුම්රිය එන්ජම උස්සයි	https://www.lankadeepa.lk/news/ගලවලට-සරවදමරය-එනජම-උසසය/101-683549	si	lankadeepalk	1763641712.0
lk_news	2025-11-20-virakesarilk-e021f837	virakesarilk-e021f837	2025-11-20	சுற்றுச்சூழலை பேண பிரித்தானிய உயர்ஸ்தானிகராலயத்தினால் புதிய செயற்திட்டம்!	https://www.virakesari.lk/article/230944	ta	virakesarilk	1763641500.0
lk_news	2025-11-20-virakesarilk-40d6607f	virakesarilk-40d6607f	2025-11-20	அம்மாவின் நகையை திருடிய குற்றச்சாட்டில் கைதான இளைஞன் தப்பியோட்டம்	https://www.virakesari.lk/article/230943	ta	virakesarilk	1763641440.0
lk_news	2025-11-20-virakesarilk-a01e030b	virakesarilk-a01e030b	2025-11-20	இலங்கை - ஐக்கிய அமெரிக்கா இடையிலான பாதுகாப்பு ஒப்பந்தம் மீண்டும் பாராளுமன்றத்துக்கு சமர்ப்பிப்பு - பாதுகாப்பு பிரதி அமைச்சர்	https://www.virakesari.lk/article/230941	ta	virakesarilk	1763640360.0
lk_news	2025-11-20-tamilmirrorlk-db040714	tamilmirrorlk-db040714	2025-11-20	மனைவியின் நிர்வாண வீ​டியோவை மைத்துனிக்கு அனுப்பிய கணவன்	https://www.tamilmirror.lk/செய்திகள்/மனைவியின்-நிர்வாண-வீ-டியோவை-மைத்துனிக்கு-அனுப்பிய-கணவன்/175-368253	ta	tamilmirrorlk	1763639569.0
lk_news	2025-11-20-virakesarilk-ec8f07ad	virakesarilk-ec8f07ad	2025-11-20	நல்லூர் நினைவாலயம் நாளை அங்குரார்ப்பணம்	https://www.virakesari.lk/article/230940	ta	virakesarilk	1763639160.0
lk_news	2025-11-20-virakesarilk-646c9f07	virakesarilk-646c9f07	2025-11-20	நெடுங்கேணி பொலிஸ் சார்ஜன் கைது!	https://www.virakesari.lk/article/230939	ta	virakesarilk	1763638800.0
lk_news	2025-11-20-lankadeepalk-18c566d5	lankadeepalk-18c566d5	2025-11-20	විදුලි බිල තුනෙන් එකකින් අඩු කිරීමට සැලසුම්	https://www.lankadeepa.lk/news/වදල-බල-තනන-එකකන-අඩ-කරමට-සලසම/101-683548	si	lankadeepalk	1763638761.0
lk_news	2025-11-20-virakesarilk-509e5c8d	virakesarilk-509e5c8d	2025-11-20	அரசாங்கம் ஆட்சியமைத்துள்ள தங்காலை நகர சபை, யட்டியந்தோட்டை பிரதேச சபையின் வரவு - செலவு திட்டங்கள் தோல்வி : வெலிகம பிரதேச சபையின் வரவு - செலவுத்திட்டம் நிறைவேற்றம் !	https://www.virakesari.lk/article/230935	ta	virakesarilk	1763638500.0
lk_news	2025-11-20-virakesarilk-16ff0792	virakesarilk-16ff0792	2025-11-20	திருகோணமலையில் வரலாற்றையும் தமிழர்களின் மத உணர்வுகளையும் சிதைக்கும் செயற்பாடுகள் நாட்டின் வளர்ச்சி, இன ஐக்கியத்துக்கு ஒருபோதும் பங்களிக்காது - சுரேஷ் பிரேமச்சந்திரன்	https://www.virakesari.lk/article/230938	ta	virakesarilk	1763638380.0
lk_news	2025-11-20-tamilmirrorlk-9cd689e9	tamilmirrorlk-9cd689e9	2025-11-20	இரண்டு தபால் ரயில்கள் இரத்து	https://www.tamilmirror.lk/மலையகம்/இரண்டு-தபால்-ரயில்கள்-இரத்து/76-368252	ta	tamilmirrorlk	1763638050.0
lk_news	2025-11-20-lankadeepalk-2e5f6b3a	lankadeepalk-2e5f6b3a	2025-11-20	මත මඩින්න වැඩ කළ විරුවන්ට තිළිණ	https://www.lankadeepa.lk/news/මත-මඩනන-වඩ-කළ-වරවනට-තළණ/101-683547	si	lankadeepalk	1763638014.0
lk_news	2025-11-20-tamilmirrorlk-164979b5	tamilmirrorlk-164979b5	2025-11-20	வாளை உருவுகையில் வருவதை பாருங்கள் (வீ​டியோ)	https://www.tamilmirror.lk/சிந்தனை-சித்திரம்/வாளை-உருவுகையில்-வருவதை-பாருங்கள்-வீ-டியோ/62-368251	ta	tamilmirrorlk	1763638003.0
lk_news	2025-11-20-tamilmirrorlk-09cd62bb	tamilmirrorlk-09cd62bb	2025-11-20	வாளை உருவுகையில் வருவதை பாருங்கள்	https://www.tamilmirror.lk/சிந்தனை-சித்திரம்/வாளை-உருவுகையில்-வருவதை-பாருங்கள்/62-368251	ta	tamilmirrorlk	1763638003.0
lk_news	2025-11-20-virakesarilk-97e1f522	virakesarilk-97e1f522	2025-11-20	எத்தனை ஆட்சிகள் மாறினாலும் ஆட்சியாளர்களின் மனதில் மாற்றம் வராது - சட்டத்தரணி வி.மணிவண்ணன்	https://www.virakesari.lk/article/230934	ta	virakesarilk	1763637960.0
lk_news	2025-11-20-virakesarilk-684d3d68	virakesarilk-684d3d68	2025-11-20	புலம்பெயர் தமிழ் சமூகத்தின் ஒப்பந்தத்தை நிறைவேற்றுவதற்காக தேசத்துரோக நிகழ்ச்சி நிரலின் அடிப்படையில் செயற்படும் அரசாங்கம் - விமல் வீரவன்ச கடும் விசனம்	https://www.virakesari.lk/article/230936	ta	virakesarilk	1763637900.0
lk_news	2025-11-20-lankadeepalk-7619854c	lankadeepalk-7619854c	2025-11-20	බිරිඳගේ නිරුවත නෑනාට යවලා	https://www.lankadeepa.lk/news/බරඳග-නරවත-නනට-යවල/101-683546	si	lankadeepalk	1763637861.0
lk_news	2025-11-20-virakesarilk-03beba77	virakesarilk-03beba77	2025-11-20	மாவீரர் வாரத்தை முன்னிட்டு மன்னாரில் மாவீரர்களின் பெற்றோர்கள் கௌரவிப்பு	https://www.virakesari.lk/article/230933	ta	virakesarilk	1763637540.0
lk_news	2025-11-20-lankadeepalk-31c90b87	lankadeepalk-31c90b87	2025-11-20	‘‘නුවරවැවෙන් යන්නම ඕන‘‘	https://www.lankadeepa.lk/news/නවරවවන-යනනම-ඕන/101-683545	si	lankadeepalk	1763637530.0
lk_news	2025-11-20-tamilmirrorlk-8a867375	tamilmirrorlk-8a867375	2025-11-20	திரிபோஷாவுக்கு  தட்டுப்பாடு	https://www.tamilmirror.lk/செய்திகள்/திரிபோஷாவுக்கு-தட்டுப்பாடு/175-368250	ta	tamilmirrorlk	1763637149.0
lk_news	2025-11-20-lankadeepalk-a09d2f1a	lankadeepalk-a09d2f1a	2025-11-20	උඩරට තැපැල් දුම්රිය අදත් අවලංගු කරයි	https://www.lankadeepa.lk/news/උඩරට-තපල-දමරය-අදත-අවලග-කරය/101-683544	si	lankadeepalk	1763637089.0
lk_news	2025-11-20-lankadeepalk-fe4a8201	lankadeepalk-fe4a8201	2025-11-20	දරුවන්ගේ වෙනස් වීම් ගැන අවධානයෙන් ඉන්න	https://www.lankadeepa.lk/news/දරවනග-වනස-වම-ගන-අවධනයන-ඉනන/101-683543	si	lankadeepalk	1763636902.0
lk_news	2025-11-20-virakesarilk-e0ed0d5c	virakesarilk-e0ed0d5c	2025-11-20	நுண்கடன் நிறுவனங்கள் அனுமதிபெறாவிட்டால் வேலணை பிரதேச சபை ஆளுகைக்குள் இயங்கத் தடை!	https://www.virakesari.lk/article/230894	ta	virakesarilk	1763636640.0
lk_news	2025-11-20-lankadeepalk-1597a497	lankadeepalk-1597a497	2025-11-20	සජබෙන් වෙනම රැලියක්: නුගේගොඩ රැලියට නෑ	https://www.lankadeepa.lk/news/සජබන-වනම-රලයක-නගගඩ-රලයට-න/101-683542	si	lankadeepalk	1763636488.0
lk_news	2025-11-20-virakesarilk-81a25c1d	virakesarilk-81a25c1d	2025-11-20	நாளை நடைபெறவுள்ள பொதுக் கூட்டம் காரணமாக விசேட போக்குவரத்து கட்டுப்பாடு!	https://www.virakesari.lk/article/230932	ta	virakesarilk	1763636460.0
lk_news	2025-11-20-virakesarilk-ab349ce6	virakesarilk-ab349ce6	2025-11-20	சிவில் பிரஜைகள் பொலிஸ் சான்றிதழ் பெற அனுமதி தேவையில்லை - சுனில் வட்டகல	https://www.virakesari.lk/article/230931	ta	virakesarilk	1763636400.0
lk_news	2025-11-20-virakesarilk-edbe8c96	virakesarilk-edbe8c96	2025-11-20	யாழில் கள்ளுத் தவறணையில் முதியவர் மீது கொடூர தாக்குதல் - ஆபத்தான நிலையில் சிகிச்சையில்!	https://www.virakesari.lk/article/230930	ta	virakesarilk	1763636340.0
lk_news	2025-11-20-virakesarilk-66896e87	virakesarilk-66896e87	2025-11-20	முத்து நகர் விவசாயிகள் ஆளும் கட்சி எம்.பிக்களின் கொடும்பாவி எரித்து விவசாய நிலத்தில் போராட்டம்	https://www.virakesari.lk/article/230929	ta	virakesarilk	1763636160.0
lk_news	2025-11-20-lankadeepalk-d9bf23fb	lankadeepalk-d9bf23fb	2025-11-20	ජාජබ වැලිකන්ද අයවැය ඡන්ද 12කින් සම්මතයි	https://www.lankadeepa.lk/news/ජජබ-වලකනද-අයවය-ඡනද-12කන-සමමතය/101-683541	si	lankadeepalk	1763636095.0
lk_news	2025-11-20-virakesarilk-f03ef6a6	virakesarilk-f03ef6a6	2025-11-20	வடக்கில் இராணுவம் சிகை அலங்கரிப்பு நிலையங்களை நடத்திவருவதால், சிகை அலங்கரிப்பாளர்களின் வாழ்வாதாரம் பாதிப்பு! - வடக்கு அழகக சங்கங்களின் சம்மேளனம்	https://www.virakesari.lk/article/230928	ta	virakesarilk	1763635920.0
lk_news	2025-11-20-virakesarilk-beecdacc	virakesarilk-beecdacc	2025-11-20	சர்ச்சைக்குரிய துறையூர் மீன் சந்தை தொடர்பில் சட்ட நடவடிக்கை - தவிசாளர் அசோக்குமார்!	https://www.virakesari.lk/article/230927	ta	virakesarilk	1763635800.0
lk_news	2025-11-20-virakesarilk-a8eb42b5	virakesarilk-a8eb42b5	2025-11-20	“அக்வா பிளான்ட் 2025” – உலக மீனவர் தினத்தை முன்னிட்டு பயிற்சி பட்டறைகள் ஆரம்பம்	https://www.virakesari.lk/article/230926	ta	virakesarilk	1763635080.0
lk_news	2025-11-20-lankadeepalk-d657165e	lankadeepalk-d657165e	2025-11-20	විෂ මත නසන දකුණේ මෙහෙයුම තංගල්ලේ දී ඇරැඹෙයි	https://www.lankadeepa.lk/news/වෂ-මත-නසන-දකණ-මහයම-තගලල-ද-ඇරඹය/101-683540	si	lankadeepalk	1763634939.0
lk_news	2025-11-20-virakesarilk-2aeaad1b	virakesarilk-2aeaad1b	2025-11-20	கிராமத்தில் பதவிகள் தனிக் கட்சிக்கு - சஜித் பிரேமதாச குற்றச்சாட்டுகள்	https://www.virakesari.lk/article/230923	ta	virakesarilk	1763634660.0
lk_news	2025-11-20-adalk-38d521d8	adalk-38d521d8	2025-11-20	දේශීය ආදායම් දෙපාර්තමේන්තුව ඉතිහාසයේ ඉහළම ආදායම වාර්තා කරයි	https://www.ada.lk/breaking_news/දේශීය-ආදායම්-දෙපාර්තමේන්තුව-ඉතිහාසයේ-ඉහළම-ආදායම-වාර්තා-කරයි/11-419787	si	adalk	1763634505.0
lk_news	2025-11-20-virakesarilk-40870e26	virakesarilk-40870e26	2025-11-20	டிசம்பரில் நெட்ஃபிளிக்ஸில் வெளியாகும் சைக்கலாஜிக்கல் திரில்லரான 'ஸ்டீபன் '  இணைய தொடர்	https://www.virakesari.lk/article/230919	ta	virakesarilk	1763634120.0
lk_news	2025-11-20-adalk-2390fdb8	adalk-2390fdb8	2025-11-20	ලෙකෝ සභාපතිට ඇණවුම් කළ බෙන්ස් රථ ඇණවුම අවලංගු කරයි	https://www.ada.lk/breaking_news/ලෙකෝ-සභාපතිට-ඇණවුම්-කළ-බෙන්ස්-රථ-ඇණවුම-අවලංගු-කරයි/11-419786	si	adalk	1763634037.0
lk_news	2025-11-20-virakesarilk-950fcc84	virakesarilk-950fcc84	2025-11-20	கல்யாணி பிரியதர்ஷன் நடிக்கும் புதிய படத்தின் படப்பிடிப்பு தொடக்கம்	https://www.virakesari.lk/article/230916	ta	virakesarilk	1763634000.0
lk_news	2025-11-20-virakesarilk-320e08ad	virakesarilk-320e08ad	2025-11-20	நடிகர் நிவின் பாலி நடிக்கும் 'சர்வம் மாயா' படத்தின் வெளியீட்டு திகதி அறிவிப்பு	https://www.virakesari.lk/article/230915	ta	virakesarilk	1763633880.0
lk_news	2025-11-20-virakesarilk-271365e0	virakesarilk-271365e0	2025-11-20	தென்கொரியாவில் படகு விபத்து ; இருவர் கைது	https://www.virakesari.lk/article/230908	ta	virakesarilk	1763633880.0
lk_news	2025-11-20-virakesarilk-b4a64b02	virakesarilk-b4a64b02	2025-11-20	மின்சார சபையின் பணிகள், பொறுப்புக்களை பூரண அரச அங்கீகாரம் பெற்ற நிறுவனங்களிடம் கையளிக்க தீர்மானம்	https://www.virakesari.lk/article/230910	ta	virakesarilk	1763633700.0
lk_news	2025-11-20-virakesarilk-a1b56be8	virakesarilk-a1b56be8	2025-11-20	தொல். திருமாவளவன் வெளியிட்ட 'மாண்புமிகு பறை' படத்தின் இசை	https://www.virakesari.lk/article/230914	ta	virakesarilk	1763633700.0
lk_news	2025-11-20-bbccomsinhala-a3d2ab5d	bbccomsinhala-a3d2ab5d	2025-11-20	'දේශපාලනයේදී කැට තියන්න බෑ. නොසිතූ මිනිස්සු ගෙදර ගියා. නොසිතූ මිනිස්සු ජනාධිපති වුණා'	https://www.bbc.com/sinhala/articles/c5ypy8dlev0o	si	bbccomsinhala	1763632999.0
lk_news	2025-11-20-adalk-a75a0d51	adalk-a75a0d51	2025-11-20	රු. කෝටි හතරක කුෂ් කටුනායකින් අල්ලයි	https://www.ada.lk/breaking_news/රු--කෝටි-හතරක-කුෂ්-කටුනායකින්-අල්ලයි/11-419785	si	adalk	1763632956.0
lk_news	2025-11-20-adalk-f6451bdb	adalk-f6451bdb	2025-11-20	විශේෂඥ වෛද්‍යවරුන් සඳහා සේවා ව්‍යවස්ථාව කෙටුම්පත් කිරීමට කමිටුවක්	https://www.ada.lk/breaking_news/විශේෂඥ-වෛද්‍යවරුන්-සඳහා-සේවා-ව්‍යවස්ථාව-කෙටුම්පත්-කිරීමට-කමිටුවක්/11-419784	si	adalk	1763632465.0
lk_news	2025-11-20-virakesarilk-d70a0889	virakesarilk-d70a0889	2025-11-20	நாட்டில் 10 சதவீதமானோருக்கு சிறுநீரக நோய் ; விசேட வைத்திய நிபுணர்	https://www.virakesari.lk/article/230904	ta	virakesarilk	1763632080.0
lk_news	2025-11-20-tamilmirrorlk-4941171c	tamilmirrorlk-4941171c	2025-11-20	நுகேகொடையில் சிறப்பு போக்குவரத்து திட்டம்	https://www.tamilmirror.lk/செய்திகள்/நுகேகொடையில்-சிறப்பு-போக்குவரத்து-திட்டம்/175-368242	ta	tamilmirrorlk	1763631740.0
