doc_type	doc_id	num	date_str	description	url_metadata	lang	newspaper_id	time_ut
lk_news	2025-11-26-lankadeepalk-8eb264e3	lankadeepalk-8eb264e3	2025-11-26	ගුවනේදී හිමි නමගේ මුදල් සොරකම් කළ චීන ජාතිකයන් දෙදෙනා අල්ලයි	https://www.lankadeepa.lk/news/ගවනද-හම-නමග-මදල-සරකම-කළ-චන-ජතකයන-දදන-අලලය/101-683887	si	lankadeepalk	1764127700.0
lk_news	2025-11-26-tamilmirrorlk-5a9be670	tamilmirrorlk-5a9be670	2025-11-26	படகு கவிழ்ந்து இளைஞர் உயிரிழப்பு	https://www.tamilmirror.lk/செய்திகள்/படகு-கவிழ்ந்து-இளைஞர்-உயிரிழப்பு/175-368505	ta	tamilmirrorlk	1764126785.0
lk_news	2025-11-26-lankadeepalk-38d93b8f	lankadeepalk-38d93b8f	2025-11-26	විදෙස් දුම්වැටි සමඟ තිදෙනකු ගුවන්තොටුපොළෙදී අල්ලයි	https://www.lankadeepa.lk/news/වදස-දමවට-සමඟ-තදනක-ගවනතටපළද-අලලය/101-683886	si	lankadeepalk	1764126766.0
lk_news	2025-11-26-virakesarilk-62da09ad	virakesarilk-62da09ad	2025-11-26	சில தினங்களுக்கு நாடு முழுவதும் காற்றுடன் மழையுடனான வானிலை !	https://www.virakesari.lk/article/231468	ta	virakesarilk	1764122100.0
lk_news	2025-11-26-adalk-4cdb4991	adalk-4cdb4991	2025-11-26	ලංකාව දිනුවත් සිම්බාබ්වේ තවමත් ඉදිරියෙන්, පාකිස්තාන තරගයේ ජය අනිවාර්යයි	https://www.ada.lk/sports/ලංකාව-දිනුවත්-සිම්බාබ්වේ-තවමත්-ඉදිරියෙන්--පාකිස්තාන-තරගයේ-ජය-අනිවාර්යයි/9-419884	si	adalk	1764121479.0
lk_news	2025-11-26-dailyftlk-fadc5281	dailyftlk-fadc5281	2025-11-26	Man previously questioned over Easter attacks seeks asylum in UK	https://www.ft.lk/news/Man-previously-questioned-over-Easter-attacks-seeks-asylum-in-UK/56-784840	en	dailyftlk	1764120644.0
lk_news	2025-11-26-dailyftlk-82125f45	dailyftlk-82125f45	2025-11-26	Govt. weighs curbs on rice imports to lift paddy production	https://www.ft.lk/news/Govt-weighs-curbs-on-rice-imports-to-lift-paddy-production/56-784839	en	dailyftlk	1764120521.0
lk_news	2025-11-26-dailyftlk-290f6b05	dailyftlk-290f6b05	2025-11-26	Parliament turns orange to end gender-based violence	https://www.ft.lk/news/Parliament-turns-orange-to-end-gender-based-violence/56-784838	en	dailyftlk	1764120452.0
lk_news	2025-11-26-dailyftlk-9a023df1	dailyftlk-9a023df1	2025-11-26	Cabinet approves signing of amended Sri Lanka–Luxembourg Double Taxation Agreement	https://www.ft.lk/news/Cabinet-approves-signing-of-amended-Sri-LankaLuxembourg-Double-Taxation-Agreement/56-784837	en	dailyftlk	1764120371.0
lk_news	2025-11-26-dailyftlk-1682bab3	dailyftlk-1682bab3	2025-11-26	Sri Lanka’s mineral sector investment opportunities promoted in UK	https://www.ft.lk/business/Sri-Lanka-s-mineral-sector-investment-opportunities-promoted-in-UK/34-784836	en	dailyftlk	1764120220.0
lk_news	2025-11-26-dailyftlk-c1292f5e	dailyftlk-c1292f5e	2025-11-26	Sri Lankan delegation participates in CII Partnership Summit 2025 in Andhra Pradesh	https://www.ft.lk/business/Sri-Lankan-delegation-participates-in-CII-Partnership-Summit-2025-in-Andhra-Pradesh/34-784835	en	dailyftlk	1764120164.0
lk_news	2025-11-26-dailyftlk-e5dbdd03	dailyftlk-e5dbdd03	2025-11-26	HNB becomes Platinum sponsor of TiECON 2026 to power Sri Lanka’s runway to the world	https://www.ft.lk/business/HNB-becomes-Platinum-sponsor-of-TiECON-2026-to-power-Sri-Lanka-s-runway-to-the-world/34-784834	en	dailyftlk	1764120063.0
lk_news	2025-11-26-dailyftlk-f059fed0	dailyftlk-f059fed0	2025-11-26	Sri Lanka Economic Summit 2025 next week with over 850 participants	https://www.ft.lk/business/Sri-Lanka-Economic-Summit-2025-next-week-with-over-850-participants/34-784833	en	dailyftlk	1764118005.0
lk_news	2025-11-26-dailyftlk-9dcef14c	dailyftlk-9dcef14c	2025-11-26	Sri Lanka Customs hitting record single-day revenue: A turning point or one-off?	https://www.ft.lk/columns/Sri-Lanka-Customs-hitting-record-single-day-revenue-A-turning-point-or-one-off/4-784832	en	dailyftlk	1764117953.0
lk_news	2025-11-26-tamilmirrorlk-eb429ba0	tamilmirrorlk-eb429ba0	2025-11-26	’போதைக்கு அடிமையானவர்களின் புனர்வாழ்வு குறித்தும் அதிக கவனம்’	https://www.tamilmirror.lk/செய்திகள்/போதைக்கு-அடிமையானவர்களின்-புனர்வாழ்வு-குறித்தும்-அதிக-கவனம்/175-368504	ta	tamilmirrorlk	1764117771.0
lk_news	2025-11-26-dailyftlk-1132ea4e	dailyftlk-1132ea4e	2025-11-26	The Baby Prince’s daydream: Opposition’s empty trump cards against AKD Govt.	https://www.ft.lk/columns/The-Baby-Prince-s-daydream-Opposition-s-empty-trump-cards-against-AKD-Govt/4-784831	en	dailyftlk	1764117366.0
lk_news	2025-11-26-dailyftlk-05318c20	dailyftlk-05318c20	2025-11-26	Demographic red flags for the economy	https://www.ft.lk/columns/Demographic-red-flags-for-the-economy/4-784829	en	dailyftlk	1764117006.0
lk_news	2025-11-26-tamilmirrorlk-84f17002	tamilmirrorlk-84f17002	2025-11-26	இந்திய பயணத்தை ரத்து செய்தார் நெதன்யாகு	https://www.tamilmirror.lk/உலக-செய்திகள்/இந்திய-பயணத்தை-ரத்து-செய்தார்-நெதன்யாகு/50-368503	ta	tamilmirrorlk	1764116838.0
lk_news	2025-11-26-dailyftlk-60b8fd73	dailyftlk-60b8fd73	2025-11-26	FCCISL presents five strategic Budget proposals	https://www.ft.lk/opinion/FCCISL-presents-five-strategic-Budget-proposals/14-784828	en	dailyftlk	1764116667.0
lk_news	2025-11-26-dailyftlk-5f3bd146	dailyftlk-5f3bd146	2025-11-26	Tax professionals: The backbone of ethical tax practices	https://www.ft.lk/columns/Tax-professionals-The-backbone-of-ethical-tax-practices/4-784827	en	dailyftlk	1764116470.0
lk_news	2025-11-26-tamilmirrorlk-007f0694	tamilmirrorlk-007f0694	2025-11-26	பிரான்ஸ் ஜனாதிபதியின் கருத்தால் சர்ச்சை	https://www.tamilmirror.lk/உலக-செய்திகள்/பிரான்ஸ்-ஜனாதிபதியின்-கருத்தால்-சர்ச்சை/50-368502	ta	tamilmirrorlk	1764116411.0
lk_news	2025-11-26-dailyftlk-f4a61c45	dailyftlk-f4a61c45	2025-11-26	Compensation – a reflection of fairness, trust and recognition	https://www.ft.lk/opinion/Compensation-a-reflection-of-fairness-trust-and-recognition/14-784826	en	dailyftlk	1764116118.0
lk_news	2025-11-26-dailyftlk-3672d183	dailyftlk-3672d183	2025-11-26	President moves to introduce law for on-site destruction of seized narcotics	https://www.ft.lk/news/President-moves-to-introduce-law-for-on-site-destruction-of-seized-narcotics/56-784825	en	dailyftlk	1764115852.0
lk_news	2025-11-26-dailyftlk-43f299b1	dailyftlk-43f299b1	2025-11-26	Supreme Court of Sri Lanka steps into new era	https://www.ft.lk/news/Supreme-Court-of-Sri-Lanka-steps-into-new-era/56-784824	en	dailyftlk	1764115781.0
lk_news	2025-11-26-dailyftlk-1cb668f4	dailyftlk-1cb668f4	2025-11-26	Govt. expects metro bus service will set new standard for public transport	https://www.ft.lk/news/Govt-expects-metro-bus-service-will-set-new-standard-for-public-transport/56-784823	en	dailyftlk	1764115703.0
lk_news	2025-11-26-virakesarilk-d0629be1	virakesarilk-d0629be1	2025-11-26	தொல்பொருள் இடங்களுக்கான பெயர்ப்பலகை அகற்றிய விவகாரம்: வாழைச்சேனை பிரதேசசபை தவிசாளர் உள்ளிட்ட ஐவருக்குப் பிணை	https://www.virakesari.lk/article/231467	ta	virakesarilk	1764115080.0
lk_news	2025-11-26-virakesarilk-5f2d30d1	virakesarilk-5f2d30d1	2025-11-26	தெஹிவளையில் மீளாத் பாடசாலை: இடப்பற்றாக்குறைக்கு அரசாங்க நடவடிக்கை கோரி ரிஷாத் பதியுதீன்	https://www.virakesari.lk/article/231466	ta	virakesarilk	1764114900.0
lk_news	2025-11-26-virakesarilk-7b0d32c0	virakesarilk-7b0d32c0	2025-11-26	பொருளாதாரப் பாதிப்பில் இருந்து மீட்சிப்பெற்றுக்கொண்டு தான் அனைத்து விடயங்களையும்  கோரிக்கைகளையும் செயற்படுத்த வேண்டும் -  மஹிந்த ஜயசிங்க	https://www.virakesari.lk/article/231465	ta	virakesarilk	1764114720.0
lk_news	2025-11-26-virakesarilk-795ddc32	virakesarilk-795ddc32	2025-11-26	வெருகல் பிரதேசத்தில் பெருமளவான காணிகளை வனவிலங்கு துறை உரிமை கோருவதால் அந்த பிரதேச மக்கள் எதிர்கொண்டுள்ள பிரச்சினைகளுக்கு உரிய தீர்வுகளை வழங்குக - இம்ரான் மஹ்ரூப்	https://www.virakesari.lk/article/231464	ta	virakesarilk	1764114540.0
lk_news	2025-11-26-virakesarilk-b65cb42a	virakesarilk-b65cb42a	2025-11-26	மாகாணங்களில் 101 பாடசாலைகள் மூடப்பட்டுள்ளன : மீளத் திறப்பிற்கான நடவடிக்கைகள் கோரி ஐக்கிய மக்கள் சக்தி முழுமை ஒத்துழைப்பு – கிங்ஸ் நெல்சன்	https://www.virakesari.lk/article/231463	ta	virakesarilk	1764114120.0
lk_news	2025-11-26-virakesarilk-12a494b8	virakesarilk-12a494b8	2025-11-26	மொறக்கொட்டாஞ்சேனை இராணுவ முகாமில் இருந்த பாடசாலை விடுவிப்பு: அழிக்கப்பட்ட 56 வீடுகள் நிர்மாணிக்க மற்றும் ஆசிரியர் பற்றாக்குறை தீர்வு கோரிக்கை – ஸ்ரீநேசன்	https://www.virakesari.lk/article/231462	ta	virakesarilk	1764113760.0
lk_news	2025-11-26-virakesarilk-a5370422	virakesarilk-a5370422	2025-11-26	உயர்தர பொருளியல் பரீட்சை வினாத்தாள் குறித்து சீ.ஐ.டி. விசாரணைகள் ஆரம்பம் - அமைச்சரவை பேச்சாளர்	https://www.virakesari.lk/article/231461	ta	virakesarilk	1764113400.0
lk_news	2025-11-26-virakesarilk-2835269f	virakesarilk-2835269f	2025-11-26	குறைந்த மாணவர்களை கொண்ட பாடசாலைகள் மூடும் முயற்சிக்கு எதிர்ப்பு – வே. இராதாகிருஷ்ணன்	https://www.virakesari.lk/article/231460	ta	virakesarilk	1764113160.0
lk_news	2025-11-26-virakesarilk-1e96f07e	virakesarilk-1e96f07e	2025-11-26	வாழைச்சேனையில் தொல்பொருள் விவகாரம் : தொடர்புடையோருக்கு எதிராக கடும் சட்ட நடவடிக்கை - அரசாங்கம்	https://www.virakesari.lk/article/231459	ta	virakesarilk	1764113040.0
lk_news	2025-11-26-virakesarilk-efee8ffc	virakesarilk-efee8ffc	2025-11-26	மாகாணசபைகளுக்கான நிதி ஒதுக்கீடு : நிதி ஆணைக்குழுவின் பரிந்துரைகளை பாராளுமன்றத்தில் சமர்ப்பிக்க அமைச்சரவை அங்கீகாரம்	https://www.virakesari.lk/article/231458	ta	virakesarilk	1764112800.0
lk_news	2025-11-26-virakesarilk-732d5292	virakesarilk-732d5292	2025-11-26	சுற்றுலா சேவையை முழுமையாக மேம்படுத்த  சில சவால்கள் உள்ளன - வடக்கு ஆளுநர் தெரிவிப்பு!	https://www.virakesari.lk/article/231457	ta	virakesarilk	1764112740.0
lk_news	2025-11-26-bbccomsinhala-64da8e71	bbccomsinhala-64da8e71	2025-11-26	EPF ඩිජිටල් පද්ධතියෙන් ඔබට ලැබෙන ප්‍රතිලාභ මොනවා ද? එය ඇරඹෙන්නේ කවදා ද?	https://www.bbc.com/sinhala/articles/cjwy05p09qeo	si	bbccomsinhala	1764103415.0
lk_news	2025-11-26-virakesarilk-c5c61c7d	virakesarilk-c5c61c7d	2025-11-26	75வது கடற்படை தினத்தை முன்னிட்டு கடற்படைக்கு ஆசிர்வதிக்கும் வகையில் ஒரு கூட்டு கிறிஸ்தவ உற்சவம் மற்றும் நன்றி செலுத்தும் ஆராதனை	https://www.virakesari.lk/article/231456	ta	virakesarilk	1764102300.0
lk_news	2025-11-26-virakesarilk-4bf36543	virakesarilk-4bf36543	2025-11-26	இன அடிப்படையிலான பாடசாலைகள் ரத்து செய்யப்பட்டு  அனைத்து இன மாணவர்களும் ஒன்றாக கல்வி கற்க முடியுமான சூழலை ஏற்படுத்த வேண்டும் - மனோகணேசன்	https://www.virakesari.lk/article/231455	ta	virakesarilk	1764102060.0
lk_news	2025-11-26-virakesarilk-d48ed1c1	virakesarilk-d48ed1c1	2025-11-26	பௌத்த சிங்கள சமூகத்தை தூண்டி கோபத்துக்குள்ளாக முயற்சி தனி ஈழத்துக்புகு பாதை அமைப்பதற்கு இடமளித்து விடக் கூடாது - ஞானசார தேரர் எச்சரிக்கை	https://www.virakesari.lk/article/231454	ta	virakesarilk	1764101280.0
lk_news	2025-11-26-virakesarilk-6b13a537	virakesarilk-6b13a537	2025-11-26	பிணை வழங்கப்படமுடியாத மிகக்கொடூரமான தொல்லியல் சட்டம் மாற்றியமைக்கப்படவேண்டும் - எம்.ஏ.சுமந்திரன்	https://www.virakesari.lk/article/231453	ta	virakesarilk	1764100860.0
lk_news	2025-11-26-virakesarilk-e6c96d5a	virakesarilk-e6c96d5a	2025-11-26	ஸ்ரீலங்கன் எயா லைன்ஸ் தலைவராக தம்மிக பெரேரா நியமிக்கப்பட்டுள்ளாரா? - அரசாங்கம் மறுப்பு	https://www.virakesari.lk/article/231452	ta	virakesarilk	1764100620.0
lk_news	2025-11-26-virakesarilk-026b2bee	virakesarilk-026b2bee	2025-11-26	கல்வி நிதி குறைப்பை விமர்சிப்போரே அப்போது ஆதரித்தவர்கள்; தற்போது உயர்ந்த நிதி ஒதுக்கப்பட்டுள்ளது - நளின் ஹேவகே	https://www.virakesari.lk/article/231451	ta	virakesarilk	1764100440.0
lk_news	2025-11-26-virakesarilk-dc18b92c	virakesarilk-dc18b92c	2025-11-26	காதலனின் வீட்டில் உள்ள நகைகளை திருடிய காதலி - சாவகச்சேரியில் சம்பவம்!	https://www.virakesari.lk/article/231450	ta	virakesarilk	1764099900.0
lk_news	2025-11-26-virakesarilk-6c1c0092	virakesarilk-6c1c0092	2025-11-26	வெளிநாட்டு வேலைவாய்ப்புப் பணியகத்தின் முன்னாள் தலைவருக்கு விளக்கமறியல்	https://www.virakesari.lk/article/231449	ta	virakesarilk	1764099780.0
lk_news	2025-11-26-virakesarilk-edb9b7ab	virakesarilk-edb9b7ab	2025-11-26	வட்டுக்கோட்டையில் இரு வெவ்வேறு இடங்களில் ஐஸ் போதைப் பொருளுடன் இருவர் கைது!	https://www.virakesari.lk/article/231448	ta	virakesarilk	1764099660.0
lk_news	2025-11-26-virakesarilk-27bd0451	virakesarilk-27bd0451	2025-11-26	கொழும்பில் இருந்து போதை மாத்திரைகள் கடத்திய 3 பேர் யாழ்ப்பாணத்தில் கைது	https://www.virakesari.lk/article/231447	ta	virakesarilk	1764099480.0
lk_news	2025-11-26-virakesarilk-9998ff07	virakesarilk-9998ff07	2025-11-26	போதைப் பொருளுக்கு அடிமையானவர்களின் புனர்வாழ்வுக்கான முறையான அறிவியல் ரீதியான திட்டமொன்றைத் தயாரிக்குக -  ஜனாதிபதி	https://www.virakesari.lk/article/231446	ta	virakesarilk	1764099360.0
lk_news	2025-11-26-islandlk-b890106a	islandlk-b890106a	2025-11-26	Global Vinyl reinforces market leadership with launch of locally manufactured luxury SPC flooring	http://island.lk/global-vinyl-reinforces-market-leadership-with-launch-of-locally-manufactured-luxury-spc-flooring/	en	islandlk	1764098160.0
lk_news	2025-11-26-islandlk-7f1829a2	islandlk-7f1829a2	2025-11-26	Ganesh, head of Traders’ Association	http://island.lk/ganesh-head-of-traders-association/	en	islandlk	1764098100.0
lk_news	2025-11-26-islandlk-c647b56d	islandlk-c647b56d	2025-11-26	SEC alert on Blue Ocean Securities Ltd	http://island.lk/sec-alert-on-blue-ocean-securities-ltd/	en	islandlk	1764098040.0
lk_news	2025-11-26-islandlk-acdedca8	islandlk-acdedca8	2025-11-26	A decade strong: Suren Cooke Agencies with Xterm redefined pest termite control	http://island.lk/a-decade-strong-suren-cooke-agencies-with-xterm-redefined-pest-termite-control/	en	islandlk	1764097680.0
lk_news	2025-11-26-islandlk-d4fb7a6d	islandlk-d4fb7a6d	2025-11-26	Assetline Finance soars high, nearing 40% asset growth during 1st half of FY2025/26	http://island.lk/assetline-finance-soars-high-nearing-40-asset-growth-during-1st-half-of-fy2025-26/	en	islandlk	1764097620.0
lk_news	2025-11-26-islandlk-98c26bde	islandlk-98c26bde	2025-11-26	Sri Lankan pride, global glory: Solar Booze sweeps Service and Performance Excellence Awards	http://island.lk/sri-lankan-pride-global-glory-solar-booze-sweeps-service-and-performance-excellence-awards/	en	islandlk	1764097620.0
lk_news	2025-11-25-lankadeepalk-80097654	lankadeepalk-80097654	2025-11-25	රෝහිත ඇතුළු 20 ක් නැවත පොහොට්ටුවට	https://www.lankadeepa.lk/latest_news/රහත-ඇතළ-20-ක-නවත-පහටටවට/1-683885	si	lankadeepalk	1764091990.0
lk_news	2025-11-25-lankadeepalk-6702a2d1	lankadeepalk-6702a2d1	2025-11-25	ශ්‍රී ලංකාව කඩුලු 9 කින් ජයගනී	https://www.lankadeepa.lk/news/ශර-ලකව-කඩල-9-කන-ජයගන/101-683884	si	lankadeepalk	1764090808.0
lk_news	2025-11-25-virakesarilk-9b63b28d	virakesarilk-9b63b28d	2025-11-25	நிலவும் மழை மற்றும் காற்றால் யாழ்ப்பாணம் மாவட்டத்தில் 560 பேர் பாதிப்பு – 171 குடும்பங்கள் பாதிக்கப்பட்டன	https://www.virakesari.lk/article/231445	ta	virakesarilk	1764088800.0
lk_news	2025-11-25-virakesarilk-30dc4b01	virakesarilk-30dc4b01	2025-11-25	ஸிம்பாப்வேயை வெளுத்துக்கட்டிய இலங்கைக்கு இறுதிக்கு செல்ல இன்னும் ஒரு வெற்றி தேவை	https://www.virakesari.lk/article/231444	ta	virakesarilk	1764088740.0
lk_news	2025-11-25-lankadeepalk-cf862405	lankadeepalk-cf862405	2025-11-25	කලපුවට වැටි තරුණයෙක් මියයයි	https://www.lankadeepa.lk/latest_news/කලපවට-වට-තරණයක-මයයය/1-683883	si	lankadeepalk	1764088039.0
lk_news	2025-11-25-virakesarilk-d6e6b9ba	virakesarilk-d6e6b9ba	2025-11-25	2026 ரி20 உலகக் கிண்ண கிரிக்கெட்: இலங்கைக்கு சொந்த மண்ணில் முதல் சுற்று	https://www.virakesari.lk/article/231443	ta	virakesarilk	1764087660.0
lk_news	2025-11-25-lankadeepalk-f2befea3	lankadeepalk-f2befea3	2025-11-25	බලංගොඩ නිවාස 17ක  පුද්ගලයන් 78ක්  තාවකාලිකව ඉවත් කරයි	https://www.lankadeepa.lk/latest_news/බලගඩ-නවස-17ක-පදගලයන-78ක-තවකලකව-ඉවත-කරය/1-683882	si	lankadeepalk	1764087446.0
lk_news	2025-11-25-lankadeepalk-307dc9b0	lankadeepalk-307dc9b0	2025-11-25	කලා වැවේ වාන් දොරටු දෙකක් විවෘත කරයි	https://www.lankadeepa.lk/news/කල-වව-වන-දරට-දකක-වවත-කරය/101-683881	si	lankadeepalk	1764086776.0
lk_news	2025-11-25-virakesarilk-caafa0b0	virakesarilk-caafa0b0	2025-11-25	மேல் கொத்மலை நீர்த்தேக்கத்தின் ஒரு வான் கதவு திறப்பு	https://www.virakesari.lk/article/231442	ta	virakesarilk	1764085140.0
lk_news	2025-11-25-virakesarilk-ec67396c	virakesarilk-ec67396c	2025-11-25	தென் ஆபிரிக்காவுடனான இரண்டாவது டெஸ்டில் இந்தியா தள்ளாடுகிறது	https://www.virakesari.lk/article/231440	ta	virakesarilk	1764081660.0
lk_news	2025-11-25-virakesarilk-87538119	virakesarilk-87538119	2025-11-25	இலங்கைக்கு தீர்மானம் மிக்க இன்றைய மும்முனை சர்வதேச ரி20 போட்டியில் ஸிம்பாப்வே முதலில் துடுப்பெடுத்தாடுகிறது	https://www.virakesari.lk/article/231439	ta	virakesarilk	1764081540.0
lk_news	2025-11-25-virakesarilk-748a2a06	virakesarilk-748a2a06	2025-11-25	ஆரோக்கியமான வாழ்க்கைக்கு உடற்பயிற்சி அவசியம் - கலாநிதி ஜயன்த தசநாயக்க	https://www.virakesari.lk/article/231438	ta	virakesarilk	1764081480.0
lk_news	2025-11-25-lankadeepalk-7c47dcb9	lankadeepalk-7c47dcb9	2025-11-25	වරාය ලාභයෙන් කෝටි 500 ක් භාණ්ඩාගාරයට	https://www.lankadeepa.lk/latest_news/වරය-ලභයන-කට-500-ක-භණඩගරයට/1-683879	si	lankadeepalk	1764080522.0
lk_news	2025-11-25-lankadeepalk-ab36dbfa	lankadeepalk-ab36dbfa	2025-11-25	විස්සයි විස්ස ලෝක කුසලානයේ සම-සත්කාරකත්වය ලංකාවට	https://www.lankadeepa.lk/news/වසසය-වසස-ලක-කසලනය-සම-සතකරකතවය-ලකවට/101-683878	si	lankadeepalk	1764079429.0
lk_news	2025-11-25-lankadeepalk-2d63e761	lankadeepalk-2d63e761	2025-11-25	අධ්‍යාපන වැය ශීර්ෂය සම්මතයි	https://www.lankadeepa.lk/news/අධයපන-වය-ශරෂය-සමමතය/101-683877	si	lankadeepalk	1764078586.0
lk_news	2025-11-25-lankadeepalk-eb248795	lankadeepalk-eb248795	2025-11-25	අත්අඩංගුවට ගන්නා විස මත් එවේලේම වනසන නීති ගෙනෙයි	https://www.lankadeepa.lk/news/අතඅඩගවට-ගනන-වස-මත-එවලම-වනසන-නත-ගනය/101-683876	si	lankadeepalk	1764078147.0
lk_news	2025-11-25-lankadeepalk-587e98e1	lankadeepalk-587e98e1	2025-11-25	තාඹුගල වරද පිළිගනී	https://www.lankadeepa.lk/news/තඹගල-වරද-පළගන/101-683875	si	lankadeepalk	1764077851.0
lk_news	2025-11-25-lankadeepalk-94b014a7	lankadeepalk-94b014a7	2025-11-25	ආපදාවලින් මරණ 10 ක්	https://www.lankadeepa.lk/news/ආපදවලන-මරණ-10-ක/101-683874	si	lankadeepalk	1764077435.0
lk_news	2025-11-25-tamilmirrorlk-fec02d9f	tamilmirrorlk-fec02d9f	2025-11-25	தொல்பொருள் பெயர் பலகைகள் அகற்றல் : மூவருக்கு பிணை	https://www.tamilmirror.lk/செய்திகள்/தொல்பொருள்-பெயர்-பலகைகள்-அகற்றல்-மூவருக்கு-பிணை/175-368486	ta	tamilmirrorlk	1764077010.0
lk_news	2025-11-25-lankadeepalk-6967f05c	lankadeepalk-6967f05c	2025-11-25	පෙර පාසල් අධ්‍යාපනයට රජයේ ඇල්ම බැල්ම වැඩිවෙයි	https://www.lankadeepa.lk/latest_news/පර-පසල-අධයපනයට-රජය-ඇලම-බලම-වඩවය/1-683873	si	lankadeepalk	1764076705.0
