doc_type	doc_id	num	date_str	description	url_metadata	lang	newspaper_id	time_ut
lk_news	2025-10-31-dailyftlk-72b58ea5	dailyftlk-72b58ea5	2025-10-31	Sri Lanka’s first plastic testing lab debuts	https://www.ft.lk/business/Sri-Lanka-s-first-plastic-testing-lab-debuts/34-783709	en	dailyftlk	1761871849.0
lk_news	2025-10-31-dailyftlk-345046f2	dailyftlk-345046f2	2025-10-31	UDA Chief new On’ally Holdings Chairman	https://www.ft.lk/business/UDA-Chief-new-On-ally-Holdings-Chairman/34-783708	en	dailyftlk	1761871757.0
lk_news	2025-10-31-dailyftlk-4ac5eae7	dailyftlk-4ac5eae7	2025-10-31	Sri Lanka, Japan and IOM unveil roadmap to strengthen traveller clearance, health security at seaports	https://www.ft.lk/business/Sri-Lanka-Japan-and-IOM-unveil-roadmap-to-strengthen-traveller-clearance-health-security-at-seaports/34-783707	en	dailyftlk	1761871640.0
lk_news	2025-10-31-dailyftlk-0b93ef38	dailyftlk-0b93ef38	2025-10-31	Fed cuts US interest rates again despite ‘flying blind’	https://www.ft.lk/business/Fed-cuts-US-interest-rates-again-despite-flying-blind/34-783706	en	dailyftlk	1761871540.0
lk_news	2025-10-31-dailyftlk-2df44e9f	dailyftlk-2df44e9f	2025-10-31	External headwinds weaken fiscal consolidation in Asia-Pacific – Fitch	https://www.ft.lk/business/External-headwinds-weaken-fiscal-consolidation-in-Asia-Pacific-Fitch/34-783705	en	dailyftlk	1761871520.0
lk_news	2025-10-31-dailyftlk-bb0359c5	dailyftlk-bb0359c5	2025-10-31	Sri Lanka, Netherlands conclude second round of political consultations	https://www.ft.lk/news/Sri-Lanka-Netherlands-conclude-second-round-of-political-consultations/56-783704	en	dailyftlk	1761871460.0
lk_news	2025-10-31-dailyftlk-b63c3777	dailyftlk-b63c3777	2025-10-31	Why some countries prosper, whilst others continue to remain poor and in chaos	https://www.ft.lk/columns/Why-some-countries-prosper-whilst-others-continue-to-remain-poor-and-in-chaos/4-783703	en	dailyftlk	1761871322.0
lk_news	2025-10-31-dailyftlk-f3d42bd6	dailyftlk-f3d42bd6	2025-10-31	Proposal for establishment of Advisory Board for revival of welding technology	https://www.ft.lk/columns/Proposal-for-establishment-of-Advisory-Board-for-revival-of-welding-technology/4-783702	en	dailyftlk	1761871076.0
lk_news	2025-10-31-dailyftlk-06c55600	dailyftlk-06c55600	2025-10-31	Peace – without justice in letting go of backlog?	https://www.ft.lk/columns/Peace-without-justice-in-letting-go-of-backlog/4-783701	en	dailyftlk	1761870648.0
lk_news	2025-10-31-dailyftlk-70bd3254	dailyftlk-70bd3254	2025-10-31	Why governments bet on long-term sports tourism partnerships	https://www.ft.lk/opinion/Why-governments-bet-on-long-term-sports-tourism-partnerships/14-783699	en	dailyftlk	1761870297.0
lk_news	2025-10-31-dailyftlk-6f27635b	dailyftlk-6f27635b	2025-10-31	From Kerala to Colombo: Lessons in building gender-responsive tourism	https://www.ft.lk/columns/From-Kerala-to-Colombo-Lessons-in-building-gender-responsive-tourism/4-783698	en	dailyftlk	1761870148.0
lk_news	2025-10-31-virakesarilk-3a015e4a	virakesarilk-3a015e4a	2025-10-31	இன்றைய வானிலை	https://www.virakesari.lk/article/229090	ta	virakesarilk	1761870000.0
lk_news	2025-10-31-dailyftlk-606430d9	dailyftlk-606430d9	2025-10-31	Indian-funded Mahatma Gandhi Model Village opens in Ampara	https://www.ft.lk/news/Indian-funded-Mahatma-Gandhi-Model-Village-opens-in-Ampara/56-783697	en	dailyftlk	1761869866.0
lk_news	2025-10-31-dailyftlk-302fdd56	dailyftlk-302fdd56	2025-10-31	Ravinatha appointed Executive Director of Regional Centre for Strategic Studies	https://www.ft.lk/news/Ravinatha-appointed-Executive-Director-of-Regional-Centre-for-Strategic-Studies/56-783696	en	dailyftlk	1761869798.0
lk_news	2025-10-31-dailyftlk-db052733	dailyftlk-db052733	2025-10-31	AAIB assesses crop damage amid heavy rains	https://www.ft.lk/news/AAIB-assesses-crop-damage-amid-heavy-rains/56-783695	en	dailyftlk	1761869719.0
lk_news	2025-10-30-virakesarilk-41a22a76	virakesarilk-41a22a76	2025-10-30	City of Dreams : இலங்கையின் சுற்றுலாப் பரப்பை மறுவடிவமைக்கும் ஒரு பிரமாண்டமான திட்டம்	https://www.virakesari.lk/article/229087	ta	virakesarilk	1761846300.0
lk_news	2025-10-30-virakesarilk-3e009a59	virakesarilk-3e009a59	2025-10-30	நடப்பு சம்பியன் அவுஸ்திரேலியாவை வீழ்த்திய இந்தியா, புதிய அணி உலக சம்பியனாவதை உறுதிசெய்தது	https://www.virakesari.lk/article/229089	ta	virakesarilk	1761846120.0
lk_news	2025-10-30-lankadeepalk-93479906	lankadeepalk-93479906	2025-10-30	සුරාබදු පස් දෙනා හත දක්වා රිමාන්ඩ්	https://www.lankadeepa.lk/news/සරබද-පස-දන-හත-දකව-රමනඩ/101-682396	si	lankadeepalk	1761846114.0
lk_news	2025-10-30-lankadeepalk-232075c6	lankadeepalk-232075c6	2025-10-30	නීතිඥවරිය ගැන තොරතුරු තවත් එළියට	https://www.lankadeepa.lk/news/නතඥවරය-ගන-තරතර-තවත-එළයට/101-682395	si	lankadeepalk	1761845876.0
lk_news	2025-10-30-lankadeepalk-dc15672d	lankadeepalk-dc15672d	2025-10-30	සුරාබදු නිලධාරින් මෙහෙයුමක් මුවාවෙන් මුදල් කොල්ල කාලා	https://www.lankadeepa.lk/news/සරබද-නලධරන-මහයමක-මවවන-මදල-කලල-කල/101-682394	si	lankadeepalk	1761845427.0
lk_news	2025-10-30-lankadeepalk-2ee478ae	lankadeepalk-2ee478ae	2025-10-30	චීන ආයෝජකයෝ පිරිසක් මෙරටට	https://www.lankadeepa.lk/news/චන-ආයජකය-පරසක-මරටට/101-682393	si	lankadeepalk	1761845078.0
lk_news	2025-10-30-lankadeepalk-6db33579	lankadeepalk-6db33579	2025-10-30	සිරගෙට ගෙනියන්න සපත්තුවලට දුරකතන දමා මසද්දී මාට්ටු	https://www.lankadeepa.lk/news/සරගට-ගනයනන-සපතතවලට-දරකතන-දම-මසදද-මටට/101-682392	si	lankadeepalk	1761844737.0
lk_news	2025-10-30-tamilmirrorlk-2181ab9e	tamilmirrorlk-2181ab9e	2025-10-30	போதைப்பொருள் ஒழிப்புப் பணியகத்தின் அதிகாரிகள் கைது	https://www.tamilmirror.lk/செய்திகள்/போதைப்பொருள்-ஒழிப்புப்-பணியகத்தின்-அதிகாரிகள்-கைது/175-367124	ta	tamilmirrorlk	1761841095.0
lk_news	2025-10-30-tamilmirrorlk-cf35de85	tamilmirrorlk-cf35de85	2025-10-30	2024 ஆம் ஆண்டுக்கான சனத்தொகை தரவுகள் வெளியீடு	https://www.tamilmirror.lk/செய்திகள்/2024-ஆம்-ஆண்டுக்கான-சனத்தொகை-தரவுகள்-வெளியீடு/175-367120	ta	tamilmirrorlk	1761836090.0
lk_news	2025-10-30-adalk-617cabfd	adalk-617cabfd	2025-10-30	වැලිගම සභාපති ඝාතනයේ සැකකරුවන් 7ක් රිමාන්ඩ්	https://www.ada.lk/breaking_news/වැලිගම-සභාපති-ඝාතනයේ-සැකකරුවන්-7ක්-රිමාන්ඩ්/11-419420	si	adalk	1761836055.0
lk_news	2025-10-30-virakesarilk-612caa3e	virakesarilk-612caa3e	2025-10-30	அவுஸ்திரேலியாவினால் இந்தியாவுக்கு 339 ஓட்டங்கள் வெற்றி இலக்கு	https://www.virakesari.lk/article/229088	ta	virakesarilk	1761834720.0
lk_news	2025-10-30-lankadeepalk-49ab659c	lankadeepalk-49ab659c	2025-10-30	ගිනි අවි තුනක් සමග අයෙක් මාට්ටු	https://www.lankadeepa.lk/latest_news/ගන-අව-තනක-සමග-අයක-මටට/1-682391	si	lankadeepalk	1761832657.0
lk_news	2025-10-30-lankadeepalk-3563dd10	lankadeepalk-3563dd10	2025-10-30	තවත් මූල්‍ය සමාගමක් ගැන විමර්ශන	https://www.lankadeepa.lk/latest_news/තවත-මලය-සමගමක-ගන-වමරශන/1-682390	si	lankadeepalk	1761832124.0
lk_news	2025-10-30-lankadeepalk-ceda14b8	lankadeepalk-ceda14b8	2025-10-30	ඇමෙරිකාවත් න්‍යෂ්ටික බලය වැඩි කරන්න යයි	https://www.lankadeepa.lk/latest_news/ඇමරකවත-නයෂටක-බලය-වඩ-කරනන-යය/1-682389	si	lankadeepalk	1761831938.0
lk_news	2025-10-30-lankadeepalk-294963b5	lankadeepalk-294963b5	2025-10-30	ඇමෙරිකාව චීනයට එරෙහි බද්ධ ටිකක් අඩු කරයි	https://www.lankadeepa.lk/latest_news/ඇමරකව-චනයට-එරහ-බදධටකක-අඩ-කරය/1-682388	si	lankadeepalk	1761831765.0
lk_news	2025-10-30-islandlk-217b7666	islandlk-217b7666	2025-10-30	Union Bank delivers LKR 1.2 Bn PBT for 9M 2025	http://island.lk/union-bank-delivers-lkr-1-2-bn-pbt-for-9m-2025/	en	islandlk	1761830580.0
lk_news	2025-10-30-islandlk-c94737b4	islandlk-c94737b4	2025-10-30	US Federal Reserve decision seen as impacting local stocks	http://island.lk/us-federal-reserve-decision-seen-as-impacting-local-stocks/	en	islandlk	1761830520.0
lk_news	2025-10-30-islandlk-3c2f9beb	islandlk-3c2f9beb	2025-10-30	Lanka Rating Agency assigns ‘A+ (f)’ Stability Rating to Astrue Money Market Fund	http://island.lk/lanka-rating-agency-assigns-a-f-stability-rating-to-astrue-money-market-fund/	en	islandlk	1761830520.0
lk_news	2025-10-30-islandlk-299a1231	islandlk-299a1231	2025-10-30	CEAT Kelani wins double honours at CNCI Achiever Awards 2025	http://island.lk/ceat-kelani-wins-double-honours-at-cnci-achiever-awards-2025/	en	islandlk	1761830520.0
lk_news	2025-10-30-virakesarilk-a010bbc6	virakesarilk-a010bbc6	2025-10-30	2026க்கான பொருளாதார வளர்ச்சி வீத எதிர்வுகூறல் 3.5 சதவீதத்திலிருந்து 3.1 சதவீதமாகக் குறைத்த ஐ.எம்.எப்.	https://www.virakesari.lk/article/229084	ta	virakesarilk	1761830460.0
lk_news	2025-10-30-virakesarilk-ee14a6f6	virakesarilk-ee14a6f6	2025-10-30	நாடு பாதாள உலகக் குழுக்களிடம் ஒப்படைக்கப்பட்டுள்ளது ; மக்கள் பிரதிநிதிகளுக்கு வெளியே சென்று சேவையாற்ற முடியாத நிலை - சஜித்	https://www.virakesari.lk/article/229086	ta	virakesarilk	1761830400.0
lk_news	2025-10-30-virakesarilk-76e9ed6c	virakesarilk-76e9ed6c	2025-10-30	துன்புறுத்தல்கள் தொடர்பில் பாராளுமன்ற ஊழியர்கள் வாக்குமூலம்	https://www.virakesari.lk/article/229085	ta	virakesarilk	1761830220.0
lk_news	2025-10-30-virakesarilk-c536df8d	virakesarilk-c536df8d	2025-10-30	தனிநபர்களின் வாழ்வை சிதைக்கும் கொடிய சமூகப் பிரச்சினையாகியுள்ள 'பட அடிப்படையிலான வன்முறை'	https://www.virakesari.lk/article/229083	ta	virakesarilk	1761829740.0
lk_news	2025-10-30-tamilmirrorlk-bdb4a497	tamilmirrorlk-bdb4a497	2025-10-30	நாளை வேலைநிறுத்தப் போராட்டம்	https://www.tamilmirror.lk/செய்திகள்/நாளை-வேலைநிறுத்தப்-போராட்டம்/175-367119	ta	tamilmirrorlk	1761829651.0
lk_news	2025-10-30-lankadeepalk-00ebcee2	lankadeepalk-00ebcee2	2025-10-30	ට්‍රම්ප් චීන ජනපති හමුවෙයි	https://www.lankadeepa.lk/news/ටරමප-චන-ජනපත-හමවය/101-682387	si	lankadeepalk	1761829619.0
lk_news	2025-10-30-tamilmirrorlk-6a55b062	tamilmirrorlk-6a55b062	2025-10-30	நாடளாவிய ரீதியில் வைத்தியர்கள் வேலை நிறுத்தம்	https://www.tamilmirror.lk/செய்திகள்/நாடளாவிய-ரீதியில்-வைத்தியர்கள்-வேலை-நிறுத்தம்/175-367118	ta	tamilmirrorlk	1761829444.0
lk_news	2025-10-30-virakesarilk-a325f41f	virakesarilk-a325f41f	2025-10-30	தெற்கு அரசியல்வாதிகள் குழு இன்று வடக்குக்கு விஜயம் : வடக்கின் அரசியல், பொருளாதார இயங்குகை பற்றித் தெளிவூட்டுவதே நோக்கம்	https://www.virakesari.lk/article/229082	ta	virakesarilk	1761829320.0
lk_news	2025-10-30-virakesarilk-138fddc8	virakesarilk-138fddc8	2025-10-30	பாதாள உலகக் கும்பல்களை அழிக்கும் போர்வையில் எதிர்க்கட்சிகள் முடக்கப்படுகின்றன - ஹர்ஷன ராஜகருணா	https://www.virakesari.lk/article/229075	ta	virakesarilk	1761828000.0
lk_news	2025-10-30-virakesarilk-ee94e0ad	virakesarilk-ee94e0ad	2025-10-30	சிலம்பரசனின் குரலில் வெளியான 'ஆரோமலே' பட முன்னோட்டம்	https://www.virakesari.lk/article/229071	ta	virakesarilk	1761827460.0
lk_news	2025-10-30-virakesarilk-c10647bd	virakesarilk-c10647bd	2025-10-30	'முழு நாடுமே ஒன்றாக - தேசிய செயற்பாடு' தொனிப்பொருளின் கீழ் தேசிய போதைப்பொருள் ஒழிப்பு செயற்றிட்டம்	https://www.virakesari.lk/article/229070	ta	virakesarilk	1761827460.0
lk_news	2025-10-30-virakesarilk-7cc3b238	virakesarilk-7cc3b238	2025-10-30	சேத்தன் சீனு நடித்திருக்கும் 'வள்ளுவன்' திரைப்படத்தின் இசை, முன்னோட்டம் வெளியீடு	https://www.virakesari.lk/article/229067	ta	virakesarilk	1761827340.0
lk_news	2025-10-30-virakesarilk-4183b97e	virakesarilk-4183b97e	2025-10-30	கூட்டு எதிரணியினரின் நுகேகொடைக் கூட்டம் பொதுமக்களுக்கு பயனற்றது - கே.டி. லால்காந்த	https://www.virakesari.lk/article/229066	ta	virakesarilk	1761827280.0
lk_news	2025-10-30-virakesarilk-f04ddf68	virakesarilk-f04ddf68	2025-10-30	பொலிஸ் மாஅதிபரை முன்னிறுத்தி ஆட்சியை முன்கொண்டு செல்ல முயற்சிக்கும் அரசு - ஐக்கிய மக்கள் சக்தி	https://www.virakesari.lk/article/229063	ta	virakesarilk	1761827040.0
lk_news	2025-10-30-virakesarilk-9f9f5647	virakesarilk-9f9f5647	2025-10-30	பிரகீத் எக்னலிகொட வழக்கு : கொழும்பு உயர்நீதிமன்றம் டிசம்பர் 5 விசாரணை உத்தரவு	https://www.virakesari.lk/article/229062	ta	virakesarilk	1761826920.0
lk_news	2025-10-30-virakesarilk-e1f6e795	virakesarilk-e1f6e795	2025-10-30	வட மாகாணத்தில் மனிதாபிமான கண்ணிவெடி அகற்றும் நடவடிக்கைகளுக்கு ஜப்பான் ஆதரவு!	https://www.virakesari.lk/article/229077	ta	virakesarilk	1761826560.0
lk_news	2025-10-30-virakesarilk-f6aaf66f	virakesarilk-f6aaf66f	2025-10-30	இந்தியாவின் மேம்படுத்தப்பட்ட நிதியுதவி திட்டம் : கிழக்குப் பல்கலைக்கழக மாணவர்களுக்கு!	https://www.virakesari.lk/article/229081	ta	virakesarilk	1761826500.0
lk_news	2025-10-30-virakesarilk-b2d9c487	virakesarilk-b2d9c487	2025-10-30	அமைச்சர் அனுர கருணாதிலகவின் இந்திய விஜயம் : கடல்சார் ஒத்துழைப்பில் கவனம்	https://www.virakesari.lk/article/229079	ta	virakesarilk	1761826380.0
lk_news	2025-10-30-virakesarilk-78dc4fe5	virakesarilk-78dc4fe5	2025-10-30	பொதுச் சேவையை விட்டு விலகிய மருத்துவ அதிகாரிகளால் 1277 மில்லியன் அரசாங்கத்துக்கு செலுத்தப்பட வேண்டியுள்ளது -  தேசிய கணக்காய்வு அலுவலகம்	https://www.virakesari.lk/article/229061	ta	virakesarilk	1761826080.0
lk_news	2025-10-30-virakesarilk-3de541cf	virakesarilk-3de541cf	2025-10-30	‘AKEBONO’ கப்பல் குழுவினர் இலங்கை கடற்படையுடன் இணைந்து கடற்கரை துப்புரவுப் பணிகளை முன்னெடுப்பு	https://www.virakesari.lk/article/229060	ta	virakesarilk	1761825960.0
lk_news	2025-10-30-virakesarilk-dd635da0	virakesarilk-dd635da0	2025-10-30	பாடசாலை நேரத்தை நீடிக்கும் தீர்மானத்தை அரசாங்கம் நீக்கிக்கொள்ளாவிட்டால் பணிப்பகிஷ்கரிப்பு - இலங்கை ஆசிரியர் சங்கம்	https://www.virakesari.lk/article/229059	ta	virakesarilk	1761825780.0
lk_news	2025-10-30-virakesarilk-9b6925d9	virakesarilk-9b6925d9	2025-10-30	மீண்டும் ‘உடை’ விவகாரம் குறித்து வாய் திறந்துள்ள ஞானசார தேரர்….!	https://www.virakesari.lk/article/229078	ta	virakesarilk	1761825480.0
lk_news	2025-10-30-tamilmirrorlk-885bc8e5	tamilmirrorlk-885bc8e5	2025-10-30	டயானா கமகேவுக்கு எதிரான வழக்கு விசாரணை ஆரம்பம்	https://www.tamilmirror.lk/செய்திகள்/டயானா-கமகேவுக்கு-எதிரான-வழக்கு-விசாரணை-ஆரம்பம்/175-367117	ta	tamilmirrorlk	1761825452.0
lk_news	2025-10-30-virakesarilk-650337bf	virakesarilk-650337bf	2025-10-30	"""செம்மணி உடனிருப்பு வேண்டுதல்"" : அணையா தீபம் சுற்றுவட்டப் பகுதியில் போராட்டம்"	https://www.virakesari.lk/article/229076	ta	virakesarilk	1761825180.0
lk_news	2025-10-30-tamilmirrorlk-4c709968	tamilmirrorlk-4c709968	2025-10-30	ஹந்துனெத்தியின் மனு விசாரணைக்கு	https://www.tamilmirror.lk/செய்திகள்/ஹந்துனெத்தியின்-மனு-விசாரணைக்கு/175-367116	ta	tamilmirrorlk	1761824929.0
lk_news	2025-10-30-virakesarilk-c725d078	virakesarilk-c725d078	2025-10-30	கடலில் கவிழ்ந்த கேஷான் புதா 1 மீன்பிடிக் கப்பல் -  மீனவர்களை மீட்கப் புறப்பட்டது சிதுரல கப்பல்	https://www.virakesari.lk/article/229056	ta	virakesarilk	1761824400.0
lk_news	2025-10-30-virakesarilk-477fe877	virakesarilk-477fe877	2025-10-30	போதைப்பொருள் வலையமைப்பிலிருந்து உடனடியாக விலகுங்கள் அல்லது நாம் உங்களை விலக்குவோம் - பாதுகாப்பு துறை உள்ளிட்ட அரச அதிகாரிகளுக்கு ஜனாதிபதி எச்சரிக்கை!	https://www.virakesari.lk/article/229072	ta	virakesarilk	1761824280.0
lk_news	2025-10-30-virakesarilk-fc769b4e	virakesarilk-fc769b4e	2025-10-30	ரி ரி எஃப் வாசன் நடிக்கும் 'இந்தியன் பீனல் லா' படத்தின் அப்டேட்ஸ்	https://www.virakesari.lk/article/229073	ta	virakesarilk	1761824220.0
lk_news	2025-10-30-virakesarilk-a4e2b79e	virakesarilk-a4e2b79e	2025-10-30	யாழில் ஒப்பந்த காலம் நிறைவடைந்தும் வெளியேறாத நிறுவனம் - மீனவர்கள் போராட்டம்!	https://www.virakesari.lk/article/229068	ta	virakesarilk	1761824220.0
lk_news	2025-10-30-virakesarilk-aa865582	virakesarilk-aa865582	2025-10-30	போதைப்பொருள் பற்றிய தகவல்களைத் தெரிவிக்க துரித தொலைபேசி இலக்கம்!	https://www.virakesari.lk/article/229074	ta	virakesarilk	1761824160.0
lk_news	2025-10-30-virakesarilk-7896bf24	virakesarilk-7896bf24	2025-10-30	மின்சார சபை பற்றிய விசாரணை தொடர்பாக LTL நிறுவனம் கோப் குழுவிற்கு அழைப்பு	https://www.virakesari.lk/article/229058	ta	virakesarilk	1761824100.0
lk_news	2025-10-30-virakesarilk-ee691561	virakesarilk-ee691561	2025-10-30	போதைப்பொருட்களுக்கு எதிரான சவாலை எதிர்கொள்ளத் தயார் - 'முழு நாடுமே ஒன்றாக' தேசிய செயற்பாட்டு அங்குரார்ப்பண நிகழ்வில்  ஜனாதிபதி வலியுறுத்தல்	https://www.virakesari.lk/article/229064	ta	virakesarilk	1761823740.0
lk_news	2025-10-30-virakesarilk-bd141819	virakesarilk-bd141819	2025-10-30	வல்பொலகந்த கிராமத்தில் குரங்குகளின் அட்டகாசம் அதிகரிப்பு ; கிராம மக்கள் விசனம்!	https://www.virakesari.lk/article/229057	ta	virakesarilk	1761822540.0
lk_news	2025-10-30-virakesarilk-c07a1d2f	virakesarilk-c07a1d2f	2025-10-30	இலங்கையின் மொத்த சனத்தொகை குறித்து வெளியான தகவல் !	https://www.virakesari.lk/article/229054	ta	virakesarilk	1761822420.0
lk_news	2025-10-30-virakesarilk-51f2d552	virakesarilk-51f2d552	2025-10-30	அவுஸ்திரேலிய இளம் கிரிக்கெட் வீரர்  பென் ஆஸ்டின் உயிரிழப்பு!	https://www.virakesari.lk/article/229051	ta	virakesarilk	1761822300.0
lk_news	2025-10-30-lankadeepalk-81a02c71	lankadeepalk-81a02c71	2025-10-30	ශ්‍රීපාලියේ “පර්යේෂණ සම්මන්ත්‍රණය“ අරුන්දතියේදී	https://www.lankadeepa.lk/ld_events/ශරපලය-පරයෂණ-සමමනතරණය-අරනදතයද/244-682386	si	lankadeepalk	1761821950.0
lk_news	2025-10-30-lankadeepalk-e35795b5	lankadeepalk-e35795b5	2025-10-30	මත්තල ගුවන්තොටට හොද සහතිකයක්	https://www.lankadeepa.lk/news/මතතල-ගවනතටට-හද-සහතකයක/101-682385	si	lankadeepalk	1761821484.0
lk_news	2025-10-30-tamilmirrorlk-0141231f	tamilmirrorlk-0141231f	2025-10-30	“தனியார் நிறுவனமே வெளியேறு”	https://www.tamilmirror.lk/செய்திகள்/தனியார்-நிறுவனமே-வெளியேறு/175-367115	ta	tamilmirrorlk	1761821133.0
lk_news	2025-10-30-lankadeepalk-8a0b2638	lankadeepalk-8a0b2638	2025-10-30	විෂ මත ගැන තොරතුරු දෙන්න අංකයක්	https://www.lankadeepa.lk/news/වෂ-මත-ගන-තරතර-දනන-අකයක/101-682384	si	lankadeepalk	1761820134.0
lk_news	2025-10-30-tamilmirrorlk-f572cfb4	tamilmirrorlk-f572cfb4	2025-10-30	1818 க்கு அழைக்கவும்	https://www.tamilmirror.lk/செய்திகள்/1818-க்கு-அழைக்கவும்/175-367114	ta	tamilmirrorlk	1761820047.0
lk_news	2025-10-30-lankadeepalk-d9705792	lankadeepalk-d9705792	2025-10-30	පළාත් සභාව දේශපාලන විකෘතියක්	https://www.lankadeepa.lk/features/පළත-සභව-දශපලන-වකතයක/2-682382	si	lankadeepalk	1761819742.0
lk_news	2025-10-30-adalk-d502c921	adalk-d502c921	2025-10-30	ජාතික ආරක්ෂාව පිරිහිලා	https://www.ada.lk/breaking_news/ජාතික-ආරක්ෂාව-පිරිහිලා/11-419419	si	adalk	1761819571.0
lk_news	2025-10-30-lankadeepalk-dd5dddbd	lankadeepalk-dd5dddbd	2025-10-30	දුම්රිය එන්ජින් 103ක් ’’පැන්ෂන්’’  යවලා	https://www.lankadeepa.lk/news/දමරය-එනජන-103ක-පනෂන-යවල/101-682381	si	lankadeepalk	1761819352.0
