doc_type	doc_id	num	date_str	description	url_metadata	lang	newspaper_id	time_ut
lk_news	2025-10-31-virakesarilk-c1e9c8c9	virakesarilk-c1e9c8c9	2025-10-31	வணிக கடல் பாதுகாப்பு குழுக்களிடமிருந்து இலங்கை கடற்படைக்கு ஆயுதங்கள், உபகரணங்கள் கையளிப்பு	https://www.virakesari.lk/article/229135	ta	virakesarilk	1761900180.0
lk_news	2025-10-31-adalk-b0be607e	adalk-b0be607e	2025-10-31	සමාජ මාධ්‍ය දැන්වීම් මගින් විදේශ රැකියා වංචා වැඩිවෙලා	https://www.ada.lk/breaking_news/සමාජ-මාධ්‍ය-දැන්වීම්-මගින්-විදේශ-රැකියා-වංචා-වැඩිවෙලා/11-419433	si	adalk	1761900057.0
lk_news	2025-10-31-virakesarilk-d8a487be	virakesarilk-d8a487be	2025-10-31	மருதானையில் தீ விபத்து!	https://www.virakesari.lk/article/229134	ta	virakesarilk	1761899760.0
lk_news	2025-10-31-adalk-f662112c	adalk-f662112c	2025-10-31	ආරක්ෂාව ගැන විපක්ෂ මන්ත්‍රිගේ ඉල්ලීම් ජනපතිට කියන බව පොලිස්පති කියයි	https://www.ada.lk/breaking_news/ආරක්ෂාව-ගැන-විපක්ෂ-මන්ත්‍රිගේ-ඉල්ලීම්-ජනපතිට-කියන-බව-පොලිස්පති-කියයි/11-419432	si	adalk	1761899593.0
lk_news	2025-10-31-tamilmirrorlk-8fa84ce2	tamilmirrorlk-8fa84ce2	2025-10-31	இ.போ.ச பேருந்து சாரதி ஒருவர் அதிரடியாக கைது	https://www.tamilmirror.lk/செய்திகள்/இ-போ-ச-பேருந்து-சாரதி-ஒருவர்-அதிரடியாக-கைது/175-367135	ta	tamilmirrorlk	1761899546.0
lk_news	2025-10-31-virakesarilk-4326e0c7	virakesarilk-4326e0c7	2025-10-31	"பிரிட்டன் இளவரசர் அன்றூவின் பட்டங்களை பறிக்க மன்னர் சார்லஸ் உத்தரவு ; ""இது முன்னெப்போதும் கிடைக்காத வெற்றி!"" - கண்ணீருடன் வர்ஜீனியாவின் சகோதரர்"	https://www.virakesari.lk/article/229136	ta	virakesarilk	1761899460.0
lk_news	2025-10-31-virakesarilk-f1a69911	virakesarilk-f1a69911	2025-10-31	சிறைச்சாலை கைதிக்கு புகையிலை, கையடக்கத் தோலைபேசிகளை கொடுக்க முயன்ற இருவர் கைது!	https://www.virakesari.lk/article/229137	ta	virakesarilk	1761899100.0
lk_news	2025-10-31-adalk-704be5a3	adalk-704be5a3	2025-10-31	මුල් මාස අටට ලොකු ඵණු ටොන් 217883ක් ගෙන්වලා	https://www.ada.lk/breaking_news/මුල්-මාස-අටට-ලොකු-ඵණු-ටොන්-217883ක්-ගෙන්වලා/11-419431	si	adalk	1761897008.0
lk_news	2025-10-31-virakesarilk-66f3f00e	virakesarilk-66f3f00e	2025-10-31	தென்னந்தோப்பில் சிதைவடைந்த நிலையில் இளைஞனின் சடலம் மீட்பு!	https://www.virakesari.lk/article/229129	ta	virakesarilk	1761896520.0
lk_news	2025-10-31-lankadeepalk-456f34ad	lankadeepalk-456f34ad	2025-10-31	වෙළෙඳ ඇමති ත්‍රිපෝෂ සමාගමට	https://www.lankadeepa.lk/news/වළඳ-ඇමත-තරපෂ-සමගමට/101-682433	si	lankadeepalk	1761895663.0
lk_news	2025-10-31-adalk-ecfddb94	adalk-ecfddb94	2025-10-31	හෙට්ටිවීදියේ දස කෝටියක කොල්ලයට සුරාබදු නිලධාරීන් 05ක් අල්ලයි	https://www.ada.lk/breaking_news/හෙට්ටිවීදියේ-දස-කෝටියක-කොල්ලයට-සුරාබදු-නිලධාරීන්-05ක්-අල්ලයි/11-419430	si	adalk	1761895655.0
lk_news	2025-10-31-virakesarilk-bc8be496	virakesarilk-bc8be496	2025-10-31	போதைப்பொருள் சுற்றிவளைப்பு ; பலர் கைது!	https://www.virakesari.lk/article/229126	ta	virakesarilk	1761895620.0
lk_news	2025-10-31-lankadeepalk-6b2a0770	lankadeepalk-6b2a0770	2025-10-31	වරෙන්තුවට ඇල්ලුවැයි පවුලේ අය පොලිසියේ යකා නටලා	https://www.lankadeepa.lk/news/වරනතවට-ඇලලවය-පවල-අය-පලසය-යක-නටල/101-682432	si	lankadeepalk	1761895572.0
lk_news	2025-10-31-virakesarilk-bfe36fa5	virakesarilk-bfe36fa5	2025-10-31	மன்னார் நகர சபையினால் அகழ்வு செய்யப்பட்ட திண்மக்கழிவுகள் கொட்டும் இடத்தில் தொடர் பிரச்சினை	https://www.virakesari.lk/article/229128	ta	virakesarilk	1761895500.0
lk_news	2025-10-31-lankadeepalk-e46c0aa8	lankadeepalk-e46c0aa8	2025-10-31	කෝටි තුනක මත්ද්‍රව්‍ය සමඟ තිදෙනකු අල්ලයි	https://www.lankadeepa.lk/news/කට-තනක-මතදරවය-සමඟ-තදනක-අලලය/101-682431	si	lankadeepalk	1761895467.0
lk_news	2025-10-31-virakesarilk-ac82476c	virakesarilk-ac82476c	2025-10-31	இந்தாண்டு சுங்கத் திணைக்களத்தினால் இரண்டு ரில்லியன் ரூபாய் வருமானம்	https://www.virakesari.lk/article/229123	ta	virakesarilk	1761895380.0
lk_news	2025-10-31-virakesarilk-6ca21785	virakesarilk-6ca21785	2025-10-31	“ருவுல் குமார ”வின் சகா போதைப்பொருட்களுடன் கைது!	https://www.virakesari.lk/article/229127	ta	virakesarilk	1761894960.0
lk_news	2025-10-31-adalk-c3303119	adalk-c3303119	2025-10-31	රැවුල් කුමාරගේ ගෝලයෙක් ලක්ෂ 20ක⁣ මත්ද්‍රව්‍ය සමග අල්ලයි	https://www.ada.lk/breaking_news/රැවුල්-කුමාරගේ-ගෝලයෙක්-ලක්ෂ-20ක⁣-මත්ද්‍රව්‍ය-සමග-අල්ලයි/11-419429	si	adalk	1761894777.0
lk_news	2025-10-31-virakesarilk-bca338e0	virakesarilk-bca338e0	2025-10-31	30 ஆண்டுகள் கழித்து அணு ஆயுத சோதனை நடத்தவுள்ள அமெரிக்கா! - ட்ரம்ப் அதிரடி உத்தரவு	https://www.virakesari.lk/article/229125	ta	virakesarilk	1761894240.0
lk_news	2025-10-31-lankadeepalk-c0226644	lankadeepalk-c0226644	2025-10-31	වාණිජ නීතිගත සංස්ථාවේ හිටපු සභාපති අත්අඩංගුවට	https://www.lankadeepa.lk/news/වණජ-නතගත-සසථව-හටප-සභපත-අතඅඩගවට/101-682426	si	lankadeepalk	1761894175.0
lk_news	2025-10-31-lankadeepalk-0a343bb6	lankadeepalk-0a343bb6	2025-10-31	වාණිජ නීතිගත සංස්ථාවේ සභාපති අත්අඩංගුවට	https://www.lankadeepa.lk/news/වණජ-නතගත-සසථව-සභපත-අතඅඩගවට/101-682426	si	lankadeepalk	1761894175.0
lk_news	2025-10-31-virakesarilk-f33f26b4	virakesarilk-f33f26b4	2025-10-31	காட்டு மிருகங்களை வேட்டையாடி இறைச்சிகளை உணவகங்கள், சுற்றுலா விடுதிகளுக்கு விற்பனை செய்தவர்கள் கைது!	https://www.virakesari.lk/article/229124	ta	virakesarilk	1761893940.0
lk_news	2025-10-31-adalk-248f4d88	adalk-248f4d88	2025-10-31	Voyage Sri Lanka 2025 සමුළුව සාර්ථකව අවසන්	https://www.ada.lk/business/Voyage-Sri-Lanka-2025-සමුළුව-සාර්ථකව-අවසන්/7-419427	si	adalk	1761893797.0
