doc_type	doc_id	num	date_str	description	url_metadata	lang	newspaper_id	time_ut
lk_news	2025-10-08-dailyftlk-0ff1cb69	dailyftlk-0ff1cb69	2025-10-08	IDL appoints Indhu Selvaratnam as Deputy Chairperson	https://www.ft.lk/business/IDL-appoints-Indhu-Selvaratnam-as-Deputy-Chairperson/34-782695	en	dailyftlk	1759882428.0
lk_news	2025-10-08-dailyftlk-7781155b	dailyftlk-7781155b	2025-10-08	Inaugural South Asia Bitumen Market Conference in Colombo next month	https://www.ft.lk/business/Inaugural-South-Asia-Bitumen-Market-Conference-in-Colombo-next-month/34-782694	en	dailyftlk	1759882280.0
lk_news	2025-10-08-dailyftlk-f01525f3	dailyftlk-f01525f3	2025-10-08	Sri Lanka, South Africa reaffirm commitment to strengthen bilateral ties	https://www.ft.lk/news/Sri-Lanka-South-Africa-reaffirm-commitment-to-strengthen-bilateral-ties/56-782693	en	dailyftlk	1759882237.0
lk_news	2025-10-08-dailyftlk-5ba7457c	dailyftlk-5ba7457c	2025-10-08	Govt. clarifies stance on vehicles assigned for former Presidents’ security	https://www.ft.lk/news/Govt-clarifies-stance-on-vehicles-assigned-for-former-Presidents-security/56-782692	en	dailyftlk	1759882166.0
lk_news	2025-10-08-dailyftlk-50615cbd	dailyftlk-50615cbd	2025-10-08	CIABOC gets digital Case Tracking System to boost transparency, efficiency	https://www.ft.lk/news/CIABOC-gets-digital-Case-Tracking-System-to-boost-transparency-efficiency/56-782691	en	dailyftlk	1759882087.0
lk_news	2025-10-08-dailyftlk-2ff90e12	dailyftlk-2ff90e12	2025-10-08	Jaffna lawyers protest Police action	https://www.ft.lk/news/Jaffna-lawyers-protest-Police-action/56-782690	en	dailyftlk	1759882031.0
lk_news	2025-10-08-dailyftlk-120b594a	dailyftlk-120b594a	2025-10-08	AIIB President commits to Sri Lanka’s development	https://www.ft.lk/news/AIIB-President-commits-to-Sri-Lanka-s-development/56-782689	en	dailyftlk	1759881986.0
lk_news	2025-10-08-dailyftlk-17c058f6	dailyftlk-17c058f6	2025-10-08	TNA MP questions CIABOC Chief’s appointment, cites conflicts in Constitutional Council	https://www.ft.lk/news/TNA-MP-questions-CIABOC-Chief-s-appointment-cites-conflicts-in-Constitutional-Council/56-782688	en	dailyftlk	1759881921.0
lk_news	2025-10-08-dailyftlk-38162ab3	dailyftlk-38162ab3	2025-10-08	SL to host int’l conference on wetlands, mental health, and sustainable tourism	https://www.ft.lk/news/SL-to-host-int-l-conference-on-wetlands-mental-health-and-sustainable-tourism/56-782687	en	dailyftlk	1759881859.0
lk_news	2025-10-08-dailyftlk-84c5da45	dailyftlk-84c5da45	2025-10-08	Police warn of rising online fraud via Telegram, WhatsApp	https://www.ft.lk/news/Police-warn-of-rising-online-fraud-via-Telegram-WhatsApp/56-782686	en	dailyftlk	1759881837.0
lk_news	2025-10-08-dailyftlk-057f58ff	dailyftlk-057f58ff	2025-10-08	Sri Lanka must open up and trade its way to recovery: Economist	https://www.ft.lk/news/Sri-Lanka-must-open-up-and-trade-its-way-to-recovery-Economist/56-782685	en	dailyftlk	1759881812.0
lk_news	2025-10-08-dailyftlk-57b84c13	dailyftlk-57b84c13	2025-10-08	Govt. addressing shortage of dialysis needles – Health Minister	https://www.ft.lk/news/Govt-addressing-shortage-of-dialysis-needles-Health-Minister/56-782684	en	dailyftlk	1759881719.0
lk_news	2025-10-08-dailyftlk-c2824602	dailyftlk-c2824602	2025-10-08	Govt. raises taxes on gambling, doubles casino entry fee for Lankans	https://www.ft.lk/news/Govt-raises-taxes-on-gambling-doubles-casino-entry-fee-for-Lankans/56-782683	en	dailyftlk	1759881648.0
lk_news	2025-10-08-virakesarilk-4fcfe6f0	virakesarilk-4fcfe6f0	2025-10-08	தொண்டமானாறு உவர்நீர்த் தடுப்பணையால் வெள்ளப்பாதிப்பனை எதிர்கொள்வோருக்கு தீர்வு முன்வைக்கப்படவேண்டும் - ஆளுநரிடம் தவிசாளர் நிரோஷ் கோரிக்கை	https://www.virakesari.lk/article/227172	ta	virakesarilk	1759875900.0
lk_news	2025-10-08-virakesarilk-320656f6	virakesarilk-320656f6	2025-10-08	மன்னார் மற்றும் முல்லைத்தீவு மாவட்ட பொது மருத்துவமனைகளையும் சமச்சீரான சேவைவழங்கலில் இணையுங்கள்; அமைச்சர் நளிந்த ஜெயதிஸ்ஸவிடம் வலியுறுத்திய - ரவிகரன் எம்.பி	https://www.virakesari.lk/article/227171	ta	virakesarilk	1759875660.0
lk_news	2025-10-08-virakesarilk-db71206a	virakesarilk-db71206a	2025-10-08	இரத்த சுத்திகரிப்பு சிகிச்சைக்கான ஃபிஸ்டுலா ஊசிக்கு தட்டுபாடு இல்லை - பிரதி அமைச்சரை் ஹன்சக விஜேமுனி	https://www.virakesari.lk/article/227170	ta	virakesarilk	1759875360.0
lk_news	2025-10-08-virakesarilk-59b5104f	virakesarilk-59b5104f	2025-10-08	சரத் பொன்சேக்காவுக்கு ஏன் சர்வதேசம் தடை விதிக்கவில்லை? மஹிந்த மீதான குற்றச்சாட்டு தொடர்பில் பொதுஜன பெரமுன கேள்வி	https://www.virakesari.lk/article/227169	ta	virakesarilk	1759875180.0
lk_news	2025-10-08-virakesarilk-457a928e	virakesarilk-457a928e	2025-10-08	வசீம் தாஜூதீன் படுகொலை: உண்மை வெளியாகும் போது ராஜபக்ஷர்கள் கலக்கமடைவது ஆச்சரியமல்ல - மஹிந்த ஜயசிங்க	https://www.virakesari.lk/article/227168	ta	virakesarilk	1759874940.0
lk_news	2025-10-08-virakesarilk-914cc65b	virakesarilk-914cc65b	2025-10-08	2009 ஆம் ஆண்டுக்கு பின்னர் வடக்கில் செய்தவற்றின் பிரதிபலன் இன்று  தெற்கில் கிடைக்கிறது - சத்தியலிங்கம்	https://www.virakesari.lk/article/227167	ta	virakesarilk	1759874160.0
lk_news	2025-10-08-virakesarilk-7f1d3a0e	virakesarilk-7f1d3a0e	2025-10-08	யாழ்ப்பாணம் பாஷையூரில் ஹெரோயினுடன் இளைஞர் கைது – மூன்று வாள்கள் பறிமுதல்	https://www.virakesari.lk/article/227166	ta	virakesarilk	1759868340.0
lk_news	2025-10-08-virakesarilk-25b0c781	virakesarilk-25b0c781	2025-10-08	இமாச்சல் மண்சரிவில் உயிரிழப்புகள் 18 ஆக உயர்வு	https://www.virakesari.lk/article/227165	ta	virakesarilk	1759868220.0
lk_news	2025-10-07-islandlk-b520175f	islandlk-b520175f	2025-10-07	Aitken Spence Logistics wins big at CILT Awards 2025	http://island.lk/aitken-spence-logistics-wins-big-at-cilt-awards-2025/	en	islandlk	1759858680.0
lk_news	2025-10-07-islandlk-f63c5b9c	islandlk-f63c5b9c	2025-10-07	LB Finance to raise Rs. 20 billion through debentures; selling pressure brings down indices	http://island.lk/lb-finance-to-raise-rs-20-billion-through-debentures-selling-pressure-brings-down-indices/	en	islandlk	1759858560.0
lk_news	2025-10-07-islandlk-cb6397d7	islandlk-cb6397d7	2025-10-07	Telbedde Estate crowned Overall Gold Winner at Ceylon Specialty Estate Tea Awards 2025	http://island.lk/telbedde-estate-crowned-overall-gold-winner-at-ceylon-specialty-estate-tea-awards-2025/	en	islandlk	1759858560.0
lk_news	2025-10-07-islandlk-42688b70	islandlk-42688b70	2025-10-07	Inspiring Sri Lanka’s children to dream big on World Children’s Day	http://island.lk/inspiring-sri-lankas-children-to-dream-big-on-world-childrens-day-2/	en	islandlk	1759858500.0
lk_news	2025-10-07-islandlk-05ceaf87	islandlk-05ceaf87	2025-10-07	MOVA partners with FILMBASE to bring next-generation Smart Glass & LED Film Solutions to Sri Lanka	http://island.lk/mova-partners-with-filmbase-to-bring-next-generation-smart-glass-led-film-solutions-to-sri-lanka/	en	islandlk	1759858500.0
lk_news	2025-10-07-tamilmirrorlk-cd2936ae	tamilmirrorlk-cd2936ae	2025-10-07	”காணாமல் ஆக்கப்பட்டோர் வழக்கு விசாரணைகளில் முன்னேற்றம் இல்லை”	https://www.tamilmirror.lk/செய்திகள்/காணாமல்-ஆக்கப்பட்டோர்-வழக்கு-விசாரணைகளில்-முன்னேற்றம்-இல்லை/175-365927	ta	tamilmirrorlk	1759855375.0
lk_news	2025-10-07-virakesarilk-b412b639	virakesarilk-b412b639	2025-10-07	ஒக்டோபர் 7 தாக்குதலின் இரண்டாம் ஆண்டு நிறைவு : டிரம்ப்பின் 20 அம்ச திட்டம் மூலம் அமைதியை நிலைநாட்ட உறுதி	https://www.virakesari.lk/article/227164	ta	virakesarilk	1759853100.0
lk_news	2025-10-07-tamilmirrorlk-7f11ce3b	tamilmirrorlk-7f11ce3b	2025-10-07	பொலிஸ் அதிகாரியை கைது செய்த விசேட அதிரடிப்படையினர்	https://www.tamilmirror.lk/செய்திகள்/பொலிஸ்-அதிகாரியை-கைது-செய்த-விசேட-அதிரடிப்படையினர்/175-365914	ta	tamilmirrorlk	1759853041.0
lk_news	2025-10-07-virakesarilk-31870b4d	virakesarilk-31870b4d	2025-10-07	பரிசோதனைக்குட்படுத்தாது விடுவித்த 323 கொள்கலன்கள் தொடர்பில் ஆராய விசேட தெரிவுக்குழுவொன்றை நியமியுங்கள்!	https://www.virakesari.lk/article/227163	ta	virakesarilk	1759852620.0
lk_news	2025-10-07-virakesarilk-c228a608	virakesarilk-c228a608	2025-10-07	ஜனாதிபதியை சந்தித்த ஆசிய முதலீட்டு வங்கித் தலைவர் – இலங்கையின் பசுமை வலுசக்தித் துறைக்கு ஆதரவு உறுதி	https://www.virakesari.lk/article/227162	ta	virakesarilk	1759852320.0
lk_news	2025-10-07-lankadeepalk-2c68317f	lankadeepalk-2c68317f	2025-10-07	හරිත බලශක්තිය නංවන්න උදව් කරනවා	https://www.lankadeepa.lk/news/හරත-බලශකතය-නවනන-උදව-කරනව/101-680886	si	lankadeepalk	1759847627.0
lk_news	2025-10-07-virakesarilk-b5f55b06	virakesarilk-b5f55b06	2025-10-07	கிரிக்கெட் சபை  தொடர்பில் ஜனாதிபதி அன்று முன்வைத்த குற்றச்சாட்டுகளுக்கு இன்று எடுத்த நடவடிக்கை என்ன - அஜித் பி.பெரேரா கேள்வி	https://www.virakesari.lk/article/227161	ta	virakesarilk	1759846260.0
lk_news	2025-10-07-virakesarilk-1f75ac63	virakesarilk-1f75ac63	2025-10-07	தீர்வுக்கான நடவடிக்கைகளை முன்னெடுத்தால் சர்வதேச அழுத்தங்கள் படிப்படியாகக் குறையும் - இலங்கை மனித உரிமைகள் ஆணைக்குழு சுட்டிக்காட்டு	https://www.virakesari.lk/article/227160	ta	virakesarilk	1759845540.0
lk_news	2025-10-07-adalk-c9830b87	adalk-c9830b87	2025-10-07	ආර්ථිකය ගොඩ නැගීමට රජය ගත් වෑයම අයි.එම්.එෆ්. අගයයි	https://www.ada.lk/breaking_news/ආර්ථිකය-ගොඩ-නැගීමට-රජය-ගත්-වෑයම-අයි-එම්-එෆ්--අගයයි/11-418963	si	adalk	1759844807.0
lk_news	2025-10-07-adalk-4e8f368f	adalk-4e8f368f	2025-10-07	ජුලම්පිටිය අමරේගේ මරණ දඩුවම ශ්‍රේෂ්ඨාධිකරණය තහවුරු කරයි	https://www.ada.lk/breaking_news/ජුලම්පිටිය-අමරේගේ-මරණ-දඩුවම-ශ්‍රේෂ්ඨාධිකරණය-තහවුරු-කරයි/11-418962	si	adalk	1759844257.0
lk_news	2025-10-07-lankadeepalk-aac9ea4a	lankadeepalk-aac9ea4a	2025-10-07	කර්මාන්ත අමාත්‍යාංශයේ ලාභාංශ මිලියන 757.4 ක් භාණ්ඩාගාරයට දෙයි	https://www.lankadeepa.lk/news/කරමනත-අමතයශය-ලභශ-මලයන-757-4-ක-භණඩගරයට-දය/101-680884	si	lankadeepalk	1759843688.0
lk_news	2025-10-07-virakesarilk-814e0ba8	virakesarilk-814e0ba8	2025-10-07	பப்புவா நியூ கினியாவில் சக்திவாய்ந்த நிலநடுக்கம்	https://www.virakesari.lk/article/227159	ta	virakesarilk	1759843620.0
lk_news	2025-10-07-lankadeepalk-1a77db61	lankadeepalk-1a77db61	2025-10-07	පැරා ශූරයෝ ලංකාවට	https://www.lankadeepa.lk/news/පර-ශරය-ලකවට/101-680881	si	lankadeepalk	1759842998.0
lk_news	2025-10-07-tamilmirrorlk-408f6f59	tamilmirrorlk-408f6f59	2025-10-07	323 கொள்கலன்கள் சர்ச்சை;குழு நியமனம்	https://www.tamilmirror.lk/செய்திகள்/323-கொள்கலன்கள்-சர்ச்சை-குழு-நியமனம்/175-365913	ta	tamilmirrorlk	1759842654.0
lk_news	2025-10-07-tamilmirrorlk-17586e37	tamilmirrorlk-17586e37	2025-10-07	பந்தயம் மற்றும் சூதாட்ட வரி மீதான வர்த்தமானி வெளியீடு	https://www.tamilmirror.lk/செய்திகள்/பந்தயம்-மற்றும்-சூதாட்ட-வரி-மீதான-வர்த்தமானி-வெளியீடு/175-365912	ta	tamilmirrorlk	1759842095.0
lk_news	2025-10-07-virakesarilk-2e54fe66	virakesarilk-2e54fe66	2025-10-07	களுத்துறையில் குறைந்த வருமான குடும்பங்களுக்கு வீடுகள் கையளிப்பு	https://www.virakesari.lk/article/227155	ta	virakesarilk	1759840860.0
lk_news	2025-10-07-adalk-cf563630	adalk-cf563630	2025-10-07	තහනම් උත්තේජකවලට එරෙහි පනතට කථානායක සහතිකය	https://www.ada.lk/sports/තහනම්-උත්තේජකවලට-එරෙහි-පනතට-කථානායක-සහතිකය/9-418961	si	adalk	1759840687.0
lk_news	2025-10-07-virakesarilk-5a724ad1	virakesarilk-5a724ad1	2025-10-07	வாழைச்சேனையில் அதிகளவு ஐஸ் போதைப்பொருளுடன் இளம் தம்பதி கைது	https://www.virakesari.lk/article/227157	ta	virakesarilk	1759840380.0
lk_news	2025-10-07-lankadeepalk-16b36bd2	lankadeepalk-16b36bd2	2025-10-07	ක්‍රීඩා උත්තේජක තහනම් පනතට කතානායක සහතිකය	https://www.lankadeepa.lk/news/කරඩ-උතතජක-තහනම-පනතට-කතනයක-සහතකය/101-680880	si	lankadeepalk	1759840044.0
lk_news	2025-10-07-virakesarilk-1390de3b	virakesarilk-1390de3b	2025-10-07	இலங்கை குறித்த புதிய தீர்மானம் : எப்போதேனும் நீதி கிட்டும் எனும் நம்பிக்கையை பாதிக்கப்பட்ட தரப்பினர் மத்தியில் விதைத்துள்ளது - மனித உரிமைகள் கண்காணிப்பகம்	https://www.virakesari.lk/article/227156	ta	virakesarilk	1759838520.0
lk_news	2025-10-07-tamilmirrorlk-1ea8af6a	tamilmirrorlk-1ea8af6a	2025-10-07	ஜனாதிபதியை சந்தித்த IMF பிரதிநிதிகள்	https://www.tamilmirror.lk/செய்திகள்/ஜனாதிபதியை-சந்தித்த-IMF-பிரதிநிதிகள்/175-365910	ta	tamilmirrorlk	1759838274.0
lk_news	2025-10-07-virakesarilk-b757f0c8	virakesarilk-b757f0c8	2025-10-07	பௌதீகவியலுக்கான நோபல் பரிசு 3 பேருக்கு அறிவிப்பு	https://www.virakesari.lk/article/227154	ta	virakesarilk	1759838220.0
lk_news	2025-10-07-virakesarilk-b174d474	virakesarilk-b174d474	2025-10-07	ஜனாதிபதிக்கும் சர்வதேச நாணய நிதியத்தின் பிரதிநிதிகளுக்கும் இடையிலான கலந்துரையாடல்	https://www.virakesari.lk/article/227151	ta	virakesarilk	1759838100.0
lk_news	2025-10-07-virakesarilk-928f9712	virakesarilk-928f9712	2025-10-07	இலஞ்ச ஊழல் ஆணைக்குழுவுக்கான நியமனம் தொடர்பில் ஜீவன் தொண்டமான், சாணக்கியன், தயாசிறி ஜயசேகர சபையில் எதிர்ப்பு!	https://www.virakesari.lk/article/227153	ta	virakesarilk	1759837980.0
lk_news	2025-10-07-virakesarilk-3cb4b2c2	virakesarilk-3cb4b2c2	2025-10-07	போதைப்பொருள், ஊழலுக்கு எதிராக நடவடிக்கைகள் எடுத்தபோதிலும் தமிழர்களுக்கு தீர்வு வழங்க அரசு நடவடிக்கை எடுக்கவில்லை - இ.சிறிநாத்	https://www.virakesari.lk/article/227152	ta	virakesarilk	1759837560.0
lk_news	2025-10-07-lankadeepalk-348cd7ae	lankadeepalk-348cd7ae	2025-10-07	බහාලුම් අවුල හොයන්න විශේෂ කාරක සභාවක්	https://www.lankadeepa.lk/latest_news/බහලම-අවල-හයනන-වශෂ-කරක-සභවක/1-680879	si	lankadeepalk	1759837427.0
lk_news	2025-10-07-lankadeepalk-c9b9d455	lankadeepalk-c9b9d455	2025-10-07	ඩෙංගු වැඩිවීමේ අවධානමක්	https://www.lankadeepa.lk/latest_news/ඩග-වඩවම-අවධනමක/1-680878	si	lankadeepalk	1759837244.0
lk_news	2025-10-07-virakesarilk-2ef63d32	virakesarilk-2ef63d32	2025-10-07	சிகை அலங்கரிப்பாளர்களும் தொழில்வாண்மை மிகுந்தவர்களாக மாறவேண்டும் -   வடக்கு மாகாண ஆளுநர் வேதநாயகன்	https://www.virakesari.lk/article/227150	ta	virakesarilk	1759837080.0
lk_news	2025-10-07-virakesarilk-d730198e	virakesarilk-d730198e	2025-10-07	இன அழிப்புக்கு நியாயம் கோரி பாலஸ்தீன கொடிகளுடன் மட்டக்களப்பில் கவனயீர்ப்பு	https://www.virakesari.lk/article/227145	ta	virakesarilk	1759836960.0
lk_news	2025-10-07-lankadeepalk-3d3b3852	lankadeepalk-3d3b3852	2025-10-07	ජනපති - අයි.එම්.එෆ් හමුවෙයි	https://www.lankadeepa.lk/news/ජනපත-අය-එම-එෆ-හමවය/101-680877	si	lankadeepalk	1759836855.0
lk_news	2025-10-07-tamilmirrorlk-6bcb8062	tamilmirrorlk-6bcb8062	2025-10-07	ஜூலம்பிடியவின் மரண தண்டனையை உறுதி செய்தது உயர்நீதிமன்றம்	https://www.tamilmirror.lk/செய்திகள்/ஜூலம்பிடியவின்-மரண-தண்டனையை-உறுதி-செய்தது-உயர்நீதிமன்றம்/175-365908	ta	tamilmirrorlk	1759836576.0
lk_news	2025-10-07-virakesarilk-c85220cb	virakesarilk-c85220cb	2025-10-07	கிழக்கு ஆளுநர் அலுவலகத்துக்கு முன் ஒன்றுதிரண்ட தனியார் பேருந்து உரிமையாளர்கள், சாரதிகள், நடத்துநர்கள்!	https://www.virakesari.lk/article/227146	ta	virakesarilk	1759836360.0
lk_news	2025-10-07-virakesarilk-d8bd88e5	virakesarilk-d8bd88e5	2025-10-07	“அரசன்“ ஆன சிலம்பரசன்	https://www.virakesari.lk/article/227149	ta	virakesarilk	1759836060.0
lk_news	2025-10-07-lankadeepalk-7684b658	lankadeepalk-7684b658	2025-10-07	අමරේට තංගල්ලෙන් දුන් දඬුවම ශ්‍රේෂ්ඨාධිකරණය තහවුරු කරයි	https://www.lankadeepa.lk/news/අමරට-තගලලන-දන-දඬවම-ශරෂඨධකරණය-තහවර-කරය/101-680876	si	lankadeepalk	1759835809.0
lk_news	2025-10-07-adalk-f6af3607	adalk-f6af3607	2025-10-07	මධ්‍යම අධිවේගයේ රඹුක්කන හා ගලගෙදර කොටසේ ඉදිකිරීමේ මේ වසරේ ඇරඹේ	https://www.ada.lk/breaking_news/මධ්‍යම-අධිවේගයේ-රඹුක්කන-හා-ගලගෙදර-කොටසේ-ඉදිකිරීමේ-මේ-වසරේ-ඇරඹේ/11-418960	si	adalk	1759835753.0
lk_news	2025-10-07-virakesarilk-33571419	virakesarilk-33571419	2025-10-07	கொட்டகலையில் இரண்டு மோட்டார் சைக்கிள்கள் நேருக்கு நேர் மோதி விபத்து	https://www.virakesari.lk/article/227147	ta	virakesarilk	1759835640.0
lk_news	2025-10-07-lankadeepalk-ade1dbfe	lankadeepalk-ade1dbfe	2025-10-07	සංචාරක ත්‍රීරෝද රියැදුරන්ට විශේෂ පුහුණුවක්	https://www.lankadeepa.lk/news/සචරක-තරරද-රයදරනට-වශෂ-පහණවක/101-680875	si	lankadeepalk	1759835531.0
lk_news	2025-10-07-virakesarilk-e8cf0ea3	virakesarilk-e8cf0ea3	2025-10-07	கவின் நடிக்கும் 'மாஸ்க்' படத்தின் அப்டேட்	https://www.virakesari.lk/article/227148	ta	virakesarilk	1759835520.0
lk_news	2025-10-07-lankadeepalk-0af6e7e4	lankadeepalk-0af6e7e4	2025-10-07	මම තමයි චීනේ මැණික් බිස්නස් පටන් ගත්ත  දෙවැනි ශ්‍රී ලාංකිකයා	https://www.lankadeepa.lk/visheshanga/මම-තමය-චන-මණක-බසනස-පටන-ගතත-දවන-ශර-ලකකය/26-680874	si	lankadeepalk	1759835417.0
lk_news	2025-10-07-adalk-fbcaa2c3	adalk-fbcaa2c3	2025-10-07	අන්තර්ජාලය හරහා සිදුවන වංචා ගැන පැමිණිලි ඉහළට	https://www.ada.lk/breaking_news/අන්තර්ජාලය-හරහා-සිදුවන-වංචා-ගැන-පැමිණිලි-ඉහළට/11-418959	si	adalk	1759835200.0
lk_news	2025-10-07-virakesarilk-c30cd1ad	virakesarilk-c30cd1ad	2025-10-07	ரசிகர்களை 'முதல் நாள் முதல் காட்சி'க்காக தயார்படுத்தும் சிவகார்த்திகேயனின் 'பராசக்தி' படக் குழு	https://www.virakesari.lk/article/227144	ta	virakesarilk	1759834980.0
lk_news	2025-10-07-lankadeepalk-dd910112	lankadeepalk-dd910112	2025-10-07	අටෙන් එකක් මානසික ලෙඩෙක්	https://www.lankadeepa.lk/latest_news/අටන-එකක-මනසක-ලඩක/1-680873	si	lankadeepalk	1759834857.0
lk_news	2025-10-07-virakesarilk-cdcc0a92	virakesarilk-cdcc0a92	2025-10-07	நாங்கள் இந்த சிங்கள பௌத்த ஆட்சியாளர்களை நம்பவே மாட்டோம் - சிவாஜிலிங்கம் இடித்துரைப்பு!	https://www.virakesari.lk/article/227141	ta	virakesarilk	1759834800.0
lk_news	2025-10-07-virakesarilk-11f90c4c	virakesarilk-11f90c4c	2025-10-07	இரண்டுமாடி வீட்டில் இயங்கி வந்த சட்டவிரோத மதுபான உற்பத்தி நிலையம் சுற்றிவளைப்பு!	https://www.virakesari.lk/article/227143	ta	virakesarilk	1759834440.0
lk_news	2025-10-07-tamilmirrorlk-07a9e7c1	tamilmirrorlk-07a9e7c1	2025-10-07	மருமகனின் உள்ளாடையை எடுத்து மாமியார் செய்த அசிங்கம்:பார்த்து அதிர்ந்த மாமனார்	https://www.tamilmirror.lk/செய்திகள்/மருமகனின்-உள்ளாடையை-எடுத்து-மாமியார்-செய்த-அசிங்கம்-பார்த்து-அதிர்ந்த-மாமனார்/175-365904	ta	tamilmirrorlk	1759834424.0
lk_news	2025-10-07-virakesarilk-13b35231	virakesarilk-13b35231	2025-10-07	படத் தொகுப்பாளர் அண்டனி வெளியிட்ட 'தடை அதை உடை 'படத்தின் பிரத்யேக காணொலி	https://www.virakesari.lk/article/227142	ta	virakesarilk	1759834380.0
