doc_type	doc_id	num	date_str	description	url_metadata	lang	newspaper_id	time_ut
lk_news	2025-11-16-virakesarilk-5270de76	virakesarilk-5270de76	2025-11-16	யாழ். நெடுந்தீவில் பாவனையற்ற காணியிலிருந்து துப்பாக்கி மீட்பு	https://www.virakesari.lk/article/230456	ta	virakesarilk	1763259540.0
lk_news	2025-11-16-virakesarilk-28623fc4	virakesarilk-28623fc4	2025-11-16	டிசம்பர் முதல் வாரத்தில் டெல்லி செல்கிறார் டில்வின்	https://www.virakesari.lk/article/230454	ta	virakesarilk	1763259360.0
lk_news	2025-11-16-virakesarilk-3a015e4a	virakesarilk-3a015e4a	2025-11-16	இன்றைய வானிலை	https://www.virakesari.lk/article/230453	ta	virakesarilk	1763254080.0
lk_news	2025-11-16-virakesarilk-e64caba8	virakesarilk-e64caba8	2025-11-16	தமிழ் பிரச்சினைக்கு நிரந்தரத் தீர்வு: தொல். திருமாவளவனிடம் தமிழ் தேசிய மக்கள் முன்னணியின் கோரிக்கை	https://www.virakesari.lk/article/230452	ta	virakesarilk	1763241000.0
lk_news	2025-11-16-virakesarilk-daeb669e	virakesarilk-daeb669e	2025-11-16	மன்னார் தாழ்வுபாடு கடலில் இரு படகுகள் மோதி விபத்து; ஒருவர் காயம்	https://www.virakesari.lk/article/230451	ta	virakesarilk	1763240760.0
lk_news	2025-11-16-virakesarilk-6f0f90b3	virakesarilk-6f0f90b3	2025-11-16	ஆசிய கிண்ண உதய தாரகைகள் ரி20 போட்டியில் வியாஸ்காந்த் பந்துவீச்சில் பிரகாசிப்பு; ஆனால் இலங்கை ஏ அணிக்கு ஏமாற்றம்	https://www.virakesari.lk/article/230450	ta	virakesarilk	1763237460.0
lk_news	2025-11-15-tamilmirrorlk-d026ffdf	tamilmirrorlk-d026ffdf	2025-11-15	சினிமா பாணியில் நடக்கும் போதைப்பொருள் கடத்தல்	https://www.tamilmirror.lk/செய்திகள்/சினிமா-பாணியில்-நடக்கும்-போதைப்பொருள்-கடத்தல்/175-367959	ta	tamilmirrorlk	1763228429.0
lk_news	2025-11-15-virakesarilk-eefaef06	virakesarilk-eefaef06	2025-11-15	டிஎஸ்ஐ சுப்பர் ஸ்போர்ட் பாடசாலைகள் கரப்பந்தாட்டம் 2025: தம்மிஸ்சர வித்தியாலயத்திற்கு இரண்டு சம்பியன் பட்டங்கள்	https://www.virakesari.lk/article/230449	ta	virakesarilk	1763223840.0
lk_news	2025-11-15-lankadeepalk-6383443e	lankadeepalk-6383443e	2025-11-15	වැලිකන්ද රෝහලේ කටයුතු වලට අලින්ගෙන් බාධා	https://www.lankadeepa.lk/news/වලකනද-රහල-කටයත-වලට-අලනගන-බධ/101-683217	si	lankadeepalk	1763223585.0
lk_news	2025-11-15-lankadeepalk-718ee966	lankadeepalk-718ee966	2025-11-15	ජනපතිගේ වැය ශීර්ෂය සම්මතයි	https://www.lankadeepa.lk/news/ජනපතග-වය-ශරෂය-සමමතය/101-683216	si	lankadeepalk	1763222263.0
lk_news	2025-11-15-tamilmirrorlk-cff57d48	tamilmirrorlk-cff57d48	2025-11-15	பொலித்தீன் பைகளுக்குப் பதிலாக காகிதப் பைகள்	https://www.tamilmirror.lk/செய்திகள்/பொலித்தீன்-பைகளுக்குப்-பதிலாக-காகிதப்-பைகள்/175-367946	ta	tamilmirrorlk	1763220435.0
lk_news	2025-11-15-lankadeepalk-8cd6a25a	lankadeepalk-8cd6a25a	2025-11-15	ශිරාන්තිගේ පින්තූරේ රාමුකරන්නත් ආණ්ඩුවේ මුදල්	https://www.lankadeepa.lk/news/ශරනතග-පනතර-රමකරනනත-ආණඩව-මදල/101-683215	si	lankadeepalk	1763218498.0
lk_news	2025-11-15-lankadeepalk-ddcdf801	lankadeepalk-ddcdf801	2025-11-15	වරායේ ඉදිකිරීම් පමාවට කොන්ත්‍රාත්කරුට කෝටි 423ක වන්දියක්	https://www.lankadeepa.lk/news/වරය-ඉදකරම-පමවට-කනතරතකරට-කට-423ක-වනදයක/101-683214	si	lankadeepalk	1763218243.0
lk_news	2025-11-15-lankadeepalk-f4e43c1e	lankadeepalk-f4e43c1e	2025-11-15	බිමල්  මැතිසබේ ලොක්කන්ට  දෙහි කපයි	https://www.lankadeepa.lk/latest_news/බමල-මතසබ-ලකකනට-දහ-කපය/1-683213	si	lankadeepalk	1763217289.0
lk_news	2025-11-15-virakesarilk-546177d0	virakesarilk-546177d0	2025-11-15	மனித பாவனைக்கு உதவாத தேங்காய் எண்ணெயை லொறியில் எடுத்து சென்றவர் கைது!	https://www.virakesari.lk/article/230436	ta	virakesarilk	1763215740.0
lk_news	2025-11-15-virakesarilk-5f4df76e	virakesarilk-5f4df76e	2025-11-15	'எல்லா புகழும் என் தந்தைக்கே, அவர் இல்லாமல் இந்தளவு உயர்ந்திருக்கமாட்டேன்' - 14 வயது இந்திய வீரர் சூரியவன்ஷி	https://www.virakesari.lk/article/230448	ta	virakesarilk	1763215140.0
lk_news	2025-11-15-islandlk-5af080d4	islandlk-5af080d4	2025-11-15	Sampath Bank maintains its growth momentum in 2025, recording a 21% increase in profit after tax for the nine-month period	http://island.lk/sampath-bank-maintains-its-growth-momentum-in-2025-recording-a-21-increase-in-profit-after-tax-for-the-nine-month-period/	en	islandlk	1763213400.0
lk_news	2025-11-15-islandlk-4a722657	islandlk-4a722657	2025-11-15	HNB Assurance partners Dialog Finance to drive digital payment transformation	http://island.lk/hnb-assurance-partners-dialog-finance-to-drive-digital-payment-transformation/	en	islandlk	1763213400.0
lk_news	2025-11-15-islandlk-0ec4eaa2	islandlk-0ec4eaa2	2025-11-15	Nawaloka Hospitals Named Sri Lanka’s ‘Leading Hospital in AI and Innovation’ at the Asia Pacific Global Health Awards 2025	http://island.lk/nawaloka-hospitals-named-sri-lankas-leading-hospital-in-ai-and-innovation-at-the-asia-pacific-global-health-awards-2025/	en	islandlk	1763213400.0
lk_news	2025-11-15-islandlk-e8c4c3ec	islandlk-e8c4c3ec	2025-11-15	LTL Transformers (Pvt) Ltd Honored at the Sri Lanka National Quality Awards 2023	http://island.lk/ltl-transformers-pvt-ltd-honored-at-the-sri-lanka-national-quality-awards-2023/	en	islandlk	1763213340.0
lk_news	2025-11-15-islandlk-e299e65f	islandlk-e299e65f	2025-11-15	HNB Finance celebrates fivefold success at SLIM NASCO Awards	http://island.lk/hnb-finance-celebrates-fivefold-success-at-slim-nasco-awards/	en	islandlk	1763212260.0
lk_news	2025-11-15-virakesarilk-41854445	virakesarilk-41854445	2025-11-15	கூடைப்பந்தாட்ட விளையாட்டின் பின்னணியில் தயாராகும் 'நடு சென்டர்' எனும் இணைய தொடரின் முன்னோட்டம் வெளியீடு	https://www.virakesari.lk/article/230447	ta	virakesarilk	1763211900.0
lk_news	2025-11-15-virakesarilk-b022a611	virakesarilk-b022a611	2025-11-15	இயக்குநர் ஹெச் .வினோத் வெளியிட்ட ' ராபின்ஹுட் ' பட முன்னோட்டம்	https://www.virakesari.lk/article/230446	ta	virakesarilk	1763211480.0
lk_news	2025-11-15-virakesarilk-a31e97a8	virakesarilk-a31e97a8	2025-11-15	தேனிசைத்தென்றல்' தேவா இசையில் உருவான 'அனந்தா' படத்தின் இசை வெளியீடு	https://www.virakesari.lk/article/230445	ta	virakesarilk	1763211060.0
lk_news	2025-11-15-virakesarilk-e4eb4173	virakesarilk-e4eb4173	2025-11-15	நகைச்சுவை படைப்பாக தயாராகும் சித்தார்த்தின் 'ரௌடி & கோ'	https://www.virakesari.lk/article/230444	ta	virakesarilk	1763210820.0
lk_news	2025-11-15-virakesarilk-7f23b05f	virakesarilk-7f23b05f	2025-11-15	தனுஷ் நடிக்கும் 'தேரே இஷ்க் மே' படத்தின் முன்னோட்டம் வெளியீடு	https://www.virakesari.lk/article/230443	ta	virakesarilk	1763210460.0
lk_news	2025-11-15-virakesarilk-96922dc0	virakesarilk-96922dc0	2025-11-15	இலங்கை சுற்றுப்பயணம் மற்றும் 2009 பயங்கரவாத தாக்கதலின் எதிரொலி	https://www.virakesari.lk/article/230428	ta	virakesarilk	1763209680.0
lk_news	2025-11-15-virakesarilk-4bf55199	virakesarilk-4bf55199	2025-11-15	துடுப்பாட்டத்தில் இந்தியாவும் தடுமாறிய முதல் டெஸ்டில் பரிதாபகரமான நிலையில் தென் ஆபிரிக்கா	https://www.virakesari.lk/article/230440	ta	virakesarilk	1763209260.0
lk_news	2025-11-15-virakesarilk-1e15af8c	virakesarilk-1e15af8c	2025-11-15	கும்கி 2 - திரைப்பட விமர்சனம்	https://www.virakesari.lk/article/230439	ta	virakesarilk	1763209080.0
lk_news	2025-11-15-virakesarilk-94673bd5	virakesarilk-94673bd5	2025-11-15	19 இலட்சத்துக்கும் மேற்பட்ட சுற்றுலாப் பயணிகள் இலங்கைக்கு வருகை!	https://www.virakesari.lk/article/230427	ta	virakesarilk	1763208900.0
lk_news	2025-11-15-lankadeepalk-bb6e6d25	lankadeepalk-bb6e6d25	2025-11-15	පළාත් රෝහල් හතක් මධ්‍යම රජය යටතට	https://www.lankadeepa.lk/news/පළත-රහල-හතක-මධයම-රජය-යටතට/101-683212	si	lankadeepalk	1763208563.0
lk_news	2025-11-15-virakesarilk-053e8948	virakesarilk-053e8948	2025-11-15	நடிகர் சதீஷின் 'முஸ்தபா முஸ்தபா ' பட ஃபர்ஸ்ட் லுக் வெளியீடு	https://www.virakesari.lk/article/230438	ta	virakesarilk	1763208180.0
lk_news	2025-11-15-virakesarilk-4e59ea5c	virakesarilk-4e59ea5c	2025-11-15	நடிகர் நந்தமூரி பாலகிருஷ்ணா நடிக்கும் ' அகண்டா 2 :தாண்டவம்' படத்தின் முதல் பாடல் வெளியீடு	https://www.virakesari.lk/article/230437	ta	virakesarilk	1763207520.0
lk_news	2025-11-15-adalk-1f9ac79f	adalk-1f9ac79f	2025-11-15	නැගෙනහිර පර්යන්තයේ ඉදිකිරීම් ප්‍රමාද නිසා කොන්ත්‍රාත්කරු රු. මි. 4227 ක් වන්දි ඉල්ලයි	https://www.ada.lk/breaking_news/නැගෙනහිර-පර්යන්තයේ-ඉදිකිරීම්-ප්‍රමාද-නිසා-කොන්ත්‍රාත්කරු-රු--මි--4227-ක්-වන්දි-ඉල්ලයි/11-419700	si	adalk	1763207073.0
lk_news	2025-11-15-islandlk-504b9381	islandlk-504b9381	2025-11-15	Que Sera Sera	http://island.lk/que-sera-sera/	en	islandlk	1763206860.0
lk_news	2025-11-15-adalk-40af25ab	adalk-40af25ab	2025-11-15	2023 ITN පාඩුව රු. ලක්ෂ 1640	https://www.ada.lk/breaking_news/2023-ITN-පාඩුව-රු--ලක්ෂ 1640/11-419699	si	adalk	1763206570.0
lk_news	2025-11-15-virakesarilk-992a005b	virakesarilk-992a005b	2025-11-15	ரூபவாஹினி மற்றும் சுயாதீன தொலைக்காட்சி வருடாந்த  அறிக்கைகள் பரிசீலனை	https://www.virakesari.lk/article/230435	ta	virakesarilk	1763206560.0
lk_news	2025-11-15-islandlk-91736b9b	islandlk-91736b9b	2025-11-15	Experience as an Advisor to the Government on Productivity Promotion	http://island.lk/experience-as-an-advisor-to-the-government-on-productivity-promotion/	en	islandlk	1763206500.0
lk_news	2025-11-15-islandlk-17ab94ec	islandlk-17ab94ec	2025-11-15	The Seelawathi Syndrome	http://island.lk/the-seelawathi-syndrome/	en	islandlk	1763206500.0
lk_news	2025-11-15-virakesarilk-33499e31	virakesarilk-33499e31	2025-11-15	பிளாஸ்டிக் பைகளை மாற்ற சுற்றுச்சூழலுக்கு உகந்த காகிதப் பைகள்  தயாரிக்க ஆலோசனை	https://www.virakesari.lk/article/230433	ta	virakesarilk	1763205780.0
lk_news	2025-11-15-virakesarilk-c5636c5c	virakesarilk-c5636c5c	2025-11-15	பாடசாலைக்கு அருகில் போதை மாத்திரைகளை விற்பனை செய்தவர் கைது!	https://www.virakesari.lk/article/230434	ta	virakesarilk	1763205540.0
lk_news	2025-11-15-islandlk-91598b76	islandlk-91598b76	2025-11-15	Takes from Overseas	http://island.lk/takes-from-overseas/	en	islandlk	1763205420.0
lk_news	2025-11-15-islandlk-007dbd97	islandlk-007dbd97	2025-11-15	Democrats sweep elections in New York, New Jersey, Virginia and California	http://island.lk/democrats-sweep-elections-in-new-york-new-jersey-virginia-and-california/	en	islandlk	1763205360.0
lk_news	2025-11-15-virakesarilk-d5a012b1	virakesarilk-d5a012b1	2025-11-15	வரவுசெலவுக்குஆதரவாக வாக்களித்ததால் அரசாங்கத்தின் பக்கம் மாறுவதற்கு நாங்கள் தயாராக இல்லை ;  வேலுசாமி ராதாகிருஷ்ணன்	https://www.virakesari.lk/article/230432	ta	virakesarilk	1763204280.0
lk_news	2025-11-15-islandlk-989803d5	islandlk-989803d5	2025-11-15	Breaking the pattern in the name of travel:Different kind of guidebook	http://island.lk/breaking-the-pattern-in-the-name-of-traveldifferent-kind-of-guidebook/	en	islandlk	1763204040.0
lk_news	2025-11-15-islandlk-2eedd7f4	islandlk-2eedd7f4	2025-11-15	Memories of my time at the Bandaranaike Centre for International Studies	http://island.lk/memories-of-my-time-at-the-bandaranaike-centre-for-international-studies/	en	islandlk	1763203860.0
lk_news	2025-11-15-virakesarilk-6974ab06	virakesarilk-6974ab06	2025-11-15	வவுனியா தேசிய கல்வியற்கல்லூரியில் ஆசிரிய மாணவர்களுக்கு திடீர் சுகவீனம் ; சுகாதார பரிசோதகர்கள் தீவிர விசாரணை!	https://www.virakesari.lk/article/230431	ta	virakesarilk	1763203140.0
lk_news	2025-11-15-lankadeepalk-5c2ed574	lankadeepalk-5c2ed574	2025-11-15	පතිනායක ඉවත් කරන්න පොලිස් කොමිසමේ අනුමැතිය	https://www.lankadeepa.lk/latest_news/පතනයක-ඉවත-කරනන-පලස-කමසම-අනමතය/1-683202	si	lankadeepalk	1763202490.0
lk_news	2025-11-15-virakesarilk-124eb8b4	virakesarilk-124eb8b4	2025-11-15	“பாணந்துறை குடு சலிந்து“வின் போதைப்பொருள் வலையமைப்பை கையாண்ட யுவதி கைது!	https://www.virakesari.lk/article/230430	ta	virakesarilk	1763201520.0
lk_news	2025-11-15-virakesarilk-0b9d32ee	virakesarilk-0b9d32ee	2025-11-15	“கெஹெல்பத்தர பத்மே”வுக்கு சொந்தமான வங்கி கணக்குகள் தொடர்பில் விசாரணை செய்ய சி.ஐ.டிக்கு அனுமதி!	https://www.virakesari.lk/article/230429	ta	virakesarilk	1763200260.0
lk_news	2025-11-15-virakesarilk-a9a5d159	virakesarilk-a9a5d159	2025-11-15	யாழில். வீதிக்கு கழிவு நீரை வெளியேற்றிய உணவக உரிமையாளர் உள்ளிட்ட மூவருக்கு அபராதம்	https://www.virakesari.lk/article/230426	ta	virakesarilk	1763199840.0
lk_news	2025-11-15-virakesarilk-5084e000	virakesarilk-5084e000	2025-11-15	காதலால் நேர்ந்த கொடூரம்: சிறுமி கொலை ; இளைஞன் உயிர்மாய்ப்பு!	https://www.virakesari.lk/article/230424	ta	virakesarilk	1763199780.0
lk_news	2025-11-15-lankadeepalk-0f05f796	lankadeepalk-0f05f796	2025-11-15	එජාප වනිතාවෝ රනිල් හමුවෙති	https://www.lankadeepa.lk/latest_news/එජප-වනතව-රනල-හමවත/1-683193	si	lankadeepalk	1763199338.0
lk_news	2025-11-15-virakesarilk-cec0c34d	virakesarilk-cec0c34d	2025-11-15	செல்வ சந்நதியில் ஆலய சூழலில் சுகாதார சீர்கேட்டுடன் பானிப்பூரி விற்றவருக்கு தண்டம்!	https://www.virakesari.lk/article/230425	ta	virakesarilk	1763199120.0
lk_news	2025-11-15-virakesarilk-ab4fa77d	virakesarilk-ab4fa77d	2025-11-15	கடும் மின்னல் தாக்கம் குறித்து பொதுமக்களுக்கு எச்சரிக்கை!	https://www.virakesari.lk/article/230422	ta	virakesarilk	1763199060.0
lk_news	2025-11-15-virakesarilk-1156b316	virakesarilk-1156b316	2025-11-15	வலையில் சிக்கிய அரிய வகை கடல் ஆமையை உயிருடன் மீண்டும் கடலில் விட்ட மீனவர்களுக்கு வனத்துறையினர் பாராட்டு	https://www.virakesari.lk/article/230423	ta	virakesarilk	1763198880.0
lk_news	2025-11-15-tamilmirrorlk-b63e094a	tamilmirrorlk-b63e094a	2025-11-15	சிறுமியை கொலை செய்த இளைஞனும் மரணம் : நடந்தது என்ன?	https://www.tamilmirror.lk/செய்திகள்/சிறுமியை-கொலை-செய்த-இளைஞனும்-மரணம்-நடந்தது-என்ன/175-367945	ta	tamilmirrorlk	1763198721.0
lk_news	2025-11-15-virakesarilk-af4776bd	virakesarilk-af4776bd	2025-11-15	அரச சேவை சம்பள அமைப்பு கட்டமைப்பு இடைக்கால அறிக்கை சமர்ப்பிப்பு	https://www.virakesari.lk/article/230419	ta	virakesarilk	1763198160.0
lk_news	2025-11-15-virakesarilk-5f026c93	virakesarilk-5f026c93	2025-11-15	மட்டக்களப்பில் கனமழை காரணமாக தாழ்நிலப் பகுதிகளுக்கு  வெள்ள அபாய எச்சரிக்கை	https://www.virakesari.lk/article/230421	ta	virakesarilk	1763198160.0
lk_news	2025-11-15-lankadeepalk-1b8bbcf4	lankadeepalk-1b8bbcf4	2025-11-15	ටින් මාළු මිල බස්සන ගැසට්ටුවක්	https://www.lankadeepa.lk/news/ටන-මළ-මල-බසසන-ගසටටවක/101-683191	si	lankadeepalk	1763197235.0
lk_news	2025-11-15-virakesarilk-467610d8	virakesarilk-467610d8	2025-11-15	மத்ரஸாவில் 12 வயது சிறுவன் உயிரிழப்பு ; பிரதேச மக்கள் ஆர்ப்பாட்டம்!	https://www.virakesari.lk/article/230420	ta	virakesarilk	1763196900.0
lk_news	2025-11-15-adalk-dd4f4ab6	adalk-dd4f4ab6	2025-11-15	චීන ජාතිකයන්ට ජපානයේ සංචාරය කිරිමෙන් වළකින්නැයි චීනය කියයි	https://www.ada.lk/international/චීන-ජාතිකයන්ට-ජපානයේ-සංචාරය-කිරිමෙන්-වළකින්නැයි-චීනය-කියයි/3-419698	si	adalk	1763195764.0
lk_news	2025-11-15-lankadeepalk-275e89b8	lankadeepalk-275e89b8	2025-11-15	නඩුකාරවරුන් විස්සක් ඉවත් කරලා	https://www.lankadeepa.lk/news/නඩකරවරන-වසසක-ඉවත-කරල/101-683190	si	lankadeepalk	1763195545.0
lk_news	2025-11-15-tamilmirrorlk-a3819c03	tamilmirrorlk-a3819c03	2025-11-15	டின் மீன்களுக்கு அதிகபட்ச சில்லறை விலை	https://www.tamilmirror.lk/செய்திகள்/டின்-மீன்களுக்கு-அதிகபட்ச-சில்லறை-விலை/175-367944	ta	tamilmirrorlk	1763194885.0
lk_news	2025-11-15-lankadeepalk-7c7ad3ce	lankadeepalk-7c7ad3ce	2025-11-15	නාමල් - සුමන්තිරන් හමුවක්	https://www.lankadeepa.lk/news/නමල-සමනතරන-හමවක/101-683189	si	lankadeepalk	1763194859.0
lk_news	2025-11-15-virakesarilk-e22b7ad4	virakesarilk-e22b7ad4	2025-11-15	டெங்கு நுளம்பு பரவக்கூடிய சூழலை பேணிய ஆதன உரிமையாளர்களுக்கு அபராதம்!	https://www.virakesari.lk/article/230417	ta	virakesarilk	1763194500.0
lk_news	2025-11-15-lankadeepalk-011cd0cc	lankadeepalk-011cd0cc	2025-11-15	මැතිසබේ අවුළුවන කුණුකතා	https://www.lankadeepa.lk/features/මතසබ-අවළවන-කණකත/2-683188	si	lankadeepalk	1763193980.0
lk_news	2025-11-15-virakesarilk-84b67afd	virakesarilk-84b67afd	2025-11-15	பிரதி பொலிஸ் மாஅதிபர் லலித் பத்திநாயக்க பதவி நீக்கம்!	https://www.virakesari.lk/article/230414	ta	virakesarilk	1763193960.0
lk_news	2025-11-15-virakesarilk-b788d1d0	virakesarilk-b788d1d0	2025-11-15	வெளிநாட்டு பெண்ணிடம் பாலியல் சேட்டையில் ஈடுபட்ட இளைஞன் தொடர்பில் விசாரணை!	https://www.virakesari.lk/article/230416	ta	virakesarilk	1763193540.0
lk_news	2025-11-15-virakesarilk-8bd714e4	virakesarilk-8bd714e4	2025-11-15	யாழில் போதைப்பொருள் விற்பனையில் ஈடுபட்ட கும்பல் கைது!	https://www.virakesari.lk/article/230413	ta	virakesarilk	1763192940.0
lk_news	2025-11-15-virakesarilk-3e6c4c9f	virakesarilk-3e6c4c9f	2025-11-15	மகளை பார்க்கச் சென்றுக்கொண்டிருந்த தாய், தந்தை மீது காட்டு யானை தாக்குதல்!	https://www.virakesari.lk/article/230409	ta	virakesarilk	1763192700.0
lk_news	2025-11-15-virakesarilk-16fa93b6	virakesarilk-16fa93b6	2025-11-15	நாமல் ராஜபக்ஷ - எம்.ஏ.சுமந்திரன் இடையில் சந்திப்பு!	https://www.virakesari.lk/article/230415	ta	virakesarilk	1763192700.0
lk_news	2025-11-15-lankadeepalk-7d0f69d3	lankadeepalk-7d0f69d3	2025-11-15	ජනපති රටට ඉතිරි කරපු මුදල මෙන්න	https://www.lankadeepa.lk/latest_news/ජනපත-රටට-ඉතර-කරප-මදල-මනන/1-683187	si	lankadeepalk	1763192243.0
lk_news	2025-11-15-lankadeepalk-6c952072	lankadeepalk-6c952072	2025-11-15	ඩිජිටල් අධ්‍යාපන ප්‍රතිපත්තිය කැබිනට්ටුවට	https://www.lankadeepa.lk/latest_news/ඩජටල-අධයපන-පරතපතතය-කබනටටවට/1-683186	si	lankadeepalk	1763192000.0
lk_news	2025-11-15-lankadeepalk-a4763ac4	lankadeepalk-a4763ac4	2025-11-15	ඉන්දු - ලංකා නිර්මාණ ශිල්පීහු සීයක් එකම වේදිකාවක	https://www.lankadeepa.lk/latest_news/ඉනද-ලක-නරමණ-ශලපහ-සයක-එකම-වදකවක/1-683185	si	lankadeepalk	1763191690.0
lk_news	2025-11-15-virakesarilk-f686b530	virakesarilk-f686b530	2025-11-15	முல்லைத்தீவு தனியார் காணியில் ஆயுத அகழ்வு பணிகள் ஆரம்பம்	https://www.virakesari.lk/article/230412	ta	virakesarilk	1763189100.0
lk_news	2025-11-15-lankadeepalk-62ec1037	lankadeepalk-62ec1037	2025-11-15	නුගේගොඩ රැලිය කවුරුවත් රජ කරවන්න නොවේ	https://www.lankadeepa.lk/news/නගගඩ-රලය-කවරවත-රජ-කරවනන-නව/101-683184	si	lankadeepalk	1763188550.0
lk_news	2025-11-15-lankadeepalk-4d95ce58	lankadeepalk-4d95ce58	2025-11-15	මත් සැකකරුවෝ 1056ක්	https://www.lankadeepa.lk/news/මත-සකකරව-1056ක/101-683183	si	lankadeepalk	1763188367.0
lk_news	2025-11-15-colombotelegraphcom-d02e33b3	colombotelegraphcom-d02e33b3	2025-11-15	Sex Education & Religious Barriers To Information	https://www.colombotelegraph.com/index.php/sex-education-religious-barriers-to-information/	en	colombotelegraphcom	1763187079.0
