doc_type	doc_id	num	date_str	description	url_metadata	lang	newspaper_id	time_ut
lk_news	2025-10-29-tamilmirrorlk-feb15353	tamilmirrorlk-feb15353	2025-10-29	பியல் மனம்பேரிக்கு விளக்கமறியல் நீடிப்பு	https://www.tamilmirror.lk/செய்திகள்/பியல்-மனம்பேரிக்கு-விளக்கமறியல்-நீடிப்பு/175-367077	ta	tamilmirrorlk	1761759203.0
lk_news	2025-10-29-tamilmirrorlk-dace2311	tamilmirrorlk-dace2311	2025-10-29	மத்தள விமான நிலையம் தொடர்பான அறிவிப்பு	https://www.tamilmirror.lk/செய்திகள்/மத்தள-விமான-நிலையம்-தொடர்பான-அறிவிப்பு/175-367076	ta	tamilmirrorlk	1761758922.0
lk_news	2025-10-29-tamilmirrorlk-e6b7186a	tamilmirrorlk-e6b7186a	2025-10-29	யாழில் 3 மாத குழந்தைக்கு நேர்ந்த துயரம்	https://www.tamilmirror.lk/யாழ்ப்பாணம்/யாழில்-3-மாத-குழந்தைக்கு-நேர்ந்த-துயரம்/71-367075	ta	tamilmirrorlk	1761758276.0
lk_news	2025-10-29-virakesarilk-a15aa4af	virakesarilk-a15aa4af	2025-10-29	இங்கிலாந்தை நொக் - அவுட் செய்து முதல் அணியாக மகளிர் உலகக் கிண்ண இறுதிக்குள் நுழைந்தது தென் ஆபிரிக்கா	https://www.virakesari.lk/article/229010	ta	virakesarilk	1761757260.0
lk_news	2025-10-29-lankadeepalk-0702d67d	lankadeepalk-0702d67d	2025-10-29	හිටපු උදවිය හිටපු ගෙවල් ගැන  වතගොත මෙන්න	https://www.lankadeepa.lk/latest_news/හටප-උදවය-හටප-ගවල-ගන-වතගත-මනන/1-682337	si	lankadeepalk	1761756438.0
lk_news	2025-10-29-lankadeepalk-c0f3bd98	lankadeepalk-c0f3bd98	2025-10-29	ජගත් මනුවර්ණට නොතීසි	https://www.lankadeepa.lk/latest_news/ජගත-මනවරණට-නතස/1-682336	si	lankadeepalk	1761756272.0
lk_news	2025-10-29-lankadeepalk-3f6ed9bb	lankadeepalk-3f6ed9bb	2025-10-29	ලොකු ලූනු ගොවියා වළපල්ලට	https://www.lankadeepa.lk/latest_news/ලක-ලන-ගවය-වළපලලට/1-682335	si	lankadeepalk	1761755993.0
lk_news	2025-10-29-lankadeepalk-547d6e00	lankadeepalk-547d6e00	2025-10-29	රොන්මඩ පෙන්නා වැලි ගොඩ දමනවාලු	https://www.lankadeepa.lk/latest_news/රනමඩ-පනන-වල-ගඩ-දමනවල/1-682334	si	lankadeepalk	1761755028.0
lk_news	2025-10-29-lankadeepalk-730f9788	lankadeepalk-730f9788	2025-10-29	රනින් බැබලු සසිඳුට - මනුජට ගමෙන් උපහාර	https://www.lankadeepa.lk/latest_news/රනන-බබල-සසඳට-මනජට-ගමන-උපහර/1-682333	si	lankadeepalk	1761754185.0
lk_news	2025-10-29-virakesarilk-712b8e65	virakesarilk-712b8e65	2025-10-29	லோராவின் அபார சதம் தென் ஆபிரிக்காவை பலமான நிலையில் இட்டது	https://www.virakesari.lk/article/229009	ta	virakesarilk	1761748080.0
lk_news	2025-10-29-lankadeepalk-1739a3fd	lankadeepalk-1739a3fd	2025-10-29	පතලක් කඩා  වැටි  තරුණයෙක් මරුට	https://www.lankadeepa.lk/latest_news/පතලක-කඩ-වට-තරණයක-මරට/1-682332	si	lankadeepalk	1761747185.0
lk_news	2025-10-29-virakesarilk-c3e12586	virakesarilk-c3e12586	2025-10-29	சீனாவின் அடுத்த 5 வருடகால வளர்ச்சி இலங்கையின் சுபீட்சத்துக்கான கதவுகளைத் திறக்கும் - இலங்கைக்கான சீனத் தூதுவர்	https://www.virakesari.lk/article/229006	ta	virakesarilk	1761743880.0
lk_news	2025-10-29-lankadeepalk-7661d519	lankadeepalk-7661d519	2025-10-29	මේ මාස දහයේ කොරියාවට 3253ක් ගිහින්	https://www.lankadeepa.lk/news/ම-මස-දහය-කරයවට-3253ක-ගහන/101-682331	si	lankadeepalk	1761743617.0
lk_news	2025-10-29-lankadeepalk-65d845a5	lankadeepalk-65d845a5	2025-10-29	කාන්තාවන්ගේ  දුක බලන්න වෙනම කොමිසමක්	https://www.lankadeepa.lk/news/කනතවනග-දක-බලනන-වනම-කමසමක/101-682330	si	lankadeepalk	1761743195.0
lk_news	2025-10-29-lankadeepalk-7f76fa75	lankadeepalk-7f76fa75	2025-10-29	මන්ත්‍රීලාගේ  ආරක්‍ෂාව: පොලිස්පති පාර්ලිමේන්තුවට  කැදවයි?	https://www.lankadeepa.lk/latest_news/මනතරලග-ආරකෂව-පලසපත-පරලමනතවට-කදවය/1-682329	si	lankadeepalk	1761741583.0
lk_news	2025-10-29-virakesarilk-9506aad6	virakesarilk-9506aad6	2025-10-29	நவம்பர் 5 கூடுகிறது தமிழ் அரசுக் கட்சியின் மத்திய செயற்குழு ; வரவு - செலவுத் திட்டத்தை ஆதரிப்பதா, எதிர்ப்பதாக? - குழுவில் ஆராய்வு	https://www.virakesari.lk/article/229004	ta	virakesarilk	1761741240.0
lk_news	2025-10-29-virakesarilk-55afffd7	virakesarilk-55afffd7	2025-10-29	தனுஷ் நடிக்கும் 'தேரே இஷ்க் மே' படத்தின் அப்டேட்ஸ்	https://www.virakesari.lk/article/229003	ta	virakesarilk	1761741180.0
lk_news	2025-10-29-virakesarilk-5be77879	virakesarilk-5be77879	2025-10-29	பெலவத்த சீனிக் கைத்தொழிற்சாலையை இந்தியாவுக்கு விற்க அரசாங்கம் தீர்மானம் ; நாட்டு மக்கள் ஒன்றிணைந்து எதிர்க்க வேண்டும் - விமல் வீரவன்ச	https://www.virakesari.lk/article/229002	ta	virakesarilk	1761740640.0
lk_news	2025-10-29-virakesarilk-bbd14d80	virakesarilk-bbd14d80	2025-10-29	பொலிஸ் மாஅதிபர் பிரியந்த வீரசூரியவை பாராளுமன்றத்துக்கு அழைக்குமாறு சபாநாயகரிடம் எதிர்க்கட்சிகள் வேண்டுகோள்	https://www.virakesari.lk/article/229001	ta	virakesarilk	1761740220.0
lk_news	2025-10-29-virakesarilk-a158f388	virakesarilk-a158f388	2025-10-29	அஸ்வெசும இரண்டாம் கட்டத்திற்கு தகுதியான பயனாளிகள் வங்கி கணக்கு திறக்க அறிவுறுத்தல்	https://www.virakesari.lk/article/229000	ta	virakesarilk	1761739260.0
lk_news	2025-10-29-virakesarilk-cb146f1f	virakesarilk-cb146f1f	2025-10-29	துப்பாக்கிச்சூடுகளை பாதாள உலகக் குழுக்கள் மீது சுமத்தி விட்டு தப்பிக்க முற்பட வேண்டாம்  -   எதிர்க்கட்சி அரசாங்கத்திடம் வலியுறுத்தல்	https://www.virakesari.lk/article/228998	ta	virakesarilk	1761739020.0
lk_news	2025-10-29-virakesarilk-cf111b59	virakesarilk-cf111b59	2025-10-29	யாழ் - பலாலியில் காணி விடுவிப்பது குறித்து பாதுகாப்பு அமைச்சில் உயர்மட்ட கலந்துரையாடல்	https://www.virakesari.lk/article/228995	ta	virakesarilk	1761738960.0
lk_news	2025-10-29-virakesarilk-8989f533	virakesarilk-8989f533	2025-10-29	மட்டக்களப்பில் புதிய அரச மருந்தகம் – ஒக்டோபர் 31 பொதுமக்கள் பாவனைக்கு!	https://www.virakesari.lk/article/228994	ta	virakesarilk	1761738900.0
lk_news	2025-10-29-virakesarilk-6cc69b51	virakesarilk-6cc69b51	2025-10-29	கூட்டாட்சி முறைமை தொடர்பில் தமிழ்த்தரப்புக்களுடன் பேசத்தயார் - ஆளுந்தரப்பு உறுப்பினர்கள் கூறியதாக சுவிஸ் தூதுவர் சுமந்திரனிடம் தெரிவிப்பு	https://www.virakesari.lk/article/228993	ta	virakesarilk	1761738900.0
lk_news	2025-10-29-lankadeepalk-f9768e5a	lankadeepalk-f9768e5a	2025-10-29	ශ්‍රමදානයට ආ රැඳවියා අධිකරණ ගබඩාවෙන් ගිනි අවියක් උස්සලා	https://www.lankadeepa.lk/news/ශරමදනයට-ආ-රඳවය-අධකරණ-ගබඩවන-ගන-අවයක-උසසල/101-682328	si	lankadeepalk	1761738739.0
lk_news	2025-10-29-virakesarilk-9d2236f5	virakesarilk-9d2236f5	2025-10-29	திடீர் சுகயீனமுற்று வைத்தியசாலையில் அனுமதிக்கப்பட்ட சந்தேக நபர் கைவிலங்குகளுடன் தப்பியோட்டம்!	https://www.virakesari.lk/article/228999	ta	virakesarilk	1761738600.0
lk_news	2025-10-29-virakesarilk-ed5ca0db	virakesarilk-ed5ca0db	2025-10-29	57 உதவி கண் தொழில்நுட்ப வல்லுநர்களுக்கான உயர் டிப்ளோமா வழங்கும் விழா	https://www.virakesari.lk/article/228991	ta	virakesarilk	1761738300.0
lk_news	2025-10-29-virakesarilk-c4aced36	virakesarilk-c4aced36	2025-10-29	வரி குறித்த சர்ச்சைக்கு வி.எப்.எஸ். குளோபல் நிறுவனம் விளக்கம்	https://www.virakesari.lk/article/228988	ta	virakesarilk	1761738300.0
lk_news	2025-10-29-virakesarilk-e769c0e8	virakesarilk-e769c0e8	2025-10-29	06 மாடிக் கட்டடத்தின் நிர்மாணத்தில் மாகாணசபை அதிக சுமையை ஏற்கும் வகையில் ஒப்பந்தக்காரரினால் தயாரிக்கப்பட்ட நிர்மாணக் கொள்முதல் நடைமுறையைத் தெரிவுசெய்து சாத்தியக்கூற்று அறிக்கையும் பெற்றுக்கொள்ளப்படவில்லை – கோபா குழு கேள்வி	https://www.virakesari.lk/article/228969	ta	virakesarilk	1761737940.0
lk_news	2025-10-29-virakesarilk-243df0e6	virakesarilk-243df0e6	2025-10-29	உலக வங்கி உணர்த்­து­கின்ற  எச்­ச­ரிக்கை ; இலங்­கையின் பொரு­ளா­தா­ரத்­திற்கு நடக்கப் போவது என்ன?	https://www.virakesari.lk/article/228980	ta	virakesarilk	1761737820.0
lk_news	2025-10-29-virakesarilk-f59e8205	virakesarilk-f59e8205	2025-10-29	மித்தெனிய ஐஸ் இரசாயனங்கள் ; பியல் மனம்பேரிக்கு விளக்கமறியல் நீடிப்பு!	https://www.virakesari.lk/article/228996	ta	virakesarilk	1761737700.0
lk_news	2025-10-29-lankadeepalk-01980043	lankadeepalk-01980043	2025-10-29	ඩඩ්ලි, ආණ්ඩුවේ හොඳ නරක දෙකම දකී	https://www.lankadeepa.lk/news/ඩඩල-ආණඩව-හඳ-නරක-දකම-දක/101-682326	si	lankadeepalk	1761737449.0
lk_news	2025-10-29-virakesarilk-c0cae45f	virakesarilk-c0cae45f	2025-10-29	சிறை செல்வதற்கு நானும் தயாராகவுள்ளேன் ; உதய கம்மன்பில	https://www.virakesari.lk/article/228987	ta	virakesarilk	1761737220.0
lk_news	2025-10-29-virakesarilk-cc018360	virakesarilk-cc018360	2025-10-29	அரச - தனியார் பேருந்து சேவையின் எதிர்காலம் குறித்து யாழ்ப்பாண பாராளுமன்ற உறுப்பினர்கள்கூட்டாக கள ஆய்வு!	https://www.virakesari.lk/article/228986	ta	virakesarilk	1761737160.0
lk_news	2025-10-29-lankadeepalk-4b9f067f	lankadeepalk-4b9f067f	2025-10-29	බෝවතැන්න ජලාශය ගොඩවීමේ අවදානමක?	https://www.lankadeepa.lk/news/බවතනන-ජලශය-ගඩවම-අවදනමක/101-682325	si	lankadeepalk	1761736989.0
lk_news	2025-10-29-virakesarilk-f8307287	virakesarilk-f8307287	2025-10-29	போதைப்பொருள் எதிர்ப்பு தேசிய நடவடிக்கை – ஜனாதிபதி தலைமையில் நாளை ஆரம்பம்	https://www.virakesari.lk/article/228985	ta	virakesarilk	1761736740.0
lk_news	2025-10-29-lankadeepalk-e21285cf	lankadeepalk-e21285cf	2025-10-29	නුගේගොඩ රැලියට සජබෙ කවුරු හරි යනවා	https://www.lankadeepa.lk/news/නගගඩ-රලයට-සජබ-කවර-හර-යනව/101-682324	si	lankadeepalk	1761736661.0
lk_news	2025-10-29-lankadeepalk-fa4a8009	lankadeepalk-fa4a8009	2025-10-29	පාසල් කාලය සවස 2තෙක් දීර්ඝ කරන චක්‍රලේඛය අද හෙටම	https://www.lankadeepa.lk/latest_news/පසල-කලය-සවස-2තක-දරඝ-කරන-චකරලඛය-අද-හටම/1-682323	si	lankadeepalk	1761736092.0
lk_news	2025-10-29-virakesarilk-1a4c84ce	virakesarilk-1a4c84ce	2025-10-29	தந்தையும் மகளும் பயணித்த மோட்டார் சைக்கிள் மீது காட்டு யானை தாக்குதல்!	https://www.virakesari.lk/article/228992	ta	virakesarilk	1761735960.0
lk_news	2025-10-29-lankadeepalk-16220919	lankadeepalk-16220919	2025-10-29	රනිල්ගේ නඩුවට දින දෙයි	https://www.lankadeepa.lk/latest_news/රනලග-නඩවට-දන-දය/1-682322	si	lankadeepalk	1761735788.0
lk_news	2025-10-29-tamilmirrorlk-1fb8aca3	tamilmirrorlk-1fb8aca3	2025-10-29	JMSDF AKEBONO’’ கப்பலுக்கான விஜயத்தின் போது இருதரப்பு ஒத்துழைப்பு	https://www.tamilmirror.lk/செய்திகள்/JMSDF-AKEBONO-கப்பலுக்கான-விஜயத்தின்-போது-இருதரப்பு-ஒத்துழைப்பு/175-367059	ta	tamilmirrorlk	1761735670.0
lk_news	2025-10-29-lankadeepalk-f5647f53	lankadeepalk-f5647f53	2025-10-29	මැතිසබේ කෘෂි කමිටුවට චීනයෙන් පාඩමක්	https://www.lankadeepa.lk/latest_news/මතසබ-කෂ-කමටවට-චනයන-පඩමක/1-682320	si	lankadeepalk	1761734934.0
lk_news	2025-10-29-virakesarilk-56198adc	virakesarilk-56198adc	2025-10-29	விற்பனை நிலையத்துக்குள் அத்துமீறி நுழைந்து பணம் கொள்ளை!	https://www.virakesari.lk/article/228984	ta	virakesarilk	1761734700.0
lk_news	2025-10-29-virakesarilk-60589d54	virakesarilk-60589d54	2025-10-29	நீதிமன்ற வளாகத்தில் துப்பாக்கி ; பொலிஸார் விசாரணை!	https://www.virakesari.lk/article/228990	ta	virakesarilk	1761734640.0
lk_news	2025-10-29-virakesarilk-4f7ddcd4	virakesarilk-4f7ddcd4	2025-10-29	ரணிலுக்கு எதிரான வழக்கு மீதான விசாரணை ஒத்திவைப்பு!	https://www.virakesari.lk/article/228989	ta	virakesarilk	1761734280.0
lk_news	2025-10-29-lankadeepalk-dff3e0a7	lankadeepalk-dff3e0a7	2025-10-29	ගොවියා රකින්න ආ ආණ්ඩුව දැන් ලොකු ලූනු මනිනවා	https://www.lankadeepa.lk/latest_news/ගවය-රකනන-ආ-ආණඩව-දන-ලක-ලන-මනනව/1-682318	si	lankadeepalk	1761733981.0
lk_news	2025-10-29-tamilmirrorlk-8452e1cb	tamilmirrorlk-8452e1cb	2025-10-29	தேசிய மக்கள் சக்தி எம்.பிக்கு  பிடியாணை	https://www.tamilmirror.lk/செய்திகள்/தேசிய-மக்கள்-சக்தி-எம்-பிக்கு-பிடியாணை/175-367058	ta	tamilmirrorlk	1761733908.0
lk_news	2025-10-29-adalk-fe18c81b	adalk-fe18c81b	2025-10-29	ජනමාධයේ කියුම් කෙරුම් ජනපති මැන බලයි	https://www.ada.lk/breaking_news/ජනමාධයේ-කියුම්-කෙරුම්-ජනපති-මැන-බලයි/11-419394	si	adalk	1761733150.0
lk_news	2025-10-29-tamilmirrorlk-749af230	tamilmirrorlk-749af230	2025-10-29	ரணிலுக்கு எதிரான வழக்கு ஒத்திவைப்பு	https://www.tamilmirror.lk/செய்திகள்/ரணிலுக்கு-எதிரான-வழக்கு-ஒத்திவைப்பு/175-367057	ta	tamilmirrorlk	1761732874.0
lk_news	2025-10-29-tamilmirrorlk-2718697a	tamilmirrorlk-2718697a	2025-10-29	’’நாளையிலிருந்து முழு நாடுமே ஒன்றாக’’	https://www.tamilmirror.lk/செய்திகள்/நாளையிலிருந்து-முழு-நாடுமே-ஒன்றாக/175-367056	ta	tamilmirrorlk	1761732817.0
lk_news	2025-10-29-lankadeepalk-468cdbe1	lankadeepalk-468cdbe1	2025-10-29	සැකකරුවෙක් අත්විලංගු සමග රෝහලින් පැන යයි	https://www.lankadeepa.lk/latest_news/සකකරවක-අතවලග-සමග-රහලන-පන-යය/1-682317	si	lankadeepalk	1761732803.0
lk_news	2025-10-29-adalk-21bb2c50	adalk-21bb2c50	2025-10-29	විපක්ෂයේ රැළිය සාර්ථක වේවා	https://www.ada.lk/breaking_news/විපක්ෂයේ-රැළිය-සාර්ථක-වේවා/11-419393	si	adalk	1761732632.0
lk_news	2025-10-29-lankadeepalk-45e9260d	lankadeepalk-45e9260d	2025-10-29	විෂ මත මඩින්න හෙට ’’රටම එකට’’ එක්වෙයි	https://www.lankadeepa.lk/news/වෂ-මත-මඩනන-හට-රටම-එකට-එකවය/101-682316	si	lankadeepalk	1761732430.0
lk_news	2025-10-29-virakesarilk-5b622225	virakesarilk-5b622225	2025-10-29	கடந்தகால சிக்கல்களை ஆராயாமல் விடுவது நெருக்கடியை கொண்டுவரும் ; பயங்கரவாத தடைச்சட்டம் சர்வதேசத் தரநிலைகளைப் பூர்த்தி செய்யவில்லை என்கிறார் ஜேர்மன் தூதுவர் பீலிக்ஸ் நியுமான்	https://www.virakesari.lk/article/228983	ta	virakesarilk	1761732180.0
lk_news	2025-10-29-virakesarilk-fe0939bf	virakesarilk-fe0939bf	2025-10-29	இலங்கையில் முதலீடு செய்வதில் பல தடைகள் நிலத்தை பெறுவது பெரும்பாடு என்கிறார் ஜேர்மன் தூதுவர் பீலிக்ஸ் நியுமான்	https://www.virakesari.lk/article/228982	ta	virakesarilk	1761731880.0
lk_news	2025-10-29-tamilmirrorlk-cab1dfee	tamilmirrorlk-cab1dfee	2025-10-29	ரணிலின் மனைவியும் நீதிமன்றுக்கு வந்தார்	https://www.tamilmirror.lk/செய்திகள்/ரணிலின்-மனைவியும்-நீதிமன்றுக்கு-வந்தார்/175-367053	ta	tamilmirrorlk	1761731636.0
lk_news	2025-10-29-virakesarilk-b34013fe	virakesarilk-b34013fe	2025-10-29	ஐஸ் போதைப்பொருள் விற்பனையில் ஈடுபட்ட தம்பதி கைது!	https://www.virakesari.lk/article/228979	ta	virakesarilk	1761731340.0
lk_news	2025-10-29-tamilmirrorlk-97b2e065	tamilmirrorlk-97b2e065	2025-10-29	செட்டிகுளத்தில் குண்டுகள் ; கட்டுநாயகவில் மூவர் கைது	https://www.tamilmirror.lk/செய்திகள்/செட்டிகுளத்தில்-குண்டுகள்-கட்டுநாயகவில்-மூவர்-கைது/175-367052	ta	tamilmirrorlk	1761731294.0
lk_news	2025-10-29-virakesarilk-7145d1f0	virakesarilk-7145d1f0	2025-10-29	மன்னாரில் உணவகம், வெதுப்பகம், வர்த்தக நிலையத்திற்கு சீல்	https://www.virakesari.lk/article/228978	ta	virakesarilk	1761731220.0
lk_news	2025-10-29-virakesarilk-5d9afbc9	virakesarilk-5d9afbc9	2025-10-29	சட்டவிரோத கடத்தல் மற்றும் குற்றச் செயல்களில் பாக்கிஸ்தானின் போக்கும் அமெரிக்கத் தீர்ப்பின் பின்னணியும்	https://www.virakesari.lk/article/228976	ta	virakesarilk	1761731220.0
lk_news	2025-10-29-adalk-2a3230e2	adalk-2a3230e2	2025-10-29	රනිල්ට එරෙහි නඩුව ජනවාරි 28ට කල් යයි	https://www.ada.lk/breaking_news/රනිල්ට-එරෙහි-නඩුව-ජනවාරි-28ට-කල්-යයි/11-419392	si	adalk	1761730986.0
lk_news	2025-10-29-tamilmirrorlk-ef01c29d	tamilmirrorlk-ef01c29d	2025-10-29	ரூ.150 மில்லியன் மோசடி: பெண்ணுக்கு வலை	https://www.tamilmirror.lk/செய்திகள்/ரூ-150-மில்லியன்-மோசடி-பெண்ணுக்கு-வலை/175-367050	ta	tamilmirrorlk	1761730261.0
lk_news	2025-10-29-adalk-99c840e7	adalk-99c840e7	2025-10-29	සෙට්ටිකුලම බෝම්බ විමර්ශනයේ සැකකරුවන් ටී.අයි.ඩී. භාරයට	https://www.ada.lk/breaking_news/සෙට්ටිකුලම-බෝම්බ-විමර්ශනයේ-සැකකරුවන්-ටී-අයි-ඩී--භාරයට/11-419391	si	adalk	1761730058.0
lk_news	2025-10-29-tamilmirrorlk-7eb73917	tamilmirrorlk-7eb73917	2025-10-29	மன்னாரில் மூன்று  சீல்	https://www.tamilmirror.lk/செய்திகள்/மன்னாரில்-மூன்று-சீல்/175-367049	ta	tamilmirrorlk	1761729876.0
lk_news	2025-10-29-virakesarilk-52eb5814	virakesarilk-52eb5814	2025-10-29	சந்தேக நபரை கைதுசெய்ய பொதுமக்களிடம் உதவி கோரல்!	https://www.virakesari.lk/article/228975	ta	virakesarilk	1761729600.0
lk_news	2025-10-29-adalk-d880b038	adalk-d880b038	2025-10-29	සැකකරියක් අල්ලන්න පොලීසිය මහජන සහාය ඉල්ලයි	https://www.ada.lk/breaking_news/සැකකරියක්-අල්ලන්න-පොලීසිය-මහජන-සහාය-ඉල්ලයි/11-419390	si	adalk	1761729238.0
lk_news	2025-10-29-tamilmirrorlk-a9f5a2dc	tamilmirrorlk-a9f5a2dc	2025-10-29	பெண்களின் நிர்வாண படங்கள் வைத்திருந்ததால் காதலனை  கொன்ற காதலி	https://www.tamilmirror.lk/செய்திகள்/பெண்களின்-நிர்வாண-படங்கள்-வைத்திருந்ததால்-காதலனை-கொன்ற-காதலி/175-367048	ta	tamilmirrorlk	1761729125.0
lk_news	2025-10-29-tamilmirrorlk-9dcb5af7	tamilmirrorlk-9dcb5af7	2025-10-29	பெண்களின் நிர்வாணம்: காதலனை  கொன்ற காதலி	https://www.tamilmirror.lk/செய்திகள்/பெண்களின்-நிர்வாணம்-காதலனை-கொன்ற-காதலி/175-367048	ta	tamilmirrorlk	1761729125.0
lk_news	2025-10-29-lankadeepalk-72e2f69a	lankadeepalk-72e2f69a	2025-10-29	වයඹ පළාත් සභාව කෝපා කමිටුවට	https://www.lankadeepa.lk/news/වයඹ-පළත-සභව-කප-කමටවට/101-682310	si	lankadeepalk	1761728937.0
lk_news	2025-10-29-virakesarilk-640ef492	virakesarilk-640ef492	2025-10-29	பெருந்தோட்டத் தொழிலாளர்களின் சம்பள விவகாரம் : சட்ட ரீதியாக அரசாங்கத்தால் பணிப்புரை விடுக்க முடியாது ; ஆனால் வாக்குறுதியை நிறைவேற்றுவோம் : அமைச்சர் சமந்த வித்தியாரத்ன	https://www.virakesari.lk/article/228974	ta	virakesarilk	1761728580.0
