doc_type	doc_id	num	date_str	description	url_metadata	lang	newspaper_id	time_ut
lk_news	2025-10-28-dailyftlk-7d42a597	dailyftlk-7d42a597	2025-10-28	Auditor General gets letter on audited financials of Royal College SDS for 2024	https://www.ft.lk/opinion/Auditor-General-gets-letter-on-audited-financials-of-Royal-College-SDS-for-2024/14-783529	en	dailyftlk	1761610819.0
lk_news	2025-10-28-dailyftlk-0c743640	dailyftlk-0c743640	2025-10-28	Unequal exchange: Systematic drain of value from Global South	https://www.ft.lk/columns/Unequal-exchange-Systematic-drain-of-value-from-Global-South/4-783528	en	dailyftlk	1761610754.0
lk_news	2025-10-28-dailyftlk-8b90b49d	dailyftlk-8b90b49d	2025-10-28	From “No Kings” to “No Clients”: Political and economic gravity – Part 1	https://www.ft.lk/columns/From-No-Kings-to-No-Clients-Political-and-economic-gravity-Part-1/4-783527	en	dailyftlk	1761610478.0
lk_news	2025-10-28-dailyftlk-56ef0b64	dailyftlk-56ef0b64	2025-10-28	Role of Government in a market economy	https://www.ft.lk/columns/Role-of-Government-in-a-market-economy/4-783525	en	dailyftlk	1761610184.0
lk_news	2025-10-28-dailyftlk-b771e01b	dailyftlk-b771e01b	2025-10-28	Parading suspects before media questions professionalism of investigators – Saliya Peiris	https://www.ft.lk/news/Parading-suspects-before-media-questions-professionalism-of-investigators-Saliya-Peiris/56-783524	en	dailyftlk	1761609808.0
lk_news	2025-10-28-dailyftlk-ccba0663	dailyftlk-ccba0663	2025-10-28	CIABOC briefs Foreign Ministry officials on combatting bribery and corruption	https://www.ft.lk/news/CIABOC-briefs-Foreign-Ministry-officials-on-combatting-bribery-and-corruption/56-783523	en	dailyftlk	1761609675.0
lk_news	2025-10-28-dailyftlk-613893c2	dailyftlk-613893c2	2025-10-28	Opposition alliance to launch joint campaign on 21 Nov., SJB opts out	https://www.ft.lk/news/Opposition-alliance-to-launch-joint-campaign-on-21-Nov-SJB-opts-out/56-783522	en	dailyftlk	1761609563.0
lk_news	2025-10-28-dailyftlk-b0cc06dd	dailyftlk-b0cc06dd	2025-10-28	Indian nabbed at BIA with heroin worth Rs. 85 m	https://www.ft.lk/news/Indian-nabbed-at-BIA-with-heroin-worth-Rs-85-m/56-783521	en	dailyftlk	1761609535.0
lk_news	2025-10-28-dailyftlk-c617b954	dailyftlk-c617b954	2025-10-28	Govt. plans smartphone ban for under 12s	https://www.ft.lk/news/Govt-plans-smartphone-ban-for-under-12s/56-783520	en	dailyftlk	1761609515.0
lk_news	2025-10-28-virakesarilk-97a6a77c	virakesarilk-97a6a77c	2025-10-28	மக்களாட்சியின் டிஜிட்டல் எல்லையைப் பாதுகாத்தல் ‘தேர்தல் நேர்மைக்கான பல்தரப்புக்களப் போராட்டம்’	https://www.virakesari.lk/article/228845	ta	virakesarilk	1761608460.0
lk_news	2025-10-28-virakesarilk-1643d4a2	virakesarilk-1643d4a2	2025-10-28	பம்பலப்பிட்டி கதிரேசன் ஆலயத்தில் சூரசம்ஹார நிகழ்வு சிறப்புற நடைபெற்றது	https://www.virakesari.lk/article/228844	ta	virakesarilk	1761607980.0
lk_news	2025-10-28-virakesarilk-067adb90	virakesarilk-067adb90	2025-10-28	திருகோணமலை முத்துக்குமாரசுவாமி ஆலயத்தில் சூரசம்ஹார விழா சிறப்பாக நிறைவு	https://www.virakesari.lk/article/228843	ta	virakesarilk	1761607620.0
lk_news	2025-10-28-dailyftlk-fb3102f2	dailyftlk-fb3102f2	2025-10-28	Urgent repairs planned for historic Nuwara Eliya Post Office amid heritage conservation push	https://www.ft.lk/news/Urgent-repairs-planned-for-historic-Nuwara-Eliya-Post-Office-amid-heritage-conservation-push/56-783518	en	dailyftlk	1761604670.0
lk_news	2025-10-27-virakesarilk-1b579f1a	virakesarilk-1b579f1a	2025-10-27	மட்டு. களுவதாவளை சிவ சக்தி ஸ்ரீ முருகன் ஆலயத்தில் வெகு சிறப்பாக நடந்தேறிய சூரன்போர்	https://www.virakesari.lk/article/228842	ta	virakesarilk	1761589680.0
lk_news	2025-10-27-islandlk-bac70334	islandlk-bac70334	2025-10-27	Night of Music and Fellowship	http://island.lk/night-of-music-and-fellowship/	en	islandlk	1761588780.0
lk_news	2025-10-27-islandlk-ff87d693	islandlk-ff87d693	2025-10-27	Kaspersky Industrial Cybersecurity enhances performance: new capabilities improve network security and operational effectiveness	http://island.lk/kaspersky-industrial-cybersecurity-enhances-performance-new-capabilities-improve-network-security-and-operational-effectiveness/	en	islandlk	1761588060.0
lk_news	2025-10-27-islandlk-43b90bd2	islandlk-43b90bd2	2025-10-27	Month-end profit-takings slow down share market, 13 crossings notwithstanding	http://island.lk/month-end-profit-takings-slow-down-share-market-13-crossings-notwithstanding/	en	islandlk	1761588000.0
lk_news	2025-10-27-islandlk-9bff3064	islandlk-9bff3064	2025-10-27	Standard Chartered appoints Kumudu Munasinghe as Head of Corporate Affairs, Brand and Marketing	http://island.lk/standard-chartered-appoints-kumudu-munasinghe-as-head-of-corporate-affairs-brand-and-marketing/	en	islandlk	1761587940.0
lk_news	2025-10-27-islandlk-122bf6bf	islandlk-122bf6bf	2025-10-27	Softlogic GLOMARK expands footprint with all-new outlet at Horton Place	http://island.lk/softlogic-glomark-expands-footprint-with-all-new-outlet-at-horton-place/	en	islandlk	1761587640.0
lk_news	2025-10-27-islandlk-62642d38	islandlk-62642d38	2025-10-27	Unit Trust Association of Sri Lanka launches “Investor Awareness Initiative” to empower public to build wealth through Unit Trusts	http://island.lk/unit-trust-association-of-sri-lanka-launches-investor-awareness-initiative-to-empower-public-to-build-wealth-through-unit-trusts/	en	islandlk	1761587580.0
lk_news	2025-10-27-tamilmirrorlk-a09eade1	tamilmirrorlk-a09eade1	2025-10-27	வடக்கு புகையிரத சேவைகள் முற்றாக பாதிப்பு	https://www.tamilmirror.lk/செய்திகள்/வடக்கு-புகையிரத-சேவைகள்-முற்றாக-பாதிப்பு/175-366955	ta	tamilmirrorlk	1761586760.0
lk_news	2025-10-27-tamilmirrorlk-d0e30834	tamilmirrorlk-d0e30834	2025-10-27	பூஸ்ஸ சிறையில் தொலைபேசிகள் மீட்பு	https://www.tamilmirror.lk/செய்திகள்/பூஸ்ஸ-சிறையில்-தொலைபேசிகள்-மீட்பு/175-366954	ta	tamilmirrorlk	1761581259.0
lk_news	2025-10-27-virakesarilk-bc3a248d	virakesarilk-bc3a248d	2025-10-27	இலத்திரனியல் விசா விநியோக விவகாரம் : முடிந்தால் டிரான் அழஸிற்கு எதிராக சட்ட நடவடிக்கை எடுங்கள் ஜனாதிபதிக்கு இந்த விடயம் அக்கினி பரீட்சை - பாட்டலி ஜனாதிபதிக்கு சவால்	https://www.virakesari.lk/article/228841	ta	virakesarilk	1761579240.0
lk_news	2025-10-27-virakesarilk-dade74ba	virakesarilk-dade74ba	2025-10-27	ரத்தொலுவலில் தெற்கில் வலிந்து காணாமலாக்கப்பட்டோரை நினைவுகூரும் நிகழ்வு - ஜனாதிபதியிடம் மகஜரொன்றும் கையளிப்பு	https://www.virakesari.lk/article/228840	ta	virakesarilk	1761578820.0
lk_news	2025-10-27-virakesarilk-58e5f2ab	virakesarilk-58e5f2ab	2025-10-27	மொன்தா புயல் கடும் சூறாவளியாக வலுப்பெறலாம் என வளிமண்டலவியல் திணைக்களம் எதிர்வு கூறல்	https://www.virakesari.lk/article/228839	ta	virakesarilk	1761578160.0
lk_news	2025-10-27-lankadeepalk-ca28a254	lankadeepalk-ca28a254	2025-10-27	සියලු දෙනා එකතු කරගෙන අධ්‍යාපන ප්‍රතිසංස්කරණ පරදනවා	https://www.lankadeepa.lk/news/සයල-දන-එකත-කරගන-අධයපන-පරතසසකරණ-පරදනව/101-682175	si	lankadeepalk	1761577373.0
lk_news	2025-10-27-virakesarilk-ee42c23a	virakesarilk-ee42c23a	2025-10-27	கிண்ணியா நகர சபை தவிசாளர் உடன் கஜேந்திர குமார் எம் பி சந்திப்பு	https://www.virakesari.lk/article/228838	ta	virakesarilk	1761577020.0
lk_news	2025-10-27-tamilmirrorlk-6e325e51	tamilmirrorlk-6e325e51	2025-10-27	எதிர்க்கட்சிகள் ஒன்று சேர்வது நல்லது-துணை அமைச்சர்	https://www.tamilmirror.lk/செய்திகள்/எதிர்க்கட்சிகள்-ஒன்று-சேர்வது-நல்லது-துணை-அமைச்சர்/175-366951	ta	tamilmirrorlk	1761574668.0
lk_news	2025-10-27-tamilmirrorlk-61b5ff8b	tamilmirrorlk-61b5ff8b	2025-10-27	LGBTQ சுற்றுலா திட்டத்திற்கு எதிராக மனுத் தாக்கல்	https://www.tamilmirror.lk/செய்திகள்/LGBTQ-சுற்றுலா-திட்டத்திற்கு-எதிராக-மனுத்-தாக்கல்/175-366939	ta	tamilmirrorlk	1761574103.0
lk_news	2025-10-27-virakesarilk-87acbff0	virakesarilk-87acbff0	2025-10-27	யாழ். தமிழ்ச் சங்கமும் அரசகரும மொழிகள் திணைக்களமும் இணைந்து நடத்திய புலமைத்துவக் கலந்துரையாடல்!	https://www.virakesari.lk/article/228835	ta	virakesarilk	1761572700.0
lk_news	2025-10-27-virakesarilk-62ff266f	virakesarilk-62ff266f	2025-10-27	மலேசிய மகளிர் கிரிக்கெட் அணியினர் இலங்கை வருகின்றனர்	https://www.virakesari.lk/article/228836	ta	virakesarilk	1761572640.0
lk_news	2025-10-27-lankadeepalk-865407b7	lankadeepalk-865407b7	2025-10-27	ජගත්ට දුන් ආරක්ෂාව ගැන පොලිස්පති කී දේකට සජබ විරෝධය	https://www.lankadeepa.lk/news/ජගතට-දන-ආරකෂව-ගන-පලසපත-ක-දකට-සජබ-වරධය/101-682174	si	lankadeepalk	1761572233.0
lk_news	2025-10-27-virakesarilk-9eb45541	virakesarilk-9eb45541	2025-10-27	வடக்கு மாகாண உள்ளூராட்சி அமைச்சின் செயலாளரைச் சந்தித்தார் துரைராசா ரவிகரன்	https://www.virakesari.lk/article/228834	ta	virakesarilk	1761571680.0
lk_news	2025-10-27-virakesarilk-3cc2d1da	virakesarilk-3cc2d1da	2025-10-27	அருவக்காடு திண்மக் கழிவு முகாமைத்துவத் திட்டத்தை கண்காணித்தார் பிரதமர்	https://www.virakesari.lk/article/228832	ta	virakesarilk	1761571500.0
lk_news	2025-10-27-virakesarilk-fd7670ad	virakesarilk-fd7670ad	2025-10-27	அரசாங்கத்தின் சர்வாதிகார செயற்பாடுகளுக்கு எதிராக எதிர்க்கட்சிகள் ஒன்றிணைய வேண்டும் – மக்கள் குரல் அமைப்பு	https://www.virakesari.lk/article/228829	ta	virakesarilk	1761571380.0
lk_news	2025-10-27-lankadeepalk-8aaf262b	lankadeepalk-8aaf262b	2025-10-27	ලොකු ලූනු මිලට ගන්න වට මනී	https://www.lankadeepa.lk/news/ලක-ලන-මලට-ගනන-වට-මන/101-682173	si	lankadeepalk	1761571279.0
lk_news	2025-10-27-virakesarilk-cd7d6c66	virakesarilk-cd7d6c66	2025-10-27	பாதுகாப்பு கட்டமைப்பு முழுமையாக அரசியல்மயமாகியுள்ளது – சாகர காரியவசம்	https://www.virakesari.lk/article/228827	ta	virakesarilk	1761571080.0
lk_news	2025-10-27-virakesarilk-b1c7a6c9	virakesarilk-b1c7a6c9	2025-10-27	13ஐ முழுமையாக நடைமுறைப்படுத்தி தமிழீழத்தை உருவாக்குவதே ஐ.நா.வின் நோக்கம் ; அதற்கு அரசாங்கமும் துணை நிற்கிறது - முன்னாள் கடற்படை அதிகாரி டி.கே.பி.தசநாயக்க	https://www.virakesari.lk/article/228826	ta	virakesarilk	1761570900.0
lk_news	2025-10-27-lankadeepalk-28bd51a3	lankadeepalk-28bd51a3	2025-10-27	වැලිගම සභාපති ඝාතනයට සැකපිට ගත් තිදෙනා රඳවා ගන්න අවසර	https://www.lankadeepa.lk/news/වලගම-සභපත-ඝතනයට-සකපට-ගත-තදන-රඳව-ගනන-අවසර/101-682172	si	lankadeepalk	1761570723.0
lk_news	2025-10-27-lankadeepalk-45b06dc8	lankadeepalk-45b06dc8	2025-10-27	තේ වතු හිමි ව්‍යාපාරික යුවළක් කඩුවලින් කපලා	https://www.lankadeepa.lk/news/ත-වත-හම-වයපරක-යවළක-කඩවලන-කපල/101-682171	si	lankadeepalk	1761569812.0
lk_news	2025-10-27-virakesarilk-9d7ef83f	virakesarilk-9d7ef83f	2025-10-27	ஊழலை எதிர்த்துப் போராடுதல் குறித்து வெளிவிவகார அமைச்சின் அதிகாரிகளுக்கு விளக்கம் - இலஞ்ச, ஊழல் விசாரணை ஆணைக்குழுவின் பணிப்பாளர் நாயகம் நடவடிக்கை	https://www.virakesari.lk/article/228825	ta	virakesarilk	1761569520.0
lk_news	2025-10-27-virakesarilk-6ab94739	virakesarilk-6ab94739	2025-10-27	இலங்கை தொடர்பான புதிய தீர்மானம்: நீதிக்குப் பதிலாக தண்டனைகளிலிருந்து விடுபடும் போக்கையே ஊக்குவிக்கிறது - ஐ.நா மனித உரிமைகள் உயர்ஸ்தானிகரிடம் பிரித்தானிய தமிழர் பேரவை விசனம்	https://www.virakesari.lk/article/228824	ta	virakesarilk	1761569280.0
lk_news	2025-10-27-virakesarilk-3831005c	virakesarilk-3831005c	2025-10-27	கிழக்கு கடலில் நோய்வாய்ப்பட்ட MV IYO கப்பலின் பணியாளரை சிகிச்சைக்காக தரையிறக்க கடற்படையினர் உதவி!	https://www.virakesari.lk/article/228828	ta	virakesarilk	1761569100.0
lk_news	2025-10-27-virakesarilk-dde39c22	virakesarilk-dde39c22	2025-10-27	உயிர்த்த ஞாயிறு தாக்குதல் ; மைத்திரிபால சிறிசேனவின் மனு தொடர்பில் நீதிமன்றம் பிறப்பித்த உத்தரவு!	https://www.virakesari.lk/article/228823	ta	virakesarilk	1761569040.0
lk_news	2025-10-27-tamilmirrorlk-45ef6972	tamilmirrorlk-45ef6972	2025-10-27	சூரசம்ஹாரம்...	https://www.tamilmirror.lk/பிரதான-செய்திகள்/சூரசம்ஹாரம்/46-366937	ta	tamilmirrorlk	1761569003.0
lk_news	2025-10-27-adalk-83d8d1ee	adalk-83d8d1ee	2025-10-27	මිහින්තලෙ බෝධියක් කඩා වැටී අයෙක් මරුට	https://www.ada.lk/breaking_news/මිහින්තලෙ-බෝධියක්-කඩා-වැටී-අයෙක්-මරුට/11-419349	si	adalk	1761568572.0
lk_news	2025-10-27-lankadeepalk-be672b10	lankadeepalk-be672b10	2025-10-27	පිටරට ඉන්න ලාංකිකයින්ටත්  ඡන්ද අයිතිය	https://www.lankadeepa.lk/news/පටරට-ඉනන-ලකකයනටත-ඡනද-අයතය/101-682170	si	lankadeepalk	1761568519.0
lk_news	2025-10-27-virakesarilk-140c8d37	virakesarilk-140c8d37	2025-10-27	ஐசிசி மகளிர் உலகக் கிண்ண அரை இறுதிகள்: மத்தியஸ்தர்கள் குழாத்தில் இலங்கையின் நிமாலி, மிஷெல்	https://www.virakesari.lk/article/228833	ta	virakesarilk	1761568380.0
lk_news	2025-10-27-virakesarilk-31980166	virakesarilk-31980166	2025-10-27	“மிதிகம லசா” படுகொலை ; பிரதான துப்பாக்கிதாரி நீதிமன்ற வைத்தியரிடம் முன்னிலைப்படுத்தப்பட்டார்!	https://www.virakesari.lk/article/228831	ta	virakesarilk	1761567420.0
lk_news	2025-10-27-adalk-c03758cd	adalk-c03758cd	2025-10-27	මන්දකට හසු වී සිටි කදුකර කොටියා නිර්වින්දනය කර මුදා ගනිියි	https://www.ada.lk/breaking_news/මන්දකට-හසු-වී-සිටි-කදුකර-කොටියා-නිර්වින්දනය-කර-මුදා-ගනිියි/11-419348	si	adalk	1761567384.0
lk_news	2025-10-27-virakesarilk-0f64c98b	virakesarilk-0f64c98b	2025-10-27	யாழ்ப்பாணத்தில் 11 பேருக்கு மட்டுமல்ல மேலும் பலருக்கு எதிராக வழக்கு தாக்கல் - பொலிஸ்	https://www.virakesari.lk/article/228830	ta	virakesarilk	1761567240.0
lk_news	2025-10-27-lankadeepalk-e2a001fc	lankadeepalk-e2a001fc	2025-10-27	හරිනි - අරුවක්කාලු බලන්න යයි	https://www.lankadeepa.lk/news/හරන-අරවකකල-බලනන-යය/101-682169	si	lankadeepalk	1761567140.0
lk_news	2025-10-27-adalk-39c2a2fa	adalk-39c2a2fa	2025-10-27	විදෙස් ගත ශ්‍රී ලාංකිකයින්ට ඡන්ද අයිතිය	https://www.ada.lk/breaking_news/විදෙස්-ගත-ශ්‍රී-ලාංකිකයින්ට-ඡන්ද-අයිතිය/11-419347	si	adalk	1761566732.0
lk_news	2025-10-27-lankadeepalk-4006e35f	lankadeepalk-4006e35f	2025-10-27	රටවල් දෙකක ගුවන් සේවා හෙට සිට මත්තලට	https://www.lankadeepa.lk/news/රටවල-දකක-ගවන-සව-හට-සට-මතතලට/101-682168	si	lankadeepalk	1761565918.0
lk_news	2025-10-27-lankadeepalk-1f237123	lankadeepalk-1f237123	2025-10-27	’’සිපෙට්කෝ ලිහිසි තෙල්” ධීවරයන්ට ළගටම	https://www.lankadeepa.lk/news/සපටක-ලහස-තල-ධවරයනට-ළගටම/101-682167	si	lankadeepalk	1761565535.0
lk_news	2025-10-27-tamilmirrorlk-ecb91542	tamilmirrorlk-ecb91542	2025-10-27	வெளிநாடுகளில் வசிக்கும் இலங்கையர்களுக்கு விசேட செய்தி	https://www.tamilmirror.lk/செய்திகள்/வெளிநாடுகளில்-வசிக்கும்-இலங்கையர்களுக்கு-விசேட-செய்தி/175-366932	ta	tamilmirrorlk	1761565347.0
lk_news	2025-10-27-virakesarilk-94f4b367	virakesarilk-94f4b367	2025-10-27	நாட்டின் அபிவிருத்திக்காக ரணில் விக்ரமசிங்கவை பயன்படுத்திக்கொள்ள வேண்டும் ;  வஜிர அபேவர்தன	https://www.virakesari.lk/article/228822	ta	virakesarilk	1761564840.0
lk_news	2025-10-27-tamilmirrorlk-47e9a061	tamilmirrorlk-47e9a061	2025-10-27	எதிர்க்கட்சிக் கூட்டணியில் டெலிபோனைக் காணவில்லை	https://www.tamilmirror.lk/செய்திகள்/எதிர்க்கட்சிக்-கூட்டணியில்-டெலிபோனைக்-காணவில்லை/175-366931	ta	tamilmirrorlk	1761564813.0
lk_news	2025-10-27-virakesarilk-8e1a7688	virakesarilk-8e1a7688	2025-10-27	அரசாங்கம் பதவி  காலத்தை நிறைவு செய்ய இடமளிப்பதற்கு நாட்டு மக்கள் தயார் நிலையில் இல்லை ; மஹிந்த அமரவீர	https://www.virakesari.lk/article/228821	ta	virakesarilk	1761564780.0
lk_news	2025-10-27-lankadeepalk-4651ae38	lankadeepalk-4651ae38	2025-10-27	සංජය මහවත්තට වාරණයක්	https://www.lankadeepa.lk/latest_news/සජය-මහවතතට-වරණයක/1-682166	si	lankadeepalk	1761564528.0
lk_news	2025-10-27-virakesarilk-abb902f2	virakesarilk-abb902f2	2025-10-27	உலகில் மிக விரும்பப்படும் சுற்றுலாத் தலங்களில் இணைந்துள்ள யாழ்ப்பாணம்	https://www.virakesari.lk/article/228805	ta	virakesarilk	1761564480.0
lk_news	2025-10-27-virakesarilk-2ea4b991	virakesarilk-2ea4b991	2025-10-27	ஹிட்லருக்கு எதிரான கூட்டணி போன்றது எம்முடையது…! ; யானை– கை –மொட்டு கட்சிகளின் பிரகடனம்	https://www.virakesari.lk/article/228819	ta	virakesarilk	1761564300.0
lk_news	2025-10-27-virakesarilk-6f990fea	virakesarilk-6f990fea	2025-10-27	பொலிஸார் ஹிட்லரின் பொலிஸாரை போன்று செயற்படுகிறார்கள் -  உதய கம்மன்பில	https://www.virakesari.lk/article/228820	ta	virakesarilk	1761564180.0
lk_news	2025-10-27-virakesarilk-8e6772b8	virakesarilk-8e6772b8	2025-10-27	எச்.பி. பியசிறி அரச ஆயுர்வேத வைத்தியசாலையின் புதிய மூன்று மாடி சிகிச்சைப் பிரிவுக் கட்டடத் தொகுதி திறந்து வைப்பு!	https://www.virakesari.lk/article/228818	ta	virakesarilk	1761564120.0
lk_news	2025-10-27-virakesarilk-d5b35dc1	virakesarilk-d5b35dc1	2025-10-27	சபாநாயகரின் செயற்பாடுகள் சண்டித்தனமானவை - தலதா அத்துகோரல	https://www.virakesari.lk/article/228817	ta	virakesarilk	1761564060.0
lk_news	2025-10-27-tamilmirrorlk-b8b7fa64	tamilmirrorlk-b8b7fa64	2025-10-27	குறிஞ்சாக்கேணிக்கான பாதுகாப்பான படகு பாதை பயணம்  ஆரம்பம்	https://www.tamilmirror.lk/செய்திகள்/குறிஞ்சாக்கேணிக்கான-பாதுகாப்பான-படகு-பாதை-பயணம்-ஆரம்பம்/175-366930	ta	tamilmirrorlk	1761563841.0
lk_news	2025-10-27-virakesarilk-766760fb	virakesarilk-766760fb	2025-10-27	பொலிஸ் மா அதிபருக்கெதிராக சட்ட நடவடிக்கை - பாராளுமன்ற உறுப்பினர் ஜகத் விதான	https://www.virakesari.lk/article/228816	ta	virakesarilk	1761563520.0
lk_news	2025-10-27-virakesarilk-d2e913e7	virakesarilk-d2e913e7	2025-10-27	சிறைச்சாலையில் விசேட சோதனை ; கையடக்கத் தொலைபேசிகள் கைப்பற்றல்!	https://www.virakesari.lk/article/228812	ta	virakesarilk	1761563220.0
lk_news	2025-10-27-virakesarilk-0dd3820b	virakesarilk-0dd3820b	2025-10-27	போதைப்பொருள் விற்பனையில் ஈடுபட்ட ஓய்வு பெற்ற ஆசிரியையும் மருமகனும் கைது!	https://www.virakesari.lk/article/228815	ta	virakesarilk	1761563100.0
lk_news	2025-10-27-virakesarilk-a09c668e	virakesarilk-a09c668e	2025-10-27	இலஞ்ச ஊழல் முறைப்பாட்டுக்காக வாழும் அச்சுறுத்தல்; கிளிநொச்சி மாவட்டத்தில் ஊழல் எதிர்ப்பு ஆர்வலர் மீது தாக்குதல்	https://www.virakesari.lk/article/228814	ta	virakesarilk	1761563040.0
lk_news	2025-10-27-lankadeepalk-8b4677b8	lankadeepalk-8b4677b8	2025-10-27	ක්‍රිකට් තරඟ පාවාදීමට අනුබල දුන් තිදෙනකුගෙන් ප්‍රකාශ ගන්න නියෝගයක්	https://www.lankadeepa.lk/test/කරකට-තරඟ-පවදමට-අනබල-දන-තදනකගන-පරකශ-ගනන-නයගයක/222-682165	si	lankadeepalk	1761563009.0
