doc_type	doc_id	num	date_str	description	url_metadata	lang	newspaper_id	time_ut
lk_news	2025-09-26-lankadeepalk-f9cbb369	lankadeepalk-f9cbb369	2025-09-26	මධ්‍යම පරිසර අධිකාරිය GOv pay හා එක් වෙයි	https://www.lankadeepa.lk/latest_news/මධයම-පරසර-අධකරය-GOv-pay-හ-එක-වය/1-680295	si	lankadeepalk	1758901359.0
lk_news	2025-09-26-lankadeepalk-ad354731	lankadeepalk-ad354731	2025-09-26	උ.පෙළ විභාග පරීක්ෂකයන් ඔන්ලයින් තෝරයි	https://www.lankadeepa.lk/news/උ-පළ-වභග-පරකෂකයන-ඔනලයන-තරය/101-680294	si	lankadeepalk	1758900397.0
lk_news	2025-09-26-virakesarilk-ea2a74b1	virakesarilk-ea2a74b1	2025-09-26	கடற்றொழிலாளர்களின் பிள்ளைகளின் கல்விக்கு ஜனாதிபதி நிதியத்திலிருந்து விசேட நிதி உதவி – கடற்றொழில் அமைச்சர்	https://www.virakesari.lk/article/226200	ta	virakesarilk	1758896940.0
lk_news	2025-09-26-lankadeepalk-eb9e5f4f	lankadeepalk-eb9e5f4f	2025-09-26	තිස්සමහාරාම වෙඩි තැබීමකින් අයෙක් මරුට	https://www.lankadeepa.lk/latest_news/තසසමහරම-වඩ-තබමකන-අයක-මරට/1-680293	si	lankadeepalk	1758896894.0
lk_news	2025-09-26-virakesarilk-6723e65c	virakesarilk-6723e65c	2025-09-26	காங்கேசன்துறை துறைமுக அபிவிருத்தி இறுதி தீர்மானம் ஏதும் எடுக்கப்படவில்லை - அமைச்சர் பிமல் ரத்நாயக்க	https://www.virakesari.lk/article/226196	ta	virakesarilk	1758896820.0
lk_news	2025-09-26-virakesarilk-6cc6440e	virakesarilk-6cc6440e	2025-09-26	யாழ். பழைய பூங்காவில் உள்ள சிறுவர் பூங்காவை மேம்படுத்த நடவடிக்கை - அரசாங்க அதிபர்	https://www.virakesari.lk/article/226187	ta	virakesarilk	1758896760.0
lk_news	2025-09-26-virakesarilk-2d110c0a	virakesarilk-2d110c0a	2025-09-26	மன்னார் மக்களை எதிர்த்து அடாவடியாக காற்றாலை திட்டத்தை முன்னெடுக்கவேண்டாம்  - ரவிகரன்	https://www.virakesari.lk/article/226190	ta	virakesarilk	1758896640.0
lk_news	2025-09-26-virakesarilk-16301456	virakesarilk-16301456	2025-09-26	அமைதி, மேம்பாட்டின் உன்னத நோக்கத்திற்கு சீனா மகத்தான பங்களிப்புகளைச் செய்யும் - சீனத் தூதுவர்	https://www.virakesari.lk/article/226199	ta	virakesarilk	1758896400.0
lk_news	2025-09-26-lankadeepalk-7f6a8748	lankadeepalk-7f6a8748	2025-09-26	කෘතිම බුද්ධිය වෘත්තීය මාධ්‍යවේදියාට පහරක්ද?	https://www.lankadeepa.lk/test/කතම-බදධය-වතතය-මධයවදයට-පහරකද/222-680292	si	lankadeepalk	1758895070.0
lk_news	2025-09-26-virakesarilk-6bbd3eea	virakesarilk-6bbd3eea	2025-09-26	மருத்துவம், ஆயுர்வேதம், உணவு மற்றும் அழகு சாதன பரிசோதனைகளுக்கு நவீன ஆய்வுகூடம் - அமைச்சர் நளிந்த ஜயதிஸ்ஸ	https://www.virakesari.lk/article/226192	ta	virakesarilk	1758894600.0
lk_news	2025-09-26-virakesarilk-e7c7c225	virakesarilk-e7c7c225	2025-09-26	ஏறாவூர் சுற்றுலா நீதிமன்ற சிறைக்கூடத்தில் கைதி ஒருவர் உயிர்மாய்ப்பு	https://www.virakesari.lk/article/226193	ta	virakesarilk	1758894540.0
lk_news	2025-09-26-virakesarilk-d0206942	virakesarilk-d0206942	2025-09-26	ஆசிய அபிவிருத்தி வங்கியின் நிதியுதவியில் சுகாதார சேவைகளுக்கு பயன்படுத்த 7 வாகனங்கள் வழங்கி வைப்பு	https://www.virakesari.lk/article/226194	ta	virakesarilk	1758894360.0
lk_news	2025-09-26-virakesarilk-03871ed8	virakesarilk-03871ed8	2025-09-26	இலஞ்சம் பெற்ற குற்றச்சாட்டில் மூவர் கைது	https://www.virakesari.lk/article/226198	ta	virakesarilk	1758894120.0
lk_news	2025-09-26-virakesarilk-b729cc24	virakesarilk-b729cc24	2025-09-26	வேன் - சிறிய லொறி - முச்சக்கர வண்டி  மோதி விபத்து ; 12 பேர் காயம்,  பண்டாரகமயில்  சம்பவம்	https://www.virakesari.lk/article/226197	ta	virakesarilk	1758894060.0
lk_news	2025-09-26-tamilmirrorlk-b49c06e3	tamilmirrorlk-b49c06e3	2025-09-26	பகிடிவதை விவகாரம் : மாணவர்களுக்கு விளக்கமறியல்	https://www.tamilmirror.lk/செய்திகள்/பகிடிவதை-விவகாரம்-மாணவர்களுக்கு-விளக்கமறியல்/175-365341	ta	tamilmirrorlk	1758893898.0
lk_news	2025-09-26-tamilmirrorlk-8a788e25	tamilmirrorlk-8a788e25	2025-09-26	ஆடையை கழற்றி பகிடிவதை : மாணவர்களுக்கு விளக்கமறியல்	https://www.tamilmirror.lk/செய்திகள்/ஆடையை-கழற்றி-பகிடிவதை-மாணவர்களுக்கு-விளக்கமறியல்/175-365341	ta	tamilmirrorlk	1758893898.0
lk_news	2025-09-26-lankadeepalk-7f3bfbc9	lankadeepalk-7f3bfbc9	2025-09-26	නා උයන ආරණ්‍යයේ හිමිවරුන්ට වජිර අවසන් ගෞරව දක්වයි	https://www.lankadeepa.lk/latest_news/න-උයන-ආරණයය-හමවරනට-වජර-අවසන-ගරව-දකවය/1-680291	si	lankadeepalk	1758892229.0
lk_news	2025-09-26-lankadeepalk-122f2950	lankadeepalk-122f2950	2025-09-26	නා උයනනේ අනතුර ගැන කතෝලික සම්මේලනයෙන් ශෝක පණිවුඩයක්	https://www.lankadeepa.lk/latest_news/න-උයනන-අනතර-ගන-කතලක-සමමලනයන-ශක-පණවඩයක/1-680290	si	lankadeepalk	1758891620.0
lk_news	2025-09-26-lankadeepalk-b343d8c2	lankadeepalk-b343d8c2	2025-09-26	’’ආණ්ඩුවේ ප්‍රතිපත්ති’’ ක්‍රියාත්මක කිරීම ගැන සතුටුයි	https://www.lankadeepa.lk/news/ආණඩව-පරතපතත-කරයතමක-කරම-ගන-සතටය/101-680289	si	lankadeepalk	1758891323.0
lk_news	2025-09-26-virakesarilk-8f09c243	virakesarilk-8f09c243	2025-09-26	அறுகம்பேயில் உள்ள இஸ்ரேலின் சபாத் இல்லத்தினால் மக்கள் பீதியடைந்தால் சட்ட நடவடிக்கை எடுக்குமாறு நீதிமன்றம் பொலிஸாருக்கு ஆலோசனை - அமைச்சர் சுனில் செனவி	https://www.virakesari.lk/article/226189	ta	virakesarilk	1758891000.0
lk_news	2025-09-26-virakesarilk-bbd747ae	virakesarilk-bbd747ae	2025-09-26	வவுனியா வடக்கில் தமிழர்களின் பூர்வீக காணிகள், குளங்களை விழுங்கப்போகும் கிவுல் ஓயா திட்டத்தை உடன் நிறுத்துங்கள் -  ரவிகரன்	https://www.virakesari.lk/article/226188	ta	virakesarilk	1758890640.0
lk_news	2025-09-26-virakesarilk-02882d52	virakesarilk-02882d52	2025-09-26	சாதனை படைக்கும் ரஜினி கிஷன் நடிக்கும் 'ரஜினி கேங்'	https://www.virakesari.lk/article/226186	ta	virakesarilk	1758890400.0
lk_news	2025-09-26-virakesarilk-5ece12c7	virakesarilk-5ece12c7	2025-09-26	நடிகை யாஷிகா ஆனந்த் நடிக்கும் 'டாஸ்' படத்தின் படப்பிடிப்பு தொடக்கம்	https://www.virakesari.lk/article/226184	ta	virakesarilk	1758890040.0
lk_news	2025-09-26-lankadeepalk-63b3da7c	lankadeepalk-63b3da7c	2025-09-26	ලංගම ඩිපෝවල ලොක්කෝ පොඩ්ඩෝ  උදේ ඉදන් සූර් වෙලා	https://www.lankadeepa.lk/news/ලගම-ඩපවල-ලකක-පඩඩ-උද-ඉදන-සර-වල/101-680288	si	lankadeepalk	1758888961.0
lk_news	2025-09-26-virakesarilk-7ab582eb	virakesarilk-7ab582eb	2025-09-26	தமிழ் திரையுலக பிரபலங்கள் இணைந்து வெளியிட்ட 'இரவின் விழிகள்' படத்தின் இசை மற்றும் முன்னோட்டம்	https://www.virakesari.lk/article/226181	ta	virakesarilk	1758888900.0
lk_news	2025-09-26-lankadeepalk-c74faca5	lankadeepalk-c74faca5	2025-09-26	රාමඤ්ඤ නිකායේ විහාරවල කහ කොඩි ඔසවන්න	https://www.lankadeepa.lk/news/රමඤඤ-නකය-වහරවල-කහ-කඩ-ඔසවනන/101-680287	si	lankadeepalk	1758888808.0
lk_news	2025-09-26-economynextcom-9ad477d6	economynextcom-9ad477d6	2025-09-26	Sri Lanka rupee flat against dollar, bond yields steady	https://economynext.com/sri-lanka-rupee-flat-against-dollar-bond-yields-steady-241992/	en	economynextcom	1758888360.0
lk_news	2025-09-26-virakesarilk-d2dc2f65	virakesarilk-d2dc2f65	2025-09-26	சர்வதேச மாணவர் விருதினை பெற்ற இலங்கை கடற்படையினைச் சேர்ந்த LCDR கத்ரிஆரச்சிகே கத்ரிஆரச்சிக்கு அமெரிக்க தூதரகம் வாழ்த்து	https://www.virakesari.lk/article/226155	ta	virakesarilk	1758888120.0
lk_news	2025-09-26-virakesarilk-998389eb	virakesarilk-998389eb	2025-09-26	சிங்கள மொழி கற்றல் சமூக கலாசாரத்தைப்  புரிதலும் இனங்களுக்கு இடையேயான உறவுகளை வளர்க்க உதவும் –  முனீர் முளப்பர்	https://www.virakesari.lk/article/226179	ta	virakesarilk	1758887940.0
lk_news	2025-09-26-virakesarilk-81c5abca	virakesarilk-81c5abca	2025-09-26	தேசிய பொருளாதார மீட்புக்காக ஃபாம் ஒயில் செய்கையை மீண்டும் ஆரம்பிக்க அரசாங்கத்தை வலியுறுத்துகிறது இலங்கைக பெருந்தோட்ட முதலாளிமார் சம்மேளனம்	https://www.virakesari.lk/article/226174	ta	virakesarilk	1758887940.0
lk_news	2025-09-26-virakesarilk-584fbdaf	virakesarilk-584fbdaf	2025-09-26	வலிந்து காணாமலாக்கப்பட்டவர்களுக்கு நீதி கோரி இரண்டாம் நாள் உண்ணாவிரதப் போராட்டம்	https://www.virakesari.lk/article/226175	ta	virakesarilk	1758887760.0
lk_news	2025-09-26-virakesarilk-99c8084d	virakesarilk-99c8084d	2025-09-26	வேலிக்கு ஓணான் சாட்சி போல ஊழல்வாதிகளுக்கு எதிர்க்கட்சியினர்  ஆதரவாக உள்ளார்கள் - மஹிந்த ஜயசிங்க	https://www.virakesari.lk/article/226173	ta	virakesarilk	1758887700.0
lk_news	2025-09-26-virakesarilk-fd431eae	virakesarilk-fd431eae	2025-09-26	அரசாங்கத்துக்கு எதிராக செயற்படுபவர்களுக்கு மாத்திரமே அரசாங்கம் கடைப்பிடித்து வருகிறது ; முஜிபுர் ரஹ்மான்	https://www.virakesari.lk/article/226171	ta	virakesarilk	1758887640.0
lk_news	2025-09-26-virakesarilk-63f089f1	virakesarilk-63f089f1	2025-09-26	323 கொள்கலன்கள் விடுவிக்கப்பட்டமைக்கு அரசாங்கமே பொறுப்புக்கூற வேண்டும் - டி.வி.சானக	https://www.virakesari.lk/article/226169	ta	virakesarilk	1758887580.0
lk_news	2025-09-26-virakesarilk-79c968b9	virakesarilk-79c968b9	2025-09-26	புதிய வாகன இலக்கத்தகடுகள் நவம்பர் 15 ஆம் திகதி முதல் விநியோகிக்கப்படும் - பிமல் ரத்நாயக்க	https://www.virakesari.lk/article/226167	ta	virakesarilk	1758887520.0
lk_news	2025-09-26-virakesarilk-e3ff6adf	virakesarilk-e3ff6adf	2025-09-26	LGBTIQ சுற்றுலாவை ஊக்குவிக்கும் திட்டத்திற்கு ஆதரவு	https://www.virakesari.lk/article/226157	ta	virakesarilk	1758887460.0
lk_news	2025-09-26-virakesarilk-01ef9583	virakesarilk-01ef9583	2025-09-26	களுவாஞ்சிகுடியில் ஆணின் சடலம் மீட்பு!	https://www.virakesari.lk/article/226168	ta	virakesarilk	1758887100.0
lk_news	2025-09-26-virakesarilk-e8321772	virakesarilk-e8321772	2025-09-26	யாழ்ப்பாணத்திலிருந்து பயணித்த ரயிலில் மோதி ஒருவர் பலி!	https://www.virakesari.lk/article/226177	ta	virakesarilk	1758887040.0
lk_news	2025-09-26-lankadeepalk-2c70be76	lankadeepalk-2c70be76	2025-09-26	අයවැය විසර්ජන පනත් කෙටුම්පත මැතිසබයට	https://www.lankadeepa.lk/news/අයවය-වසරජන-පනත-කටමපත-මතසබයට/101-680286	si	lankadeepalk	1758886569.0
lk_news	2025-09-26-tamilmirrorlk-db4fc198	tamilmirrorlk-db4fc198	2025-09-26	இலைதழைகள் மட்டும் தான் சாப்பாடு: ஆனால் சிக்ஸ்பேக்	https://www.tamilmirror.lk/செய்திகள்/இலைதழைகள்-மட்டும்-தான்-சாப்பாடு-ஆனால்-சிக்ஸ்பேக்/175-365339	ta	tamilmirrorlk	1758886030.0
lk_news	2025-09-26-economynextcom-fc52d216	economynextcom-fc52d216	2025-09-26	Sri Lanka stocks close up, driven by capital goods	https://economynext.com/sri-lanka-stocks-close-up-driven-by-capital-goods-241975/	en	economynextcom	1758885900.0
lk_news	2025-09-26-tamilmirrorlk-e26233be	tamilmirrorlk-e26233be	2025-09-26	கிறிஸ்தவர்கள் நெற்றியில் குங்குமம் பூசிய விவகாரம்	https://www.tamilmirror.lk/செய்திகள்/கிறிஸ்தவர்கள்-நெற்றியில்-குங்குமம்-பூசிய-விவகாரம்/175-365338	ta	tamilmirrorlk	1758885571.0
lk_news	2025-09-26-tamilmirrorlk-2d79ee7a	tamilmirrorlk-2d79ee7a	2025-09-26	நாமலின் கிரிஷ் வழக்கு: நீதிமன்றம் பிறப்பித்த உத்தரவு	https://www.tamilmirror.lk/செய்திகள்/நாமலின்-கிரிஷ்-வழக்கு-நீதிமன்றம்-பிறப்பித்த-உத்தரவு/175-365337	ta	tamilmirrorlk	1758885270.0
lk_news	2025-09-26-tamilmirrorlk-ca1c3f33	tamilmirrorlk-ca1c3f33	2025-09-26	3 வாகனங்கள் மோதியதில் 11 பேர் காயம்	https://www.tamilmirror.lk/செய்திகள்/3-வாகனங்கள்-மோதியதில்-11-பேர்-காயம்/175-365336	ta	tamilmirrorlk	1758884887.0
lk_news	2025-09-26-lankadeepalk-e41d0e9c	lankadeepalk-e41d0e9c	2025-09-26	මුජිබර්ගේ ප්‍රශ්නෙන් මැතිසබේ රත්වෙයි	https://www.lankadeepa.lk/latest_news/මජබරග-පරශනන-මතසබ-රතවය/1-680285	si	lankadeepalk	1758884406.0
lk_news	2025-09-26-lankadeepalk-49923b85	lankadeepalk-49923b85	2025-09-26	වාහන 3ක් එකිනෙක ගැටී 11ක් රෝහලට	https://www.lankadeepa.lk/latest_news/වහන-3ක-එකනක-ගට-11ක-රහලට/1-680284	si	lankadeepalk	1758884009.0
lk_news	2025-09-26-virakesarilk-c1081be4	virakesarilk-c1081be4	2025-09-26	சரீரம் - திரைப்பட விமர்சனம்	https://www.virakesari.lk/article/226165	ta	virakesarilk	1758883620.0
lk_news	2025-09-26-virakesarilk-cc83c923	virakesarilk-cc83c923	2025-09-26	ஈஸி கேஷ் முறையைப் பயன்படுத்தி ஐஸ் போதைப்பொருள் விற்பனை ; இளம் தம்பதியர் கைது	https://www.virakesari.lk/article/226163	ta	virakesarilk	1758883500.0
lk_news	2025-09-26-virakesarilk-bb09f734	virakesarilk-bb09f734	2025-09-26	3 வாரங்களுக்கு தேவையான இன்சுலின்கள் கையிருப்பில் உள்ளன அமைச்சர் நளிந்த ஜயதிஸ்ஸ  விளக்கம்	https://www.virakesari.lk/article/226161	ta	virakesarilk	1758883440.0
lk_news	2025-09-26-economynextcom-18869df4	economynextcom-18869df4	2025-09-26	Sri Lanka apparel exports dip in August 2025: JAAF	https://economynext.com/sri-lanka-apparel-exports-dip-in-august-2025-jaaf-241973/	en	economynextcom	1758883440.0
lk_news	2025-09-26-tamilmirrorlk-bb55e25c	tamilmirrorlk-bb55e25c	2025-09-26	’’குஷ்’’ஷூடன் விமான பயணி சிக்கினார்	https://www.tamilmirror.lk/செய்திகள்/குஷ்-ஷூடன்-விமான-பயணி-சிக்கினார்/175-365334	ta	tamilmirrorlk	1758883164.0
lk_news	2025-09-26-virakesarilk-82b16bcd	virakesarilk-82b16bcd	2025-09-26	மத்திய சுற்றாடல் அதிகாரசபை கொடுப்பனவுகள் இன்று முதல் GovPay மூலம்...	https://www.virakesari.lk/article/226148	ta	virakesarilk	1758883020.0
lk_news	2025-09-26-lankadeepalk-6487f6e8	lankadeepalk-6487f6e8	2025-09-26	කෝප් සිවුවැනි හෙළිදරව්ව මෙන්න	https://www.lankadeepa.lk/latest_news/කප-සවවන-හළදරවව-මනන/1-680283	si	lankadeepalk	1758882908.0
lk_news	2025-09-26-tamilmirrorlk-4cb7b10d	tamilmirrorlk-4cb7b10d	2025-09-26	பெண்ணின் உள்ளாடைக்குள் ‘ஐஸ்’: 52  பக்கெட்டுகள் மீட்பு	https://www.tamilmirror.lk/மலையகம்/பெண்ணின்-உள்ளாடைக்குள்-ஐஸ்-52-பக்கெட்டுகள்-மீட்பு/76-365333	ta	tamilmirrorlk	1758882817.0
lk_news	2025-09-26-virakesarilk-81916aa2	virakesarilk-81916aa2	2025-09-26	"""நினைவேந்தலில் அரசியல் தலையீடு இருக்கக்கூடாது"" : துண்டுப் பிரசுரம் விநியோகித்த இளைஞனுடன் தர்க்கம் -  திலீபனின் நினைவிடத்தில் அமைதியின்மை!"	https://www.virakesari.lk/article/226162	ta	virakesarilk	1758882600.0
lk_news	2025-09-26-tamilmirrorlk-f92c3840	tamilmirrorlk-f92c3840	2025-09-26	’கெஹெல்பத்தர பத்மே’வின்  ஆயுதங்கள் மீன் சந்தைக்கு அருகில் மீட்பு	https://www.tamilmirror.lk/செய்திகள்/கெஹெல்பத்தர-பத்மே-வின்-ஆயுதங்கள்-மீன்-சந்தைக்கு-அருகில்-மீட்பு/175-365332	ta	tamilmirrorlk	1758882468.0
lk_news	2025-09-26-virakesarilk-5ea76e7c	virakesarilk-5ea76e7c	2025-09-26	விமான நிலையத்தில் குஷ் போதைப்பொருளுடன் வர்த்தகர் கைது!	https://www.virakesari.lk/article/226160	ta	virakesarilk	1758882300.0
lk_news	2025-09-26-virakesarilk-6b8582eb	virakesarilk-6b8582eb	2025-09-26	ரைட் - திரைப்பட விமர்சனம்	https://www.virakesari.lk/article/226159	ta	virakesarilk	1758882240.0
lk_news	2025-09-26-adalk-05153637	adalk-05153637	2025-09-26	නව වාහන අංක තහඩු නොවැම්බර් 15න් පසුව	https://www.ada.lk/breaking_news/නව-වාහන-අංක-තහඩු-නොවැම්බර්-15න්-පසුව/11-418748	si	adalk	1758881955.0
lk_news	2025-09-26-virakesarilk-f4bdb758	virakesarilk-f4bdb758	2025-09-26	சம்பத் மனம்பேரியை 90 நாட்கள் தடுத்து வைத்து விசாரிக்க நீதிமன்றம் அனுமதி!	https://www.virakesari.lk/article/226151	ta	virakesarilk	1758881760.0
lk_news	2025-09-26-virakesarilk-c9e9a598	virakesarilk-c9e9a598	2025-09-26	திருநெல்வேலி வர்த்தக நிலையத்தில் திருடிய சந்தேகநபர்கள் நால்வர் கைது	https://www.virakesari.lk/article/226153	ta	virakesarilk	1758881760.0
lk_news	2025-09-26-lankadeepalk-ad31dcc2	lankadeepalk-ad31dcc2	2025-09-26	සම්පත් මනම්පේරිට දින 90ක රැඳවුම් නියෝග	https://www.lankadeepa.lk/latest_news/සමපත-මනමපරට-දන-90ක-රඳවම-නයග/1-680282	si	lankadeepalk	1758881458.0
lk_news	2025-09-26-adalk-e6636020	adalk-e6636020	2025-09-26	ජනපති ජපාන සංචාරය අරඹයි	https://www.ada.lk/breaking_news/ජනපති-ජපාන-සංචාරය-අරඹයි/11-418747	si	adalk	1758881400.0
lk_news	2025-09-26-tamilmirrorlk-39defd7f	tamilmirrorlk-39defd7f	2025-09-26	சம்பத் மனம்பேரிக்கு 90 நாள் தடுப்புக்காவல்	https://www.tamilmirror.lk/செய்திகள்/சம்பத்-மனம்பேரிக்கு-90-நாள்-தடுப்புக்காவல்/175-365330	ta	tamilmirrorlk	1758881344.0
lk_news	2025-09-26-virakesarilk-628b6090	virakesarilk-628b6090	2025-09-26	ஒரு கோடியே 80 இலட்சம் ரூபா பெறுமதியான வெளிநாட்டு சிகரட்டுகளுடன் வர்த்தகர் கட்டுநாயக்கவில் கைது!	https://www.virakesari.lk/article/226156	ta	virakesarilk	1758881340.0
lk_news	2025-09-26-virakesarilk-1227fdf1	virakesarilk-1227fdf1	2025-09-26	கிடா முட்டு சண்டையை உரக்க பேசும் 'ஜாக்கி'	https://www.virakesari.lk/article/226154	ta	virakesarilk	1758881220.0
lk_news	2025-09-26-lankadeepalk-de339583	lankadeepalk-de339583	2025-09-26	දොස්තරලා දැන් බයට බේත් ලියන්නේ නෑ	https://www.lankadeepa.lk/latest_news/දසතරල-දන-බයට-බත-ලයනන-න/1-680281	si	lankadeepalk	1758880791.0
lk_news	2025-09-26-virakesarilk-4c589a0b	virakesarilk-4c589a0b	2025-09-26	முதியோருக்கான தேசியக் கொள்கை ஒக். 1இல் வெளியிடப்படும் ; துறைசார் மேற்பார்வைக் குழுவில் இறுதிக் கொள்கை பரிசீலனை	https://www.virakesari.lk/article/226152	ta	virakesarilk	1758880560.0
lk_news	2025-09-26-lankadeepalk-5b1cd12c	lankadeepalk-5b1cd12c	2025-09-26	‘කුෂ්‘ සමඟ ගුවන් මගියා මාට්ටු	https://www.lankadeepa.lk/latest_news/කෂ-සමඟ-ගවන-මගය-මටට/1-680280	si	lankadeepalk	1758880513.0
lk_news	2025-09-26-virakesarilk-a92b9ee6	virakesarilk-a92b9ee6	2025-09-26	எகிப்தில் ஆடைத் தொழிற்சாலையொன்றில் ஏற்பட்ட தீ விபத்தில் சுமார் 8 பேர் பலி : 35 பேர் காயம்	https://www.virakesari.lk/article/226145	ta	virakesarilk	1758880500.0
lk_news	2025-09-26-tamilmirrorlk-17d174f2	tamilmirrorlk-17d174f2	2025-09-26	யாழ்.பல்கலைக்கழகத்தில் திலீபனின் நினைவு தினம்	https://www.tamilmirror.lk/செய்திகள்/யாழ்-பல்கலைக்கழகத்தில்-திலீபனின்-நினைவு-தினம்/175-365329	ta	tamilmirrorlk	1758880340.0
