doc_type	doc_id	num	date_str	description	url_metadata	lang	newspaper_id	time_ut
lk_news	2025-10-23-tamilmirrorlk-5f86e181	tamilmirrorlk-5f86e181	2025-10-23	மின்சாரம் தாக்கி மாற்றுத்திறனாளி உயிரிழப்பு	https://www.tamilmirror.lk/செய்திகள்/மின்சாரம்-தாக்கி-மாற்றுத்திறனாளி-உயிரிழப்பு/175-366694	ta	tamilmirrorlk	1761172262.0
lk_news	2025-10-23-virakesarilk-76553674	virakesarilk-76553674	2025-10-23	கல்பிட்டி கடற்கரையில் கடலுக்குள் சட்டவிரோதமாக கடத்தப்பட்ட 1416 கிலோ பீடி இலைகளை கடற்படையினர் கைப்பற்றினர்	https://www.virakesari.lk/article/228428	ta	virakesarilk	1761170580.0
lk_news	2025-10-23-virakesarilk-10160e4b	virakesarilk-10160e4b	2025-10-23	யாழில். போதை மாத்திரை வியாபாரியான 20 வயதுடைய இளைஞன் உள்ளிட்ட இருவர் கைது	https://www.virakesari.lk/article/228427	ta	virakesarilk	1761170280.0
lk_news	2025-10-23-virakesarilk-55e1fcff	virakesarilk-55e1fcff	2025-10-23	பிரான்சிலிருந்து துவிச்சக்கர வண்டியில் 10 ஆயிரம் கிலோமீற்றர் பயணம் செய்து யாழ்ப்பாணம் வந்தடைந்த சூரன்	https://www.virakesari.lk/article/228426	ta	virakesarilk	1761170160.0
lk_news	2025-10-23-virakesarilk-68f18456	virakesarilk-68f18456	2025-10-23	பத்மாவின் குற்றச்செயல்களுக்கு துப்பாக்கி  விநியோகஸ்தராக செயற்பட்ட “கம்பஹா பபா“	https://www.virakesari.lk/article/228425	ta	virakesarilk	1761167760.0
lk_news	2025-10-23-virakesarilk-df7070de	virakesarilk-df7070de	2025-10-23	திருநெல்வேலி அரசடி சிவகாம சுந்தரி அம்பாள் ஆலய இராஜ கோபுரத்திற்கான அடிக்கல் நாட்டல் நிகழ்வு	https://www.virakesari.lk/article/228424	ta	virakesarilk	1761167520.0
lk_news	2025-10-23-virakesarilk-fc837123	virakesarilk-fc837123	2025-10-23	குறிகட்டுவான் இறங்குதுறையை நிர்மாணிப்பதற்கு அமைச்சரவை அங்கீகாரம்	https://www.virakesari.lk/article/228423	ta	virakesarilk	1761167280.0
lk_news	2025-10-23-dailyftlk-d96f3bc2	dailyftlk-d96f3bc2	2025-10-23	Govt. will not tolerate creating divisions among ethnic communities: Cabinet Spokesman	https://www.ft.lk/news/Govt-will-not-tolerate-creating-divisions-among-ethnic-communities-Cabinet-Spokesman/56-783341	en	dailyftlk	1761166272.0
lk_news	2025-10-23-dailyftlk-06da9310	dailyftlk-06da9310	2025-10-23	Weligama PS Chairman’s murder: Four Police teams deployed	https://www.ft.lk/news/Weligama-PS-Chairman-s-murder-Four-Police-teams-deployed/56-783340	en	dailyftlk	1761166128.0
lk_news	2025-10-23-dailyftlk-f5695574	dailyftlk-f5695574	2025-10-23	Rs. 630 m allocated to locally manufacture assistive devices for differently-abled	https://www.ft.lk/news/Rs-630-m-allocated-to-locally-manufacture-assistive-devices-for-differently-abled/56-783339	en	dailyftlk	1761166049.0
lk_news	2025-10-23-dailyftlk-eba73460	dailyftlk-eba73460	2025-10-23	Australian NDC delegation visits SLN Headquarters	https://www.ft.lk/news/Australian-NDC-delegation-visits-SLN-Headquarters/56-783338	en	dailyftlk	1761166024.0
lk_news	2025-10-23-dailyftlk-ee5c39c6	dailyftlk-ee5c39c6	2025-10-23	Rs. 761 m approved for textbook printing by State Printing Corporation	https://www.ft.lk/news/Rs-761-m-approved-for-textbook-printing-by-State-Printing-Corporation/56-783337	en	dailyftlk	1761165905.0
lk_news	2025-10-23-dailyftlk-8e1384ba	dailyftlk-8e1384ba	2025-10-23	Police to receive CID’s report on Piumi’s connection to ‘Kehelbaddara Padme’	https://www.ft.lk/news/Police-to-receive-CID-s-report-on-Piumi-s-connection-to-Kehelbaddara-Padme/56-783336	en	dailyftlk	1761165866.0
lk_news	2025-10-23-dailyftlk-bb5424d8	dailyftlk-bb5424d8	2025-10-23	Dairy major HANNS Global Canada appoints Rohan Ariyawansa as SL Country Head	https://www.ft.lk/business/Dairy-major-HANNS-Global-Canada-appoints-Rohan-Ariyawansa-as-SL-Country-Head/34-783335	en	dailyftlk	1761165705.0
lk_news	2025-10-23-dailyftlk-8a86cd68	dailyftlk-8a86cd68	2025-10-23	Kusal Jayawardana appointed Chairman of Lanka Ventures and LVL Energy Fund	https://www.ft.lk/business/Kusal-Jayawardana-appointed-Chairman-of-Lanka-Ventures-and-LVL-Energy-Fund/34-783334	en	dailyftlk	1761165637.0
lk_news	2025-10-23-dailyftlk-a45cc28e	dailyftlk-a45cc28e	2025-10-23	2025 Sri Lanka Barometer Survey Report launched: New insights on reconciliation, governance, and civic engagement	https://www.ft.lk/news/2025-Sri-Lanka-Barometer-Survey-Report-launched-New-insights-on-reconciliation-governance-and-civic-engagement/56-783333	en	dailyftlk	1761165393.0
lk_news	2025-10-23-dailyftlk-745f0e1f	dailyftlk-745f0e1f	2025-10-23	Rs. 1 b worth illegal cigarettes turned into clean energy at Western Power’s Waste-to-Energy facility	https://www.ft.lk/news/Rs-1-b-worth-illegal-cigarettes-turned-into-clean-energy-at-Western-Power-s-Waste-to-Energy-facility/56-783332	en	dailyftlk	1761165215.0
lk_news	2025-10-23-dailyftlk-5cc8a2b1	dailyftlk-5cc8a2b1	2025-10-23	Govt. to allocate more for mitigating floods from 2026 Budget	https://www.ft.lk/news/Govt-to-allocate-more-for-mitigating-floods-from-2026-Budget/56-783331	en	dailyftlk	1761165052.0
lk_news	2025-10-23-dailyftlk-a3837832	dailyftlk-a3837832	2025-10-23	Survivors seek $ 15 m in reparations for 1989 Valvettithurai massacre	https://www.ft.lk/news/Survivors-seek-15-m-in-reparations-for-1989-Valvettithurai-massacre/56-783330	en	dailyftlk	1761165021.0
lk_news	2025-10-23-dailyftlk-2db21a88	dailyftlk-2db21a88	2025-10-23	“Govt. should impose death penalty” – Prof. Mahanamahewa	https://www.ft.lk/opinion/Govt-should-impose-death-penalty-Prof-Mahanamahewa/14-783313	en	dailyftlk	1761160660.0
lk_news	2025-10-23-dailyftlk-09ac6400	dailyftlk-09ac6400	2025-10-23	Electoral reactivation of provincial councils is an urgent systemic imperative	https://www.ft.lk/columns/Electoral-reactivation-of-provincial-councils-is-an-urgent-systemic-imperative/4-783312	en	dailyftlk	1761160208.0
lk_news	2025-10-23-dailyftlk-d578df8f	dailyftlk-d578df8f	2025-10-23	Resistance matrix: How a narrative was forged to remake the Middle East	https://www.ft.lk/columns/Resistance-matrix-How-a-narrative-was-forged-to-remake-the-Middle-East/4-783311	en	dailyftlk	1761158949.0
lk_news	2025-10-23-dailyftlk-f9e5cd6b	dailyftlk-f9e5cd6b	2025-10-23	Unspoken rift: When founders and siblings collide in family businesses	https://www.ft.lk/columns/Unspoken-rift-When-founders-and-siblings-collide-in-family-businesses/4-783309	en	dailyftlk	1761158128.0
lk_news	2025-10-22-virakesarilk-5ee860c7	virakesarilk-5ee860c7	2025-10-22	இந்தோனேஷியாவில் இருந்து அழைத்து வரப்பட்ட கெஹல்பத்தர பத்மேயுடன் தொடர்பு ; பியூமியிடம் சி.ஐ.டி.சிறப்பு விசாரணை	https://www.virakesari.lk/article/228422	ta	virakesarilk	1761157560.0
lk_news	2025-10-22-dailyftlk-427cedab	dailyftlk-427cedab	2025-10-22	Benchmarking National Budget 2026 and making theatrics of cheerleaders superfluous	https://www.ft.lk/columns/Benchmarking-National-Budget-2026-and-making-theatrics-of-cheerleaders-superfluous/4-783308	en	dailyftlk	1761157540.0
lk_news	2025-10-22-virakesarilk-04bed64e	virakesarilk-04bed64e	2025-10-22	புதுப்பிக்கத்தக்க ஆற்றலை குறைக்க வேண்டாம்; முன்னர் செலுத்திய தொகையையே செலுத்தங்கள் - சஜித் பிரேமதாச அரசாங்கத்திடம் வேண்டுகோள்	https://www.virakesari.lk/article/228421	ta	virakesarilk	1761157260.0
lk_news	2025-10-22-tamilmirrorlk-fa534225	tamilmirrorlk-fa534225	2025-10-22	கெஹல்பத்தர பத்மேவுடனான தொடர்பு குறித்து உண்மையை வெளியிட்ட பியூமி	https://www.tamilmirror.lk/செய்திகள்/கெஹல்பத்தர-பத்மேவுடனான-தொடர்பு-குறித்து-உண்மையை-வெளியிட்ட-பியூமி/175-366693	ta	tamilmirrorlk	1761154869.0
lk_news	2025-10-22-lankadeepalk-bef7ffd3	lankadeepalk-bef7ffd3	2025-10-22	‘‘වැලිගම සභාපති පාතාලයෙක්‘‘	https://www.lankadeepa.lk/latest_news/වලගම-සභපත-පතලයක/1-681871	si	lankadeepalk	1761153893.0
lk_news	2025-10-22-virakesarilk-df5af7e1	virakesarilk-df5af7e1	2025-10-22	ஏஷ்லி, அனாபெல் ஆகியோரின் அபார துடுப்பாட்டங்கள் ஆஸியை வெல்ல வைத்தன; இங்கிலாந்துக்கு முதலாவது தோல்வி	https://www.virakesari.lk/article/228420	ta	virakesarilk	1761153540.0
lk_news	2025-10-22-lankadeepalk-70701cf9	lankadeepalk-70701cf9	2025-10-22	‘‘විදුලි මිල වැඩි විය යුතුමයි‘‘	https://www.lankadeepa.lk/latest_news/වදල-මල-වඩ-වය-යතමය/1-681870	si	lankadeepalk	1761153474.0
lk_news	2025-10-22-lankadeepalk-d8e8cb10	lankadeepalk-d8e8cb10	2025-10-22	ඉෂාර රට පැටවූ සැකකරුගේ නිවසේ ගිනි අවි සහ උණ්ඩ	https://www.lankadeepa.lk/news/ඉෂර-රට-පටව-සකකරග-නවස-ගන-අව-සහ-උණඩ/101-681869	si	lankadeepalk	1761152794.0
lk_news	2025-10-22-virakesarilk-df538c06	virakesarilk-df538c06	2025-10-22	ஆடவர் உலகக் கிண்ணத்துக்கான அரங்குகளின் புனரமைப்பு காரணமாக லங்கா பிறீமியர் லீக் இந்த வருடம் இல்லை	https://www.virakesari.lk/article/228419	ta	virakesarilk	1761149820.0
lk_news	2025-10-22-virakesarilk-6f6b4694	virakesarilk-6f6b4694	2025-10-22	கம்பஹா கஹடோவிட்ட முஸ்லிம் மகளிர் வித்தியாலயத்தின் மாணவிகள் ஜனாதிபதி அலுவலகத்திற்கு விஜயம்	https://www.virakesari.lk/article/228418	ta	virakesarilk	1761148980.0
lk_news	2025-10-22-lankadeepalk-0cb4d08a	lankadeepalk-0cb4d08a	2025-10-22	’’මාගේ ජීවිත ආරක්ෂාව සලසා ගැනීම සම්බන්ධයෙනි’’	https://www.lankadeepa.lk/latest_news/මග-ජවත-ආරකෂව-සලස-ගනම-සමබනධයන/1-681867	si	lankadeepalk	1761148820.0
lk_news	2025-10-22-lankadeepalk-7f482ee5	lankadeepalk-7f482ee5	2025-10-22	කොළඹ ප්‍රදේශ කිහිපයකට හෙට ජල කප්පාදුවක්	https://www.lankadeepa.lk/latest_news/කළඹ-පරදශ-කහපයකට-හට-ජල-කපපදවක/1-681866	si	lankadeepalk	1761147309.0
lk_news	2025-10-22-virakesarilk-52715aab	virakesarilk-52715aab	2025-10-22	யாழில் மூச்செடுக்க சிரமப்பட்ட சிறுமி பரிதாபமாக உயரிழப்பு!	https://www.virakesari.lk/article/228417	ta	virakesarilk	1761146940.0
lk_news	2025-10-22-virakesarilk-07a192e4	virakesarilk-07a192e4	2025-10-22	ஆசியாவில் அடுத்த தலைமுறையினரின் விளையாட்டுத்திறனை வெளிக்கொணரும் ஆசிய இளையோர் விளையாட்டு விழா	https://www.virakesari.lk/article/228416	ta	virakesarilk	1761144720.0
lk_news	2025-10-22-tamilmirrorlk-59ef2456	tamilmirrorlk-59ef2456	2025-10-22	விமலின் வழக்குக்கு திகதி குறிப்பு	https://www.tamilmirror.lk/செய்திகள்/விமலின்-வழக்குக்கு-திகதி-குறிப்பு/175-366680	ta	tamilmirrorlk	1761142553.0
lk_news	2025-10-22-virakesarilk-34465fef	virakesarilk-34465fef	2025-10-22	யாழில் போதை மாத்திரைகளுடன் இருவர் கைது!	https://www.virakesari.lk/article/228415	ta	virakesarilk	1761141900.0
lk_news	2025-10-22-virakesarilk-c62453a4	virakesarilk-c62453a4	2025-10-22	மனவளர்ச்சி குறைபாடு, நரம்பு விருத்திக் குறைபாடுகளைக் கொண்ட சிறுவர்களுக்கு ஐந்தாண்டு தேசிய வேலைத்திட்டம்	https://www.virakesari.lk/article/228404	ta	virakesarilk	1761138960.0
lk_news	2025-10-22-virakesarilk-1c5ff748	virakesarilk-1c5ff748	2025-10-22	மார்பகப் புற்றுநோய்க்கு எதிரான விழிப்புணர்வூட்டலுக்கு ஒத்துழைப்பு வழங்கி இளஞ்சிவப்பு நிறமாக மாறிய பாராளுமன்றம்	https://www.virakesari.lk/article/228407	ta	virakesarilk	1761138840.0
lk_news	2025-10-22-virakesarilk-e54e39a7	virakesarilk-e54e39a7	2025-10-22	விஜய் - சூர்யா இணைந்து நடித்த 'பிரண்ட்ஸ்' ரீ ரிலீஸ்	https://www.virakesari.lk/article/228411	ta	virakesarilk	1761138480.0
lk_news	2025-10-22-virakesarilk-1aa4c429	virakesarilk-1aa4c429	2025-10-22	வெற்றி மாறன் வெளியிட்ட 'மெல்லிசை' படத்தின் ஃபர்ஸ்ட் லுக்	https://www.virakesari.lk/article/228410	ta	virakesarilk	1761138360.0
lk_news	2025-10-22-virakesarilk-b3b1319b	virakesarilk-b3b1319b	2025-10-22	நடிகர் ரிச்சர்ட் ரிஷி நடிக்கும் 'திரௌபதி 2 'படத்தின் அப்டேட்ஸ்	https://www.virakesari.lk/article/228409	ta	virakesarilk	1761138240.0
lk_news	2025-10-22-virakesarilk-161eacc5	virakesarilk-161eacc5	2025-10-22	ஆசிய இளையோர் விளையாட்டு விழா: ஆண்களுக்கான கபடி போட்டியில் ஈரானிடம் இலங்கை படுதோல்வி	https://www.virakesari.lk/article/228408	ta	virakesarilk	1761138240.0
lk_news	2025-10-22-virakesarilk-e841e57a	virakesarilk-e841e57a	2025-10-22	'இலங்கையர் தினம்' தேசிய நிகழ்ச்சித்திட்டத்துக்கு அமைச்சரவை அங்கீகாரம்	https://www.virakesari.lk/article/228406	ta	virakesarilk	1761137580.0
lk_news	2025-10-22-virakesarilk-0eadf7e5	virakesarilk-0eadf7e5	2025-10-22	ஆஸ்திரேலிய தேசிய பாதுகாப்பு கல்லூரி தூதுக்குழுவின் கடற்படை தலைமையக உத்தியோகபூர்வ விஜயம்	https://www.virakesari.lk/article/228405	ta	virakesarilk	1761137580.0
lk_news	2025-10-22-virakesarilk-463af413	virakesarilk-463af413	2025-10-22	வாகனங்களுக்கான இறக்குமதி வரி திருத்தம் குறித்து எதிர்காலத்தில் தீர்மானிக்கப்படும் - அமைச்சரவை பேச்சாளர்	https://www.virakesari.lk/article/228403	ta	virakesarilk	1761137280.0
lk_news	2025-10-22-lankadeepalk-e2f0bf9a	lankadeepalk-e2f0bf9a	2025-10-22	පොන්නි  සහල් යට ගේම් එකක්	https://www.lankadeepa.lk/news/පනන-සහල-යට-ගම-එකක/101-681864	si	lankadeepalk	1761137218.0
lk_news	2025-10-22-lankadeepalk-69701faa	lankadeepalk-69701faa	2025-10-22	රටේ ජාතික ආරක්ෂාව කොහේද	https://www.lankadeepa.lk/news/රට-ජතක-ආරකෂව-කහද/101-681863	si	lankadeepalk	1761137187.0
lk_news	2025-10-22-lankadeepalk-916a3eef	lankadeepalk-916a3eef	2025-10-22	පාසල් සිසුන්ට නොමිලේ පාවහන් දෙන්න කැබිනට් අනුමැතිය	https://www.lankadeepa.lk/news/පසල-සසනට-නමල-පවහන-දනන-කබනට-අනමතය/101-681862	si	lankadeepalk	1761136994.0
lk_news	2025-10-22-tamilmirrorlk-25cfed41	tamilmirrorlk-25cfed41	2025-10-22	தங்கம் விலை இரண்டு தடவைகள் குறைந்தது	https://www.tamilmirror.lk/செய்திகள்/தங்கம்-விலை-இரண்டு-தடவைகள்-குறைந்தது/175-366679	ta	tamilmirrorlk	1761136983.0
lk_news	2025-10-22-lankadeepalk-a2497b67	lankadeepalk-a2497b67	2025-10-22	වෙඩි නොවදින මෝටර් රථයක් පාගොඩ ගරාජයක	https://www.lankadeepa.lk/news/වඩ-නවදන-මටර-රථයක-පගඩ-ගරජයක/101-681861	si	lankadeepalk	1761135531.0
lk_news	2025-10-22-virakesarilk-f1a24888	virakesarilk-f1a24888	2025-10-22	“லொக்கு பெட்டி”யின் பணத்தை கையாண்டு வந்த தேவாலய பூசாரிக்கு விளக்கமறியல்!	https://www.virakesari.lk/article/228400	ta	virakesarilk	1761135120.0
lk_news	2025-10-22-virakesarilk-47819fe6	virakesarilk-47819fe6	2025-10-22	மலையக மக்களுக்கான இந்திய வீட்டுத்திட்டத்தின் நோக்கம் நிறைவேற்றப்படுகிறதா?	https://www.virakesari.lk/article/228399	ta	virakesarilk	1761134760.0
lk_news	2025-10-22-virakesarilk-04a5af3f	virakesarilk-04a5af3f	2025-10-22	பொலிஸ் அதிகாரிகள் என கூறி வீட்டிற்குள் நுழைந்து கொள்ளையிட்ட கும்பல் கைது!	https://www.virakesari.lk/article/228396	ta	virakesarilk	1761134640.0
lk_news	2025-10-22-lankadeepalk-79745656	lankadeepalk-79745656	2025-10-22	වැලිගම සභාපති ඝාතනය ගැන දුමින්දගේ සැකය	https://www.lankadeepa.lk/news/වලගම-සභපත-ඝතනය-ගන-දමනදග-සකය/101-681860	si	lankadeepalk	1761134397.0
lk_news	2025-10-22-virakesarilk-3cfa977f	virakesarilk-3cfa977f	2025-10-22	கிரிக்கெட் விளையாடச் சென்றவர்களின் 8 கைப்பேசிகள் திருட்டு - சிசிடிவியில் சிக்கிய மூவர்	https://www.virakesari.lk/article/228398	ta	virakesarilk	1761134280.0
lk_news	2025-10-22-virakesarilk-80f34826	virakesarilk-80f34826	2025-10-22	பாடசாலை மாணவர்களுக்கு அரசாங்கத்திடமிருந்து பாதணிகள்	https://www.virakesari.lk/article/228397	ta	virakesarilk	1761133920.0
lk_news	2025-10-22-lankadeepalk-be007b3e	lankadeepalk-be007b3e	2025-10-22	වැලිගම සභාපතිගේ ඝාතකයන් හොයන්න කණ්ඩායම් හතරක්	https://www.lankadeepa.lk/news/වලගම-සභපතග-ඝතකයන-හයනන-කණඩයම-හතරක/101-681859	si	lankadeepalk	1761133543.0
lk_news	2025-10-22-tamilmirrorlk-a39d2add	tamilmirrorlk-a39d2add	2025-10-22	2025 லங்கா பிரீமியர் லீக் ஒத்திவைப்பு	https://www.tamilmirror.lk/உள்ளூர்-விளையாட்டு/2025-லங்கா-பிரீமியர்-லீக்-ஒத்திவைப்பு/88-366678	ta	tamilmirrorlk	1761133506.0
lk_news	2025-10-22-virakesarilk-c429fe9d	virakesarilk-c429fe9d	2025-10-22	நில அளவைத் திணைக்களத்தின் புதிய நில அளவையாளர் நியமனம்	https://www.virakesari.lk/article/228380	ta	virakesarilk	1761133200.0
lk_news	2025-10-22-tamilmirrorlk-0313b508	tamilmirrorlk-0313b508	2025-10-22	24 வயது பெண்ணுடன் 74 வயது நபர் திருமணம்: கடைசியில் ட்விஸ்ட்	https://www.tamilmirror.lk/விநோத-உலகம்/24-வயது-பெண்ணுடன்-74-வயது-நபர்-திருமணம்-கடைசியில்-ட்விஸ்ட்/53-366677	ta	tamilmirrorlk	1761132828.0
lk_news	2025-10-22-lankadeepalk-0d993926	lankadeepalk-0d993926	2025-10-22	කඩ - කුටිවලට කොළඹ පදිකවේදිකාවේ ඉඩ නෑ	https://www.lankadeepa.lk/news/කඩ-කටවලට-කළඹ-පදකවදකව-ඉඩ-න/101-681858	si	lankadeepalk	1761132793.0
lk_news	2025-10-22-virakesarilk-037ca819	virakesarilk-037ca819	2025-10-22	குடும்ப சுகாதார  உத்தியோகத்தர்கள் சேவையில் 2613 வெற்றிடங்கள் ; அடுத்தாண்டு 1110 பேருக்கு நியமனங்கள் வழங்கப்படும் - சுகாதார அமைச்சர்	https://www.virakesari.lk/article/228389	ta	virakesarilk	1761132360.0
lk_news	2025-10-22-virakesarilk-98a4bff8	virakesarilk-98a4bff8	2025-10-22	மதுவரி பெற வேண்டுமாயின் முதலில் அனைவரும் மது அருந்த வேண்டும்: அதற்கு மதுபானங்களின் விலையை குறைக்க வேண்டும்: சாமர சம்பத்	https://www.virakesari.lk/article/228388	ta	virakesarilk	1761132300.0
lk_news	2025-10-22-virakesarilk-1d138e35	virakesarilk-1d138e35	2025-10-22	15 ஆண்டுகளில் 8 ஊடகவியலாளர்கள் மாத்திரமே தாக்குதலுக்குள்ளாகியுள்ளனர் - வெகுஜன ஊடக அமைச்சர் நளிந்த ஜயதிஸ்ஸ	https://www.virakesari.lk/article/228374	ta	virakesarilk	1761132120.0
lk_news	2025-10-22-virakesarilk-30d6c63e	virakesarilk-30d6c63e	2025-10-22	வெலிகம பிரதேசசபை தவிசாளரின் கொலை அரசியல் பழிவாங்கலா? : ஐக்கிய மக்கள் சக்தி சந்தேகம்	https://www.virakesari.lk/article/228386	ta	virakesarilk	1761132060.0
lk_news	2025-10-22-adalk-d9494222	adalk-d9494222	2025-10-22	වැලිගම ලසා පාතාල අපරාධකරුවෙක්	https://www.ada.lk/breaking_news/වැලිගම-ලසා-පාතාල-අපරාධකරුවෙක්/11-419266	si	adalk	1761132033.0
lk_news	2025-10-22-virakesarilk-b6487d25	virakesarilk-b6487d25	2025-10-22	வெலிகம பிரதேச சபையின் தலைவர் லசந்த விக்கிரமசேகர பாதாளக் குழு குற்றவாளி - ஆனந்த விஜேபால	https://www.virakesari.lk/article/228395	ta	virakesarilk	1761131940.0
lk_news	2025-10-22-virakesarilk-34116663	virakesarilk-34116663	2025-10-22	பாரிய செலவினச் சுமையாக மாறியுள்ள இலங்கை மின்சார சபை மறுசீரமைக்கப்படும் -வலுசக்தி அமைச்சர்	https://www.virakesari.lk/article/228394	ta	virakesarilk	1761131940.0
lk_news	2025-10-22-tamilmirrorlk-8ce17456	tamilmirrorlk-8ce17456	2025-10-22	இரத்தினபுரி வரைக்கும் புகையிரதப் பாதை	https://www.tamilmirror.lk/மலையகம்/இரத்தினபுரி-வரைக்கும்-புகையிரதப்-பாதை/76-366676	ta	tamilmirrorlk	1761131482.0
lk_news	2025-10-22-tamilmirrorlk-ff0190df	tamilmirrorlk-ff0190df	2025-10-22	குறிகட்டுவான் இறங்குதுறையை புனரமைக்க அங்கிகாரம்	https://www.tamilmirror.lk/செய்திகள்/குறிகட்டுவான்-இறங்குதுறையை-புனரமைக்க-அங்கிகாரம்/175-366675	ta	tamilmirrorlk	1761131119.0
