doc_type	doc_id	num	date_str	description	url_metadata	lang	newspaper_id	time_ut
lk_news	2025-11-24-virakesarilk-4954a452	virakesarilk-4954a452	2025-11-24	வெருகல் சுற்றுச்சூழல் பிரச்சினைகளுக்கு தீர்வு காண பாராளுமன்றம் நடவடிக்கை எடுக்க வேண்டும் – குகதாசன் வலியுறுத்தல்	https://www.virakesari.lk/article/231334	ta	virakesarilk	1764002160.0
lk_news	2025-11-24-lankadeepalk-e290a57e	lankadeepalk-e290a57e	2025-11-24	ප්‍රවාහන නාගරික සංවර්ධන වැය ශීර්ෂ සම්මතයි	https://www.lankadeepa.lk/news/පරවහන-නගරක-සවරධන-වය-ශරෂ-සමමතය/101-683810	si	lankadeepalk	1764001872.0
lk_news	2025-11-24-virakesarilk-5899bb9f	virakesarilk-5899bb9f	2025-11-24	யாழ். மூளாயில் தவறான முடிவெடுத்து சிறுமி உயிர் மாய்ப்பு!	https://www.virakesari.lk/article/231333	ta	virakesarilk	1764001860.0
lk_news	2025-11-24-lankadeepalk-8c113ba4	lankadeepalk-8c113ba4	2025-11-24	පුරා විද්‍යා නාම පුවරු ගැලෙව්වාට අයෙක් සැකපිට	https://www.lankadeepa.lk/news/පර-වදය-නම-පවර-ගලවවට-අයක-සකපට/101-683809	si	lankadeepalk	1764001673.0
lk_news	2025-11-24-lankadeepalk-d72b9021	lankadeepalk-d72b9021	2025-11-24	නාය අවදානමක් නිසා පිරිසක් ඉවත් කරයි	https://www.lankadeepa.lk/news/නය-අවදනමක-නස-පරසක-ඉවත-කරය/101-683804	si	lankadeepalk	1763998005.0
lk_news	2025-11-24-lankadeepalk-6a88e2a0	lankadeepalk-6a88e2a0	2025-11-24	ලංකාවේ ’’රිවස්ටන්’’ කල්කටා රන් සම්මාන දිනයි	https://www.lankadeepa.lk/latest_news/ලකව-රවසටන-කලකට-රන-සමමන-දනය/1-683803	si	lankadeepalk	1763997721.0
lk_news	2025-11-24-lankadeepalk-8cb31cdf	lankadeepalk-8cb31cdf	2025-11-24	බදුල්ල - කොළඹ මාර්ගය හල්දුම්මුල්ලෙන් අවහිර වේ	https://www.lankadeepa.lk/news/බදලල-කළඹ-මරගය-හලදමමලලන-අවහර-ව/101-683802	si	lankadeepalk	1763997143.0
lk_news	2025-11-24-lankadeepalk-c910249d	lankadeepalk-c910249d	2025-11-24	මත්තල ගුවන් තොටුපළ පාඩුව කෝටි 6600 ක්	https://www.lankadeepa.lk/latest_news/මතතල-ගවන-තටපළ-පඩව-කට-6600-ක/1-683796	si	lankadeepalk	1763994359.0
lk_news	2025-11-24-virakesarilk-7ade9b6c	virakesarilk-7ade9b6c	2025-11-24	ஜனாதிபதி அனுரகுமார திசாநாயக்க பிறந்தநாளை முன்னிட்டு ஜிந்துப்பிட்டி முருகன் கோவிலில் விசேட பூஜை	https://www.virakesari.lk/article/231330	ta	virakesarilk	1763994300.0
lk_news	2025-11-24-virakesarilk-b9567cbf	virakesarilk-b9567cbf	2025-11-24	யாழில் இடம்பெற்ற கொலையுடன் தொடர்புடைய சந்தேகநபர் ஒருவர் கைது!	https://www.virakesari.lk/article/231332	ta	virakesarilk	1763994240.0
lk_news	2025-11-24-lankadeepalk-11e72442	lankadeepalk-11e72442	2025-11-24	අය්.එම්.එෆ්. මීළඟ වාරිකය ගැන 15 තීරණය ගනී	https://www.lankadeepa.lk/latest_news/අය-එම-එෆ-මළඟ-වරකය-ගන-15-තරණය-ගන/1-683794	si	lankadeepalk	1763994042.0
lk_news	2025-11-24-virakesarilk-b1e9b738	virakesarilk-b1e9b738	2025-11-24	ரில்வினுக்கு எதிரான வன்முறை ஆர்ப்பாட்டத்திற்கு ஈ.பி.டி.பி கண்டனம்!	https://www.virakesari.lk/article/231331	ta	virakesarilk	1763994000.0
lk_news	2025-11-24-lankadeepalk-387e914b	lankadeepalk-387e914b	2025-11-24	ප්‍රතිකාර ගන්න ආ කතකට දොස්තරගෙන් කරදරයක්	https://www.lankadeepa.lk/latest_news/පරතකර-ගනන-ආ-කතකට-දසතරගන-කරදරයක/1-683793	si	lankadeepalk	1763993250.0
lk_news	2025-11-24-lankadeepalk-1de48bf6	lankadeepalk-1de48bf6	2025-11-24	පහේ දරුවා වෑන් රථයට බිලි	https://www.lankadeepa.lk/latest_news/පහ-දරව-වන-රථයට-බල/1-683789	si	lankadeepalk	1763992025.0
lk_news	2025-11-24-virakesarilk-5e7c3ff4	virakesarilk-5e7c3ff4	2025-11-24	ஊடக சுதந்திரம் பொய்யுக்கு இடமளிக்காது - சபை முதல்வர் பிமல் ரத்நாயக்க வலியுறுத்தினார்	https://www.virakesari.lk/article/231329	ta	virakesarilk	1763991180.0
lk_news	2025-11-24-adalk-af2b288b	adalk-af2b288b	2025-11-24	බිමල්ගේ අමාත්‍යාංශ වැය ශිර්ෂය සම්මතයි	https://www.ada.lk/breaking_news/බිමල්ගේ-අමාත්‍යාංශ-වැය-ශිර්ෂය-සම්මතයි/11-419853	si	adalk	1763991152.0
lk_news	2025-11-24-virakesarilk-3e12563b	virakesarilk-3e12563b	2025-11-24	பிரதமருடன் அமெரிக்க தூதுவர் சந்திப்பு	https://www.virakesari.lk/article/231328	ta	virakesarilk	1763990820.0
lk_news	2025-11-24-virakesarilk-8222550b	virakesarilk-8222550b	2025-11-24	"SINGER நிறுவனம் “நோக்கத்துடனோர் முன்னேற்றம்"" என்ற கருப்பொருளில் ESG திட்டப்பாதை 200ஐ அறிமுகப்படுத்துகிறது"	https://www.virakesari.lk/article/231325	ta	virakesarilk	1763989380.0
lk_news	2025-11-24-virakesarilk-da671198	virakesarilk-da671198	2025-11-24	ஹிர்துஹாரூன் நடிக்கும் 'டெக்ஸாஸ் டைகர்' படத்தின் ஃபர்ஸ்ட் லுக் வெளியீடு	https://www.virakesari.lk/article/231324	ta	virakesarilk	1763988960.0
lk_news	2025-11-24-virakesarilk-2796d51c	virakesarilk-2796d51c	2025-11-24	ஹரிஷ் கல்யாண் றாப்பிசை கலைஞராக நடிக்கும் 'தாஷமக்கான்'	https://www.virakesari.lk/article/231323	ta	virakesarilk	1763988720.0
lk_news	2025-11-24-virakesarilk-f091f827	virakesarilk-f091f827	2025-11-24	பங்களாதேஷை சுப்பர் ஓவரில் வீழ்த்தி ஆசிய கிண்ண உதயத் தாரகைகள் சம்பியன் பட்டத்தை பாகிஸ்தான் சூடியது	https://www.virakesari.lk/article/231321	ta	virakesarilk	1763987940.0
lk_news	2025-11-24-virakesarilk-6ff718fc	virakesarilk-6ff718fc	2025-11-24	சாதனை படைக்கும் அருண் விஜய்யின் 'ரெட்ட தல' பட பாடல்	https://www.virakesari.lk/article/231322	ta	virakesarilk	1763987940.0
lk_news	2025-11-24-virakesarilk-27708aa7	virakesarilk-27708aa7	2025-11-24	இந்து மத சனாதன தர்மத்தை உரத்து பேசும் நந்தமூரி பாலகிருஷ்ணாவின் 'அகண்டா 2 : தாண்டவம்' படத்தின் முன்னோட்டம்	https://www.virakesari.lk/article/231320	ta	virakesarilk	1763987760.0
lk_news	2025-11-24-virakesarilk-0c1e5527	virakesarilk-0c1e5527	2025-11-24	தயாரிப்பாளர் கலைப்புலி எஸ். தாணு வெளியிட்ட 'செர்பன்ட்' படத்தின் ஃபர்ஸ்ட் லுக்	https://www.virakesari.lk/article/231319	ta	virakesarilk	1763987580.0
lk_news	2025-11-24-virakesarilk-85757c31	virakesarilk-85757c31	2025-11-24	அர்ஜுன் தாஸ் - சாண்டி மாஸ்டர் இணைந்து மிரட்டும் 'சுப்பர் ஹீரோ'	https://www.virakesari.lk/article/231316	ta	virakesarilk	1763987160.0
lk_news	2025-11-24-virakesarilk-2fad5566	virakesarilk-2fad5566	2025-11-24	இராணுவத்தினரின் பெற்றோருக்காக வழங்கப்படும் கொடுப்பனவை இடைநிறுத்தவில்லை! - அருண ஜயசேகர	https://www.virakesari.lk/article/231314	ta	virakesarilk	1763986500.0
lk_news	2025-11-24-adalk-8b92efe4	adalk-8b92efe4	2025-11-24	පුද්ගලයින් දස දෙනෙකුට මරණ දඬුවම	https://www.ada.lk/breaking_news/පුද්ගලයින්-දස-දෙනෙකුට-මරණ-දඬුවම/11-419852	si	adalk	1763985993.0
lk_news	2025-11-24-virakesarilk-f9032898	virakesarilk-f9032898	2025-11-24	வடக்கு, கிழக்கு மாகாணத்தில் மீள்குடியேற்றத்துக்காக அடுத்த ஆண்டு 2500 வீடுகள் நிர்மாணிக்கப்படும் - சுசில் ரணசிங்க	https://www.virakesari.lk/article/231311	ta	virakesarilk	1763985720.0
lk_news	2025-11-24-lankadeepalk-6702c763	lankadeepalk-6702c763	2025-11-24	විද්‍යුත් කාඩ් ගෙවීම් ක්‍රමය දිනෙන් දින දියුණු කරනවා	https://www.lankadeepa.lk/news/වදයත-කඩ-ගවම-කරමය-දනන-දන-දයණ-කරනව/101-683788	si	lankadeepalk	1763985072.0
lk_news	2025-11-24-adalk-b6d5f413	adalk-b6d5f413	2025-11-24	ආණ්ඩුවේ බලාපොරොත්තු සුන් කරමින් නුගේගොඩ මහා හිස් ගොඩක් බවට පත් වුණා	https://www.ada.lk/breaking_news/ආණ්ඩුවේ-බලාපොරොත්තු-සුන්-කරමින්-නුගේගොඩ-මහා-හිස්-ගොඩක්-බවට-පත්-වුණා/11-419851	si	adalk	1763985013.0
lk_news	2025-11-24-lankadeepalk-9ce78beb	lankadeepalk-9ce78beb	2025-11-24	පොල් ගෙඩි කෝටි 420 ක ඉලක්කයක්	https://www.lankadeepa.lk/news/පල-ගඩ-කට-420-ක-ඉලකකයක/101-683787	si	lankadeepalk	1763984766.0
lk_news	2025-11-24-virakesarilk-ba0082e7	virakesarilk-ba0082e7	2025-11-24	தம்புள்ளையில் புதிய இடத்தில் ஆதார வைத்தியசாலையை ரூ.12 பில். செலவில் அதிநவீன வசதிகளுடன் நிர்மாணிக்கத் திட்டம்	https://www.virakesari.lk/article/231309	ta	virakesarilk	1763984640.0
lk_news	2025-11-24-virakesarilk-04ed6c97	virakesarilk-04ed6c97	2025-11-24	வரவு செலவுத் திட்டத்தில் முன்வைத்தவற்றில் 50 வீதத்தையாவது நிறைவேற்றுவதற்கு நடவடிக்கை எடுக்கப்படவில்லை ;  நாமல் ராஜபக்ஷ	https://www.virakesari.lk/article/231308	ta	virakesarilk	1763984580.0
lk_news	2025-11-24-lankadeepalk-5c44ec67	lankadeepalk-5c44ec67	2025-11-24	තරුණයකු ඝාතනයට දස දෙනෙක් පෝරකයට	https://www.lankadeepa.lk/latest_news/තරණයක-ඝතනයට-දස-දනක-පරකයට/1-683786	si	lankadeepalk	1763983789.0
lk_news	2025-11-24-virakesarilk-b08adfee	virakesarilk-b08adfee	2025-11-24	பாடசாலை வேன்களுக்கு சி.சி.டி.வி கெமரா அமைப்புகளை கட்டாயமாக்க நடவடிக்கை எடுக்கப்படும் - பிமல் ரத்நாயக்க	https://www.virakesari.lk/article/231306	ta	virakesarilk	1763983560.0
lk_news	2025-11-24-lankadeepalk-3487fbf2	lankadeepalk-3487fbf2	2025-11-24	රියැදුරන් වෙරිවීලාදැයි බලන්න ඡංගම වෛද්‍ය රථයක්	https://www.lankadeepa.lk/latest_news/රයදරන-වරවලදය-බලනන-ඡගම-වදය-රථයක/1-683785	si	lankadeepalk	1763983316.0
lk_news	2025-11-24-lankadeepalk-1e5ba860	lankadeepalk-1e5ba860	2025-11-24	මැකො නිලධාරී හතළිහක් පුහුණුවකට ඉන්දියාවට	https://www.lankadeepa.lk/latest_news/මක-නලධර-හතළහක-පහණවකට-ඉනදයවට/1-683784	si	lankadeepalk	1763982881.0
lk_news	2025-11-24-lankadeepalk-e43afc9d	lankadeepalk-e43afc9d	2025-11-24	ගම්පහට සුළු ගංවතුර තත්වයක්	https://www.lankadeepa.lk/latest_news/ගමපහට-සළ-ගවතර-තතවයක/1-683783	si	lankadeepalk	1763982601.0
lk_news	2025-11-24-virakesarilk-f77ebae3	virakesarilk-f77ebae3	2025-11-24	சிஐடியில் முன்னிலையானார் நடிகை காயத்ரி டயஸ்	https://www.virakesari.lk/article/231302	ta	virakesarilk	1763981400.0
lk_news	2025-11-24-tamilmirrorlk-80d8e4bc	tamilmirrorlk-80d8e4bc	2025-11-24	புதிய அம்சங்களுடன் அதிர்ச்சி கொடுக்கும் கூகுள் மேப்ஸ்	https://www.tamilmirror.lk/science-tech/புதிய-அம்சங்களுடன்-அதிர்ச்சி-கொடுக்கும்-கூகுள்-மேப்ஸ்/57-368417	ta	tamilmirrorlk	1763981391.0
lk_news	2025-11-24-virakesarilk-aa4c3ec8	virakesarilk-aa4c3ec8	2025-11-24	நாட்டுக்கு பயனுடையதாக அமையும் கருத்திட்டங்களுக்கு முழுமையான ஒத்துழைப்பு வழங்குவோம் - எஸ்.எம்.மரிக்கார்	https://www.virakesari.lk/article/231300	ta	virakesarilk	1763980620.0
lk_news	2025-11-24-virakesarilk-d6116b29	virakesarilk-d6116b29	2025-11-24	இவ்வாண்டில் 2080 பில்லியன் ரூபா வரி வருமானம் ; நிர்ணயிக்கப்பட்ட இலக்கில் 92 சதவீதத்தை அண்மித்துள்ளோம் - உள்நாட்டு இறைவரி திணைக்களம்	https://www.virakesari.lk/article/231296	ta	virakesarilk	1763980200.0
lk_news	2025-11-24-virakesarilk-bceeadbc	virakesarilk-bceeadbc	2025-11-24	கொலைக் குற்றவாளிகள் 10 பேருக்கு மரண தண்டனை	https://www.virakesari.lk/article/231280	ta	virakesarilk	1763980140.0
lk_news	2025-11-24-virakesarilk-83160921	virakesarilk-83160921	2025-11-24	எமது குழந்தைகளின் ஆரோக்கியமான எதிர்காலத்திற்காக முக்கியமான நடவடிக்கையை எடுத்துள்ளோம் - கொழும்பு மாநகர மேயர்	https://www.virakesari.lk/article/231299	ta	virakesarilk	1763980140.0
lk_news	2025-11-24-lankadeepalk-4ef36b3a	lankadeepalk-4ef36b3a	2025-11-24	ආණ්ඩුවේ බාඳුරා මලක් ගැන පාර්ලිමේන්තුවේදී හෙළිදරව්වක්	https://www.lankadeepa.lk/news/ආණඩව-බඳර-මලක-ගන-පරලමනතවද-හළදරවවක/101-683782	si	lankadeepalk	1763979803.0
lk_news	2025-11-24-virakesarilk-098fde0d	virakesarilk-098fde0d	2025-11-24	ஐரோப்பிய ஒன்றியப் பிரதிநிதிகள் குழு டிசம்பரில் நாட்டுக்கு வருகை	https://www.virakesari.lk/article/231295	ta	virakesarilk	1763979660.0
lk_news	2025-11-24-virakesarilk-fbc1d040	virakesarilk-fbc1d040	2025-11-24	கொழும்பு துறைமுகத்தின் சரக்கு நெரிசலைக் குறைக்க சீர்திருத்தங்கள் உடனடியாக தேவை என்கிறது JAAF	https://www.virakesari.lk/article/231294	ta	virakesarilk	1763979480.0
lk_news	2025-11-24-lankadeepalk-35c89813	lankadeepalk-35c89813	2025-11-24	කන්දකැටිය අයවැය දෙවැනි වරටත් පරදී	https://www.lankadeepa.lk/news/කනදකටය-අයවය-දවන-වරටත-පරද/101-683781	si	lankadeepalk	1763979449.0
lk_news	2025-11-24-virakesarilk-f9124223	virakesarilk-f9124223	2025-11-24	காலி துறைமுகத்தை சுற்றுலாத்துறை அபிவிருத்திக்காக பயன்படுத்த தீர்மானிக்கப்பட்டுள்ளது - அருண கருணாதிலக	https://www.virakesari.lk/article/231292	ta	virakesarilk	1763979360.0
lk_news	2025-11-24-virakesarilk-4a2ff9cf	virakesarilk-4a2ff9cf	2025-11-24	பாடசாலை மாணவர்கள் என்பவர்கள் முதிர்ச்சியடையாத பருவத்தினர் ; அவர்களை எந்தவிதமான கோட்பாடுகளின் அடிப்படையிலும் பிரித்துப் பார்ப்பது பொருத்தமாகாது - காதர் மஸ்தான்	https://www.virakesari.lk/article/231289	ta	virakesarilk	1763979180.0
lk_news	2025-11-24-tamilmirrorlk-9e6a0c4b	tamilmirrorlk-9e6a0c4b	2025-11-24	மற்றொரு பட்ஜெட் தோற்றது	https://www.tamilmirror.lk/செய்திகள்/மற்றொரு-பட்ஜெட்-தோற்றது/175-368413	ta	tamilmirrorlk	1763979098.0
lk_news	2025-11-24-virakesarilk-dcfc84d6	virakesarilk-dcfc84d6	2025-11-24	இணையவழி மோசடி வலையில் சிக்கினார் ஓய்வு பெற்ற நீதிபதி !	https://www.virakesari.lk/article/231291	ta	virakesarilk	1763979060.0
lk_news	2025-11-24-lankadeepalk-e32c9d25	lankadeepalk-e32c9d25	2025-11-24	බොලිවුඩ් නළු ධර්මේන්ද්‍ර දිවි රඟ මඩලට සමුදෙයි	https://www.lankadeepa.lk/news/බලවඩ-නළ-ධරමනදර-දව-රඟ-මඩලට-සමදය/101-683780	si	lankadeepalk	1763978849.0
lk_news	2025-11-24-virakesarilk-07925af8	virakesarilk-07925af8	2025-11-24	சீரற்ற வானிலை: 10 மாவட்டங்களில் 1,790 பேர் பாதிப்பு!	https://www.virakesari.lk/article/231285	ta	virakesarilk	1763978700.0
lk_news	2025-11-24-virakesarilk-cd1c37bb	virakesarilk-cd1c37bb	2025-11-24	தனியார் நிறுவனங்களுக்கு விற்கப்பட்ட கடல் எல்லைகள் - மூதூர் மீனவர்கள் ஆர்ப்பாட்டம்	https://www.virakesari.lk/article/231288	ta	virakesarilk	1763978340.0
lk_news	2025-11-24-virakesarilk-9040c792	virakesarilk-9040c792	2025-11-24	கொழும்பு துறைமுக வளாகத்தில் மனித புதைகுழிகள் : சில கேள்விகளை உள்ளடக்கி மக்கள் போராட்ட முன்னணி நீதி அமைச்சுக்கு கடிதம்	https://www.virakesari.lk/article/231286	ta	virakesarilk	1763978040.0
lk_news	2025-11-24-virakesarilk-f693658c	virakesarilk-f693658c	2025-11-24	பொலிவுட்டின் மூத்த நடிகர் தர்மேந்திரா காலமானார்	https://www.virakesari.lk/article/231287	ta	virakesarilk	1763977860.0
lk_news	2025-11-24-tamilmirrorlk-9d4218c2	tamilmirrorlk-9d4218c2	2025-11-24	நம்ம  பல் துலக்கும் பிரஷை கண்டுபிடிச்சது யார் தெரியுமா?	https://www.tamilmirror.lk/விநோத-உலகம்/நம்ம-பல்-துலக்கும்-பிரஷை-கண்டுபிடிச்சது-யார்-தெரியுமா/53-368411	ta	tamilmirrorlk	1763977115.0
lk_news	2025-11-24-tamilmirrorlk-63d77d64	tamilmirrorlk-63d77d64	2025-11-24	இளம்பெண் அமர்ந்த சோபாவை நுகர்ந்து, நக்கி பார்த்த நபர்	https://www.tamilmirror.lk/விநோத-உலகம்/இளம்பெண்-அமர்ந்த-சோபாவை-நுகர்ந்து-நக்கி-பார்த்த-நபர்/53-368410	ta	tamilmirrorlk	1763976359.0
lk_news	2025-11-24-tamilmirrorlk-cfdd0b60	tamilmirrorlk-cfdd0b60	2025-11-24	பணத்தால் மாணவர்களை தூண்டிய ஆசிரியை :ஆபாச படங்களால் பரபரப்பு	https://www.tamilmirror.lk/உலக-செய்திகள்/பணத்தால்-மாணவர்களை-தூண்டிய-ஆசிரியை-ஆபாச-படங்களால்-பரபரப்பு/50-368409	ta	tamilmirrorlk	1763976090.0
lk_news	2025-11-24-lankadeepalk-191d7166	lankadeepalk-191d7166	2025-11-24	’ගල පුපුරවන්න  බැරි අවදානමක් : මං  තීරුවක් අද හෙටම විවෘත කරනවා’	https://www.lankadeepa.lk/news/ගල-පපරවනන-බර-අවදනමක-ම-තරවක-අද-හටම-වවත-කරනව/101-683778	si	lankadeepalk	1763976075.0
lk_news	2025-11-24-virakesarilk-685fae69	virakesarilk-685fae69	2025-11-24	பாணந்துறையில் தொழிற்சாலையில் பாரிய தீ விபத்து!	https://www.virakesari.lk/article/231282	ta	virakesarilk	1763976060.0
lk_news	2025-11-24-virakesarilk-5a129fb4	virakesarilk-5a129fb4	2025-11-24	ஊடக சுதந்திரத்தில் கை வைக்க வேண்டாம் கோழைத்தனமான ஆட்சியை உடன் நிறுத்துங்கள் - எதிர்க்கட்சி தலைவர் சஜித் பிரேமதாச வலியுறுத்தல்	https://www.virakesari.lk/article/231284	ta	virakesarilk	1763976000.0
lk_news	2025-11-24-lankadeepalk-e19bc6ab	lankadeepalk-e19bc6ab	2025-11-24	ඉන්දියාවේ මහා අනතුරක්	https://www.lankadeepa.lk/news/ඉනදයව-මහ-අනතරක/101-683776	si	lankadeepalk	1763975805.0
lk_news	2025-11-24-tamilmirrorlk-892cac3f	tamilmirrorlk-892cac3f	2025-11-24	பாணந்துறை ஹிரான பகுதியில் தீ விபத்து	https://www.tamilmirror.lk/செய்திகள்/பாணந்துறை-ஹிரான-பகுதியில்-தீ-விபத்து/175-368408	ta	tamilmirrorlk	1763975708.0
lk_news	2025-11-24-bbccomsinhala-6feb2d44	bbccomsinhala-6feb2d44	2025-11-24	අරුණ පුවත්පතේ කර්තෘ CID කැඳවීම මාධ්‍යවේදීන් බිය ගැන්වීමක් ද?	https://www.bbc.com/sinhala/articles/cwypevq4epjo	si	bbccomsinhala	1763975385.0
lk_news	2025-11-24-virakesarilk-7745c98a	virakesarilk-7745c98a	2025-11-24	இஸ்ரேலின் வான்வழித் தாக்குதலில் ஹிஸ்புல்லா அமைப்பின் முக்கிய இராணுவ தளபதி பலி	https://www.virakesari.lk/article/231262	ta	virakesarilk	1763975340.0
lk_news	2025-11-24-adalk-bbff7906	adalk-bbff7906	2025-11-24	කාඩ්පත් මගින් බස් ගාස්තු ගෙවිම අරඹයි - මගියාට අමතර මුදල් අයවිමක් නෑ	https://www.ada.lk/breaking_news/කාඩ්පත්-මගින්-බස්-ගාස්තු-ගෙවිම-අරඹයි---මගියාට-අමතර-මුදල්-අයවිමක්-නෑ/11-419850	si	adalk	1763974999.0
lk_news	2025-11-24-lankadeepalk-962a7df3	lankadeepalk-962a7df3	2025-11-24	’’කැබ් එක’’ එපා යැයි ජගත් විතාන ලියුමක් දෙයි	https://www.lankadeepa.lk/news/කබ-එක-එප-යය-ජගත-වතන-ලයමක-දය/101-683774	si	lankadeepalk	1763974861.0
lk_news	2025-11-24-tamilmirrorlk-3ae52913	tamilmirrorlk-3ae52913	2025-11-24	மத்திய நிலையத்தில் போதையில் இருந்தவருக்கு தடை	https://www.tamilmirror.lk/செய்திகள்/மத்திய-நிலையத்தில்-போதையில்-இருந்தவருக்கு-தடை/175-368407	ta	tamilmirrorlk	1763974643.0
