doc_type	doc_id	num	date_str	description	url_metadata	lang	newspaper_id	time_ut
lk_news	2025-10-29-tamilmirrorlk-a9f5a2dc	tamilmirrorlk-a9f5a2dc	2025-10-29	பெண்களின் நிர்வாண படங்கள் வைத்திருந்ததால் காதலனை  கொன்ற காதலி	https://www.tamilmirror.lk/செய்திகள்/பெண்களின்-நிர்வாண-படங்கள்-வைத்திருந்ததால்-காதலனை-கொன்ற-காதலி/175-367048	ta	tamilmirrorlk	1761729125.0
lk_news	2025-10-29-lankadeepalk-72e2f69a	lankadeepalk-72e2f69a	2025-10-29	වයඹ පළාත් සභාව කෝපා කමිටුවට	https://www.lankadeepa.lk/news/වයඹ-පළත-සභව-කප-කමටවට/101-682310	si	lankadeepalk	1761728937.0
lk_news	2025-10-29-tamilmirrorlk-f76f4e57	tamilmirrorlk-f76f4e57	2025-10-29	‘அஸ்வெசும’ தொடர்பில் அதிரடியான அறிவிப்பு	https://www.tamilmirror.lk/செய்திகள்/அஸ்வெசும-தொடர்பில்-அதிரடியான-அறிவிப்பு/175-367046	ta	tamilmirrorlk	1761728552.0
lk_news	2025-10-29-virakesarilk-a8d45381	virakesarilk-a8d45381	2025-10-29	போர் விமானத்தில் பறந்தார் இந்திய ஜனாதிபதி திரௌபதி முர்மு	https://www.virakesari.lk/article/228971	ta	virakesarilk	1761727620.0
lk_news	2025-10-29-lankadeepalk-46079374	lankadeepalk-46079374	2025-10-29	අක්ෂි තාක්ෂණවේදීහු 57ක් ඩිප්ලෝමා උපාධි ලබති	https://www.lankadeepa.lk/news/අකෂ-තකෂණවදහ-57ක-ඩපලම-උපධ-ලබත/101-682307	si	lankadeepalk	1761726416.0
lk_news	2025-10-29-lankadeepalk-670ed252	lankadeepalk-670ed252	2025-10-29	වේයන්ගොඩට බහුවිධ භාණ්ඩ ප්‍රවාහන මධ්‍යස්ථානයක්	https://www.lankadeepa.lk/news/වයනගඩට-බහවධ-භණඩ-පරවහන-මධයසථනයක/101-682305	si	lankadeepalk	1761725694.0
lk_news	2025-10-29-lankadeepalk-d33b92e3	lankadeepalk-d33b92e3	2025-10-29	මැතිසබේ වෙනස් කරන රපෝර්තුවට කන්තෝරු නවයේම විරෝධය	https://www.lankadeepa.lk/news/මතසබ-වනස-කරන-රපරතවට-කනතර-නවයම-වරධය/101-682304	si	lankadeepalk	1761725543.0
lk_news	2025-10-29-tamilmirrorlk-a4254815	tamilmirrorlk-a4254815	2025-10-29	தென்கிழக்கு விஞ்ஞான பீட விடுதியில்  தீ	https://www.tamilmirror.lk/செய்திகள்/தென்கிழக்கு-விஞ்ஞான-பீட-விடுதியில்-தீ/175-367044	ta	tamilmirrorlk	1761725396.0
lk_news	2025-10-29-lankadeepalk-b5107c0e	lankadeepalk-b5107c0e	2025-10-29	රනිල් අධිකරණයට එයි	https://www.lankadeepa.lk/news/රනල-අධකරණයට-එය/101-682303	si	lankadeepalk	1761724772.0
lk_news	2025-10-29-tamilmirrorlk-954e205e	tamilmirrorlk-954e205e	2025-10-29	நீதிமன்றில் ரணில் ஆஜர்	https://www.tamilmirror.lk/செய்திகள்/நீதிமன்றில்-ரணில்-ஆஜர்/175-367041	ta	tamilmirrorlk	1761724740.0
lk_news	2025-10-29-virakesarilk-8a8ac780	virakesarilk-8a8ac780	2025-10-29	நீதிமன்றில் ஆஜரானார் ரணில் விக்ரமசிங்க!	https://www.virakesari.lk/article/228970	ta	virakesarilk	1761724380.0
lk_news	2025-10-29-virakesarilk-a51b6df1	virakesarilk-a51b6df1	2025-10-29	முகத்தை முழுமையாக மறைக்கும் வகையில் ஆடையணிவது பிரச்சினைகளை ஏற்படுத்தும் - அரசாங்கம் இந்த விடயத்தில் அடிபணிய கூடாது என்கிறார் ஞானசார தேரர்	https://www.virakesari.lk/article/228965	ta	virakesarilk	1761724020.0
lk_news	2025-10-29-virakesarilk-6e9a555b	virakesarilk-6e9a555b	2025-10-29	சடலத்தை அடையாளம் காண  பொதுமக்களிடம் உதவி கோரல்!	https://www.virakesari.lk/article/228968	ta	virakesarilk	1761723960.0
lk_news	2025-10-29-virakesarilk-c257029f	virakesarilk-c257029f	2025-10-29	இலங்கை - ரஷ்ய இராணுவ பயிற்சியின் போது வெடி விபத்து : 3 இராணுவ வீரர்கள் காயம் !	https://www.virakesari.lk/article/228967	ta	virakesarilk	1761723780.0
lk_news	2025-10-29-dailyftlk-414f2626	dailyftlk-414f2626	2025-10-29	Vijitha says audit report on e-Visa key to ongoing court case	https://www.ft.lk/news/Vijitha-says-audit-report-on-e-Visa-key-to-ongoing-court-case/56-783631	en	dailyftlk	1761723508.0
lk_news	2025-10-29-virakesarilk-48d9a9df	virakesarilk-48d9a9df	2025-10-29	நாடளாவிய ரீதியில் விசேட சுற்றிவளைப்பு!	https://www.virakesari.lk/article/228966	ta	virakesarilk	1761723480.0
lk_news	2025-10-29-virakesarilk-b4a3c2d8	virakesarilk-b4a3c2d8	2025-10-29	பத்தாயிரம் கிலோவுக்கு அதிகமான பூசணியை சந்தைப்படுத்த முடியாது அவதிப்படும் விவசாயி	https://www.virakesari.lk/article/228964	ta	virakesarilk	1761723240.0
lk_news	2025-10-29-virakesarilk-c50622eb	virakesarilk-c50622eb	2025-10-29	2025 ஆம் ஆண்டின் மூன்றாவது காலாண்டில் ஆண்டுக்கு ஆண்டு 32% அதிகரிப்புடன் வளர்ச்சிப் பதிவுசெய்துள்ளது ஸ்ரீலங்கா இன்சூரன்ஸ் லைஃப்	https://www.virakesari.lk/article/228961	ta	virakesarilk	1761723060.0
lk_news	2025-10-29-virakesarilk-b0c9e84c	virakesarilk-b0c9e84c	2025-10-29	நுவரெலியாவில் ஆணின் சடலம் மீட்பு!	https://www.virakesari.lk/article/228963	ta	virakesarilk	1761723060.0
lk_news	2025-10-29-virakesarilk-67f72d97	virakesarilk-67f72d97	2025-10-29	மக்கள் வங்கியும் Japan Remit Finance நிறுவனமும் 5 ஆண்டு கால கூட்டாண்மையை வலுப்படுத்தியுள்ளன	https://www.virakesari.lk/article/228958	ta	virakesarilk	1761723000.0
lk_news	2025-10-29-virakesarilk-40891049	virakesarilk-40891049	2025-10-29	முற்றுப்பெறாத நீர்ப்பாசனத் திட்டமும் காட்டுயானை அட்டகாசமும் – தட்டையமலை நிலைமையை பார்வையிட்டார் துரைராசா ரவிகரன்	https://www.virakesari.lk/article/228959	ta	virakesarilk	1761723000.0
lk_news	2025-10-29-virakesarilk-633b32a2	virakesarilk-633b32a2	2025-10-29	பிரேசிலில் போதைப்பொருள் கடத்தல் கும்பலை பிடிக்க சுற்றிவளைப்பு : பொலிஸார் உட்பட 64 பேர் உயிரிழப்பு	https://www.virakesari.lk/article/228960	ta	virakesarilk	1761722820.0
lk_news	2025-10-29-lankadeepalk-8bf620fd	lankadeepalk-8bf620fd	2025-10-29	ලොකු උපාධි ගන්න ගිය දොස්තරලා 68ක් කට්ටි පැනලා	https://www.lankadeepa.lk/news/ලක-උපධ-ගනන-ගය-දසතරල-68ක-කටට-පනල/101-682301	si	lankadeepalk	1761722697.0
lk_news	2025-10-29-virakesarilk-6c8a0ffd	virakesarilk-6c8a0ffd	2025-10-29	நாடு கடத்தப்பட்ட இலங்கையர்கள் மூவர் கட்டுநாயக்கவில் கைது!	https://www.virakesari.lk/article/228962	ta	virakesarilk	1761722580.0
lk_news	2025-10-29-adalk-0b4695cd	adalk-0b4695cd	2025-10-29	ලංකාවේ තේ, කෝපි සහ දුම්කොළ වගාව සංවර්ධනයට චීන දූත පිරිසක් සමඟ සාකච්ඡා	https://www.ada.lk/breaking_news/ලංකාවේ-තේ--කෝපි-සහ-දුම්කොළ-වගාව-සංවර්ධනයට-චීන-දූත-පිරිසක්-සමඟ-සාකච්ඡා/11-419385	si	adalk	1761722089.0
lk_news	2025-10-29-adalk-7d938886	adalk-7d938886	2025-10-29	වයඹ පළාත් සභාව කෝපා කමිටුවට කැඳවයි	https://www.ada.lk/breaking_news/වයඹ-පළාත්-සභාව-කෝපා-කමිටුවට-කැඳවයි/11-419384	si	adalk	1761721466.0
lk_news	2025-10-29-virakesarilk-61c6280d	virakesarilk-61c6280d	2025-10-29	MAS ஹோல்டிங்ஸினால் அறிமுகப்படுத்தப்பட்டுள்ள 'Plan for Change 2030' திட்டம் நிலையான ஆடைகள் துறை நோக்கிய முன்னேற்றத்தை விரைவுபடுத்துகிறது	https://www.virakesari.lk/article/228957	ta	virakesarilk	1761721320.0
lk_news	2025-10-29-virakesarilk-f7cdff25	virakesarilk-f7cdff25	2025-10-29	இராணுவப் புத்தாக்கத்தை மறுவடிவமைக்கும் மூலோபாயத்தில் சீனாவின் 15 ஆவது ஐந்தாண்டுத் திட்டம் !	https://www.virakesari.lk/article/228955	ta	virakesarilk	1761721200.0
lk_news	2025-10-29-virakesarilk-e5a26b16	virakesarilk-e5a26b16	2025-10-29	நல்லிணக்கத்தை யதார்த்தமாக்குவதற்கு அவசியமான நடவடிக்கைகளை அரசாங்கம் முன்னெடுக்க வேண்டிய தருணம் இது	https://www.virakesari.lk/article/228956	ta	virakesarilk	1761720960.0
lk_news	2025-10-29-tamilmirrorlk-306eb080	tamilmirrorlk-306eb080	2025-10-29	தங்கத்தின் விலையில் திடீர் மாற்றம்	https://www.tamilmirror.lk/செய்திகள்/தங்கத்தின்-விலையில்-திடீர்-மாற்றம்/175-367040	ta	tamilmirrorlk	1761720345.0
lk_news	2025-10-29-virakesarilk-8850e9ff	virakesarilk-8850e9ff	2025-10-29	யாழில் ஹெரோயினுடன் கைதானவரை தடுத்து வைத்து விசாரணை செய்ய நீதிமன்றம் அனுமதி	https://www.virakesari.lk/article/228954	ta	virakesarilk	1761720060.0
lk_news	2025-10-29-virakesarilk-f7e7b502	virakesarilk-f7e7b502	2025-10-29	முல்லை அனர்த்த முகாமைத்துவ ஒருங்கிணைப்பு பிரிவு உதவிப்பணிப்பாளர், துரைராசா ரவிகரன் ஆகியோருக்கிடையில் சந்திப்பு	https://www.virakesari.lk/article/228951	ta	virakesarilk	1761719820.0
lk_news	2025-10-29-lankadeepalk-8190a073	lankadeepalk-8190a073	2025-10-29	ආයුර්වේද කොමසාරිස් ජනරාල් පත් වෙයි	https://www.lankadeepa.lk/news/ආයරවද-කමසරස-ජනරල-පත-වය/101-682288	si	lankadeepalk	1761719813.0
lk_news	2025-10-29-virakesarilk-6e8feb10	virakesarilk-6e8feb10	2025-10-29	இன்றைய நாணய மாற்று விகிதம்	https://www.virakesari.lk/article/228952	ta	virakesarilk	1761719760.0
lk_news	2025-10-29-virakesarilk-e07fd01a	virakesarilk-e07fd01a	2025-10-29	யோஷித ராஜபக்ஷ, டெய்சி பாட்டிக்கு எதிரான வழக்கு மீதான விசாரணை ஒத்திவைப்பு!	https://www.virakesari.lk/article/228953	ta	virakesarilk	1761719280.0
lk_news	2025-10-29-virakesarilk-9c991b18	virakesarilk-9c991b18	2025-10-29	அமெரிக்கா, ஐக்கிய இராச்சியத்திற்கான ஏற்றுமதி குறைந்த போதிலும் செப்டம்பரில் ஆடை ஏற்றுமதியில் மிதமான வளர்ச்சி - ஒன்றிணைந்த ஆடைச் சங்கங்களின் மன்றம்	https://www.virakesari.lk/article/228950	ta	virakesarilk	1761718740.0
lk_news	2025-10-29-lankadeepalk-32ad878c	lankadeepalk-32ad878c	2025-10-29	දුප්පත්කම දේශපාලන ව්‍යාපාරයක්?	https://www.lankadeepa.lk/features/දපපතකම-දශපලන-වයපරයක/2-682285	si	lankadeepalk	1761718665.0
lk_news	2025-10-29-tamilmirrorlk-3c478920	tamilmirrorlk-3c478920	2025-10-29	கோபா குழுவிற்கு வடமேல் மாகாணசபைக்கு அழைப்பு	https://www.tamilmirror.lk/செய்திகள்/கோபா-குழுவிற்கு-வடமேல்-மாகாணசபைக்கு-அழைப்பு/175-367035	ta	tamilmirrorlk	1761718581.0
lk_news	2025-10-29-lankadeepalk-98437e4f	lankadeepalk-98437e4f	2025-10-29	අමරණීය අමරදේව	https://www.lankadeepa.lk/features/අමරණය-අමරදව/2-682282	si	lankadeepalk	1761718513.0
lk_news	2025-10-29-virakesarilk-86f070f0	virakesarilk-86f070f0	2025-10-29	ரணில் விக்ரமசிங்கவுக்கு எதிரான வழக்கு மீதான விசாரணை இன்று!	https://www.virakesari.lk/article/228949	ta	virakesarilk	1761718320.0
lk_news	2025-10-29-lankadeepalk-87ae54ad	lankadeepalk-87ae54ad	2025-10-29	දාඹරේ මාවතේ ලොකු ගින්නක්	https://www.lankadeepa.lk/news/දඹර-මවත-ලක-ගනනක/101-682281	si	lankadeepalk	1761718191.0
lk_news	2025-10-29-lankadeepalk-35ed5747	lankadeepalk-35ed5747	2025-10-29	අයවැය - ජනතා අපේක්ෂා	https://www.lankadeepa.lk/features/අයවය-ජනත-අපකෂ/2-682279	si	lankadeepalk	1761717863.0
lk_news	2025-10-29-virakesarilk-5f784029	virakesarilk-5f784029	2025-10-29	யாழில் சட்டவிரோத மணலுடன் இரண்டு உழவு இயந்திரங்கள் கைப்பற்றல் : ஒருவர் கைது	https://www.virakesari.lk/article/228947	ta	virakesarilk	1761717420.0
lk_news	2025-10-29-virakesarilk-04973cea	virakesarilk-04973cea	2025-10-29	“கணேமுல்ல சஞ்சீவ” படுகொலை ; இஷாரா செவ்வந்திக்கு உதவிய சட்டத்தரணி பொலிஸ் தடுப்பு காவலில் வைத்து விசாரணை!	https://www.virakesari.lk/article/228948	ta	virakesarilk	1761717360.0
lk_news	2025-10-29-lankadeepalk-21b66e4c	lankadeepalk-21b66e4c	2025-10-29	බැංකු ගිණුම් නැති අස්වැසුම දෙවැනි අදියරේ උදවියට පණිවිඩයක්	https://www.lankadeepa.lk/news/බක-ගණම-නත-අසවසම-දවන-අදයර-උදවයට-පණවඩයක/101-682273	si	lankadeepalk	1761716774.0
lk_news	2025-10-29-virakesarilk-2c504a1a	virakesarilk-2c504a1a	2025-10-29	கடலில் மிதந்த போத்தலில் இருந்து திரவத்தை குடித்த 02 பேர் உயிரிழப்பு	https://www.virakesari.lk/article/228946	ta	virakesarilk	1761716640.0
lk_news	2025-10-29-adalk-c29432e4	adalk-c29432e4	2025-10-29	නාරාහේන්පිට මහල් නිවාස සංකීර්ණයේ ගින්නෙන් පිරිස් මුදා ගැනීමේ මෙහෙයුම්	https://www.ada.lk/breaking_news/නාරාහේන්පිට-මහල්-නිවාස-සංකීර්ණයේ-ගින්නෙන්-පිරිස්-මුදා-ගැනීමේ-මෙහෙයුම්/11-419383	si	adalk	1761716194.0
lk_news	2025-10-29-tamilmirrorlk-2346cb42	tamilmirrorlk-2346cb42	2025-10-29	கைக்குண்டு வெடித்ததில் 3 சிப்பாய்கள் காயம்	https://www.tamilmirror.lk/செய்திகள்/கைக்குண்டு-வெடித்ததில்-3-சிப்பாய்கள்-காயம்/175-367032	ta	tamilmirrorlk	1761716092.0
lk_news	2025-10-29-tamilmirrorlk-47590df4	tamilmirrorlk-47590df4	2025-10-29	நாரஹேன்பிட்டவில் தீ: சிக்கிய பலர் மீட்பு	https://www.tamilmirror.lk/செய்திகள்/நாரஹேன்பிட்டவில்-தீ-சிக்கிய-பலர்-மீட்பு/175-367031	ta	tamilmirrorlk	1761715904.0
lk_news	2025-10-29-lankadeepalk-845b5ab0	lankadeepalk-845b5ab0	2025-10-29	පුහුණුවේදී අත් බෝම්බයක් පුපුරා සෙබළු තුනක්  රෝහලේ	https://www.lankadeepa.lk/news/පහණවද-අත-බමබයක-පපර-සබළ-තනක-රහල/101-682272	si	lankadeepalk	1761715805.0
lk_news	2025-10-29-tamilmirrorlk-d5c59942	tamilmirrorlk-d5c59942	2025-10-29	போதை  வேட்டை : பொலிஸார் உட்பட 64 பேர் உயிரிழப்பு	https://www.tamilmirror.lk/உலக-செய்திகள்/போதை-வேட்டை-பொலிஸார்-உட்பட-64-பேர்-உயிரிழப்பு/50-367030	ta	tamilmirrorlk	1761715411.0
lk_news	2025-10-29-tamilmirrorlk-b1c18c97	tamilmirrorlk-b1c18c97	2025-10-29	நீல நிறத்திற்கு மாறிய நாய்கள்	https://www.tamilmirror.lk/விநோத-உலகம்/நீல-நிறத்திற்கு-மாறிய-நாய்கள்/53-367029	ta	tamilmirrorlk	1761715072.0
lk_news	2025-10-29-tamilmirrorlk-756c6552	tamilmirrorlk-756c6552	2025-10-29	இந்த நால்வரின் இல்லங்களிலேயே நீதிமன்றங்கள்	https://www.tamilmirror.lk/செய்திகள்/இந்த-நால்வரின்-இல்லங்களிலேயே-நீதிமன்றங்கள்/175-367028	ta	tamilmirrorlk	1761714764.0
lk_news	2025-10-29-lankadeepalk-88feaea8	lankadeepalk-88feaea8	2025-10-29	කුණු කෑම විකිණු කඩ 9කට නඩු	https://www.lankadeepa.lk/news/කණ-කම-වකණ-කඩ-9කට-නඩ/101-682268	si	lankadeepalk	1761714103.0
lk_news	2025-10-29-tamilmirrorlk-a13302a5	tamilmirrorlk-a13302a5	2025-10-29	சட்டம்	https://www.tamilmirror.lk/சிந்தனை-சித்திரம்/சட்டம்/62-367027	ta	tamilmirrorlk	1761713718.0
lk_news	2025-10-29-lankadeepalk-dcdf43d5	lankadeepalk-dcdf43d5	2025-10-29	පාවී ආ නාඳුනන බෝතලයෙන් බී දෙකක් මරුට: දෙකක් රෝහලට	https://www.lankadeepa.lk/news/පව-ආ-නඳනන-බතලයන-බ-දකක-මරට-දකක-රහලට/101-682267	si	lankadeepalk	1761713685.0
lk_news	2025-10-29-tamilmirrorlk-f838c316	tamilmirrorlk-f838c316	2025-10-29	பாடசாலை நேரம் 30 நிமிடத்தால் அதிகரிப்பு	https://www.tamilmirror.lk/சிந்தனை-சித்திரம்/பாடசாலை-நேரம்-30-நிமிடத்தால்-அதிகரிப்பு/62-367026	ta	tamilmirrorlk	1761713546.0
lk_news	2025-10-29-tamilmirrorlk-f899d2fe	tamilmirrorlk-f899d2fe	2025-10-29	தங்க பதக்கத்தை தன் தந்தைக்கு அணிவித்த தங்கப்பெண்	https://www.tamilmirror.lk/மலையகம்/தங்க-பதக்கத்தை-தன்-தந்தைக்கு-அணிவித்த-தங்கப்பெண்/76-367024	ta	tamilmirrorlk	1761713037.0
lk_news	2025-10-29-tamilmirrorlk-7967befd	tamilmirrorlk-7967befd	2025-10-29	திரவத்தை பருகிய இரண்டு மீனவர்கள் மரணம்	https://www.tamilmirror.lk/வடமேல்-வடமத்தி/திரவத்தை-பருகிய-இரண்டு-மீனவர்கள்-மரணம்/94-367023	ta	tamilmirrorlk	1761712476.0
lk_news	2025-10-29-tamilmirrorlk-3d9e1a0c	tamilmirrorlk-3d9e1a0c	2025-10-29	செவ்வந்திக்கு நூல் கொடுத்த சட்டத்தரணியை விசாரிக்க அனுமதி	https://www.tamilmirror.lk/செய்திகள்/செவ்வந்திக்கு-நூல்-கொடுத்த-சட்டத்தரணியை-விசாரிக்க-அனுமதி/175-367022	ta	tamilmirrorlk	1761711331.0
lk_news	2025-10-29-tamilmirrorlk-10bdaabb	tamilmirrorlk-10bdaabb	2025-10-29	செவ்வந்திக்கு நூல் கொடுத்த பெண் சட்டத்தரணிக்கு தடுப்புக்காவல்	https://www.tamilmirror.lk/பிரசித்த-செய்தி/செவ்வந்திக்கு-நூல்-கொடுத்த-பெண்-சட்டத்தரணிக்கு-தடுப்புக்காவல்/150-367022	ta	tamilmirrorlk	1761711331.0
lk_news	2025-10-29-tamilmirrorlk-f2a84f1b	tamilmirrorlk-f2a84f1b	2025-10-29	நாரஹேன்பிட குடியிருப்புத் தொகுதியில் திடீர் தீ	https://www.tamilmirror.lk/செய்திகள்/நாரஹேன்பிட-குடியிருப்புத்-தொகுதியில்-திடீர்-தீ/175-367021	ta	tamilmirrorlk	1761710967.0
lk_news	2025-10-29-tamilmirrorlk-ffa0da0c	tamilmirrorlk-ffa0da0c	2025-10-29	இரவில் வரும் அதிகாரிகளுக்கு ஆதரவளியுங்கள்	https://www.tamilmirror.lk/செய்திகள்/இரவில்-வரும்-அதிகாரிகளுக்கு-ஆதரவளியுங்கள்/175-367020	ta	tamilmirrorlk	1761710455.0
lk_news	2025-10-29-virakesarilk-6e9fbd78	virakesarilk-6e9fbd78	2025-10-29	நாரஹேன்பிட்டியில் தொடர்மாடி குடியிருப்பில் தீ விபத்து	https://www.virakesari.lk/article/228945	ta	virakesarilk	1761710400.0
lk_news	2025-10-29-virakesarilk-ab267ebc	virakesarilk-ab267ebc	2025-10-29	கரையை கடந்தது மொந்தா புயல்	https://www.virakesari.lk/article/228944	ta	virakesarilk	1761708360.0
lk_news	2025-10-29-adalk-64ab9688	adalk-64ab9688	2025-10-29	වරාය අධිකාරියේ සේවක සමූපාකාර බැංකුවේ බලය ජවිපෙට	https://www.ada.lk/breaking_news/වරාය-අධිකාරියේ-සේවක-සමූපාකාර-බැංකුවේ-බලය-ජවිපෙට/11-419382	si	adalk	1761708355.0
lk_news	2025-10-29-lankadeepalk-8f1da026	lankadeepalk-8f1da026	2025-10-29	ජාතික හැදුනුම්පත් ලක්‍ෂ 15 ක් හිරවෙලා	https://www.lankadeepa.lk/latest_news/ජතක-හදනමපත-ලකෂ-15-ක-හරවල/1-682265	si	lankadeepalk	1761708198.0
lk_news	2025-10-29-adalk-55b231d2	adalk-55b231d2	2025-10-29	සෙව්වන්දිට නීති පොත දුන් නීතිඥවරියගෙන් රඳවාගෙන ප්‍රශ්න කරයි	https://www.ada.lk/breaking_news/සෙව්වන්දිට-නීති-පොත-දුන්-නීතිඥවරියගෙන්-රඳවාගෙන-ප්‍රශ්න-කරයි/11-419381	si	adalk	1761708084.0
lk_news	2025-10-29-virakesarilk-e02c97a9	virakesarilk-e02c97a9	2025-10-29	கணேமுல்ல சஞ்சீவ கொலை வழக்கில் பெண் சட்டத்தரணி கைது!	https://www.virakesari.lk/article/228943	ta	virakesarilk	1761707820.0
lk_news	2025-10-29-adalk-91f853de	adalk-91f853de	2025-10-29	අද වැසි ස්වල්පයක් පමණයි	https://www.ada.lk/breaking_news/අද-වැසි-ස්වල්පයක්-පමණයි/11-419380	si	adalk	1761707582.0
lk_news	2025-10-29-adalk-9f1da135	adalk-9f1da135	2025-10-29	රුහුණු සරසවි සිසුන්ට ඇප	https://www.ada.lk/breaking_news/රුහුණු-සරසවි-සිසුන්ට-ඇප/11-419379	si	adalk	1761706514.0
