doc_type	doc_id	num	date_str	description	url_metadata	lang	newspaper_id	time_ut
lk_news	2025-10-16-lankadeepalk-3251164e	lankadeepalk-3251164e	2025-10-16	රිවස්ටන් පාර වහයි	https://www.lankadeepa.lk/latest_news/රවසටන-පර-වහය/1-681442	si	lankadeepalk	1760587808.0
lk_news	2025-10-16-lankadeepalk-2eaae2eb	lankadeepalk-2eaae2eb	2025-10-16	අගමැතිනිය ඉන්දියාවට යයි	https://www.lankadeepa.lk/latest_news/අගමතනය-ඉනදයවට-යය/1-681440	si	lankadeepalk	1760587305.0
lk_news	2025-10-16-virakesarilk-d0281361	virakesarilk-d0281361	2025-10-16	சீனா சென்று திரும்பிய பிரதமர் ஹரிணி இந்தியா பயணமானார் !	https://www.virakesari.lk/article/227849	ta	virakesarilk	1760586300.0
lk_news	2025-10-16-lankadeepalk-12b2165a	lankadeepalk-12b2165a	2025-10-16	වසන්ත ගිය ජිනීවා වෙළෙඳ සැසිය ඇරැඹේ	https://www.lankadeepa.lk/news/වසනත-ගය-ජනව-වළඳ-සසය-ඇරඹ/101-681434	si	lankadeepalk	1760585679.0
lk_news	2025-10-16-lankadeepalk-f8b7bdd8	lankadeepalk-f8b7bdd8	2025-10-16	පොඩ්ඩා කළ වැඩේ වසන් කළ ලොක්කාගේ වැඩ තහනම්	https://www.lankadeepa.lk/news/පඩඩ-කළ-වඩ-වසන-කළ-ලකකග-වඩ-තහනම/101-681433	si	lankadeepalk	1760584721.0
lk_news	2025-10-16-lankadeepalk-0497c20e	lankadeepalk-0497c20e	2025-10-16	ලක්ෂ 20ක මත්ද්‍රව්‍ය සමඟ තිදෙනකු අල්ලයි	https://www.lankadeepa.lk/news/ලකෂ-20ක-මතදරවය-සමඟ-තදනක-අලලය/101-681432	si	lankadeepalk	1760584455.0
lk_news	2025-10-16-tamilmirrorlk-cb2892b8	tamilmirrorlk-cb2892b8	2025-10-16	இன்று காலநிலையில் ஏற்படவுள்ள மாற்றம்	https://www.tamilmirror.lk/செய்திகள்/இன்று-காலநிலையில்-ஏற்படவுள்ள-மாற்றம்/175-366366	ta	tamilmirrorlk	1760584105.0
lk_news	2025-10-16-tamilmirrorlk-3609b7dd	tamilmirrorlk-3609b7dd	2025-10-16	இந்தியா சென்றார் பிரதமர் ஹரிணி	https://www.tamilmirror.lk/செய்திகள்/இந்தியா-சென்றார்-பிரதமர்-ஹரிணி/175-366365	ta	tamilmirrorlk	1760583936.0
lk_news	2025-10-16-lankadeepalk-1de9c5ea	lankadeepalk-1de9c5ea	2025-10-16	අද කාලගුණය	https://www.lankadeepa.lk/news/අද-කලගණය/101-681431	si	lankadeepalk	1760582943.0
lk_news	2025-10-16-adalk-34246ac5	adalk-34246ac5	2025-10-16	හාලි ඇළ නිවසකට පස් කන්දක් කඩා වැටෙයි, හතරක්ගේ දිවි බේරෙයි	https://www.ada.lk/breaking_news/හාලි-ඇළ-නිවසකට-පස්-කන්දක්-කඩා-වැටෙයි--හතරක්ගේ-දිවි-බේරෙයි/11-419126	si	adalk	1760580335.0
lk_news	2025-10-16-virakesarilk-3a015e4a	virakesarilk-3a015e4a	2025-10-16	இன்றைய வானிலை	https://www.virakesari.lk/article/227848	ta	virakesarilk	1760575740.0
lk_news	2025-10-16-dailyftlk-754da2d7	dailyftlk-754da2d7	2025-10-16	Home Lands EXPO 2025 spotlights property investment opportunities	https://www.ft.lk/business/Home-Lands-EXPO-2025-spotlights-property-investment-opportunities/34-783072	en	dailyftlk	1760574306.0
lk_news	2025-10-16-dailyftlk-813e4000	dailyftlk-813e4000	2025-10-16	Virtusa expands technology centre in Sri Lanka with over 200 open roles	https://www.ft.lk/business/Virtusa-expands-technology-centre-in-Sri-Lanka-with-over-200-open-roles/34-783071	en	dailyftlk	1760574232.0
lk_news	2025-10-16-dailyftlk-67456e48	dailyftlk-67456e48	2025-10-16	Salesforce and OpenAI partner across enterprise work and commerce	https://www.ft.lk/business/Salesforce-and-OpenAI-partner-across-enterprise-work-and-commerce/34-783070	en	dailyftlk	1760574192.0
lk_news	2025-10-16-dailyftlk-3578663e	dailyftlk-3578663e	2025-10-16	CA Sri Lanka honours Niluka Jayasinghe as Best Entrepreneur 2025 for driving knowledge-based exports	https://www.ft.lk/business/CA-Sri-Lanka-honours-Niluka-Jayasinghe-as-Best-Entrepreneur-2025-for-driving-knowledge-based-exports/34-783069	en	dailyftlk	1760573920.0
lk_news	2025-10-16-dailyftlk-a1ba7d68	dailyftlk-a1ba7d68	2025-10-16	India’s Guru Kashi University and Oxford Chester Uni  of Higher Education Sri Lanka strengthen academic ties	https://www.ft.lk/business/India-s-Guru-Kashi-University-and-Oxford-Chester-Uni-of-Higher-Education-Sri-Lanka-strengthen-academic-ties/34-783068	en	dailyftlk	1760573881.0
lk_news	2025-10-16-dailyftlk-eb8a4558	dailyftlk-eb8a4558	2025-10-16	Colombo Declaration unites South-East Asia for healthy ageing	https://www.ft.lk/news/Colombo-Declaration-unites-South-East-Asia-for-healthy-ageing/56-783067	en	dailyftlk	1760573779.0
lk_news	2025-10-16-dailyftlk-775ebb0d	dailyftlk-775ebb0d	2025-10-16	PC polls to be held next year under old or new system: Lalkantha	https://www.ft.lk/news/PC-polls-to-be-held-next-year-under-old-or-new-system-Lalkantha/56-783066	en	dailyftlk	1760573530.0
lk_news	2025-10-16-dailyftlk-7d9d6cba	dailyftlk-7d9d6cba	2025-10-16	Navy seizes 839 kg haul of drugs drifting in southern seas	https://www.ft.lk/news/Navy-seizes-839-kg-haul-of-drugs-drifting-in-southern-seas/56-783065	en	dailyftlk	1760573502.0
lk_news	2025-10-16-tamilmirrorlk-53520f68	tamilmirrorlk-53520f68	2025-10-16	ஆப்கானிஸ்தான் - பாகிஸ்தான் இடையில் போர் நிறுத்தம்	https://www.tamilmirror.lk/உலக-செய்திகள்/ஆப்கானிஸ்தான்-பாகிஸ்தான்-இடையில்-போர்-நிறுத்தம்/50-366363	ta	tamilmirrorlk	1760570697.0
lk_news	2025-10-16-tamilmirrorlk-580396ab	tamilmirrorlk-580396ab	2025-10-16	8 பேரை சுட்டுக்கொன்றது ஹமாஸ்	https://www.tamilmirror.lk/உலக-செய்திகள்/8-பேரை-சுட்டுக்கொன்றது-ஹமாஸ்/50-366362	ta	tamilmirrorlk	1760570473.0
lk_news	2025-10-16-dailyftlk-9fe2cc33	dailyftlk-9fe2cc33	2025-10-16	Gaza reprieved, Geneva match-fixed, devolution auctioned, Venezuela targeted	https://www.ft.lk/columns/Gaza-reprieved-Geneva-match-fixed-devolution-auctioned-Venezuela-targeted/4-783047	en	dailyftlk	1760570294.0
lk_news	2025-10-16-virakesarilk-09b0d577	virakesarilk-09b0d577	2025-10-16	மன்னார் - நகரசபை, மாவட்ட செயலகத்தின் தீர்மானத்திற்கு எதிராக போராட தயாராகும் சாந்திபுரம் கிராம மக்கள்	https://www.virakesari.lk/article/227847	ta	virakesarilk	1760569800.0
lk_news	2025-10-16-dailyftlk-7d12544c	dailyftlk-7d12544c	2025-10-16	Enhancing tax morale in Sri Lanka: Path to sustainable compliance	https://www.ft.lk/columns/Enhancing-tax-morale-in-Sri-Lanka-Path-to-sustainable-compliance/4-783046	en	dailyftlk	1760569746.0
lk_news	2025-10-16-dailyftlk-d65f6178	dailyftlk-d65f6178	2025-10-16	Beyond prediction: Rise of explainable AI in financial decision making	https://www.ft.lk/columns/Beyond-prediction-Rise-of-explainable-AI-in-financial-decision-making/4-783045	en	dailyftlk	1760569020.0
lk_news	2025-10-16-tamilmirrorlk-b29182f0	tamilmirrorlk-b29182f0	2025-10-16	29 இந்திய மீனவர்களுக்கு விளக்கமறியல் நீடிப்பு	https://www.tamilmirror.lk/செய்திகள்/29-இந்திய-மீனவர்களுக்கு-விளக்கமறியல்-நீடிப்பு/175-366360	ta	tamilmirrorlk	1760568850.0
lk_news	2025-10-16-virakesarilk-8a5408ea	virakesarilk-8a5408ea	2025-10-16	ஓராண்டின் பின் மீண்டும் கூடுகிறது சம்பள நிர்ணயசபை; தொழில் ஆணையாளரால் தொழிற்சங்கங்களுக்கு அழைப்பு	https://www.virakesari.lk/article/227846	ta	virakesarilk	1760568840.0
lk_news	2025-10-16-dailyftlk-9a039d39	dailyftlk-9a039d39	2025-10-16	Promise and peril of relativism: Respecting perspectives without excusing injustice	https://www.ft.lk/columns/Promise-and-peril-of-relativism-Respecting-perspectives-without-excusing-injustice/4-783044	en	dailyftlk	1760568794.0
lk_news	2025-10-16-tamilmirrorlk-167b70e9	tamilmirrorlk-167b70e9	2025-10-16	கொழும்பு குற்ற விசாரணைப்பிரிவில் இஷாரா செவ்வந்தி	https://www.tamilmirror.lk/செய்திகள்/கொழும்பு-குற்ற-விசாரணைப்பிரிவில்-இஷாரா-செவ்வந்தி/175-366359	ta	tamilmirrorlk	1760568511.0
lk_news	2025-10-16-virakesarilk-da9cda42	virakesarilk-da9cda42	2025-10-16	பழைய முறையிலோ, புதிய முறையிலோ அடுத்த வருடம் மாகாணசபைத்தேர்தல்கள் - அமைச்சர் லால் காந்த உறுதி	https://www.virakesari.lk/article/227845	ta	virakesarilk	1760568420.0
lk_news	2025-10-16-virakesarilk-75454229	virakesarilk-75454229	2025-10-16	மன்னார் நகர சபை கழிவு குவியலில் மூன்றாவது நாளாகவும் தீ பரவல் ; மக்கள் அசௌகரியத்தில்	https://www.virakesari.lk/article/227844	ta	virakesarilk	1760568120.0
lk_news	2025-10-16-virakesarilk-65a42126	virakesarilk-65a42126	2025-10-16	யாழில் தாலிக்கொடி மற்றும் பணம் என்பவற்றை திருடிய சந்தேகநபர் கைது!	https://www.virakesari.lk/article/227843	ta	virakesarilk	1760567820.0
lk_news	2025-10-16-dailyftlk-a8082ff1	dailyftlk-a8082ff1	2025-10-16	Hand in hand for better foods and a better future: Partnerships for Sri Lanka’s SDG journey	https://www.ft.lk/columns/Hand-in-hand-for-better-foods-and-a-better-future-Partnerships-for-Sri-Lanka-s-SDG-journey/4-783042	en	dailyftlk	1760567469.0
lk_news	2025-10-16-virakesarilk-79f450a1	virakesarilk-79f450a1	2025-10-16	இங்கிலாந்து - பாகிஸ்தான் மகளிர் உலகக் கிண்ண கிரிக்கெட் போட்டி மழை காரணமாக இடையில் கைவிடப்பட்டது	https://www.virakesari.lk/article/227842	ta	virakesarilk	1760565420.0
lk_news	2025-10-16-virakesarilk-b82b1205	virakesarilk-b82b1205	2025-10-16	கடந்த ஆண்டு போல் இந்த ஆண்டு கப்பல் சேவை இடைநிறுத்தப்படாது - ஜெயசீலன்	https://www.virakesari.lk/article/227841	ta	virakesarilk	1760564820.0
lk_news	2025-10-16-bbccomsinhala-5c3df942	bbccomsinhala-5c3df942	2025-10-16	අක්වෙරළ අයෝජන: අල්ලස් කොමිසමට කළ පැමිණිල්ල ගැන හිටපු ඇමති ටිරාන් අලස් කියන්නේ කුමක් ද?	https://www.bbc.com/sinhala/articles/cvgdwnplzx4o	si	bbccomsinhala	1760558499.0
lk_news	2025-10-15-islandlk-d5b567ee	islandlk-d5b567ee	2025-10-15	Direct Kitchens Sri Lanka to design bespoke kitchens for Oceana Villas by Home Lands Skyline	http://island.lk/direct-kitchens-sri-lanka-to-design-bespoke-kitchens-for-oceana-villas-by-home-lands-skyline/	en	islandlk	1760552040.0
lk_news	2025-10-15-islandlk-8ae88abb	islandlk-8ae88abb	2025-10-15	CEAT Kelani attains ISO 14064-1:2018 certification for GHG emissions reporting	http://island.lk/ceat-kelani-attains-iso-14064-12018-certification-for-ghg-emissions-reporting-2/	en	islandlk	1760551980.0
lk_news	2025-10-15-islandlk-6bb848a7	islandlk-6bb848a7	2025-10-15	Conference on “Perspectives on Geographical Indications in Sri Lanka”	http://island.lk/conference-on-perspectives-on-geographical-indications-in-sri-lanka/	en	islandlk	1760551920.0
lk_news	2025-10-15-islandlk-19baa99b	islandlk-19baa99b	2025-10-15	Market down amid active trading, led by sectoral declines	http://island.lk/market-down-amid-active-trading-led-by-sectoral-declines/	en	islandlk	1760551860.0
lk_news	2025-10-15-islandlk-4e49d916	islandlk-4e49d916	2025-10-15	WIS Group’s Imperial Advisors expands conveyancing operation in Sri Lanka	http://island.lk/wis-groups-imperial-advisors-expands-conveyancing-operation-in-sri-lanka/	en	islandlk	1760551740.0
lk_news	2025-10-15-islandlk-124e1ae0	islandlk-124e1ae0	2025-10-15	More solutions …	http://island.lk/more-solutions/	en	islandlk	1760551380.0
lk_news	2025-10-15-virakesarilk-ce074624	virakesarilk-ce074624	2025-10-15	மாகாணசபைத்தேர்தல்கள்: தமிழ்த்தரப்புக்கள் ஒருமித்துப் பயணிக்க வேண்டும் - தமிழ்த்தேசியக் கட்சிகளின் சந்திப்பில் வலியுறுத்தல்	https://www.virakesari.lk/article/227840	ta	virakesarilk	1760547720.0
lk_news	2025-10-15-virakesarilk-86c4b8b0	virakesarilk-86c4b8b0	2025-10-15	31 ஓவர்களாக மட்டுப்படுத்தப்பட்ட இங்கிலாந்துடனான போட்டியில் DLS முறை பிரகாரம் பாகிஸ்தானின் இலக்கு 113 ஓட்டங்கள்	https://www.virakesari.lk/article/227839	ta	virakesarilk	1760545680.0
lk_news	2025-10-15-virakesarilk-58a9ccb4	virakesarilk-58a9ccb4	2025-10-15	சருமத்தை வெண்மையாக்கும் களிம்பு பாவனையால் 100 பேரில் 5 பாதிப்பு	https://www.virakesari.lk/article/227818	ta	virakesarilk	1760543460.0
lk_news	2025-10-15-virakesarilk-37a06cad	virakesarilk-37a06cad	2025-10-15	குருந்தூர்மலையை மகாவம்சந்துடன் தொடர்புபடுத்தி காட்சிப்படுத்தப்பட்ட போலி வரலாற்றுப் புனைவு; தொல்லியல் திணைக்களத்தை வன்மையாகக் கண்டிக்கும் - ரவிகரன் எம்.பி	https://www.virakesari.lk/article/227838	ta	virakesarilk	1760542680.0
lk_news	2025-10-15-dbsjeyarajcom-83e5d536	dbsjeyarajcom-83e5d536	2025-10-15	“Black October” 1990 :Mass Expulsion of Northern   Province Muslims by the  Tigers  35 Years ago	https://dbsjeyaraj.com/dbsj/?p=86483	en	dbsjeyarajcom	1760542200.0
lk_news	2025-10-15-adalk-b8f52457	adalk-b8f52457	2025-10-15	මනූෂට ඇප	https://www.ada.lk/breaking_news/මනූෂට-ඇප/11-419125	si	adalk	1760542130.0
lk_news	2025-10-15-adalk-a4b30cb5	adalk-a4b30cb5	2025-10-15	ගුණරත්න වන්නිනායකට ඇප	https://www.ada.lk/breaking_news/ගුණරත්න-වන්නිනායකට-ඇප/11-419124	si	adalk	1760541943.0
lk_news	2025-10-15-adalk-e4c8376a	adalk-e4c8376a	2025-10-15	ඉෂාරා සෙව්වන්දි ඇතුළු පිරිස ලංකාවට ගෙන එයි	https://www.ada.lk/breaking_news/ඉෂාරා-සෙව්වන්දි-ඇතුළු-පිරිස-ලංකාවට-ගෙන-එයි/11-419123	si	adalk	1760541779.0
lk_news	2025-10-15-virakesarilk-443f3712	virakesarilk-443f3712	2025-10-15	இஷாரா செவ்வந்தி குழுவினர் கொழும்புக்கு அழைத்து வரப்பட்டனர்	https://www.virakesari.lk/article/227837	ta	virakesarilk	1760539860.0
lk_news	2025-10-15-virakesarilk-5c0b155a	virakesarilk-5c0b155a	2025-10-15	மின்னல் தாக்கி ஒருவர்  வைத்தியசாலையில் அனுமதி; வீடும் வேனும் பலத்த சேதம்	https://www.virakesari.lk/article/227836	ta	virakesarilk	1760538180.0
lk_news	2025-10-15-tamilmirrorlk-8761bde9	tamilmirrorlk-8761bde9	2025-10-15	நாட்டிற்கு அழைத்து வரப்பட்டார் செவ்வந்தி	https://www.tamilmirror.lk/செய்திகள்/நாட்டிற்கு-அழைத்து-வரப்பட்டார்-செவ்வந்தி/175-366346	ta	tamilmirrorlk	1760537417.0
lk_news	2025-10-15-virakesarilk-aef884c9	virakesarilk-aef884c9	2025-10-15	இரு அமைச்சுக்களுக்கு புதிய செயலாளர்கள் நியமனம்	https://www.virakesari.lk/article/227835	ta	virakesarilk	1760537280.0
lk_news	2025-10-15-virakesarilk-be0d381a	virakesarilk-be0d381a	2025-10-15	சுன்னாகம் பொலிஸ் நிலைய உத்தியோகத்தர் இருவர் இடமாற்றம்	https://www.virakesari.lk/article/227834	ta	virakesarilk	1760536920.0
lk_news	2025-10-15-colombotelegraphcom-03d852df	colombotelegraphcom-03d852df	2025-10-15	Who Introduced Commercial Whale Watching In Sri Lanka?	https://www.colombotelegraph.com/index.php/who-introduced-commercial-whale-watching-in-sri-lanka/	en	colombotelegraphcom	1760536248.0
lk_news	2025-10-15-virakesarilk-b7ae0119	virakesarilk-b7ae0119	2025-10-15	முன்னாள் அமைச்சர் மனுஷ நாணயக்கார பிணையில் விடுவிப்பு	https://www.virakesari.lk/article/227833	ta	virakesarilk	1760536020.0
lk_news	2025-10-15-lankadeepalk-058d231a	lankadeepalk-058d231a	2025-10-15	මම මළා කියපු කතාවට මටම හිනා	https://www.lankadeepa.lk/news/මම-මළ-කයප-කතවට-මටම-හන/101-681429	si	lankadeepalk	1760535870.0
lk_news	2025-10-15-lankadeepalk-49c9e978	lankadeepalk-49c9e978	2025-10-15	ඉෂාර සෙව්වන්දි දිවයිනට රැගෙන එයි	https://www.lankadeepa.lk/latest_news/ඉෂර-සවවනද-දවයනට-රගන-එය/1-681428	si	lankadeepalk	1760535372.0
lk_news	2025-10-15-lankadeepalk-b8f52457	lankadeepalk-b8f52457	2025-10-15	මනූෂට ඇප	https://www.lankadeepa.lk/news/මනෂට-ඇප/101-681427	si	lankadeepalk	1760534101.0
lk_news	2025-10-15-lankadeepalk-edc6a39d	lankadeepalk-edc6a39d	2025-10-15	සයිනොපෙක් සමාගමේ පිරිසක් ඇමැති විජිත හමුවේ	https://www.lankadeepa.lk/news/සයනපක-සමගම-පරසක-ඇමත-වජත-හමව/101-681426	si	lankadeepalk	1760533913.0
lk_news	2025-10-15-virakesarilk-258fb4a5	virakesarilk-258fb4a5	2025-10-15	உண்மை மற்றும் நல்லிணக்க ஆணைக்குழுவை நிறுவ அரசாங்கம் நடவடிக்கை எடுக்கவில்லை -சிவில் சமூக அமைப்புக்கள் அதிருப்தி	https://www.virakesari.lk/article/227831	ta	virakesarilk	1760533800.0
lk_news	2025-10-15-lankadeepalk-7cd3493b	lankadeepalk-7cd3493b	2025-10-15	දූෂණයෙන් ලංකාව 120 තැනට	https://www.lankadeepa.lk/news/දෂණයන-ලකව-120-තනට/101-681425	si	lankadeepalk	1760533295.0
lk_news	2025-10-15-virakesarilk-3ba57aff	virakesarilk-3ba57aff	2025-10-15	ரொக் பொஸ்பேற் பெறுமதி சேர்க்கும் திட்டத்தை அமுல்படுத்துதல் தொடர்பான கலந்துரையாடல்	https://www.virakesari.lk/article/227830	ta	virakesarilk	1760532660.0
lk_news	2025-10-15-lankadeepalk-67d6d284	lankadeepalk-67d6d284	2025-10-15	ගුණරත්න වන්නිනායක ඇප මත මුදා හරියි	https://www.lankadeepa.lk/latest_news/ගණරතන-වනනනයක-ඇප-මත-මද-හරය/1-681424	si	lankadeepalk	1760532130.0
lk_news	2025-10-15-lankadeepalk-16fc6e09	lankadeepalk-16fc6e09	2025-10-15	අමාත්‍යාංශ දෙකකට නව ලේකම්වරු	https://www.lankadeepa.lk/latest_news/අමතයශ-දකකට-නව-ලකමවර/1-681423	si	lankadeepalk	1760531792.0
lk_news	2025-10-15-virakesarilk-26e6343a	virakesarilk-26e6343a	2025-10-15	களுதாவளையில் பாடசாலை மாணவி மற்றும் தாய் மீது மோதிய முச்சக்கரவண்டி!	https://www.virakesari.lk/article/227829	ta	virakesarilk	1760531460.0
lk_news	2025-10-15-virakesarilk-c7a6ed36	virakesarilk-c7a6ed36	2025-10-15	பேச்சுத்திறனற்ற இளம்பெண் மீது பலாத்கார முயற்சி - சந்தேக நபருக்கு விளக்கமறியல்	https://www.virakesari.lk/article/227828	ta	virakesarilk	1760530200.0
lk_news	2025-10-15-virakesarilk-9e66cbfb	virakesarilk-9e66cbfb	2025-10-15	நான் ஒரு நாள் கைதுசெய்யப்படுவேன் என்று எனக்கு தெரியும் - இஷாரா செவ்வந்தி	https://www.virakesari.lk/article/227827	ta	virakesarilk	1760530140.0
lk_news	2025-10-15-tamilmirrorlk-89ea5ca9	tamilmirrorlk-89ea5ca9	2025-10-15	பியூமி ஹன்சமாலிக்கு சிக்கல்	https://www.tamilmirror.lk/செய்திகள்/பியூமி-ஹன்சமாலிக்கு-சிக்கல்/175-366345	ta	tamilmirrorlk	1760529978.0
lk_news	2025-10-15-tamilmirrorlk-080520db	tamilmirrorlk-080520db	2025-10-15	தெற்கில் போதைப்பொருள் கடத்தல்;ஐவர் கைது	https://www.tamilmirror.lk/செய்திகள்/தெற்கில்-போதைப்பொருள்-கடத்தல்-ஐவர்-கைது/175-366344	ta	tamilmirrorlk	1760529548.0
lk_news	2025-10-15-tamilmirrorlk-2bb363fb	tamilmirrorlk-2bb363fb	2025-10-15	அனைத்து எதிர்க்கட்சிகளையும் அழைக்கிறது ஐ.தே.க	https://www.tamilmirror.lk/செய்திகள்/அனைத்து-எதிர்க்கட்சிகளையும்-அழைக்கிறது-ஐ-தே-க/175-366343	ta	tamilmirrorlk	1760529141.0
lk_news	2025-10-15-lankadeepalk-5f7f9695	lankadeepalk-5f7f9695	2025-10-15	යුක්තිය පසඳලීමේ ක්‍රියාවලිය දේශපාලනිකරණය වෙලා	https://www.lankadeepa.lk/latest_news/යකතය-පසඳලම-කරයවලය-දශපලනකරණය-වල/1-681422	si	lankadeepalk	1760528682.0
lk_news	2025-10-15-lankadeepalk-ae3c919f	lankadeepalk-ae3c919f	2025-10-15	ලබන පාර්ලිමේන්තු සතියේ වැඩ වෙන හැටි	https://www.lankadeepa.lk/latest_news/ලබන-පරලමනත-සතය-වඩ-වන-හට/1-681421	si	lankadeepalk	1760528456.0
lk_news	2025-10-15-virakesarilk-cbfddff3	virakesarilk-cbfddff3	2025-10-15	29 இந்திய மீனவர்களுக்கு விளக்கமறியல்	https://www.virakesari.lk/article/227825	ta	virakesarilk	1760528040.0
lk_news	2025-10-15-adalk-07c3ad86	adalk-07c3ad86	2025-10-15	ලබන සතියේ පාර්ලිමේන්තුව රැස් වෙන්නේ මෙහෙමයි	https://www.ada.lk/breaking_news/ලබන-සතියේ-පාර්ලිමේන්තුව-රැස්-වෙන්නේ-මෙහෙමයි/11-419122	si	adalk	1760528003.0
lk_news	2025-10-15-virakesarilk-f8ba6d53	virakesarilk-f8ba6d53	2025-10-15	மாகாண சபை தேர்தலை நடத்துங்கள்; எந்தவொரு பலப்பரீட்சைக்கும் தயார் - சஜித் பிரேமதாச	https://www.virakesari.lk/article/227822	ta	virakesarilk	1760527980.0
lk_news	2025-10-15-virakesarilk-77a0ac44	virakesarilk-77a0ac44	2025-10-15	பல்கட்சி ஜனநாயக முறைமையைப் பாதுகாப்பதற்காக ஐக்கிய மக்கள் சக்தியுடன் இணைந்து செயற்பட உறுதி பூண்டுள்ளோம் - ஐ.தே.க	https://www.virakesari.lk/article/227824	ta	virakesarilk	1760527980.0
lk_news	2025-10-15-lankadeepalk-2942a04b	lankadeepalk-2942a04b	2025-10-15	බහු පක්ෂ ක්‍රමය රකින්න ඔක්කොම එක තැනකට එන්න	https://www.lankadeepa.lk/news/බහ-පකෂ-කරමය-රකනන-ඔකකම-එක-තනකට-එනන/101-681420	si	lankadeepalk	1760527588.0
lk_news	2025-10-15-virakesarilk-9b1d358a	virakesarilk-9b1d358a	2025-10-15	இலங்கையின் ஆடைத் தொழில் நிலைத்தன்மையை மறுவரையறை செய்கிறது : காலநிலை நடவடிக்கை முதல் சமூக தாக்கம் வரை	https://www.virakesari.lk/article/227823	ta	virakesarilk	1760527440.0
