doc_type	doc_id	num	date_str	description	url_metadata	lang	newspaper_id	time_ut
lk_news	2025-11-13-dailyftlk-1067780a	dailyftlk-1067780a	2025-11-13	Anura suspends social and ethnic contracts; Mamdani presents new socialism	https://www.ft.lk/columns/Anura-suspends-social-and-ethnic-contracts-Mamdani-presents-new-socialism/4-784259	en	dailyftlk	1762995955.0
lk_news	2025-11-13-dailyftlk-227f8041	dailyftlk-227f8041	2025-11-13	Reforming our Constitution: Getting basics right first	https://www.ft.lk/columns/Reforming-our-Constitution-Getting-basics-right-first/4-784258	en	dailyftlk	1762995503.0
lk_news	2025-11-13-dailyftlk-2809b50d	dailyftlk-2809b50d	2025-11-13	Who really wins from Sri Lanka’s vehicle loan boom?	https://www.ft.lk/opinion/Who-really-wins-from-Sri-Lanka-s-vehicle-loan-boom/14-784256	en	dailyftlk	1762995174.0
lk_news	2025-11-13-dailyftlk-67222610	dailyftlk-67222610	2025-11-13	Retaining talent: Missing link in tourism’s recovery	https://www.ft.lk/columns/Retaining-talent-Missing-link-in-tourism-s-recovery/4-784255	en	dailyftlk	1762995026.0
lk_news	2025-11-13-dailyftlk-cc2ff68a	dailyftlk-cc2ff68a	2025-11-13	Ephemeral wealth: Serving gig economy worker whose income disappears overnight	https://www.ft.lk/columns/Ephemeral-wealth-Serving-gig-economy-worker-whose-income-disappears-overnight/4-784254	en	dailyftlk	1762993423.0
lk_news	2025-11-13-dailyftlk-ceb3c42d	dailyftlk-ceb3c42d	2025-11-13	SLPP and UNP hold talks ahead of anti-Govt. rally	https://www.ft.lk/news/SLPP-and-UNP-hold-talks-ahead-of-anti-Govt-rally/56-784252	en	dailyftlk	1762992697.0
lk_news	2025-11-13-dailyftlk-9cafe96e	dailyftlk-9cafe96e	2025-11-13	High Court told Daisy Forrest unable to face money laundering trial due to dementia	https://www.ft.lk/news/High-Court-told-Daisy-Forrest-unable-to-face-money-laundering-trial-due-to-dementia/56-784251	en	dailyftlk	1762992636.0
lk_news	2025-11-13-dailyftlk-c710cbb6	dailyftlk-c710cbb6	2025-11-13	Govt. to pilot pipeline irrigation projects to combat drought and crop losses in dry zones	https://www.ft.lk/news/Govt-to-pilot-pipeline-irrigation-projects-to-combat-drought-and-crop-losses-in-dry-zones/56-784250	en	dailyftlk	1762992614.0
lk_news	2025-11-13-dailyftlk-c01b43b1	dailyftlk-c01b43b1	2025-11-13	Prasanna Ranatunga granted bail following bribery arrest	https://www.ft.lk/news/Prasanna-Ranatunga-granted-bail-following-bribery-arrest/56-784249	en	dailyftlk	1762992298.0
lk_news	2025-11-13-dailyftlk-aff0c391	dailyftlk-aff0c391	2025-11-13	SLPP MPs decline official vehicles, donate them to Health Ministry	https://www.ft.lk/news/SLPP-MPs-decline-official-vehicles-donate-them-to-Health-Ministry/56-784248	en	dailyftlk	1762992221.0
lk_news	2025-11-13-bbccomsinhala-bc9e600a	bbccomsinhala-bc9e600a	2025-11-13	පකිස්ථාන - ශ්‍රී ලංකා ක්‍රිකට් තරගාවලියේ අලුත් ම තත්ත්වය	https://www.bbc.com/sinhala/articles/c0l750e9prro	si	bbccomsinhala	1762984987.0
lk_news	2025-11-13-bbccomsinhala-dd90ec4a	bbccomsinhala-dd90ec4a	2025-11-13	ජනතාවට බරක් වී ඇති රාජ්‍ය ආයතන මෙන්න	https://www.bbc.com/sinhala/articles/cx2pv42eg32o	si	bbccomsinhala	1762977673.0
lk_news	2025-11-13-islandlk-5b2891c8	islandlk-5b2891c8	2025-11-13	The ‘Art’ of Diplomacy	http://island.lk/the-art-of-diplomacy/	en	islandlk	1762972680.0
lk_news	2025-11-13-islandlk-1bcbb85e	islandlk-1bcbb85e	2025-11-13	Beauty … with Ice Cubes	http://island.lk/beauty-with-ice-cubes/	en	islandlk	1762972560.0
lk_news	2025-11-12-islandlk-06581182	islandlk-06581182	2025-11-12	Tokyo Cement Group and Foundation of Goodness: A decade of nurturing cricketing dreams	http://island.lk/tokyo-cement-group-and-foundation-of-goodness-a-decade-of-nurturing-cricketing-dreams/	en	islandlk	1762971060.0
lk_news	2025-11-12-islandlk-7a254de0	islandlk-7a254de0	2025-11-12	Dutch Trails honored at Presidential Environment Awards 2025 for exceptional commitment to sustainability	http://island.lk/dutch-trails-honored-at-presidential-environment-awards-2025-for-exceptional-commitment-to-sustainability/	en	islandlk	1762970940.0
lk_news	2025-11-12-islandlk-dc83fbc4	islandlk-dc83fbc4	2025-11-12	Browns’ General Trading honoured at Construct Exhibition 2025	http://island.lk/browns-general-trading-honoured-at-construct-exhibition-2025/	en	islandlk	1762970880.0
lk_news	2025-11-12-islandlk-14df45f8	islandlk-14df45f8	2025-11-12	CSE surges past 23,500 mark as Fitch praises budget	http://island.lk/cse-surges-past-23500-mark-as-fitch-praises-budget/	en	islandlk	1762970820.0
lk_news	2025-11-12-islandlk-81683cc8	islandlk-81683cc8	2025-11-12	Mark and Comm presents strategic communications framework to Deputy Minister for Sri Lanka’s USD15b digital economy transformation	http://island.lk/mark-and-comm-presents-strategic-communications-framework-to-deputy-minister-for-sri-lankas-usd15b-digital-economy-transformation/	en	islandlk	1762970640.0
lk_news	2025-11-12-islandlk-afca166b	islandlk-afca166b	2025-11-12	JF Packaging IPO oversubscribed six times	http://island.lk/jf-packaging-ipo-oversubscribed-six-times/	en	islandlk	1762970520.0
lk_news	2025-11-12-adalk-d8443de1	adalk-d8443de1	2025-11-12	ඉදිරි දිනවලදි වැස්ස වැඩිවෙයි	https://www.ada.lk/breaking_news/ඉදිරි-දිනවලදි-වැස්ස-වැඩිවෙයි/11-419657	si	adalk	1762956974.0
lk_news	2025-11-12-lankadeepalk-0500cf31	lankadeepalk-0500cf31	2025-11-12	ගෙලිඔය අනතුරකින් කතක් මරුට:දෙකක් රෝහලට	https://www.lankadeepa.lk/latest_news/ගලඔය-අනතරකන-කතක-මරටදකක-රහලට/1-683066	si	lankadeepalk	1762953186.0
lk_news	2025-11-12-lankadeepalk-3cefec3c	lankadeepalk-3cefec3c	2025-11-12	ආණ්ඩුව ගොවියා අනාථ කරලා	https://www.lankadeepa.lk/latest_news/ආණඩව-ගවය-අනථ-කරල/1-683065	si	lankadeepalk	1762952784.0
lk_news	2025-11-12-lankadeepalk-b036e8ad	lankadeepalk-b036e8ad	2025-11-12	ලංකා ක්‍රිකට් කණ්ඩායමේ ආරක්ෂාව ගැන ජනපතිගෙන් ප්‍රතිඥාවක්	https://www.lankadeepa.lk/latest_news/ලක-කරකට-කණඩයම-ආරකෂව-ගන-ජනපතගන-පරතඥවක/1-683064	si	lankadeepalk	1762951822.0
lk_news	2025-11-12-lankadeepalk-66043dfe	lankadeepalk-66043dfe	2025-11-12	හුංගම දී ටිපර් - බස් ගැටේ	https://www.lankadeepa.lk/latest_news/හගම-ද-ටපර-බස-ගට/1-683063	si	lankadeepalk	1762951578.0
lk_news	2025-11-12-lankadeepalk-22f623d4	lankadeepalk-22f623d4	2025-11-12	හුංගම අනතුරින් ටිපර් රියැදුරු මරුට:35කට තුවාල	https://www.lankadeepa.lk/news/හගම-අනතරන-ටපර-රයදර-මරට35කට-තවල/101-683063	si	lankadeepalk	1762951578.0
lk_news	2025-11-12-virakesarilk-ea8a2740	virakesarilk-ea8a2740	2025-11-12	பயங்கரவாத தடைச் சட்டத்தை அமுல்படுத்திக்கொண்டு பொருளாதார ரீதியில் ஒருபோதும் முன்னேற்றமடைய முடியாது - செல்வம் அடைக்கலநாதன்	https://www.virakesari.lk/article/230201	ta	virakesarilk	1762950900.0
