doc_type	doc_id	num	date_str	description	url_metadata	lang	newspaper_id	time_ut
lk_news	2025-12-03-adalk-3cda9bd6	adalk-3cda9bd6	2025-12-03	තබ්බෝව පාලම පැය 72කටත් අඩු කාලයකින් හදයි	https://www.ada.lk/picture_story/තබ්බෝව-පාලම-පැය-72කටත්-අඩු-කාලයකින්-හදයි/10-420045	si	adalk	1764766835.0
lk_news	2025-12-03-virakesarilk-5cc1a500	virakesarilk-5cc1a500	2025-12-03	கவனம் ஈர்க்கும் கார்த்தியின் ' வா  வாத்தியார்' பட பாடல்கள்	https://www.virakesari.lk/article/232364	ta	virakesarilk	1764766500.0
lk_news	2025-12-03-lankadeepalk-e8c5ead0	lankadeepalk-e8c5ead0	2025-12-03	බංග්ලාදේශයත් ලංකාවට ආධාර කරයි	https://www.lankadeepa.lk/latest_news/බගලදශයත-ලකවට-ආධර-කරය/1-684616	si	lankadeepalk	1764766105.0
lk_news	2025-12-03-lankadeepalk-74d2a3b4	lankadeepalk-74d2a3b4	2025-12-03	පැලවත්තට පවරාගෙන ඇති බලය පාර්ලිමේන්තුවට දෙන්න	https://www.lankadeepa.lk/latest_news/පලවතතට-පවරගන-ඇත-බලය-පරලමනතවට-දනන/1-684614	si	lankadeepalk	1764765985.0
lk_news	2025-12-03-virakesarilk-800e79d2	virakesarilk-800e79d2	2025-12-03	சண்முக பாண்டியன் விஜயகாந்த் - சரத்குமார் கூட்டணி இணைந்து மிரட்டும் 'கொம்பு சீவி' படத்தின் புதிய பாடல் வெளியீடு	https://www.virakesari.lk/article/232363	ta	virakesarilk	1764765300.0
lk_news	2025-12-03-lankadeepalk-f5558a2d	lankadeepalk-f5558a2d	2025-12-03	නුවරඑළියට ළඟා විය හැකි පාරවල් මෙන්න	https://www.lankadeepa.lk/latest_news/නවරඑළයට-ළඟ-වය-හක-පරවල-මනන/1-684610	si	lankadeepalk	1764765178.0
lk_news	2025-12-03-lankadeepalk-ed6ea727	lankadeepalk-ed6ea727	2025-12-03	මහනුවරට සියයට 50කට වතුර යථා තත්වයට	https://www.lankadeepa.lk/latest_news/මහනවරට-සයයට-50කට-වතර-යථ-තතවයට/1-684609	si	lankadeepalk	1764764734.0
lk_news	2025-12-03-virakesarilk-e698d4b6	virakesarilk-e698d4b6	2025-12-03	கோலன் மலைப்பகுதி ஆக்கிரமிப்பு: இஸ்ரேலுக்கு எதிரான ஐ.நா தீர்மானத்துக்கு இந்தியா ஆதரவு	https://www.virakesari.lk/article/232362	ta	virakesarilk	1764764460.0
lk_news	2025-12-03-lankadeepalk-eb5456fd	lankadeepalk-eb5456fd	2025-12-03	උඩරට දුම්රිය මාර්ගය හදන්න මාස දෙකක්	https://www.lankadeepa.lk/news/උඩරට-දමරය-මරගය-හදනන-මස-දකක/101-684608	si	lankadeepalk	1764764069.0
lk_news	2025-12-03-lankadeepalk-d5c1bac3	lankadeepalk-d5c1bac3	2025-12-03	දහම් පාසල් විභාග කල් යයි	https://www.lankadeepa.lk/news/දහම-පසල-වභග-කල-යය/101-684607	si	lankadeepalk	1764763575.0
lk_news	2025-12-03-lankadeepalk-9fc373c4	lankadeepalk-9fc373c4	2025-12-03	කඳු පරීක්ෂාවට විශේෂඥ කණ්ඩායම්	https://www.lankadeepa.lk/news/කඳ-පරකෂවට-වශෂඥ-කණඩයම/101-684606	si	lankadeepalk	1764763177.0
lk_news	2025-12-03-virakesarilk-2757fd6b	virakesarilk-2757fd6b	2025-12-03	அனர்த்தத்தினால் பாதிக்கப்பட்ட குடும்பங்களுக்கு  ஐ.நா செயலாளர் நாயகம் அன்டோனியோ குட்டரெஸ் அனுதாபம்	https://www.virakesari.lk/article/232355	ta	virakesarilk	1764763140.0
lk_news	2025-12-03-virakesarilk-523b6afb	virakesarilk-523b6afb	2025-12-03	எச்.எஸ்.பி.சி. வங்கியின் சில்லறை வங்கி பிரிவை நேஷன்ஸ் ட்ரஸ்ட் வங்கி கையப்படுத்த இலங்கை மத்திய வங்கி அனுமதி	https://www.virakesari.lk/article/232360	ta	virakesarilk	1764763080.0
lk_news	2025-12-03-lankadeepalk-92c4ffef	lankadeepalk-92c4ffef	2025-12-03	ජල යෝජනා ක්‍රම 150 ක් ආපදාවට ලක්වෙයි	https://www.lankadeepa.lk/latest_news/ජල-යජන-කරම-150-ක-ආපදවට-ලකවය/1-684605	si	lankadeepalk	1764762980.0
lk_news	2025-12-03-virakesarilk-9c897b25	virakesarilk-9c897b25	2025-12-03	யூனியன் அஷ்யூரன்ஸ் தொழிற்துறையின் முன்னோடியான UA Premier Club கௌரவிப்புகளை 2025 முதலாம், இரண்டாம் காலாண்டுகளுக்காக முன்னெடுத்தது	https://www.virakesari.lk/article/232359	ta	virakesarilk	1764762900.0
lk_news	2025-12-03-virakesarilk-1f3cb2ba	virakesarilk-1f3cb2ba	2025-12-03	புதிய கல்வி மறுசீரமைப்பின் தமிழர் வரலாறு மற்றும் தமிழ் மன்னர்களின் வரலாறுகள் பாடப்பரப்பில் உள்ளடக்கப்படும் - பிரதமர்	https://www.virakesari.lk/article/232358	ta	virakesarilk	1764762900.0
lk_news	2025-12-03-virakesarilk-d4b28ecf	virakesarilk-d4b28ecf	2025-12-03	புதிய வரவு செலவு திட்டம் தேவை - நாமல் ராஜபக்ஷ்	https://www.virakesari.lk/article/232357	ta	virakesarilk	1764762780.0
lk_news	2025-12-03-virakesarilk-dcad76b3	virakesarilk-dcad76b3	2025-12-03	பேரிடரின் பின்னர் சிறுவர்களின் மனநலம்  கடுமையாக பாதிக்கப்பட்டுள்ளது  - மனநல வைத்திய நிபுணர் தர்ஷனி ஹெட்டியாராய்ச்சி	https://www.virakesari.lk/article/232356	ta	virakesarilk	1764762480.0
lk_news	2025-12-03-virakesarilk-34fff7b0	virakesarilk-34fff7b0	2025-12-03	அனர்த்த நிலைமை காரணமாக1,500 இ.போ.ச. பேருந்து சேவைகள் இரத்து	https://www.virakesari.lk/article/232350	ta	virakesarilk	1764762360.0
lk_news	2025-12-03-virakesarilk-65701f02	virakesarilk-65701f02	2025-12-03	புயல் எச்சரிக்கையை அரசு பின்பற்றவில்லை - தயாசிறி ஜயசேகர	https://www.virakesari.lk/article/232354	ta	virakesarilk	1764762240.0
lk_news	2025-12-03-virakesarilk-16c163dc	virakesarilk-16c163dc	2025-12-03	அடுத்த வருட வரவு செலவுத்திட்டம் அனர்த்த பாதிப்புகளை கருதவில்லை - சஜித் பிரேமதாச	https://www.virakesari.lk/article/232353	ta	virakesarilk	1764762240.0
