doc_type	doc_id	num	date_str	description	url_metadata	lang	newspaper_id	time_ut
lk_news	2025-12-05-virakesarilk-24da2725	virakesarilk-24da2725	2025-12-05	நாட்டின் ஏற்றுமதியில் புதுப்பிக்கப்பட்ட வளர்ச்சியைக் காட்டும் புதிய மூலோபாயங்களை முன்வைத்தது ஏற்றுமதி அபிவிருத்தி சபை	https://www.virakesari.lk/article/232511	ta	virakesarilk	1764920460.0
lk_news	2025-12-05-lankadeepalk-75462172	lankadeepalk-75462172	2025-12-05	ප්‍රධාන මාර්ග කිලෝමීටර් 247ක් කැඩිලා	https://www.lankadeepa.lk/latest_news/පරධන-මරග-කලමටර-247ක-කඩල/1-684709	si	lankadeepalk	1764920418.0
lk_news	2025-12-05-lankadeepalk-983e5c9d	lankadeepalk-983e5c9d	2025-12-05	අද මැතිසබේ විවාදය දිවා විවේකයත් නැතිව දිගටම	https://www.lankadeepa.lk/latest_news/අද-මතසබ-වවදය-දව-වවකයත-නතව-දගටම/1-684707	si	lankadeepalk	1764920086.0
lk_news	2025-12-05-virakesarilk-397426ed	virakesarilk-397426ed	2025-12-05	யாழ். பழைய பூங்கா உள்ளக விளையாட்டரங்கின் பணிகளை நிறுத்த நீதிமன்றம் கட்டளை	https://www.virakesari.lk/article/232505	ta	virakesarilk	1764919620.0
lk_news	2025-12-05-lankadeepalk-4de12ca6	lankadeepalk-4de12ca6	2025-12-05	ගම්පහ ප්‍රා.ස.අය වැය වැඩි ඡන්ද 21 කින් සම්මතයි	https://www.lankadeepa.lk/latest_news/ගමපහ-පර-ස-අය-වය-වඩ-ඡනද-21-කන-සමමතය/1-684703	si	lankadeepalk	1764919260.0
lk_news	2025-12-05-virakesarilk-9156974f	virakesarilk-9156974f	2025-12-05	வவுனியாவில் ஆறுமுகநாவலரின் 146வது குருபூஜை  தினம்	https://www.virakesari.lk/article/232506	ta	virakesarilk	1764918780.0
lk_news	2025-12-05-virakesarilk-6e8feb10	virakesarilk-6e8feb10	2025-12-05	இன்றைய நாணய மாற்று விகிதம்	https://www.virakesari.lk/article/232507	ta	virakesarilk	1764918540.0
lk_news	2025-12-05-lankadeepalk-5d276bd5	lankadeepalk-5d276bd5	2025-12-05	පරිපූරක ඇස්තමේන්තුවක් ගෙනාවොත් අපි සහාය දෙනවා	https://www.lankadeepa.lk/latest_news/පරපරක-ඇසතමනතවක-ගනවත-අප-සහය-දනව/1-684698	si	lankadeepalk	1764918486.0
lk_news	2025-12-05-lankadeepalk-f06537e9	lankadeepalk-f06537e9	2025-12-05	සජබ මන්ත්‍රී තාහිර් දිවුරුම් දෙයි	https://www.lankadeepa.lk/news/සජබ-මනතර-තහර-දවරම-දය/101-684689	si	lankadeepalk	1764917585.0
lk_news	2025-12-05-virakesarilk-40a32cab	virakesarilk-40a32cab	2025-12-05	வெள்ளப்பேரிடரால் உயிரிழந்தவர்களுக்கு வவுனியாவில் அஞ்சலி	https://www.virakesari.lk/article/232503	ta	virakesarilk	1764917580.0
lk_news	2025-12-05-virakesarilk-f63a2b9e	virakesarilk-f63a2b9e	2025-12-05	போலி ஆவணங்களைத் தயாரித்த நபராருவர் கைது	https://www.virakesari.lk/article/232498	ta	virakesarilk	1764917100.0
lk_news	2025-12-05-virakesarilk-c8b76d10	virakesarilk-c8b76d10	2025-12-05	அமெரிக்க விசா விண்ணப்பதாரர்களுக்கு ட்ரம்ப் அரசு விடுத்த முக்கிய அறிவிப்பு	https://www.virakesari.lk/article/232504	ta	virakesarilk	1764916800.0
lk_news	2025-12-05-adalk-9159bcbb	adalk-9159bcbb	2025-12-05	ශ්‍රී ලංකාව යළි ගොඩනැගීමට HUTCH වෙතින් ලක්ෂ 600ක්	https://www.ada.lk/business/ශ්‍රී-ලංකාව-යළි-ගොඩනැගීමට-HUTCH-වෙතින්-ලක්ෂ-600ක්/7-420071	si	adalk	1764916406.0
lk_news	2025-12-05-lankadeepalk-a8232bd7	lankadeepalk-a8232bd7	2025-12-05	ජනපති අද පාර්ලිමේන්තුවට	https://www.lankadeepa.lk/news/ජනපත-අද-පරලමනතවට/101-684684	si	lankadeepalk	1764915663.0
lk_news	2025-12-05-lankadeepalk-82c3f032	lankadeepalk-82c3f032	2025-12-05	නාය අනතුරකින් කිතුල්වල කන්ද පාමුල පිරිස් ඉවත් කරති	https://www.lankadeepa.lk/news/නය-අනතරකන-කතලවල-කනද-පමල-පරස-ඉවත-කරත/101-684683	si	lankadeepalk	1764915488.0
lk_news	2025-12-05-lankadeepalk-5f8b59b5	lankadeepalk-5f8b59b5	2025-12-05	දිට්වාට ඉඩදී ආණ්ඩුව කර ඇරියාද?	https://www.lankadeepa.lk/features/දටවට-ඉඩද-ආණඩව-කර-ඇරයද/2-684682	si	lankadeepalk	1764915297.0
lk_news	2025-12-05-virakesarilk-9903ea98	virakesarilk-9903ea98	2025-12-05	இ.போ.ச பஸ்களில் பயணிக்க ரயில் பருவக்கால சீட்டுக்களை பயன்படுத்தலாம்	https://www.virakesari.lk/article/232502	ta	virakesarilk	1764915240.0
lk_news	2025-12-05-lankadeepalk-c4f6bd17	lankadeepalk-c4f6bd17	2025-12-05	බිඳ වැටුණු කෘෂිකර්මය ගොඩගන්න ජනපති සාකච්ඡාවක් කැඳවයි	https://www.lankadeepa.lk/news/බඳ-වටණ-කෂකරමය-ගඩගනන-ජනපත-සකචඡවක-කඳවය/101-684681	si	lankadeepalk	1764915233.0
lk_news	2025-12-05-adalk-c4072409	adalk-c4072409	2025-12-05	අධි වේගී මගේ ගාස්තු යලිත් අයකෙරේ	https://www.ada.lk/breaking_news/අධි-වේගී-මගේ-ගාස්තු-යලිත්-අයකෙරේ/11-420070	si	adalk	1764915082.0
lk_news	2025-12-05-virakesarilk-e8598bea	virakesarilk-e8598bea	2025-12-05	முருங்கன் ஆதார வைத்தியசாலையின் ஏற்பாட்டில் விசேட நடமாடும் மருத்துவ முகாம் முன்னெடுப்பு	https://www.virakesari.lk/article/232501	ta	virakesarilk	1764914700.0
lk_news	2025-12-05-tamilmirrorlk-00fd050d	tamilmirrorlk-00fd050d	2025-12-05	தெல்தோட்டைக்கு ஹக்கீம்  கள விஜயம்	https://www.tamilmirror.lk/மலையகம்/தெல்தோட்டைக்கு-ஹக்கீம்-கள-விஜயம்/76-369101	ta	tamilmirrorlk	1764914472.0
lk_news	2025-12-05-virakesarilk-ad9fd899	virakesarilk-ad9fd899	2025-12-05	கும்புக்கனை சம்பவம் ; பஸ் சாரதி, நடத்துனர் பணி இடை நீக்கம்	https://www.virakesari.lk/article/232500	ta	virakesarilk	1764913440.0
lk_news	2025-12-05-virakesarilk-e143c768	virakesarilk-e143c768	2025-12-05	இலங்கைக்கு கனடாவின் 1 மில்லியன் கனேடிய டொலர் அவசர மனிதாபிமான உதவி – கனடிய தமிழர் பேரவை வரவேற்பு	https://www.virakesari.lk/article/232499	ta	virakesarilk	1764911880.0
lk_news	2025-12-05-adalk-e24304a6	adalk-e24304a6	2025-12-05	නව මන්ත්‍රීවරයෙක් දිවුරුම් දෙයි	https://www.ada.lk/breaking_news/නව-මන්ත්‍රීවරයෙක්-දිවුරුම්-දෙයි/11-420069	si	adalk	1764911737.0
lk_news	2025-12-05-lankadeepalk-66778b36	lankadeepalk-66778b36	2025-12-05	ප්‍රා.සභා රියැදුරා අසරණයන්ට ගෙනා  වතුර බෝතල් හොරකමේ	https://www.lankadeepa.lk/news/පර-සභ-රයදර-අසරණයනට-ගන-වතර-බතල-හරකම/101-684680	si	lankadeepalk	1764911601.0
lk_news	2025-12-05-virakesarilk-c09ce0e1	virakesarilk-c09ce0e1	2025-12-05	எம்மீது ஒரு பலத்த அடி விழுந்திருக்கிறது ;  ஆயினும் நாம் வீழ்ந்துவிடவில்லை -  ஹரிணி அமரசூரிய	https://www.virakesari.lk/article/232497	ta	virakesarilk	1764911220.0
lk_news	2025-12-05-tamilmirrorlk-8196b36d	tamilmirrorlk-8196b36d	2025-12-05	மொஹம்மட் தாஹிர் எம்.பியாக சத்தியப்பிரமாணம்	https://www.tamilmirror.lk/செய்திகள்/மொஹம்மட்-தாஹிர்-எம்-பியாக-சத்தியப்பிரமாணம்/175-369100	ta	tamilmirrorlk	1764911213.0
lk_news	2025-12-05-virakesarilk-a1f074b3	virakesarilk-a1f074b3	2025-12-05	பாராளுமன்ற உறுப்பினராக மொஹமட் தாஹிர் பதவியேற்பு!	https://www.virakesari.lk/article/232493	ta	virakesarilk	1764910800.0
lk_news	2025-12-05-virakesarilk-1279ad88	virakesarilk-1279ad88	2025-12-05	குடியுரிமைக்கு விண்ணப்பிக்க 19 நாடுகளுக்கு அமெரிக்கா தடை	https://www.virakesari.lk/article/232494	ta	virakesarilk	1764910440.0
lk_news	2025-12-05-virakesarilk-98143b70	virakesarilk-98143b70	2025-12-05	இலங்கையில் வெள்ளப் பேரழிவு : அவசர நிவாரணத்திற்காக  கனடா 1 மில்லியன் கனடிய டொலர் உதவி அறிவிப்பு	https://www.virakesari.lk/article/232496	ta	virakesarilk	1764910320.0
lk_news	2025-12-05-virakesarilk-ee4e1532	virakesarilk-ee4e1532	2025-12-05	டித்வா ' சூறாவளியும் இந்திய, இலங்கை உறவுகளும் ; அயலகத்தில் இராஜதந்திரத்துக்கான வழிகாட்டி	https://www.virakesari.lk/article/232495	ta	virakesarilk	1764909960.0
lk_news	2025-12-05-virakesarilk-c0046482	virakesarilk-c0046482	2025-12-05	நெடுந்தீவு கடற்பரப்பில் பெருமளவிலான வெளிநாட்டு சிகரெட்டுகள் கைப்பற்றல்	https://www.virakesari.lk/article/232492	ta	virakesarilk	1764908760.0
lk_news	2025-12-05-virakesarilk-5c282c61	virakesarilk-5c282c61	2025-12-05	நாடு முழுவதும் மனிதாபிமான உதவி , பேரிடர் நிவாரணங்களை வழங்குவதில் கடற்படையின் தொடர்ச்சியான ஆதரவு	https://www.virakesari.lk/article/232491	ta	virakesarilk	1764908760.0
lk_news	2025-12-05-lankadeepalk-056b99d8	lankadeepalk-056b99d8	2025-12-05	වැලිගම සභාපති ඝාතනයට ධීවරයෙක් සංචාරක මඟපෙන්වන්නෙක් මාට්ටු	https://www.lankadeepa.lk/latest_news/වලගම-සභපත-ඝතනයට-ධවරයක-සචරක-මඟපනවනනක-මටට/1-684679	si	lankadeepalk	1764908135.0
lk_news	2025-12-05-adalk-cbde3075	adalk-cbde3075	2025-12-05	ආපදා තත්වයේදීත් දිගටම මවුකිරි දෙන්න, පිටිකිරි දෙන්න මව්වරු පෙළඹවන්න එපා	https://www.ada.lk/breaking_news/ආපදා-තත්වයේදීත්-දිගටම-මවුකිරි-දෙන්න--පිටිකිරි-දෙන්න-මව්වරු-පෙළඹවන්න-එපා/11-420068	si	adalk	1764907632.0
lk_news	2025-12-05-virakesarilk-279698b2	virakesarilk-279698b2	2025-12-05	ரஷ்ய ஜனாதிபதி புட்டினுக்கு பகவத் கீதையை பரிசளித்தார் இந்திய பிரதமர் மோடி	https://www.virakesari.lk/article/232490	ta	virakesarilk	1764906960.0
lk_news	2025-12-05-adalk-af6c4f22	adalk-af6c4f22	2025-12-05	විදේශ ආධාර නිසි ලෙස කළමනාකරණය කළොත් කෙටි කාලයකින් රට ගොඩ	https://www.ada.lk/breaking_news/විදේශ-ආධාර-නිසි-ලෙස-කළමනාකරණය-කළොත්-කෙටි-කාලයකින්-රට-ගොඩ/11-420067	si	adalk	1764905392.0
lk_news	2025-12-05-virakesarilk-8026c6de	virakesarilk-8026c6de	2025-12-05	அளுத்கம - மொரகல்ல பகுதியில் விபத்து: ஒருவர் உயிரிழப்பு!	https://www.virakesari.lk/article/232489	ta	virakesarilk	1764905280.0
lk_news	2025-12-05-virakesarilk-f855dd3f	virakesarilk-f855dd3f	2025-12-05	கேகாலையில் வீதி விபத்து: ஒருவர் உயிரிழப்பு!	https://www.virakesari.lk/article/232488	ta	virakesarilk	1764904860.0
lk_news	2025-12-05-virakesarilk-35a201a8	virakesarilk-35a201a8	2025-12-05	சட்டவிரோத மதுபான உற்பத்தி நிலையம் முற்றுகை: ஒருவர் கைது!	https://www.virakesari.lk/article/232487	ta	virakesarilk	1764904740.0
lk_news	2025-12-05-virakesarilk-04d275a2	virakesarilk-04d275a2	2025-12-05	சட்டவிரோத மதுபானத்துடன் இளைஞர் ஒருவர் கைது!	https://www.virakesari.lk/article/232486	ta	virakesarilk	1764904740.0
lk_news	2025-12-05-virakesarilk-a30851f5	virakesarilk-a30851f5	2025-12-05	சட்டவிரோத சிகரெட்டுக்களுடன் சந்தேகநபர் ஒருவர் கைது!	https://www.virakesari.lk/article/232485	ta	virakesarilk	1764904680.0
lk_news	2025-12-05-lankadeepalk-7c4c6ca9	lankadeepalk-7c4c6ca9	2025-12-05	අයවැය අවසන් ඡන්දය අද	https://www.lankadeepa.lk/news/අයවය-අවසන-ඡනදය-අද/101-684678	si	lankadeepalk	1764903508.0
lk_news	2025-12-05-lankadeepalk-7a6266b2	lankadeepalk-7a6266b2	2025-12-05	කොළඹ ඉන්න: පක්ෂ නායකයන්ගෙන් මන්ත්‍රීලාට දැනුම් දීමක්	https://www.lankadeepa.lk/latest_news/කළඹ-ඉනන-පකෂ-නයකයනගන-මනතරලට-දනම-දමක/1-684678	si	lankadeepalk	1764903508.0
lk_news	2025-12-05-tamilmirrorlk-d60070f2	tamilmirrorlk-d60070f2	2025-12-05	இன்று இடியுடன் கூடிய மழை	https://www.tamilmirror.lk/செய்திகள்/இன்று-இடியுடன்-கூடிய-மழை/175-369099	ta	tamilmirrorlk	1764903371.0
lk_news	2025-12-05-adalk-5dd92317	adalk-5dd92317	2025-12-05	ඊසාන දිග මෝසම ස්ථාපිත වෙයි	https://www.ada.lk/breaking_news/ඊසාන-දිග-මෝසම-ස්ථාපිත-වෙයි/11-420065	si	adalk	1764903240.0
lk_news	2025-12-05-tamilmirrorlk-859221a3	tamilmirrorlk-859221a3	2025-12-05	தையிட்டியில் பதற்றம்	https://www.tamilmirror.lk/செய்திகள்/தையிட்டியில்-பதற்றம்/175-369098	ta	tamilmirrorlk	1764902978.0
lk_news	2025-12-05-lankadeepalk-23d029b9	lankadeepalk-23d029b9	2025-12-05	රට ගොඩනඟන්න මිලියන 697ක් ලැබිලා	https://www.lankadeepa.lk/latest_news/රට-ගඩනඟනන-මලයන-697ක-ලබල/1-684677	si	lankadeepalk	1764900986.0
lk_news	2025-12-05-lankadeepalk-7fd0e327	lankadeepalk-7fd0e327	2025-12-05	ඊසාන දිග මෝසම සක්‍රියයි:පළාත් රැසකට අදත් වැස්ස	https://www.lankadeepa.lk/latest_news/ඊසන-දග-මසම-සකරයයපළත-රසකට-අදත-වසස/1-684676	si	lankadeepalk	1764900336.0
lk_news	2025-12-05-lankadeepalk-50df0726	lankadeepalk-50df0726	2025-12-05	ආපදාවෙන් ට්‍රාන්ස්ෆෝමර් 16,771ක් කැඩිලා	https://www.lankadeepa.lk/news/ආපදවන-ටරනසෆමර-16-771ක-කඩල/101-684675	si	lankadeepalk	1764899886.0
lk_news	2025-12-05-virakesarilk-0223c1c3	virakesarilk-0223c1c3	2025-12-05	2026 ஆம் ஆண்டுக்கான வரவு - செலவுத் திட்டம் மீதான மூன்றாவது வாசிப்பு இன்று : வாக்கெடுப்பின்றி ஏகமனதாக நிறைவேற்றப்படும் என எதிர்பார்ப்பு !	https://www.virakesari.lk/article/232482	ta	virakesarilk	1764898800.0
lk_news	2025-12-05-dailyftlk-2c1f883a	dailyftlk-2c1f883a	2025-12-05	Ranil rips into Govt. response to weather crisis	https://www.ft.lk/news/Ranil-rips-into-Govt-response-to-weather-crisis/56-785276	en	dailyftlk	1764896889.0
lk_news	2025-12-05-dailyftlk-40d2ba3d	dailyftlk-40d2ba3d	2025-12-05	Australia extends additional  $ 2.5 m support to cyclone-hit SL	https://www.ft.lk/news/Australia-extends-additional-2-5-m-support-to-cyclone-hit-SL/56-785275	en	dailyftlk	1764896813.0
lk_news	2025-12-05-dailyftlk-fda44b37	dailyftlk-fda44b37	2025-12-05	Pakistani PM calls President Dissanayake, offers support to rebuild	https://www.ft.lk/news/Pakistani-PM-calls-President-Dissanayake-offers-support-to-rebuild/56-785274	en	dailyftlk	1764896728.0
lk_news	2025-12-05-dailyftlk-d6d69263	dailyftlk-d6d69263	2025-12-05	Maldives President pledges maximum support in phone call with AKD	https://www.ft.lk/news/Maldives-President-pledges-maximum-support-in-phone-call-with-AKD/56-785273	en	dailyftlk	1764896557.0
lk_news	2025-12-05-virakesarilk-298f5df3	virakesarilk-298f5df3	2025-12-05	வடக்கு , கிழக்கு, வடமத்திய, ஊவா மாகாணங்களில் மழைக்கான சாத்தியம் !	https://www.virakesari.lk/article/232484	ta	virakesarilk	1764896520.0
lk_news	2025-12-05-dailyftlk-f259870e	dailyftlk-f259870e	2025-12-05	Namal pledges salary, allowances to assist children	https://www.ft.lk/news/Namal-pledges-salary-allowances-to-assist-children/56-785272	en	dailyftlk	1764896484.0
lk_news	2025-12-05-dailyftlk-cd30df3a	dailyftlk-cd30df3a	2025-12-05	Strong quarter underscores JKH’s strength and strategic momentum	https://www.ft.lk/business/Strong-quarter-underscores-JKH-s-strength-and-strategic-momentum/34-785271	en	dailyftlk	1764896032.0
lk_news	2025-12-05-dailyftlk-98f5af1b	dailyftlk-98f5af1b	2025-12-05	UAE sends sixth aircraft with more aid to Sri Lanka	https://www.ft.lk/news/UAE-sends-sixth-aircraft-with-more-aid-to-Sri-Lanka/56-785270	en	dailyftlk	1764895608.0
lk_news	2025-12-05-dailyftlk-c54390ae	dailyftlk-c54390ae	2025-12-05	China stands with Sri Lanka in the wake of Cyclone Ditwah	https://www.ft.lk/news/China-stands-with-Sri-Lanka-in-the-wake-of-Cyclone-Ditwah/56-785269	en	dailyftlk	1764895546.0
lk_news	2025-12-05-dailyftlk-c2f968ff	dailyftlk-c2f968ff	2025-12-05	India delivers more disaster relief, medical team arrives	https://www.ft.lk/news/India-delivers-more-disaster-relief-medical-team-arrives/56-785268	en	dailyftlk	1764895467.0
lk_news	2025-12-05-dailyftlk-6c56ba15	dailyftlk-6c56ba15	2025-12-05	India sends Bailey bridge units and team to aid recovery efforts	https://www.ft.lk/news/India-sends-Bailey-bridge-units-and-team-to-aid-recovery-efforts/56-785267	en	dailyftlk	1764895370.0
lk_news	2025-12-05-dailyftlk-bd47b6e3	dailyftlk-bd47b6e3	2025-12-05	UNFPA in life-saving response to humanitarian crisis triggered by Cyclone Ditwah	https://www.ft.lk/news/UNFPA-in-life-saving-response-to-humanitarian-crisis-triggered-by-Cyclone-Ditwah/56-785266	en	dailyftlk	1764895297.0
lk_news	2025-12-05-dailyftlk-04808e3b	dailyftlk-04808e3b	2025-12-05	Japanese JDR medical team arrives in Sri Lanka	https://www.ft.lk/news/Japanese-JDR-medical-team-arrives-in-Sri-Lanka/56-785265	en	dailyftlk	1764895138.0
lk_news	2025-12-05-dailyftlk-a7b21edc	dailyftlk-a7b21edc	2025-12-05	Pakistan sends fresh relief cargo and elite rescue team	https://www.ft.lk/news/Pakistan-sends-fresh-relief-cargo-and-elite-rescue-team/56-785264	en	dailyftlk	1764895057.0
lk_news	2025-12-05-dailyftlk-cb4fbe90	dailyftlk-cb4fbe90	2025-12-05	JICA donates essential relief supplies	https://www.ft.lk/news/JICA-donates-essential-relief-supplies/56-785263	en	dailyftlk	1764894983.0
lk_news	2025-12-05-dailyftlk-962363c8	dailyftlk-962363c8	2025-12-05	Over 19,000 overseas workers contribute to relief fund	https://www.ft.lk/business/Over-19-000-overseas-workers-contribute-to-relief-fund/34-785262	en	dailyftlk	1764894832.0
lk_news	2025-12-05-dailyftlk-8a5bbfd9	dailyftlk-8a5bbfd9	2025-12-05	VFS Global donates Rs. 7.5 m for Sri Lanka’s relief work	https://www.ft.lk/business/VFS-Global-donates-Rs-7-5-m-for-Sri-Lanka-s-relief-work/34-785261	en	dailyftlk	1764894742.0
lk_news	2025-12-05-dailyftlk-feb20b55	dailyftlk-feb20b55	2025-12-05	CH17 to allocate 10,000 privilege cards to volunteers to mark Ditwah relief and aid	https://www.ft.lk/business/CH17-to-allocate-10-000-privilege-cards-to-volunteers-to-mark-Ditwah-relief-and-aid/34-785260	en	dailyftlk	1764894716.0
lk_news	2025-12-05-dailyftlk-241fb565	dailyftlk-241fb565	2025-12-05	Hutch contributes Rs. 60 m to  support cyclone-affected communities	https://www.ft.lk/business/Hutch-contributes-Rs-60-m-to-support-cyclone-affected-communities/34-785259	en	dailyftlk	1764894671.0
lk_news	2025-12-05-dailyftlk-dd101a30	dailyftlk-dd101a30	2025-12-05	OPA members, associations unite to support those affected by Cyclone Ditwah	https://www.ft.lk/business/OPA-members-associations-unite-to-support-those-affected-by-Cyclone-Ditwah/34-785258	en	dailyftlk	1764894597.0
lk_news	2025-12-05-dailyftlk-6b121c92	dailyftlk-6b121c92	2025-12-05	CHEC Port City Colombo deploys disaster-response fleet to restore A5 corridor	https://www.ft.lk/business/CHEC-Port-City-Colombo-deploys-disaster-response-fleet-to-restore-A5-corridor/34-785257	en	dailyftlk	1764894520.0
lk_news	2025-12-05-dailyftlk-a4f509b0	dailyftlk-a4f509b0	2025-12-05	Sri Lanka Overseas Chinese Association donates to cyclone relief	https://www.ft.lk/business/Sri-Lanka-Overseas-Chinese-Association-donates-to-cyclone-relief/34-785256	en	dailyftlk	1764894434.0
lk_news	2025-12-05-dailyftlk-9d7f363c	dailyftlk-9d7f363c	2025-12-05	Hatch’s first “GRIT Accelerator” concludes, supporting Female entrepreneurs in North	https://www.ft.lk/business/Hatch-s-first-GRIT-Accelerator-concludes-supporting-Female-entrepreneurs-in-North/34-785249	en	dailyftlk	1764893809.0
lk_news	2025-12-05-dailyftlk-9f3f05d0	dailyftlk-9f3f05d0	2025-12-05	ComBank’s Innovation Challenge brings digital customer experience to fore	https://www.ft.lk/business/ComBank-s-Innovation-Challenge-brings-digital-customer-experience-to-fore/34-785248	en	dailyftlk	1764893550.0
lk_news	2025-12-05-dailyftlk-d95576ce	dailyftlk-d95576ce	2025-12-05	Digital Wings takes off in Sri Lanka: Empowering students through technology	https://www.ft.lk/business/Digital-Wings-takes-off-in-Sri-Lanka-Empowering-students-through-technology/34-785247	en	dailyftlk	1764893499.0
lk_news	2025-12-05-dailyftlk-b2655f2c	dailyftlk-b2655f2c	2025-12-05	Secured Transactions Registry: Role of financial institutions	https://www.ft.lk/columns/Secured-Transactions-Registry-Role-of-financial-institutions/4-785246	en	dailyftlk	1764892727.0
lk_news	2025-12-05-bbccomsinhala-301def39	bbccomsinhala-301def39	2025-12-05	දිට්වා සුළි කුණාටුව: කාලගුණ විද්‍යා දෙපාර්තමේන්තුව නිසි වගකීම් ඉටු කළේ නැද් ද?	https://www.bbc.com/sinhala/articles/cvgr908ngg9o	si	bbccomsinhala	1764891422.0
lk_news	2025-12-05-dailyftlk-49dfbfaa	dailyftlk-49dfbfaa	2025-12-05	Humanities, Arts and Social Sciences under pressure	https://www.ft.lk/news/Humanities-Arts-and-Social-Sciences-under-pressure/56-785245	en	dailyftlk	1764885917.0
lk_news	2025-12-05-dailyftlk-cfe00b2b	dailyftlk-cfe00b2b	2025-12-05	National campaign begins to combat gender-based violence in Sri Lanka	https://www.ft.lk/news/National-campaign-begins-to-combat-gender-based-violence-in-Sri-Lanka/56-785244	en	dailyftlk	1764885587.0
lk_news	2025-12-05-dailyftlk-480bf823	dailyftlk-480bf823	2025-12-05	Rebuilding Sri Lanka beyond the catastrophe	https://www.ft.lk/columns/Rebuilding-Sri-Lanka-beyond-the-catastrophe/4-785243	en	dailyftlk	1764884306.0
lk_news	2025-12-05-dailyftlk-0ed10ca6	dailyftlk-0ed10ca6	2025-12-05	The usual suspects  crop up in post-disaster Sri Lanka	https://www.ft.lk/columns/The-usual-suspects-crop-up-in-post-disaster-Sri-Lanka/4-785242	en	dailyftlk	1764883798.0
lk_news	2025-12-05-tamilmirrorlk-32405589	tamilmirrorlk-32405589	2025-12-05	கைத்தொழில் அமைச்சு அதிகாரிகளுடன் ஜனாதிபதி சந்திப்பு	https://www.tamilmirror.lk/செய்திகள்/கைத்தொழில்-அமைச்சு-அதிகாரிகளுடன்-ஜனாதிபதி-சந்திப்பு/175-369097	ta	tamilmirrorlk	1764882028.0
