doc_type	doc_id	num	date_str	description	url_metadata	lang	newspaper_id	time_ut
lk_news	2025-10-19-islandlk-5eff02aa	islandlk-5eff02aa	2025-10-19	Sri Lankan flag flies high at Asia eCommerce Awards 2025	http://island.lk/sri-lankan-flag-flies-high-at-asia-ecommerce-awards-2025/	en	islandlk	1760875980.0
lk_news	2025-10-19-islandlk-351d88d5	islandlk-351d88d5	2025-10-19	Casons Rent a Car introduces Sri Lanka’s first fleet of eco-friendly vehicles	http://island.lk/casons-rent-a-car-introduces-sri-lankas-first-fleet-of-eco-friendly-vehicles/	en	islandlk	1760875980.0
lk_news	2025-10-19-islandlk-0709b1ea	islandlk-0709b1ea	2025-10-19	Sun Siyam Pasikudah and Chairman Siyam honoured at Global Hospitality Awards	http://island.lk/sun-siyam-pasikudah-and-chairman-siyam-honoured-at-global-hospitality-awards/	en	islandlk	1760875980.0
lk_news	2025-10-19-lankadeepalk-b5de6339	lankadeepalk-b5de6339	2025-10-19	ලූවර්  කෞතුකාගාරයට හොරු පනිති	https://www.lankadeepa.lk/latest_news/ලවර-කතකගරයට-හර-පනත/1-681633	si	lankadeepalk	1760875221.0
lk_news	2025-10-19-adalk-dd43f159	adalk-dd43f159	2025-10-19	ඇෆ්ගනිස්ථානය වෙනුවට සිම්බාබ්වේ එයි	https://www.ada.lk/breaking_news/ඇෆ්ගනිස්ථානය-වෙනුවට-සිම්බාබ්වේ-එයි/11-419196	si	adalk	1760874819.0
lk_news	2025-10-19-virakesarilk-7a7fa273	virakesarilk-7a7fa273	2025-10-19	நுவரெலியாவில் பேஸ்புக் களியாட்ட நிகழ்வு ; போதைப்பொருளுடன் 30 பேர் கைது	https://www.virakesari.lk/article/228156	ta	virakesarilk	1760874660.0
lk_news	2025-10-19-virakesarilk-ab781580	virakesarilk-ab781580	2025-10-19	அட்டனில் கோலாகலமாக நடைபெற்ற தேசிய தீபாவளி உற்சவம்	https://www.virakesari.lk/article/228160	ta	virakesarilk	1760874420.0
lk_news	2025-10-19-lankadeepalk-aa37e756	lankadeepalk-aa37e756	2025-10-19	විල්පත්තු ගිය පිරිසක් ජලයට කොටුවෙලා	https://www.lankadeepa.lk/latest_news/වලපතත-ගය-පරසක-ජලයට-කටවල/1-681632	si	lankadeepalk	1760874063.0
lk_news	2025-10-19-adalk-a901ed2a	adalk-a901ed2a	2025-10-19	උඩරට දුම්රිය ධාවනයට බාධා	https://www.ada.lk/breaking_news/උඩරට-දුම්රිය-ධාවනයට-බාධා/11-419195	si	adalk	1760874026.0
lk_news	2025-10-19-virakesarilk-edbc33ef	virakesarilk-edbc33ef	2025-10-19	மதுவரி உத்தியோகத்தர்களில் 20 - 30 சதவீதமானோர் மோசடியாளர்கள் ; பழைய பழக்கத்தை திருத்திக்கொள்ளுங்கள் : மதுவரித் திணைக்கள ஆணையாளர் நாயகம் அறிவுறுத்தல்	https://www.virakesari.lk/article/228154	ta	virakesarilk	1760874000.0
lk_news	2025-10-19-virakesarilk-f8b69856	virakesarilk-f8b69856	2025-10-19	நாட்டின் பெண்கள் மற்றும் சிறுவர்கள் துறையில் நாம் இன்னும் தீவிரமாக செயல்பட வேண்டும் : அமைச்சர் சரோஜா சாவித்ரி போல்ராஜ்	https://www.virakesari.lk/article/228158	ta	virakesarilk	1760872500.0
lk_news	2025-10-19-virakesarilk-c5060f9b	virakesarilk-c5060f9b	2025-10-19	போதைப்பொருள், பாதாள குழுக்களுடன் தொடர்பில்லையென பொலிஸ் சான்றிதழ் சமர்ப்பிப்பவர்களுக்கு மாத்திரம் வேட்புமனு வழங்கப்படும் - ஸ்ரீ லங்கா பொதுஜன பெரமுன	https://www.virakesari.lk/article/228146	ta	virakesarilk	1760870940.0
lk_news	2025-10-19-virakesarilk-42131bc6	virakesarilk-42131bc6	2025-10-19	செப்டெம்பர் வரை இலங்கை தொடர்பில் ஐ.நாவிடம் மொத்தமாக 112,348 ஆதாரங்கள்	https://www.virakesari.lk/article/228152	ta	virakesarilk	1760870880.0
lk_news	2025-10-19-tamilmirrorlk-b495600c	tamilmirrorlk-b495600c	2025-10-19	கஞ்சா பயிர்ச்செய்கையில் ஈடுபட்ட அந்நியர் கைது	https://www.tamilmirror.lk/செய்திகள்/கஞ்சா-பயிர்ச்செய்கையில்-ஈடுபட்ட-அந்நியர்-கைது/175-366507	ta	tamilmirrorlk	1760870872.0
lk_news	2025-10-19-virakesarilk-10553399	virakesarilk-10553399	2025-10-19	‘குஷ்’ கஞ்சா பயிரிட்ட வெளிநாட்டவர் கைது	https://www.virakesari.lk/article/228155	ta	virakesarilk	1760870820.0
lk_news	2025-10-19-tamilmirrorlk-7fcc9f95	tamilmirrorlk-7fcc9f95	2025-10-19	ஜம்போரிக்கு வந்த 20 மாணவர்கள் விபத்தில் சிக்கினர்	https://www.tamilmirror.lk/செய்திகள்/ஜம்போரிக்கு-வந்த-20-மாணவர்கள்-விபத்தில்-சிக்கினர்/175-366505	ta	tamilmirrorlk	1760870453.0
lk_news	2025-10-19-virakesarilk-ecf75df8	virakesarilk-ecf75df8	2025-10-19	சோமரத்ன ராஜபக்ஷவின் சத்தியக்கடதாசி ஆதாரங்களைத் திரட்டும் அதிகாரிகளிடம் கையளிப்பு	https://www.virakesari.lk/article/228151	ta	virakesarilk	1760869860.0
lk_news	2025-10-19-virakesarilk-fc980798	virakesarilk-fc980798	2025-10-19	ஆசிய அபிவிருத்தி வங்கியிடமிருந்து 100 மில்லியன் டொலர் கடன் நிதி	https://www.virakesari.lk/article/228148	ta	virakesarilk	1760869740.0
lk_news	2025-10-19-virakesarilk-de14fe79	virakesarilk-de14fe79	2025-10-19	13வது திருத்தம் குறித்து பேசுவதை ஒப்பந்தத்தில் இருந்து விலகுவதாகவே பார்க்கிறோம் : கஜேந்திரகுமார் பொன்னம்பலம் தெரிவிப்பு	https://www.virakesari.lk/article/228149	ta	virakesarilk	1760869740.0
lk_news	2025-10-19-virakesarilk-c68424c2	virakesarilk-c68424c2	2025-10-19	ராகமவில் பஸ் விபத்து ;  09 சிறுவர்கள் உட்பட 12 பேர் காயம்	https://www.virakesari.lk/article/228153	ta	virakesarilk	1760869680.0
lk_news	2025-10-19-tamilmirrorlk-39567932	tamilmirrorlk-39567932	2025-10-19	செவ்வந்தியின் தம்பிக்கு பிணை	https://www.tamilmirror.lk/செய்திகள்/செவ்வந்தியின்-தம்பிக்கு-பிணை/175-366504	ta	tamilmirrorlk	1760869562.0
lk_news	2025-10-19-lankadeepalk-991a5434	lankadeepalk-991a5434	2025-10-19	උසාවිවල නඩු බඩු ‘සුද්දයක්’	https://www.lankadeepa.lk/latest_news/උසවවල-නඩ-බඩ-සදදයක/1-681631	si	lankadeepalk	1760867905.0
