doc_type	doc_id	num	date_str	description	url_metadata	lang	newspaper_id	time_ut
lk_news	2025-12-05-virakesarilk-bcb4a6da	virakesarilk-bcb4a6da	2025-12-05	இயற்கை அனர்த்த பாதிப்புகளின் போது அந்த பாதிப்புகளை குறைப்பதுவே அரசாங்கத்தின் பொறுப்பாகும் - கஜேந்திரகுமார் பொன்னம்பலம்	https://www.virakesari.lk/article/232538	ta	virakesarilk	1764935100.0
lk_news	2025-12-05-virakesarilk-e3a0adf4	virakesarilk-e3a0adf4	2025-12-05	அவசரகால சட்டத்துக்குரிய ஒழுங்குவிதிகள் பாராளுமன்றத்துக்கு சமர்ப்பிக்கப்பட்டுள்ளது ; இந்த ஒழுங்குவிதிகள் இன்று நிறைவேற்றப்படும் - விஜித்த  ஹேரத்	https://www.virakesari.lk/article/232537	ta	virakesarilk	1764935040.0
lk_news	2025-12-05-virakesarilk-15adc37f	virakesarilk-15adc37f	2025-12-05	நாட்டின் பொருளாதாரத்தை வளர்த்தெடுத்தால் மட்டுமே நாங்கள் இந்த நாட்டில் வாழ முடியும் ; வே.இராதாகிருஷ்ணன்	https://www.virakesari.lk/article/232540	ta	virakesarilk	1764935040.0
lk_news	2025-12-05-virakesarilk-bf3c1d40	virakesarilk-bf3c1d40	2025-12-05	மக்களின் வாழும் உரிமையை உறுதிப்படுத்தத் தவறியமைக்காக ஜனாதிபதி, அமைச்சரவையை ஐதாண்டு சிறை தண்டனைக்குட்படுத்த முடியும் - பிவிதுரு ஹெல உருமயவின் தலைவர் உதய கம்மன்பில	https://www.virakesari.lk/article/232535	ta	virakesarilk	1764934980.0
lk_news	2025-12-05-lankadeepalk-1de78b2c	lankadeepalk-1de78b2c	2025-12-05	“රට නැවත ගොඩනැගීමට ජාතික සැලැස්මක් ඕනෑ“	https://www.lankadeepa.lk/news/රට-නවත-ගඩනගමට-ජතක-සලසමක-ඕන/101-684742	si	lankadeepalk	1764934401.0
lk_news	2025-12-05-lankadeepalk-bd8bf0df	lankadeepalk-bd8bf0df	2025-12-05	මාලදිවයිනෙන් ටූනා මාළු පෙට්ටි 25,000ක පරිත්‍යාගයක්	https://www.lankadeepa.lk/news/මලදවයනන-ටන-මළ-පටට-25-000ක-පරතයගයක/101-684741	si	lankadeepalk	1764934031.0
lk_news	2025-12-05-lankadeepalk-61b103af	lankadeepalk-61b103af	2025-12-05	ජීවිත 14ක් බිලිගත් නාවලපිටියේ නාය යාම | ගුවන් දර්ශන	https://www.lankadeepa.lk/latest_news/ජවත-14ක-බලගත-නවලපටය-නය-යම-ගවන-දරශන/1-684740	si	lankadeepalk	1764933937.0
lk_news	2025-12-05-virakesarilk-3f032ea2	virakesarilk-3f032ea2	2025-12-05	இலங்கையின் மீட்சிக்கு உதவக்கூடிய மேலதிக வழிமுறைகள் குறித்து ஆராய்கிறோம் - நாணய நிதிய தொடர்பாடல் பிரிவின் பணிப்பாளர் ஜுலி கொஸாக் அறிவிப்பு	https://www.virakesari.lk/article/232533	ta	virakesarilk	1764933600.0
lk_news	2025-12-05-virakesarilk-f9566170	virakesarilk-f9566170	2025-12-05	அனர்த்தத்தினால் பாதிக்கப்பட்டவர்களுக்காக யாழ்ப்பாணத்திற்காக 36 கோடி ரூபா ஒதுக்கப்பட்டுள்ளது ; அந்தப் பணம் தேவையில்லை - அர்ச்சுனா இராமநாதன்	https://www.virakesari.lk/article/232531	ta	virakesarilk	1764931980.0
lk_news	2025-12-05-virakesarilk-c2337de8	virakesarilk-c2337de8	2025-12-05	4 மாவட்டங்களுக்கு விடுக்கப்பட்டுள்ள மண் சரிவு அபாய எச்சரிக்கை நீடிப்பு - தேசிய கட்டட ஆராய்ச்சி நிறுவனம்	https://www.virakesari.lk/article/232530	ta	virakesarilk	1764931200.0
lk_news	2025-12-05-virakesarilk-23fffc63	virakesarilk-23fffc63	2025-12-05	ஜனாதிபதியின் செயலாளரை சந்தித்தனர் சிங்கப்பூர், மலேசியாவை சேர்ந்த தேரர்கள் அடங்கிய குழுவினர்	https://www.virakesari.lk/article/232528	ta	virakesarilk	1764930540.0
lk_news	2025-12-05-virakesarilk-df9ec7bd	virakesarilk-df9ec7bd	2025-12-05	புலிபாய்ந்த கல் சுற்றுலா ஒதுக்கிடத்தில் பெரும்பான்மை இன மீனவர்கள் சிலரால் சட்டவிரோத செயற்பாடு	https://www.virakesari.lk/article/232524	ta	virakesarilk	1764930480.0
lk_news	2025-12-05-lankadeepalk-942aa2b8	lankadeepalk-942aa2b8	2025-12-05	පේරාදෙනිය මල්වත්ත යළි එළිය කරන වැඩ අරඹයි	https://www.lankadeepa.lk/news/පරදනය-මලවතත-යළ-එළය-කරන-වඩ-අරඹය/101-684739	si	lankadeepalk	1764930448.0
lk_news	2025-12-05-adalk-fe9fddbb	adalk-fe9fddbb	2025-12-05	මන්ත්‍රී අර්චුනාට සිංහල රණවිරුවන්ගේ අගය තේරෙයි	https://www.ada.lk/breaking_news/මන්ත්‍රී-අර්චුනාට-සිංහල-රණවිරුවන්ගේ-අගය-තේරෙයි/11-420079	si	adalk	1764929583.0
lk_news	2025-12-05-virakesarilk-f107b47d	virakesarilk-f107b47d	2025-12-05	இந்திய தேசிய பேரிடர் மீட்புக் குழுவினர் நாடு திரும்பினர் !	https://www.virakesari.lk/article/232526	ta	virakesarilk	1764929580.0
lk_news	2025-12-05-virakesarilk-5ce883e4	virakesarilk-5ce883e4	2025-12-05	ட்ரம்ப் முன்னிலையில் கொங்கோ, ருவாண்டா இடையே அமைதி ஒப்பந்தம் கைச்சாத்து ; “பலர் தோல்வியடைந்த இடத்தில் நாம் வெற்றி கண்டிருக்கிறோம்” - ட்ரம்ப் பெருமிதம்	https://www.virakesari.lk/article/232527	ta	virakesarilk	1764929340.0
lk_news	2025-12-05-lankadeepalk-44d0df00	lankadeepalk-44d0df00	2025-12-05	අවසර දෙන තුරු කඳුකරයේ ඉදිකිරීම් බෑ	https://www.lankadeepa.lk/visheshanga/අවසර-දන-තර-කඳකරය-ඉදකරම-බ/26-684738	si	lankadeepalk	1764929063.0
lk_news	2025-12-05-lankadeepalk-cc548f73	lankadeepalk-cc548f73	2025-12-05	සෞඛ්‍ය නිවාඩු ගැන නිවේදනයක්	https://www.lankadeepa.lk/news/සඛය-නවඩ-ගන-නවදනයක/101-684737	si	lankadeepalk	1764928692.0
lk_news	2025-12-05-lankadeepalk-57671efc	lankadeepalk-57671efc	2025-12-05	දුම්රිය වාර ප්‍රවේශපත් නිකුත් කිරීමේ දිනය දීර්ඝ කරයි	https://www.lankadeepa.lk/news/දමරය-වර-පරවශපත-නකත-කරම-දනය-දරඝ-කරය/101-684736	si	lankadeepalk	1764928492.0
lk_news	2025-12-05-virakesarilk-e82fc84b	virakesarilk-e82fc84b	2025-12-05	அனர்த்த நிவாரண நிதியாக 10 பில்லியன் ஒதுக்கீடு: இன்று முதல் விநியோகம்! - அமைச்சர் ஆனந்த விஜேபால	https://www.virakesari.lk/article/232520	ta	virakesarilk	1764927960.0
lk_news	2025-12-05-virakesarilk-7ae42ee6	virakesarilk-7ae42ee6	2025-12-05	'எனக்கு கெப் வேண்டாம்; அந்த நிதியை மருந்து கொள்வனவுக்கு வழங்குங்கள்!' - டி.வி.சானக சபாநாயகரிடம் வலியுறுத்தல்	https://www.virakesari.lk/article/232521	ta	virakesarilk	1764927960.0
