doc_type	doc_id	num	date_str	description	url_metadata	lang	newspaper_id	time_ut
lk_news	2025-10-15-dailyftlk-b7346574	dailyftlk-b7346574	2025-10-15	Govt. to draft new amendments to Port City law	https://www.ft.lk/news/Govt-to-draft-new-amendments-to-Port-City-law/56-783000	en	dailyftlk	1760487629.0
lk_news	2025-10-15-dailyftlk-497e03ee	dailyftlk-497e03ee	2025-10-15	Rs. 1.45 b project to upgrade Kolonnawa fuel filling facilities	https://www.ft.lk/news/Rs-1-45-b-project-to-upgrade-Kolonnawa-fuel-filling-facilities/56-782999	en	dailyftlk	1760487578.0
lk_news	2025-10-15-dailyftlk-ded4049d	dailyftlk-ded4049d	2025-10-15	Full implementation of new minimum wage law to raise pay to Rs. 27,000	https://www.ft.lk/news/Full-implementation-of-new-minimum-wage-law-to-raise-pay-to-Rs-27-000/56-782998	en	dailyftlk	1760487558.0
lk_news	2025-10-15-dailyftlk-e088068e	dailyftlk-e088068e	2025-10-15	Govt. to procure Rs. 2.5 b worth of medical supplies	https://www.ft.lk/news/Govt-to-procure-Rs-2-5-b-worth-of-medical-supplies/56-782997	en	dailyftlk	1760487543.0
lk_news	2025-10-15-dailyftlk-c7e85440	dailyftlk-c7e85440	2025-10-15	Govt. to launch ‘Ratama Ekata’ national anti-drug operation	https://www.ft.lk/news/Govt-to-launch-Ratama-Ekata-national-anti-drug-operation/56-782996	en	dailyftlk	1760487503.0
lk_news	2025-10-15-dailyftlk-2b04a826	dailyftlk-2b04a826	2025-10-15	Cabinet nod for Rs. 1.3 b Excise Department revenue system	https://www.ft.lk/news/Cabinet-nod-for-Rs-1-3-b-Excise-Department-revenue-system/56-782995	en	dailyftlk	1760487435.0
lk_news	2025-10-15-dailyftlk-a85ef5f3	dailyftlk-a85ef5f3	2025-10-15	Sri Lanka to sign anti–money laundering MoUs with Vatican, Mauritius	https://www.ft.lk/news/Sri-Lanka-to-sign-antimoney-laundering-MoUs-with-Vatican-Mauritius/56-782994	en	dailyftlk	1760487416.0
lk_news	2025-10-15-dailyftlk-40e1d278	dailyftlk-40e1d278	2025-10-15	CEB unions suspend strike	https://www.ft.lk/news/CEB-unions-suspend-strike/56-782993	en	dailyftlk	1760487400.0
lk_news	2025-10-15-dailyftlk-877da5c9	dailyftlk-877da5c9	2025-10-15	Govt. allows rice imports amid local Keeri Samba shortage	https://www.ft.lk/news/Govt-allows-rice-imports-amid-local-Keeri-Samba-shortage/56-782992	en	dailyftlk	1760487386.0
lk_news	2025-10-15-dailyftlk-e949f872	dailyftlk-e949f872	2025-10-15	Gold prices hit record high	https://www.ft.lk/news/Gold-prices-hit-record-high/56-782991	en	dailyftlk	1760487369.0
lk_news	2025-10-15-virakesarilk-2f38a858	virakesarilk-2f38a858	2025-10-15	செம்மணி மனித புதைகுழியின் அடுத்த அகழ்வு: 2 கோடி ரூபாய் நிதிக்கு அனுமதி	https://www.virakesari.lk/article/227759	ta	virakesarilk	1760482980.0
lk_news	2025-10-15-bbccomsinhala-c6171f5a	bbccomsinhala-c6171f5a	2025-10-15	දකුණු මුහුදෙන් හමු වූ මත්ද්‍රව්‍ය : 'දවස් 31ක මෙහෙයුමක් සිදුකළා'	https://www.bbc.com/sinhala/articles/cx2n5qj89dqo	si	bbccomsinhala	1760482864.0
lk_news	2025-10-15-virakesarilk-0c6d3f40	virakesarilk-0c6d3f40	2025-10-15	காணி உரிமை தொடர்பில் பாராளுமன்றத்தில் கூட்டு ஆவணமொன்றை முன்வைப்போம் - சலக மலையகப் பிரதிநிதிகளுக்கும் ஜீவன் அழைப்பு	https://www.virakesari.lk/article/227758	ta	virakesarilk	1760482800.0
lk_news	2025-10-15-virakesarilk-b36f7131	virakesarilk-b36f7131	2025-10-15	மட்டு கரடியனாறு பகுதியில் யானை தாக்கியதில் 65 வயது விவசாயி ஒருவர் உயிரிழப்பு	https://www.virakesari.lk/article/227757	ta	virakesarilk	1760482620.0
lk_news	2025-10-15-virakesarilk-ecade953	virakesarilk-ecade953	2025-10-15	முடிந்தால் அடிப்படை சம்பளத்தில் 10 ரூபாவை அதிகரித்துக் காட்டுங்கள் -  ஜனாதிபதிக்கு ஜீவன் சவால்	https://www.virakesari.lk/article/227756	ta	virakesarilk	1760482500.0
lk_news	2025-10-15-virakesarilk-1e7f8662	virakesarilk-1e7f8662	2025-10-15	2025 இறுதி காலாண்டில் மின்கட்டணம் அதிகரிக்கப்படாது – பொதுப்பயன்பாடுகள் ஆணைக்குழு	https://www.virakesari.lk/article/227755	ta	virakesarilk	1760482140.0
lk_news	2025-10-15-virakesarilk-b0ae63f9	virakesarilk-b0ae63f9	2025-10-15	மன்னாரில் படகு மற்றும் இயந்திரத்தை திருடி இந்தியாவுக்கு தப்பிச் சென்ற நபர்	https://www.virakesari.lk/article/227754	ta	virakesarilk	1760481720.0
lk_news	2025-10-15-virakesarilk-89d79f42	virakesarilk-89d79f42	2025-10-15	பரஸ்பர வர்த்தக மற்றும் ஏற்றுமதி வாய்ப்புக்களை விரிவுபடுத்தல்; இலங்கை - அமெரிக்கா கூட்டாக ஆராய்வு	https://www.virakesari.lk/article/227753	ta	virakesarilk	1760481480.0
lk_news	2025-10-15-virakesarilk-9681e11e	virakesarilk-9681e11e	2025-10-15	சிவப்பு அறிவித்தல் விடுக்கப்பட்டள்ள 40 சந்தேகநபர்களில் 18 பேர் நாட்டுக்கு அழைத்து வரப்பட்டுள்ளனர் - பொலிஸ் பேச்சாளர்	https://www.virakesari.lk/article/227752	ta	virakesarilk	1760481360.0
lk_news	2025-10-15-virakesarilk-4a78d3f3	virakesarilk-4a78d3f3	2025-10-15	கொழும்பு தேசிய வைத்தியசாலையில் 3 எம். ஆர். ஐ இயந்திரங்கள் செயலிழப்பு	https://www.virakesari.lk/article/227751	ta	virakesarilk	1760481060.0
lk_news	2025-10-15-virakesarilk-ffad69bd	virakesarilk-ffad69bd	2025-10-15	வறுமை, தீவிர வறுமைக் குடும்பங்களை வலுவூட்ட விசேட நிகழ்ச்சித்திட்டம்- அமைச்சரவை அங்கீகாரம்	https://www.virakesari.lk/article/227750	ta	virakesarilk	1760480820.0
lk_news	2025-10-15-virakesarilk-6df97c84	virakesarilk-6df97c84	2025-10-15	ஞாயிற்றுக்கிழமைகளில் நெடுந்தீவுக்கான போக்குவரத்து அனுமதி	https://www.virakesari.lk/article/227749	ta	virakesarilk	1760473980.0
lk_news	2025-10-15-virakesarilk-8ec85efa	virakesarilk-8ec85efa	2025-10-15	அமைச்சரவை மறுசீரமைப்புக்கும், கொள்கலன் விவகாரத்துக்கும் தொடர்பில்லை - அமைச்சரவை பேச்சாளர் நளிந்த ஜயதிஸ்ஸ	https://www.virakesari.lk/article/227748	ta	virakesarilk	1760473620.0
lk_news	2025-10-15-virakesarilk-5993f395	virakesarilk-5993f395	2025-10-15	இலங்கையை 2 - 1 என வெற்றிகொண்டு பதிலடி கொடுத்தது துர்க்மேனிஸ்தான்	https://www.virakesari.lk/article/227747	ta	virakesarilk	1760473500.0
lk_news	2025-10-14-islandlk-eb37805f	islandlk-eb37805f	2025-10-14	The Viral ‘Cancer-Cure’ story – Why Sri Lanka needs professional science journalism	http://island.lk/the-viral-cancer-cure-story-why-sri-lanka-needs-professional-science-journalism/	en	islandlk	1760464740.0
lk_news	2025-10-14-islandlk-f7d58405	islandlk-f7d58405	2025-10-14	Spending smarter to boost growth, lessons for Sri Lanka	http://island.lk/spending-smarter-to-boost-growth-lessons-for-sri-lanka/	en	islandlk	1760464560.0
lk_news	2025-10-14-islandlk-465d2b80	islandlk-465d2b80	2025-10-14	CavinKare launches India’s No1 Cavin’s Milkshake in Sri Lanka	http://island.lk/cavinkare-launches-indias-no1-cavins-milkshake-in-sri-lanka/	en	islandlk	1760463780.0
lk_news	2025-10-14-islandlk-1787b638	islandlk-1787b638	2025-10-14	From Bean to Brew: Sri Lanka’s first coffee experience studio ‘Soul Brewology’ opens on Chatham Street	http://island.lk/from-bean-to-brew-sri-lankas-first-coffee-experience-studio-soul-brewology-opens-on-chatham-street/	en	islandlk	1760463780.0
lk_news	2025-10-14-islandlk-25fb9ff8	islandlk-25fb9ff8	2025-10-14	NDB Privilege Banking hosts exclusive wellness webinar on Diabetic Reversal	http://island.lk/ndb-privilege-banking-hosts-exclusive-wellness-webinar-on-diabetic-reversal/	en	islandlk	1760463660.0
lk_news	2025-10-14-islandlk-0b833068	islandlk-0b833068	2025-10-14	DiabSense wins Venture Engine 2025, AGC Innovate and Spectrify AI named runners-up	http://island.lk/diabsense-wins-venture-engine-2025-agc-innovate-and-spectrify-ai-named-runners-up/	en	islandlk	1760463480.0
lk_news	2025-10-14-islandlk-b0d8ff83	islandlk-b0d8ff83	2025-10-14	Hong Kong-based World Elite Ltd acquires 50.01 per cent ordinary shares in Gestetner of Ceylon; market overall positive	http://island.lk/hong-kong-based-world-elite-ltd-acquires-50-01-per-cent-ordinary-shares-in-gestetner-of-ceylon-market-overall-positive/	en	islandlk	1760463420.0
lk_news	2025-10-14-islandlk-9f9542ad	islandlk-9f9542ad	2025-10-14	Financing issues seen as preventing households from benefiting fully from BESS-related tariff scheme	http://island.lk/financing-issues-seen-as-preventing-households-from-benefiting-fully-from-bess-related-tariff-scheme/	en	islandlk	1760463420.0
lk_news	2025-10-14-colombotelegraphcom-86c7a1c7	colombotelegraphcom-86c7a1c7	2025-10-14	When Justice Trembles: In Defence Of Attorney Gunaratne Wanninayake	https://www.colombotelegraph.com/index.php/when-justice-trembles-in-defence-of-attorney-gunaratne-wanninayake/	en	colombotelegraphcom	1760462143.0
lk_news	2025-10-14-virakesarilk-66d5572c	virakesarilk-66d5572c	2025-10-14	யாழ்ப்பாணம் கோப்பாய் பொலிஸ் காணி உரிமையாளர்களுக்கு கையளிக்கப்படவுள்ளது – நீதிமன்றம் உத்தரவு	https://www.virakesari.lk/article/227746	ta	virakesarilk	1760461620.0
lk_news	2025-10-14-virakesarilk-2254bb8f	virakesarilk-2254bb8f	2025-10-14	38ஆவது அகில இலங்கை பாடசாலைகள் விளையாட்டு விழா: 5000 மீற்றர் ஓட்டப் போட்டியில் விகிர்தன் புதிய சாதனை	https://www.virakesari.lk/article/227745	ta	virakesarilk	1760460300.0
lk_news	2025-10-14-virakesarilk-94e5700b	virakesarilk-94e5700b	2025-10-14	இலங்கை - நியூஸிலாந்து உலகக் கிண்ணப் போட்டி மழையினால் இடையில் கைவிடப்பட்டது; நியூஸிலாந்தின் அரை இறுதி வாய்ப்பு சந்தேகம்?	https://www.virakesari.lk/article/227744	ta	virakesarilk	1760460120.0
lk_news	2025-10-14-lankadeepalk-a0bde662	lankadeepalk-a0bde662	2025-10-14	’’ විදුලි බිල වැඩි නොවුනේ අපි නිසා’’	https://www.lankadeepa.lk/news/වදල-බල-වඩ-නවන-අප-නස/101-681350	si	lankadeepalk	1760459921.0
lk_news	2025-10-14-islandlk-a6b0f793	islandlk-a6b0f793	2025-10-14	Cabinet nod to issue Dollar Bonds	http://island.lk/cabinet-nod-to-issue-dollar-bonds/	en	islandlk	1760459580.0
lk_news	2025-10-14-lankadeepalk-94cb88ee	lankadeepalk-94cb88ee	2025-10-14	හරිනි ඇමරිකාවෙන් ඉන්දියාවට	https://www.lankadeepa.lk/news/හරන-ඇමරකවන-ඉනදයවට/101-681349	si	lankadeepalk	1760459078.0
lk_news	2025-10-14-virakesarilk-fa0cf074	virakesarilk-fa0cf074	2025-10-14	கொழும்பு பங்குச் சந்தை 8 டிரில்லியன் ரூபாய் சாதனையைத் தாண்டியது	https://www.virakesari.lk/article/227743	ta	virakesarilk	1760459040.0
lk_news	2025-10-14-lankadeepalk-8f31c80a	lankadeepalk-8f31c80a	2025-10-14	අස්වැසුම ප්‍රතිලාභීන්ට සුබ ආරංචියක්	https://www.lankadeepa.lk/news/අසවසම-පරතලභනට-සබ-ආරචයක/101-681348	si	lankadeepalk	1760458689.0
lk_news	2025-10-14-virakesarilk-90f113d1	virakesarilk-90f113d1	2025-10-14	ஐக்கிய மக்கள் சக்தியின் அழுத்தம் காரணமாகவே மின்சாரக் கட்டண அதிகரிப்பு நிறுத்தப்பட்டது - சஜித் பிரேமதாச	https://www.virakesari.lk/article/227742	ta	virakesarilk	1760458680.0
lk_news	2025-10-14-virakesarilk-ec33c94d	virakesarilk-ec33c94d	2025-10-14	திருகோணமலை ஸ்ரீ சண்முக மகளிர் கல்லூரி வன்முறைச் சம்பவத்தையடுத்து பிரதி அமைச்சர் அருண் ஹேமச்சந்திரா நேரில் பார்வை	https://www.virakesari.lk/article/227741	ta	virakesarilk	1760458500.0
lk_news	2025-10-14-lankadeepalk-3782eabf	lankadeepalk-3782eabf	2025-10-14	’’බලශක්තිය ඇමැතිවරයාගෙන් ලිඛිත එකඟතාවයක් ඕනේ’’	https://www.lankadeepa.lk/news/බලශකතය-ඇමතවරයගන-ලඛත-එකඟතවයක-ඕන/101-681347	si	lankadeepalk	1760458201.0
lk_news	2025-10-14-lankadeepalk-9a641444	lankadeepalk-9a641444	2025-10-14	රැකව දියඹෙන් මත්ද්‍රව්‍ය කිලෝ 1200ක් ගොඩගනී	https://www.lankadeepa.lk/news/රකව-දයඹන-මතදරවය-කල-1200ක-ගඩගන/101-681346	si	lankadeepalk	1760457549.0
lk_news	2025-10-14-lankadeepalk-657cc98f	lankadeepalk-657cc98f	2025-10-14	මත්ද්‍රව්‍ය තොගයක්  රැකව දියඹෙන් ගොඩගනි	https://www.lankadeepa.lk/news/මතදරවය-තගයක-රකව-දයඹන-ගඩගන/101-681346	si	lankadeepalk	1760457549.0
lk_news	2025-10-14-virakesarilk-7f7b9577	virakesarilk-7f7b9577	2025-10-14	செம்மணி மனிதப்புதைகுழி: அடுத்த வழக்கு விசாரணை வரை குற்ற விசாரணைப்பிரிவினர் நாளாந்தம் கண்காணிப்பர் - காணாமல்போனோர் பற்றிய அலுவலகம்	https://www.virakesari.lk/article/227739	ta	virakesarilk	1760457240.0
lk_news	2025-10-14-tamilmirrorlk-23e50ce9	tamilmirrorlk-23e50ce9	2025-10-14	வயதான பெண்களை டுபாய்க்கு அனுப்பியவர் கைது	https://www.tamilmirror.lk/செய்திகள்/வயதான-பெண்களை-டுபாய்க்கு-அனுப்பியவர்-கைது/175-366286	ta	tamilmirrorlk	1760457138.0
lk_news	2025-10-14-virakesarilk-b67339e0	virakesarilk-b67339e0	2025-10-14	மாகாணசபைத்தேர்தலை உடன் நடாத்துதல் ; தமிழ்த்தேசியக்கட்சிகள் இன்று கூடி ஆராய்வு	https://www.virakesari.lk/article/227738	ta	virakesarilk	1760456460.0
lk_news	2025-10-14-tamilmirrorlk-6a24c85d	tamilmirrorlk-6a24c85d	2025-10-14	பொறுப்பை முறையாக நிறைவேற்றுங்கள்	https://www.tamilmirror.lk/செய்திகள்/பொறுப்பை-முறையாக-நிறைவேற்றுங்கள்/175-366285	ta	tamilmirrorlk	1760452842.0
lk_news	2025-10-14-lankadeepalk-2e7267b9	lankadeepalk-2e7267b9	2025-10-14	සෞන්දර්ය කලා සරසවියට ඉඩමක් තෑගි දෙයි	https://www.lankadeepa.lk/news/සනදරය-කල-සරසවයට-ඉඩමක-තග-දය/101-681345	si	lankadeepalk	1760451418.0
lk_news	2025-10-14-lankadeepalk-d8ee8a27	lankadeepalk-d8ee8a27	2025-10-14	’’මට මැණික් ගඟ ළඟ ගෙදරක් නෑ’’	https://www.lankadeepa.lk/news/මට-මණක-ගඟ-ළඟ-ගදරක-න/101-681344	si	lankadeepalk	1760449713.0
lk_news	2025-10-14-lankadeepalk-be6fb654	lankadeepalk-be6fb654	2025-10-14	වරාය නගර පනත සංශෝධනය වෙයි	https://www.lankadeepa.lk/latest_news/වරය-නගර-පනත-සශධනය-වය/1-681343	si	lankadeepalk	1760448888.0
lk_news	2025-10-14-tamilmirrorlk-af1b9800	tamilmirrorlk-af1b9800	2025-10-14	அஸ்வெசும பயனாளிகளுக்கு மகிழ்ச்சியான அறிவிப்பு	https://www.tamilmirror.lk/செய்திகள்/அஸ்வெசும-பயனாளிகளுக்கு-மகிழ்ச்சியான-அறிவிப்பு/175-366284	ta	tamilmirrorlk	1760448886.0
lk_news	2025-10-14-lankadeepalk-50969000	lankadeepalk-50969000	2025-10-14	උළුගේතැන්නට ඇප දුන් අධිකරණයෙන් සී.අයි.ඩීයට දොස්	https://www.lankadeepa.lk/latest_news/උළගතනනට-ඇප-දන-අධකරණයන-ස-අය-ඩයට-දස/1-681342	si	lankadeepalk	1760448829.0
lk_news	2025-10-14-virakesarilk-72d9c58c	virakesarilk-72d9c58c	2025-10-14	அபிவிருத்தியின் நன்மைகளை மக்களுக்கு வழங்குவதில் இடைப் பொறிமுறையாக அரச அதிகாரிகளுக்கு பாரிய பொறுப்பு உள்ளது -  ஜனாதிபதி	https://www.virakesari.lk/article/227735	ta	virakesarilk	1760448540.0
lk_news	2025-10-14-virakesarilk-6e6cd382	virakesarilk-6e6cd382	2025-10-14	மக்கள் மண்டபத்தில் (Great Hall of the People) நடைபெற்ற கௌரவிப்பு நிகழ்வில் பிரதமர் கலாநிதி ஹரிணி அமரசூரிய பங்கேற்றார்	https://www.virakesari.lk/article/227737	ta	virakesarilk	1760448480.0
lk_news	2025-10-14-virakesarilk-a9bda63c	virakesarilk-a9bda63c	2025-10-14	நியூஸிலாந்துக்கு 259 ஓட்டங்களை வெற்றி இலக்காக  நிர்ணயித்தது  இலங்கை	https://www.virakesari.lk/article/227736	ta	virakesarilk	1760448300.0
lk_news	2025-10-14-tamilmirrorlk-07dfda67	tamilmirrorlk-07dfda67	2025-10-14	சமீபத்திய பதவி மாற்றங்கள் குறித்து அமைச்சர் விளக்கம்	https://www.tamilmirror.lk/செய்திகள்/சமீபத்திய-பதவி-மாற்றங்கள்-குறித்து-அமைச்சர்-விளக்கம்/175-366283	ta	tamilmirrorlk	1760447180.0
lk_news	2025-10-14-lankadeepalk-8324d8fd	lankadeepalk-8324d8fd	2025-10-14	කනත්තේ මල් ශාලාවට කෝපාවෙන්  දොස්	https://www.lankadeepa.lk/news/කනතත-මල-ශලවට-කපවන-දස/101-681341	si	lankadeepalk	1760446809.0
lk_news	2025-10-14-tamilmirrorlk-60641343	tamilmirrorlk-60641343	2025-10-14	”எனக்கும் அதற்கும் எந்த சம்பந்தமும் இல்லை”	https://www.tamilmirror.lk/செய்திகள்/எனக்கும்-அதற்கும்-எந்த-சம்பந்தமும்-இல்லை/175-366282	ta	tamilmirrorlk	1760446712.0
lk_news	2025-10-14-colombotelegraphcom-53a9bfb5	colombotelegraphcom-53a9bfb5	2025-10-14	The Stakes For Hamas Disarmament	https://www.colombotelegraph.com/index.php/the-stakes-for-hamas-disarmament/	en	colombotelegraphcom	1760446399.0
lk_news	2025-10-14-lankadeepalk-dca3e40b	lankadeepalk-dca3e40b	2025-10-14	වයඹ සරසවි වෙද සිසුන්ට ඉන්න තැනක් හදයි	https://www.lankadeepa.lk/news/වයඹ-සරසව-වද-සසනට-ඉනන-තනක-හදය/101-681340	si	lankadeepalk	1760445704.0
lk_news	2025-10-14-lankadeepalk-cb1c4d4e	lankadeepalk-cb1c4d4e	2025-10-14	මේ අවුරුද්දේ 3000 ක් කොරියා රස්සා වලට ගිහින්	https://www.lankadeepa.lk/news/ම-අවරදද-3000-ක-කරය-රසස-වලට-ගහන/101-681339	si	lankadeepalk	1760445508.0
lk_news	2025-10-14-lankadeepalk-cc7214a0	lankadeepalk-cc7214a0	2025-10-14	පීසීට තග දැමූ නීතිඥවරයා සොයන්න පොලිස් කණ්ඩායම් 3 ක්	https://www.lankadeepa.lk/news/පසට-තග-දම-නතඥවරය-සයනන-පලස-කණඩයම-3-ක/101-681338	si	lankadeepalk	1760445273.0
lk_news	2025-10-14-virakesarilk-1a20f4dd	virakesarilk-1a20f4dd	2025-10-14	தெஹிவளையில் ஒருவர் கைது!	https://www.virakesari.lk/article/227734	ta	virakesarilk	1760443680.0
lk_news	2025-10-14-virakesarilk-b748b78b	virakesarilk-b748b78b	2025-10-14	கழிவுகளை கொட்ட நிரந்தர இடம் ஒதுக்கும் வரை கழிவுகளுடன் நிறுத்தப்பட்டுள்ள வாகனம் அகற்றப்படமாட்டது – மன்னார் நகரசபை முதல்வர்	https://www.virakesari.lk/article/227731	ta	virakesarilk	1760443080.0
lk_news	2025-10-14-virakesarilk-67665647	virakesarilk-67665647	2025-10-14	இஷாரா செவ்வந்தியின் கைதானது பல மாத காலமாக திட்டமிடப்பட்ட இரகசிய நடவடிக்கையாகும் - பொலிஸ் ஊடகப் பேச்சாளர்	https://www.virakesari.lk/article/227732	ta	virakesarilk	1760443080.0
lk_news	2025-10-14-adalk-e334ede0	adalk-e334ede0	2025-10-14	මහනුවර රෝහලට මිලදී ගත් වාහන 10ක් වසර දෙකකින් භාවිතයෙන් ඉවත් කරලා	https://www.ada.lk/breaking_news/මහනුවර-රෝහලට-මිලදී-ගත්-වාහන-10ක්-වසර-දෙකකින්-භාවිතයෙන්-ඉවත්-කරලා/11-419100	si	adalk	1760442701.0
lk_news	2025-10-14-adalk-b072a087	adalk-b072a087	2025-10-14	මාර්ගගත කැසිනෝ වලින් බදු අදායමක් ලබාගැනීමේ ක්‍රමයක් නෑ	https://www.ada.lk/breaking_news/මාර්ගගත-කැසිනෝ-වලින්-බදු-අදායමක්-ලබාගැනීමේ-ක්‍රමයක්-නෑ/11-419099	si	adalk	1760442152.0
lk_news	2025-10-14-virakesarilk-df44d3d9	virakesarilk-df44d3d9	2025-10-14	விசேட சோதனை நடவடிக்கையில் 6,082 பேர் கைது - பொலிஸ் ஊடகப் பேச்சாளர்	https://www.virakesari.lk/article/227729	ta	virakesarilk	1760442060.0
lk_news	2025-10-14-lankadeepalk-ad52eeee	lankadeepalk-ad52eeee	2025-10-14	සුරා බදු ආදායම් පරිපාලනය ඩිජිටල් වෙයි	https://www.lankadeepa.lk/latest_news/සර-බද-ආදයම-පරපලනය-ඩජටල-වය/1-681337	si	lankadeepalk	1760441790.0
lk_news	2025-10-14-adalk-cdbb9599	adalk-cdbb9599	2025-10-14	කොළඹ කොටුවේ  හිඟ බදු ආදායම රු. කෝටි 60යි	https://www.ada.lk/breaking_news/කොළඹ-කොටුවේ--හිඟ-බදු-ආදායම-රු--කෝටි-60යි/11-419098	si	adalk	1760441736.0
lk_news	2025-10-14-virakesarilk-1701a8b2	virakesarilk-1701a8b2	2025-10-14	பாதாள உலக கும்பலின் சொத்துக்கள் பறிமுதல் செய்யப்பட்டுள்ளது - பொலிஸ் ஊடகப் பேச்சாளர்	https://www.virakesari.lk/article/227728	ta	virakesarilk	1760441580.0
lk_news	2025-10-14-virakesarilk-d03bdad9	virakesarilk-d03bdad9	2025-10-14	யாழில் இரண்டாவது நாளாக தொடரும் ஆசிரியர்களின் போராட்டம்	https://www.virakesari.lk/article/227722	ta	virakesarilk	1760441340.0
lk_news	2025-10-14-virakesarilk-c6b58386	virakesarilk-c6b58386	2025-10-14	வவுணதீவில் மீட்கப்பட்ட வெடி பொருட்கள் வெடிக்கவைத்து அழிப்பு	https://www.virakesari.lk/article/227725	ta	virakesarilk	1760441340.0
