doc_type	doc_id	num	date_str	description	url_metadata	lang	newspaper_id	time_ut
lk_news	2025-10-07-lankadeepalk-ff7c9c8d	lankadeepalk-ff7c9c8d	2025-10-07	වීදුරු බෝතල් හදන්න හඳුන්නෙත්තිගෙන් ආරාධනයක්	https://www.lankadeepa.lk/news/වදර-බතල-හදනන-හඳනනතතගන-ආරධනයක/101-680831	si	lankadeepalk	1759813826.0
lk_news	2025-10-07-lankadeepalk-f676c87f	lankadeepalk-f676c87f	2025-10-07	ආණ්ඩුව මැවූ දිව්‍යලෝකය කඩා වැටිලා	https://www.lankadeepa.lk/latest_news/ආණඩව-මව-දවයලකය-කඩ-වටල/1-680830	si	lankadeepalk	1759812939.0
lk_news	2025-10-07-lankadeepalk-fc52bbcf	lankadeepalk-fc52bbcf	2025-10-07	එයාලට හීනෙනුත් පේන්නේ මමයි තාත්තයි	https://www.lankadeepa.lk/latest_news/එයලට-හනනත-පනන-මමය-තතතය/1-680829	si	lankadeepalk	1759812593.0
lk_news	2025-10-07-tamilmirrorlk-d75b3080	tamilmirrorlk-d75b3080	2025-10-07	இடைநீக்கம் செய்யப்பட்ட நீதிபதிகளுக்கு பாதி சம்பளம்	https://www.tamilmirror.lk/செய்திகள்/இடைநீக்கம்-செய்யப்பட்ட-நீதிபதிகளுக்கு-பாதி-சம்பளம்/175-365867	ta	tamilmirrorlk	1759812527.0
lk_news	2025-10-07-tamilmirrorlk-d7262c5f	tamilmirrorlk-d7262c5f	2025-10-07	புதிய ரக துப்பாக்கியுடன் ஒருவர் கைது	https://www.tamilmirror.lk/செய்திகள்/புதிய-ரக-துப்பாக்கியுடன்-ஒருவர்-கைது/175-365865	ta	tamilmirrorlk	1759812155.0
lk_news	2025-10-07-tamilmirrorlk-7ec074d2	tamilmirrorlk-7ec074d2	2025-10-07	மாங்குளத்தில்  மனித எலும்புக்கூடு  மீட்பு	https://www.tamilmirror.lk/செய்திகள்/மாங்குளத்தில்-மனித-எலும்புக்கூடு-மீட்பு/175-365864	ta	tamilmirrorlk	1759811647.0
lk_news	2025-10-07-tamilmirrorlk-e450addb	tamilmirrorlk-e450addb	2025-10-07	மஹிந்தவுக்கு பாதுகாப்பு வழங்க அரசாங்கம் தயார்	https://www.tamilmirror.lk/செய்திகள்/மஹிந்தவுக்கு-பாதுகாப்பு-வழங்க-அரசாங்கம்-தயார்/175-365863	ta	tamilmirrorlk	1759810826.0
lk_news	2025-10-07-tamilmirrorlk-016122d5	tamilmirrorlk-016122d5	2025-10-07	வார இறுதியில் வேலைக்கு வர மறுத்த ஊழியர் பணிநீக்கம்	https://www.tamilmirror.lk/செய்திகள்/வார-இறுதியில்-வேலைக்கு-வர-மறுத்த-ஊழியர்-பணிநீக்கம்/175-365862	ta	tamilmirrorlk	1759809864.0
lk_news	2025-10-07-lankadeepalk-db681674	lankadeepalk-db681674	2025-10-07	අකුණක් වැදී ධීවරයා මරුට	https://www.lankadeepa.lk/latest_news/අකණක-වද-ධවරය-මරට/1-680828	si	lankadeepalk	1759809547.0
lk_news	2025-10-07-lankadeepalk-2dcce1d1	lankadeepalk-2dcce1d1	2025-10-07	අපරාධකල්ලි සාමාජිකයෙක් අල්ලයි	https://www.lankadeepa.lk/news/අපරධකලල-සමජකයක-අලලය/101-680824	si	lankadeepalk	1759807729.0
lk_news	2025-10-07-tamilmirrorlk-66676fbb	tamilmirrorlk-66676fbb	2025-10-07	கம்பளை விபத்துக்கான காரணம் வெளியானது	https://www.tamilmirror.lk/செய்திகள்/கம்பளை-விபத்துக்கான-காரணம்-வெளியானது/175-365861	ta	tamilmirrorlk	1759807204.0
lk_news	2025-10-07-tamilmirrorlk-64b38489	tamilmirrorlk-64b38489	2025-10-07	இன்று பிற்பகல் மழை பெய்யும்	https://www.tamilmirror.lk/செய்திகள்/இன்று-பிற்பகல்-மழை-பெய்யும்/175-365860	ta	tamilmirrorlk	1759806712.0
lk_news	2025-10-07-lankadeepalk-79aed7ee	lankadeepalk-79aed7ee	2025-10-07	මත් කරල් ගෙන පොලීසියට ආ පීසී අත්අඩංගුවට	https://www.lankadeepa.lk/news/මත-කරල-ගන-පලසයට-ආ-පස-අතඅඩගවට/101-680820	si	lankadeepalk	1759805826.0
lk_news	2025-10-07-lankadeepalk-5bf6e8ac	lankadeepalk-5bf6e8ac	2025-10-07	යුවළක් කපා කොටා මරලා	https://www.lankadeepa.lk/news/යවළක-කප-කට-මරල/101-680819	si	lankadeepalk	1759804777.0
lk_news	2025-10-07-tamilmirrorlk-b85937e5	tamilmirrorlk-b85937e5	2025-10-07	இளம் தம்பதியினர் வெட்டிக் கொலை	https://www.tamilmirror.lk/செய்திகள்/இளம்-தம்பதியினர்-வெட்டிக்-கொலை/175-365859	ta	tamilmirrorlk	1759804377.0
lk_news	2025-10-07-adalk-8c0f68da	adalk-8c0f68da	2025-10-07	මුහුණු ආවරණය කරගෙන පැමිණි 5ක් අනියම් යුවළක් ඝාතනය කරයි	https://www.ada.lk/breaking_news/මුහුණු-ආවරණය-කරගෙන-පැමිණි-5ක්-අනියම්-යුවළක්-ඝාතනය-කරයි/11-418944	si	adalk	1759802178.0
lk_news	2025-10-07-lankadeepalk-fd0186ee	lankadeepalk-fd0186ee	2025-10-07	සවස් කාලයේ වැසි ඇති වේ	https://www.lankadeepa.lk/news/සවස-කලය-වස-ඇත-ව/101-680818	si	lankadeepalk	1759800147.0
lk_news	2025-10-07-adalk-b6a76d04	adalk-b6a76d04	2025-10-07	අදත් හවස බොහෝ පළාත්වලට වැසි	https://www.ada.lk/breaking_news/අදත්-හවස-බොහෝ-පළාත්වලට-වැසි/11-418943	si	adalk	1759797734.0
lk_news	2025-10-07-tamilmirrorlk-3d39dc44	tamilmirrorlk-3d39dc44	2025-10-07	ரஷ்யாவின் எண்ணெய் நிலையம் மீது உக்ரைன் தாக்குதல்	https://www.tamilmirror.lk/உலக-செய்திகள்/ரஷ்யாவின்-எண்ணெய்-நிலையம்-மீது-உக்ரைன்-தாக்குதல்/50-365857	ta	tamilmirrorlk	1759795703.0
lk_news	2025-10-07-dailyftlk-1d2d152b	dailyftlk-1d2d152b	2025-10-07	International Day for Universal Access to Information	https://www.ft.lk/news/International-Day-for-Universal-Access-to-Information/56-782667	en	dailyftlk	1759786594.0
lk_news	2025-10-07-dailyftlk-8874ec74	dailyftlk-8874ec74	2025-10-07	Series of religious blessing programs to mark 76th anniversary of SL Army	https://www.ft.lk/news/Series-of-religious-blessing-programs-to-mark-76th-anniversary-of-SL-Army/56-782666	en	dailyftlk	1759786470.0
lk_news	2025-10-07-dailyftlk-c2443f6f	dailyftlk-c2443f6f	2025-10-07	Lanka IOC ‘brings energy to life’  in partnership with Rescue Animals	https://www.ft.lk/news/Lanka-IOC-brings-energy-to-life-in-partnership-with-Rescue-Animals/56-782665	en	dailyftlk	1759786227.0
lk_news	2025-10-07-dailyftlk-34fdd59c	dailyftlk-34fdd59c	2025-10-07	Sri Lanka reports third highest child displacements from climate disasters in South Asia	https://www.ft.lk/news/Sri-Lanka-reports-third-highest-child-displacements-from-climate-disasters-in-South-Asia/56-782664	en	dailyftlk	1759785884.0
lk_news	2025-10-07-dailyftlk-772bf575	dailyftlk-772bf575	2025-10-07	ECSL named Electoral Commission of the Year at International Electoral Awards 2025	https://www.ft.lk/news/ECSL-named-Electoral-Commission-of-the-Year-at-International-Electoral-Awards-2025/56-782663	en	dailyftlk	1759785822.0
lk_news	2025-10-07-dailyftlk-5578f84a	dailyftlk-5578f84a	2025-10-07	Outdated laws obstacle to resolving drugs shortages, says Health Minister	https://www.ft.lk/news/Outdated-laws-obstacle-to-resolving-drugs-shortages-says-Health-Minister/56-782662	en	dailyftlk	1759785711.0
lk_news	2025-10-07-dailyftlk-ec784dbe	dailyftlk-ec784dbe	2025-10-07	President opens Somawathi Archaeological Museum, International Archaeological Research Institute	https://www.ft.lk/news/President-opens-Somawathi-Archaeological-Museum-International-Archaeological-Research-Institute/56-782661	en	dailyftlk	1759785599.0
lk_news	2025-10-07-dailyftlk-b46f5eae	dailyftlk-b46f5eae	2025-10-07	All Island Dairy Association commits support to boost local production	https://www.ft.lk/business/All-Island-Dairy-Association-commits-support-to-boost-local-production/34-782653	en	dailyftlk	1759783236.0
lk_news	2025-10-07-dailyftlk-a3da5346	dailyftlk-a3da5346	2025-10-07	KPMG flags urgent compliance prep after SVAT repeal	https://www.ft.lk/business/KPMG-flags-urgent-compliance-prep-after-SVAT-repeal/34-782652	en	dailyftlk	1759782866.0
lk_news	2025-10-07-dailyftlk-ad7cce1e	dailyftlk-ad7cce1e	2025-10-07	Xeptagon opens first office at Colombo Port City IT Park	https://www.ft.lk/business/Xeptagon-opens-first-office-at-Colombo-Port-City-IT-Park/34-782651	en	dailyftlk	1759782765.0
lk_news	2025-10-07-dailyftlk-61fd3928	dailyftlk-61fd3928	2025-10-07	Ceylon Specialty Estate Tea  of the Year 2025 charity auction	https://www.ft.lk/business/Ceylon-Specialty-Estate-Tea-of-the-Year-2025-charity-auction/34-782650	en	dailyftlk	1759782480.0
lk_news	2025-10-07-dailyftlk-b7607b42	dailyftlk-b7607b42	2025-10-07	Bernard Philknit unveils ‘Boths  By Bernards’ with new apparel line	https://www.ft.lk/business/Bernard-Philknit-unveils-Boths-By-Bernards-with-new-apparel-line/34-782649	en	dailyftlk	1759782432.0
lk_news	2025-10-07-dailyftlk-0aafefe1	dailyftlk-0aafefe1	2025-10-07	SLID and ACCA launch National Director Awards	https://www.ft.lk/business/SLID-and-ACCA-launch-National-Director-Awards/34-782647	en	dailyftlk	1759780655.0
lk_news	2025-10-07-dailyftlk-f1732ba3	dailyftlk-f1732ba3	2025-10-07	CM Holdings to dispose Rs. 382.2 m property	https://www.ft.lk/business/CM-Holdings-to-dispose-Rs-382-2-m-property/34-782646	en	dailyftlk	1759780518.0
lk_news	2025-10-07-dailyftlk-b326139c	dailyftlk-b326139c	2025-10-07	Condemning surveillance, harassment, and intimidation of journalist Kumanan Kanapathipillai	https://www.ft.lk/opinion/Condemning-surveillance-harassment-and-intimidation-of-journalist-Kumanan-Kanapathipillai/14-782635	en	dailyftlk	1759778018.0
lk_news	2025-10-07-dailyftlk-33dbf890	dailyftlk-33dbf890	2025-10-07	Aruni Shapiro introduces Adam Smith to Sri Lanka’s readers	https://www.ft.lk/columns/Aruni-Shapiro-introduces-Adam-Smith-to-Sri-Lanka-s-readers/4-782633	en	dailyftlk	1759777657.0
lk_news	2025-10-07-dailyftlk-456215c8	dailyftlk-456215c8	2025-10-07	Being Buddhist during genocide	https://www.ft.lk/columns/Being-Buddhist-during-genocide/4-782632	en	dailyftlk	1759776942.0
lk_news	2025-10-06-dailyftlk-ce82e85f	dailyftlk-ce82e85f	2025-10-06	Elevating Sri Lankan brands on the global stage	https://www.ft.lk/business/Elevating-Sri-Lankan-brands-on-the-global-stage/34-782625	en	dailyftlk	1759772019.0
lk_news	2025-10-06-dailyftlk-40820ca3	dailyftlk-40820ca3	2025-10-06	Signature partners CH17 Loyalty to elevate style with rewards	https://www.ft.lk/business/Signature-partners-CH17-Loyalty-to-elevate-style-with-rewards/34-782624	en	dailyftlk	1759771838.0
lk_news	2025-10-06-islandlk-948acbd8	islandlk-948acbd8	2025-10-06	New role for singer Alston Koch	http://island.lk/new-role-for-singer-alston-koch/	en	islandlk	1759770960.0
lk_news	2025-10-06-islandlk-eeff3880	islandlk-eeff3880	2025-10-06	Bouquets for Michael de Silva	http://island.lk/bouquets-for-michael-de-silva/	en	islandlk	1759770780.0
lk_news	2025-10-06-tamilmirrorlk-edfaa363	tamilmirrorlk-edfaa363	2025-10-06	விபத்தில் சிக்கினார் விஜய் தேவரகொண்டா	https://www.tamilmirror.lk/cinema/விபத்தில்-சிக்கினார்-விஜய்-தேவரகொண்டா/54-365856	ta	tamilmirrorlk	1759770374.0
lk_news	2025-10-06-islandlk-71b948d5	islandlk-71b948d5	2025-10-06	Retail Industry Technology Trends 2025 – Kandy Edition introduces next-gen AI and smart retail solutions	http://island.lk/retail-industry-technology-trends-2025-kandy-edition-introduces-next-gen-ai-and-smart-retail-solutions/	en	islandlk	1759769340.0
lk_news	2025-10-06-islandlk-e3026e3c	islandlk-e3026e3c	2025-10-06	Sun Siyam Pasikudah wins Best Global Hotel Design at Homes & Gardens’ Design Awards 2025	http://island.lk/sun-siyam-pasikudah-wins-best-global-hotel-design-at-homes-gardens-design-awards-2025/	en	islandlk	1759769280.0
lk_news	2025-10-06-islandlk-12dd7377	islandlk-12dd7377	2025-10-06	FitsAir celebrates three years of passenger operations	http://island.lk/fitsair-celebrates-three-years-of-passenger-operations/	en	islandlk	1759769220.0
lk_news	2025-10-06-islandlk-c09def1c	islandlk-c09def1c	2025-10-06	Central Bank of Sri Lanka releases “Sri Lanka Socio-Economic Data – 2025”	http://island.lk/central-bank-of-sri-lanka-releases-sri-lanka-socio-economic-data-2025/	en	islandlk	1759768980.0
lk_news	2025-10-06-islandlk-08f176e2	islandlk-08f176e2	2025-10-06	HUTCH honored among Sri Lanka’s Best Employer Brands 2025	http://island.lk/hutch-honored-among-sri-lankas-best-employer-brands-2025/	en	islandlk	1759768920.0
lk_news	2025-10-06-islandlk-cb089116	islandlk-cb089116	2025-10-06	Gamer.LK dominates video games marketing category with Gold Award at SLIM DIGIS 2.5	http://island.lk/gamer-lk-dominates-video-games-marketing-category-with-gold-award-at-slim-digis-2-5/	en	islandlk	1759768860.0
lk_news	2025-10-06-islandlk-66b099cc	islandlk-66b099cc	2025-10-06	Parental Intelligence, ‘Sri Lanka’s first parenting AI companion’	http://island.lk/parental-intelligence-sri-lankas-first-parenting-ai-companion/	en	islandlk	1759768800.0
lk_news	2025-10-06-lankadeepalk-8124ddd9	lankadeepalk-8124ddd9	2025-10-06	උඩු මහලින් වැටුණු හිමි නම අපවත් වෙති	https://www.lankadeepa.lk/latest_news/උඩ-මහලන-වටණ-හම-නම-අපවත-වත/1-680811	si	lankadeepalk	1759768145.0
lk_news	2025-10-06-virakesarilk-81041e33	virakesarilk-81041e33	2025-10-06	யாழில் போதைப்பொருள் வாங்குவதற்கு சகோதரி பணம் கொடுக்காததால் சகோதரன் உயிர்மாய்ப்பு!	https://www.virakesari.lk/article/227064	ta	virakesarilk	1759767540.0
lk_news	2025-10-06-lankadeepalk-b5e5d722	lankadeepalk-b5e5d722	2025-10-06	බෝලය ගන්න තටාකයට පැන්න සිසුවා ගිලි මරුට	https://www.lankadeepa.lk/latest_news/බලය-ගනන-තටකයට-පනන-සසව-ගල-මරට/1-680810	si	lankadeepalk	1759767460.0
lk_news	2025-10-06-virakesarilk-3c9527a7	virakesarilk-3c9527a7	2025-10-06	தலைமன்னார் கட்டுகாரன் குடியிருப்பு குடிநீர் திட்டம் ; வைபவ ரீதியாக ஆரம்பித்து வைப்பு	https://www.virakesari.lk/article/227063	ta	virakesarilk	1759767420.0
lk_news	2025-10-06-lankadeepalk-e2b32f5b	lankadeepalk-e2b32f5b	2025-10-06	නිල්වැල්ල මුහුදේ තිදෙනෙක් ගසාන යති	https://www.lankadeepa.lk/latest_news/නලවලල-මහද-තදනක-ගසන-යත/1-680809	si	lankadeepalk	1759766952.0
lk_news	2025-10-06-virakesarilk-958e7d81	virakesarilk-958e7d81	2025-10-06	வெடுக்குநாறி மலை ஆதி சிவன் ஆலய முன்னாள் தலைவர் மற்றும் செயலாளரை ரிஐடி விசாரணைக்கு அழைப்பு	https://www.virakesari.lk/article/227061	ta	virakesarilk	1759766820.0
lk_news	2025-10-06-lankadeepalk-1279d419	lankadeepalk-1279d419	2025-10-06	ඇමැතිවරුන් පත් කර ප්‍රංශ අගමැති ඉල්ලා අස්වේ	https://www.lankadeepa.lk/news/ඇමතවරන-පත-කර-පරශ-අගමත-ඉලල-අසව/101-680808	si	lankadeepalk	1759766286.0
lk_news	2025-10-06-lankadeepalk-7b7838a5	lankadeepalk-7b7838a5	2025-10-06	කායික විද්‍යාව හෝ වෛද්‍ය විද්‍යාව සඳහා වන නොබෙල් ත්‍යාගයට තිදෙනෙක්	https://www.lankadeepa.lk/news/කයක-වදයව-හ-වදය-වදයව-සඳහ-වන-නබල-තයගයට-තදනක/101-680807	si	lankadeepalk	1759766023.0
lk_news	2025-10-06-lankadeepalk-ca7bd770	lankadeepalk-ca7bd770	2025-10-06	හෙට ඇරැඹෙන පාර්ලිමේන්තු සතියේ වැඩ වෙන්නෙ මෙහෙමයි	https://www.lankadeepa.lk/news/හට-ඇරඹන-පරලමනත-සතය-වඩ-වනන-මහමය/101-680806	si	lankadeepalk	1759765780.0
lk_news	2025-10-06-lankadeepalk-b42058ae	lankadeepalk-b42058ae	2025-10-06	වකුගඩු එන්නත් කටුවෙන් ලොකු ගැහිල්ලක්	https://www.lankadeepa.lk/news/වකගඩ-එනනත-කටවන-ලක-ගහලලක/101-680805	si	lankadeepalk	1759765505.0
lk_news	2025-10-06-adalk-367b80cc	adalk-367b80cc	2025-10-06	තැපෑල තව දුරටත් භාණ්ඩාගාරයට බරක් විය යුතු නැහැ	https://www.ada.lk/breaking_news/තැපෑල-තව-දුරටත්-භාණ්ඩාගාරයට-බරක්-විය-යුතු-නැහැ/11-418942	si	adalk	1759765379.0
lk_news	2025-10-06-lankadeepalk-8443d000	lankadeepalk-8443d000	2025-10-06	මුරුතවෙල ජලාශයේ ගිලී ගුරුවරයෙකු මරුට	https://www.lankadeepa.lk/news/මරතවල-ජලශය-ගල-ගරවරයක-මරට/101-680804	si	lankadeepalk	1759764034.0
lk_news	2025-10-06-virakesarilk-47a92675	virakesarilk-47a92675	2025-10-06	மேற்கிந்தியத் தீவுகளின் முன்னாள் சகலதுறை வீரர் பெர்னார்ட் ஜூலியன் மறைவு	https://www.virakesari.lk/article/227060	ta	virakesarilk	1759763580.0
lk_news	2025-10-06-virakesarilk-5dc53c38	virakesarilk-5dc53c38	2025-10-06	பெல்லன்வில ரஜமஹா விகாரையின் “மெனிக்க” யானை உயிரிழப்பு	https://www.virakesari.lk/article/227059	ta	virakesarilk	1759763220.0
lk_news	2025-10-06-lankadeepalk-936c2ab2	lankadeepalk-936c2ab2	2025-10-06	හිටපු මැති ඇමැති 40ගේ බැංකු ගිණුම් අවුස්සයි	https://www.lankadeepa.lk/news/හටප-මත-ඇමත-40ග-බක-ගණම-අවසසය/101-680803	si	lankadeepalk	1759761713.0
lk_news	2025-10-06-lankadeepalk-279b70b4	lankadeepalk-279b70b4	2025-10-06	මන්ත්‍රී  “පැන්ෂන්” කපන පනත අවසන් සෝදිසියේ	https://www.lankadeepa.lk/news/මනතර-පනෂන-කපන-පනත-අවසන-සදසය/101-680802	si	lankadeepalk	1759760885.0
lk_news	2025-10-06-tamilmirrorlk-e46843cc	tamilmirrorlk-e46843cc	2025-10-06	”மஹிந்தவை தூக்கிலிட வேண்டும்”	https://www.tamilmirror.lk/செய்திகள்/மஹிந்தவை-தூக்கிலிட-வேண்டும்/175-365841	ta	tamilmirrorlk	1759760299.0
lk_news	2025-10-06-tamilmirrorlk-01887600	tamilmirrorlk-01887600	2025-10-06	​​சில அவசரகால பிரச்சினைகளுக்கு தீர்வு காண்பது கடினம்-அமைச்சர்	https://www.tamilmirror.lk/செய்திகள்/சில-அவசரகால-பிரச்சினைகளுக்கு-தீர்வு-காண்பது-கடினம்-அமைச்சர்/175-365840	ta	tamilmirrorlk	1759759763.0
lk_news	2025-10-06-colombotelegraphcom-bdf723f3	colombotelegraphcom-bdf723f3	2025-10-06	Aruni Shapiro Introduces Adam Smith To Sri Lanka’s Readers	https://www.colombotelegraph.com/index.php/aruni-shapiro-introduces-adam-smith-to-sri-lankas-readers/	en	colombotelegraphcom	1759758135.0
lk_news	2025-10-06-tamilmirrorlk-0975b4e8	tamilmirrorlk-0975b4e8	2025-10-06	”கம்மன்பிலவும் விமலும் நீண்ட காலமாக லூசு போல் பேசி வருகின்றனர்”	https://www.tamilmirror.lk/செய்திகள்/கம்மன்பிலவும்-விமலும்-நீண்ட-காலமாக-லூசு-போல்-பேசி-வருகின்றனர்/175-365839	ta	tamilmirrorlk	1759758084.0
lk_news	2025-10-06-virakesarilk-b5c4bbff	virakesarilk-b5c4bbff	2025-10-06	கம்மன்பில, விமல் விசாரணைகளுக்கு முன்னிலையாக வேண்டும் - தொழில் பிரதி அமைச்சர் மஹிந்த ஜயசிங்க	https://www.virakesari.lk/article/227058	ta	virakesarilk	1759755300.0
lk_news	2025-10-06-adalk-cf922d9f	adalk-cf922d9f	2025-10-06	එන්නත් කටු හිඟය නිසා රු. 100 රුධිර කාන්දුකරන එන්නත් කටුවක් රු 760ට විකුණයි	https://www.ada.lk/breaking_news/එන්නත්-කටු-හිඟය-නිසා-රු--100-රුධිර-කාන්දුකරන-එන්නත්-කටුවක්-රු-760ට-විකුණයි/11-418941	si	adalk	1759754424.0
lk_news	2025-10-06-adalk-6b0e90fe	adalk-6b0e90fe	2025-10-06	ගම්පොල අනතුරකින් තිදෙනෙක් මරුට	https://www.ada.lk/breaking_news/ගම්පොල-අනතුරකින්-තිදෙනෙක්-මරුට/11-418940	si	adalk	1759753957.0
lk_news	2025-10-06-virakesarilk-af387cf9	virakesarilk-af387cf9	2025-10-06	பாடசாலையை இலக்குவைத்தே புதிய சட்டமூலம் வருகிறது - இலங்கை ஆசிரியர் சேவை சங்கத்தின் தலைவர் தெரிவிப்பு	https://www.virakesari.lk/article/227057	ta	virakesarilk	1759753560.0
lk_news	2025-10-06-virakesarilk-f149a93a	virakesarilk-f149a93a	2025-10-06	சோமாவதி விகாரையின் வரலாற்றில் நுழைவதற்கு வாய்ப்பு ஏற்பட்டுள்ளது  - அமைச்சர் சுனில் செனெவி	https://www.virakesari.lk/article/227051	ta	virakesarilk	1759753140.0
lk_news	2025-10-06-virakesarilk-5f4c3c4d	virakesarilk-5f4c3c4d	2025-10-06	பல்கலைகளில் வெற்றிடங்களை  நிரப்புவதற்கு அரசாங்கம் அனுமதி	https://www.virakesari.lk/article/227049	ta	virakesarilk	1759753080.0
lk_news	2025-10-06-virakesarilk-2e0cd64a	virakesarilk-2e0cd64a	2025-10-06	மூன்றிலொரு பங்கால் பிறப்பு வீதம் வீழ்ச்சி	https://www.virakesari.lk/article/227055	ta	virakesarilk	1759752060.0
lk_news	2025-10-06-virakesarilk-5d6e5f73	virakesarilk-5d6e5f73	2025-10-06	வீட்டுத் திட்டத்தில் பெயர் பொறிக்க சஜித் 2 கோடி ஊழல் மோசடி ; விசாரணை முன்னெடுப்பு - கந்தசாமி பிரபு	https://www.virakesari.lk/article/227054	ta	virakesarilk	1759751940.0
lk_news	2025-10-06-virakesarilk-2ce58359	virakesarilk-2ce58359	2025-10-06	தாஜூதீன் கொலை தொடர்பில் வெகுவிரைவில் உண்மைகள் வெளிப்படுத்தப்படும்  - பிரதி அமைச்சர் சுனில் வட்டகல	https://www.virakesari.lk/article/227031	ta	virakesarilk	1759750740.0
lk_news	2025-10-06-virakesarilk-1db8917f	virakesarilk-1db8917f	2025-10-06	ஜனாதிபதி ஆணைக்குழுவை அமைத்து  மஹிந்தவை விசாரணை செய்யுங்கள் -  சரத்பொன்சேகா பரபரப்பு குற்றச்சாட்டு	https://www.virakesari.lk/article/227047	ta	virakesarilk	1759750560.0
lk_news	2025-10-06-virakesarilk-c8cc2e70	virakesarilk-c8cc2e70	2025-10-06	நான் ஜனாதிபதியாகியிருந்தால் மஹிந்த கைதாகியிருப்பார் - சரத் பொன்சேக்கா	https://www.virakesari.lk/article/227046	ta	virakesarilk	1759750140.0
lk_news	2025-10-06-virakesarilk-1d638593	virakesarilk-1d638593	2025-10-06	பௌர்ணமி விடுமுறை நாளில் மதுபானம் விற்பனை - சந்தேக நபர் சிக்கியது எப்படி?	https://www.virakesari.lk/article/227050	ta	virakesarilk	1759750140.0
