doc_type	doc_id	num	date_str	description	url_metadata	lang	newspaper_id	time_ut
lk_news	2025-11-03-lankadeepalk-426f5e9c	lankadeepalk-426f5e9c	2025-11-03	කුඩු සමග ඇල්ලූ ධීවරයන් රඳවා ප්‍රශ්න කරන්න අවසර	https://www.lankadeepa.lk/news/කඩ-සමග-ඇලල-ධවරයන-රඳව-පරශන-කරනන-අවසර/101-682617	si	lankadeepalk	1762182825.0
lk_news	2025-11-03-lankadeepalk-2c40ea17	lankadeepalk-2c40ea17	2025-11-03	ගුවන් අනතුරැ වළක්වන පෙරහුරැවක්	https://www.lankadeepa.lk/latest_news/ගවන-අනතර-වළකවන-පරහරවක/1-682616	si	lankadeepalk	1762182556.0
lk_news	2025-11-03-virakesarilk-3ed3ac69	virakesarilk-3ed3ac69	2025-11-03	டில்லி சென்றடைந்தார் எதிர்க்கட்சி தலைவர் சஜித் மோடியுடனான சந்திப்புக்கு எவ்வித ஏற்பாடும் இல்லை	https://www.virakesari.lk/article/229419	ta	virakesarilk	1762180260.0
lk_news	2025-11-03-lankadeepalk-cadd605b	lankadeepalk-cadd605b	2025-11-03	’’බදාදා සුනාමි පෙරහුරුවක්’’	https://www.lankadeepa.lk/news/බදද-සනම-පරහරවක/101-682615	si	lankadeepalk	1762179628.0
lk_news	2025-11-03-lankadeepalk-46340e62	lankadeepalk-46340e62	2025-11-03	කඩවතින් යන එන අයට පොලිසියෙන් දැනුම් දීමක්	https://www.lankadeepa.lk/news/කඩවතන-යන-එන-අයට-පලසයන-දනම-දමක/101-682614	si	lankadeepalk	1762179325.0
lk_news	2025-11-03-virakesarilk-b1c5073e	virakesarilk-b1c5073e	2025-11-03	இலங்கை கடற்பரப்பில் மீன் பிடித்த 35 தமிழ்நாட்டு மீனவர்கள் கைது	https://www.virakesari.lk/article/229418	ta	virakesarilk	1762178880.0
lk_news	2025-11-03-tamilmirrorlk-5a421a65	tamilmirrorlk-5a421a65	2025-11-03	அரச பொறியியல் கூட்டுத்தாபனத்தின் முன்னாள் நிர்வாக பணிப்பாளர் கைது	https://www.tamilmirror.lk/செய்திகள்/அரச-பொறியியல்-கூட்டுத்தாபனத்தின்-முன்னாள்-நிர்வாக-பணிப்பாளர்-கைது/175-367291	ta	tamilmirrorlk	1762177815.0
lk_news	2025-11-03-virakesarilk-8ce60ca0	virakesarilk-8ce60ca0	2025-11-03	வவுனியாவில் மரணித்த பல்கலைக்கழக மாணவனின் உடற்கூற்று மாதிரிகள் கொழும்புக்கு அனுப்பி வைப்பு	https://www.virakesari.lk/article/229417	ta	virakesarilk	1762177740.0
lk_news	2025-11-03-virakesarilk-0296fff1	virakesarilk-0296fff1	2025-11-03	கொழும்பு - கண்டி பிரதான வீதியில் போக்குவரத்து கட்டுப்பாடுகள் - பொலிஸ் ஊடகப் பிரிவு அறிவிப்பு	https://www.virakesari.lk/article/229416	ta	virakesarilk	1762176240.0
lk_news	2025-11-03-adalk-129c9129	adalk-129c9129	2025-11-03	මධ්‍යම අධිවේගයේ ඉදිකිරිම් හේතුවෙන් කොළඹ නුවර පාරේ මංතීරුවක් වසා තැබෙයි	https://www.ada.lk/breaking_news/මධ්‍යම-අධිවේගයේ-ඉදිකිරිම්-හේතුවෙන්-කොළඹ-නුවර-පාරේ-මංතීරුවක්-වසා-තැබෙයි/11-419479	si	adalk	1762175896.0
lk_news	2025-11-03-lankadeepalk-ba14d8bc	lankadeepalk-ba14d8bc	2025-11-03	ජාතික ලොතරැයි මණ්ඩලය ආදායම් ඉලක්කය ඉක්මවයි	https://www.lankadeepa.lk/latest_news/ජතක-ලතරය-මණඩලය-ආදයම-ඉලකකය-ඉකමවය/1-682613	si	lankadeepalk	1762174891.0
lk_news	2025-11-03-virakesarilk-ad8f922e	virakesarilk-ad8f922e	2025-11-03	புட்டபர்த்தி சாய்பாபாவின் புகழைப் போற்றும் 'அனந்தா '	https://www.virakesari.lk/article/229415	ta	virakesarilk	1762174680.0
lk_news	2025-11-03-virakesarilk-8e2b0cf0	virakesarilk-8e2b0cf0	2025-11-03	அறிமுக நடிகர் மதி நடிக்கும் 'கும்கி 2' படத்தின் முதல் பாடல் வெளியீடு	https://www.virakesari.lk/article/229414	ta	virakesarilk	1762174500.0
lk_news	2025-11-03-virakesarilk-40725d26	virakesarilk-40725d26	2025-11-03	இயக்குநர் லோகேஷ் கனகராஜ் நடிக்கும் 'டி சி ' ( D C) படத்தின் பிரத்யேக காணொளி வெளியீடு	https://www.virakesari.lk/article/229413	ta	virakesarilk	1762174320.0
lk_news	2025-11-03-virakesarilk-bf08a246	virakesarilk-bf08a246	2025-11-03	நடிகர் சிவராஜ் குமார் நடிக்கும் '45' படத்தின் அப்டேட்	https://www.virakesari.lk/article/229412	ta	virakesarilk	1762174140.0
lk_news	2025-11-03-lankadeepalk-bd6a7b08	lankadeepalk-bd6a7b08	2025-11-03	රට පුරා කාන්තාවන්ට නොමිලේ රෝග පරීක්ෂාවක්	https://www.lankadeepa.lk/news/රට-පර-කනතවනට-නමල-රග-පරකෂවක/101-682612	si	lankadeepalk	1762174087.0
lk_news	2025-11-03-lankadeepalk-c89aba5f	lankadeepalk-c89aba5f	2025-11-03	හැඳුනුම්පත් එක් දින සේවය වයඹට	https://www.lankadeepa.lk/news/හඳනමපත-එක-දන-සවය-වයඹට/101-682611	si	lankadeepalk	1762173672.0
lk_news	2025-11-03-virakesarilk-f33668af	virakesarilk-f33668af	2025-11-03	மட்டக்களப்பில் இரு வேறு பிரதேசங்களில் போதைப்பொருள், கசிப்பு விற்பனையில் ஈடுபட்ட இருவர் கைது	https://www.virakesari.lk/article/229408	ta	virakesarilk	1762173000.0
lk_news	2025-11-03-lankadeepalk-e6341f8b	lankadeepalk-e6341f8b	2025-11-03	රාජ්‍ය සේවා පත්වීම් වල වැඩි පංගුවක් සෞඛ්‍යට	https://www.lankadeepa.lk/news/රජය-සව-පතවම-වල-වඩ-පගවක-සඛයට/101-682610	si	lankadeepalk	1762172455.0
lk_news	2025-11-03-virakesarilk-d7e7eb63	virakesarilk-d7e7eb63	2025-11-03	ஆட்பதிவு திணைக்களத்தின் வடமேல் மாகாண அலுவலகத்தின் ஒருநாள் சேவை கடமைகள் இன்று ஆரம்பம்!	https://www.virakesari.lk/article/229411	ta	virakesarilk	1762172100.0
lk_news	2025-11-03-virakesarilk-39144ced	virakesarilk-39144ced	2025-11-03	நடிகர் ஆனந்தராஜ் நடித்திருக்கும் 'மெட்ராஸ் மாஃபியா கம்பனி' படத்தின் இசை மற்றும் முன்னோட்டம் வெளியீடு	https://www.virakesari.lk/article/229410	ta	virakesarilk	1762171980.0
lk_news	2025-11-03-virakesarilk-3be8818f	virakesarilk-3be8818f	2025-11-03	சித்தார்த் நடிக்கும் 'ஆபரேஷன் சஃபேத் சாகர் ' இணையத் தொடரின் டீசர் வெளியீடு	https://www.virakesari.lk/article/229409	ta	virakesarilk	1762171800.0
lk_news	2025-11-03-virakesarilk-75308430	virakesarilk-75308430	2025-11-03	மீண்டும் வெளியாகும் சேரனின் 'ஆட்டோகிராப் '	https://www.virakesari.lk/article/229407	ta	virakesarilk	1762171560.0
lk_news	2025-11-03-virakesarilk-4fd4c48d	virakesarilk-4fd4c48d	2025-11-03	யூடியூபர் சாலிய டி ரணவக்க தாய்லாந்தில் கைது!	https://www.virakesari.lk/article/229390	ta	virakesarilk	1762171440.0
lk_news	2025-11-03-lankadeepalk-476f9a5f	lankadeepalk-476f9a5f	2025-11-03	ඉංජිනේරු සංස්ථාවේ හිටපු අධ්‍යක්ෂට ඇප	https://www.lankadeepa.lk/news/ඉජනර-සසථව-හටප-අධයකෂට-ඇප/101-682609	si	lankadeepalk	1762170988.0
lk_news	2025-11-03-virakesarilk-3ff16a16	virakesarilk-3ff16a16	2025-11-03	தலவாக்கலை தமிழ் மகா வித்தியாலயத்திற்கான கேட்போர் கூடம் நிர்மாணிப்பதற்கு அடிக்கல் நாட்டு விழா!	https://www.virakesari.lk/article/229404	ta	virakesarilk	1762170840.0
lk_news	2025-11-03-lankadeepalk-3eaafd4b	lankadeepalk-3eaafd4b	2025-11-03	භික්ෂුණියකට තර්ජනය කළ දෙදෙනෙකු අත්අඩංගුවට	https://www.lankadeepa.lk/videos/භික්ෂුණියකට-තර්ජනය-කළ-දෙදෙනෙකු-අත්අඩංගුවට/12-682608	si	lankadeepalk	1762170831.0
lk_news	2025-11-03-lankadeepalk-34cad496	lankadeepalk-34cad496	2025-11-03	හොර සහතික දුන් විදෙස් රැකියා පුහුණු ආයතනයක් තහනම් කරයි	https://www.lankadeepa.lk/news/හර-සහතක-දන-වදස-රකය-පහණ-ආයතනයක-තහනම-කරය/101-682607	si	lankadeepalk	1762170143.0
lk_news	2025-11-03-virakesarilk-7da47a2a	virakesarilk-7da47a2a	2025-11-03	பனங்கட்டிகொட்டு மீனவர்சங்கத்தை சந்தித்தார் துரைராசா ரவிகரன்	https://www.virakesari.lk/article/229402	ta	virakesarilk	1762170120.0
lk_news	2025-11-03-lankadeepalk-c7d2c605	lankadeepalk-c7d2c605	2025-11-03	සමිද්ධි සමරකෝන්ට තනතුරක්	https://www.lankadeepa.lk/news/සමදධ-සමරකනට-තනතරක/101-682606	si	lankadeepalk	1762169965.0
lk_news	2025-11-03-tamilmirrorlk-ddb66c94	tamilmirrorlk-ddb66c94	2025-11-03	செம்மணி  3ஆம் கட்ட  அகழாய்வு  2026 இல்	https://www.tamilmirror.lk/செய்திகள்/செம்மணி-3ஆம்-கட்ட-அகழாய்வு-2026-இல்/175-367288	ta	tamilmirrorlk	1762169742.0
lk_news	2025-11-03-virakesarilk-e34bd94a	virakesarilk-e34bd94a	2025-11-03	Singer - MCA சுப்பர் பிறீமியர் லீக் கிரிக்கெட் : மெலிபன் பிஸ்கட்ஸ் நொக் அவுட் சம்பியனானது	https://www.virakesari.lk/article/229401	ta	virakesarilk	1762169160.0
lk_news	2025-11-03-virakesarilk-cc9d89ab	virakesarilk-cc9d89ab	2025-11-03	போதைப்பொருள் ஒழிப்புக்கு முழுமையான ஒத்துழைப்பு வழங்குவோம் ; சாகர காரியவசம்	https://www.virakesari.lk/article/229399	ta	virakesarilk	1762169100.0
lk_news	2025-11-03-virakesarilk-492898fe	virakesarilk-492898fe	2025-11-03	பாதாள உலக கும்பலைச் சேர்ந்த “சமபோஷ” கைது!	https://www.virakesari.lk/article/229400	ta	virakesarilk	1762168920.0
lk_news	2025-11-03-adalk-91644d18	adalk-91644d18	2025-11-03	තාවකාලික වැඩ තහනමට ලක්ව සිටි සැරයන් අත්තක් කඩා වැටි ජීවිතක්ෂයට	https://www.ada.lk/breaking_news/තාවකාලික-වැඩ-තහනමට-ලක්ව-සිටි-සැරයන්-අත්තක්-කඩා-වැටි-ජීවිතක්ෂයට/11-419478	si	adalk	1762168861.0
lk_news	2025-11-03-virakesarilk-49e2da5b	virakesarilk-49e2da5b	2025-11-03	தமிழ் அரசியல் கட்சிகள் தமிழ் மக்களை ஒரு தேசமாக காட்டி எழுப்புகின்ற வரலாற்று பயணத்தை சரியாக மேற்கொள்ளவில்லை ; சட்டத்தரணி மணிவண்ணன்	https://www.virakesari.lk/article/229397	ta	virakesarilk	1762168800.0
lk_news	2025-11-03-virakesarilk-7a0c4974	virakesarilk-7a0c4974	2025-11-03	வவுனியா மாநகரசபையால் அங்காடி வியாபாரிகளுக்கு 135 கடை ஒதுக்கீடு	https://www.virakesari.lk/article/229396	ta	virakesarilk	1762168680.0
lk_news	2025-11-03-virakesarilk-b6031477	virakesarilk-b6031477	2025-11-03	தெற்காசிய சிரேஷ்ட தடகள போட்டிகளில் பங்குபற்றி பதக்கங்களை வென்ற இலங்கை விமானப்படை வீர வீராங்கனைகள்  கௌரவிப்பு!	https://www.virakesari.lk/article/229394	ta	virakesarilk	1762168560.0
lk_news	2025-11-03-tamilmirrorlk-20f667a3	tamilmirrorlk-20f667a3	2025-11-03	விரிவுரையாளரின் பாலியல் வன்கொடுமை: சுயாதீன விசாரணை	https://www.tamilmirror.lk/செய்திகள்/விரிவுரையாளரின்-பாலியல்-வன்கொடுமை-சுயாதீன-விசாரணை/175-367287	ta	tamilmirrorlk	1762167848.0
lk_news	2025-11-03-virakesarilk-814c9f13	virakesarilk-814c9f13	2025-11-03	உள்நாட்டு ஆயுர்வேத சேவைக்கு 303 புதிய மருத்துவர்கள் நியமனம் - நளிந்த ஜயதிஸ்ஸ	https://www.virakesari.lk/article/229395	ta	virakesarilk	1762167840.0
lk_news	2025-11-03-virakesarilk-52ae688a	virakesarilk-52ae688a	2025-11-03	“கணேமுல்ல சஞ்சீவ”வின் கொலைக்கு பின்னால் ஐவர் உள்ளனர் - இஷாரா செவ்வந்தி	https://www.virakesari.lk/article/229392	ta	virakesarilk	1762167420.0
lk_news	2025-11-03-adalk-abfc425a	adalk-abfc425a	2025-11-03	’සමපෝෂ’  අත්අඩංගුවට	https://www.ada.lk/breaking_news/’සමපෝෂ’--අත්අඩංගුවට/11-419477	si	adalk	1762167391.0
lk_news	2025-11-03-tamilmirrorlk-bcea086f	tamilmirrorlk-bcea086f	2025-11-03	கடல்சார் ஒத்துழைப்புக்கு சவூதியுடன் பேச்சு	https://www.tamilmirror.lk/செய்திகள்/கடல்சார்-ஒத்துழைப்புக்கு-சவூதியுடன்-பேச்சு/175-367285	ta	tamilmirrorlk	1762167111.0
lk_news	2025-11-03-virakesarilk-a25198e8	virakesarilk-a25198e8	2025-11-03	இலங்கை சுங்கத்தின் வருமானம் மற்றும் செயலாற்றுகை குறித்து ஆராய்ந்த வழிவகைகள் பற்றிய குழு	https://www.virakesari.lk/article/229391	ta	virakesarilk	1762166940.0
lk_news	2025-11-03-tamilmirrorlk-a7f3782e	tamilmirrorlk-a7f3782e	2025-11-03	யாழ் இளைஞர்களை இலக்கு வைத்த இருவர் கைது	https://www.tamilmirror.lk/செய்திகள்/யாழ்-இளைஞர்களை-இலக்கு-வைத்த-இருவர்-கைது/175-367283	ta	tamilmirrorlk	1762166723.0
lk_news	2025-11-03-virakesarilk-f0e7eab1	virakesarilk-f0e7eab1	2025-11-03	கஞ்சா பயிரிட ஆறு நிறுவனங்களுக்கு பச்சைக்கொடி காட்டப்பட்டுள்ளதாக ஓமல்பே சோபித்த தேரர் தெரிவிப்பு	https://www.virakesari.lk/article/229385	ta	virakesarilk	1762166520.0
lk_news	2025-11-03-virakesarilk-0e53e46b	virakesarilk-0e53e46b	2025-11-03	தமிழ் மக்கள் கூட்டணியின் அலுவலகம் திறப்பு	https://www.virakesari.lk/article/229388	ta	virakesarilk	1762166460.0
lk_news	2025-11-03-tamilmirrorlk-f7986f4c	tamilmirrorlk-f7986f4c	2025-11-03	இரண்டு முன்னாள் உயர் அதிகாரிகள் கைது	https://www.tamilmirror.lk/செய்திகள்/இரண்டு-முன்னாள்-உயர்-அதிகாரிகள்-கைது/175-367281	ta	tamilmirrorlk	1762166039.0
lk_news	2025-11-03-tamilmirrorlk-70dce16a	tamilmirrorlk-70dce16a	2025-11-03	ஏலத்திற்கு புதிய டிஜிட்டல் முறைமை	https://www.tamilmirror.lk/செய்திகள்/ஏலத்திற்கு-புதிய-டிஜிட்டல்-முறைமை/175-367280	ta	tamilmirrorlk	1762165558.0
lk_news	2025-11-03-virakesarilk-c69b7091	virakesarilk-c69b7091	2025-11-03	களனிப் பல்கலைக்கழகத்தில் 'பங்கேற்பு ஜனநாயகம்' கற்கைநெறி ஆரம்பம் - அரச கிராமிய கள அதிகாரிகளுக்கு 40,000 ரூபா பெறுமதியான 100 புலமைப்பரிசில்கள்	https://www.virakesari.lk/article/229387	ta	virakesarilk	1762165500.0
lk_news	2025-11-03-virakesarilk-80e89619	virakesarilk-80e89619	2025-11-03	நவ சம சமாஜ கட்சியின் அரசியல் குழு உறுப்பினர் வல்லிபுரம் திருநாவுக்கரசு காலமானார்	https://www.virakesari.lk/article/229384	ta	virakesarilk	1762165380.0
lk_news	2025-11-03-virakesarilk-7d5c4bef	virakesarilk-7d5c4bef	2025-11-03	19 வயதுக்குட்பட்ட பெண்களுக்கான CAVA கரப்பந்தாட்டம் ; இலங்கை, கிர்கிஸ்தான், மாலைதீவுகள், நேபாளம் பங்கேற்பு	https://www.virakesari.lk/article/229386	ta	virakesarilk	1762165200.0
lk_news	2025-11-03-tamilmirrorlk-755d139a	tamilmirrorlk-755d139a	2025-11-03	தமிழக மீனவர்கள் 35 பேர் கைது:   விஜய் அதிரடி கோரிக்கை	https://www.tamilmirror.lk/செய்திகள்/தமிழக-மீனவர்கள்-35-பேர்-கைது-விஜய்-அதிரடி-கோரிக்கை/175-367279	ta	tamilmirrorlk	1762165173.0
lk_news	2025-11-03-tamilmirrorlk-3ae537c9	tamilmirrorlk-3ae537c9	2025-11-03	சமூக ஊடக ஆர்வலர் சாலிய கைது	https://www.tamilmirror.lk/செய்திகள்/சமூக-ஊடக-ஆர்வலர்-சாலிய-கைது/175-367278	ta	tamilmirrorlk	1762164790.0
lk_news	2025-11-03-lankadeepalk-c0fac921	lankadeepalk-c0fac921	2025-11-03	මන්ත්‍රීලාට පිස්තෝල දෙන්නේ මෙහෙමයි	https://www.lankadeepa.lk/news/මනතරලට-පසතල-දනන-මහමය/101-682601	si	lankadeepalk	1762164643.0
lk_news	2025-11-03-virakesarilk-0bb70d0f	virakesarilk-0bb70d0f	2025-11-03	அலி ரொஷானின் பிணை மனு மீதான விசாரணை டிசம்பர் மாதம்!	https://www.virakesari.lk/article/229383	ta	virakesarilk	1762164240.0
lk_news	2025-11-03-tamilmirrorlk-2e2525f6	tamilmirrorlk-2e2525f6	2025-11-03	வடக்கு, கிழக்கில்  அலங்கார  மீன் உற்பத்தி	https://www.tamilmirror.lk/செய்திகள்/வடக்கு-கிழக்கில்-அலங்கார-மீன்-உற்பத்தி/175-367276	ta	tamilmirrorlk	1762164132.0
lk_news	2025-11-03-virakesarilk-ae92c470	virakesarilk-ae92c470	2025-11-03	சட்டவிரோதமாக கசிப்பு உற்பத்தி பகுதி முற்றுகை ; பொலிஸ் விசேட அதிரடிப்படையினரை தாக்கிய குற்றச்சாட்டில் எழுவர் கைது!	https://www.virakesari.lk/article/229382	ta	virakesarilk	1762163760.0
lk_news	2025-11-03-virakesarilk-8960a860	virakesarilk-8960a860	2025-11-03	தமிழக மீனவர்கள் இலங்கை கடற்பரப்பில் நுழையாது இருக்க நடவடிக்கைகளை முன்னெடுக்க வேண்டும் - என்.எம்.ஆலம்	https://www.virakesari.lk/article/229381	ta	virakesarilk	1762163760.0
lk_news	2025-11-03-virakesarilk-28d8b887	virakesarilk-28d8b887	2025-11-03	105 கிலோகிராம் கேரள கஞ்சாவுடன் நான்கு பேர் கைது!	https://www.virakesari.lk/article/229380	ta	virakesarilk	1762163700.0
lk_news	2025-11-03-virakesarilk-8206e251	virakesarilk-8206e251	2025-11-03	மாம்பழ அறுவடையில் மாணவர்களின் ஒத்துழைப்புக்கு நன்றி – கல்முனை அஸ்-ஸுஹறா அதிபர்	https://www.virakesari.lk/article/229379	ta	virakesarilk	1762163400.0
lk_news	2025-11-03-virakesarilk-702e06dd	virakesarilk-702e06dd	2025-11-03	இலங்கை – சவூதி அரேபியா இடையே கடல்சார் ஒத்துழைப்பை வலுப்படுத்தல் குறித்து கலந்துரையாடல்	https://www.virakesari.lk/article/229378	ta	virakesarilk	1762163400.0
lk_news	2025-11-03-virakesarilk-aef1c6b6	virakesarilk-aef1c6b6	2025-11-03	ஆப்கானிஸ்தானில் சக்திவாய்ந்த நிலநடுக்கம்: 20 பேர் பலி; 320 பேர் காயம்	https://www.virakesari.lk/article/229377	ta	virakesarilk	1762162800.0
lk_news	2025-11-03-lankadeepalk-a9e2c618	lankadeepalk-a9e2c618	2025-11-03	උසස් පෙළ උපකාරක පන්ති   හෙට සිට තහනම්	https://www.lankadeepa.lk/news/උසස-පළ-උපකරක-පනත-හට-සට-තහනම/101-682600	si	lankadeepalk	1762162402.0
lk_news	2025-11-03-adalk-fe7871b4	adalk-fe7871b4	2025-11-03	වයඹ සරසවියේ අතවරය ගැන ස්වාධීන පරීක්ෂණයක්	https://www.ada.lk/breaking_news/වයඹ-සරසවියේ-අතවරය-ගැන-ස්වාධීන-පරීක්ෂණයක්/11-419476	si	adalk	1762162274.0
lk_news	2025-11-03-lankadeepalk-f21a620c	lankadeepalk-f21a620c	2025-11-03	අයවැය විවාදයේ දින ගණන වැඩි කරන්නැයි විපක්ෂයෙන් ඉල්ලීමක්	https://www.lankadeepa.lk/news/අයවය-වවදය-දන-ගණන-වඩ-කරනනය-වපකෂයන-ඉලලමක/101-682599	si	lankadeepalk	1762162266.0
lk_news	2025-11-03-virakesarilk-57b0e7bd	virakesarilk-57b0e7bd	2025-11-03	நீர்த் தாவர இழைய வளர்ப்பு குறித்து கலந்துரையாடல்	https://www.virakesari.lk/article/229376	ta	virakesarilk	1762162200.0
lk_news	2025-11-03-virakesarilk-1a94bcb8	virakesarilk-1a94bcb8	2025-11-03	செம்மணி புதைகுழிக்குள் வெள்ளம்	https://www.virakesari.lk/article/229375	ta	virakesarilk	1762162140.0
lk_news	2025-11-03-virakesarilk-6349d3b1	virakesarilk-6349d3b1	2025-11-03	தமிழர்களின் குடித்தொகைப் பெருக்கத்தில் பாரிய வீழ்ச்சி - ச.லலீசன் சுட்டிக்காட்டு	https://www.virakesari.lk/article/229373	ta	virakesarilk	1762161360.0
lk_news	2025-11-03-virakesarilk-d47d502c	virakesarilk-d47d502c	2025-11-03	டயலொக் ஜனாதிபதி தங்கக் கிண்ண கரபந்தாட்டத்தில் ரத்தனபால, ரன்தரு கழகங்கள் சம்பியனாகின	https://www.virakesari.lk/article/229370	ta	virakesarilk	1762161120.0
lk_news	2025-11-03-lankadeepalk-2225562c	lankadeepalk-2225562c	2025-11-03	බසයේ ගැටී යතුරුපැදිකරු මරුට	https://www.lankadeepa.lk/news/බසය-ගට-යතරපදකර-මරට/101-682598	si	lankadeepalk	1762160911.0
lk_news	2025-11-03-lankadeepalk-bad977f7	lankadeepalk-bad977f7	2025-11-03	සජිත් ඉන්දියාවට යයි	https://www.lankadeepa.lk/news/සජත-ඉනදයවට-යය/101-682597	si	lankadeepalk	1762160565.0
