doc_type	doc_id	num	date_str	description	url_metadata	lang	newspaper_id	time_ut
lk_news	2025-11-13-lankadeepalk-ba1c0fee	lankadeepalk-ba1c0fee	2025-11-13	නාවුල අයවැයත් පරදී	https://www.lankadeepa.lk/news/නවල-අයවයත-පරද/101-683111	si	lankadeepalk	1763039894.0
lk_news	2025-11-13-lankadeepalk-715a644e	lankadeepalk-715a644e	2025-11-13	කැප්පෙටිපොළලා- දොන් ජුවන් ධර්මපාලලා එකතු වෙලා	https://www.lankadeepa.lk/news/කපපටපළල-දන-ජවන-ධරමපලල-එකත-වල/101-683109	si	lankadeepalk	1763038584.0
lk_news	2025-11-13-virakesarilk-3a5187bb	virakesarilk-3a5187bb	2025-11-13	பதினொரு செயலாற்றுகை அறிக்கைகள், வருடாந்த அறிக்கைகள் ஆராயப்பட்டு துறைசார் மேற்பார்வைக் குழுவில் அனுமதிக்கப்பட்டன	https://www.virakesari.lk/article/230274	ta	virakesarilk	1763037840.0
lk_news	2025-11-13-virakesarilk-e1f87558	virakesarilk-e1f87558	2025-11-13	போதை மாத்திரைகளுடன் திருநாவற்குளத்தை சேர்ந்த இரு இளைஞர்கள் உட்பட்ட நான்கு  இளைஞர்கள் கைது	https://www.virakesari.lk/article/230275	ta	virakesarilk	1763037780.0
lk_news	2025-11-13-lankadeepalk-ba8cf3b9	lankadeepalk-ba8cf3b9	2025-11-13	‘‘භාණ්ඩාගාරයේ ට්‍රිලියනයේ කථාව කතන්දරයක්‘‘	https://www.lankadeepa.lk/latest_news/භණඩගරය-ටරලයනය-කථව-කතනදරයක/1-683108	si	lankadeepalk	1763037407.0
lk_news	2025-11-13-lankadeepalk-8781df25	lankadeepalk-8781df25	2025-11-13	අයවැය දෙවැනි වර කියවීමේ ඡන්දය අද	https://www.lankadeepa.lk/latest_news/අයවය-දවන-වර-කයවම-ඡනදය-අද/1-683107	si	lankadeepalk	1763036961.0
lk_news	2025-11-13-virakesarilk-a2018567	virakesarilk-a2018567	2025-11-13	மன்னாரில் மாவீரர்களின் பெற்றோர்கள் கௌரவிப்பு	https://www.virakesari.lk/article/230272	ta	virakesarilk	1763036880.0
lk_news	2025-11-13-virakesarilk-e80fd19a	virakesarilk-e80fd19a	2025-11-13	அமெரிக்காவில் 43 நாள் நீடித்த அரசு முடக்கம் முடிவு - சட்டமூலத்தில் கையெழுத்திட்டார் ட்ரம்ப்	https://www.virakesari.lk/article/230273	ta	virakesarilk	1763036760.0
lk_news	2025-11-13-lankadeepalk-0d93b52e	lankadeepalk-0d93b52e	2025-11-13	ඊසිකෑෂ් කුඩු ගත් දෙකක් මාට්ටු	https://www.lankadeepa.lk/latest_news/ඊසකෂ-කඩ-ගත-දකක-මටට/1-683106	si	lankadeepalk	1763036666.0
lk_news	2025-11-13-lankadeepalk-03d6ca35	lankadeepalk-03d6ca35	2025-11-13	ඇමේරිකාවට ශතය එපා වේ	https://www.lankadeepa.lk/latest_news/ඇමරකවට-ශතය-එප-ව/1-683105	si	lankadeepalk	1763036284.0
lk_news	2025-11-13-lankadeepalk-c1cf4c4d	lankadeepalk-c1cf4c4d	2025-11-13	දොඩංගොඩ අයවැය පරාදයි	https://www.lankadeepa.lk/latest_news/දඩගඩ-අයවය-පරදය/1-683104	si	lankadeepalk	1763035924.0
lk_news	2025-11-13-virakesarilk-3b157727	virakesarilk-3b157727	2025-11-13	இலங்கையில் சுயாதீன வழக்குத் தொடுநர் அலுவலகமானது சர்வதேசத்துக்கு காட்டும் கண் துடைப்பு அலுவலகம் - மூத்த சட்டத்தரணி கேஎஸ் இரத்தினவேல் தெரிவிப்பு!	https://www.virakesari.lk/article/230270	ta	virakesarilk	1763034600.0
lk_news	2025-11-13-virakesarilk-e4361db0	virakesarilk-e4361db0	2025-11-13	பாகிஸ்தானில் இலங்கை கிரிக்கெட் அணியினரின் உயிர்பாதுபாப்பு  கரிசணைகளை தீர்த்துவைக்க ஜனாதிபதி AKD தலையீடு	https://www.virakesari.lk/article/230271	ta	virakesarilk	1763034420.0
lk_news	2025-11-13-virakesarilk-03b06e9d	virakesarilk-03b06e9d	2025-11-13	யாழை வந்தடைந்தார் இந்திய பாராளுமன்ற உறுப்பினர் திருமாவளவன்!	https://www.virakesari.lk/article/230267	ta	virakesarilk	1763034000.0
lk_news	2025-11-13-virakesarilk-a354ed05	virakesarilk-a354ed05	2025-11-13	நாய்களால் மனைவியிடம் விவாகரத்து கோரிய கணவர்	https://www.virakesari.lk/article/230268	ta	virakesarilk	1763033880.0
lk_news	2025-11-13-virakesarilk-4392aa49	virakesarilk-4392aa49	2025-11-13	மசாஜ் நிலையம் என்ற போர்வையில் இயங்கிய மூன்று விபச்சார விடுதிகள் சுற்றிவளைப்பு!	https://www.virakesari.lk/article/230266	ta	virakesarilk	1763032560.0
lk_news	2025-11-13-virakesarilk-382326bb	virakesarilk-382326bb	2025-11-13	“முழு நாடுமே ஒன்றாக” போதைப்பொருள் சுற்றிவளைப்பில்  1,099 பேர் கைது!	https://www.virakesari.lk/article/230257	ta	virakesarilk	1763032560.0
lk_news	2025-11-13-virakesarilk-e0377925	virakesarilk-e0377925	2025-11-13	இணையவழி கடன் மாபியாவை எதிர்க்க நடவடிக்கை எடுக்க வேண்டும் – சஜித் பிரேமதாச	https://www.virakesari.lk/article/230265	ta	virakesarilk	1763032500.0
lk_news	2025-11-13-virakesarilk-a840e9d3	virakesarilk-a840e9d3	2025-11-13	நாட்டின் கடற்றொழில் துறையின் மேம்பாடு தொடர்பாக விசேட கலந்துரையாடல்	https://www.virakesari.lk/article/230263	ta	virakesarilk	1763032440.0
lk_news	2025-11-13-lankadeepalk-77b2fffd	lankadeepalk-77b2fffd	2025-11-13	ගයන්තගේ මාරක ළිදේ කතාවට ආණ්ඩුවෙන් උත්තරයක්	https://www.lankadeepa.lk/news/ගයනතග-මරක-ළද-කතවට-ආණඩවන-උතතරයක/101-683103	si	lankadeepalk	1763031897.0
lk_news	2025-11-13-adalk-bc7ec761	adalk-bc7ec761	2025-11-13	මට දැන් කියන්නෙ දුඹුරු සීනි පියා කියල	https://www.ada.lk/breaking_news/මට-දැන්-කියන්නෙ-දුඹුරු-සීනි-පියා-කියල/11-419679	si	adalk	1763031409.0
lk_news	2025-11-13-virakesarilk-e408b8b3	virakesarilk-e408b8b3	2025-11-13	முத்துநகர் விவசாயிகளின் விவசாய நிலங்கள் தொடர்பான பிரச்சினை குறித்து பிரதமர் அலுவலகத்தில் கலந்துரையாடல்!	https://www.virakesari.lk/article/230262	ta	virakesarilk	1763031360.0
lk_news	2025-11-13-virakesarilk-f67d1cd5	virakesarilk-f67d1cd5	2025-11-13	மூன்று புதிய தூதுவர்கள் மற்றும் இரண்டு உயர் ஸ்தானிகர்கள் ஜனாதிபதியிடம் நற்சான்றுப் பத்திரங்களை கையளித்தனர்	https://www.virakesari.lk/article/230258	ta	virakesarilk	1763031300.0
lk_news	2025-11-13-lankadeepalk-fb8501fb	lankadeepalk-fb8501fb	2025-11-13	රට පුරා පොදු ක්‍රීඩා පිටි හදනවා	https://www.lankadeepa.lk/news/රට-පර-පද-කරඩ-පට-හදනව/101-683102	si	lankadeepalk	1763031180.0
lk_news	2025-11-13-virakesarilk-2561e357	virakesarilk-2561e357	2025-11-13	பொலன்னறுவையில் ரயிலில் மோதி யானை உயிரிழப்பு!	https://www.virakesari.lk/article/230260	ta	virakesarilk	1763030880.0
lk_news	2025-11-13-tamilmirrorlk-2bacd8cd	tamilmirrorlk-2bacd8cd	2025-11-13	“பல உயிர்களைப் பலி கொடுக்கும் முன்னர், ஆராய்க ”	https://www.tamilmirror.lk/பிரசித்த-செய்தி/பல-உயிர்களைப்-பலி-கொடுக்கும்-முன்னர்-ஆராய்க/150-367893	ta	tamilmirrorlk	1763030547.0
lk_news	2025-11-13-virakesarilk-7d401ecf	virakesarilk-7d401ecf	2025-11-13	“உங்களுக்கு எத்தனை மனைவிகள்?” - சிரியா ஜனாதிபதியிடம் கேட்ட ட்ரம்ப்	https://www.virakesari.lk/article/230259	ta	virakesarilk	1763030340.0
lk_news	2025-11-13-lankadeepalk-7d8f755c	lankadeepalk-7d8f755c	2025-11-13	නව රාජතාන්ත්‍රිකයෝ පස් දෙනෙක් ජනපතිට අක්තපත්‍ර දෙති	https://www.lankadeepa.lk/news/නව-රජතනතරකය-පස-දනක-ජනපතට-අකතපතර-දත/101-683101	si	lankadeepalk	1763030021.0
lk_news	2025-11-13-adalk-ed716e6a	adalk-ed716e6a	2025-11-13	ලංකාවෙන් දෙබිඩි දරු උපතක් වාර්තා වෙයි	https://www.ada.lk/breaking_news/ලංකාවෙන්-දෙබිඩි-දරු-උපතක්-වාර්තා-වෙයි/11-419678	si	adalk	1763029618.0
lk_news	2025-11-13-lankadeepalk-6bfa39fa	lankadeepalk-6bfa39fa	2025-11-13	අස්සජී හිමියෝ දරුවන්ට තෑගිත් අරන් මීගහජදුරට වඩිති	https://www.lankadeepa.lk/news/අසසජ-හමය-දරවනට-තගත-අරන-මගහජදරට-වඩත/101-683100	si	lankadeepalk	1763029003.0
lk_news	2025-11-13-lankadeepalk-1b616f2c	lankadeepalk-1b616f2c	2025-11-13	ආණ්ඩුව දෙන සහන වලට බාල්දි දාන්න එපා	https://www.lankadeepa.lk/news/ආණඩව-දන-සහන-වලට-බලද-දනන-එප/101-683099	si	lankadeepalk	1763028750.0
lk_news	2025-11-13-virakesarilk-680bf676	virakesarilk-680bf676	2025-11-13	நாட்டில் ஐந்து பேரில் ஒருவருக்கு நீரிழிவு நோய் - சுகாதார அதிகாரிகள் எச்சரிக்கை	https://www.virakesari.lk/article/230254	ta	virakesarilk	1763028660.0
lk_news	2025-11-13-virakesarilk-306d3960	virakesarilk-306d3960	2025-11-13	போக்குவரத்து கடமைகளில் ஈடுபட்டிருந்த பொலிஸ் அதிகாரியை மன்னா கத்தியால் தாக்கிய மோட்டார் சைக்கிள் செலுத்துனர் கைது!	https://www.virakesari.lk/article/230256	ta	virakesarilk	1763028540.0
lk_news	2025-11-13-lankadeepalk-e69a8183	lankadeepalk-e69a8183	2025-11-13	මියගිය සිවිල් ආරක්ෂක සෙබළුන් පිරිසකගේ බිරින්දෑවරු උපවාසයක	https://www.lankadeepa.lk/news/මයගය-සවල-ආරකෂක-සබළන-පරසකග-බරනදවර-උපවසයක/101-683098	si	lankadeepalk	1763027604.0
lk_news	2025-11-13-virakesarilk-fecd117c	virakesarilk-fecd117c	2025-11-13	தேசிய கண் வைத்தியசாலையில் போதியளவான சத்திர சிகிச்சை அரங்குகள் இல்லை	https://www.virakesari.lk/article/230250	ta	virakesarilk	1763027460.0
lk_news	2025-11-13-virakesarilk-0fd2e653	virakesarilk-0fd2e653	2025-11-13	பதவிலிருந்து ஓய்வு பெறுவதாக தேர்தல்கள் ஆணையாளர் நாயகம் சமன் ஸ்ரீ ரத்நாயக்க அறிவிப்பு!	https://www.virakesari.lk/article/230252	ta	virakesarilk	1763027460.0
lk_news	2025-11-13-lankadeepalk-4c58a29d	lankadeepalk-4c58a29d	2025-11-13	දිල්ලියට තවත් ප්‍රහාර මාලාවක්?	https://www.lankadeepa.lk/latest_news/දලලයට-තවත-පරහර-මලවක/1-683097	si	lankadeepalk	1763027450.0
lk_news	2025-11-13-virakesarilk-863fedae	virakesarilk-863fedae	2025-11-13	எமிரேட்ஸ் ஏர்லைன்ஸ்: இலங்கை உள்ளிட்ட நாடுகளில் விமானப் பணியாளர்களுக்கு ஆட்சேர்ப்பு அறிவிப்பு	https://www.virakesari.lk/article/230247	ta	virakesarilk	1763026980.0
lk_news	2025-11-13-virakesarilk-2bc387b1	virakesarilk-2bc387b1	2025-11-13	2026 நிதியாண்டுக்கான ஒதுக்கீட்டுச் சட்டமூலம் தொடர்பில் தயாரிக்கப்பட்ட வரைபு அறிக்கை COPF குழுவில் பரிசீலிக்கப்பட்டது	https://www.virakesari.lk/article/230251	ta	virakesarilk	1763026920.0
lk_news	2025-11-13-virakesarilk-8d3d4898	virakesarilk-8d3d4898	2025-11-13	கிரிந்த பகுதியில் போதைப்பொருளுடன் கைதான சந்தேக நபர்களுக்கு 7 நாட்கள் தடுப்புகாவல்	https://www.virakesari.lk/article/230248	ta	virakesarilk	1763026560.0
lk_news	2025-11-13-lankadeepalk-76e3629f	lankadeepalk-76e3629f	2025-11-13	උතුරු මැද රෝහල්වල ප්‍රගතිය විමසයි	https://www.lankadeepa.lk/latest_news/උතර-මද-රහලවල-පරගතය-වමසය/1-683096	si	lankadeepalk	1763026450.0
lk_news	2025-11-13-tamilmirrorlk-0cad31c8	tamilmirrorlk-0cad31c8	2025-11-13	7 கடவுச்சீட்டுகள் வீதியோரத்தில் இருந்து மீட்பு	https://www.tamilmirror.lk/செய்திகள்/7-கடவுச்சீட்டுகள்-வீதியோரத்தில்-இருந்து-மீட்பு/175-367890	ta	tamilmirrorlk	1763025395.0
lk_news	2025-11-13-lankadeepalk-6d7078be	lankadeepalk-6d7078be	2025-11-13	කුච්චවේලි සභාපති යළි රිමාන්ඩ්	https://www.lankadeepa.lk/news/කචචවල-සභපත-යළ-රමනඩ/101-683095	si	lankadeepalk	1763024654.0
lk_news	2025-11-13-virakesarilk-0f93ab81	virakesarilk-0f93ab81	2025-11-13	போதைப்பொருளுடன் கைது செய்யப்பட்ட 5 இலங்கை மீனவர்கள் – மாலைத்தீவில் 30 நாட்கள் தடுப்புக்காவல்	https://www.virakesari.lk/article/230246	ta	virakesarilk	1763024520.0
lk_news	2025-11-13-lankadeepalk-7ac82a19	lankadeepalk-7ac82a19	2025-11-13	පොලිස් සැරයන්ට මන්නා පහරක්: සැකකරු අත්අඩංගුවට	https://www.lankadeepa.lk/news/පලස-සරයනට-මනන-පහරක-සකකර-අතඅඩගවට/101-683094	si	lankadeepalk	1763024248.0
lk_news	2025-11-13-tamilmirrorlk-5e2c3618	tamilmirrorlk-5e2c3618	2025-11-13	அனுரவுக்கு மற்றொரு தோல்வி	https://www.tamilmirror.lk/செய்திகள்/அனுரவுக்கு-மற்றொரு-தோல்வி/175-367887	ta	tamilmirrorlk	1763024113.0
lk_news	2025-11-13-virakesarilk-4b64ef3f	virakesarilk-4b64ef3f	2025-11-13	மலையகத்தின் மூத்த எழுத்தாளர் தி.இராஜகோபாலன் காலமானார்!	https://www.virakesari.lk/article/230243	ta	virakesarilk	1763023680.0
lk_news	2025-11-13-adalk-d864c4e7	adalk-d864c4e7	2025-11-13	බිරිඳගේ පොරෝ පහරින් තුවාල ලබා රෝහල් ගතව සිටි සැමියා මරුට	https://www.ada.lk/breaking_news/බිරිඳගේ-පොරෝ-පහරින්-තුවාල-ලබා-රෝහල්-ගතව-සිටි-සැමියා-මරුට/11-419674	si	adalk	1763023622.0
lk_news	2025-11-13-virakesarilk-94defaa6	virakesarilk-94defaa6	2025-11-13	விகாரையிலிருந்த விலையுயர்ந்த மாணிக்கக் கற்கள் திருட்டு!	https://www.virakesari.lk/article/230245	ta	virakesarilk	1763023620.0
lk_news	2025-11-13-lankadeepalk-6b9810bb	lankadeepalk-6b9810bb	2025-11-13	“කෝප්” සභාපතිගෙන්  වරප්‍රසාද ප්‍රශ්නයක්	https://www.lankadeepa.lk/news/කප-සභපතගන-වරපරසද-පරශනයක/101-683093	si	lankadeepalk	1763023423.0
lk_news	2025-11-13-tamilmirrorlk-c5ee5fd6	tamilmirrorlk-c5ee5fd6	2025-11-13	தங்கத்தின் விலை அதிரடியாக உயர்வு	https://www.tamilmirror.lk/செய்திகள்/தங்கத்தின்-விலை-அதிரடியாக-உயர்வு/175-367885	ta	tamilmirrorlk	1763023133.0
lk_news	2025-11-13-lankadeepalk-f01d802c	lankadeepalk-f01d802c	2025-11-13	පාර්ලිමේන්තුවට අභියෝග කරන්න පුළුවන් ජගතෙක් පිටත නැහැ	https://www.lankadeepa.lk/news/පරලමනතවට-අභයග-කරනන-පළවන-ජගතක-පටත-නහ/101-683092	si	lankadeepalk	1763023062.0
lk_news	2025-11-13-virakesarilk-ab4fa77d	virakesarilk-ab4fa77d	2025-11-13	கடும் மின்னல் தாக்கம் குறித்து பொதுமக்களுக்கு எச்சரிக்கை!	https://www.virakesari.lk/article/230244	ta	virakesarilk	1763022840.0
lk_news	2025-11-13-virakesarilk-e0179394	virakesarilk-e0179394	2025-11-13	“லொக்கு பெட்டி”யின்  சகாக்கள் இருவர் கைது!	https://www.virakesari.lk/article/230242	ta	virakesarilk	1763022540.0
lk_news	2025-11-13-adalk-a478d7e1	adalk-a478d7e1	2025-11-13	හැටන් ඩිපෝවේ ආදායම අඩුවෙයි	https://www.ada.lk/breaking_news/හැටන්-ඩිපෝවේ-ආදායම-අඩුවෙයි/11-419673	si	adalk	1763022488.0
lk_news	2025-11-13-lankadeepalk-b7e97ae7	lankadeepalk-b7e97ae7	2025-11-13	සල්ලි නෝට්ටු කතාවකට නාමල් අජිත් හැප්පෙති	https://www.lankadeepa.lk/news/සලල-නටට-කතවකට-නමල-අජත-හපපත/101-683091	si	lankadeepalk	1763022151.0
lk_news	2025-11-13-adalk-07f09421	adalk-07f09421	2025-11-13	වැඩි කල වැටුපට විරුද්ධවන අයට දේවසාපය ඉල්ලා පොල් ගසයි	https://www.ada.lk/breaking_news/වැඩි-කල-වැටුපට-විරුද්ධවන-අයට-දේවසාපය-ඉල්ලා-පොල්-ගසයි/11-419672	si	adalk	1763022052.0
lk_news	2025-11-13-lankadeepalk-28a07e2a	lankadeepalk-28a07e2a	2025-11-13	පාස්පෝට් 7ක් පුල්මුඩේ පාරක් අයිනේ	https://www.lankadeepa.lk/news/පසපට-7ක-පලමඩ-පරක-අයන/101-683090	si	lankadeepalk	1763021790.0
lk_news	2025-11-13-adalk-ad00448c	adalk-ad00448c	2025-11-13	2050දී ප්‍රති-ක්ෂුද්‍ර ජීවී ඖෂධ ප්‍රතිරෝධය හේතුවෙන් වාර්ෂිකව මිලියන 10 ක් මරුට	https://www.ada.lk/breaking_news/2050දී-ප්‍රති-ක්ෂුද්‍ර-ජීවී-ඖෂධ-ප්‍රතිරෝධය-හේතුවෙන්-වාර්ෂිකව-මිලියන-10-ක්-මරුට/11-419671	si	adalk	1763021766.0
lk_news	2025-11-13-lankadeepalk-b08a42e6	lankadeepalk-b08a42e6	2025-11-13	E-9 රැකියා වලට කොරියාවට 3469 ක් ගිහින්	https://www.lankadeepa.lk/news/E-9-රකය-වලට-කරයවට-3469-ක-ගහන/101-683089	si	lankadeepalk	1763021623.0
lk_news	2025-11-13-virakesarilk-9b00cf9f	virakesarilk-9b00cf9f	2025-11-13	டெல்லியில் நடந்தது ஒரு தெளிவான பயங்கரவாத தாக்குதல் - அமெரிக்க வெளியுறவுத்துறை செயலாளர்	https://www.virakesari.lk/article/230239	ta	virakesarilk	1763021460.0
lk_news	2025-11-13-adalk-94f680db	adalk-94f680db	2025-11-13	රාජ්‍ය සේවයට විධිමත් වැටුප් ව්‍යුහයක් සැකසීමට අතුරු වාර්තාවක්	https://www.ada.lk/breaking_news/රාජ්‍ය-සේවයට-විධිමත්-වැටුප්-ව්‍යුහයක්-සැකසීමට-අතුරු-වාර්තාවක්/11-419670	si	adalk	1763021197.0
lk_news	2025-11-13-tamilmirrorlk-1b07d9c1	tamilmirrorlk-1b07d9c1	2025-11-13	வெங்காய மாலைகளை அணிந்து வந்த உறுப்பினர்	https://www.tamilmirror.lk/செய்திகள்/வெங்காய-மாலைகளை-அணிந்து-வந்த-உறுப்பினர்/175-367884	ta	tamilmirrorlk	1763021095.0
lk_news	2025-11-13-tamilmirrorlk-030517f7	tamilmirrorlk-030517f7	2025-11-13	வெங்காய மலைகளை அணிந்து வந்த உறுப்பினர்	https://www.tamilmirror.lk/செய்திகள்/வெங்காய-மலைகளை-அணிந்து-வந்த-உறுப்பினர்/175-367884	ta	tamilmirrorlk	1763021095.0
lk_news	2025-11-13-virakesarilk-e8d2f938	virakesarilk-e8d2f938	2025-11-13	MSBA லீக் சுற்றுப்போட்டியில் சாம்பியன் பட்டம் வென்றது ஸ்ரீலங்கன் ஏர்லைன்ஸ் கூடைப்பந்தாட்ட அணி!	https://www.virakesari.lk/article/230237	ta	virakesarilk	1763021040.0
lk_news	2025-11-13-virakesarilk-2d00660a	virakesarilk-2d00660a	2025-11-13	2025 உலக நுண்ணுயிர் எதிர்ப்பு விழிப்புணர்வு வார தேசிய நிகழ்வு நாளை ஆரம்பம்	https://www.virakesari.lk/article/230236	ta	virakesarilk	1763020740.0
lk_news	2025-11-13-lankadeepalk-4840b666	lankadeepalk-4840b666	2025-11-13	මීගමු කලපුව දූෂණය වෙලා	https://www.lankadeepa.lk/news/මගම-කලපව-දෂණය-වල/101-683088	si	lankadeepalk	1763020615.0
lk_news	2025-11-13-adalk-b1488f6f	adalk-b1488f6f	2025-11-13	මේ  වසරේ දකුණු කොරියවට 3469 ක් ගිහින්	https://www.ada.lk/breaking_news/මේ--වසරේ-දකුණු-කොරියවට-3469-ක්-ගිහින්/11-419668	si	adalk	1763020492.0
lk_news	2025-11-13-lankadeepalk-5f06bb63	lankadeepalk-5f06bb63	2025-11-13	අපි මෙහෙම ඉන්න ඕන රටක් නෙමෙයි	https://www.lankadeepa.lk/news/අප-මහම-ඉනන-ඕන-රටක-නමය/101-683087	si	lankadeepalk	1763020181.0
lk_news	2025-11-13-virakesarilk-e8e178c1	virakesarilk-e8e178c1	2025-11-13	கானாவில் இராணுவத்துக்கு ஆட்சேர்ப்பு - சன நெரிசல் சிக்கி 6 பேர் பலி ; 22 பேர் படுகாயம்	https://www.virakesari.lk/article/230234	ta	virakesarilk	1763019840.0
lk_news	2025-11-13-virakesarilk-2f4b82cd	virakesarilk-2f4b82cd	2025-11-13	பஸ்ஸுடன் மோதி மோட்டார் சைக்கிள் விபத்து ; இளைஞன் பலி	https://www.virakesari.lk/article/230235	ta	virakesarilk	1763019660.0
lk_news	2025-11-13-virakesarilk-3217cb11	virakesarilk-3217cb11	2025-11-13	எமது பிரதேசத்துக்கான அபிவிருத்திகளையே ஜனாதிபதியிடம் கேட்டிருக்கிறோம் - பஸ்மின் ஷரீப்	https://www.virakesari.lk/article/230223	ta	virakesarilk	1763018760.0
lk_news	2025-11-13-virakesarilk-00df0d5e	virakesarilk-00df0d5e	2025-11-13	சமந்த வித்யாரத்ன ஊடங்களுக்கு குறிப்பிட்ட  கருத்துக்களால் எனது பாதுகாப்புக்கு அச்சுறுத்தல் - எஸ்.எம்.மரிக்கார்	https://www.virakesari.lk/article/230233	ta	virakesarilk	1763018760.0
