doc_type	doc_id	num	date_str	description	url_metadata	lang	newspaper_id	time_ut
lk_news	2025-10-16-virakesarilk-6d4008b7	virakesarilk-6d4008b7	2025-10-16	சாவகச்சேரியில் புகையிரத விபத்தில் பெண் உயிரிழப்பு	https://www.virakesari.lk/article/227931	ta	virakesarilk	1760634420.0
lk_news	2025-10-16-virakesarilk-394e3bc1	virakesarilk-394e3bc1	2025-10-16	யாழ்ப்பாணம், வேலணித்துறை பகுதியில் சட்டவிரோதமாக கடலட்டைகளை கொண்டு சென்ற இரண்டு நபர்கள் கைது	https://www.virakesari.lk/article/227930	ta	virakesarilk	1760634120.0
lk_news	2025-10-16-lankadeepalk-569fdfe5	lankadeepalk-569fdfe5	2025-10-16	පැරා ඔලිම්පික් පදක්කම් ලාබී සෙබළා දුම්රියේ ගැටිලා	https://www.lankadeepa.lk/news/පර-ඔලමපක-පදකකම-ලබ-සබළ-දමරය-ගටල/101-681502	si	lankadeepalk	1760627066.0
lk_news	2025-10-16-lankadeepalk-b5920d74	lankadeepalk-b5920d74	2025-10-16	රේගුවේ ඇති වාහන කොන්දේසිවලට යටත්ව මුදා හරියි	https://www.lankadeepa.lk/news/රගව-ඇත-වහන-කනදසවලට-යටතව-මද-හරය/101-681501	si	lankadeepalk	1760625652.0
lk_news	2025-10-16-virakesarilk-2b8f1de3	virakesarilk-2b8f1de3	2025-10-16	2026 ஆடவர் ரி20 உலகக் கிண்ணத்தில் விளையாட நேபாளம், ஓமான் தகுதி	https://www.virakesari.lk/article/227929	ta	virakesarilk	1760625600.0
lk_news	2025-10-16-lankadeepalk-dea8a9e0	lankadeepalk-dea8a9e0	2025-10-16	ශ්‍රී ලංකා රේගුව කප් එක ගහයි	https://www.lankadeepa.lk/news/ශර-ලක-රගව-කප-එක-ගහය/101-681500	si	lankadeepalk	1760625389.0
lk_news	2025-10-16-lankadeepalk-572ea03a	lankadeepalk-572ea03a	2025-10-16	සල්ලි අරන් නඩුවට නොආ ලෝයර්ගේ කබාය ගලවයි	https://www.lankadeepa.lk/news/සලල-අරන-නඩවට-නආ-ලයරග-කබය-ගලවය/101-681499	si	lankadeepalk	1760624419.0
lk_news	2025-10-16-lankadeepalk-429e2b09	lankadeepalk-429e2b09	2025-10-16	කළු සල්ලි සුදු කළැයි කපුවා කෝටි 33ක් සමග මාට්ටු	https://www.lankadeepa.lk/news/කළ-සලල-සද-කළය-කපව-කට-33ක-සමග-මටට/101-681498	si	lankadeepalk	1760623376.0
lk_news	2025-10-16-virakesarilk-f6b6ede4	virakesarilk-f6b6ede4	2025-10-16	கடன்மறுசீரமைப்பை அடுத்து இலங்கையின்  பொருளாதார செயலாக்கத்தில் முன்னேற்றம் - சர்வதேச நாணய நிதியம் பாராட்டு	https://www.virakesari.lk/article/227916	ta	virakesarilk	1760621580.0
lk_news	2025-10-16-virakesarilk-96d9d29f	virakesarilk-96d9d29f	2025-10-16	புகையிரத நிலைய  அதிபர் சங்கத்துக்கு  புதிய தலைவர், செயலாளர் நியமனம்	https://www.virakesari.lk/article/227917	ta	virakesarilk	1760621520.0
lk_news	2025-10-16-virakesarilk-006d2458	virakesarilk-006d2458	2025-10-16	பாராளுமன்ற உறுப்பினர்களின் சம்பளம் உள்ளிட்ட கொடுப்பனவுகளை கட்சி நிதியில் வரவு வைப்பதைத் தடை செய்யக் கோரும் தயாசிறி	https://www.virakesari.lk/article/227927	ta	virakesarilk	1760621460.0
lk_news	2025-10-16-virakesarilk-cac4b139	virakesarilk-cac4b139	2025-10-16	எதிர்பார்க்கப்பட்ட வரி வருவாயில் 102 வீதத்தை அடைய முடிந்தது - உள்நாட்டு இறைவரித் திணைக்களத்தின் அதிகாரிகள் தெரிவிப்பு	https://www.virakesari.lk/article/227926	ta	virakesarilk	1760620800.0
lk_news	2025-10-16-virakesarilk-a7f16769	virakesarilk-a7f16769	2025-10-16	குற்றவாளிகளைக் கொண்டாடுதலும் தண்டனைகளிலிருந்து விடுபடும் போக்கும் முடிவுக்குக் கொண்டுவரப்படவேண்டும் - மனித உரிமைகள் கண்காணிப்பகம்	https://www.virakesari.lk/article/227925	ta	virakesarilk	1760620740.0
lk_news	2025-10-16-virakesarilk-2ccfc24f	virakesarilk-2ccfc24f	2025-10-16	நிலுவையில் உள்ள சாரதி அனுமதிப்பத்திரங்களை 3 மாதங்களுக்குள் அச்சிட்டு வழங்க திட்டம்	https://www.virakesari.lk/article/227924	ta	virakesarilk	1760620440.0
lk_news	2025-10-16-tamilmirrorlk-2f72da02	tamilmirrorlk-2f72da02	2025-10-16	மக்களே உஷார்;பொலிஸ் முக்கிய அறிவிப்பு	https://www.tamilmirror.lk/செய்திகள்/மக்களே-உஷார்-பொலிஸ்-முக்கிய-அறிவிப்பு/175-366413	ta	tamilmirrorlk	1760620364.0
lk_news	2025-10-16-virakesarilk-1bee4100	virakesarilk-1bee4100	2025-10-16	நிர்மாணக் கைத்தொழில் அபிவிருத்தி அதிகாரசபைக்கு எதிரான வழக்குகள் தொடர்பான நடவடிக்கைகளுக்கு  அதிகாரசபையினால் 15.01 மில்லியன் ரூபாய் செலவு - கோப் குழு	https://www.virakesari.lk/article/227923	ta	virakesarilk	1760620200.0
lk_news	2025-10-16-lankadeepalk-05ebac1a	lankadeepalk-05ebac1a	2025-10-16	අපේක්ෂා රෝහලේ රෝගී දරුවන් විකිණූ තිදෙනෙක් මාට්ටු	https://www.lankadeepa.lk/news/අපකෂ-රහල-රග-දරවන-වකණ-තදනක-මටට/101-681497	si	lankadeepalk	1760619489.0
lk_news	2025-10-16-lankadeepalk-a3ae7579	lankadeepalk-a3ae7579	2025-10-16	උසාවිය මගහැරි  සිරකරුවෙක් මාට්ටු	https://www.lankadeepa.lk/latest_news/උසවය-මගහර-සරකරවක-මටට/1-681496	si	lankadeepalk	1760618530.0
lk_news	2025-10-16-virakesarilk-ad22fec2	virakesarilk-ad22fec2	2025-10-16	பண்டாரவளை நிகழ்வு முற்றுமுழுதாக ஒரு ஏமாற்று வேலையாகும் - மனோ கணேசன்	https://www.virakesari.lk/article/227919	ta	virakesarilk	1760617980.0
lk_news	2025-10-16-lankadeepalk-7bc31504	lankadeepalk-7bc31504	2025-10-16	හරිනි-ජය ශංකර් හමුවේ	https://www.lankadeepa.lk/latest_news/හරන-ජය-ශකර-හමව/1-681495	si	lankadeepalk	1760617820.0
lk_news	2025-10-16-lankadeepalk-0d125b8f	lankadeepalk-0d125b8f	2025-10-16	කොළඹ නගරාධිපතිනියට විපක්‍ෂය ප්‍රශ්න වැලක්	https://www.lankadeepa.lk/latest_news/කළඹ-නගරධපතනයට-වපකෂය-පරශන-වලක/1-681494	si	lankadeepalk	1760617449.0
lk_news	2025-10-16-tamilmirrorlk-ddb5e133	tamilmirrorlk-ddb5e133	2025-10-16	எம்.பிக்களின் சம்பளத்தை கட்சிகள் எடுப்பதற்கு எதிராக பிரேரணை	https://www.tamilmirror.lk/செய்திகள்/எம்-பிக்களின்-சம்பளத்தை-கட்சிகள்-எடுப்பதற்கு-எதிராக-பிரேரணை/175-366412	ta	tamilmirrorlk	1760617382.0
lk_news	2025-10-16-virakesarilk-1af600b5	virakesarilk-1af600b5	2025-10-16	இஷாரா செவ்வந்தி உள்ளிட்ட குழுவை பொலிஸ் தடுப்பு காவலில் வைத்து விசாரணை செய்ய அனுமதி!	https://www.virakesari.lk/article/227918	ta	virakesarilk	1760617320.0
lk_news	2025-10-16-tamilmirrorlk-f5a79ef4	tamilmirrorlk-f5a79ef4	2025-10-16	தீபாவளியை முன்னிட்டு விசேட பஸ் சேவைகள்	https://www.tamilmirror.lk/செய்திகள்/தீபாவளியை-முன்னிட்டு-விசேட-பஸ்-சேவைகள்/175-366411	ta	tamilmirrorlk	1760616934.0
lk_news	2025-10-16-virakesarilk-ee8eb3c5	virakesarilk-ee8eb3c5	2025-10-16	திருமணமான தம்பதிகளின் கவனத்தை கவர்ந்த ரியோ ராஜின் 'ஆண்பாவம் பொல்லாதது 'பட முன்னோட்டம்	https://www.virakesari.lk/article/227912	ta	virakesarilk	1760616480.0
lk_news	2025-10-16-virakesarilk-40bad97c	virakesarilk-40bad97c	2025-10-16	இயக்குநர் மோகன் ஜி வெளியிட்ட 'தடை அதை உடை' படத்தின் கிளர்வோட்டம்	https://www.virakesari.lk/article/227910	ta	virakesarilk	1760616480.0
lk_news	2025-10-16-virakesarilk-f61dde13	virakesarilk-f61dde13	2025-10-16	பொலிஸ் அதிகாரிகள் என கூறி லொறியை சோதனையிட்டு பணத்தை திருடியவர்கள் தொடர்பில் பொலிஸார் விசாரணை!	https://www.virakesari.lk/article/227913	ta	virakesarilk	1760615700.0
lk_news	2025-10-16-virakesarilk-608c5479	virakesarilk-608c5479	2025-10-16	எச்சரிக்கை: கொழும்பு மாநகர சபை விடுத்துள்ள முக்கிய அறிவிப்பு!	https://www.virakesari.lk/article/227911	ta	virakesarilk	1760615220.0
lk_news	2025-10-16-virakesarilk-ad455847	virakesarilk-ad455847	2025-10-16	நடிகர் ஸ்ரீராம் கார்த்திக் நடிக்கும் 'மெசன்ஜர் 'படத்தின் முன்னோட்டம் வெளியீடு	https://www.virakesari.lk/article/227908	ta	virakesarilk	1760614620.0
lk_news	2025-10-16-virakesarilk-6b1fad93	virakesarilk-6b1fad93	2025-10-16	நடிகர் கௌஷிக் ராம் நடிக்கும் 'கிறிஸ்டினா கதிர்வேலன்' படத்தின் முதல் பாடல் வெளியீடு	https://www.virakesari.lk/article/227906	ta	virakesarilk	1760614560.0
lk_news	2025-10-16-virakesarilk-569cff9c	virakesarilk-569cff9c	2025-10-16	15 வயது சிறுமியை பாலியல் துஷ்பிரயோகம் செய்த 17 வயது சிறுவன் கைது	https://www.virakesari.lk/article/227907	ta	virakesarilk	1760614500.0
lk_news	2025-10-16-tamilmirrorlk-a1ea8fc5	tamilmirrorlk-a1ea8fc5	2025-10-16	இஷாரா உள்ளிட்ட நால்வருக்கும்  72 மணிநேர தடுப்புக்காவல்	https://www.tamilmirror.lk/செய்திகள்/இஷாரா-உள்ளிட்ட-நால்வருக்கும்-72-மணிநேர-தடுப்புக்காவல்/175-366409	ta	tamilmirrorlk	1760614409.0
lk_news	2025-10-16-virakesarilk-22742a89	virakesarilk-22742a89	2025-10-16	யாழ். பருத்தித்துறை வாள் வெட்டுத் தாக்குதல் ; பொலிஸார் எடுத்த நடவடிக்கை தொடர்பாக அறிக்கை கோரல்	https://www.virakesari.lk/article/227904	ta	virakesarilk	1760613900.0
lk_news	2025-10-16-lankadeepalk-928afe34	lankadeepalk-928afe34	2025-10-16	හෙට රට බාර ගන්න තරුණයා අද හදමු	https://www.lankadeepa.lk/news/හට-රට-බර-ගනන-තරණය-අද-හදම/101-681493	si	lankadeepalk	1760613821.0
lk_news	2025-10-16-lankadeepalk-0eea12b3	lankadeepalk-0eea12b3	2025-10-16	දුම්රිය ස්ථානාධිපති සංගමයට නව සභාපති සහ ලේකම්වරයෙක්	https://www.lankadeepa.lk/news/දමරය-සථනධපත-සගමයට-නව-සභපත-සහ-ලකමවරයක/101-681492	si	lankadeepalk	1760613583.0
lk_news	2025-10-16-virakesarilk-28e6c9ba	virakesarilk-28e6c9ba	2025-10-16	வீட்டிற்குள் கஞ்சா பயிர்ச்செய்கை - ஒருவர் கைது!	https://www.virakesari.lk/article/227905	ta	virakesarilk	1760613360.0
lk_news	2025-10-16-tamilmirrorlk-9e1c5308	tamilmirrorlk-9e1c5308	2025-10-16	15 வயது சிறுமி துஷ்பிரயோகம்: 17 வயது சிறுவன் கைது	https://www.tamilmirror.lk/செய்திகள்/15-வயது-சிறுமி-துஷ்பிரயோகம்-17-வயது-சிறுவன்-கைது/175-366408	ta	tamilmirrorlk	1760613169.0
lk_news	2025-10-16-virakesarilk-8df87b9c	virakesarilk-8df87b9c	2025-10-16	சரத்பொன்சேகா இறுதியுத்த சாட்சியம் வழங்குவார் என்றால் சர்வதேச குற்றவியல் விசாரணை நடாத்தப்படவேண்டும் என்பதை வலியுறுத்த வேண்டும் - கஜேந்திரகுமார் பொன்னம்பலம்	https://www.virakesari.lk/article/227903	ta	virakesarilk	1760613060.0
lk_news	2025-10-16-lankadeepalk-29543885	lankadeepalk-29543885	2025-10-16	දකුණු මුහුදෙන් ඇල්ලූ ’අයිස්’ අයිස් දැයි සොයයි	https://www.lankadeepa.lk/news/දකණ-මහදන-ඇලලඅයස-අයස-දය-සයය/101-681491	si	lankadeepalk	1760613047.0
lk_news	2025-10-16-lankadeepalk-32896b2b	lankadeepalk-32896b2b	2025-10-16	අතීතයට ගිහිං  වයිෆ්ව , හස්බන්ව වෙනස් කළොත් ? මේක  කාල තරණය ගැන කතාවක්	https://www.lankadeepa.lk/videos/අතීතයට-ගිහිං--වයිෆ්ව---හස්බන්ව-වෙනස්-කළොත්---මේක--කාල-තරණය-ගැන-කතාවක්/12-681490	si	lankadeepalk	1760612789.0
lk_news	2025-10-16-adalk-30abcecc	adalk-30abcecc	2025-10-16	අවවාද කරල ඉවරයි දැන් දඩ	https://www.ada.lk/breaking_news/අවවාද-කරල-ඉවරයි-දැන්-දඩ/11-419149	si	adalk	1760612742.0
lk_news	2025-10-16-virakesarilk-bac3d194	virakesarilk-bac3d194	2025-10-16	மாரி செல்வராஜ் வெளியிட்ட நடிகர் ஆதித்யா மாதவனின் 'அதர்ஸ்' பட டீசர்	https://www.virakesari.lk/article/227902	ta	virakesarilk	1760612400.0
lk_news	2025-10-16-virakesarilk-80f11c79	virakesarilk-80f11c79	2025-10-16	சமூக வைத்தியர்கள் கல்லூரியின் 31வது தலைவராக வைத்தியர் விந்தியா குமாரபெல்லி நியமனம்	https://www.virakesari.lk/article/227900	ta	virakesarilk	1760612400.0
lk_news	2025-10-16-virakesarilk-48425265	virakesarilk-48425265	2025-10-16	“கெப்பெட்டிபொல பூதயா”வுடன் 18 பேர் கைது!	https://www.virakesari.lk/article/227901	ta	virakesarilk	1760612280.0
lk_news	2025-10-16-virakesarilk-42447057	virakesarilk-42447057	2025-10-16	பின் கதவால் வெளியேறியவர்களுக்கு வெட்கம் இல்லையா – ஜோசப் ஸ்டாலின் கேள்வி	https://www.virakesari.lk/article/227899	ta	virakesarilk	1760611860.0
lk_news	2025-10-16-tamilmirrorlk-b45f00ec	tamilmirrorlk-b45f00ec	2025-10-16	பெண்களை இரவில் பணியமர்த்தும் சட்டங்களில் திருத்தம்	https://www.tamilmirror.lk/செய்திகள்/பெண்களை-இரவில்-பணியமர்த்தும்-சட்டங்களில்-திருத்தம்/175-366405	ta	tamilmirrorlk	1760611834.0
lk_news	2025-10-16-tamilmirrorlk-16db47b0	tamilmirrorlk-16db47b0	2025-10-16	தாய் பயன்படுத்திய ஆணுறைகளை சேமித்து வந்த மகள்	https://www.tamilmirror.lk/செய்திகள்/தாய்-பயன்படுத்திய-ஆணுறைகளை-சேமித்து-வந்த-மகள்/175-366401	ta	tamilmirrorlk	1760611436.0
lk_news	2025-10-16-adalk-118e6567	adalk-118e6567	2025-10-16	රියදුරු බලපත්‍ර ලක්ෂ 3ක් ඉදිරි මාස තුනේදී මුද්‍රණයට	https://www.ada.lk/breaking_news/රියදුරු-බලපත්‍ර-ලක්ෂ-3ක්-ඉදිරි-මාස-තුනේදී-මුද්‍රණයට/11-419148	si	adalk	1760610470.0
lk_news	2025-10-16-virakesarilk-53a38419	virakesarilk-53a38419	2025-10-16	கிராமத்தை ஆளும் காட்டு யானைகள்!	https://www.virakesari.lk/article/227898	ta	virakesarilk	1760610360.0
lk_news	2025-10-16-virakesarilk-3318b919	virakesarilk-3318b919	2025-10-16	வேலணை பிரதேச சபை அனுமதியின்றி நுண்நிதி கடன் நிறுவனங்கள் செயற்பட அனுமதி மறுப்பு	https://www.virakesari.lk/article/227895	ta	virakesarilk	1760610120.0
lk_news	2025-10-16-virakesarilk-d16def74	virakesarilk-d16def74	2025-10-16	முன்னாள் டெஸ்ட் கிரிக்கெட் வீரர் ஜயானந்த வர்ணவீர காலமானார்	https://www.virakesari.lk/article/227896	ta	virakesarilk	1760609580.0
lk_news	2025-10-16-adalk-a402d97a	adalk-a402d97a	2025-10-16	වර්ණවීර ජීවන පිටියෙන් සමුගනියි	https://www.ada.lk/breaking_news/වර්ණවීර-ජීවන-පිටියෙන්-සමුගනියි/11-419147	si	adalk	1760609184.0
lk_news	2025-10-16-virakesarilk-fe3635cd	virakesarilk-fe3635cd	2025-10-16	விபத்துகள் குறித்த தேசிய மாநாடு நாளை!	https://www.virakesari.lk/article/227891	ta	virakesarilk	1760608380.0
lk_news	2025-10-16-virakesarilk-668f80eb	virakesarilk-668f80eb	2025-10-16	கல்கிஸ்ஸை நீதிமன்ற சம்பவம் ; சட்டத்தரணி வன்னிநாயக்கவின்  மனு மீதான விசாரணை நவம்பர்!	https://www.virakesari.lk/article/227894	ta	virakesarilk	1760608200.0
lk_news	2025-10-16-tamilmirrorlk-f3657999	tamilmirrorlk-f3657999	2025-10-16	பொறியியல் கூட்டுத்தாபன முன்னாள் பணிப்பாளருக்கு பிணை	https://www.tamilmirror.lk/செய்திகள்/பொறியியல்-கூட்டுத்தாபன-முன்னாள்-பணிப்பாளருக்கு-பிணை/175-366394	ta	tamilmirrorlk	1760607808.0
lk_news	2025-10-16-virakesarilk-83d9acc7	virakesarilk-83d9acc7	2025-10-16	தெல்லிப்பழை  யூனியன்  கல்லூரி  வளாகத்தில்  மணிக்கூட்டுக் கோபுரம் திறந்துவைப்பு!	https://www.virakesari.lk/article/227888	ta	virakesarilk	1760607660.0
lk_news	2025-10-16-adalk-fcd7e49a	adalk-fcd7e49a	2025-10-16	දේශීය ආදායම් දෙපාර්තමේන්තුව අපේක්ෂිත බදු ආදායමත් ඉක්මවා යයි	https://www.ada.lk/breaking_news/දේශීය-ආදායම්-දෙපාර්තමේන්තුව-අපේක්ෂිත-බදු-ආදායමත්-ඉක්මවා-යයි/11-419146	si	adalk	1760607550.0
lk_news	2025-10-16-lankadeepalk-e127288b	lankadeepalk-e127288b	2025-10-16	ලේකම්වරුන් තිදෙනෙකුට උසස් නිලතල සභාවේ අනුමැතිය	https://www.lankadeepa.lk/latest_news/ලකමවරන-තදනකට-උසස-නලතල-සභව-අනමතය/1-681489	si	lankadeepalk	1760607518.0
lk_news	2025-10-16-adalk-ff52a147	adalk-ff52a147	2025-10-16	රවී සෙනෙවිරත්නගේ පත්කිරීමට අනුමැතිය	https://www.ada.lk/breaking_news/රවී-සෙනෙවිරත්නගේ-පත්කිරීමට-අනුමැතිය/11-419145	si	adalk	1760607139.0
lk_news	2025-10-16-virakesarilk-adfe6b72	virakesarilk-adfe6b72	2025-10-16	'தெற்காசியாவின் முன்னணி சர்வதேச விமான நிறுவனம்' - ஸ்ரீலங்கன் ஏர்லைன்ஸ் தொடர்ச்சியாக மூன்றாவது முறையாக சாதனை!	https://www.virakesari.lk/article/227889	ta	virakesarilk	1760607060.0
lk_news	2025-10-16-virakesarilk-f87ce020	virakesarilk-f87ce020	2025-10-16	இலங்கை அரச பொறியியல் கூட்டுத்தாபனத்தின் முன்னாள் பணிப்பாளர் விஜேதாசவுக்கு பிணை!	https://www.virakesari.lk/article/227890	ta	virakesarilk	1760606940.0
lk_news	2025-10-16-tamilmirrorlk-1464c5ca	tamilmirrorlk-1464c5ca	2025-10-16	’லொக்கு பெட்டி’க்கு உதவிய கப்புறாளை கைது	https://www.tamilmirror.lk/செய்திகள்/லொக்கு-பெட்டி-க்கு-உதவிய-கப்புறாளை-கைது/175-366392	ta	tamilmirrorlk	1760606923.0
lk_news	2025-10-16-virakesarilk-7d29c9a2	virakesarilk-7d29c9a2	2025-10-16	ஹெரோயின் விற்பனையில் ஈடுபட்ட இருவர் கைது!	https://www.virakesari.lk/article/227887	ta	virakesarilk	1760606820.0
lk_news	2025-10-16-adalk-0cf1b490	adalk-0cf1b490	2025-10-16	රුසියාවෙන් තෙල් මිලදී ගැනිම නවත්වන බව මෝදි කිව්වා - ට්‍රම්ප්	https://www.ada.lk/breaking_news/රුසියාවෙන්-තෙල්-මිලදී-ගැනිම-නවත්වන-බව-මෝදි-කිව්වා---ට්‍රම්ප්/11-419144	si	adalk	1760606603.0
lk_news	2025-10-16-virakesarilk-bf817c61	virakesarilk-bf817c61	2025-10-16	திருகோணமலை கடற்கரை பகுதியில் சட்டவிரோத கட்டுமானம் அகற்றப்பட்டது	https://www.virakesari.lk/article/227886	ta	virakesarilk	1760606520.0
lk_news	2025-10-16-lankadeepalk-6047eb7f	lankadeepalk-6047eb7f	2025-10-16	ඉංජිනේරු සංස්ථාවේ හිටපු ලොක්කාට ඇප	https://www.lankadeepa.lk/latest_news/ඉජනර-සසථව-හටප-ලකකට-ඇප/1-681488	si	lankadeepalk	1760606353.0
lk_news	2025-10-16-adalk-3239faf9	adalk-3239faf9	2025-10-16	කාසියේ වාසිය බංග්ලාදේශයට	https://www.ada.lk/sports/කාසියේ-වාසිය-බංග්ලාදේශයට/9-419143	si	adalk	1760606346.0
lk_news	2025-10-16-tamilmirrorlk-50deabb6	tamilmirrorlk-50deabb6	2025-10-16	14 வயது மாணவியை கடத்திய 16 வயதானவர் கைது	https://www.tamilmirror.lk/செய்திகள்/14-வயது-மாணவியை-கடத்திய-16-வயதானவர்-கைது/175-366391	ta	tamilmirrorlk	1760606316.0
lk_news	2025-10-16-virakesarilk-c897c0de	virakesarilk-c897c0de	2025-10-16	ரூ.4 இலட்சத்தை நெருங்கும் தங்க விலை	https://www.virakesari.lk/article/227885	ta	virakesarilk	1760606100.0
lk_news	2025-10-16-lankadeepalk-93a13038	lankadeepalk-93a13038	2025-10-16	මහමග අනතුරු වලින් වසරකට 2500ක් එලොව යති	https://www.lankadeepa.lk/latest_news/මහමග-අනතර-වලන-වසරකට-2500ක-එලව-යත/1-681487	si	lankadeepalk	1760605532.0
lk_news	2025-10-16-adalk-cfc52a56	adalk-cfc52a56	2025-10-16	ගාල්ලේ උග්‍ර පෝෂණ හිගයෙන් පෙළෙන දරුවන් 527ක්	https://www.ada.lk/breaking_news/ගාල්ලේ-උග්‍ර-පෝෂණ-හිගයෙන්-පෙළෙන-දරුවන්-527ක්/11-419142	si	adalk	1760605526.0
