doc_type	doc_id	num	date_str	description	url_metadata	lang	newspaper_id	time_ut
lk_news	2025-10-14-bbccomsinhala-2c4ee793	bbccomsinhala-2c4ee793	2025-10-14	විදුලි බල මණ්ඩලය ඉල්ලා සිටි 6.8%ක විදුලි ගාස්තු වැඩි කිරීම මහජන උපයෝගීතා කොමිසම ප්‍රතික්ෂේප කළේ ඇයි?	https://www.bbc.com/sinhala/articles/c1wl711v71qo	si	bbccomsinhala	1760403915.0
lk_news	2025-10-14-lankadeepalk-29343538	lankadeepalk-29343538	2025-10-14	මිලි මීටර් 100 ඉක්මවූ තද වැසි	https://www.lankadeepa.lk/news/මල-මටර-100-ඉකමව-තද-වස/101-681273	si	lankadeepalk	1760403787.0
lk_news	2025-10-14-virakesarilk-3a015e4a	virakesarilk-3a015e4a	2025-10-14	இன்றைய வானிலை	https://www.virakesari.lk/article/227656	ta	virakesarilk	1760402220.0
lk_news	2025-10-14-bbccomsinhala-87e94188	bbccomsinhala-87e94188	2025-10-14	'අප්පච්චිට හොරෙන් අම්මා මහලා දීපු රේසින් සූට් එකත් අරගෙන තලෙයිමන්නාරමෙන් මද්‍රාස්වලට ගියේ' - ඩිලන්ත මාලගමුව	https://www.bbc.com/sinhala/articles/ckgywy5kgxro	si	bbccomsinhala	1760401384.0
lk_news	2025-10-14-virakesarilk-c0cfb02b	virakesarilk-c0cfb02b	2025-10-14	செம்மணி புதைகுழியில் மூன்றாம் கட்ட அகழ்வுக்கான நிதி கிடைத்தது; கால நிலை சீரின்மையால் அகழ்வை ஆரம்பிப்பதில் தாமதம்	https://www.virakesari.lk/article/227655	ta	virakesarilk	1760394240.0
lk_news	2025-10-14-virakesarilk-dc6ecb05	virakesarilk-dc6ecb05	2025-10-14	யாழில்.மோட்டார் சைக்கிள் - பேருந்து விபத்து ; உதைப்பந்தாட்ட நடுவர் உயிரிழப்பு	https://www.virakesari.lk/article/227654	ta	virakesarilk	1760394000.0
lk_news	2025-10-14-virakesarilk-43107000	virakesarilk-43107000	2025-10-14	மட்டக்களப்பு மேற்கு கல்வி வலய ஆறாவது வலயக் கல்விப் பணிப்பாளராக திருமதி சிவசங்கரி கங்கேஸ்வரன் பதவியேற்பு	https://www.virakesari.lk/article/227653	ta	virakesarilk	1760393760.0
lk_news	2025-10-14-virakesarilk-d9b01c88	virakesarilk-d9b01c88	2025-10-14	யாழில் விசேட தேவையுடையோருக்கான சர்வதேச தின தேசிய விழா	https://www.virakesari.lk/article/227652	ta	virakesarilk	1760393580.0
lk_news	2025-10-14-virakesarilk-4892dcbc	virakesarilk-4892dcbc	2025-10-14	மின்சார கட்டணம் குறித்த ஆணையத்தின் இறுதி முடிவு இன்று அறிவிக்கப்படும்	https://www.virakesari.lk/article/227651	ta	virakesarilk	1760393280.0
lk_news	2025-10-14-virakesarilk-1a950904	virakesarilk-1a950904	2025-10-14	போர்க்குற்றங்கள் குறித்து சாட்சியம் அளிக்கத் தயார்;  சோமரத்ன ராஜபக்ஷவின் சத்தியக்கடதாசி ஐ.நா மனித உரிமைகள் உயர்ஸ்தானிகர் அலுவலகத்திடம் கையளிப்பு	https://www.virakesari.lk/article/227650	ta	virakesarilk	1760393040.0
lk_news	2025-10-14-bbccomsinhala-fd103e34	bbccomsinhala-fd103e34	2025-10-14	දින හතරක මෙහෙයුමකින් 'ඉෂාරා සෙව්වන්දි' නේපාලයේදී අත්අඩංගුවට ගත් හැටි	https://www.bbc.com/sinhala/articles/c0rpwdg71yyo	si	bbccomsinhala	1760392504.0
lk_news	2025-10-14-dailyftlk-e1e2b9c2	dailyftlk-e1e2b9c2	2025-10-14	SL chairs WHO South-East Asia Regional Committee session	https://www.ft.lk/news/SL-chairs-WHO-South-East-Asia-Regional-Committee-session/56-782964	en	dailyftlk	1760389168.0
lk_news	2025-10-14-dailyftlk-52e5c5f0	dailyftlk-52e5c5f0	2025-10-14	Court upholds fair access for tourism operators in Samanalawewa	https://www.ft.lk/news/Court-upholds-fair-access-for-tourism-operators-in-Samanalawewa/56-782963	en	dailyftlk	1760389055.0
lk_news	2025-10-14-dailyftlk-fdcd0d86	dailyftlk-fdcd0d86	2025-10-14	Colombo Port posts Rs. 32 b profit YTD Aug. 2025	https://www.ft.lk/news/Colombo-Port-posts-Rs-32-b-profit-YTD-Aug-2025/56-782962	en	dailyftlk	1760388980.0
lk_news	2025-10-14-virakesarilk-0ec6e4ed	virakesarilk-0ec6e4ed	2025-10-14	பங்களாதேஷிடம் பலத்த சவாலை எதிர்கொண்ட தென் ஆபிரிக்கா 3 பந்துகள் மீதமிருக்க பரபரப்பான வெற்றியை ஈட்டியது	https://www.virakesari.lk/article/227649	ta	virakesarilk	1760386560.0
lk_news	2025-10-14-dailyftlk-1d168ee8	dailyftlk-1d168ee8	2025-10-14	Bairaha marks 50 years of leadership in Sri Lanka’s poultry industry	https://www.ft.lk/business/Bairaha-marks-50-years-of-leadership-in-Sri-Lanka-s-poultry-industry/34-782951	en	dailyftlk	1760385914.0
lk_news	2025-10-14-bbccomsinhala-c2d58088	bbccomsinhala-c2d58088	2025-10-14	පනත සම්මත වී වසර යි, කාන්තා කොමිසම තවමත් ප්‍රමාද ඇයි?: නතර වී ඇත්තේ කොතැන ද?	https://www.bbc.com/sinhala/articles/c62e3q6wzlyo	si	bbccomsinhala	1760385752.0
lk_news	2025-10-14-dailyftlk-37805baf	dailyftlk-37805baf	2025-10-14	PE veteran Nissanka Weerasekera joins Lanka Ventures, LVL Energy Fund Boards	https://www.ft.lk/business/PE-veteran-Nissanka-Weerasekera-joins-Lanka-Ventures-LVL-Energy-Fund-Boards/34-782950	en	dailyftlk	1760385672.0
lk_news	2025-10-14-dailyftlk-e7a53fc7	dailyftlk-e7a53fc7	2025-10-14	Coca-Cola appoints Mario Perera as Country Head for Sri Lanka and Maldives	https://www.ft.lk/business/Coca-Cola-appoints-Mario-Perera-as-Country-Head-for-Sri-Lanka-and-Maldives/34-782949	en	dailyftlk	1760385568.0
lk_news	2025-10-14-dailyftlk-19faac38	dailyftlk-19faac38	2025-10-14	Masterclass on cargo insurance by Shippers’ Academy Colombo	https://www.ft.lk/business/Masterclass-on-cargo-insurance-by-Shippers-Academy-Colombo/34-782948	en	dailyftlk	1760385471.0
lk_news	2025-10-14-dailyftlk-e36fd8f7	dailyftlk-e36fd8f7	2025-10-14	WindForce announces another 10 MW wind project	https://www.ft.lk/business/WindForce-announces-another-10-MW-wind-project/34-782947	en	dailyftlk	1760385444.0
lk_news	2025-10-14-dailyftlk-8bacf723	dailyftlk-8bacf723	2025-10-14	Vidullanka clinches Gold, Silver and Bronze at Taiki Akimoto 5S Awards 2025	https://www.ft.lk/business/Vidullanka-clinches-Gold-Silver-and-Bronze-at-Taiki-Akimoto-5S-Awards-2025/34-782946	en	dailyftlk	1760385418.0
lk_news	2025-10-14-dailyftlk-b61ddf7b	dailyftlk-b61ddf7b	2025-10-14	JF Packaging IPO Investor Forum on 21 October	https://www.ft.lk/business/JF-Packaging-IPO-Investor-Forum-on-21-October/34-782945	en	dailyftlk	1760385362.0
lk_news	2025-10-14-dailyftlk-f3daf21f	dailyftlk-f3daf21f	2025-10-14	Abans Group Director Dr. Dubash honoured with Visionary Leadership Award	https://www.ft.lk/business/Abans-Group-Director-Dr-Dubash-honoured-with-Visionary-Leadership-Award/34-782944	en	dailyftlk	1760385321.0
lk_news	2025-10-14-islandlk-b7091765	islandlk-b7091765	2025-10-14	JJ Twins … plenty to shout about	http://island.lk/jj-twins-plenty-to-shout-about/	en	islandlk	1760381580.0
lk_news	2025-10-14-dailyftlk-fbf772a1	dailyftlk-fbf772a1	2025-10-14	Traffic Police: It’s time you moved away from ‘white line’ fixation	https://www.ft.lk/columns/Traffic-Police-It-s-time-you-moved-away-from-white-line-fixation/4-782934	en	dailyftlk	1760381540.0
lk_news	2025-10-14-islandlk-281711cc	islandlk-281711cc	2025-10-14	AROH … absolutely excellent	http://island.lk/aroh-absolutely-excellent/	en	islandlk	1760381460.0
lk_news	2025-10-14-islandlk-2ecb8360	islandlk-2ecb8360	2025-10-14	Inclusive approach to all communities is in national interest	http://island.lk/inclusive-approach-to-all-communities-is-in-national-interest/	en	islandlk	1760380500.0
lk_news	2025-10-14-islandlk-a650ddc9	islandlk-a650ddc9	2025-10-14	Survival of the fittest? The importance of context-sensitivity in education reform	http://island.lk/survival-of-the-fittest-the-importance-of-context-sensitivity-in-education-reform/	en	islandlk	1760380380.0
lk_news	2025-10-14-dailyftlk-e6654cbb	dailyftlk-e6654cbb	2025-10-14	Reform first — growth will follow	https://www.ft.lk/columns/Reform-first-growth-will-follow/4-782932	en	dailyftlk	1760380376.0
lk_news	2025-10-13-islandlk-46454d3f	islandlk-46454d3f	2025-10-13	Enfection pioneers hybrid AI ads for vivid storytelling	http://island.lk/enfection-pioneers-hybrid-ai-ads-for-vivid-storytelling/	en	islandlk	1760380080.0
lk_news	2025-10-13-islandlk-3e779951	islandlk-3e779951	2025-10-13	JF Packaging announces IPO, investor forum	http://island.lk/jf-packaging-announces-ipo-investor-forum/	en	islandlk	1760380020.0
lk_news	2025-10-13-islandlk-cd601ebf	islandlk-cd601ebf	2025-10-13	Salesforce unveils the foundation for building trusted AI	http://island.lk/salesforce-unveils-the-foundation-for-building-trusted-ai/	en	islandlk	1760379960.0
lk_news	2025-10-13-islandlk-15befaf6	islandlk-15befaf6	2025-10-13	WindForce acquires 51 percent stake in Safe Power International to develop 10 MW wind power project	http://island.lk/windforce-acquires-51-percent-stake-in-safe-power-international-to-develop-10-mw-wind-power-project/	en	islandlk	1760379960.0
lk_news	2025-10-13-islandlk-d65fe803	islandlk-d65fe803	2025-10-13	Universities seen as ‘catalysts of real-world environmental change’	http://island.lk/universities-seen-as-catalysts-of-real-world-environmental-change/	en	islandlk	1760379900.0
lk_news	2025-10-13-islandlk-6963ddc4	islandlk-6963ddc4	2025-10-13	National Chamber hosts one-day workshop on “Corporate Governance for SMEs”	http://island.lk/national-chamber-hosts-one-day-workshop-on-corporate-governance-for-smes/	en	islandlk	1760379900.0
lk_news	2025-10-13-islandlk-1f87be9e	islandlk-1f87be9e	2025-10-13	GABV Asia-Pacific Chapter meeting 2025 to be held in Colombo	http://island.lk/gabv-asia-pacific-chapter-meeting-2025-to-be-held-in-colombo/	en	islandlk	1760379900.0
lk_news	2025-10-13-islandlk-d7345f9f	islandlk-d7345f9f	2025-10-13	Chinese international trade promoter to bestow ‘Trusted Trader’ certification on eligible Lankan companies	http://island.lk/chinese-international-trade-promoter-to-bestow-trusted-trader-certification-on-eligible-lankan-companies/	en	islandlk	1760379840.0
lk_news	2025-10-13-tamilmirrorlk-6307130c	tamilmirrorlk-6307130c	2025-10-13	சங்குப்பிட்டி சம்பவம் : பிரேத பரிசோதனையில் காத்திருந்த அதிர்ச்சி	https://www.tamilmirror.lk/செய்திகள்/சங்குப்பிட்டி-சம்பவம்-பிரேத-பரிசோதனையில்-காத்திருந்த-அதிர்ச்சி/175-366229	ta	tamilmirrorlk	1760374195.0
lk_news	2025-10-13-lankadeepalk-600b8e32	lankadeepalk-600b8e32	2025-10-13	මහින්ද කතුන්ගේ ගුණ කියයි	https://www.lankadeepa.lk/news/මහනද-කතනග-ගණ-කයය/101-681266	si	lankadeepalk	1760372341.0
lk_news	2025-10-13-lankadeepalk-ff342f95	lankadeepalk-ff342f95	2025-10-13	විදුලි වෘත්තීය සමිති නායකයා රෝහලට යයි	https://www.lankadeepa.lk/news/වදල-වතතය-සමත-නයකය-රහලට-යය/101-681265	si	lankadeepalk	1760371212.0
lk_news	2025-10-13-lankadeepalk-322abc2a	lankadeepalk-322abc2a	2025-10-13	ජනපති වැවිලි සමාගම් නියෝජිතයන් කොළඹට කැඳවයි	https://www.lankadeepa.lk/news/ජනපත-වවල-සමගම-නයජතයන-කළඹට-කඳවය/101-681264	si	lankadeepalk	1760369623.0
lk_news	2025-10-13-lankadeepalk-94d053d0	lankadeepalk-94d053d0	2025-10-13	පොහොට්ටුවට කැඳවුම්කරුවෝ 17ක්	https://www.lankadeepa.lk/latest_news/පහටටවට-කඳවමකරව-17ක/1-681263	si	lankadeepalk	1760369458.0
lk_news	2025-10-13-virakesarilk-5a2dd135	virakesarilk-5a2dd135	2025-10-13	TECHNO 2025இல் காட்சிப்படுத்தப்பட்ட கடற்படை பொறியியல் கண்டுபிடிப்பின் சிறப்பம்சங்கள்	https://www.virakesari.lk/article/227644	ta	virakesarilk	1760368800.0
lk_news	2025-10-13-adalk-b50d55e1	adalk-b50d55e1	2025-10-13	වතු කම්කරු වැටුප් වැඩි කිරීම ගැන සාකච්ඡාවක්	https://www.ada.lk/breaking_news/වතු-කම්කරු-වැටුප්-වැඩි-කිරීම-ගැන-සාකච්ඡාවක්/11-419068	si	adalk	1760367635.0
lk_news	2025-10-13-virakesarilk-430b4f2d	virakesarilk-430b4f2d	2025-10-13	ஸ்லோவாக்கியாவில் ரயில் மோதல் – பலர் காயம்	https://www.virakesari.lk/article/227648	ta	virakesarilk	1760367600.0
lk_news	2025-10-13-lankadeepalk-4983cc6d	lankadeepalk-4983cc6d	2025-10-13	කොළඹ මහ නගර සභාව කෝටි 400ක වරිපනම් පිනට ඇරලා	https://www.lankadeepa.lk/latest_news/කළඹ-මහ-නගර-සභව-කට-400ක-වරපනම-පනට-ඇරල/1-681262	si	lankadeepalk	1760366499.0
lk_news	2025-10-13-lankadeepalk-8933dfb8	lankadeepalk-8933dfb8	2025-10-13	ලංකා වෙළඳ ප්‍රතිපත්තිය ගැන කියන්න වසන්ත ස්විට්සර්ලන්තයට	https://www.lankadeepa.lk/latest_news/ලක-වළඳ-පරතපතතය-ගන-කයනන-වසනත-සවටසරලනතයට/1-681261	si	lankadeepalk	1760366134.0
lk_news	2025-10-13-virakesarilk-279ef1e5	virakesarilk-279ef1e5	2025-10-13	20  வயதுக்குட்பட்ட  பெண்களுக்கான கோலூன்றிப் பாய்தலில் வட மாகாணத்திற்கு தங்கம், வெள்ளி, வெண்கலம்	https://www.virakesari.lk/article/227647	ta	virakesarilk	1760364900.0
lk_news	2025-10-13-virakesarilk-a5b8806b	virakesarilk-a5b8806b	2025-10-13	சபாநாயகர் பொய் கூறி பாராளுமன்றத்தையே ஏமாற்றியிருக்கின்றார்; கடுமையாக குற்றஞ்சாட்டுகிறார் உதய கம்மன்பில	https://www.virakesari.lk/article/227646	ta	virakesarilk	1760364120.0
lk_news	2025-10-13-lankadeepalk-62e4238f	lankadeepalk-62e4238f	2025-10-13	වන්නිනායකට එරෙහිව පොලිසිය කරුණු දක්වයි	https://www.lankadeepa.lk/news/වනනනයකට-එරහව-පලසය-කරණ-දකවය/101-681260	si	lankadeepalk	1760363989.0
lk_news	2025-10-13-tamilmirrorlk-25f2170e	tamilmirrorlk-25f2170e	2025-10-13	சட்டவிரோத மீன்பிடி 45 பேர் கைது	https://www.tamilmirror.lk/செய்திகள்/சட்டவிரோத-மீன்பிடி-45-பேர்-கைது/175-366216	ta	tamilmirrorlk	1760361605.0
lk_news	2025-10-13-virakesarilk-f8a1aaf1	virakesarilk-f8a1aaf1	2025-10-13	குருக்கள்மடம் தென்னந்தோப்பில் ஆணின் சடலம்!	https://www.virakesari.lk/article/227636	ta	virakesarilk	1760361000.0
lk_news	2025-10-13-virakesarilk-5315bb9b	virakesarilk-5315bb9b	2025-10-13	இலஞ்சம் பெற உதவிய அபிவிருத்தி அதிகாரி கைது	https://www.virakesari.lk/article/227639	ta	virakesarilk	1760360700.0
lk_news	2025-10-13-virakesarilk-fb825f40	virakesarilk-fb825f40	2025-10-13	எங்களை நாங்கள் வளர்த்துக்கொள்வதற்கு பிறமொழியை அறிந்திருப்பது நன்மையே ; வேதநாயகன்	https://www.virakesari.lk/article/227635	ta	virakesarilk	1760360520.0
lk_news	2025-10-13-tamilmirrorlk-d91ea021	tamilmirrorlk-d91ea021	2025-10-13	நிதி மற்றும் திட்டமிடல், பொருளாதார அபிவிருத்தி பிரதி அமைச்சர்கள் கடமைகளை பொறுப்பேற்பு	https://www.tamilmirror.lk/செய்திகள்/நிதி-மற்றும்-திட்டமிடல்-பொருளாதார-அபிவிருத்தி-பிரதி-அமைச்சர்கள்-கடமைகளை-பொறுப்பேற்பு/175-366215	ta	tamilmirrorlk	1760360440.0
lk_news	2025-10-13-tamilmirrorlk-0d60503e	tamilmirrorlk-0d60503e	2025-10-13	பிரதி அமைச்சர்கள் கடமைகளை பொறுப்பேற்பு	https://www.tamilmirror.lk/செய்திகள்/பிரதி-அமைச்சர்கள்-கடமைகளை-பொறுப்பேற்பு/175-366215	ta	tamilmirrorlk	1760360440.0
lk_news	2025-10-13-tamilmirrorlk-6ab3559e	tamilmirrorlk-6ab3559e	2025-10-13	அமைச்சுக்கு புதிய செயலாளர் நியமனம்	https://www.tamilmirror.lk/செய்திகள்/அமைச்சுக்கு-புதிய-செயலாளர்-நியமனம்/175-366214	ta	tamilmirrorlk	1760359650.0
lk_news	2025-10-13-tamilmirrorlk-1edee62b	tamilmirrorlk-1edee62b	2025-10-13	வீடமைப்பு, நிர்மாணத்துறை மற்றும் நீர் வழங்கல் அமைச்சுக்கு புதிய செயலாளர் நியமனம்	https://www.tamilmirror.lk/செய்திகள்/வீடமைப்பு-நிர்மாணத்துறை-மற்றும்-நீர்-வழங்கல்-அமைச்சுக்கு-புதிய-செயலாளர்-நியமனம்/175-366214	ta	tamilmirrorlk	1760359650.0
lk_news	2025-10-13-virakesarilk-13cb5757	virakesarilk-13cb5757	2025-10-13	சர்வதேச மொழிபெயர்ப்பு தினத்தை முன்னிட்டு பாராளுமன்றத்தில் விசேட நிகழ்வு	https://www.virakesari.lk/article/227643	ta	virakesarilk	1760359260.0
lk_news	2025-10-13-virakesarilk-bc5f64d1	virakesarilk-bc5f64d1	2025-10-13	போதைப்பொருள் நாட்டுக்குள் வருவதை தடுப்பதற்கான முதல் படி எடுக்கப்பட்டதாக ஜனாதிபதி குறிப்பிட்டது பிமலிடமிருந்து துறைமுக அமைச்சு நீக்கப்பட்டமையையா? - ஸ்ரீலங்கா பொதுஜன பெரமுன கேள்வி	https://www.virakesari.lk/article/227642	ta	virakesarilk	1760359200.0
lk_news	2025-10-13-virakesarilk-852e1178	virakesarilk-852e1178	2025-10-13	கஞ்சா, ஐஸ், ஹெரோயினுடன் இருவர் வட்டவளையில் கைது - ஈஸி கேஷ் பயன்படுத்தி வியாபாரம்	https://www.virakesari.lk/article/227641	ta	virakesarilk	1760358600.0
lk_news	2025-10-13-lankadeepalk-369ed483	lankadeepalk-369ed483	2025-10-13	යතුරු පැදි ජාවාරමක් එළියට	https://www.lankadeepa.lk/latest_news/යතර-පද-ජවරමක-එළයට/1-681259	si	lankadeepalk	1760358072.0
lk_news	2025-10-13-virakesarilk-9927ee98	virakesarilk-9927ee98	2025-10-13	சட்டவிரோத மீன்பிடியை தடுக்க கடற்படையினர் நடவடிக்கை - 45 பேர் சிக்கினர்	https://www.virakesari.lk/article/227640	ta	virakesarilk	1760358060.0
lk_news	2025-10-13-adalk-2001c916	adalk-2001c916	2025-10-13	මොනරාගල බඩ ඉරිඟු ව්‍යාප්ත කරන්න බීජ ටොන් 26ක්	https://www.ada.lk/breaking_news/මොනරාගල-බඩ-ඉරිඟු-ව්‍යාප්ත-කරන්න-බීජ-ටොන්-26ක්/11-419067	si	adalk	1760357854.0
lk_news	2025-10-13-lankadeepalk-8fd2532e	lankadeepalk-8fd2532e	2025-10-13	ලූනු මිලට හඬන ගොවීහු	https://www.lankadeepa.lk/latest_news/ලන-මලට-හඬන-ගවහ/1-681256	si	lankadeepalk	1760356876.0
lk_news	2025-10-13-tamilmirrorlk-106942cc	tamilmirrorlk-106942cc	2025-10-13	மன்னார் விவகாரம்: உயர்நீதிமன்றில் மனு	https://www.tamilmirror.lk/செய்திகள்/மன்னார்-விவகாரம்-உயர்நீதிமன்றில்-மனு/175-366211	ta	tamilmirrorlk	1760356791.0
lk_news	2025-10-13-virakesarilk-1edee62b	virakesarilk-1edee62b	2025-10-13	வீடமைப்பு, நிர்மாணத்துறை மற்றும் நீர் வழங்கல் அமைச்சுக்கு புதிய செயலாளர் நியமனம்	https://www.virakesari.lk/article/227638	ta	virakesarilk	1760356500.0
lk_news	2025-10-13-tamilmirrorlk-62a5e762	tamilmirrorlk-62a5e762	2025-10-13	கொழும்பில்  ITI கட்டிடத்தில்   தீ	https://www.tamilmirror.lk/செய்திகள்/கொழும்பில்-ITI-கட்டிடத்தில்-தீ/175-366208	ta	tamilmirrorlk	1760356047.0
lk_news	2025-10-13-lankadeepalk-166fa032	lankadeepalk-166fa032	2025-10-13	විදුලි බිල වැඩි වෙනවාද - නැද්ද තීරණය හෙට	https://www.lankadeepa.lk/latest_news/වදල-බල-වඩ-වනවද-නදද-තරණය-හට/1-681253	si	lankadeepalk	1760355681.0
lk_news	2025-10-13-lankadeepalk-f31a91f9	lankadeepalk-f31a91f9	2025-10-13	වන අලින්ට ආහාර සපයන මෙහෙයුමක්	https://www.lankadeepa.lk/news/වන-අලනට-ආහර-සපයන-මහයමක/101-681252	si	lankadeepalk	1760355506.0
lk_news	2025-10-13-virakesarilk-f73ec560	virakesarilk-f73ec560	2025-10-13	இடமாற்றம் கோரி யாழ்ப்பாணத்தை சேர்ந்த அபிவிருத்தி உத்தியோகத்தர்கள் போராட்டம்	https://www.virakesari.lk/article/227630	ta	virakesarilk	1760355480.0
lk_news	2025-10-13-virakesarilk-b0b5bf04	virakesarilk-b0b5bf04	2025-10-13	மாகாணசபைத் தேர்தலை இலக்காகக் கொண்டு அழகிய வசனங்களாலான வரவு - செலவு திட்டம் சமர்ப்பிக்கப்படும் - ஐக்கிய மக்கள் சக்தி சாடல்	https://www.virakesari.lk/article/227634	ta	virakesarilk	1760355480.0
lk_news	2025-10-13-virakesarilk-640c7325	virakesarilk-640c7325	2025-10-13	மலையக பெருந்தோட்டத் தொழிலாளர்களுக்கு 10 பேர்ச்சஸ் காணியை வழங்குவதற்கு தேசிய மக்கள் சக்தி அரசாங்கம் நடவடிக்கை எடுக்க வேண்டும் - பழனி திகாம்பரம்	https://www.virakesari.lk/article/227633	ta	virakesarilk	1760355420.0
lk_news	2025-10-13-tamilmirrorlk-ccf8ad8b	tamilmirrorlk-ccf8ad8b	2025-10-13	அனுரவுக்கு  காது குத்திவிட்டனர்: மனோ கிண்டல்	https://www.tamilmirror.lk/செய்திகள்/அனுரவுக்கு-காது-குத்திவிட்டனர்-மனோ-கிண்டல்/175-366207	ta	tamilmirrorlk	1760355414.0
lk_news	2025-10-13-virakesarilk-212134e7	virakesarilk-212134e7	2025-10-13	உடவத்தகெலே பகுதியில் வெள்ள நீர் கட்டுப்பாடு நடவடிக்கை அவசியம் - மத்திய மாகாண ஆளுநர்	https://www.virakesari.lk/article/227632	ta	virakesarilk	1760355300.0
lk_news	2025-10-13-virakesarilk-0bccc284	virakesarilk-0bccc284	2025-10-13	இலங்கை, பூட்டான், நேபாளத்துக்கு இந்திய ரூபாயில் கடன் வழங்க அனுமதி ! - இந்திய ரிசர்வ் வங்கி	https://www.virakesari.lk/article/227631	ta	virakesarilk	1760355300.0
