doc_type	doc_id	num	date_str	description	url_metadata	lang	newspaper_id	time_ut
lk_news	2025-12-10-tamilmirrorlk-8b8a75bf	tamilmirrorlk-8b8a75bf	2025-12-10	கப்பலுக்கு பொருட்களை ஏற்றியவர் கடலில் விழுந்து மரணம்	https://www.tamilmirror.lk/செய்திகள்/கப்பலுக்கு-பொருட்களை-ஏற்றியவர்-கடலில்-விழுந்து-மரணம்/175-369355	ta	tamilmirrorlk	1765343278.0
lk_news	2025-12-10-adalk-a255ccc5	adalk-a255ccc5	2025-12-10	ඊසානදිග මෝසම සක්‍රීය වීමත් සමග ආපදාවට පත් පුද්ගලයන් ගණන ඉහළට	https://www.ada.lk/breaking_news/ඊසානදිග-මෝසම-සක්‍රීය-වීමත්-සමග-ආපදාවට-පත්-පුද්ගලයන්-ගණන-ඉහළට/11-420155	si	adalk	1765342877.0
lk_news	2025-12-10-tamilmirrorlk-a3c405df	tamilmirrorlk-a3c405df	2025-12-10	லஞ்ச வழக்கில் முன்னாள் அதிகாரிக்கு தூக்கு தண்டனை	https://www.tamilmirror.lk/உலக-செய்திகள்/லஞ்ச-வழக்கில்-முன்னாள்-அதிகாரிக்கு-தூக்கு-தண்டனை/50-369354	ta	tamilmirrorlk	1765342830.0
lk_news	2025-12-10-virakesarilk-9c95d930	virakesarilk-9c95d930	2025-12-10	இலங்கை கடற்படையின் 75 வது ஆண்டு நிறைவை முன்னிட்டு தலதா மாளிகையில் மத நிகழ்வு!	https://www.virakesari.lk/article/232945	ta	virakesarilk	1765342680.0
lk_news	2025-12-10-virakesarilk-29bc79bd	virakesarilk-29bc79bd	2025-12-10	பாகிஸ்தானில் இராணுவத்தினர் மீது துப்பாக்கிச் சூடு - 6 வீரர்கள் பலி	https://www.virakesari.lk/article/232946	ta	virakesarilk	1765342560.0
lk_news	2025-12-10-tamilmirrorlk-342f58ce	tamilmirrorlk-342f58ce	2025-12-10	அனில் அம்பானி மகன் மீது   வழக்கு	https://www.tamilmirror.lk/செய்திகள்/அனில்-அம்பானி-மகன்-மீது-வழக்கு/175-369353	ta	tamilmirrorlk	1765342455.0
lk_news	2025-12-10-virakesarilk-fa377587	virakesarilk-fa377587	2025-12-10	காட்டு யானை மீது மோதி லொறி விபத்து ; இருவர் காயம்!	https://www.virakesari.lk/article/232942	ta	virakesarilk	1765342020.0
lk_news	2025-12-10-virakesarilk-b2a1445c	virakesarilk-b2a1445c	2025-12-10	காலியிலிருந்து மருதானை நோக்கிப் பயணித்த ரயிலுடன் மோதி கார் விபத்து!	https://www.virakesari.lk/article/232944	ta	virakesarilk	1765342020.0
lk_news	2025-12-10-tamilmirrorlk-9441623d	tamilmirrorlk-9441623d	2025-12-10	தெமோதர மலையில் மண்சரிவு அபாயம்	https://www.tamilmirror.lk/மலையகம்/தெமோதர-மலையில்-மண்சரிவு-அபாயம்/76-369352	ta	tamilmirrorlk	1765341912.0
lk_news	2025-12-10-lankadeepalk-05e446a5	lankadeepalk-05e446a5	2025-12-10	රිදීමාලියද්දේ කදුවැටි කීපයක නාය යාම් යළි සක්‍රිය වෙලා	https://www.lankadeepa.lk/news/රදමලයදද-කදවට-කපයක-නය-යම-යළ-සකරය-වල/101-684985	si	lankadeepalk	1765341792.0
lk_news	2025-12-10-tamilmirrorlk-a07496d3	tamilmirrorlk-a07496d3	2025-12-10	பண்டாரவன்னி கிராம  மக்கள் இடம்பெயர்ந்தனர்	https://www.tamilmirror.lk/செய்திகள்/பண்டாரவன்னி-கிராம-மக்கள்-இடம்பெயர்ந்தனர்/175-369351	ta	tamilmirrorlk	1765341739.0
lk_news	2025-12-10-tamilmirrorlk-7b7ce189	tamilmirrorlk-7b7ce189	2025-12-10	பதுளையில் மீண்டும் மண்சரிவு: யாருக்கும் பாதிப்பில்லை	https://www.tamilmirror.lk/மலையகம்/பதுளையில்-மீண்டும்-மண்சரிவு-யாருக்கும்-பாதிப்பில்லை/76-369350	ta	tamilmirrorlk	1765341512.0
lk_news	2025-12-10-tamilmirrorlk-d51333cf	tamilmirrorlk-d51333cf	2025-12-10	நீங்கள் எல்லாம் எங்கிருந்து வாரீங்க...	https://www.tamilmirror.lk/சிந்தனை-சித்திரம்/நீங்கள்-எல்லாம்-எங்கிருந்து-வாரீங்க/62-369349	ta	tamilmirrorlk	1765341290.0
lk_news	2025-12-10-tamilmirrorlk-90fe72c2	tamilmirrorlk-90fe72c2	2025-12-10	மன்னாரில்  உணவகத்துக்கு எதிராக சுகாதார துறை நடவடிக்கை	https://www.tamilmirror.lk/செய்திகள்/மன்னாரில்-உணவகத்துக்கு-எதிராக-சுகாதார-துறை-நடவடிக்கை/175-369347	ta	tamilmirrorlk	1765340969.0
lk_news	2025-12-10-virakesarilk-64768581	virakesarilk-64768581	2025-12-10	SLT குழுமம் 2025 ஆம் ஆண்டின் மூன்றாம் காலாண்டிலும், முதல் 9 மாத காலப்பகுதியிலும் உறுதியான நிதிப் பெறுபேறுகளைப் பதிவு	https://www.virakesari.lk/article/232941	ta	virakesarilk	1765340880.0
lk_news	2025-12-10-virakesarilk-fea0be4c	virakesarilk-fea0be4c	2025-12-10	மன்னார் வைத்தியசாலைக்கு மருத்துவப் பொருட்களை நன்கொடையாக வழங்கிய மறைமாவட்ட ஆயர்!	https://www.virakesari.lk/article/232940	ta	virakesarilk	1765340400.0
lk_news	2025-12-10-virakesarilk-74fe4728	virakesarilk-74fe4728	2025-12-10	தொலைத்தொடர்பு கோபுரத்தில் பொருத்தப்பட்ட கேபிள் திருட்டு –  ஒருவர் கைது!	https://www.virakesari.lk/article/232937	ta	virakesarilk	1765340400.0
lk_news	2025-12-10-tamilmirrorlk-f495bc87	tamilmirrorlk-f495bc87	2025-12-10	இன்று 100 மில்லி மீற்றர் மழை	https://www.tamilmirror.lk/செய்திகள்/இன்று-100-மில்லி-மீற்றர்-மழை/175-369345	ta	tamilmirrorlk	1765339682.0
lk_news	2025-12-10-lankadeepalk-5ae39e02	lankadeepalk-5ae39e02	2025-12-10	බෝගහපතන කන්ද නාය සක්‍රීය වෙයි	https://www.lankadeepa.lk/news/බගහපතන-කනද-නය-සකරය-වය/101-684984	si	lankadeepalk	1765339039.0
lk_news	2025-12-10-virakesarilk-805cc379	virakesarilk-805cc379	2025-12-10	'மறைந்த புரட்சித்தலைவர் எம்ஜிஆருக்கு அர்ப்பணிக்கப்பட்ட திரைப்படம் தான் 'வா வாத்தியார்' - இயக்குநர் நலன் குமாரசாமி	https://www.virakesari.lk/article/232939	ta	virakesarilk	1765338900.0
lk_news	2025-12-10-virakesarilk-47016d4f	virakesarilk-47016d4f	2025-12-10	நடிகர் குரு லக்ஷ்மன் நடிக்கும் 'ஹார்டிலே பற்றரி ' எனும் இணையத் தொடரின் முன்னோட்டம் வெளியீடு	https://www.virakesari.lk/article/232938	ta	virakesarilk	1765338720.0
lk_news	2025-12-10-virakesarilk-a28dfc5e	virakesarilk-a28dfc5e	2025-12-10	பிரதான மார்க்கங்களில் ரயில் சேவை தாமதம் – ரயில்வே திணைக்களம்	https://www.virakesari.lk/article/232936	ta	virakesarilk	1765337580.0
lk_news	2025-12-10-lankadeepalk-1de9c5ea	lankadeepalk-1de9c5ea	2025-12-10	අද කාලගුණය	https://www.lankadeepa.lk/news/අද-කලගණය/101-684983	si	lankadeepalk	1765335800.0
lk_news	2025-12-10-lankadeepalk-310f6798	lankadeepalk-310f6798	2025-12-10	දෙමෝදර කන්ද නාය අවදානමක	https://www.lankadeepa.lk/news/දමදර-කනද-නය-අවදනමක/101-684982	si	lankadeepalk	1765335576.0
lk_news	2025-12-10-lankadeepalk-0670211f	lankadeepalk-0670211f	2025-12-10	බදුල්ලේ තැන් හතක් ගැන විමසිල්ලෙන්	https://www.lankadeepa.lk/news/බදලල-තන-හතක-ගන-වමසලලන/101-684981	si	lankadeepalk	1765334304.0
lk_news	2025-12-10-lankadeepalk-8907b16e	lankadeepalk-8907b16e	2025-12-10	විපතට පත් ජනතාවට සෙත් පතා ගංගාරාමයේ පිංකම්	https://www.lankadeepa.lk/news/වපතට-පත-ජනතවට-සත-පත-ගගරමය-පකම/101-684980	si	lankadeepalk	1765333789.0
lk_news	2025-12-10-virakesarilk-a6c8a293	virakesarilk-a6c8a293	2025-12-10	யாழ்ப்பாணம், கிளிநொச்சி, முல்லைத்தீவு மாவட்ட மக்களுக்கு விடுக்கப்பட்டுள்ள எச்சரிக்கை !	https://www.virakesari.lk/article/232935	ta	virakesarilk	1765331640.0
lk_news	2025-12-10-bbccomsinhala-ef450049	bbccomsinhala-ef450049	2025-12-10	'බඩගින්න දරාගන්න බැරිව කුරුම්බා ගෙඩියක් බිව්වා': ගංවතුරට හසුවී පොල් ගසකට නැග දිවී බේරා ගත් ෂම්සුදීන්	https://www.bbc.com/sinhala/articles/cn5l1wd401qo	si	bbccomsinhala	1765331495.0
lk_news	2025-12-10-virakesarilk-3a015e4a	virakesarilk-3a015e4a	2025-12-10	இன்றைய வானிலை	https://www.virakesari.lk/article/232934	ta	virakesarilk	1765327260.0
lk_news	2025-12-10-bbccomsinhala-74673c19	bbccomsinhala-74673c19	2025-12-10	හදිසි ආපදාවන්ට මුහුණ දීමට සහ ඒවා කළමනාකරණය කර ගැනීමට ශ්‍රී ලංකාව තවදුරටත් ශක්තිමත් කරගත යුතු ක්ෂේත්‍ර මොනවා ද?	https://www.bbc.com/sinhala/articles/c8dy7q1mn34o	si	bbccomsinhala	1765326779.0
